PLT_ID,TRAIT,DATE,QUALITY,ENTRY_CODE,ENTRY_NAME,COMP,RATER,ROW,COL,PLOC_CODE,YEAR,MONTH,RATING_EVENT,RATING_EVENT_CODE,MONTH_CODE,YEAR_CODE,TEST_LOC
241,Turf Quality,4/18/18,4,37,NAI-14-132,Columbia River Seed,RMD,17,1,239,2018,Apr,RMD-2018-04-18,8,1,1,"Adelphia, NJ"
241,Turf Quality,5/10/18,4,37,NAI-14-132,Columbia River Seed,RON,17,1,239,2018,May,RON-2018-05-10,13,6,1,"Adelphia, NJ"
241,Turf Quality,6/7/18,5,37,NAI-14-132,Columbia River Seed,RON,17,1,239,2018,Jun,RON-2018-06-07,14,4,1,"Adelphia, NJ"
241,Turf Quality,7/17/18,5,37,NAI-14-132,Columbia River Seed,RON,17,1,239,2018,Jul,RON-2018-07-17,15,3,1,"Adelphia, NJ"
241,Turf Quality,8/15/18,6,37,NAI-14-132,Columbia River Seed,RMD,17,1,239,2018,Aug,RMD-2018-08-15,9,2,1,"Adelphia, NJ"
241,Turf Quality,9/12/18,5,37,NAI-14-132,Columbia River Seed,RON,17,1,239,2018,Sep,RON-2018-09-12,16,9,1,"Adelphia, NJ"
241,Turf Quality,10/2/18,4,37,NAI-14-132,Columbia River Seed,RON,17,1,239,2018,Oct,RON-2018-10-02,17,8,1,"Adelphia, NJ"
241,Turf Quality,11/9/18,4,37,NAI-14-132,Columbia River Seed,RON,17,1,239,2018,Nov,RON-2018-11-09,18,7,1,"Adelphia, NJ"
241,Turf Quality,4/17/19,3,37,NAI-14-132,Columbia River Seed,RON,17,1,239,2019,Apr,RON-2019-04-17,19,1,2,"Adelphia, NJ"
241,Turf Quality,5/2/19,4,37,NAI-14-132,Columbia River Seed,RON,17,1,239,2019,May,RON-2019-05-02,20,6,2,"Adelphia, NJ"
241,Turf Quality,6/13/19,4,37,NAI-14-132,Columbia River Seed,RON,17,1,239,2019,Jun,RON-2019-06-13,21,4,2,"Adelphia, NJ"
241,Turf Quality,6/17/19,4,37,NAI-14-132,Columbia River Seed,SAB,17,1,239,2019,Jun,SAB-2019-06-17,25,4,2,"Adelphia, NJ"
241,Turf Quality,7/17/19,5,37,NAI-14-132,Columbia River Seed,RON,17,1,239,2019,Jul,RON-2019-07-17,22,3,2,"Adelphia, NJ"
241,Turf Quality,8/22/19,3,37,NAI-14-132,Columbia River Seed,SAB,17,1,239,2019,Aug,SAB-2019-08-22,26,2,2,"Adelphia, NJ"
241,Turf Quality,9/16/19,4,37,NAI-14-132,Columbia River Seed,RON,17,1,239,2019,Sep,RON-2019-09-16,23,9,2,"Adelphia, NJ"
241,Turf Quality,10/10/19,4,37,NAI-14-132,Columbia River Seed,SAB,17,1,239,2019,Oct,SAB-2019-10-10,27,8,2,"Adelphia, NJ"
241,Turf Quality,11/1/19,3,37,NAI-14-132,Columbia River Seed,RON,17,1,239,2019,Nov,RON-2019-11-01,24,7,2,"Adelphia, NJ"
241,Turf Quality,4/28/20,4,37,NAI-14-132,Columbia River Seed,WAM,17,1,239,2020,Apr,WAM-2020-04-28,31,1,3,"Adelphia, NJ"
241,Turf Quality,5/18/20,4,37,NAI-14-132,Columbia River Seed,SAB,17,1,239,2020,May,SAB-2020-05-18,28,6,3,"Adelphia, NJ"
241,Turf Quality,6/17/20,4,37,NAI-14-132,Columbia River Seed,WAM,17,1,239,2020,Jun,WAM-2020-06-17,32,4,3,"Adelphia, NJ"
241,Turf Quality,7/15/20,5,37,NAI-14-132,Columbia River Seed,WAM,17,1,239,2020,Jul,WAM-2020-07-15,33,3,3,"Adelphia, NJ"
241,Turf Quality,8/6/20,7,37,NAI-14-132,Columbia River Seed,PLV,17,1,239,2020,Aug,PLV-2020-08-06,5,2,3,"Adelphia, NJ"
241,Turf Quality,9/2/20,3,37,NAI-14-132,Columbia River Seed,DAS,17,1,239,2020,Sep,DAS-2020-09-02,1,9,3,"Adelphia, NJ"
241,Turf Quality,10/15/20,2,37,NAI-14-132,Columbia River Seed,WAM,17,1,239,2020,Oct,WAM-2020-10-15,34,8,3,"Adelphia, NJ"
241,Turf Quality,11/5/20,2,37,NAI-14-132,Columbia River Seed,WAM,17,1,239,2020,Nov,WAM-2020-11-05,35,7,3,"Adelphia, NJ"
241,Turf Quality,10/15/20,2,37,NAI-14-132,Columbia River Seed,RMD,17,1,239,2020,Oct,RMD-2020-10-15,10,8,3,"Adelphia, NJ"
241,Turf Quality,10/23/20,3,37,NAI-14-132,Columbia River Seed,RMD,17,1,239,2020,Oct,RMD-2020-10-23,11,8,3,"Adelphia, NJ"
241,Turf Quality,3/30/21,2,37,NAI-14-132,Columbia River Seed,RMD,17,1,239,2021,Mar,RMD-2021-03-30,12,5,4,"Adelphia, NJ"
241,Turf Quality,4/22/21,2,37,NAI-14-132,Columbia River Seed,PLV,17,1,239,2021,Apr,PLV-2021-04-22,6,1,4,"Adelphia, NJ"
241,Turf Quality,5/28/21,2,37,NAI-14-132,Columbia River Seed,SAB,17,1,239,2021,May,SAB-2021-05-28,29,6,4,"Adelphia, NJ"
241,Turf Quality,6/11/21,4,37,NAI-14-132,Columbia River Seed,JEN,17,1,239,2021,Jun,JEN-2021-06-11,2,4,4,"Adelphia, NJ"
241,Turf Quality,7/13/21,4,37,NAI-14-132,Columbia River Seed,PLV,17,1,239,2021,Jul,PLV-2021-07-13,7,3,4,"Adelphia, NJ"
241,Turf Quality,8/11/21,4,37,NAI-14-132,Columbia River Seed,JEN,17,1,239,2021,Aug,JEN-2021-08-11,3,2,4,"Adelphia, NJ"
241,Turf Quality,9/17/21,3,37,NAI-14-132,Columbia River Seed,JEN,17,1,239,2021,Sep,JEN-2021-09-17,4,9,4,"Adelphia, NJ"
241,Turf Quality,10/13/21,1,37,NAI-14-132,Columbia River Seed,SAB,17,1,239,2021,Oct,SAB-2021-10-13,30,8,4,"Adelphia, NJ"
241,Turf Quality,11/18/21,4,37,NAI-14-132,Columbia River Seed,WAM,17,1,239,2021,Nov,WAM-2021-11-18,36,7,4,"Adelphia, NJ"
240,Turf Quality,4/18/18,5,25,BAR PP 7236V,Barenbrug Research,RMD,16,1,238,2018,Apr,RMD-2018-04-18,8,1,1,"Adelphia, NJ"
240,Turf Quality,5/10/18,7,25,BAR PP 7236V,Barenbrug Research,RON,16,1,238,2018,May,RON-2018-05-10,13,6,1,"Adelphia, NJ"
240,Turf Quality,6/7/18,5,25,BAR PP 7236V,Barenbrug Research,RON,16,1,238,2018,Jun,RON-2018-06-07,14,4,1,"Adelphia, NJ"
240,Turf Quality,7/17/18,5,25,BAR PP 7236V,Barenbrug Research,RON,16,1,238,2018,Jul,RON-2018-07-17,15,3,1,"Adelphia, NJ"
240,Turf Quality,8/15/18,7,25,BAR PP 7236V,Barenbrug Research,RMD,16,1,238,2018,Aug,RMD-2018-08-15,9,2,1,"Adelphia, NJ"
240,Turf Quality,9/12/18,6,25,BAR PP 7236V,Barenbrug Research,RON,16,1,238,2018,Sep,RON-2018-09-12,16,9,1,"Adelphia, NJ"
240,Turf Quality,10/2/18,6,25,BAR PP 7236V,Barenbrug Research,RON,16,1,238,2018,Oct,RON-2018-10-02,17,8,1,"Adelphia, NJ"
240,Turf Quality,11/9/18,8,25,BAR PP 7236V,Barenbrug Research,RON,16,1,238,2018,Nov,RON-2018-11-09,18,7,1,"Adelphia, NJ"
240,Turf Quality,4/17/19,8,25,BAR PP 7236V,Barenbrug Research,RON,16,1,238,2019,Apr,RON-2019-04-17,19,1,2,"Adelphia, NJ"
240,Turf Quality,5/2/19,6,25,BAR PP 7236V,Barenbrug Research,RON,16,1,238,2019,May,RON-2019-05-02,20,6,2,"Adelphia, NJ"
240,Turf Quality,6/13/19,5,25,BAR PP 7236V,Barenbrug Research,RON,16,1,238,2019,Jun,RON-2019-06-13,21,4,2,"Adelphia, NJ"
240,Turf Quality,6/17/19,4,25,BAR PP 7236V,Barenbrug Research,SAB,16,1,238,2019,Jun,SAB-2019-06-17,25,4,2,"Adelphia, NJ"
240,Turf Quality,7/17/19,5,25,BAR PP 7236V,Barenbrug Research,RON,16,1,238,2019,Jul,RON-2019-07-17,22,3,2,"Adelphia, NJ"
240,Turf Quality,8/22/19,6,25,BAR PP 7236V,Barenbrug Research,SAB,16,1,238,2019,Aug,SAB-2019-08-22,26,2,2,"Adelphia, NJ"
240,Turf Quality,9/16/19,7,25,BAR PP 7236V,Barenbrug Research,RON,16,1,238,2019,Sep,RON-2019-09-16,23,9,2,"Adelphia, NJ"
240,Turf Quality,10/10/19,6,25,BAR PP 7236V,Barenbrug Research,SAB,16,1,238,2019,Oct,SAB-2019-10-10,27,8,2,"Adelphia, NJ"
240,Turf Quality,11/1/19,6,25,BAR PP 7236V,Barenbrug Research,RON,16,1,238,2019,Nov,RON-2019-11-01,24,7,2,"Adelphia, NJ"
240,Turf Quality,4/28/20,6,25,BAR PP 7236V,Barenbrug Research,WAM,16,1,238,2020,Apr,WAM-2020-04-28,31,1,3,"Adelphia, NJ"
240,Turf Quality,5/18/20,7,25,BAR PP 7236V,Barenbrug Research,SAB,16,1,238,2020,May,SAB-2020-05-18,28,6,3,"Adelphia, NJ"
240,Turf Quality,6/17/20,4,25,BAR PP 7236V,Barenbrug Research,WAM,16,1,238,2020,Jun,WAM-2020-06-17,32,4,3,"Adelphia, NJ"
240,Turf Quality,7/15/20,4,25,BAR PP 7236V,Barenbrug Research,WAM,16,1,238,2020,Jul,WAM-2020-07-15,33,3,3,"Adelphia, NJ"
240,Turf Quality,8/6/20,7,25,BAR PP 7236V,Barenbrug Research,PLV,16,1,238,2020,Aug,PLV-2020-08-06,5,2,3,"Adelphia, NJ"
240,Turf Quality,9/2/20,6,25,BAR PP 7236V,Barenbrug Research,DAS,16,1,238,2020,Sep,DAS-2020-09-02,1,9,3,"Adelphia, NJ"
240,Turf Quality,10/15/20,5,25,BAR PP 7236V,Barenbrug Research,WAM,16,1,238,2020,Oct,WAM-2020-10-15,34,8,3,"Adelphia, NJ"
240,Turf Quality,11/5/20,6,25,BAR PP 7236V,Barenbrug Research,WAM,16,1,238,2020,Nov,WAM-2020-11-05,35,7,3,"Adelphia, NJ"
240,Turf Quality,10/15/20,4,25,BAR PP 7236V,Barenbrug Research,RMD,16,1,238,2020,Oct,RMD-2020-10-15,10,8,3,"Adelphia, NJ"
240,Turf Quality,10/23/20,4,25,BAR PP 7236V,Barenbrug Research,RMD,16,1,238,2020,Oct,RMD-2020-10-23,11,8,3,"Adelphia, NJ"
240,Turf Quality,3/30/21,5,25,BAR PP 7236V,Barenbrug Research,RMD,16,1,238,2021,Mar,RMD-2021-03-30,12,5,4,"Adelphia, NJ"
240,Turf Quality,4/22/21,7,25,BAR PP 7236V,Barenbrug Research,PLV,16,1,238,2021,Apr,PLV-2021-04-22,6,1,4,"Adelphia, NJ"
240,Turf Quality,5/28/21,5,25,BAR PP 7236V,Barenbrug Research,SAB,16,1,238,2021,May,SAB-2021-05-28,29,6,4,"Adelphia, NJ"
240,Turf Quality,6/11/21,5,25,BAR PP 7236V,Barenbrug Research,JEN,16,1,238,2021,Jun,JEN-2021-06-11,2,4,4,"Adelphia, NJ"
240,Turf Quality,7/13/21,5,25,BAR PP 7236V,Barenbrug Research,PLV,16,1,238,2021,Jul,PLV-2021-07-13,7,3,4,"Adelphia, NJ"
240,Turf Quality,8/11/21,6,25,BAR PP 7236V,Barenbrug Research,JEN,16,1,238,2021,Aug,JEN-2021-08-11,3,2,4,"Adelphia, NJ"
240,Turf Quality,9/17/21,6,25,BAR PP 7236V,Barenbrug Research,JEN,16,1,238,2021,Sep,JEN-2021-09-17,4,9,4,"Adelphia, NJ"
240,Turf Quality,10/13/21,4,25,BAR PP 7236V,Barenbrug Research,SAB,16,1,238,2021,Oct,SAB-2021-10-13,30,8,4,"Adelphia, NJ"
240,Turf Quality,11/18/21,6,25,BAR PP 7236V,Barenbrug Research,WAM,16,1,238,2021,Nov,WAM-2021-11-18,36,7,4,"Adelphia, NJ"
211,Turf Quality,4/18/18,6,59,DLFPS-340/3455,DLF Pickseed USA,RMD,15,1,209,2018,Apr,RMD-2018-04-18,8,1,1,"Adelphia, NJ"
211,Turf Quality,5/10/18,7,59,DLFPS-340/3455,DLF Pickseed USA,RON,15,1,209,2018,May,RON-2018-05-10,13,6,1,"Adelphia, NJ"
211,Turf Quality,6/7/18,4,59,DLFPS-340/3455,DLF Pickseed USA,RON,15,1,209,2018,Jun,RON-2018-06-07,14,4,1,"Adelphia, NJ"
211,Turf Quality,7/17/18,5,59,DLFPS-340/3455,DLF Pickseed USA,RON,15,1,209,2018,Jul,RON-2018-07-17,15,3,1,"Adelphia, NJ"
211,Turf Quality,8/15/18,5,59,DLFPS-340/3455,DLF Pickseed USA,RMD,15,1,209,2018,Aug,RMD-2018-08-15,9,2,1,"Adelphia, NJ"
211,Turf Quality,9/12/18,4,59,DLFPS-340/3455,DLF Pickseed USA,RON,15,1,209,2018,Sep,RON-2018-09-12,16,9,1,"Adelphia, NJ"
211,Turf Quality,10/2/18,4,59,DLFPS-340/3455,DLF Pickseed USA,RON,15,1,209,2018,Oct,RON-2018-10-02,17,8,1,"Adelphia, NJ"
211,Turf Quality,11/9/18,4,59,DLFPS-340/3455,DLF Pickseed USA,RON,15,1,209,2018,Nov,RON-2018-11-09,18,7,1,"Adelphia, NJ"
211,Turf Quality,4/17/19,4,59,DLFPS-340/3455,DLF Pickseed USA,RON,15,1,209,2019,Apr,RON-2019-04-17,19,1,2,"Adelphia, NJ"
211,Turf Quality,5/2/19,4,59,DLFPS-340/3455,DLF Pickseed USA,RON,15,1,209,2019,May,RON-2019-05-02,20,6,2,"Adelphia, NJ"
211,Turf Quality,6/13/19,4,59,DLFPS-340/3455,DLF Pickseed USA,RON,15,1,209,2019,Jun,RON-2019-06-13,21,4,2,"Adelphia, NJ"
211,Turf Quality,6/17/19,5,59,DLFPS-340/3455,DLF Pickseed USA,SAB,15,1,209,2019,Jun,SAB-2019-06-17,25,4,2,"Adelphia, NJ"
211,Turf Quality,7/17/19,5,59,DLFPS-340/3455,DLF Pickseed USA,RON,15,1,209,2019,Jul,RON-2019-07-17,22,3,2,"Adelphia, NJ"
211,Turf Quality,8/22/19,3,59,DLFPS-340/3455,DLF Pickseed USA,SAB,15,1,209,2019,Aug,SAB-2019-08-22,26,2,2,"Adelphia, NJ"
211,Turf Quality,9/16/19,2,59,DLFPS-340/3455,DLF Pickseed USA,RON,15,1,209,2019,Sep,RON-2019-09-16,23,9,2,"Adelphia, NJ"
211,Turf Quality,10/10/19,2,59,DLFPS-340/3455,DLF Pickseed USA,SAB,15,1,209,2019,Oct,SAB-2019-10-10,27,8,2,"Adelphia, NJ"
211,Turf Quality,11/1/19,3,59,DLFPS-340/3455,DLF Pickseed USA,RON,15,1,209,2019,Nov,RON-2019-11-01,24,7,2,"Adelphia, NJ"
211,Turf Quality,4/28/20,4,59,DLFPS-340/3455,DLF Pickseed USA,WAM,15,1,209,2020,Apr,WAM-2020-04-28,31,1,3,"Adelphia, NJ"
211,Turf Quality,5/18/20,6,59,DLFPS-340/3455,DLF Pickseed USA,SAB,15,1,209,2020,May,SAB-2020-05-18,28,6,3,"Adelphia, NJ"
211,Turf Quality,6/17/20,3,59,DLFPS-340/3455,DLF Pickseed USA,WAM,15,1,209,2020,Jun,WAM-2020-06-17,32,4,3,"Adelphia, NJ"
211,Turf Quality,7/15/20,4,59,DLFPS-340/3455,DLF Pickseed USA,WAM,15,1,209,2020,Jul,WAM-2020-07-15,33,3,3,"Adelphia, NJ"
211,Turf Quality,8/6/20,6,59,DLFPS-340/3455,DLF Pickseed USA,PLV,15,1,209,2020,Aug,PLV-2020-08-06,5,2,3,"Adelphia, NJ"
211,Turf Quality,9/2/20,2,59,DLFPS-340/3455,DLF Pickseed USA,DAS,15,1,209,2020,Sep,DAS-2020-09-02,1,9,3,"Adelphia, NJ"
211,Turf Quality,10/15/20,1,59,DLFPS-340/3455,DLF Pickseed USA,WAM,15,1,209,2020,Oct,WAM-2020-10-15,34,8,3,"Adelphia, NJ"
211,Turf Quality,11/5/20,2,59,DLFPS-340/3455,DLF Pickseed USA,WAM,15,1,209,2020,Nov,WAM-2020-11-05,35,7,3,"Adelphia, NJ"
211,Turf Quality,10/15/20,1,59,DLFPS-340/3455,DLF Pickseed USA,RMD,15,1,209,2020,Oct,RMD-2020-10-15,10,8,3,"Adelphia, NJ"
211,Turf Quality,10/23/20,1,59,DLFPS-340/3455,DLF Pickseed USA,RMD,15,1,209,2020,Oct,RMD-2020-10-23,11,8,3,"Adelphia, NJ"
211,Turf Quality,3/30/21,2,59,DLFPS-340/3455,DLF Pickseed USA,RMD,15,1,209,2021,Mar,RMD-2021-03-30,12,5,4,"Adelphia, NJ"
211,Turf Quality,4/22/21,2,59,DLFPS-340/3455,DLF Pickseed USA,PLV,15,1,209,2021,Apr,PLV-2021-04-22,6,1,4,"Adelphia, NJ"
211,Turf Quality,5/28/21,3,59,DLFPS-340/3455,DLF Pickseed USA,SAB,15,1,209,2021,May,SAB-2021-05-28,29,6,4,"Adelphia, NJ"
211,Turf Quality,6/11/21,4,59,DLFPS-340/3455,DLF Pickseed USA,JEN,15,1,209,2021,Jun,JEN-2021-06-11,2,4,4,"Adelphia, NJ"
211,Turf Quality,7/13/21,5,59,DLFPS-340/3455,DLF Pickseed USA,PLV,15,1,209,2021,Jul,PLV-2021-07-13,7,3,4,"Adelphia, NJ"
211,Turf Quality,8/11/21,5,59,DLFPS-340/3455,DLF Pickseed USA,JEN,15,1,209,2021,Aug,JEN-2021-08-11,3,2,4,"Adelphia, NJ"
211,Turf Quality,9/17/21,3,59,DLFPS-340/3455,DLF Pickseed USA,JEN,15,1,209,2021,Sep,JEN-2021-09-17,4,9,4,"Adelphia, NJ"
211,Turf Quality,10/13/21,2,59,DLFPS-340/3455,DLF Pickseed USA,SAB,15,1,209,2021,Oct,SAB-2021-10-13,30,8,4,"Adelphia, NJ"
211,Turf Quality,11/18/21,4,59,DLFPS-340/3455,DLF Pickseed USA,WAM,15,1,209,2021,Nov,WAM-2021-11-18,36,7,4,"Adelphia, NJ"
210,Turf Quality,4/18/18,3,75,A15-6,Peak Plant Genetics,RMD,14,1,208,2018,Apr,RMD-2018-04-18,8,1,1,"Adelphia, NJ"
210,Turf Quality,5/10/18,4,75,A15-6,Peak Plant Genetics,RON,14,1,208,2018,May,RON-2018-05-10,13,6,1,"Adelphia, NJ"
210,Turf Quality,6/7/18,4,75,A15-6,Peak Plant Genetics,RON,14,1,208,2018,Jun,RON-2018-06-07,14,4,1,"Adelphia, NJ"
210,Turf Quality,7/17/18,5,75,A15-6,Peak Plant Genetics,RON,14,1,208,2018,Jul,RON-2018-07-17,15,3,1,"Adelphia, NJ"
210,Turf Quality,8/15/18,3,75,A15-6,Peak Plant Genetics,RMD,14,1,208,2018,Aug,RMD-2018-08-15,9,2,1,"Adelphia, NJ"
210,Turf Quality,9/12/18,4,75,A15-6,Peak Plant Genetics,RON,14,1,208,2018,Sep,RON-2018-09-12,16,9,1,"Adelphia, NJ"
210,Turf Quality,10/2/18,4,75,A15-6,Peak Plant Genetics,RON,14,1,208,2018,Oct,RON-2018-10-02,17,8,1,"Adelphia, NJ"
210,Turf Quality,11/9/18,5,75,A15-6,Peak Plant Genetics,RON,14,1,208,2018,Nov,RON-2018-11-09,18,7,1,"Adelphia, NJ"
210,Turf Quality,4/17/19,4,75,A15-6,Peak Plant Genetics,RON,14,1,208,2019,Apr,RON-2019-04-17,19,1,2,"Adelphia, NJ"
210,Turf Quality,5/2/19,4,75,A15-6,Peak Plant Genetics,RON,14,1,208,2019,May,RON-2019-05-02,20,6,2,"Adelphia, NJ"
210,Turf Quality,6/13/19,5,75,A15-6,Peak Plant Genetics,RON,14,1,208,2019,Jun,RON-2019-06-13,21,4,2,"Adelphia, NJ"
210,Turf Quality,6/17/19,4,75,A15-6,Peak Plant Genetics,SAB,14,1,208,2019,Jun,SAB-2019-06-17,25,4,2,"Adelphia, NJ"
210,Turf Quality,7/17/19,4,75,A15-6,Peak Plant Genetics,RON,14,1,208,2019,Jul,RON-2019-07-17,22,3,2,"Adelphia, NJ"
210,Turf Quality,8/22/19,5,75,A15-6,Peak Plant Genetics,SAB,14,1,208,2019,Aug,SAB-2019-08-22,26,2,2,"Adelphia, NJ"
210,Turf Quality,9/16/19,6,75,A15-6,Peak Plant Genetics,RON,14,1,208,2019,Sep,RON-2019-09-16,23,9,2,"Adelphia, NJ"
210,Turf Quality,10/10/19,6,75,A15-6,Peak Plant Genetics,SAB,14,1,208,2019,Oct,SAB-2019-10-10,27,8,2,"Adelphia, NJ"
210,Turf Quality,11/1/19,6,75,A15-6,Peak Plant Genetics,RON,14,1,208,2019,Nov,RON-2019-11-01,24,7,2,"Adelphia, NJ"
210,Turf Quality,4/28/20,5,75,A15-6,Peak Plant Genetics,WAM,14,1,208,2020,Apr,WAM-2020-04-28,31,1,3,"Adelphia, NJ"
210,Turf Quality,5/18/20,6,75,A15-6,Peak Plant Genetics,SAB,14,1,208,2020,May,SAB-2020-05-18,28,6,3,"Adelphia, NJ"
210,Turf Quality,6/17/20,5,75,A15-6,Peak Plant Genetics,WAM,14,1,208,2020,Jun,WAM-2020-06-17,32,4,3,"Adelphia, NJ"
210,Turf Quality,7/15/20,5,75,A15-6,Peak Plant Genetics,WAM,14,1,208,2020,Jul,WAM-2020-07-15,33,3,3,"Adelphia, NJ"
210,Turf Quality,8/6/20,8,75,A15-6,Peak Plant Genetics,PLV,14,1,208,2020,Aug,PLV-2020-08-06,5,2,3,"Adelphia, NJ"
210,Turf Quality,9/2/20,5,75,A15-6,Peak Plant Genetics,DAS,14,1,208,2020,Sep,DAS-2020-09-02,1,9,3,"Adelphia, NJ"
210,Turf Quality,10/15/20,3,75,A15-6,Peak Plant Genetics,WAM,14,1,208,2020,Oct,WAM-2020-10-15,34,8,3,"Adelphia, NJ"
210,Turf Quality,11/5/20,4,75,A15-6,Peak Plant Genetics,WAM,14,1,208,2020,Nov,WAM-2020-11-05,35,7,3,"Adelphia, NJ"
210,Turf Quality,10/15/20,4,75,A15-6,Peak Plant Genetics,RMD,14,1,208,2020,Oct,RMD-2020-10-15,10,8,3,"Adelphia, NJ"
210,Turf Quality,10/23/20,4,75,A15-6,Peak Plant Genetics,RMD,14,1,208,2020,Oct,RMD-2020-10-23,11,8,3,"Adelphia, NJ"
210,Turf Quality,3/30/21,4,75,A15-6,Peak Plant Genetics,RMD,14,1,208,2021,Mar,RMD-2021-03-30,12,5,4,"Adelphia, NJ"
210,Turf Quality,4/22/21,7,75,A15-6,Peak Plant Genetics,PLV,14,1,208,2021,Apr,PLV-2021-04-22,6,1,4,"Adelphia, NJ"
210,Turf Quality,5/28/21,4,75,A15-6,Peak Plant Genetics,SAB,14,1,208,2021,May,SAB-2021-05-28,29,6,4,"Adelphia, NJ"
210,Turf Quality,6/11/21,5,75,A15-6,Peak Plant Genetics,JEN,14,1,208,2021,Jun,JEN-2021-06-11,2,4,4,"Adelphia, NJ"
210,Turf Quality,7/13/21,7,75,A15-6,Peak Plant Genetics,PLV,14,1,208,2021,Jul,PLV-2021-07-13,7,3,4,"Adelphia, NJ"
210,Turf Quality,8/11/21,5,75,A15-6,Peak Plant Genetics,JEN,14,1,208,2021,Aug,JEN-2021-08-11,3,2,4,"Adelphia, NJ"
210,Turf Quality,9/17/21,5,75,A15-6,Peak Plant Genetics,JEN,14,1,208,2021,Sep,JEN-2021-09-17,4,9,4,"Adelphia, NJ"
210,Turf Quality,10/13/21,5,75,A15-6,Peak Plant Genetics,SAB,14,1,208,2021,Oct,SAB-2021-10-13,30,8,4,"Adelphia, NJ"
210,Turf Quality,11/18/21,5,75,A15-6,Peak Plant Genetics,WAM,14,1,208,2021,Nov,WAM-2021-11-18,36,7,4,"Adelphia, NJ"
181,Turf Quality,4/18/18,3,31,NAI-15-80,SiteOne Landscape Supply,RMD,13,1,179,2018,Apr,RMD-2018-04-18,8,1,1,"Adelphia, NJ"
181,Turf Quality,5/10/18,6,31,NAI-15-80,SiteOne Landscape Supply,RON,13,1,179,2018,May,RON-2018-05-10,13,6,1,"Adelphia, NJ"
181,Turf Quality,6/7/18,5,31,NAI-15-80,SiteOne Landscape Supply,RON,13,1,179,2018,Jun,RON-2018-06-07,14,4,1,"Adelphia, NJ"
181,Turf Quality,7/17/18,6,31,NAI-15-80,SiteOne Landscape Supply,RON,13,1,179,2018,Jul,RON-2018-07-17,15,3,1,"Adelphia, NJ"
181,Turf Quality,8/15/18,6,31,NAI-15-80,SiteOne Landscape Supply,RMD,13,1,179,2018,Aug,RMD-2018-08-15,9,2,1,"Adelphia, NJ"
181,Turf Quality,9/12/18,4,31,NAI-15-80,SiteOne Landscape Supply,RON,13,1,179,2018,Sep,RON-2018-09-12,16,9,1,"Adelphia, NJ"
181,Turf Quality,10/2/18,5,31,NAI-15-80,SiteOne Landscape Supply,RON,13,1,179,2018,Oct,RON-2018-10-02,17,8,1,"Adelphia, NJ"
181,Turf Quality,11/9/18,3,31,NAI-15-80,SiteOne Landscape Supply,RON,13,1,179,2018,Nov,RON-2018-11-09,18,7,1,"Adelphia, NJ"
181,Turf Quality,4/17/19,3,31,NAI-15-80,SiteOne Landscape Supply,RON,13,1,179,2019,Apr,RON-2019-04-17,19,1,2,"Adelphia, NJ"
181,Turf Quality,5/2/19,2,31,NAI-15-80,SiteOne Landscape Supply,RON,13,1,179,2019,May,RON-2019-05-02,20,6,2,"Adelphia, NJ"
181,Turf Quality,6/13/19,5,31,NAI-15-80,SiteOne Landscape Supply,RON,13,1,179,2019,Jun,RON-2019-06-13,21,4,2,"Adelphia, NJ"
181,Turf Quality,6/17/19,6,31,NAI-15-80,SiteOne Landscape Supply,SAB,13,1,179,2019,Jun,SAB-2019-06-17,25,4,2,"Adelphia, NJ"
181,Turf Quality,7/17/19,5,31,NAI-15-80,SiteOne Landscape Supply,RON,13,1,179,2019,Jul,RON-2019-07-17,22,3,2,"Adelphia, NJ"
181,Turf Quality,8/22/19,4,31,NAI-15-80,SiteOne Landscape Supply,SAB,13,1,179,2019,Aug,SAB-2019-08-22,26,2,2,"Adelphia, NJ"
181,Turf Quality,9/16/19,6,31,NAI-15-80,SiteOne Landscape Supply,RON,13,1,179,2019,Sep,RON-2019-09-16,23,9,2,"Adelphia, NJ"
181,Turf Quality,10/10/19,3,31,NAI-15-80,SiteOne Landscape Supply,SAB,13,1,179,2019,Oct,SAB-2019-10-10,27,8,2,"Adelphia, NJ"
181,Turf Quality,11/1/19,5,31,NAI-15-80,SiteOne Landscape Supply,RON,13,1,179,2019,Nov,RON-2019-11-01,24,7,2,"Adelphia, NJ"
181,Turf Quality,4/28/20,5,31,NAI-15-80,SiteOne Landscape Supply,WAM,13,1,179,2020,Apr,WAM-2020-04-28,31,1,3,"Adelphia, NJ"
181,Turf Quality,5/18/20,5,31,NAI-15-80,SiteOne Landscape Supply,SAB,13,1,179,2020,May,SAB-2020-05-18,28,6,3,"Adelphia, NJ"
181,Turf Quality,6/17/20,4,31,NAI-15-80,SiteOne Landscape Supply,WAM,13,1,179,2020,Jun,WAM-2020-06-17,32,4,3,"Adelphia, NJ"
181,Turf Quality,7/15/20,5,31,NAI-15-80,SiteOne Landscape Supply,WAM,13,1,179,2020,Jul,WAM-2020-07-15,33,3,3,"Adelphia, NJ"
181,Turf Quality,8/6/20,7,31,NAI-15-80,SiteOne Landscape Supply,PLV,13,1,179,2020,Aug,PLV-2020-08-06,5,2,3,"Adelphia, NJ"
181,Turf Quality,9/2/20,4,31,NAI-15-80,SiteOne Landscape Supply,DAS,13,1,179,2020,Sep,DAS-2020-09-02,1,9,3,"Adelphia, NJ"
181,Turf Quality,10/15/20,3,31,NAI-15-80,SiteOne Landscape Supply,WAM,13,1,179,2020,Oct,WAM-2020-10-15,34,8,3,"Adelphia, NJ"
181,Turf Quality,11/5/20,4,31,NAI-15-80,SiteOne Landscape Supply,WAM,13,1,179,2020,Nov,WAM-2020-11-05,35,7,3,"Adelphia, NJ"
181,Turf Quality,10/15/20,2,31,NAI-15-80,SiteOne Landscape Supply,RMD,13,1,179,2020,Oct,RMD-2020-10-15,10,8,3,"Adelphia, NJ"
181,Turf Quality,10/23/20,3,31,NAI-15-80,SiteOne Landscape Supply,RMD,13,1,179,2020,Oct,RMD-2020-10-23,11,8,3,"Adelphia, NJ"
181,Turf Quality,3/30/21,2,31,NAI-15-80,SiteOne Landscape Supply,RMD,13,1,179,2021,Mar,RMD-2021-03-30,12,5,4,"Adelphia, NJ"
181,Turf Quality,4/22/21,3,31,NAI-15-80,SiteOne Landscape Supply,PLV,13,1,179,2021,Apr,PLV-2021-04-22,6,1,4,"Adelphia, NJ"
181,Turf Quality,5/28/21,5,31,NAI-15-80,SiteOne Landscape Supply,SAB,13,1,179,2021,May,SAB-2021-05-28,29,6,4,"Adelphia, NJ"
181,Turf Quality,6/11/21,5,31,NAI-15-80,SiteOne Landscape Supply,JEN,13,1,179,2021,Jun,JEN-2021-06-11,2,4,4,"Adelphia, NJ"
181,Turf Quality,7/13/21,8,31,NAI-15-80,SiteOne Landscape Supply,PLV,13,1,179,2021,Jul,PLV-2021-07-13,7,3,4,"Adelphia, NJ"
181,Turf Quality,8/11/21,6,31,NAI-15-80,SiteOne Landscape Supply,JEN,13,1,179,2021,Aug,JEN-2021-08-11,3,2,4,"Adelphia, NJ"
181,Turf Quality,9/17/21,7,31,NAI-15-80,SiteOne Landscape Supply,JEN,13,1,179,2021,Sep,JEN-2021-09-17,4,9,4,"Adelphia, NJ"
181,Turf Quality,10/13/21,6,31,NAI-15-80,SiteOne Landscape Supply,SAB,13,1,179,2021,Oct,SAB-2021-10-13,30,8,4,"Adelphia, NJ"
181,Turf Quality,11/18/21,5,31,NAI-15-80,SiteOne Landscape Supply,WAM,13,1,179,2021,Nov,WAM-2021-11-18,36,7,4,"Adelphia, NJ"
151,Turf Quality,4/18/18,4,22,BAR PP 79366,Barenbrug Research,RMD,11,1,150,2018,Apr,RMD-2018-04-18,8,1,1,"Adelphia, NJ"
151,Turf Quality,5/10/18,6,22,BAR PP 79366,Barenbrug Research,RON,11,1,150,2018,May,RON-2018-05-10,13,6,1,"Adelphia, NJ"
151,Turf Quality,6/7/18,8,22,BAR PP 79366,Barenbrug Research,RON,11,1,150,2018,Jun,RON-2018-06-07,14,4,1,"Adelphia, NJ"
151,Turf Quality,7/17/18,6,22,BAR PP 79366,Barenbrug Research,RON,11,1,150,2018,Jul,RON-2018-07-17,15,3,1,"Adelphia, NJ"
151,Turf Quality,8/15/18,6,22,BAR PP 79366,Barenbrug Research,RMD,11,1,150,2018,Aug,RMD-2018-08-15,9,2,1,"Adelphia, NJ"
151,Turf Quality,9/12/18,7,22,BAR PP 79366,Barenbrug Research,RON,11,1,150,2018,Sep,RON-2018-09-12,16,9,1,"Adelphia, NJ"
151,Turf Quality,10/2/18,8,22,BAR PP 79366,Barenbrug Research,RON,11,1,150,2018,Oct,RON-2018-10-02,17,8,1,"Adelphia, NJ"
151,Turf Quality,11/9/18,7,22,BAR PP 79366,Barenbrug Research,RON,11,1,150,2018,Nov,RON-2018-11-09,18,7,1,"Adelphia, NJ"
151,Turf Quality,4/17/19,4,22,BAR PP 79366,Barenbrug Research,RON,11,1,150,2019,Apr,RON-2019-04-17,19,1,2,"Adelphia, NJ"
151,Turf Quality,5/2/19,7,22,BAR PP 79366,Barenbrug Research,RON,11,1,150,2019,May,RON-2019-05-02,20,6,2,"Adelphia, NJ"
151,Turf Quality,6/13/19,8,22,BAR PP 79366,Barenbrug Research,RON,11,1,150,2019,Jun,RON-2019-06-13,21,4,2,"Adelphia, NJ"
151,Turf Quality,6/17/19,7,22,BAR PP 79366,Barenbrug Research,SAB,11,1,150,2019,Jun,SAB-2019-06-17,25,4,2,"Adelphia, NJ"
151,Turf Quality,7/17/19,5,22,BAR PP 79366,Barenbrug Research,RON,11,1,150,2019,Jul,RON-2019-07-17,22,3,2,"Adelphia, NJ"
151,Turf Quality,8/22/19,7,22,BAR PP 79366,Barenbrug Research,SAB,11,1,150,2019,Aug,SAB-2019-08-22,26,2,2,"Adelphia, NJ"
151,Turf Quality,9/16/19,8,22,BAR PP 79366,Barenbrug Research,RON,11,1,150,2019,Sep,RON-2019-09-16,23,9,2,"Adelphia, NJ"
151,Turf Quality,10/10/19,8,22,BAR PP 79366,Barenbrug Research,SAB,11,1,150,2019,Oct,SAB-2019-10-10,27,8,2,"Adelphia, NJ"
151,Turf Quality,11/1/19,8,22,BAR PP 79366,Barenbrug Research,RON,11,1,150,2019,Nov,RON-2019-11-01,24,7,2,"Adelphia, NJ"
151,Turf Quality,4/28/20,7,22,BAR PP 79366,Barenbrug Research,WAM,11,1,150,2020,Apr,WAM-2020-04-28,31,1,3,"Adelphia, NJ"
151,Turf Quality,5/18/20,8,22,BAR PP 79366,Barenbrug Research,SAB,11,1,150,2020,May,SAB-2020-05-18,28,6,3,"Adelphia, NJ"
151,Turf Quality,6/17/20,8,22,BAR PP 79366,Barenbrug Research,WAM,11,1,150,2020,Jun,WAM-2020-06-17,32,4,3,"Adelphia, NJ"
151,Turf Quality,7/15/20,5,22,BAR PP 79366,Barenbrug Research,WAM,11,1,150,2020,Jul,WAM-2020-07-15,33,3,3,"Adelphia, NJ"
151,Turf Quality,8/6/20,6,22,BAR PP 79366,Barenbrug Research,PLV,11,1,150,2020,Aug,PLV-2020-08-06,5,2,3,"Adelphia, NJ"
151,Turf Quality,9/2/20,5,22,BAR PP 79366,Barenbrug Research,DAS,11,1,150,2020,Sep,DAS-2020-09-02,1,9,3,"Adelphia, NJ"
151,Turf Quality,10/15/20,5,22,BAR PP 79366,Barenbrug Research,WAM,11,1,150,2020,Oct,WAM-2020-10-15,34,8,3,"Adelphia, NJ"
151,Turf Quality,11/5/20,5,22,BAR PP 79366,Barenbrug Research,WAM,11,1,150,2020,Nov,WAM-2020-11-05,35,7,3,"Adelphia, NJ"
151,Turf Quality,10/15/20,4,22,BAR PP 79366,Barenbrug Research,RMD,11,1,150,2020,Oct,RMD-2020-10-15,10,8,3,"Adelphia, NJ"
151,Turf Quality,10/23/20,4,22,BAR PP 79366,Barenbrug Research,RMD,11,1,150,2020,Oct,RMD-2020-10-23,11,8,3,"Adelphia, NJ"
151,Turf Quality,3/30/21,4,22,BAR PP 79366,Barenbrug Research,RMD,11,1,150,2021,Mar,RMD-2021-03-30,12,5,4,"Adelphia, NJ"
151,Turf Quality,4/22/21,8,22,BAR PP 79366,Barenbrug Research,PLV,11,1,150,2021,Apr,PLV-2021-04-22,6,1,4,"Adelphia, NJ"
151,Turf Quality,5/28/21,5,22,BAR PP 79366,Barenbrug Research,SAB,11,1,150,2021,May,SAB-2021-05-28,29,6,4,"Adelphia, NJ"
151,Turf Quality,6/11/21,8,22,BAR PP 79366,Barenbrug Research,JEN,11,1,150,2021,Jun,JEN-2021-06-11,2,4,4,"Adelphia, NJ"
151,Turf Quality,7/13/21,8,22,BAR PP 79366,Barenbrug Research,PLV,11,1,150,2021,Jul,PLV-2021-07-13,7,3,4,"Adelphia, NJ"
151,Turf Quality,8/11/21,8,22,BAR PP 79366,Barenbrug Research,JEN,11,1,150,2021,Aug,JEN-2021-08-11,3,2,4,"Adelphia, NJ"
151,Turf Quality,9/17/21,8,22,BAR PP 79366,Barenbrug Research,JEN,11,1,150,2021,Sep,JEN-2021-09-17,4,9,4,"Adelphia, NJ"
151,Turf Quality,10/13/21,7,22,BAR PP 79366,Barenbrug Research,SAB,11,1,150,2021,Oct,SAB-2021-10-13,30,8,4,"Adelphia, NJ"
151,Turf Quality,11/18/21,6,22,BAR PP 79366,Barenbrug Research,WAM,11,1,150,2021,Nov,WAM-2021-11-18,36,7,4,"Adelphia, NJ"
150,Turf Quality,4/18/18,3,69,A11-38,Peak Plant Genetics,RMD,10,1,149,2018,Apr,RMD-2018-04-18,8,1,1,"Adelphia, NJ"
150,Turf Quality,5/10/18,4,69,A11-38,Peak Plant Genetics,RON,10,1,149,2018,May,RON-2018-05-10,13,6,1,"Adelphia, NJ"
150,Turf Quality,6/7/18,4,69,A11-38,Peak Plant Genetics,RON,10,1,149,2018,Jun,RON-2018-06-07,14,4,1,"Adelphia, NJ"
150,Turf Quality,7/17/18,6,69,A11-38,Peak Plant Genetics,RON,10,1,149,2018,Jul,RON-2018-07-17,15,3,1,"Adelphia, NJ"
150,Turf Quality,8/15/18,6,69,A11-38,Peak Plant Genetics,RMD,10,1,149,2018,Aug,RMD-2018-08-15,9,2,1,"Adelphia, NJ"
150,Turf Quality,9/12/18,4,69,A11-38,Peak Plant Genetics,RON,10,1,149,2018,Sep,RON-2018-09-12,16,9,1,"Adelphia, NJ"
150,Turf Quality,10/2/18,3,69,A11-38,Peak Plant Genetics,RON,10,1,149,2018,Oct,RON-2018-10-02,17,8,1,"Adelphia, NJ"
150,Turf Quality,11/9/18,3,69,A11-38,Peak Plant Genetics,RON,10,1,149,2018,Nov,RON-2018-11-09,18,7,1,"Adelphia, NJ"
150,Turf Quality,4/17/19,3,69,A11-38,Peak Plant Genetics,RON,10,1,149,2019,Apr,RON-2019-04-17,19,1,2,"Adelphia, NJ"
150,Turf Quality,5/2/19,3,69,A11-38,Peak Plant Genetics,RON,10,1,149,2019,May,RON-2019-05-02,20,6,2,"Adelphia, NJ"
150,Turf Quality,6/13/19,4,69,A11-38,Peak Plant Genetics,RON,10,1,149,2019,Jun,RON-2019-06-13,21,4,2,"Adelphia, NJ"
150,Turf Quality,6/17/19,4,69,A11-38,Peak Plant Genetics,SAB,10,1,149,2019,Jun,SAB-2019-06-17,25,4,2,"Adelphia, NJ"
150,Turf Quality,7/17/19,5,69,A11-38,Peak Plant Genetics,RON,10,1,149,2019,Jul,RON-2019-07-17,22,3,2,"Adelphia, NJ"
150,Turf Quality,8/22/19,3,69,A11-38,Peak Plant Genetics,SAB,10,1,149,2019,Aug,SAB-2019-08-22,26,2,2,"Adelphia, NJ"
150,Turf Quality,9/16/19,3,69,A11-38,Peak Plant Genetics,RON,10,1,149,2019,Sep,RON-2019-09-16,23,9,2,"Adelphia, NJ"
150,Turf Quality,10/10/19,2,69,A11-38,Peak Plant Genetics,SAB,10,1,149,2019,Oct,SAB-2019-10-10,27,8,2,"Adelphia, NJ"
150,Turf Quality,11/1/19,3,69,A11-38,Peak Plant Genetics,RON,10,1,149,2019,Nov,RON-2019-11-01,24,7,2,"Adelphia, NJ"
150,Turf Quality,4/28/20,4,69,A11-38,Peak Plant Genetics,WAM,10,1,149,2020,Apr,WAM-2020-04-28,31,1,3,"Adelphia, NJ"
150,Turf Quality,5/18/20,5,69,A11-38,Peak Plant Genetics,SAB,10,1,149,2020,May,SAB-2020-05-18,28,6,3,"Adelphia, NJ"
150,Turf Quality,6/17/20,3,69,A11-38,Peak Plant Genetics,WAM,10,1,149,2020,Jun,WAM-2020-06-17,32,4,3,"Adelphia, NJ"
150,Turf Quality,7/15/20,5,69,A11-38,Peak Plant Genetics,WAM,10,1,149,2020,Jul,WAM-2020-07-15,33,3,3,"Adelphia, NJ"
150,Turf Quality,8/6/20,5,69,A11-38,Peak Plant Genetics,PLV,10,1,149,2020,Aug,PLV-2020-08-06,5,2,3,"Adelphia, NJ"
150,Turf Quality,9/2/20,3,69,A11-38,Peak Plant Genetics,DAS,10,1,149,2020,Sep,DAS-2020-09-02,1,9,3,"Adelphia, NJ"
150,Turf Quality,10/15/20,1,69,A11-38,Peak Plant Genetics,WAM,10,1,149,2020,Oct,WAM-2020-10-15,34,8,3,"Adelphia, NJ"
150,Turf Quality,11/5/20,1,69,A11-38,Peak Plant Genetics,WAM,10,1,149,2020,Nov,WAM-2020-11-05,35,7,3,"Adelphia, NJ"
150,Turf Quality,10/15/20,1,69,A11-38,Peak Plant Genetics,RMD,10,1,149,2020,Oct,RMD-2020-10-15,10,8,3,"Adelphia, NJ"
150,Turf Quality,10/23/20,1,69,A11-38,Peak Plant Genetics,RMD,10,1,149,2020,Oct,RMD-2020-10-23,11,8,3,"Adelphia, NJ"
150,Turf Quality,3/30/21,1,69,A11-38,Peak Plant Genetics,RMD,10,1,149,2021,Mar,RMD-2021-03-30,12,5,4,"Adelphia, NJ"
150,Turf Quality,4/22/21,1,69,A11-38,Peak Plant Genetics,PLV,10,1,149,2021,Apr,PLV-2021-04-22,6,1,4,"Adelphia, NJ"
150,Turf Quality,5/28/21,1,69,A11-38,Peak Plant Genetics,SAB,10,1,149,2021,May,SAB-2021-05-28,29,6,4,"Adelphia, NJ"
150,Turf Quality,6/11/21,3,69,A11-38,Peak Plant Genetics,JEN,10,1,149,2021,Jun,JEN-2021-06-11,2,4,4,"Adelphia, NJ"
150,Turf Quality,7/13/21,6,69,A11-38,Peak Plant Genetics,PLV,10,1,149,2021,Jul,PLV-2021-07-13,7,3,4,"Adelphia, NJ"
150,Turf Quality,8/11/21,5,69,A11-38,Peak Plant Genetics,JEN,10,1,149,2021,Aug,JEN-2021-08-11,3,2,4,"Adelphia, NJ"
150,Turf Quality,9/17/21,2,69,A11-38,Peak Plant Genetics,JEN,10,1,149,2021,Sep,JEN-2021-09-17,4,9,4,"Adelphia, NJ"
150,Turf Quality,10/13/21,1,69,A11-38,Peak Plant Genetics,SAB,10,1,149,2021,Oct,SAB-2021-10-13,30,8,4,"Adelphia, NJ"
150,Turf Quality,11/18/21,4,69,A11-38,Peak Plant Genetics,WAM,10,1,149,2021,Nov,WAM-2021-11-18,36,7,4,"Adelphia, NJ"
121,Turf Quality,4/18/18,4,14,Yellowstone (A12-7),Landmark Turf & Native Seed,RMD,9,1,120,2018,Apr,RMD-2018-04-18,8,1,1,"Adelphia, NJ"
121,Turf Quality,5/10/18,6,14,Yellowstone (A12-7),Landmark Turf & Native Seed,RON,9,1,120,2018,May,RON-2018-05-10,13,6,1,"Adelphia, NJ"
121,Turf Quality,6/7/18,6,14,Yellowstone (A12-7),Landmark Turf & Native Seed,RON,9,1,120,2018,Jun,RON-2018-06-07,14,4,1,"Adelphia, NJ"
121,Turf Quality,7/17/18,6,14,Yellowstone (A12-7),Landmark Turf & Native Seed,RON,9,1,120,2018,Jul,RON-2018-07-17,15,3,1,"Adelphia, NJ"
121,Turf Quality,8/15/18,7,14,Yellowstone (A12-7),Landmark Turf & Native Seed,RMD,9,1,120,2018,Aug,RMD-2018-08-15,9,2,1,"Adelphia, NJ"
121,Turf Quality,9/12/18,6,14,Yellowstone (A12-7),Landmark Turf & Native Seed,RON,9,1,120,2018,Sep,RON-2018-09-12,16,9,1,"Adelphia, NJ"
121,Turf Quality,10/2/18,6,14,Yellowstone (A12-7),Landmark Turf & Native Seed,RON,9,1,120,2018,Oct,RON-2018-10-02,17,8,1,"Adelphia, NJ"
121,Turf Quality,11/9/18,5,14,Yellowstone (A12-7),Landmark Turf & Native Seed,RON,9,1,120,2018,Nov,RON-2018-11-09,18,7,1,"Adelphia, NJ"
121,Turf Quality,4/17/19,5,14,Yellowstone (A12-7),Landmark Turf & Native Seed,RON,9,1,120,2019,Apr,RON-2019-04-17,19,1,2,"Adelphia, NJ"
121,Turf Quality,5/2/19,5,14,Yellowstone (A12-7),Landmark Turf & Native Seed,RON,9,1,120,2019,May,RON-2019-05-02,20,6,2,"Adelphia, NJ"
121,Turf Quality,6/13/19,6,14,Yellowstone (A12-7),Landmark Turf & Native Seed,RON,9,1,120,2019,Jun,RON-2019-06-13,21,4,2,"Adelphia, NJ"
121,Turf Quality,6/17/19,5,14,Yellowstone (A12-7),Landmark Turf & Native Seed,SAB,9,1,120,2019,Jun,SAB-2019-06-17,25,4,2,"Adelphia, NJ"
121,Turf Quality,7/17/19,6,14,Yellowstone (A12-7),Landmark Turf & Native Seed,RON,9,1,120,2019,Jul,RON-2019-07-17,22,3,2,"Adelphia, NJ"
121,Turf Quality,8/22/19,4,14,Yellowstone (A12-7),Landmark Turf & Native Seed,SAB,9,1,120,2019,Aug,SAB-2019-08-22,26,2,2,"Adelphia, NJ"
121,Turf Quality,9/16/19,5,14,Yellowstone (A12-7),Landmark Turf & Native Seed,RON,9,1,120,2019,Sep,RON-2019-09-16,23,9,2,"Adelphia, NJ"
121,Turf Quality,10/10/19,6,14,Yellowstone (A12-7),Landmark Turf & Native Seed,SAB,9,1,120,2019,Oct,SAB-2019-10-10,27,8,2,"Adelphia, NJ"
121,Turf Quality,11/1/19,5,14,Yellowstone (A12-7),Landmark Turf & Native Seed,RON,9,1,120,2019,Nov,RON-2019-11-01,24,7,2,"Adelphia, NJ"
121,Turf Quality,4/28/20,5,14,Yellowstone (A12-7),Landmark Turf & Native Seed,WAM,9,1,120,2020,Apr,WAM-2020-04-28,31,1,3,"Adelphia, NJ"
121,Turf Quality,5/18/20,6,14,Yellowstone (A12-7),Landmark Turf & Native Seed,SAB,9,1,120,2020,May,SAB-2020-05-18,28,6,3,"Adelphia, NJ"
121,Turf Quality,6/17/20,4,14,Yellowstone (A12-7),Landmark Turf & Native Seed,WAM,9,1,120,2020,Jun,WAM-2020-06-17,32,4,3,"Adelphia, NJ"
121,Turf Quality,7/15/20,3,14,Yellowstone (A12-7),Landmark Turf & Native Seed,WAM,9,1,120,2020,Jul,WAM-2020-07-15,33,3,3,"Adelphia, NJ"
121,Turf Quality,8/6/20,4,14,Yellowstone (A12-7),Landmark Turf & Native Seed,PLV,9,1,120,2020,Aug,PLV-2020-08-06,5,2,3,"Adelphia, NJ"
121,Turf Quality,9/2/20,3,14,Yellowstone (A12-7),Landmark Turf & Native Seed,DAS,9,1,120,2020,Sep,DAS-2020-09-02,1,9,3,"Adelphia, NJ"
121,Turf Quality,10/15/20,1,14,Yellowstone (A12-7),Landmark Turf & Native Seed,WAM,9,1,120,2020,Oct,WAM-2020-10-15,34,8,3,"Adelphia, NJ"
121,Turf Quality,11/5/20,2,14,Yellowstone (A12-7),Landmark Turf & Native Seed,WAM,9,1,120,2020,Nov,WAM-2020-11-05,35,7,3,"Adelphia, NJ"
121,Turf Quality,10/15/20,2,14,Yellowstone (A12-7),Landmark Turf & Native Seed,RMD,9,1,120,2020,Oct,RMD-2020-10-15,10,8,3,"Adelphia, NJ"
121,Turf Quality,10/23/20,1,14,Yellowstone (A12-7),Landmark Turf & Native Seed,RMD,9,1,120,2020,Oct,RMD-2020-10-23,11,8,3,"Adelphia, NJ"
121,Turf Quality,3/30/21,1,14,Yellowstone (A12-7),Landmark Turf & Native Seed,RMD,9,1,120,2021,Mar,RMD-2021-03-30,12,5,4,"Adelphia, NJ"
121,Turf Quality,4/22/21,2,14,Yellowstone (A12-7),Landmark Turf & Native Seed,PLV,9,1,120,2021,Apr,PLV-2021-04-22,6,1,4,"Adelphia, NJ"
121,Turf Quality,5/28/21,2,14,Yellowstone (A12-7),Landmark Turf & Native Seed,SAB,9,1,120,2021,May,SAB-2021-05-28,29,6,4,"Adelphia, NJ"
121,Turf Quality,6/11/21,3,14,Yellowstone (A12-7),Landmark Turf & Native Seed,JEN,9,1,120,2021,Jun,JEN-2021-06-11,2,4,4,"Adelphia, NJ"
121,Turf Quality,7/13/21,4,14,Yellowstone (A12-7),Landmark Turf & Native Seed,PLV,9,1,120,2021,Jul,PLV-2021-07-13,7,3,4,"Adelphia, NJ"
121,Turf Quality,8/11/21,3,14,Yellowstone (A12-7),Landmark Turf & Native Seed,JEN,9,1,120,2021,Aug,JEN-2021-08-11,3,2,4,"Adelphia, NJ"
121,Turf Quality,9/17/21,3,14,Yellowstone (A12-7),Landmark Turf & Native Seed,JEN,9,1,120,2021,Sep,JEN-2021-09-17,4,9,4,"Adelphia, NJ"
121,Turf Quality,10/13/21,2,14,Yellowstone (A12-7),Landmark Turf & Native Seed,SAB,9,1,120,2021,Oct,SAB-2021-10-13,30,8,4,"Adelphia, NJ"
121,Turf Quality,11/18/21,3,14,Yellowstone (A12-7),Landmark Turf & Native Seed,WAM,9,1,120,2021,Nov,WAM-2021-11-18,36,7,4,"Adelphia, NJ"
120,Turf Quality,4/18/18,3,63,MVS-130,Mountain View Seeds,RMD,8,1,119,2018,Apr,RMD-2018-04-18,8,1,1,"Adelphia, NJ"
120,Turf Quality,5/10/18,4,63,MVS-130,Mountain View Seeds,RON,8,1,119,2018,May,RON-2018-05-10,13,6,1,"Adelphia, NJ"
120,Turf Quality,6/7/18,7,63,MVS-130,Mountain View Seeds,RON,8,1,119,2018,Jun,RON-2018-06-07,14,4,1,"Adelphia, NJ"
120,Turf Quality,7/17/18,5,63,MVS-130,Mountain View Seeds,RON,8,1,119,2018,Jul,RON-2018-07-17,15,3,1,"Adelphia, NJ"
120,Turf Quality,8/15/18,7,63,MVS-130,Mountain View Seeds,RMD,8,1,119,2018,Aug,RMD-2018-08-15,9,2,1,"Adelphia, NJ"
120,Turf Quality,9/12/18,5,63,MVS-130,Mountain View Seeds,RON,8,1,119,2018,Sep,RON-2018-09-12,16,9,1,"Adelphia, NJ"
120,Turf Quality,10/2/18,6,63,MVS-130,Mountain View Seeds,RON,8,1,119,2018,Oct,RON-2018-10-02,17,8,1,"Adelphia, NJ"
120,Turf Quality,11/9/18,4,63,MVS-130,Mountain View Seeds,RON,8,1,119,2018,Nov,RON-2018-11-09,18,7,1,"Adelphia, NJ"
120,Turf Quality,4/17/19,3,63,MVS-130,Mountain View Seeds,RON,8,1,119,2019,Apr,RON-2019-04-17,19,1,2,"Adelphia, NJ"
120,Turf Quality,5/2/19,4,63,MVS-130,Mountain View Seeds,RON,8,1,119,2019,May,RON-2019-05-02,20,6,2,"Adelphia, NJ"
120,Turf Quality,6/13/19,5,63,MVS-130,Mountain View Seeds,RON,8,1,119,2019,Jun,RON-2019-06-13,21,4,2,"Adelphia, NJ"
120,Turf Quality,6/17/19,5,63,MVS-130,Mountain View Seeds,SAB,8,1,119,2019,Jun,SAB-2019-06-17,25,4,2,"Adelphia, NJ"
120,Turf Quality,7/17/19,5,63,MVS-130,Mountain View Seeds,RON,8,1,119,2019,Jul,RON-2019-07-17,22,3,2,"Adelphia, NJ"
120,Turf Quality,8/22/19,4,63,MVS-130,Mountain View Seeds,SAB,8,1,119,2019,Aug,SAB-2019-08-22,26,2,2,"Adelphia, NJ"
120,Turf Quality,9/16/19,4,63,MVS-130,Mountain View Seeds,RON,8,1,119,2019,Sep,RON-2019-09-16,23,9,2,"Adelphia, NJ"
120,Turf Quality,10/10/19,3,63,MVS-130,Mountain View Seeds,SAB,8,1,119,2019,Oct,SAB-2019-10-10,27,8,2,"Adelphia, NJ"
120,Turf Quality,11/1/19,3,63,MVS-130,Mountain View Seeds,RON,8,1,119,2019,Nov,RON-2019-11-01,24,7,2,"Adelphia, NJ"
120,Turf Quality,4/28/20,4,63,MVS-130,Mountain View Seeds,WAM,8,1,119,2020,Apr,WAM-2020-04-28,31,1,3,"Adelphia, NJ"
120,Turf Quality,5/18/20,4,63,MVS-130,Mountain View Seeds,SAB,8,1,119,2020,May,SAB-2020-05-18,28,6,3,"Adelphia, NJ"
120,Turf Quality,6/17/20,4,63,MVS-130,Mountain View Seeds,WAM,8,1,119,2020,Jun,WAM-2020-06-17,32,4,3,"Adelphia, NJ"
120,Turf Quality,7/15/20,6,63,MVS-130,Mountain View Seeds,WAM,8,1,119,2020,Jul,WAM-2020-07-15,33,3,3,"Adelphia, NJ"
120,Turf Quality,8/6/20,5,63,MVS-130,Mountain View Seeds,PLV,8,1,119,2020,Aug,PLV-2020-08-06,5,2,3,"Adelphia, NJ"
120,Turf Quality,9/2/20,4,63,MVS-130,Mountain View Seeds,DAS,8,1,119,2020,Sep,DAS-2020-09-02,1,9,3,"Adelphia, NJ"
120,Turf Quality,10/15/20,2,63,MVS-130,Mountain View Seeds,WAM,8,1,119,2020,Oct,WAM-2020-10-15,34,8,3,"Adelphia, NJ"
120,Turf Quality,11/5/20,2,63,MVS-130,Mountain View Seeds,WAM,8,1,119,2020,Nov,WAM-2020-11-05,35,7,3,"Adelphia, NJ"
120,Turf Quality,10/15/20,3,63,MVS-130,Mountain View Seeds,RMD,8,1,119,2020,Oct,RMD-2020-10-15,10,8,3,"Adelphia, NJ"
120,Turf Quality,10/23/20,2,63,MVS-130,Mountain View Seeds,RMD,8,1,119,2020,Oct,RMD-2020-10-23,11,8,3,"Adelphia, NJ"
120,Turf Quality,3/30/21,2,63,MVS-130,Mountain View Seeds,RMD,8,1,119,2021,Mar,RMD-2021-03-30,12,5,4,"Adelphia, NJ"
120,Turf Quality,4/22/21,3,63,MVS-130,Mountain View Seeds,PLV,8,1,119,2021,Apr,PLV-2021-04-22,6,1,4,"Adelphia, NJ"
120,Turf Quality,5/28/21,3,63,MVS-130,Mountain View Seeds,SAB,8,1,119,2021,May,SAB-2021-05-28,29,6,4,"Adelphia, NJ"
120,Turf Quality,6/11/21,5,63,MVS-130,Mountain View Seeds,JEN,8,1,119,2021,Jun,JEN-2021-06-11,2,4,4,"Adelphia, NJ"
120,Turf Quality,7/13/21,5,63,MVS-130,Mountain View Seeds,PLV,8,1,119,2021,Jul,PLV-2021-07-13,7,3,4,"Adelphia, NJ"
120,Turf Quality,8/11/21,4,63,MVS-130,Mountain View Seeds,JEN,8,1,119,2021,Aug,JEN-2021-08-11,3,2,4,"Adelphia, NJ"
120,Turf Quality,9/17/21,3,63,MVS-130,Mountain View Seeds,JEN,8,1,119,2021,Sep,JEN-2021-09-17,4,9,4,"Adelphia, NJ"
120,Turf Quality,10/13/21,1,63,MVS-130,Mountain View Seeds,SAB,8,1,119,2021,Oct,SAB-2021-10-13,30,8,4,"Adelphia, NJ"
120,Turf Quality,11/18/21,4,63,MVS-130,Mountain View Seeds,WAM,8,1,119,2021,Nov,WAM-2021-11-18,36,7,4,"Adelphia, NJ"
91,Turf Quality,4/18/18,3,31,NAI-15-80,SiteOne Landscape Supply,RMD,7,1,90,2018,Apr,RMD-2018-04-18,8,1,1,"Adelphia, NJ"
91,Turf Quality,5/10/18,5,31,NAI-15-80,SiteOne Landscape Supply,RON,7,1,90,2018,May,RON-2018-05-10,13,6,1,"Adelphia, NJ"
91,Turf Quality,6/7/18,6,31,NAI-15-80,SiteOne Landscape Supply,RON,7,1,90,2018,Jun,RON-2018-06-07,14,4,1,"Adelphia, NJ"
91,Turf Quality,7/17/18,5,31,NAI-15-80,SiteOne Landscape Supply,RON,7,1,90,2018,Jul,RON-2018-07-17,15,3,1,"Adelphia, NJ"
91,Turf Quality,8/15/18,8,31,NAI-15-80,SiteOne Landscape Supply,RMD,7,1,90,2018,Aug,RMD-2018-08-15,9,2,1,"Adelphia, NJ"
91,Turf Quality,9/12/18,4,31,NAI-15-80,SiteOne Landscape Supply,RON,7,1,90,2018,Sep,RON-2018-09-12,16,9,1,"Adelphia, NJ"
91,Turf Quality,10/2/18,5,31,NAI-15-80,SiteOne Landscape Supply,RON,7,1,90,2018,Oct,RON-2018-10-02,17,8,1,"Adelphia, NJ"
91,Turf Quality,11/9/18,5,31,NAI-15-80,SiteOne Landscape Supply,RON,7,1,90,2018,Nov,RON-2018-11-09,18,7,1,"Adelphia, NJ"
91,Turf Quality,4/17/19,4,31,NAI-15-80,SiteOne Landscape Supply,RON,7,1,90,2019,Apr,RON-2019-04-17,19,1,2,"Adelphia, NJ"
91,Turf Quality,5/2/19,4,31,NAI-15-80,SiteOne Landscape Supply,RON,7,1,90,2019,May,RON-2019-05-02,20,6,2,"Adelphia, NJ"
91,Turf Quality,6/13/19,5,31,NAI-15-80,SiteOne Landscape Supply,RON,7,1,90,2019,Jun,RON-2019-06-13,21,4,2,"Adelphia, NJ"
91,Turf Quality,6/17/19,5,31,NAI-15-80,SiteOne Landscape Supply,SAB,7,1,90,2019,Jun,SAB-2019-06-17,25,4,2,"Adelphia, NJ"
91,Turf Quality,7/17/19,5,31,NAI-15-80,SiteOne Landscape Supply,RON,7,1,90,2019,Jul,RON-2019-07-17,22,3,2,"Adelphia, NJ"
91,Turf Quality,8/22/19,4,31,NAI-15-80,SiteOne Landscape Supply,SAB,7,1,90,2019,Aug,SAB-2019-08-22,26,2,2,"Adelphia, NJ"
91,Turf Quality,9/16/19,4,31,NAI-15-80,SiteOne Landscape Supply,RON,7,1,90,2019,Sep,RON-2019-09-16,23,9,2,"Adelphia, NJ"
91,Turf Quality,10/10/19,3,31,NAI-15-80,SiteOne Landscape Supply,SAB,7,1,90,2019,Oct,SAB-2019-10-10,27,8,2,"Adelphia, NJ"
91,Turf Quality,11/1/19,4,31,NAI-15-80,SiteOne Landscape Supply,RON,7,1,90,2019,Nov,RON-2019-11-01,24,7,2,"Adelphia, NJ"
91,Turf Quality,4/28/20,6,31,NAI-15-80,SiteOne Landscape Supply,WAM,7,1,90,2020,Apr,WAM-2020-04-28,31,1,3,"Adelphia, NJ"
91,Turf Quality,5/18/20,4,31,NAI-15-80,SiteOne Landscape Supply,SAB,7,1,90,2020,May,SAB-2020-05-18,28,6,3,"Adelphia, NJ"
91,Turf Quality,6/17/20,5,31,NAI-15-80,SiteOne Landscape Supply,WAM,7,1,90,2020,Jun,WAM-2020-06-17,32,4,3,"Adelphia, NJ"
91,Turf Quality,7/15/20,4,31,NAI-15-80,SiteOne Landscape Supply,WAM,7,1,90,2020,Jul,WAM-2020-07-15,33,3,3,"Adelphia, NJ"
91,Turf Quality,8/6/20,5,31,NAI-15-80,SiteOne Landscape Supply,PLV,7,1,90,2020,Aug,PLV-2020-08-06,5,2,3,"Adelphia, NJ"
91,Turf Quality,9/2/20,3,31,NAI-15-80,SiteOne Landscape Supply,DAS,7,1,90,2020,Sep,DAS-2020-09-02,1,9,3,"Adelphia, NJ"
91,Turf Quality,10/15/20,2,31,NAI-15-80,SiteOne Landscape Supply,WAM,7,1,90,2020,Oct,WAM-2020-10-15,34,8,3,"Adelphia, NJ"
91,Turf Quality,11/5/20,3,31,NAI-15-80,SiteOne Landscape Supply,WAM,7,1,90,2020,Nov,WAM-2020-11-05,35,7,3,"Adelphia, NJ"
91,Turf Quality,10/15/20,3,31,NAI-15-80,SiteOne Landscape Supply,RMD,7,1,90,2020,Oct,RMD-2020-10-15,10,8,3,"Adelphia, NJ"
91,Turf Quality,10/23/20,3,31,NAI-15-80,SiteOne Landscape Supply,RMD,7,1,90,2020,Oct,RMD-2020-10-23,11,8,3,"Adelphia, NJ"
91,Turf Quality,3/30/21,2,31,NAI-15-80,SiteOne Landscape Supply,RMD,7,1,90,2021,Mar,RMD-2021-03-30,12,5,4,"Adelphia, NJ"
91,Turf Quality,4/22/21,3,31,NAI-15-80,SiteOne Landscape Supply,PLV,7,1,90,2021,Apr,PLV-2021-04-22,6,1,4,"Adelphia, NJ"
91,Turf Quality,5/28/21,2,31,NAI-15-80,SiteOne Landscape Supply,SAB,7,1,90,2021,May,SAB-2021-05-28,29,6,4,"Adelphia, NJ"
91,Turf Quality,6/11/21,3,31,NAI-15-80,SiteOne Landscape Supply,JEN,7,1,90,2021,Jun,JEN-2021-06-11,2,4,4,"Adelphia, NJ"
91,Turf Quality,7/13/21,6,31,NAI-15-80,SiteOne Landscape Supply,PLV,7,1,90,2021,Jul,PLV-2021-07-13,7,3,4,"Adelphia, NJ"
91,Turf Quality,8/11/21,4,31,NAI-15-80,SiteOne Landscape Supply,JEN,7,1,90,2021,Aug,JEN-2021-08-11,3,2,4,"Adelphia, NJ"
91,Turf Quality,9/17/21,3,31,NAI-15-80,SiteOne Landscape Supply,JEN,7,1,90,2021,Sep,JEN-2021-09-17,4,9,4,"Adelphia, NJ"
91,Turf Quality,10/13/21,2,31,NAI-15-80,SiteOne Landscape Supply,SAB,7,1,90,2021,Oct,SAB-2021-10-13,30,8,4,"Adelphia, NJ"
91,Turf Quality,11/18/21,4,31,NAI-15-80,SiteOne Landscape Supply,WAM,7,1,90,2021,Nov,WAM-2021-11-18,36,7,4,"Adelphia, NJ"
61,Turf Quality,4/18/18,4,61,DLFPS-340/3551,DLF Pickseed USA,RMD,5,1,61,2018,Apr,RMD-2018-04-18,8,1,1,"Adelphia, NJ"
61,Turf Quality,5/10/18,6,61,DLFPS-340/3551,DLF Pickseed USA,RON,5,1,61,2018,May,RON-2018-05-10,13,6,1,"Adelphia, NJ"
61,Turf Quality,6/7/18,7,61,DLFPS-340/3551,DLF Pickseed USA,RON,5,1,61,2018,Jun,RON-2018-06-07,14,4,1,"Adelphia, NJ"
61,Turf Quality,7/17/18,6,61,DLFPS-340/3551,DLF Pickseed USA,RON,5,1,61,2018,Jul,RON-2018-07-17,15,3,1,"Adelphia, NJ"
61,Turf Quality,8/15/18,6,61,DLFPS-340/3551,DLF Pickseed USA,RMD,5,1,61,2018,Aug,RMD-2018-08-15,9,2,1,"Adelphia, NJ"
61,Turf Quality,9/12/18,7,61,DLFPS-340/3551,DLF Pickseed USA,RON,5,1,61,2018,Sep,RON-2018-09-12,16,9,1,"Adelphia, NJ"
61,Turf Quality,10/2/18,8,61,DLFPS-340/3551,DLF Pickseed USA,RON,5,1,61,2018,Oct,RON-2018-10-02,17,8,1,"Adelphia, NJ"
61,Turf Quality,11/9/18,8,61,DLFPS-340/3551,DLF Pickseed USA,RON,5,1,61,2018,Nov,RON-2018-11-09,18,7,1,"Adelphia, NJ"
61,Turf Quality,4/17/19,4,61,DLFPS-340/3551,DLF Pickseed USA,RON,5,1,61,2019,Apr,RON-2019-04-17,19,1,2,"Adelphia, NJ"
61,Turf Quality,5/2/19,7,61,DLFPS-340/3551,DLF Pickseed USA,RON,5,1,61,2019,May,RON-2019-05-02,20,6,2,"Adelphia, NJ"
61,Turf Quality,6/13/19,6,61,DLFPS-340/3551,DLF Pickseed USA,RON,5,1,61,2019,Jun,RON-2019-06-13,21,4,2,"Adelphia, NJ"
61,Turf Quality,6/17/19,6,61,DLFPS-340/3551,DLF Pickseed USA,SAB,5,1,61,2019,Jun,SAB-2019-06-17,25,4,2,"Adelphia, NJ"
61,Turf Quality,7/17/19,7,61,DLFPS-340/3551,DLF Pickseed USA,RON,5,1,61,2019,Jul,RON-2019-07-17,22,3,2,"Adelphia, NJ"
61,Turf Quality,8/22/19,7,61,DLFPS-340/3551,DLF Pickseed USA,SAB,5,1,61,2019,Aug,SAB-2019-08-22,26,2,2,"Adelphia, NJ"
61,Turf Quality,9/16/19,8,61,DLFPS-340/3551,DLF Pickseed USA,RON,5,1,61,2019,Sep,RON-2019-09-16,23,9,2,"Adelphia, NJ"
61,Turf Quality,10/10/19,5,61,DLFPS-340/3551,DLF Pickseed USA,SAB,5,1,61,2019,Oct,SAB-2019-10-10,27,8,2,"Adelphia, NJ"
61,Turf Quality,11/1/19,7,61,DLFPS-340/3551,DLF Pickseed USA,RON,5,1,61,2019,Nov,RON-2019-11-01,24,7,2,"Adelphia, NJ"
61,Turf Quality,4/28/20,8,61,DLFPS-340/3551,DLF Pickseed USA,WAM,5,1,61,2020,Apr,WAM-2020-04-28,31,1,3,"Adelphia, NJ"
61,Turf Quality,5/18/20,7,61,DLFPS-340/3551,DLF Pickseed USA,SAB,5,1,61,2020,May,SAB-2020-05-18,28,6,3,"Adelphia, NJ"
61,Turf Quality,6/17/20,5,61,DLFPS-340/3551,DLF Pickseed USA,WAM,5,1,61,2020,Jun,WAM-2020-06-17,32,4,3,"Adelphia, NJ"
61,Turf Quality,7/15/20,8,61,DLFPS-340/3551,DLF Pickseed USA,WAM,5,1,61,2020,Jul,WAM-2020-07-15,33,3,3,"Adelphia, NJ"
61,Turf Quality,8/6/20,8,61,DLFPS-340/3551,DLF Pickseed USA,PLV,5,1,61,2020,Aug,PLV-2020-08-06,5,2,3,"Adelphia, NJ"
61,Turf Quality,9/2/20,5,61,DLFPS-340/3551,DLF Pickseed USA,DAS,5,1,61,2020,Sep,DAS-2020-09-02,1,9,3,"Adelphia, NJ"
61,Turf Quality,10/15/20,4,61,DLFPS-340/3551,DLF Pickseed USA,WAM,5,1,61,2020,Oct,WAM-2020-10-15,34,8,3,"Adelphia, NJ"
61,Turf Quality,11/5/20,2,61,DLFPS-340/3551,DLF Pickseed USA,WAM,5,1,61,2020,Nov,WAM-2020-11-05,35,7,3,"Adelphia, NJ"
61,Turf Quality,10/15/20,3,61,DLFPS-340/3551,DLF Pickseed USA,RMD,5,1,61,2020,Oct,RMD-2020-10-15,10,8,3,"Adelphia, NJ"
61,Turf Quality,10/23/20,3,61,DLFPS-340/3551,DLF Pickseed USA,RMD,5,1,61,2020,Oct,RMD-2020-10-23,11,8,3,"Adelphia, NJ"
61,Turf Quality,3/30/21,3,61,DLFPS-340/3551,DLF Pickseed USA,RMD,5,1,61,2021,Mar,RMD-2021-03-30,12,5,4,"Adelphia, NJ"
61,Turf Quality,4/22/21,5,61,DLFPS-340/3551,DLF Pickseed USA,PLV,5,1,61,2021,Apr,PLV-2021-04-22,6,1,4,"Adelphia, NJ"
61,Turf Quality,5/28/21,4,61,DLFPS-340/3551,DLF Pickseed USA,SAB,5,1,61,2021,May,SAB-2021-05-28,29,6,4,"Adelphia, NJ"
61,Turf Quality,6/11/21,6,61,DLFPS-340/3551,DLF Pickseed USA,JEN,5,1,61,2021,Jun,JEN-2021-06-11,2,4,4,"Adelphia, NJ"
61,Turf Quality,7/13/21,8,61,DLFPS-340/3551,DLF Pickseed USA,PLV,5,1,61,2021,Jul,PLV-2021-07-13,7,3,4,"Adelphia, NJ"
61,Turf Quality,8/11/21,6,61,DLFPS-340/3551,DLF Pickseed USA,JEN,5,1,61,2021,Aug,JEN-2021-08-11,3,2,4,"Adelphia, NJ"
61,Turf Quality,9/17/21,5,61,DLFPS-340/3551,DLF Pickseed USA,JEN,5,1,61,2021,Sep,JEN-2021-09-17,4,9,4,"Adelphia, NJ"
61,Turf Quality,10/13/21,4,61,DLFPS-340/3551,DLF Pickseed USA,SAB,5,1,61,2021,Oct,SAB-2021-10-13,30,8,4,"Adelphia, NJ"
61,Turf Quality,11/18/21,6,61,DLFPS-340/3551,DLF Pickseed USA,WAM,5,1,61,2021,Nov,WAM-2021-11-18,36,7,4,"Adelphia, NJ"
60,Turf Quality,4/18/18,3,60,DLFPS-340/3550,DLF Pickseed USA,RMD,4,1,60,2018,Apr,RMD-2018-04-18,8,1,1,"Adelphia, NJ"
60,Turf Quality,5/10/18,6,60,DLFPS-340/3550,DLF Pickseed USA,RON,4,1,60,2018,May,RON-2018-05-10,13,6,1,"Adelphia, NJ"
60,Turf Quality,6/7/18,6,60,DLFPS-340/3550,DLF Pickseed USA,RON,4,1,60,2018,Jun,RON-2018-06-07,14,4,1,"Adelphia, NJ"
60,Turf Quality,7/17/18,6,60,DLFPS-340/3550,DLF Pickseed USA,RON,4,1,60,2018,Jul,RON-2018-07-17,15,3,1,"Adelphia, NJ"
60,Turf Quality,8/15/18,5,60,DLFPS-340/3550,DLF Pickseed USA,RMD,4,1,60,2018,Aug,RMD-2018-08-15,9,2,1,"Adelphia, NJ"
60,Turf Quality,9/12/18,7,60,DLFPS-340/3550,DLF Pickseed USA,RON,4,1,60,2018,Sep,RON-2018-09-12,16,9,1,"Adelphia, NJ"
60,Turf Quality,10/2/18,7,60,DLFPS-340/3550,DLF Pickseed USA,RON,4,1,60,2018,Oct,RON-2018-10-02,17,8,1,"Adelphia, NJ"
60,Turf Quality,11/9/18,8,60,DLFPS-340/3550,DLF Pickseed USA,RON,4,1,60,2018,Nov,RON-2018-11-09,18,7,1,"Adelphia, NJ"
60,Turf Quality,4/17/19,4,60,DLFPS-340/3550,DLF Pickseed USA,RON,4,1,60,2019,Apr,RON-2019-04-17,19,1,2,"Adelphia, NJ"
60,Turf Quality,5/2/19,5,60,DLFPS-340/3550,DLF Pickseed USA,RON,4,1,60,2019,May,RON-2019-05-02,20,6,2,"Adelphia, NJ"
60,Turf Quality,6/13/19,5,60,DLFPS-340/3550,DLF Pickseed USA,RON,4,1,60,2019,Jun,RON-2019-06-13,21,4,2,"Adelphia, NJ"
60,Turf Quality,6/17/19,5,60,DLFPS-340/3550,DLF Pickseed USA,SAB,4,1,60,2019,Jun,SAB-2019-06-17,25,4,2,"Adelphia, NJ"
60,Turf Quality,7/17/19,7,60,DLFPS-340/3550,DLF Pickseed USA,RON,4,1,60,2019,Jul,RON-2019-07-17,22,3,2,"Adelphia, NJ"
60,Turf Quality,8/22/19,8,60,DLFPS-340/3550,DLF Pickseed USA,SAB,4,1,60,2019,Aug,SAB-2019-08-22,26,2,2,"Adelphia, NJ"
60,Turf Quality,9/16/19,9,60,DLFPS-340/3550,DLF Pickseed USA,RON,4,1,60,2019,Sep,RON-2019-09-16,23,9,2,"Adelphia, NJ"
60,Turf Quality,10/10/19,3,60,DLFPS-340/3550,DLF Pickseed USA,SAB,4,1,60,2019,Oct,SAB-2019-10-10,27,8,2,"Adelphia, NJ"
60,Turf Quality,11/1/19,6,60,DLFPS-340/3550,DLF Pickseed USA,RON,4,1,60,2019,Nov,RON-2019-11-01,24,7,2,"Adelphia, NJ"
60,Turf Quality,4/28/20,8,60,DLFPS-340/3550,DLF Pickseed USA,WAM,4,1,60,2020,Apr,WAM-2020-04-28,31,1,3,"Adelphia, NJ"
60,Turf Quality,5/18/20,6,60,DLFPS-340/3550,DLF Pickseed USA,SAB,4,1,60,2020,May,SAB-2020-05-18,28,6,3,"Adelphia, NJ"
60,Turf Quality,6/17/20,7,60,DLFPS-340/3550,DLF Pickseed USA,WAM,4,1,60,2020,Jun,WAM-2020-06-17,32,4,3,"Adelphia, NJ"
60,Turf Quality,7/15/20,7,60,DLFPS-340/3550,DLF Pickseed USA,WAM,4,1,60,2020,Jul,WAM-2020-07-15,33,3,3,"Adelphia, NJ"
60,Turf Quality,8/6/20,8,60,DLFPS-340/3550,DLF Pickseed USA,PLV,4,1,60,2020,Aug,PLV-2020-08-06,5,2,3,"Adelphia, NJ"
60,Turf Quality,9/2/20,6,60,DLFPS-340/3550,DLF Pickseed USA,DAS,4,1,60,2020,Sep,DAS-2020-09-02,1,9,3,"Adelphia, NJ"
60,Turf Quality,10/15/20,4,60,DLFPS-340/3550,DLF Pickseed USA,WAM,4,1,60,2020,Oct,WAM-2020-10-15,34,8,3,"Adelphia, NJ"
60,Turf Quality,11/5/20,4,60,DLFPS-340/3550,DLF Pickseed USA,WAM,4,1,60,2020,Nov,WAM-2020-11-05,35,7,3,"Adelphia, NJ"
60,Turf Quality,10/15/20,4,60,DLFPS-340/3550,DLF Pickseed USA,RMD,4,1,60,2020,Oct,RMD-2020-10-15,10,8,3,"Adelphia, NJ"
60,Turf Quality,10/23/20,4,60,DLFPS-340/3550,DLF Pickseed USA,RMD,4,1,60,2020,Oct,RMD-2020-10-23,11,8,3,"Adelphia, NJ"
60,Turf Quality,3/30/21,4,60,DLFPS-340/3550,DLF Pickseed USA,RMD,4,1,60,2021,Mar,RMD-2021-03-30,12,5,4,"Adelphia, NJ"
60,Turf Quality,4/22/21,6,60,DLFPS-340/3550,DLF Pickseed USA,PLV,4,1,60,2021,Apr,PLV-2021-04-22,6,1,4,"Adelphia, NJ"
60,Turf Quality,5/28/21,5,60,DLFPS-340/3550,DLF Pickseed USA,SAB,4,1,60,2021,May,SAB-2021-05-28,29,6,4,"Adelphia, NJ"
60,Turf Quality,6/11/21,7,60,DLFPS-340/3550,DLF Pickseed USA,JEN,4,1,60,2021,Jun,JEN-2021-06-11,2,4,4,"Adelphia, NJ"
60,Turf Quality,7/13/21,8,60,DLFPS-340/3550,DLF Pickseed USA,PLV,4,1,60,2021,Jul,PLV-2021-07-13,7,3,4,"Adelphia, NJ"
60,Turf Quality,8/11/21,6,60,DLFPS-340/3550,DLF Pickseed USA,JEN,4,1,60,2021,Aug,JEN-2021-08-11,3,2,4,"Adelphia, NJ"
60,Turf Quality,9/17/21,5,60,DLFPS-340/3550,DLF Pickseed USA,JEN,4,1,60,2021,Sep,JEN-2021-09-17,4,9,4,"Adelphia, NJ"
60,Turf Quality,10/13/21,5,60,DLFPS-340/3550,DLF Pickseed USA,SAB,4,1,60,2021,Oct,SAB-2021-10-13,30,8,4,"Adelphia, NJ"
60,Turf Quality,11/18/21,5,60,DLFPS-340/3550,DLF Pickseed USA,WAM,4,1,60,2021,Nov,WAM-2021-11-18,36,7,4,"Adelphia, NJ"
31,Turf Quality,4/18/18,3,31,NAI-15-80,SiteOne Landscape Supply,RMD,3,1,31,2018,Apr,RMD-2018-04-18,8,1,1,"Adelphia, NJ"
31,Turf Quality,5/10/18,6,31,NAI-15-80,SiteOne Landscape Supply,RON,3,1,31,2018,May,RON-2018-05-10,13,6,1,"Adelphia, NJ"
31,Turf Quality,6/7/18,6,31,NAI-15-80,SiteOne Landscape Supply,RON,3,1,31,2018,Jun,RON-2018-06-07,14,4,1,"Adelphia, NJ"
31,Turf Quality,7/17/18,6,31,NAI-15-80,SiteOne Landscape Supply,RON,3,1,31,2018,Jul,RON-2018-07-17,15,3,1,"Adelphia, NJ"
31,Turf Quality,8/15/18,5,31,NAI-15-80,SiteOne Landscape Supply,RMD,3,1,31,2018,Aug,RMD-2018-08-15,9,2,1,"Adelphia, NJ"
31,Turf Quality,9/12/18,4,31,NAI-15-80,SiteOne Landscape Supply,RON,3,1,31,2018,Sep,RON-2018-09-12,16,9,1,"Adelphia, NJ"
31,Turf Quality,10/2/18,4,31,NAI-15-80,SiteOne Landscape Supply,RON,3,1,31,2018,Oct,RON-2018-10-02,17,8,1,"Adelphia, NJ"
31,Turf Quality,11/9/18,5,31,NAI-15-80,SiteOne Landscape Supply,RON,3,1,31,2018,Nov,RON-2018-11-09,18,7,1,"Adelphia, NJ"
31,Turf Quality,4/17/19,2,31,NAI-15-80,SiteOne Landscape Supply,RON,3,1,31,2019,Apr,RON-2019-04-17,19,1,2,"Adelphia, NJ"
31,Turf Quality,5/2/19,2,31,NAI-15-80,SiteOne Landscape Supply,RON,3,1,31,2019,May,RON-2019-05-02,20,6,2,"Adelphia, NJ"
31,Turf Quality,6/13/19,4,31,NAI-15-80,SiteOne Landscape Supply,RON,3,1,31,2019,Jun,RON-2019-06-13,21,4,2,"Adelphia, NJ"
31,Turf Quality,6/17/19,5,31,NAI-15-80,SiteOne Landscape Supply,SAB,3,1,31,2019,Jun,SAB-2019-06-17,25,4,2,"Adelphia, NJ"
31,Turf Quality,7/17/19,4,31,NAI-15-80,SiteOne Landscape Supply,RON,3,1,31,2019,Jul,RON-2019-07-17,22,3,2,"Adelphia, NJ"
31,Turf Quality,8/22/19,6,31,NAI-15-80,SiteOne Landscape Supply,SAB,3,1,31,2019,Aug,SAB-2019-08-22,26,2,2,"Adelphia, NJ"
31,Turf Quality,9/16/19,5,31,NAI-15-80,SiteOne Landscape Supply,RON,3,1,31,2019,Sep,RON-2019-09-16,23,9,2,"Adelphia, NJ"
31,Turf Quality,10/10/19,3,31,NAI-15-80,SiteOne Landscape Supply,SAB,3,1,31,2019,Oct,SAB-2019-10-10,27,8,2,"Adelphia, NJ"
31,Turf Quality,11/1/19,4,31,NAI-15-80,SiteOne Landscape Supply,RON,3,1,31,2019,Nov,RON-2019-11-01,24,7,2,"Adelphia, NJ"
31,Turf Quality,4/28/20,5,31,NAI-15-80,SiteOne Landscape Supply,WAM,3,1,31,2020,Apr,WAM-2020-04-28,31,1,3,"Adelphia, NJ"
31,Turf Quality,5/18/20,4,31,NAI-15-80,SiteOne Landscape Supply,SAB,3,1,31,2020,May,SAB-2020-05-18,28,6,3,"Adelphia, NJ"
31,Turf Quality,6/17/20,5,31,NAI-15-80,SiteOne Landscape Supply,WAM,3,1,31,2020,Jun,WAM-2020-06-17,32,4,3,"Adelphia, NJ"
31,Turf Quality,7/15/20,6,31,NAI-15-80,SiteOne Landscape Supply,WAM,3,1,31,2020,Jul,WAM-2020-07-15,33,3,3,"Adelphia, NJ"
31,Turf Quality,8/6/20,6,31,NAI-15-80,SiteOne Landscape Supply,PLV,3,1,31,2020,Aug,PLV-2020-08-06,5,2,3,"Adelphia, NJ"
31,Turf Quality,9/2/20,4,31,NAI-15-80,SiteOne Landscape Supply,DAS,3,1,31,2020,Sep,DAS-2020-09-02,1,9,3,"Adelphia, NJ"
31,Turf Quality,10/15/20,1,31,NAI-15-80,SiteOne Landscape Supply,WAM,3,1,31,2020,Oct,WAM-2020-10-15,34,8,3,"Adelphia, NJ"
31,Turf Quality,11/5/20,5,31,NAI-15-80,SiteOne Landscape Supply,WAM,3,1,31,2020,Nov,WAM-2020-11-05,35,7,3,"Adelphia, NJ"
31,Turf Quality,10/15/20,2,31,NAI-15-80,SiteOne Landscape Supply,RMD,3,1,31,2020,Oct,RMD-2020-10-15,10,8,3,"Adelphia, NJ"
31,Turf Quality,10/23/20,2,31,NAI-15-80,SiteOne Landscape Supply,RMD,3,1,31,2020,Oct,RMD-2020-10-23,11,8,3,"Adelphia, NJ"
31,Turf Quality,3/30/21,3,31,NAI-15-80,SiteOne Landscape Supply,RMD,3,1,31,2021,Mar,RMD-2021-03-30,12,5,4,"Adelphia, NJ"
31,Turf Quality,4/22/21,4,31,NAI-15-80,SiteOne Landscape Supply,PLV,3,1,31,2021,Apr,PLV-2021-04-22,6,1,4,"Adelphia, NJ"
31,Turf Quality,5/28/21,4,31,NAI-15-80,SiteOne Landscape Supply,SAB,3,1,31,2021,May,SAB-2021-05-28,29,6,4,"Adelphia, NJ"
31,Turf Quality,6/11/21,5,31,NAI-15-80,SiteOne Landscape Supply,JEN,3,1,31,2021,Jun,JEN-2021-06-11,2,4,4,"Adelphia, NJ"
31,Turf Quality,7/13/21,4,31,NAI-15-80,SiteOne Landscape Supply,PLV,3,1,31,2021,Jul,PLV-2021-07-13,7,3,4,"Adelphia, NJ"
31,Turf Quality,8/11/21,5,31,NAI-15-80,SiteOne Landscape Supply,JEN,3,1,31,2021,Aug,JEN-2021-08-11,3,2,4,"Adelphia, NJ"
31,Turf Quality,9/17/21,3,31,NAI-15-80,SiteOne Landscape Supply,JEN,3,1,31,2021,Sep,JEN-2021-09-17,4,9,4,"Adelphia, NJ"
31,Turf Quality,10/13/21,4,31,NAI-15-80,SiteOne Landscape Supply,SAB,3,1,31,2021,Oct,SAB-2021-10-13,30,8,4,"Adelphia, NJ"
31,Turf Quality,11/18/21,4,31,NAI-15-80,SiteOne Landscape Supply,WAM,3,1,31,2021,Nov,WAM-2021-11-18,36,7,4,"Adelphia, NJ"
30,Turf Quality,4/18/18,4,30,Twilight (NAI-13-132),SiteOne Landscape Supply,RMD,2,1,30,2018,Apr,RMD-2018-04-18,8,1,1,"Adelphia, NJ"
30,Turf Quality,5/10/18,6,30,Twilight (NAI-13-132),SiteOne Landscape Supply,RON,2,1,30,2018,May,RON-2018-05-10,13,6,1,"Adelphia, NJ"
30,Turf Quality,6/7/18,8,30,Twilight (NAI-13-132),SiteOne Landscape Supply,RON,2,1,30,2018,Jun,RON-2018-06-07,14,4,1,"Adelphia, NJ"
30,Turf Quality,7/17/18,6,30,Twilight (NAI-13-132),SiteOne Landscape Supply,RON,2,1,30,2018,Jul,RON-2018-07-17,15,3,1,"Adelphia, NJ"
30,Turf Quality,8/15/18,4,30,Twilight (NAI-13-132),SiteOne Landscape Supply,RMD,2,1,30,2018,Aug,RMD-2018-08-15,9,2,1,"Adelphia, NJ"
30,Turf Quality,9/12/18,6,30,Twilight (NAI-13-132),SiteOne Landscape Supply,RON,2,1,30,2018,Sep,RON-2018-09-12,16,9,1,"Adelphia, NJ"
30,Turf Quality,10/2/18,6,30,Twilight (NAI-13-132),SiteOne Landscape Supply,RON,2,1,30,2018,Oct,RON-2018-10-02,17,8,1,"Adelphia, NJ"
30,Turf Quality,11/9/18,6,30,Twilight (NAI-13-132),SiteOne Landscape Supply,RON,2,1,30,2018,Nov,RON-2018-11-09,18,7,1,"Adelphia, NJ"
30,Turf Quality,4/17/19,3,30,Twilight (NAI-13-132),SiteOne Landscape Supply,RON,2,1,30,2019,Apr,RON-2019-04-17,19,1,2,"Adelphia, NJ"
30,Turf Quality,5/2/19,4,30,Twilight (NAI-13-132),SiteOne Landscape Supply,RON,2,1,30,2019,May,RON-2019-05-02,20,6,2,"Adelphia, NJ"
30,Turf Quality,6/13/19,4,30,Twilight (NAI-13-132),SiteOne Landscape Supply,RON,2,1,30,2019,Jun,RON-2019-06-13,21,4,2,"Adelphia, NJ"
30,Turf Quality,6/17/19,2,30,Twilight (NAI-13-132),SiteOne Landscape Supply,SAB,2,1,30,2019,Jun,SAB-2019-06-17,25,4,2,"Adelphia, NJ"
30,Turf Quality,7/17/19,4,30,Twilight (NAI-13-132),SiteOne Landscape Supply,RON,2,1,30,2019,Jul,RON-2019-07-17,22,3,2,"Adelphia, NJ"
30,Turf Quality,8/22/19,5,30,Twilight (NAI-13-132),SiteOne Landscape Supply,SAB,2,1,30,2019,Aug,SAB-2019-08-22,26,2,2,"Adelphia, NJ"
30,Turf Quality,9/16/19,7,30,Twilight (NAI-13-132),SiteOne Landscape Supply,RON,2,1,30,2019,Sep,RON-2019-09-16,23,9,2,"Adelphia, NJ"
30,Turf Quality,10/10/19,3,30,Twilight (NAI-13-132),SiteOne Landscape Supply,SAB,2,1,30,2019,Oct,SAB-2019-10-10,27,8,2,"Adelphia, NJ"
30,Turf Quality,11/1/19,5,30,Twilight (NAI-13-132),SiteOne Landscape Supply,RON,2,1,30,2019,Nov,RON-2019-11-01,24,7,2,"Adelphia, NJ"
30,Turf Quality,4/28/20,4,30,Twilight (NAI-13-132),SiteOne Landscape Supply,WAM,2,1,30,2020,Apr,WAM-2020-04-28,31,1,3,"Adelphia, NJ"
30,Turf Quality,5/18/20,1,30,Twilight (NAI-13-132),SiteOne Landscape Supply,SAB,2,1,30,2020,May,SAB-2020-05-18,28,6,3,"Adelphia, NJ"
30,Turf Quality,6/17/20,6,30,Twilight (NAI-13-132),SiteOne Landscape Supply,WAM,2,1,30,2020,Jun,WAM-2020-06-17,32,4,3,"Adelphia, NJ"
30,Turf Quality,7/15/20,7,30,Twilight (NAI-13-132),SiteOne Landscape Supply,WAM,2,1,30,2020,Jul,WAM-2020-07-15,33,3,3,"Adelphia, NJ"
30,Turf Quality,8/6/20,6,30,Twilight (NAI-13-132),SiteOne Landscape Supply,PLV,2,1,30,2020,Aug,PLV-2020-08-06,5,2,3,"Adelphia, NJ"
30,Turf Quality,9/2/20,4,30,Twilight (NAI-13-132),SiteOne Landscape Supply,DAS,2,1,30,2020,Sep,DAS-2020-09-02,1,9,3,"Adelphia, NJ"
30,Turf Quality,10/15/20,2,30,Twilight (NAI-13-132),SiteOne Landscape Supply,WAM,2,1,30,2020,Oct,WAM-2020-10-15,34,8,3,"Adelphia, NJ"
30,Turf Quality,11/5/20,3,30,Twilight (NAI-13-132),SiteOne Landscape Supply,WAM,2,1,30,2020,Nov,WAM-2020-11-05,35,7,3,"Adelphia, NJ"
30,Turf Quality,10/15/20,3,30,Twilight (NAI-13-132),SiteOne Landscape Supply,RMD,2,1,30,2020,Oct,RMD-2020-10-15,10,8,3,"Adelphia, NJ"
30,Turf Quality,10/23/20,3,30,Twilight (NAI-13-132),SiteOne Landscape Supply,RMD,2,1,30,2020,Oct,RMD-2020-10-23,11,8,3,"Adelphia, NJ"
30,Turf Quality,3/30/21,3,30,Twilight (NAI-13-132),SiteOne Landscape Supply,RMD,2,1,30,2021,Mar,RMD-2021-03-30,12,5,4,"Adelphia, NJ"
30,Turf Quality,4/22/21,4,30,Twilight (NAI-13-132),SiteOne Landscape Supply,PLV,2,1,30,2021,Apr,PLV-2021-04-22,6,1,4,"Adelphia, NJ"
30,Turf Quality,5/28/21,4,30,Twilight (NAI-13-132),SiteOne Landscape Supply,SAB,2,1,30,2021,May,SAB-2021-05-28,29,6,4,"Adelphia, NJ"
30,Turf Quality,6/11/21,6,30,Twilight (NAI-13-132),SiteOne Landscape Supply,JEN,2,1,30,2021,Jun,JEN-2021-06-11,2,4,4,"Adelphia, NJ"
30,Turf Quality,7/13/21,6,30,Twilight (NAI-13-132),SiteOne Landscape Supply,PLV,2,1,30,2021,Jul,PLV-2021-07-13,7,3,4,"Adelphia, NJ"
30,Turf Quality,8/11/21,6,30,Twilight (NAI-13-132),SiteOne Landscape Supply,JEN,2,1,30,2021,Aug,JEN-2021-08-11,3,2,4,"Adelphia, NJ"
30,Turf Quality,9/17/21,5,30,Twilight (NAI-13-132),SiteOne Landscape Supply,JEN,2,1,30,2021,Sep,JEN-2021-09-17,4,9,4,"Adelphia, NJ"
30,Turf Quality,10/13/21,4,30,Twilight (NAI-13-132),SiteOne Landscape Supply,SAB,2,1,30,2021,Oct,SAB-2021-10-13,30,8,4,"Adelphia, NJ"
30,Turf Quality,11/18/21,4,30,Twilight (NAI-13-132),SiteOne Landscape Supply,WAM,2,1,30,2021,Nov,WAM-2021-11-18,36,7,4,"Adelphia, NJ"
1,Turf Quality,4/18/18,7,1,A11-40,Landmark Turf & Native Seed,RMD,1,1,1,2018,Apr,RMD-2018-04-18,8,1,1,"Adelphia, NJ"
1,Turf Quality,5/10/18,8,1,A11-40,Landmark Turf & Native Seed,RON,1,1,1,2018,May,RON-2018-05-10,13,6,1,"Adelphia, NJ"
1,Turf Quality,6/7/18,6,1,A11-40,Landmark Turf & Native Seed,RON,1,1,1,2018,Jun,RON-2018-06-07,14,4,1,"Adelphia, NJ"
1,Turf Quality,7/17/18,7,1,A11-40,Landmark Turf & Native Seed,RON,1,1,1,2018,Jul,RON-2018-07-17,15,3,1,"Adelphia, NJ"
1,Turf Quality,8/15/18,6,1,A11-40,Landmark Turf & Native Seed,RMD,1,1,1,2018,Aug,RMD-2018-08-15,9,2,1,"Adelphia, NJ"
1,Turf Quality,9/12/18,5,1,A11-40,Landmark Turf & Native Seed,RON,1,1,1,2018,Sep,RON-2018-09-12,16,9,1,"Adelphia, NJ"
1,Turf Quality,10/2/18,4,1,A11-40,Landmark Turf & Native Seed,RON,1,1,1,2018,Oct,RON-2018-10-02,17,8,1,"Adelphia, NJ"
1,Turf Quality,11/9/18,3,1,A11-40,Landmark Turf & Native Seed,RON,1,1,1,2018,Nov,RON-2018-11-09,18,7,1,"Adelphia, NJ"
1,Turf Quality,4/17/19,4,1,A11-40,Landmark Turf & Native Seed,RON,1,1,1,2019,Apr,RON-2019-04-17,19,1,2,"Adelphia, NJ"
1,Turf Quality,5/2/19,4,1,A11-40,Landmark Turf & Native Seed,RON,1,1,1,2019,May,RON-2019-05-02,20,6,2,"Adelphia, NJ"
1,Turf Quality,6/13/19,5,1,A11-40,Landmark Turf & Native Seed,RON,1,1,1,2019,Jun,RON-2019-06-13,21,4,2,"Adelphia, NJ"
1,Turf Quality,6/17/19,5,1,A11-40,Landmark Turf & Native Seed,SAB,1,1,1,2019,Jun,SAB-2019-06-17,25,4,2,"Adelphia, NJ"
1,Turf Quality,7/17/19,6,1,A11-40,Landmark Turf & Native Seed,RON,1,1,1,2019,Jul,RON-2019-07-17,22,3,2,"Adelphia, NJ"
1,Turf Quality,8/22/19,7,1,A11-40,Landmark Turf & Native Seed,SAB,1,1,1,2019,Aug,SAB-2019-08-22,26,2,2,"Adelphia, NJ"
1,Turf Quality,9/16/19,7,1,A11-40,Landmark Turf & Native Seed,RON,1,1,1,2019,Sep,RON-2019-09-16,23,9,2,"Adelphia, NJ"
1,Turf Quality,10/10/19,6,1,A11-40,Landmark Turf & Native Seed,SAB,1,1,1,2019,Oct,SAB-2019-10-10,27,8,2,"Adelphia, NJ"
1,Turf Quality,11/1/19,7,1,A11-40,Landmark Turf & Native Seed,RON,1,1,1,2019,Nov,RON-2019-11-01,24,7,2,"Adelphia, NJ"
1,Turf Quality,4/28/20,6,1,A11-40,Landmark Turf & Native Seed,WAM,1,1,1,2020,Apr,WAM-2020-04-28,31,1,3,"Adelphia, NJ"
1,Turf Quality,5/18/20,9,1,A11-40,Landmark Turf & Native Seed,SAB,1,1,1,2020,May,SAB-2020-05-18,28,6,3,"Adelphia, NJ"
1,Turf Quality,6/17/20,4,1,A11-40,Landmark Turf & Native Seed,WAM,1,1,1,2020,Jun,WAM-2020-06-17,32,4,3,"Adelphia, NJ"
1,Turf Quality,7/15/20,6,1,A11-40,Landmark Turf & Native Seed,WAM,1,1,1,2020,Jul,WAM-2020-07-15,33,3,3,"Adelphia, NJ"
1,Turf Quality,8/6/20,5,1,A11-40,Landmark Turf & Native Seed,PLV,1,1,1,2020,Aug,PLV-2020-08-06,5,2,3,"Adelphia, NJ"
1,Turf Quality,9/2/20,5,1,A11-40,Landmark Turf & Native Seed,DAS,1,1,1,2020,Sep,DAS-2020-09-02,1,9,3,"Adelphia, NJ"
1,Turf Quality,10/15/20,4,1,A11-40,Landmark Turf & Native Seed,WAM,1,1,1,2020,Oct,WAM-2020-10-15,34,8,3,"Adelphia, NJ"
1,Turf Quality,11/5/20,5,1,A11-40,Landmark Turf & Native Seed,WAM,1,1,1,2020,Nov,WAM-2020-11-05,35,7,3,"Adelphia, NJ"
1,Turf Quality,10/15/20,4,1,A11-40,Landmark Turf & Native Seed,RMD,1,1,1,2020,Oct,RMD-2020-10-15,10,8,3,"Adelphia, NJ"
1,Turf Quality,10/23/20,4,1,A11-40,Landmark Turf & Native Seed,RMD,1,1,1,2020,Oct,RMD-2020-10-23,11,8,3,"Adelphia, NJ"
1,Turf Quality,3/30/21,4,1,A11-40,Landmark Turf & Native Seed,RMD,1,1,1,2021,Mar,RMD-2021-03-30,12,5,4,"Adelphia, NJ"
1,Turf Quality,4/22/21,6,1,A11-40,Landmark Turf & Native Seed,PLV,1,1,1,2021,Apr,PLV-2021-04-22,6,1,4,"Adelphia, NJ"
1,Turf Quality,5/28/21,7,1,A11-40,Landmark Turf & Native Seed,SAB,1,1,1,2021,May,SAB-2021-05-28,29,6,4,"Adelphia, NJ"
1,Turf Quality,6/11/21,6,1,A11-40,Landmark Turf & Native Seed,JEN,1,1,1,2021,Jun,JEN-2021-06-11,2,4,4,"Adelphia, NJ"
1,Turf Quality,7/13/21,6,1,A11-40,Landmark Turf & Native Seed,PLV,1,1,1,2021,Jul,PLV-2021-07-13,7,3,4,"Adelphia, NJ"
1,Turf Quality,8/11/21,5,1,A11-40,Landmark Turf & Native Seed,JEN,1,1,1,2021,Aug,JEN-2021-08-11,3,2,4,"Adelphia, NJ"
1,Turf Quality,9/17/21,4,1,A11-40,Landmark Turf & Native Seed,JEN,1,1,1,2021,Sep,JEN-2021-09-17,4,9,4,"Adelphia, NJ"
1,Turf Quality,10/13/21,5,1,A11-40,Landmark Turf & Native Seed,SAB,1,1,1,2021,Oct,SAB-2021-10-13,30,8,4,"Adelphia, NJ"
1,Turf Quality,11/18/21,4,1,A11-40,Landmark Turf & Native Seed,WAM,1,1,1,2021,Nov,WAM-2021-11-18,36,7,4,"Adelphia, NJ"
269,Turf Quality,4/18/18,7,71,A10-280,Mountain View Seeds,RMD,18,2,267,2018,Apr,RMD-2018-04-18,8,1,1,"Adelphia, NJ"
269,Turf Quality,5/10/18,7,71,A10-280,Mountain View Seeds,RON,18,2,267,2018,May,RON-2018-05-10,13,6,1,"Adelphia, NJ"
269,Turf Quality,6/7/18,6,71,A10-280,Mountain View Seeds,RON,18,2,267,2018,Jun,RON-2018-06-07,14,4,1,"Adelphia, NJ"
269,Turf Quality,7/17/18,7,71,A10-280,Mountain View Seeds,RON,18,2,267,2018,Jul,RON-2018-07-17,15,3,1,"Adelphia, NJ"
269,Turf Quality,8/15/18,7,71,A10-280,Mountain View Seeds,RMD,18,2,267,2018,Aug,RMD-2018-08-15,9,2,1,"Adelphia, NJ"
269,Turf Quality,9/12/18,8,71,A10-280,Mountain View Seeds,RON,18,2,267,2018,Sep,RON-2018-09-12,16,9,1,"Adelphia, NJ"
269,Turf Quality,10/2/18,7,71,A10-280,Mountain View Seeds,RON,18,2,267,2018,Oct,RON-2018-10-02,17,8,1,"Adelphia, NJ"
269,Turf Quality,11/9/18,6,71,A10-280,Mountain View Seeds,RON,18,2,267,2018,Nov,RON-2018-11-09,18,7,1,"Adelphia, NJ"
269,Turf Quality,4/17/19,6,71,A10-280,Mountain View Seeds,RON,18,2,267,2019,Apr,RON-2019-04-17,19,1,2,"Adelphia, NJ"
269,Turf Quality,5/2/19,4,71,A10-280,Mountain View Seeds,RON,18,2,267,2019,May,RON-2019-05-02,20,6,2,"Adelphia, NJ"
269,Turf Quality,6/13/19,5,71,A10-280,Mountain View Seeds,RON,18,2,267,2019,Jun,RON-2019-06-13,21,4,2,"Adelphia, NJ"
269,Turf Quality,6/17/19,4,71,A10-280,Mountain View Seeds,SAB,18,2,267,2019,Jun,SAB-2019-06-17,25,4,2,"Adelphia, NJ"
269,Turf Quality,7/17/19,5,71,A10-280,Mountain View Seeds,RON,18,2,267,2019,Jul,RON-2019-07-17,22,3,2,"Adelphia, NJ"
269,Turf Quality,8/22/19,5,71,A10-280,Mountain View Seeds,SAB,18,2,267,2019,Aug,SAB-2019-08-22,26,2,2,"Adelphia, NJ"
269,Turf Quality,9/16/19,6,71,A10-280,Mountain View Seeds,RON,18,2,267,2019,Sep,RON-2019-09-16,23,9,2,"Adelphia, NJ"
269,Turf Quality,10/10/19,4,71,A10-280,Mountain View Seeds,SAB,18,2,267,2019,Oct,SAB-2019-10-10,27,8,2,"Adelphia, NJ"
269,Turf Quality,11/1/19,4,71,A10-280,Mountain View Seeds,RON,18,2,267,2019,Nov,RON-2019-11-01,24,7,2,"Adelphia, NJ"
269,Turf Quality,4/28/20,4,71,A10-280,Mountain View Seeds,WAM,18,2,267,2020,Apr,WAM-2020-04-28,31,1,3,"Adelphia, NJ"
269,Turf Quality,5/18/20,5,71,A10-280,Mountain View Seeds,SAB,18,2,267,2020,May,SAB-2020-05-18,28,6,3,"Adelphia, NJ"
269,Turf Quality,6/17/20,5,71,A10-280,Mountain View Seeds,WAM,18,2,267,2020,Jun,WAM-2020-06-17,32,4,3,"Adelphia, NJ"
269,Turf Quality,7/15/20,4,71,A10-280,Mountain View Seeds,WAM,18,2,267,2020,Jul,WAM-2020-07-15,33,3,3,"Adelphia, NJ"
269,Turf Quality,8/6/20,6,71,A10-280,Mountain View Seeds,PLV,18,2,267,2020,Aug,PLV-2020-08-06,5,2,3,"Adelphia, NJ"
269,Turf Quality,9/2/20,8,71,A10-280,Mountain View Seeds,DAS,18,2,267,2020,Sep,DAS-2020-09-02,1,9,3,"Adelphia, NJ"
269,Turf Quality,10/15/20,5,71,A10-280,Mountain View Seeds,WAM,18,2,267,2020,Oct,WAM-2020-10-15,34,8,3,"Adelphia, NJ"
269,Turf Quality,11/5/20,6,71,A10-280,Mountain View Seeds,WAM,18,2,267,2020,Nov,WAM-2020-11-05,35,7,3,"Adelphia, NJ"
269,Turf Quality,10/15/20,7,71,A10-280,Mountain View Seeds,RMD,18,2,267,2020,Oct,RMD-2020-10-15,10,8,3,"Adelphia, NJ"
269,Turf Quality,10/23/20,6,71,A10-280,Mountain View Seeds,RMD,18,2,267,2020,Oct,RMD-2020-10-23,11,8,3,"Adelphia, NJ"
269,Turf Quality,3/30/21,6,71,A10-280,Mountain View Seeds,RMD,18,2,267,2021,Mar,RMD-2021-03-30,12,5,4,"Adelphia, NJ"
269,Turf Quality,4/22/21,4,71,A10-280,Mountain View Seeds,PLV,18,2,267,2021,Apr,PLV-2021-04-22,6,1,4,"Adelphia, NJ"
269,Turf Quality,5/28/21,4,71,A10-280,Mountain View Seeds,SAB,18,2,267,2021,May,SAB-2021-05-28,29,6,4,"Adelphia, NJ"
269,Turf Quality,6/11/21,4,71,A10-280,Mountain View Seeds,JEN,18,2,267,2021,Jun,JEN-2021-06-11,2,4,4,"Adelphia, NJ"
269,Turf Quality,7/13/21,5,71,A10-280,Mountain View Seeds,PLV,18,2,267,2021,Jul,PLV-2021-07-13,7,3,4,"Adelphia, NJ"
269,Turf Quality,8/11/21,3,71,A10-280,Mountain View Seeds,JEN,18,2,267,2021,Aug,JEN-2021-08-11,3,2,4,"Adelphia, NJ"
269,Turf Quality,9/17/21,5,71,A10-280,Mountain View Seeds,JEN,18,2,267,2021,Sep,JEN-2021-09-17,4,9,4,"Adelphia, NJ"
269,Turf Quality,10/13/21,3,71,A10-280,Mountain View Seeds,SAB,18,2,267,2021,Oct,SAB-2021-10-13,30,8,4,"Adelphia, NJ"
269,Turf Quality,11/18/21,4,71,A10-280,Mountain View Seeds,WAM,18,2,267,2021,Nov,WAM-2021-11-18,36,7,4,"Adelphia, NJ"
242,Turf Quality,4/18/18,4,78,A06-8,Blue Mt. Seeds Inc.,RMD,17,2,240,2018,Apr,RMD-2018-04-18,8,1,1,"Adelphia, NJ"
242,Turf Quality,5/10/18,5,78,A06-8,Blue Mt. Seeds Inc.,RON,17,2,240,2018,May,RON-2018-05-10,13,6,1,"Adelphia, NJ"
242,Turf Quality,6/7/18,5,78,A06-8,Blue Mt. Seeds Inc.,RON,17,2,240,2018,Jun,RON-2018-06-07,14,4,1,"Adelphia, NJ"
242,Turf Quality,7/17/18,6,78,A06-8,Blue Mt. Seeds Inc.,RON,17,2,240,2018,Jul,RON-2018-07-17,15,3,1,"Adelphia, NJ"
242,Turf Quality,8/15/18,7,78,A06-8,Blue Mt. Seeds Inc.,RMD,17,2,240,2018,Aug,RMD-2018-08-15,9,2,1,"Adelphia, NJ"
242,Turf Quality,9/12/18,5,78,A06-8,Blue Mt. Seeds Inc.,RON,17,2,240,2018,Sep,RON-2018-09-12,16,9,1,"Adelphia, NJ"
242,Turf Quality,10/2/18,6,78,A06-8,Blue Mt. Seeds Inc.,RON,17,2,240,2018,Oct,RON-2018-10-02,17,8,1,"Adelphia, NJ"
242,Turf Quality,11/9/18,7,78,A06-8,Blue Mt. Seeds Inc.,RON,17,2,240,2018,Nov,RON-2018-11-09,18,7,1,"Adelphia, NJ"
242,Turf Quality,4/17/19,5,78,A06-8,Blue Mt. Seeds Inc.,RON,17,2,240,2019,Apr,RON-2019-04-17,19,1,2,"Adelphia, NJ"
242,Turf Quality,5/2/19,5,78,A06-8,Blue Mt. Seeds Inc.,RON,17,2,240,2019,May,RON-2019-05-02,20,6,2,"Adelphia, NJ"
242,Turf Quality,6/13/19,6,78,A06-8,Blue Mt. Seeds Inc.,RON,17,2,240,2019,Jun,RON-2019-06-13,21,4,2,"Adelphia, NJ"
242,Turf Quality,6/17/19,7,78,A06-8,Blue Mt. Seeds Inc.,SAB,17,2,240,2019,Jun,SAB-2019-06-17,25,4,2,"Adelphia, NJ"
242,Turf Quality,7/17/19,6,78,A06-8,Blue Mt. Seeds Inc.,RON,17,2,240,2019,Jul,RON-2019-07-17,22,3,2,"Adelphia, NJ"
242,Turf Quality,8/22/19,4,78,A06-8,Blue Mt. Seeds Inc.,SAB,17,2,240,2019,Aug,SAB-2019-08-22,26,2,2,"Adelphia, NJ"
242,Turf Quality,9/16/19,4,78,A06-8,Blue Mt. Seeds Inc.,RON,17,2,240,2019,Sep,RON-2019-09-16,23,9,2,"Adelphia, NJ"
242,Turf Quality,10/10/19,4,78,A06-8,Blue Mt. Seeds Inc.,SAB,17,2,240,2019,Oct,SAB-2019-10-10,27,8,2,"Adelphia, NJ"
242,Turf Quality,11/1/19,3,78,A06-8,Blue Mt. Seeds Inc.,RON,17,2,240,2019,Nov,RON-2019-11-01,24,7,2,"Adelphia, NJ"
242,Turf Quality,4/28/20,4,78,A06-8,Blue Mt. Seeds Inc.,WAM,17,2,240,2020,Apr,WAM-2020-04-28,31,1,3,"Adelphia, NJ"
242,Turf Quality,5/18/20,4,78,A06-8,Blue Mt. Seeds Inc.,SAB,17,2,240,2020,May,SAB-2020-05-18,28,6,3,"Adelphia, NJ"
242,Turf Quality,6/17/20,5,78,A06-8,Blue Mt. Seeds Inc.,WAM,17,2,240,2020,Jun,WAM-2020-06-17,32,4,3,"Adelphia, NJ"
242,Turf Quality,7/15/20,4,78,A06-8,Blue Mt. Seeds Inc.,WAM,17,2,240,2020,Jul,WAM-2020-07-15,33,3,3,"Adelphia, NJ"
242,Turf Quality,8/6/20,4,78,A06-8,Blue Mt. Seeds Inc.,PLV,17,2,240,2020,Aug,PLV-2020-08-06,5,2,3,"Adelphia, NJ"
242,Turf Quality,9/2/20,2,78,A06-8,Blue Mt. Seeds Inc.,DAS,17,2,240,2020,Sep,DAS-2020-09-02,1,9,3,"Adelphia, NJ"
242,Turf Quality,10/15/20,1,78,A06-8,Blue Mt. Seeds Inc.,WAM,17,2,240,2020,Oct,WAM-2020-10-15,34,8,3,"Adelphia, NJ"
242,Turf Quality,11/5/20,2,78,A06-8,Blue Mt. Seeds Inc.,WAM,17,2,240,2020,Nov,WAM-2020-11-05,35,7,3,"Adelphia, NJ"
242,Turf Quality,10/15/20,2,78,A06-8,Blue Mt. Seeds Inc.,RMD,17,2,240,2020,Oct,RMD-2020-10-15,10,8,3,"Adelphia, NJ"
242,Turf Quality,10/23/20,2,78,A06-8,Blue Mt. Seeds Inc.,RMD,17,2,240,2020,Oct,RMD-2020-10-23,11,8,3,"Adelphia, NJ"
242,Turf Quality,3/30/21,2,78,A06-8,Blue Mt. Seeds Inc.,RMD,17,2,240,2021,Mar,RMD-2021-03-30,12,5,4,"Adelphia, NJ"
242,Turf Quality,4/22/21,1,78,A06-8,Blue Mt. Seeds Inc.,PLV,17,2,240,2021,Apr,PLV-2021-04-22,6,1,4,"Adelphia, NJ"
242,Turf Quality,5/28/21,2,78,A06-8,Blue Mt. Seeds Inc.,SAB,17,2,240,2021,May,SAB-2021-05-28,29,6,4,"Adelphia, NJ"
242,Turf Quality,6/11/21,3,78,A06-8,Blue Mt. Seeds Inc.,JEN,17,2,240,2021,Jun,JEN-2021-06-11,2,4,4,"Adelphia, NJ"
242,Turf Quality,7/13/21,5,78,A06-8,Blue Mt. Seeds Inc.,PLV,17,2,240,2021,Jul,PLV-2021-07-13,7,3,4,"Adelphia, NJ"
242,Turf Quality,8/11/21,4,78,A06-8,Blue Mt. Seeds Inc.,JEN,17,2,240,2021,Aug,JEN-2021-08-11,3,2,4,"Adelphia, NJ"
242,Turf Quality,9/17/21,3,78,A06-8,Blue Mt. Seeds Inc.,JEN,17,2,240,2021,Sep,JEN-2021-09-17,4,9,4,"Adelphia, NJ"
242,Turf Quality,10/13/21,2,78,A06-8,Blue Mt. Seeds Inc.,SAB,17,2,240,2021,Oct,SAB-2021-10-13,30,8,4,"Adelphia, NJ"
242,Turf Quality,11/18/21,4,78,A06-8,Blue Mt. Seeds Inc.,WAM,17,2,240,2021,Nov,WAM-2021-11-18,36,7,4,"Adelphia, NJ"
239,Turf Quality,4/18/18,1,49,DLFPS-340/3364,DLF Pickseed USA,RMD,16,2,237,2018,Apr,RMD-2018-04-18,8,1,1,"Adelphia, NJ"
239,Turf Quality,5/10/18,2,49,DLFPS-340/3364,DLF Pickseed USA,RON,16,2,237,2018,May,RON-2018-05-10,13,6,1,"Adelphia, NJ"
239,Turf Quality,6/7/18,3,49,DLFPS-340/3364,DLF Pickseed USA,RON,16,2,237,2018,Jun,RON-2018-06-07,14,4,1,"Adelphia, NJ"
239,Turf Quality,7/17/18,3,49,DLFPS-340/3364,DLF Pickseed USA,RON,16,2,237,2018,Jul,RON-2018-07-17,15,3,1,"Adelphia, NJ"
239,Turf Quality,8/15/18,3,49,DLFPS-340/3364,DLF Pickseed USA,RMD,16,2,237,2018,Aug,RMD-2018-08-15,9,2,1,"Adelphia, NJ"
239,Turf Quality,9/12/18,3,49,DLFPS-340/3364,DLF Pickseed USA,RON,16,2,237,2018,Sep,RON-2018-09-12,16,9,1,"Adelphia, NJ"
239,Turf Quality,10/2/18,4,49,DLFPS-340/3364,DLF Pickseed USA,RON,16,2,237,2018,Oct,RON-2018-10-02,17,8,1,"Adelphia, NJ"
239,Turf Quality,11/9/18,3,49,DLFPS-340/3364,DLF Pickseed USA,RON,16,2,237,2018,Nov,RON-2018-11-09,18,7,1,"Adelphia, NJ"
239,Turf Quality,4/17/19,3,49,DLFPS-340/3364,DLF Pickseed USA,RON,16,2,237,2019,Apr,RON-2019-04-17,19,1,2,"Adelphia, NJ"
239,Turf Quality,5/2/19,3,49,DLFPS-340/3364,DLF Pickseed USA,RON,16,2,237,2019,May,RON-2019-05-02,20,6,2,"Adelphia, NJ"
239,Turf Quality,6/13/19,5,49,DLFPS-340/3364,DLF Pickseed USA,RON,16,2,237,2019,Jun,RON-2019-06-13,21,4,2,"Adelphia, NJ"
239,Turf Quality,6/17/19,4,49,DLFPS-340/3364,DLF Pickseed USA,SAB,16,2,237,2019,Jun,SAB-2019-06-17,25,4,2,"Adelphia, NJ"
239,Turf Quality,7/17/19,4,49,DLFPS-340/3364,DLF Pickseed USA,RON,16,2,237,2019,Jul,RON-2019-07-17,22,3,2,"Adelphia, NJ"
239,Turf Quality,8/22/19,4,49,DLFPS-340/3364,DLF Pickseed USA,SAB,16,2,237,2019,Aug,SAB-2019-08-22,26,2,2,"Adelphia, NJ"
239,Turf Quality,9/16/19,5,49,DLFPS-340/3364,DLF Pickseed USA,RON,16,2,237,2019,Sep,RON-2019-09-16,23,9,2,"Adelphia, NJ"
239,Turf Quality,10/10/19,3,49,DLFPS-340/3364,DLF Pickseed USA,SAB,16,2,237,2019,Oct,SAB-2019-10-10,27,8,2,"Adelphia, NJ"
239,Turf Quality,11/1/19,2,49,DLFPS-340/3364,DLF Pickseed USA,RON,16,2,237,2019,Nov,RON-2019-11-01,24,7,2,"Adelphia, NJ"
239,Turf Quality,4/28/20,3,49,DLFPS-340/3364,DLF Pickseed USA,WAM,16,2,237,2020,Apr,WAM-2020-04-28,31,1,3,"Adelphia, NJ"
239,Turf Quality,5/18/20,1,49,DLFPS-340/3364,DLF Pickseed USA,SAB,16,2,237,2020,May,SAB-2020-05-18,28,6,3,"Adelphia, NJ"
239,Turf Quality,6/17/20,4,49,DLFPS-340/3364,DLF Pickseed USA,WAM,16,2,237,2020,Jun,WAM-2020-06-17,32,4,3,"Adelphia, NJ"
239,Turf Quality,7/15/20,4,49,DLFPS-340/3364,DLF Pickseed USA,WAM,16,2,237,2020,Jul,WAM-2020-07-15,33,3,3,"Adelphia, NJ"
239,Turf Quality,8/6/20,7,49,DLFPS-340/3364,DLF Pickseed USA,PLV,16,2,237,2020,Aug,PLV-2020-08-06,5,2,3,"Adelphia, NJ"
239,Turf Quality,9/2/20,3,49,DLFPS-340/3364,DLF Pickseed USA,DAS,16,2,237,2020,Sep,DAS-2020-09-02,1,9,3,"Adelphia, NJ"
239,Turf Quality,10/15/20,2,49,DLFPS-340/3364,DLF Pickseed USA,WAM,16,2,237,2020,Oct,WAM-2020-10-15,34,8,3,"Adelphia, NJ"
239,Turf Quality,11/5/20,3,49,DLFPS-340/3364,DLF Pickseed USA,WAM,16,2,237,2020,Nov,WAM-2020-11-05,35,7,3,"Adelphia, NJ"
239,Turf Quality,10/15/20,2,49,DLFPS-340/3364,DLF Pickseed USA,RMD,16,2,237,2020,Oct,RMD-2020-10-15,10,8,3,"Adelphia, NJ"
239,Turf Quality,10/23/20,3,49,DLFPS-340/3364,DLF Pickseed USA,RMD,16,2,237,2020,Oct,RMD-2020-10-23,11,8,3,"Adelphia, NJ"
239,Turf Quality,3/30/21,2,49,DLFPS-340/3364,DLF Pickseed USA,RMD,16,2,237,2021,Mar,RMD-2021-03-30,12,5,4,"Adelphia, NJ"
239,Turf Quality,4/22/21,2,49,DLFPS-340/3364,DLF Pickseed USA,PLV,16,2,237,2021,Apr,PLV-2021-04-22,6,1,4,"Adelphia, NJ"
239,Turf Quality,5/28/21,2,49,DLFPS-340/3364,DLF Pickseed USA,SAB,16,2,237,2021,May,SAB-2021-05-28,29,6,4,"Adelphia, NJ"
239,Turf Quality,6/11/21,4,49,DLFPS-340/3364,DLF Pickseed USA,JEN,16,2,237,2021,Jun,JEN-2021-06-11,2,4,4,"Adelphia, NJ"
239,Turf Quality,7/13/21,4,49,DLFPS-340/3364,DLF Pickseed USA,PLV,16,2,237,2021,Jul,PLV-2021-07-13,7,3,4,"Adelphia, NJ"
239,Turf Quality,8/11/21,5,49,DLFPS-340/3364,DLF Pickseed USA,JEN,16,2,237,2021,Aug,JEN-2021-08-11,3,2,4,"Adelphia, NJ"
239,Turf Quality,9/17/21,5,49,DLFPS-340/3364,DLF Pickseed USA,JEN,16,2,237,2021,Sep,JEN-2021-09-17,4,9,4,"Adelphia, NJ"
239,Turf Quality,10/13/21,3,49,DLFPS-340/3364,DLF Pickseed USA,SAB,16,2,237,2021,Oct,SAB-2021-10-13,30,8,4,"Adelphia, NJ"
239,Turf Quality,11/18/21,4,49,DLFPS-340/3364,DLF Pickseed USA,WAM,16,2,237,2021,Nov,WAM-2021-11-18,36,7,4,"Adelphia, NJ"
212,Turf Quality,4/18/18,4,8,Babe,Seeds Inc.,RMD,15,2,210,2018,Apr,RMD-2018-04-18,8,1,1,"Adelphia, NJ"
212,Turf Quality,5/10/18,5,8,Babe,Seeds Inc.,RON,15,2,210,2018,May,RON-2018-05-10,13,6,1,"Adelphia, NJ"
212,Turf Quality,6/7/18,6,8,Babe,Seeds Inc.,RON,15,2,210,2018,Jun,RON-2018-06-07,14,4,1,"Adelphia, NJ"
212,Turf Quality,7/17/18,6,8,Babe,Seeds Inc.,RON,15,2,210,2018,Jul,RON-2018-07-17,15,3,1,"Adelphia, NJ"
212,Turf Quality,8/15/18,6,8,Babe,Seeds Inc.,RMD,15,2,210,2018,Aug,RMD-2018-08-15,9,2,1,"Adelphia, NJ"
212,Turf Quality,9/12/18,3,8,Babe,Seeds Inc.,RON,15,2,210,2018,Sep,RON-2018-09-12,16,9,1,"Adelphia, NJ"
212,Turf Quality,10/2/18,4,8,Babe,Seeds Inc.,RON,15,2,210,2018,Oct,RON-2018-10-02,17,8,1,"Adelphia, NJ"
212,Turf Quality,11/9/18,3,8,Babe,Seeds Inc.,RON,15,2,210,2018,Nov,RON-2018-11-09,18,7,1,"Adelphia, NJ"
212,Turf Quality,4/17/19,4,8,Babe,Seeds Inc.,RON,15,2,210,2019,Apr,RON-2019-04-17,19,1,2,"Adelphia, NJ"
212,Turf Quality,5/2/19,5,8,Babe,Seeds Inc.,RON,15,2,210,2019,May,RON-2019-05-02,20,6,2,"Adelphia, NJ"
212,Turf Quality,6/13/19,5,8,Babe,Seeds Inc.,RON,15,2,210,2019,Jun,RON-2019-06-13,21,4,2,"Adelphia, NJ"
212,Turf Quality,6/17/19,6,8,Babe,Seeds Inc.,SAB,15,2,210,2019,Jun,SAB-2019-06-17,25,4,2,"Adelphia, NJ"
212,Turf Quality,7/17/19,5,8,Babe,Seeds Inc.,RON,15,2,210,2019,Jul,RON-2019-07-17,22,3,2,"Adelphia, NJ"
212,Turf Quality,8/22/19,3,8,Babe,Seeds Inc.,SAB,15,2,210,2019,Aug,SAB-2019-08-22,26,2,2,"Adelphia, NJ"
212,Turf Quality,9/16/19,2,8,Babe,Seeds Inc.,RON,15,2,210,2019,Sep,RON-2019-09-16,23,9,2,"Adelphia, NJ"
212,Turf Quality,10/10/19,2,8,Babe,Seeds Inc.,SAB,15,2,210,2019,Oct,SAB-2019-10-10,27,8,2,"Adelphia, NJ"
212,Turf Quality,11/1/19,2,8,Babe,Seeds Inc.,RON,15,2,210,2019,Nov,RON-2019-11-01,24,7,2,"Adelphia, NJ"
212,Turf Quality,4/28/20,3,8,Babe,Seeds Inc.,WAM,15,2,210,2020,Apr,WAM-2020-04-28,31,1,3,"Adelphia, NJ"
212,Turf Quality,5/18/20,4,8,Babe,Seeds Inc.,SAB,15,2,210,2020,May,SAB-2020-05-18,28,6,3,"Adelphia, NJ"
212,Turf Quality,6/17/20,3,8,Babe,Seeds Inc.,WAM,15,2,210,2020,Jun,WAM-2020-06-17,32,4,3,"Adelphia, NJ"
212,Turf Quality,7/15/20,3,8,Babe,Seeds Inc.,WAM,15,2,210,2020,Jul,WAM-2020-07-15,33,3,3,"Adelphia, NJ"
212,Turf Quality,8/6/20,6,8,Babe,Seeds Inc.,PLV,15,2,210,2020,Aug,PLV-2020-08-06,5,2,3,"Adelphia, NJ"
212,Turf Quality,9/2/20,4,8,Babe,Seeds Inc.,DAS,15,2,210,2020,Sep,DAS-2020-09-02,1,9,3,"Adelphia, NJ"
212,Turf Quality,10/15/20,1,8,Babe,Seeds Inc.,WAM,15,2,210,2020,Oct,WAM-2020-10-15,34,8,3,"Adelphia, NJ"
212,Turf Quality,11/5/20,3,8,Babe,Seeds Inc.,WAM,15,2,210,2020,Nov,WAM-2020-11-05,35,7,3,"Adelphia, NJ"
212,Turf Quality,10/15/20,2,8,Babe,Seeds Inc.,RMD,15,2,210,2020,Oct,RMD-2020-10-15,10,8,3,"Adelphia, NJ"
212,Turf Quality,10/23/20,2,8,Babe,Seeds Inc.,RMD,15,2,210,2020,Oct,RMD-2020-10-23,11,8,3,"Adelphia, NJ"
212,Turf Quality,3/30/21,3,8,Babe,Seeds Inc.,RMD,15,2,210,2021,Mar,RMD-2021-03-30,12,5,4,"Adelphia, NJ"
212,Turf Quality,4/22/21,4,8,Babe,Seeds Inc.,PLV,15,2,210,2021,Apr,PLV-2021-04-22,6,1,4,"Adelphia, NJ"
212,Turf Quality,5/28/21,4,8,Babe,Seeds Inc.,SAB,15,2,210,2021,May,SAB-2021-05-28,29,6,4,"Adelphia, NJ"
212,Turf Quality,6/11/21,5,8,Babe,Seeds Inc.,JEN,15,2,210,2021,Jun,JEN-2021-06-11,2,4,4,"Adelphia, NJ"
212,Turf Quality,7/13/21,5,8,Babe,Seeds Inc.,PLV,15,2,210,2021,Jul,PLV-2021-07-13,7,3,4,"Adelphia, NJ"
212,Turf Quality,8/11/21,6,8,Babe,Seeds Inc.,JEN,15,2,210,2021,Aug,JEN-2021-08-11,3,2,4,"Adelphia, NJ"
212,Turf Quality,9/17/21,6,8,Babe,Seeds Inc.,JEN,15,2,210,2021,Sep,JEN-2021-09-17,4,9,4,"Adelphia, NJ"
212,Turf Quality,10/13/21,4,8,Babe,Seeds Inc.,SAB,15,2,210,2021,Oct,SAB-2021-10-13,30,8,4,"Adelphia, NJ"
212,Turf Quality,11/18/21,6,8,Babe,Seeds Inc.,WAM,15,2,210,2021,Nov,WAM-2021-11-18,36,7,4,"Adelphia, NJ"
209,Turf Quality,4/18/18,4,20,BAR PP 71213,Barenbrug Research,RMD,14,2,207,2018,Apr,RMD-2018-04-18,8,1,1,"Adelphia, NJ"
209,Turf Quality,5/10/18,4,20,BAR PP 71213,Barenbrug Research,RON,14,2,207,2018,May,RON-2018-05-10,13,6,1,"Adelphia, NJ"
209,Turf Quality,6/7/18,4,20,BAR PP 71213,Barenbrug Research,RON,14,2,207,2018,Jun,RON-2018-06-07,14,4,1,"Adelphia, NJ"
209,Turf Quality,7/17/18,6,20,BAR PP 71213,Barenbrug Research,RON,14,2,207,2018,Jul,RON-2018-07-17,15,3,1,"Adelphia, NJ"
209,Turf Quality,8/15/18,6,20,BAR PP 71213,Barenbrug Research,RMD,14,2,207,2018,Aug,RMD-2018-08-15,9,2,1,"Adelphia, NJ"
209,Turf Quality,9/12/18,6,20,BAR PP 71213,Barenbrug Research,RON,14,2,207,2018,Sep,RON-2018-09-12,16,9,1,"Adelphia, NJ"
209,Turf Quality,10/2/18,5,20,BAR PP 71213,Barenbrug Research,RON,14,2,207,2018,Oct,RON-2018-10-02,17,8,1,"Adelphia, NJ"
209,Turf Quality,11/9/18,6,20,BAR PP 71213,Barenbrug Research,RON,14,2,207,2018,Nov,RON-2018-11-09,18,7,1,"Adelphia, NJ"
209,Turf Quality,4/17/19,6,20,BAR PP 71213,Barenbrug Research,RON,14,2,207,2019,Apr,RON-2019-04-17,19,1,2,"Adelphia, NJ"
209,Turf Quality,5/2/19,7,20,BAR PP 71213,Barenbrug Research,RON,14,2,207,2019,May,RON-2019-05-02,20,6,2,"Adelphia, NJ"
209,Turf Quality,6/13/19,5,20,BAR PP 71213,Barenbrug Research,RON,14,2,207,2019,Jun,RON-2019-06-13,21,4,2,"Adelphia, NJ"
209,Turf Quality,6/17/19,4,20,BAR PP 71213,Barenbrug Research,SAB,14,2,207,2019,Jun,SAB-2019-06-17,25,4,2,"Adelphia, NJ"
209,Turf Quality,7/17/19,5,20,BAR PP 71213,Barenbrug Research,RON,14,2,207,2019,Jul,RON-2019-07-17,22,3,2,"Adelphia, NJ"
209,Turf Quality,8/22/19,6,20,BAR PP 71213,Barenbrug Research,SAB,14,2,207,2019,Aug,SAB-2019-08-22,26,2,2,"Adelphia, NJ"
209,Turf Quality,9/16/19,5,20,BAR PP 71213,Barenbrug Research,RON,14,2,207,2019,Sep,RON-2019-09-16,23,9,2,"Adelphia, NJ"
209,Turf Quality,10/10/19,7,20,BAR PP 71213,Barenbrug Research,SAB,14,2,207,2019,Oct,SAB-2019-10-10,27,8,2,"Adelphia, NJ"
209,Turf Quality,11/1/19,6,20,BAR PP 71213,Barenbrug Research,RON,14,2,207,2019,Nov,RON-2019-11-01,24,7,2,"Adelphia, NJ"
209,Turf Quality,4/28/20,6,20,BAR PP 71213,Barenbrug Research,WAM,14,2,207,2020,Apr,WAM-2020-04-28,31,1,3,"Adelphia, NJ"
209,Turf Quality,5/18/20,6,20,BAR PP 71213,Barenbrug Research,SAB,14,2,207,2020,May,SAB-2020-05-18,28,6,3,"Adelphia, NJ"
209,Turf Quality,6/17/20,3,20,BAR PP 71213,Barenbrug Research,WAM,14,2,207,2020,Jun,WAM-2020-06-17,32,4,3,"Adelphia, NJ"
209,Turf Quality,7/15/20,5,20,BAR PP 71213,Barenbrug Research,WAM,14,2,207,2020,Jul,WAM-2020-07-15,33,3,3,"Adelphia, NJ"
209,Turf Quality,8/6/20,6,20,BAR PP 71213,Barenbrug Research,PLV,14,2,207,2020,Aug,PLV-2020-08-06,5,2,3,"Adelphia, NJ"
209,Turf Quality,9/2/20,4,20,BAR PP 71213,Barenbrug Research,DAS,14,2,207,2020,Sep,DAS-2020-09-02,1,9,3,"Adelphia, NJ"
209,Turf Quality,10/15/20,3,20,BAR PP 71213,Barenbrug Research,WAM,14,2,207,2020,Oct,WAM-2020-10-15,34,8,3,"Adelphia, NJ"
209,Turf Quality,11/5/20,5,20,BAR PP 71213,Barenbrug Research,WAM,14,2,207,2020,Nov,WAM-2020-11-05,35,7,3,"Adelphia, NJ"
209,Turf Quality,10/15/20,4,20,BAR PP 71213,Barenbrug Research,RMD,14,2,207,2020,Oct,RMD-2020-10-15,10,8,3,"Adelphia, NJ"
209,Turf Quality,10/23/20,5,20,BAR PP 71213,Barenbrug Research,RMD,14,2,207,2020,Oct,RMD-2020-10-23,11,8,3,"Adelphia, NJ"
209,Turf Quality,3/30/21,5,20,BAR PP 71213,Barenbrug Research,RMD,14,2,207,2021,Mar,RMD-2021-03-30,12,5,4,"Adelphia, NJ"
209,Turf Quality,4/22/21,6,20,BAR PP 71213,Barenbrug Research,PLV,14,2,207,2021,Apr,PLV-2021-04-22,6,1,4,"Adelphia, NJ"
209,Turf Quality,5/28/21,4,20,BAR PP 71213,Barenbrug Research,SAB,14,2,207,2021,May,SAB-2021-05-28,29,6,4,"Adelphia, NJ"
209,Turf Quality,6/11/21,4,20,BAR PP 71213,Barenbrug Research,JEN,14,2,207,2021,Jun,JEN-2021-06-11,2,4,4,"Adelphia, NJ"
209,Turf Quality,7/13/21,4,20,BAR PP 71213,Barenbrug Research,PLV,14,2,207,2021,Jul,PLV-2021-07-13,7,3,4,"Adelphia, NJ"
209,Turf Quality,8/11/21,5,20,BAR PP 71213,Barenbrug Research,JEN,14,2,207,2021,Aug,JEN-2021-08-11,3,2,4,"Adelphia, NJ"
209,Turf Quality,9/17/21,4,20,BAR PP 71213,Barenbrug Research,JEN,14,2,207,2021,Sep,JEN-2021-09-17,4,9,4,"Adelphia, NJ"
209,Turf Quality,10/13/21,5,20,BAR PP 71213,Barenbrug Research,SAB,14,2,207,2021,Oct,SAB-2021-10-13,30,8,4,"Adelphia, NJ"
209,Turf Quality,11/18/21,6,20,BAR PP 71213,Barenbrug Research,WAM,14,2,207,2021,Nov,WAM-2021-11-18,36,7,4,"Adelphia, NJ"
182,Turf Quality,4/18/18,3,77,Prosperity,Blue Mt. Seeds Inc.,RMD,13,2,180,2018,Apr,RMD-2018-04-18,8,1,1,"Adelphia, NJ"
182,Turf Quality,5/10/18,4,77,Prosperity,Blue Mt. Seeds Inc.,RON,13,2,180,2018,May,RON-2018-05-10,13,6,1,"Adelphia, NJ"
182,Turf Quality,6/7/18,5,77,Prosperity,Blue Mt. Seeds Inc.,RON,13,2,180,2018,Jun,RON-2018-06-07,14,4,1,"Adelphia, NJ"
182,Turf Quality,7/17/18,6,77,Prosperity,Blue Mt. Seeds Inc.,RON,13,2,180,2018,Jul,RON-2018-07-17,15,3,1,"Adelphia, NJ"
182,Turf Quality,8/15/18,6,77,Prosperity,Blue Mt. Seeds Inc.,RMD,13,2,180,2018,Aug,RMD-2018-08-15,9,2,1,"Adelphia, NJ"
182,Turf Quality,9/12/18,4,77,Prosperity,Blue Mt. Seeds Inc.,RON,13,2,180,2018,Sep,RON-2018-09-12,16,9,1,"Adelphia, NJ"
182,Turf Quality,10/2/18,4,77,Prosperity,Blue Mt. Seeds Inc.,RON,13,2,180,2018,Oct,RON-2018-10-02,17,8,1,"Adelphia, NJ"
182,Turf Quality,11/9/18,2,77,Prosperity,Blue Mt. Seeds Inc.,RON,13,2,180,2018,Nov,RON-2018-11-09,18,7,1,"Adelphia, NJ"
182,Turf Quality,4/17/19,3,77,Prosperity,Blue Mt. Seeds Inc.,RON,13,2,180,2019,Apr,RON-2019-04-17,19,1,2,"Adelphia, NJ"
182,Turf Quality,5/2/19,3,77,Prosperity,Blue Mt. Seeds Inc.,RON,13,2,180,2019,May,RON-2019-05-02,20,6,2,"Adelphia, NJ"
182,Turf Quality,6/13/19,4,77,Prosperity,Blue Mt. Seeds Inc.,RON,13,2,180,2019,Jun,RON-2019-06-13,21,4,2,"Adelphia, NJ"
182,Turf Quality,6/17/19,4,77,Prosperity,Blue Mt. Seeds Inc.,SAB,13,2,180,2019,Jun,SAB-2019-06-17,25,4,2,"Adelphia, NJ"
182,Turf Quality,7/17/19,5,77,Prosperity,Blue Mt. Seeds Inc.,RON,13,2,180,2019,Jul,RON-2019-07-17,22,3,2,"Adelphia, NJ"
182,Turf Quality,8/22/19,4,77,Prosperity,Blue Mt. Seeds Inc.,SAB,13,2,180,2019,Aug,SAB-2019-08-22,26,2,2,"Adelphia, NJ"
182,Turf Quality,9/16/19,3,77,Prosperity,Blue Mt. Seeds Inc.,RON,13,2,180,2019,Sep,RON-2019-09-16,23,9,2,"Adelphia, NJ"
182,Turf Quality,10/10/19,3,77,Prosperity,Blue Mt. Seeds Inc.,SAB,13,2,180,2019,Oct,SAB-2019-10-10,27,8,2,"Adelphia, NJ"
182,Turf Quality,11/1/19,3,77,Prosperity,Blue Mt. Seeds Inc.,RON,13,2,180,2019,Nov,RON-2019-11-01,24,7,2,"Adelphia, NJ"
182,Turf Quality,4/28/20,4,77,Prosperity,Blue Mt. Seeds Inc.,WAM,13,2,180,2020,Apr,WAM-2020-04-28,31,1,3,"Adelphia, NJ"
182,Turf Quality,5/18/20,2,77,Prosperity,Blue Mt. Seeds Inc.,SAB,13,2,180,2020,May,SAB-2020-05-18,28,6,3,"Adelphia, NJ"
182,Turf Quality,6/17/20,4,77,Prosperity,Blue Mt. Seeds Inc.,WAM,13,2,180,2020,Jun,WAM-2020-06-17,32,4,3,"Adelphia, NJ"
182,Turf Quality,7/15/20,5,77,Prosperity,Blue Mt. Seeds Inc.,WAM,13,2,180,2020,Jul,WAM-2020-07-15,33,3,3,"Adelphia, NJ"
182,Turf Quality,8/6/20,7,77,Prosperity,Blue Mt. Seeds Inc.,PLV,13,2,180,2020,Aug,PLV-2020-08-06,5,2,3,"Adelphia, NJ"
182,Turf Quality,9/2/20,5,77,Prosperity,Blue Mt. Seeds Inc.,DAS,13,2,180,2020,Sep,DAS-2020-09-02,1,9,3,"Adelphia, NJ"
182,Turf Quality,10/15/20,2,77,Prosperity,Blue Mt. Seeds Inc.,WAM,13,2,180,2020,Oct,WAM-2020-10-15,34,8,3,"Adelphia, NJ"
182,Turf Quality,11/5/20,2,77,Prosperity,Blue Mt. Seeds Inc.,WAM,13,2,180,2020,Nov,WAM-2020-11-05,35,7,3,"Adelphia, NJ"
182,Turf Quality,10/15/20,2,77,Prosperity,Blue Mt. Seeds Inc.,RMD,13,2,180,2020,Oct,RMD-2020-10-15,10,8,3,"Adelphia, NJ"
182,Turf Quality,10/23/20,2,77,Prosperity,Blue Mt. Seeds Inc.,RMD,13,2,180,2020,Oct,RMD-2020-10-23,11,8,3,"Adelphia, NJ"
182,Turf Quality,3/30/21,2,77,Prosperity,Blue Mt. Seeds Inc.,RMD,13,2,180,2021,Mar,RMD-2021-03-30,12,5,4,"Adelphia, NJ"
182,Turf Quality,4/22/21,2,77,Prosperity,Blue Mt. Seeds Inc.,PLV,13,2,180,2021,Apr,PLV-2021-04-22,6,1,4,"Adelphia, NJ"
182,Turf Quality,5/28/21,3,77,Prosperity,Blue Mt. Seeds Inc.,SAB,13,2,180,2021,May,SAB-2021-05-28,29,6,4,"Adelphia, NJ"
182,Turf Quality,6/11/21,4,77,Prosperity,Blue Mt. Seeds Inc.,JEN,13,2,180,2021,Jun,JEN-2021-06-11,2,4,4,"Adelphia, NJ"
182,Turf Quality,7/13/21,3,77,Prosperity,Blue Mt. Seeds Inc.,PLV,13,2,180,2021,Jul,PLV-2021-07-13,7,3,4,"Adelphia, NJ"
182,Turf Quality,8/11/21,6,77,Prosperity,Blue Mt. Seeds Inc.,JEN,13,2,180,2021,Aug,JEN-2021-08-11,3,2,4,"Adelphia, NJ"
182,Turf Quality,9/17/21,5,77,Prosperity,Blue Mt. Seeds Inc.,JEN,13,2,180,2021,Sep,JEN-2021-09-17,4,9,4,"Adelphia, NJ"
182,Turf Quality,10/13/21,4,77,Prosperity,Blue Mt. Seeds Inc.,SAB,13,2,180,2021,Oct,SAB-2021-10-13,30,8,4,"Adelphia, NJ"
182,Turf Quality,11/18/21,6,77,Prosperity,Blue Mt. Seeds Inc.,WAM,13,2,180,2021,Nov,WAM-2021-11-18,36,7,4,"Adelphia, NJ"
179,Turf Quality,4/18/18,1,49,DLFPS-340/3364,DLF Pickseed USA,RMD,12,2,178,2018,Apr,RMD-2018-04-18,8,1,1,"Adelphia, NJ"
179,Turf Quality,5/10/18,2,49,DLFPS-340/3364,DLF Pickseed USA,RON,12,2,178,2018,May,RON-2018-05-10,13,6,1,"Adelphia, NJ"
179,Turf Quality,6/7/18,3,49,DLFPS-340/3364,DLF Pickseed USA,RON,12,2,178,2018,Jun,RON-2018-06-07,14,4,1,"Adelphia, NJ"
179,Turf Quality,7/17/18,4,49,DLFPS-340/3364,DLF Pickseed USA,RON,12,2,178,2018,Jul,RON-2018-07-17,15,3,1,"Adelphia, NJ"
179,Turf Quality,8/15/18,3,49,DLFPS-340/3364,DLF Pickseed USA,RMD,12,2,178,2018,Aug,RMD-2018-08-15,9,2,1,"Adelphia, NJ"
179,Turf Quality,9/12/18,3,49,DLFPS-340/3364,DLF Pickseed USA,RON,12,2,178,2018,Sep,RON-2018-09-12,16,9,1,"Adelphia, NJ"
179,Turf Quality,10/2/18,4,49,DLFPS-340/3364,DLF Pickseed USA,RON,12,2,178,2018,Oct,RON-2018-10-02,17,8,1,"Adelphia, NJ"
179,Turf Quality,11/9/18,3,49,DLFPS-340/3364,DLF Pickseed USA,RON,12,2,178,2018,Nov,RON-2018-11-09,18,7,1,"Adelphia, NJ"
179,Turf Quality,4/17/19,3,49,DLFPS-340/3364,DLF Pickseed USA,RON,12,2,178,2019,Apr,RON-2019-04-17,19,1,2,"Adelphia, NJ"
179,Turf Quality,5/2/19,2,49,DLFPS-340/3364,DLF Pickseed USA,RON,12,2,178,2019,May,RON-2019-05-02,20,6,2,"Adelphia, NJ"
179,Turf Quality,6/13/19,4,49,DLFPS-340/3364,DLF Pickseed USA,RON,12,2,178,2019,Jun,RON-2019-06-13,21,4,2,"Adelphia, NJ"
179,Turf Quality,6/17/19,4,49,DLFPS-340/3364,DLF Pickseed USA,SAB,12,2,178,2019,Jun,SAB-2019-06-17,25,4,2,"Adelphia, NJ"
179,Turf Quality,7/17/19,5,49,DLFPS-340/3364,DLF Pickseed USA,RON,12,2,178,2019,Jul,RON-2019-07-17,22,3,2,"Adelphia, NJ"
179,Turf Quality,8/22/19,4,49,DLFPS-340/3364,DLF Pickseed USA,SAB,12,2,178,2019,Aug,SAB-2019-08-22,26,2,2,"Adelphia, NJ"
179,Turf Quality,9/16/19,5,49,DLFPS-340/3364,DLF Pickseed USA,RON,12,2,178,2019,Sep,RON-2019-09-16,23,9,2,"Adelphia, NJ"
179,Turf Quality,10/10/19,2,49,DLFPS-340/3364,DLF Pickseed USA,SAB,12,2,178,2019,Oct,SAB-2019-10-10,27,8,2,"Adelphia, NJ"
179,Turf Quality,11/1/19,3,49,DLFPS-340/3364,DLF Pickseed USA,RON,12,2,178,2019,Nov,RON-2019-11-01,24,7,2,"Adelphia, NJ"
179,Turf Quality,4/28/20,3,49,DLFPS-340/3364,DLF Pickseed USA,WAM,12,2,178,2020,Apr,WAM-2020-04-28,31,1,3,"Adelphia, NJ"
179,Turf Quality,5/18/20,5,49,DLFPS-340/3364,DLF Pickseed USA,SAB,12,2,178,2020,May,SAB-2020-05-18,28,6,3,"Adelphia, NJ"
179,Turf Quality,6/17/20,4,49,DLFPS-340/3364,DLF Pickseed USA,WAM,12,2,178,2020,Jun,WAM-2020-06-17,32,4,3,"Adelphia, NJ"
179,Turf Quality,7/15/20,5,49,DLFPS-340/3364,DLF Pickseed USA,WAM,12,2,178,2020,Jul,WAM-2020-07-15,33,3,3,"Adelphia, NJ"
179,Turf Quality,8/6/20,7,49,DLFPS-340/3364,DLF Pickseed USA,PLV,12,2,178,2020,Aug,PLV-2020-08-06,5,2,3,"Adelphia, NJ"
179,Turf Quality,9/2/20,4,49,DLFPS-340/3364,DLF Pickseed USA,DAS,12,2,178,2020,Sep,DAS-2020-09-02,1,9,3,"Adelphia, NJ"
179,Turf Quality,10/15/20,3,49,DLFPS-340/3364,DLF Pickseed USA,WAM,12,2,178,2020,Oct,WAM-2020-10-15,34,8,3,"Adelphia, NJ"
179,Turf Quality,11/5/20,5,49,DLFPS-340/3364,DLF Pickseed USA,WAM,12,2,178,2020,Nov,WAM-2020-11-05,35,7,3,"Adelphia, NJ"
179,Turf Quality,10/15/20,4,49,DLFPS-340/3364,DLF Pickseed USA,RMD,12,2,178,2020,Oct,RMD-2020-10-15,10,8,3,"Adelphia, NJ"
179,Turf Quality,10/23/20,4,49,DLFPS-340/3364,DLF Pickseed USA,RMD,12,2,178,2020,Oct,RMD-2020-10-23,11,8,3,"Adelphia, NJ"
179,Turf Quality,3/30/21,5,49,DLFPS-340/3364,DLF Pickseed USA,RMD,12,2,178,2021,Mar,RMD-2021-03-30,12,5,4,"Adelphia, NJ"
179,Turf Quality,4/22/21,7,49,DLFPS-340/3364,DLF Pickseed USA,PLV,12,2,178,2021,Apr,PLV-2021-04-22,6,1,4,"Adelphia, NJ"
179,Turf Quality,5/28/21,5,49,DLFPS-340/3364,DLF Pickseed USA,SAB,12,2,178,2021,May,SAB-2021-05-28,29,6,4,"Adelphia, NJ"
179,Turf Quality,6/11/21,5,49,DLFPS-340/3364,DLF Pickseed USA,JEN,12,2,178,2021,Jun,JEN-2021-06-11,2,4,4,"Adelphia, NJ"
179,Turf Quality,7/13/21,8,49,DLFPS-340/3364,DLF Pickseed USA,PLV,12,2,178,2021,Jul,PLV-2021-07-13,7,3,4,"Adelphia, NJ"
179,Turf Quality,8/11/21,6,49,DLFPS-340/3364,DLF Pickseed USA,JEN,12,2,178,2021,Aug,JEN-2021-08-11,3,2,4,"Adelphia, NJ"
179,Turf Quality,9/17/21,7,49,DLFPS-340/3364,DLF Pickseed USA,JEN,12,2,178,2021,Sep,JEN-2021-09-17,4,9,4,"Adelphia, NJ"
179,Turf Quality,10/13/21,7,49,DLFPS-340/3364,DLF Pickseed USA,SAB,12,2,178,2021,Oct,SAB-2021-10-13,30,8,4,"Adelphia, NJ"
179,Turf Quality,11/18/21,5,49,DLFPS-340/3364,DLF Pickseed USA,WAM,12,2,178,2021,Nov,WAM-2021-11-18,36,7,4,"Adelphia, NJ"
152,Turf Quality,4/18/18,5,8,Babe,Seeds Inc.,RMD,11,2,151,2018,Apr,RMD-2018-04-18,8,1,1,"Adelphia, NJ"
152,Turf Quality,5/10/18,5,8,Babe,Seeds Inc.,RON,11,2,151,2018,May,RON-2018-05-10,13,6,1,"Adelphia, NJ"
152,Turf Quality,6/7/18,4,8,Babe,Seeds Inc.,RON,11,2,151,2018,Jun,RON-2018-06-07,14,4,1,"Adelphia, NJ"
152,Turf Quality,7/17/18,4,8,Babe,Seeds Inc.,RON,11,2,151,2018,Jul,RON-2018-07-17,15,3,1,"Adelphia, NJ"
152,Turf Quality,8/15/18,6,8,Babe,Seeds Inc.,RMD,11,2,151,2018,Aug,RMD-2018-08-15,9,2,1,"Adelphia, NJ"
152,Turf Quality,9/12/18,3,8,Babe,Seeds Inc.,RON,11,2,151,2018,Sep,RON-2018-09-12,16,9,1,"Adelphia, NJ"
152,Turf Quality,10/2/18,3,8,Babe,Seeds Inc.,RON,11,2,151,2018,Oct,RON-2018-10-02,17,8,1,"Adelphia, NJ"
152,Turf Quality,11/9/18,3,8,Babe,Seeds Inc.,RON,11,2,151,2018,Nov,RON-2018-11-09,18,7,1,"Adelphia, NJ"
152,Turf Quality,4/17/19,5,8,Babe,Seeds Inc.,RON,11,2,151,2019,Apr,RON-2019-04-17,19,1,2,"Adelphia, NJ"
152,Turf Quality,5/2/19,4,8,Babe,Seeds Inc.,RON,11,2,151,2019,May,RON-2019-05-02,20,6,2,"Adelphia, NJ"
152,Turf Quality,6/13/19,5,8,Babe,Seeds Inc.,RON,11,2,151,2019,Jun,RON-2019-06-13,21,4,2,"Adelphia, NJ"
152,Turf Quality,6/17/19,5,8,Babe,Seeds Inc.,SAB,11,2,151,2019,Jun,SAB-2019-06-17,25,4,2,"Adelphia, NJ"
152,Turf Quality,7/17/19,4,8,Babe,Seeds Inc.,RON,11,2,151,2019,Jul,RON-2019-07-17,22,3,2,"Adelphia, NJ"
152,Turf Quality,8/22/19,4,8,Babe,Seeds Inc.,SAB,11,2,151,2019,Aug,SAB-2019-08-22,26,2,2,"Adelphia, NJ"
152,Turf Quality,9/16/19,4,8,Babe,Seeds Inc.,RON,11,2,151,2019,Sep,RON-2019-09-16,23,9,2,"Adelphia, NJ"
152,Turf Quality,10/10/19,3,8,Babe,Seeds Inc.,SAB,11,2,151,2019,Oct,SAB-2019-10-10,27,8,2,"Adelphia, NJ"
152,Turf Quality,11/1/19,3,8,Babe,Seeds Inc.,RON,11,2,151,2019,Nov,RON-2019-11-01,24,7,2,"Adelphia, NJ"
152,Turf Quality,4/28/20,6,8,Babe,Seeds Inc.,WAM,11,2,151,2020,Apr,WAM-2020-04-28,31,1,3,"Adelphia, NJ"
152,Turf Quality,5/18/20,6,8,Babe,Seeds Inc.,SAB,11,2,151,2020,May,SAB-2020-05-18,28,6,3,"Adelphia, NJ"
152,Turf Quality,6/17/20,5,8,Babe,Seeds Inc.,WAM,11,2,151,2020,Jun,WAM-2020-06-17,32,4,3,"Adelphia, NJ"
152,Turf Quality,7/15/20,4,8,Babe,Seeds Inc.,WAM,11,2,151,2020,Jul,WAM-2020-07-15,33,3,3,"Adelphia, NJ"
152,Turf Quality,8/6/20,6,8,Babe,Seeds Inc.,PLV,11,2,151,2020,Aug,PLV-2020-08-06,5,2,3,"Adelphia, NJ"
152,Turf Quality,9/2/20,4,8,Babe,Seeds Inc.,DAS,11,2,151,2020,Sep,DAS-2020-09-02,1,9,3,"Adelphia, NJ"
152,Turf Quality,10/15/20,2,8,Babe,Seeds Inc.,WAM,11,2,151,2020,Oct,WAM-2020-10-15,34,8,3,"Adelphia, NJ"
152,Turf Quality,11/5/20,3,8,Babe,Seeds Inc.,WAM,11,2,151,2020,Nov,WAM-2020-11-05,35,7,3,"Adelphia, NJ"
152,Turf Quality,10/15/20,2,8,Babe,Seeds Inc.,RMD,11,2,151,2020,Oct,RMD-2020-10-15,10,8,3,"Adelphia, NJ"
152,Turf Quality,10/23/20,2,8,Babe,Seeds Inc.,RMD,11,2,151,2020,Oct,RMD-2020-10-23,11,8,3,"Adelphia, NJ"
152,Turf Quality,3/30/21,2,8,Babe,Seeds Inc.,RMD,11,2,151,2021,Mar,RMD-2021-03-30,12,5,4,"Adelphia, NJ"
152,Turf Quality,4/22/21,5,8,Babe,Seeds Inc.,PLV,11,2,151,2021,Apr,PLV-2021-04-22,6,1,4,"Adelphia, NJ"
152,Turf Quality,5/28/21,4,8,Babe,Seeds Inc.,SAB,11,2,151,2021,May,SAB-2021-05-28,29,6,4,"Adelphia, NJ"
152,Turf Quality,6/11/21,6,8,Babe,Seeds Inc.,JEN,11,2,151,2021,Jun,JEN-2021-06-11,2,4,4,"Adelphia, NJ"
152,Turf Quality,7/13/21,6,8,Babe,Seeds Inc.,PLV,11,2,151,2021,Jul,PLV-2021-07-13,7,3,4,"Adelphia, NJ"
152,Turf Quality,8/11/21,6,8,Babe,Seeds Inc.,JEN,11,2,151,2021,Aug,JEN-2021-08-11,3,2,4,"Adelphia, NJ"
152,Turf Quality,9/17/21,7,8,Babe,Seeds Inc.,JEN,11,2,151,2021,Sep,JEN-2021-09-17,4,9,4,"Adelphia, NJ"
152,Turf Quality,10/13/21,5,8,Babe,Seeds Inc.,SAB,11,2,151,2021,Oct,SAB-2021-10-13,30,8,4,"Adelphia, NJ"
152,Turf Quality,11/18/21,5,8,Babe,Seeds Inc.,WAM,11,2,151,2021,Nov,WAM-2021-11-18,36,7,4,"Adelphia, NJ"
149,Turf Quality,4/18/18,3,11,AKB3241,Pennington Seed,RMD,10,2,148,2018,Apr,RMD-2018-04-18,8,1,1,"Adelphia, NJ"
149,Turf Quality,5/10/18,3,11,AKB3241,Pennington Seed,RON,10,2,148,2018,May,RON-2018-05-10,13,6,1,"Adelphia, NJ"
149,Turf Quality,6/7/18,3,11,AKB3241,Pennington Seed,RON,10,2,148,2018,Jun,RON-2018-06-07,14,4,1,"Adelphia, NJ"
149,Turf Quality,7/17/18,5,11,AKB3241,Pennington Seed,RON,10,2,148,2018,Jul,RON-2018-07-17,15,3,1,"Adelphia, NJ"
149,Turf Quality,8/15/18,8,11,AKB3241,Pennington Seed,RMD,10,2,148,2018,Aug,RMD-2018-08-15,9,2,1,"Adelphia, NJ"
149,Turf Quality,9/12/18,7,11,AKB3241,Pennington Seed,RON,10,2,148,2018,Sep,RON-2018-09-12,16,9,1,"Adelphia, NJ"
149,Turf Quality,10/2/18,6,11,AKB3241,Pennington Seed,RON,10,2,148,2018,Oct,RON-2018-10-02,17,8,1,"Adelphia, NJ"
149,Turf Quality,11/9/18,5,11,AKB3241,Pennington Seed,RON,10,2,148,2018,Nov,RON-2018-11-09,18,7,1,"Adelphia, NJ"
149,Turf Quality,4/17/19,5,11,AKB3241,Pennington Seed,RON,10,2,148,2019,Apr,RON-2019-04-17,19,1,2,"Adelphia, NJ"
149,Turf Quality,5/2/19,7,11,AKB3241,Pennington Seed,RON,10,2,148,2019,May,RON-2019-05-02,20,6,2,"Adelphia, NJ"
149,Turf Quality,6/13/19,5,11,AKB3241,Pennington Seed,RON,10,2,148,2019,Jun,RON-2019-06-13,21,4,2,"Adelphia, NJ"
149,Turf Quality,6/17/19,4,11,AKB3241,Pennington Seed,SAB,10,2,148,2019,Jun,SAB-2019-06-17,25,4,2,"Adelphia, NJ"
149,Turf Quality,7/17/19,5,11,AKB3241,Pennington Seed,RON,10,2,148,2019,Jul,RON-2019-07-17,22,3,2,"Adelphia, NJ"
149,Turf Quality,8/22/19,6,11,AKB3241,Pennington Seed,SAB,10,2,148,2019,Aug,SAB-2019-08-22,26,2,2,"Adelphia, NJ"
149,Turf Quality,9/16/19,7,11,AKB3241,Pennington Seed,RON,10,2,148,2019,Sep,RON-2019-09-16,23,9,2,"Adelphia, NJ"
149,Turf Quality,10/10/19,4,11,AKB3241,Pennington Seed,SAB,10,2,148,2019,Oct,SAB-2019-10-10,27,8,2,"Adelphia, NJ"
149,Turf Quality,11/1/19,5,11,AKB3241,Pennington Seed,RON,10,2,148,2019,Nov,RON-2019-11-01,24,7,2,"Adelphia, NJ"
149,Turf Quality,4/28/20,6,11,AKB3241,Pennington Seed,WAM,10,2,148,2020,Apr,WAM-2020-04-28,31,1,3,"Adelphia, NJ"
149,Turf Quality,5/18/20,5,11,AKB3241,Pennington Seed,SAB,10,2,148,2020,May,SAB-2020-05-18,28,6,3,"Adelphia, NJ"
149,Turf Quality,6/17/20,5,11,AKB3241,Pennington Seed,WAM,10,2,148,2020,Jun,WAM-2020-06-17,32,4,3,"Adelphia, NJ"
149,Turf Quality,7/15/20,6,11,AKB3241,Pennington Seed,WAM,10,2,148,2020,Jul,WAM-2020-07-15,33,3,3,"Adelphia, NJ"
149,Turf Quality,8/6/20,7,11,AKB3241,Pennington Seed,PLV,10,2,148,2020,Aug,PLV-2020-08-06,5,2,3,"Adelphia, NJ"
149,Turf Quality,9/2/20,5,11,AKB3241,Pennington Seed,DAS,10,2,148,2020,Sep,DAS-2020-09-02,1,9,3,"Adelphia, NJ"
149,Turf Quality,10/15/20,3,11,AKB3241,Pennington Seed,WAM,10,2,148,2020,Oct,WAM-2020-10-15,34,8,3,"Adelphia, NJ"
149,Turf Quality,11/5/20,4,11,AKB3241,Pennington Seed,WAM,10,2,148,2020,Nov,WAM-2020-11-05,35,7,3,"Adelphia, NJ"
149,Turf Quality,10/15/20,3,11,AKB3241,Pennington Seed,RMD,10,2,148,2020,Oct,RMD-2020-10-15,10,8,3,"Adelphia, NJ"
149,Turf Quality,10/23/20,2,11,AKB3241,Pennington Seed,RMD,10,2,148,2020,Oct,RMD-2020-10-23,11,8,3,"Adelphia, NJ"
149,Turf Quality,3/30/21,3,11,AKB3241,Pennington Seed,RMD,10,2,148,2021,Mar,RMD-2021-03-30,12,5,4,"Adelphia, NJ"
149,Turf Quality,4/22/21,5,11,AKB3241,Pennington Seed,PLV,10,2,148,2021,Apr,PLV-2021-04-22,6,1,4,"Adelphia, NJ"
149,Turf Quality,5/28/21,3,11,AKB3241,Pennington Seed,SAB,10,2,148,2021,May,SAB-2021-05-28,29,6,4,"Adelphia, NJ"
149,Turf Quality,6/11/21,5,11,AKB3241,Pennington Seed,JEN,10,2,148,2021,Jun,JEN-2021-06-11,2,4,4,"Adelphia, NJ"
149,Turf Quality,7/13/21,6,11,AKB3241,Pennington Seed,PLV,10,2,148,2021,Jul,PLV-2021-07-13,7,3,4,"Adelphia, NJ"
149,Turf Quality,8/11/21,5,11,AKB3241,Pennington Seed,JEN,10,2,148,2021,Aug,JEN-2021-08-11,3,2,4,"Adelphia, NJ"
149,Turf Quality,9/17/21,7,11,AKB3241,Pennington Seed,JEN,10,2,148,2021,Sep,JEN-2021-09-17,4,9,4,"Adelphia, NJ"
149,Turf Quality,10/13/21,5,11,AKB3241,Pennington Seed,SAB,10,2,148,2021,Oct,SAB-2021-10-13,30,8,4,"Adelphia, NJ"
149,Turf Quality,11/18/21,5,11,AKB3241,Pennington Seed,WAM,10,2,148,2021,Nov,WAM-2021-11-18,36,7,4,"Adelphia, NJ"
122,Turf Quality,4/18/18,3,62,DLFPS-340/3552,DLF Pickseed USA,RMD,9,2,121,2018,Apr,RMD-2018-04-18,8,1,1,"Adelphia, NJ"
122,Turf Quality,5/10/18,4,62,DLFPS-340/3552,DLF Pickseed USA,RON,9,2,121,2018,May,RON-2018-05-10,13,6,1,"Adelphia, NJ"
122,Turf Quality,6/7/18,5,62,DLFPS-340/3552,DLF Pickseed USA,RON,9,2,121,2018,Jun,RON-2018-06-07,14,4,1,"Adelphia, NJ"
122,Turf Quality,7/17/18,7,62,DLFPS-340/3552,DLF Pickseed USA,RON,9,2,121,2018,Jul,RON-2018-07-17,15,3,1,"Adelphia, NJ"
122,Turf Quality,8/15/18,8,62,DLFPS-340/3552,DLF Pickseed USA,RMD,9,2,121,2018,Aug,RMD-2018-08-15,9,2,1,"Adelphia, NJ"
122,Turf Quality,9/12/18,7,62,DLFPS-340/3552,DLF Pickseed USA,RON,9,2,121,2018,Sep,RON-2018-09-12,16,9,1,"Adelphia, NJ"
122,Turf Quality,10/2/18,5,62,DLFPS-340/3552,DLF Pickseed USA,RON,9,2,121,2018,Oct,RON-2018-10-02,17,8,1,"Adelphia, NJ"
122,Turf Quality,11/9/18,7,62,DLFPS-340/3552,DLF Pickseed USA,RON,9,2,121,2018,Nov,RON-2018-11-09,18,7,1,"Adelphia, NJ"
122,Turf Quality,4/17/19,5,62,DLFPS-340/3552,DLF Pickseed USA,RON,9,2,121,2019,Apr,RON-2019-04-17,19,1,2,"Adelphia, NJ"
122,Turf Quality,5/2/19,5,62,DLFPS-340/3552,DLF Pickseed USA,RON,9,2,121,2019,May,RON-2019-05-02,20,6,2,"Adelphia, NJ"
122,Turf Quality,6/13/19,6,62,DLFPS-340/3552,DLF Pickseed USA,RON,9,2,121,2019,Jun,RON-2019-06-13,21,4,2,"Adelphia, NJ"
122,Turf Quality,6/17/19,3,62,DLFPS-340/3552,DLF Pickseed USA,SAB,9,2,121,2019,Jun,SAB-2019-06-17,25,4,2,"Adelphia, NJ"
122,Turf Quality,7/17/19,5,62,DLFPS-340/3552,DLF Pickseed USA,RON,9,2,121,2019,Jul,RON-2019-07-17,22,3,2,"Adelphia, NJ"
122,Turf Quality,8/22/19,7,62,DLFPS-340/3552,DLF Pickseed USA,SAB,9,2,121,2019,Aug,SAB-2019-08-22,26,2,2,"Adelphia, NJ"
122,Turf Quality,9/16/19,9,62,DLFPS-340/3552,DLF Pickseed USA,RON,9,2,121,2019,Sep,RON-2019-09-16,23,9,2,"Adelphia, NJ"
122,Turf Quality,10/10/19,6,62,DLFPS-340/3552,DLF Pickseed USA,SAB,9,2,121,2019,Oct,SAB-2019-10-10,27,8,2,"Adelphia, NJ"
122,Turf Quality,11/1/19,7,62,DLFPS-340/3552,DLF Pickseed USA,RON,9,2,121,2019,Nov,RON-2019-11-01,24,7,2,"Adelphia, NJ"
122,Turf Quality,4/28/20,6,62,DLFPS-340/3552,DLF Pickseed USA,WAM,9,2,121,2020,Apr,WAM-2020-04-28,31,1,3,"Adelphia, NJ"
122,Turf Quality,5/18/20,7,62,DLFPS-340/3552,DLF Pickseed USA,SAB,9,2,121,2020,May,SAB-2020-05-18,28,6,3,"Adelphia, NJ"
122,Turf Quality,6/17/20,6,62,DLFPS-340/3552,DLF Pickseed USA,WAM,9,2,121,2020,Jun,WAM-2020-06-17,32,4,3,"Adelphia, NJ"
122,Turf Quality,7/15/20,7,62,DLFPS-340/3552,DLF Pickseed USA,WAM,9,2,121,2020,Jul,WAM-2020-07-15,33,3,3,"Adelphia, NJ"
122,Turf Quality,8/6/20,8,62,DLFPS-340/3552,DLF Pickseed USA,PLV,9,2,121,2020,Aug,PLV-2020-08-06,5,2,3,"Adelphia, NJ"
122,Turf Quality,9/2/20,8,62,DLFPS-340/3552,DLF Pickseed USA,DAS,9,2,121,2020,Sep,DAS-2020-09-02,1,9,3,"Adelphia, NJ"
122,Turf Quality,10/15/20,7,62,DLFPS-340/3552,DLF Pickseed USA,WAM,9,2,121,2020,Oct,WAM-2020-10-15,34,8,3,"Adelphia, NJ"
122,Turf Quality,11/5/20,6,62,DLFPS-340/3552,DLF Pickseed USA,WAM,9,2,121,2020,Nov,WAM-2020-11-05,35,7,3,"Adelphia, NJ"
122,Turf Quality,10/15/20,7,62,DLFPS-340/3552,DLF Pickseed USA,RMD,9,2,121,2020,Oct,RMD-2020-10-15,10,8,3,"Adelphia, NJ"
122,Turf Quality,10/23/20,8,62,DLFPS-340/3552,DLF Pickseed USA,RMD,9,2,121,2020,Oct,RMD-2020-10-23,11,8,3,"Adelphia, NJ"
122,Turf Quality,3/30/21,6,62,DLFPS-340/3552,DLF Pickseed USA,RMD,9,2,121,2021,Mar,RMD-2021-03-30,12,5,4,"Adelphia, NJ"
122,Turf Quality,4/22/21,8,62,DLFPS-340/3552,DLF Pickseed USA,PLV,9,2,121,2021,Apr,PLV-2021-04-22,6,1,4,"Adelphia, NJ"
122,Turf Quality,5/28/21,5,62,DLFPS-340/3552,DLF Pickseed USA,SAB,9,2,121,2021,May,SAB-2021-05-28,29,6,4,"Adelphia, NJ"
122,Turf Quality,6/11/21,5,62,DLFPS-340/3552,DLF Pickseed USA,JEN,9,2,121,2021,Jun,JEN-2021-06-11,2,4,4,"Adelphia, NJ"
122,Turf Quality,7/13/21,5,62,DLFPS-340/3552,DLF Pickseed USA,PLV,9,2,121,2021,Jul,PLV-2021-07-13,7,3,4,"Adelphia, NJ"
122,Turf Quality,8/11/21,7,62,DLFPS-340/3552,DLF Pickseed USA,JEN,9,2,121,2021,Aug,JEN-2021-08-11,3,2,4,"Adelphia, NJ"
122,Turf Quality,9/17/21,7,62,DLFPS-340/3552,DLF Pickseed USA,JEN,9,2,121,2021,Sep,JEN-2021-09-17,4,9,4,"Adelphia, NJ"
122,Turf Quality,10/13/21,7,62,DLFPS-340/3552,DLF Pickseed USA,SAB,9,2,121,2021,Oct,SAB-2021-10-13,30,8,4,"Adelphia, NJ"
122,Turf Quality,11/18/21,8,62,DLFPS-340/3552,DLF Pickseed USA,WAM,9,2,121,2021,Nov,WAM-2021-11-18,36,7,4,"Adelphia, NJ"
119,Turf Quality,4/18/18,7,23,Barvette HGT,Standard,RMD,8,2,118,2018,Apr,RMD-2018-04-18,8,1,1,"Adelphia, NJ"
119,Turf Quality,5/10/18,5,23,Barvette HGT,Standard,RON,8,2,118,2018,May,RON-2018-05-10,13,6,1,"Adelphia, NJ"
119,Turf Quality,6/7/18,4,23,Barvette HGT,Standard,RON,8,2,118,2018,Jun,RON-2018-06-07,14,4,1,"Adelphia, NJ"
119,Turf Quality,7/17/18,6,23,Barvette HGT,Standard,RON,8,2,118,2018,Jul,RON-2018-07-17,15,3,1,"Adelphia, NJ"
119,Turf Quality,8/15/18,8,23,Barvette HGT,Standard,RMD,8,2,118,2018,Aug,RMD-2018-08-15,9,2,1,"Adelphia, NJ"
119,Turf Quality,9/12/18,8,23,Barvette HGT,Standard,RON,8,2,118,2018,Sep,RON-2018-09-12,16,9,1,"Adelphia, NJ"
119,Turf Quality,10/2/18,8,23,Barvette HGT,Standard,RON,8,2,118,2018,Oct,RON-2018-10-02,17,8,1,"Adelphia, NJ"
119,Turf Quality,11/9/18,9,23,Barvette HGT,Standard,RON,8,2,118,2018,Nov,RON-2018-11-09,18,7,1,"Adelphia, NJ"
119,Turf Quality,4/17/19,7,23,Barvette HGT,Standard,RON,8,2,118,2019,Apr,RON-2019-04-17,19,1,2,"Adelphia, NJ"
119,Turf Quality,5/2/19,4,23,Barvette HGT,Standard,RON,8,2,118,2019,May,RON-2019-05-02,20,6,2,"Adelphia, NJ"
119,Turf Quality,6/13/19,5,23,Barvette HGT,Standard,RON,8,2,118,2019,Jun,RON-2019-06-13,21,4,2,"Adelphia, NJ"
119,Turf Quality,6/17/19,4,23,Barvette HGT,Standard,SAB,8,2,118,2019,Jun,SAB-2019-06-17,25,4,2,"Adelphia, NJ"
119,Turf Quality,7/17/19,5,23,Barvette HGT,Standard,RON,8,2,118,2019,Jul,RON-2019-07-17,22,3,2,"Adelphia, NJ"
119,Turf Quality,8/22/19,7,23,Barvette HGT,Standard,SAB,8,2,118,2019,Aug,SAB-2019-08-22,26,2,2,"Adelphia, NJ"
119,Turf Quality,9/16/19,8,23,Barvette HGT,Standard,RON,8,2,118,2019,Sep,RON-2019-09-16,23,9,2,"Adelphia, NJ"
119,Turf Quality,10/10/19,7,23,Barvette HGT,Standard,SAB,8,2,118,2019,Oct,SAB-2019-10-10,27,8,2,"Adelphia, NJ"
119,Turf Quality,11/1/19,8,23,Barvette HGT,Standard,RON,8,2,118,2019,Nov,RON-2019-11-01,24,7,2,"Adelphia, NJ"
119,Turf Quality,4/28/20,5,23,Barvette HGT,Standard,WAM,8,2,118,2020,Apr,WAM-2020-04-28,31,1,3,"Adelphia, NJ"
119,Turf Quality,5/18/20,7,23,Barvette HGT,Standard,SAB,8,2,118,2020,May,SAB-2020-05-18,28,6,3,"Adelphia, NJ"
119,Turf Quality,6/17/20,4,23,Barvette HGT,Standard,WAM,8,2,118,2020,Jun,WAM-2020-06-17,32,4,3,"Adelphia, NJ"
119,Turf Quality,7/15/20,5,23,Barvette HGT,Standard,WAM,8,2,118,2020,Jul,WAM-2020-07-15,33,3,3,"Adelphia, NJ"
119,Turf Quality,8/6/20,7,23,Barvette HGT,Standard,PLV,8,2,118,2020,Aug,PLV-2020-08-06,5,2,3,"Adelphia, NJ"
119,Turf Quality,9/2/20,7,23,Barvette HGT,Standard,DAS,8,2,118,2020,Sep,DAS-2020-09-02,1,9,3,"Adelphia, NJ"
119,Turf Quality,10/15/20,5,23,Barvette HGT,Standard,WAM,8,2,118,2020,Oct,WAM-2020-10-15,34,8,3,"Adelphia, NJ"
119,Turf Quality,11/5/20,6,23,Barvette HGT,Standard,WAM,8,2,118,2020,Nov,WAM-2020-11-05,35,7,3,"Adelphia, NJ"
119,Turf Quality,10/15/20,8,23,Barvette HGT,Standard,RMD,8,2,118,2020,Oct,RMD-2020-10-15,10,8,3,"Adelphia, NJ"
119,Turf Quality,10/23/20,7,23,Barvette HGT,Standard,RMD,8,2,118,2020,Oct,RMD-2020-10-23,11,8,3,"Adelphia, NJ"
119,Turf Quality,3/30/21,9,23,Barvette HGT,Standard,RMD,8,2,118,2021,Mar,RMD-2021-03-30,12,5,4,"Adelphia, NJ"
119,Turf Quality,4/22/21,6,23,Barvette HGT,Standard,PLV,8,2,118,2021,Apr,PLV-2021-04-22,6,1,4,"Adelphia, NJ"
119,Turf Quality,5/28/21,4,23,Barvette HGT,Standard,SAB,8,2,118,2021,May,SAB-2021-05-28,29,6,4,"Adelphia, NJ"
119,Turf Quality,6/11/21,4,23,Barvette HGT,Standard,JEN,8,2,118,2021,Jun,JEN-2021-06-11,2,4,4,"Adelphia, NJ"
119,Turf Quality,7/13/21,4,23,Barvette HGT,Standard,PLV,8,2,118,2021,Jul,PLV-2021-07-13,7,3,4,"Adelphia, NJ"
119,Turf Quality,8/11/21,5,23,Barvette HGT,Standard,JEN,8,2,118,2021,Aug,JEN-2021-08-11,3,2,4,"Adelphia, NJ"
119,Turf Quality,9/17/21,7,23,Barvette HGT,Standard,JEN,8,2,118,2021,Sep,JEN-2021-09-17,4,9,4,"Adelphia, NJ"
119,Turf Quality,10/13/21,7,23,Barvette HGT,Standard,SAB,8,2,118,2021,Oct,SAB-2021-10-13,30,8,4,"Adelphia, NJ"
119,Turf Quality,11/18/21,7,23,Barvette HGT,Standard,WAM,8,2,118,2021,Nov,WAM-2021-11-18,36,7,4,"Adelphia, NJ"
92,Turf Quality,4/18/18,4,38,Amaze (NAI-14-133),Columbia River Seed,RMD,7,2,91,2018,Apr,RMD-2018-04-18,8,1,1,"Adelphia, NJ"
92,Turf Quality,5/10/18,5,38,Amaze (NAI-14-133),Columbia River Seed,RON,7,2,91,2018,May,RON-2018-05-10,13,6,1,"Adelphia, NJ"
92,Turf Quality,6/7/18,4,38,Amaze (NAI-14-133),Columbia River Seed,RON,7,2,91,2018,Jun,RON-2018-06-07,14,4,1,"Adelphia, NJ"
92,Turf Quality,7/17/18,5,38,Amaze (NAI-14-133),Columbia River Seed,RON,7,2,91,2018,Jul,RON-2018-07-17,15,3,1,"Adelphia, NJ"
92,Turf Quality,8/15/18,9,38,Amaze (NAI-14-133),Columbia River Seed,RMD,7,2,91,2018,Aug,RMD-2018-08-15,9,2,1,"Adelphia, NJ"
92,Turf Quality,9/12/18,6,38,Amaze (NAI-14-133),Columbia River Seed,RON,7,2,91,2018,Sep,RON-2018-09-12,16,9,1,"Adelphia, NJ"
92,Turf Quality,10/2/18,7,38,Amaze (NAI-14-133),Columbia River Seed,RON,7,2,91,2018,Oct,RON-2018-10-02,17,8,1,"Adelphia, NJ"
92,Turf Quality,11/9/18,8,38,Amaze (NAI-14-133),Columbia River Seed,RON,7,2,91,2018,Nov,RON-2018-11-09,18,7,1,"Adelphia, NJ"
92,Turf Quality,4/17/19,7,38,Amaze (NAI-14-133),Columbia River Seed,RON,7,2,91,2019,Apr,RON-2019-04-17,19,1,2,"Adelphia, NJ"
92,Turf Quality,5/2/19,6,38,Amaze (NAI-14-133),Columbia River Seed,RON,7,2,91,2019,May,RON-2019-05-02,20,6,2,"Adelphia, NJ"
92,Turf Quality,6/13/19,8,38,Amaze (NAI-14-133),Columbia River Seed,RON,7,2,91,2019,Jun,RON-2019-06-13,21,4,2,"Adelphia, NJ"
92,Turf Quality,6/17/19,7,38,Amaze (NAI-14-133),Columbia River Seed,SAB,7,2,91,2019,Jun,SAB-2019-06-17,25,4,2,"Adelphia, NJ"
92,Turf Quality,7/17/19,8,38,Amaze (NAI-14-133),Columbia River Seed,RON,7,2,91,2019,Jul,RON-2019-07-17,22,3,2,"Adelphia, NJ"
92,Turf Quality,8/22/19,7,38,Amaze (NAI-14-133),Columbia River Seed,SAB,7,2,91,2019,Aug,SAB-2019-08-22,26,2,2,"Adelphia, NJ"
92,Turf Quality,9/16/19,7,38,Amaze (NAI-14-133),Columbia River Seed,RON,7,2,91,2019,Sep,RON-2019-09-16,23,9,2,"Adelphia, NJ"
92,Turf Quality,10/10/19,5,38,Amaze (NAI-14-133),Columbia River Seed,SAB,7,2,91,2019,Oct,SAB-2019-10-10,27,8,2,"Adelphia, NJ"
92,Turf Quality,11/1/19,6,38,Amaze (NAI-14-133),Columbia River Seed,RON,7,2,91,2019,Nov,RON-2019-11-01,24,7,2,"Adelphia, NJ"
92,Turf Quality,4/28/20,6,38,Amaze (NAI-14-133),Columbia River Seed,WAM,7,2,91,2020,Apr,WAM-2020-04-28,31,1,3,"Adelphia, NJ"
92,Turf Quality,5/18/20,8,38,Amaze (NAI-14-133),Columbia River Seed,SAB,7,2,91,2020,May,SAB-2020-05-18,28,6,3,"Adelphia, NJ"
92,Turf Quality,6/17/20,7,38,Amaze (NAI-14-133),Columbia River Seed,WAM,7,2,91,2020,Jun,WAM-2020-06-17,32,4,3,"Adelphia, NJ"
92,Turf Quality,7/15/20,7,38,Amaze (NAI-14-133),Columbia River Seed,WAM,7,2,91,2020,Jul,WAM-2020-07-15,33,3,3,"Adelphia, NJ"
92,Turf Quality,8/6/20,8,38,Amaze (NAI-14-133),Columbia River Seed,PLV,7,2,91,2020,Aug,PLV-2020-08-06,5,2,3,"Adelphia, NJ"
92,Turf Quality,9/2/20,6,38,Amaze (NAI-14-133),Columbia River Seed,DAS,7,2,91,2020,Sep,DAS-2020-09-02,1,9,3,"Adelphia, NJ"
92,Turf Quality,10/15/20,3,38,Amaze (NAI-14-133),Columbia River Seed,WAM,7,2,91,2020,Oct,WAM-2020-10-15,34,8,3,"Adelphia, NJ"
92,Turf Quality,11/5/20,4,38,Amaze (NAI-14-133),Columbia River Seed,WAM,7,2,91,2020,Nov,WAM-2020-11-05,35,7,3,"Adelphia, NJ"
92,Turf Quality,10/15/20,4,38,Amaze (NAI-14-133),Columbia River Seed,RMD,7,2,91,2020,Oct,RMD-2020-10-15,10,8,3,"Adelphia, NJ"
92,Turf Quality,10/23/20,5,38,Amaze (NAI-14-133),Columbia River Seed,RMD,7,2,91,2020,Oct,RMD-2020-10-23,11,8,3,"Adelphia, NJ"
92,Turf Quality,3/30/21,5,38,Amaze (NAI-14-133),Columbia River Seed,RMD,7,2,91,2021,Mar,RMD-2021-03-30,12,5,4,"Adelphia, NJ"
92,Turf Quality,4/22/21,6,38,Amaze (NAI-14-133),Columbia River Seed,PLV,7,2,91,2021,Apr,PLV-2021-04-22,6,1,4,"Adelphia, NJ"
92,Turf Quality,5/28/21,6,38,Amaze (NAI-14-133),Columbia River Seed,SAB,7,2,91,2021,May,SAB-2021-05-28,29,6,4,"Adelphia, NJ"
92,Turf Quality,6/11/21,5,38,Amaze (NAI-14-133),Columbia River Seed,JEN,7,2,91,2021,Jun,JEN-2021-06-11,2,4,4,"Adelphia, NJ"
92,Turf Quality,7/13/21,7,38,Amaze (NAI-14-133),Columbia River Seed,PLV,7,2,91,2021,Jul,PLV-2021-07-13,7,3,4,"Adelphia, NJ"
92,Turf Quality,8/11/21,6,38,Amaze (NAI-14-133),Columbia River Seed,JEN,7,2,91,2021,Aug,JEN-2021-08-11,3,2,4,"Adelphia, NJ"
92,Turf Quality,9/17/21,5,38,Amaze (NAI-14-133),Columbia River Seed,JEN,7,2,91,2021,Sep,JEN-2021-09-17,4,9,4,"Adelphia, NJ"
92,Turf Quality,10/13/21,4,38,Amaze (NAI-14-133),Columbia River Seed,SAB,7,2,91,2021,Oct,SAB-2021-10-13,30,8,4,"Adelphia, NJ"
92,Turf Quality,11/18/21,4,38,Amaze (NAI-14-133),Columbia River Seed,WAM,7,2,91,2021,Nov,WAM-2021-11-18,36,7,4,"Adelphia, NJ"
89,Turf Quality,4/18/18,3,89,PST-T14-39,Pure Seed Testing Inc.,RMD,6,2,89,2018,Apr,RMD-2018-04-18,8,1,1,"Adelphia, NJ"
89,Turf Quality,5/10/18,4,89,PST-T14-39,Pure Seed Testing Inc.,RON,6,2,89,2018,May,RON-2018-05-10,13,6,1,"Adelphia, NJ"
89,Turf Quality,6/7/18,5,89,PST-T14-39,Pure Seed Testing Inc.,RON,6,2,89,2018,Jun,RON-2018-06-07,14,4,1,"Adelphia, NJ"
89,Turf Quality,7/17/18,6,89,PST-T14-39,Pure Seed Testing Inc.,RON,6,2,89,2018,Jul,RON-2018-07-17,15,3,1,"Adelphia, NJ"
89,Turf Quality,8/15/18,8,89,PST-T14-39,Pure Seed Testing Inc.,RMD,6,2,89,2018,Aug,RMD-2018-08-15,9,2,1,"Adelphia, NJ"
89,Turf Quality,9/12/18,6,89,PST-T14-39,Pure Seed Testing Inc.,RON,6,2,89,2018,Sep,RON-2018-09-12,16,9,1,"Adelphia, NJ"
89,Turf Quality,10/2/18,6,89,PST-T14-39,Pure Seed Testing Inc.,RON,6,2,89,2018,Oct,RON-2018-10-02,17,8,1,"Adelphia, NJ"
89,Turf Quality,11/9/18,7,89,PST-T14-39,Pure Seed Testing Inc.,RON,6,2,89,2018,Nov,RON-2018-11-09,18,7,1,"Adelphia, NJ"
89,Turf Quality,4/17/19,7,89,PST-T14-39,Pure Seed Testing Inc.,RON,6,2,89,2019,Apr,RON-2019-04-17,19,1,2,"Adelphia, NJ"
89,Turf Quality,5/2/19,6,89,PST-T14-39,Pure Seed Testing Inc.,RON,6,2,89,2019,May,RON-2019-05-02,20,6,2,"Adelphia, NJ"
89,Turf Quality,6/13/19,5,89,PST-T14-39,Pure Seed Testing Inc.,RON,6,2,89,2019,Jun,RON-2019-06-13,21,4,2,"Adelphia, NJ"
89,Turf Quality,6/17/19,5,89,PST-T14-39,Pure Seed Testing Inc.,SAB,6,2,89,2019,Jun,SAB-2019-06-17,25,4,2,"Adelphia, NJ"
89,Turf Quality,7/17/19,6,89,PST-T14-39,Pure Seed Testing Inc.,RON,6,2,89,2019,Jul,RON-2019-07-17,22,3,2,"Adelphia, NJ"
89,Turf Quality,8/22/19,6,89,PST-T14-39,Pure Seed Testing Inc.,SAB,6,2,89,2019,Aug,SAB-2019-08-22,26,2,2,"Adelphia, NJ"
89,Turf Quality,9/16/19,7,89,PST-T14-39,Pure Seed Testing Inc.,RON,6,2,89,2019,Sep,RON-2019-09-16,23,9,2,"Adelphia, NJ"
89,Turf Quality,10/10/19,5,89,PST-T14-39,Pure Seed Testing Inc.,SAB,6,2,89,2019,Oct,SAB-2019-10-10,27,8,2,"Adelphia, NJ"
89,Turf Quality,11/1/19,3,89,PST-T14-39,Pure Seed Testing Inc.,RON,6,2,89,2019,Nov,RON-2019-11-01,24,7,2,"Adelphia, NJ"
89,Turf Quality,4/28/20,5,89,PST-T14-39,Pure Seed Testing Inc.,WAM,6,2,89,2020,Apr,WAM-2020-04-28,31,1,3,"Adelphia, NJ"
89,Turf Quality,5/18/20,6,89,PST-T14-39,Pure Seed Testing Inc.,SAB,6,2,89,2020,May,SAB-2020-05-18,28,6,3,"Adelphia, NJ"
89,Turf Quality,6/17/20,5,89,PST-T14-39,Pure Seed Testing Inc.,WAM,6,2,89,2020,Jun,WAM-2020-06-17,32,4,3,"Adelphia, NJ"
89,Turf Quality,7/15/20,6,89,PST-T14-39,Pure Seed Testing Inc.,WAM,6,2,89,2020,Jul,WAM-2020-07-15,33,3,3,"Adelphia, NJ"
89,Turf Quality,8/6/20,6,89,PST-T14-39,Pure Seed Testing Inc.,PLV,6,2,89,2020,Aug,PLV-2020-08-06,5,2,3,"Adelphia, NJ"
89,Turf Quality,9/2/20,6,89,PST-T14-39,Pure Seed Testing Inc.,DAS,6,2,89,2020,Sep,DAS-2020-09-02,1,9,3,"Adelphia, NJ"
89,Turf Quality,10/15/20,4,89,PST-T14-39,Pure Seed Testing Inc.,WAM,6,2,89,2020,Oct,WAM-2020-10-15,34,8,3,"Adelphia, NJ"
89,Turf Quality,11/5/20,4,89,PST-T14-39,Pure Seed Testing Inc.,WAM,6,2,89,2020,Nov,WAM-2020-11-05,35,7,3,"Adelphia, NJ"
89,Turf Quality,10/15/20,3,89,PST-T14-39,Pure Seed Testing Inc.,RMD,6,2,89,2020,Oct,RMD-2020-10-15,10,8,3,"Adelphia, NJ"
89,Turf Quality,10/23/20,5,89,PST-T14-39,Pure Seed Testing Inc.,RMD,6,2,89,2020,Oct,RMD-2020-10-23,11,8,3,"Adelphia, NJ"
89,Turf Quality,3/30/21,2,89,PST-T14-39,Pure Seed Testing Inc.,RMD,6,2,89,2021,Mar,RMD-2021-03-30,12,5,4,"Adelphia, NJ"
89,Turf Quality,4/22/21,3,89,PST-T14-39,Pure Seed Testing Inc.,PLV,6,2,89,2021,Apr,PLV-2021-04-22,6,1,4,"Adelphia, NJ"
89,Turf Quality,5/28/21,4,89,PST-T14-39,Pure Seed Testing Inc.,SAB,6,2,89,2021,May,SAB-2021-05-28,29,6,4,"Adelphia, NJ"
89,Turf Quality,6/11/21,5,89,PST-T14-39,Pure Seed Testing Inc.,JEN,6,2,89,2021,Jun,JEN-2021-06-11,2,4,4,"Adelphia, NJ"
89,Turf Quality,7/13/21,4,89,PST-T14-39,Pure Seed Testing Inc.,PLV,6,2,89,2021,Jul,PLV-2021-07-13,7,3,4,"Adelphia, NJ"
89,Turf Quality,8/11/21,6,89,PST-T14-39,Pure Seed Testing Inc.,JEN,6,2,89,2021,Aug,JEN-2021-08-11,3,2,4,"Adelphia, NJ"
89,Turf Quality,9/17/21,7,89,PST-T14-39,Pure Seed Testing Inc.,JEN,6,2,89,2021,Sep,JEN-2021-09-17,4,9,4,"Adelphia, NJ"
89,Turf Quality,10/13/21,4,89,PST-T14-39,Pure Seed Testing Inc.,SAB,6,2,89,2021,Oct,SAB-2021-10-13,30,8,4,"Adelphia, NJ"
89,Turf Quality,11/18/21,6,89,PST-T14-39,Pure Seed Testing Inc.,WAM,6,2,89,2021,Nov,WAM-2021-11-18,36,7,4,"Adelphia, NJ"
62,Turf Quality,4/18/18,3,62,DLFPS-340/3552,DLF Pickseed USA,RMD,5,2,62,2018,Apr,RMD-2018-04-18,8,1,1,"Adelphia, NJ"
62,Turf Quality,5/10/18,4,62,DLFPS-340/3552,DLF Pickseed USA,RON,5,2,62,2018,May,RON-2018-05-10,13,6,1,"Adelphia, NJ"
62,Turf Quality,6/7/18,5,62,DLFPS-340/3552,DLF Pickseed USA,RON,5,2,62,2018,Jun,RON-2018-06-07,14,4,1,"Adelphia, NJ"
62,Turf Quality,7/17/18,5,62,DLFPS-340/3552,DLF Pickseed USA,RON,5,2,62,2018,Jul,RON-2018-07-17,15,3,1,"Adelphia, NJ"
62,Turf Quality,8/15/18,8,62,DLFPS-340/3552,DLF Pickseed USA,RMD,5,2,62,2018,Aug,RMD-2018-08-15,9,2,1,"Adelphia, NJ"
62,Turf Quality,9/12/18,7,62,DLFPS-340/3552,DLF Pickseed USA,RON,5,2,62,2018,Sep,RON-2018-09-12,16,9,1,"Adelphia, NJ"
62,Turf Quality,10/2/18,8,62,DLFPS-340/3552,DLF Pickseed USA,RON,5,2,62,2018,Oct,RON-2018-10-02,17,8,1,"Adelphia, NJ"
62,Turf Quality,11/9/18,7,62,DLFPS-340/3552,DLF Pickseed USA,RON,5,2,62,2018,Nov,RON-2018-11-09,18,7,1,"Adelphia, NJ"
62,Turf Quality,4/17/19,5,62,DLFPS-340/3552,DLF Pickseed USA,RON,5,2,62,2019,Apr,RON-2019-04-17,19,1,2,"Adelphia, NJ"
62,Turf Quality,5/2/19,5,62,DLFPS-340/3552,DLF Pickseed USA,RON,5,2,62,2019,May,RON-2019-05-02,20,6,2,"Adelphia, NJ"
62,Turf Quality,6/13/19,6,62,DLFPS-340/3552,DLF Pickseed USA,RON,5,2,62,2019,Jun,RON-2019-06-13,21,4,2,"Adelphia, NJ"
62,Turf Quality,6/17/19,5,62,DLFPS-340/3552,DLF Pickseed USA,SAB,5,2,62,2019,Jun,SAB-2019-06-17,25,4,2,"Adelphia, NJ"
62,Turf Quality,7/17/19,6,62,DLFPS-340/3552,DLF Pickseed USA,RON,5,2,62,2019,Jul,RON-2019-07-17,22,3,2,"Adelphia, NJ"
62,Turf Quality,8/22/19,8,62,DLFPS-340/3552,DLF Pickseed USA,SAB,5,2,62,2019,Aug,SAB-2019-08-22,26,2,2,"Adelphia, NJ"
62,Turf Quality,9/16/19,9,62,DLFPS-340/3552,DLF Pickseed USA,RON,5,2,62,2019,Sep,RON-2019-09-16,23,9,2,"Adelphia, NJ"
62,Turf Quality,10/10/19,7,62,DLFPS-340/3552,DLF Pickseed USA,SAB,5,2,62,2019,Oct,SAB-2019-10-10,27,8,2,"Adelphia, NJ"
62,Turf Quality,11/1/19,6,62,DLFPS-340/3552,DLF Pickseed USA,RON,5,2,62,2019,Nov,RON-2019-11-01,24,7,2,"Adelphia, NJ"
62,Turf Quality,4/28/20,7,62,DLFPS-340/3552,DLF Pickseed USA,WAM,5,2,62,2020,Apr,WAM-2020-04-28,31,1,3,"Adelphia, NJ"
62,Turf Quality,5/18/20,6,62,DLFPS-340/3552,DLF Pickseed USA,SAB,5,2,62,2020,May,SAB-2020-05-18,28,6,3,"Adelphia, NJ"
62,Turf Quality,6/17/20,5,62,DLFPS-340/3552,DLF Pickseed USA,WAM,5,2,62,2020,Jun,WAM-2020-06-17,32,4,3,"Adelphia, NJ"
62,Turf Quality,7/15/20,7,62,DLFPS-340/3552,DLF Pickseed USA,WAM,5,2,62,2020,Jul,WAM-2020-07-15,33,3,3,"Adelphia, NJ"
62,Turf Quality,8/6/20,7,62,DLFPS-340/3552,DLF Pickseed USA,PLV,5,2,62,2020,Aug,PLV-2020-08-06,5,2,3,"Adelphia, NJ"
62,Turf Quality,9/2/20,7,62,DLFPS-340/3552,DLF Pickseed USA,DAS,5,2,62,2020,Sep,DAS-2020-09-02,1,9,3,"Adelphia, NJ"
62,Turf Quality,10/15/20,7,62,DLFPS-340/3552,DLF Pickseed USA,WAM,5,2,62,2020,Oct,WAM-2020-10-15,34,8,3,"Adelphia, NJ"
62,Turf Quality,11/5/20,6,62,DLFPS-340/3552,DLF Pickseed USA,WAM,5,2,62,2020,Nov,WAM-2020-11-05,35,7,3,"Adelphia, NJ"
62,Turf Quality,10/15/20,6,62,DLFPS-340/3552,DLF Pickseed USA,RMD,5,2,62,2020,Oct,RMD-2020-10-15,10,8,3,"Adelphia, NJ"
62,Turf Quality,10/23/20,7,62,DLFPS-340/3552,DLF Pickseed USA,RMD,5,2,62,2020,Oct,RMD-2020-10-23,11,8,3,"Adelphia, NJ"
62,Turf Quality,3/30/21,7,62,DLFPS-340/3552,DLF Pickseed USA,RMD,5,2,62,2021,Mar,RMD-2021-03-30,12,5,4,"Adelphia, NJ"
62,Turf Quality,4/22/21,8,62,DLFPS-340/3552,DLF Pickseed USA,PLV,5,2,62,2021,Apr,PLV-2021-04-22,6,1,4,"Adelphia, NJ"
62,Turf Quality,5/28/21,5,62,DLFPS-340/3552,DLF Pickseed USA,SAB,5,2,62,2021,May,SAB-2021-05-28,29,6,4,"Adelphia, NJ"
62,Turf Quality,6/11/21,5,62,DLFPS-340/3552,DLF Pickseed USA,JEN,5,2,62,2021,Jun,JEN-2021-06-11,2,4,4,"Adelphia, NJ"
62,Turf Quality,7/13/21,7,62,DLFPS-340/3552,DLF Pickseed USA,PLV,5,2,62,2021,Jul,PLV-2021-07-13,7,3,4,"Adelphia, NJ"
62,Turf Quality,8/11/21,7,62,DLFPS-340/3552,DLF Pickseed USA,JEN,5,2,62,2021,Aug,JEN-2021-08-11,3,2,4,"Adelphia, NJ"
62,Turf Quality,9/17/21,8,62,DLFPS-340/3552,DLF Pickseed USA,JEN,5,2,62,2021,Sep,JEN-2021-09-17,4,9,4,"Adelphia, NJ"
62,Turf Quality,10/13/21,7,62,DLFPS-340/3552,DLF Pickseed USA,SAB,5,2,62,2021,Oct,SAB-2021-10-13,30,8,4,"Adelphia, NJ"
62,Turf Quality,11/18/21,8,62,DLFPS-340/3552,DLF Pickseed USA,WAM,5,2,62,2021,Nov,WAM-2021-11-18,36,7,4,"Adelphia, NJ"
59,Turf Quality,4/18/18,5,59,DLFPS-340/3455,DLF Pickseed USA,RMD,4,2,59,2018,Apr,RMD-2018-04-18,8,1,1,"Adelphia, NJ"
59,Turf Quality,5/10/18,6,59,DLFPS-340/3455,DLF Pickseed USA,RON,4,2,59,2018,May,RON-2018-05-10,13,6,1,"Adelphia, NJ"
59,Turf Quality,6/7/18,4,59,DLFPS-340/3455,DLF Pickseed USA,RON,4,2,59,2018,Jun,RON-2018-06-07,14,4,1,"Adelphia, NJ"
59,Turf Quality,7/17/18,5,59,DLFPS-340/3455,DLF Pickseed USA,RON,4,2,59,2018,Jul,RON-2018-07-17,15,3,1,"Adelphia, NJ"
59,Turf Quality,8/15/18,6,59,DLFPS-340/3455,DLF Pickseed USA,RMD,4,2,59,2018,Aug,RMD-2018-08-15,9,2,1,"Adelphia, NJ"
59,Turf Quality,9/12/18,5,59,DLFPS-340/3455,DLF Pickseed USA,RON,4,2,59,2018,Sep,RON-2018-09-12,16,9,1,"Adelphia, NJ"
59,Turf Quality,10/2/18,4,59,DLFPS-340/3455,DLF Pickseed USA,RON,4,2,59,2018,Oct,RON-2018-10-02,17,8,1,"Adelphia, NJ"
59,Turf Quality,11/9/18,4,59,DLFPS-340/3455,DLF Pickseed USA,RON,4,2,59,2018,Nov,RON-2018-11-09,18,7,1,"Adelphia, NJ"
59,Turf Quality,4/17/19,5,59,DLFPS-340/3455,DLF Pickseed USA,RON,4,2,59,2019,Apr,RON-2019-04-17,19,1,2,"Adelphia, NJ"
59,Turf Quality,5/2/19,5,59,DLFPS-340/3455,DLF Pickseed USA,RON,4,2,59,2019,May,RON-2019-05-02,20,6,2,"Adelphia, NJ"
59,Turf Quality,6/13/19,5,59,DLFPS-340/3455,DLF Pickseed USA,RON,4,2,59,2019,Jun,RON-2019-06-13,21,4,2,"Adelphia, NJ"
59,Turf Quality,6/17/19,5,59,DLFPS-340/3455,DLF Pickseed USA,SAB,4,2,59,2019,Jun,SAB-2019-06-17,25,4,2,"Adelphia, NJ"
59,Turf Quality,7/17/19,5,59,DLFPS-340/3455,DLF Pickseed USA,RON,4,2,59,2019,Jul,RON-2019-07-17,22,3,2,"Adelphia, NJ"
59,Turf Quality,8/22/19,5,59,DLFPS-340/3455,DLF Pickseed USA,SAB,4,2,59,2019,Aug,SAB-2019-08-22,26,2,2,"Adelphia, NJ"
59,Turf Quality,9/16/19,3,59,DLFPS-340/3455,DLF Pickseed USA,RON,4,2,59,2019,Sep,RON-2019-09-16,23,9,2,"Adelphia, NJ"
59,Turf Quality,10/10/19,3,59,DLFPS-340/3455,DLF Pickseed USA,SAB,4,2,59,2019,Oct,SAB-2019-10-10,27,8,2,"Adelphia, NJ"
59,Turf Quality,11/1/19,5,59,DLFPS-340/3455,DLF Pickseed USA,RON,4,2,59,2019,Nov,RON-2019-11-01,24,7,2,"Adelphia, NJ"
59,Turf Quality,4/28/20,7,59,DLFPS-340/3455,DLF Pickseed USA,WAM,4,2,59,2020,Apr,WAM-2020-04-28,31,1,3,"Adelphia, NJ"
59,Turf Quality,5/18/20,6,59,DLFPS-340/3455,DLF Pickseed USA,SAB,4,2,59,2020,May,SAB-2020-05-18,28,6,3,"Adelphia, NJ"
59,Turf Quality,6/17/20,3,59,DLFPS-340/3455,DLF Pickseed USA,WAM,4,2,59,2020,Jun,WAM-2020-06-17,32,4,3,"Adelphia, NJ"
59,Turf Quality,7/15/20,3,59,DLFPS-340/3455,DLF Pickseed USA,WAM,4,2,59,2020,Jul,WAM-2020-07-15,33,3,3,"Adelphia, NJ"
59,Turf Quality,8/6/20,5,59,DLFPS-340/3455,DLF Pickseed USA,PLV,4,2,59,2020,Aug,PLV-2020-08-06,5,2,3,"Adelphia, NJ"
59,Turf Quality,9/2/20,2,59,DLFPS-340/3455,DLF Pickseed USA,DAS,4,2,59,2020,Sep,DAS-2020-09-02,1,9,3,"Adelphia, NJ"
59,Turf Quality,10/15/20,3,59,DLFPS-340/3455,DLF Pickseed USA,WAM,4,2,59,2020,Oct,WAM-2020-10-15,34,8,3,"Adelphia, NJ"
59,Turf Quality,11/5/20,3,59,DLFPS-340/3455,DLF Pickseed USA,WAM,4,2,59,2020,Nov,WAM-2020-11-05,35,7,3,"Adelphia, NJ"
59,Turf Quality,10/15/20,3,59,DLFPS-340/3455,DLF Pickseed USA,RMD,4,2,59,2020,Oct,RMD-2020-10-15,10,8,3,"Adelphia, NJ"
59,Turf Quality,10/23/20,3,59,DLFPS-340/3455,DLF Pickseed USA,RMD,4,2,59,2020,Oct,RMD-2020-10-23,11,8,3,"Adelphia, NJ"
59,Turf Quality,3/30/21,3,59,DLFPS-340/3455,DLF Pickseed USA,RMD,4,2,59,2021,Mar,RMD-2021-03-30,12,5,4,"Adelphia, NJ"
59,Turf Quality,4/22/21,4,59,DLFPS-340/3455,DLF Pickseed USA,PLV,4,2,59,2021,Apr,PLV-2021-04-22,6,1,4,"Adelphia, NJ"
59,Turf Quality,5/28/21,4,59,DLFPS-340/3455,DLF Pickseed USA,SAB,4,2,59,2021,May,SAB-2021-05-28,29,6,4,"Adelphia, NJ"
59,Turf Quality,6/11/21,5,59,DLFPS-340/3455,DLF Pickseed USA,JEN,4,2,59,2021,Jun,JEN-2021-06-11,2,4,4,"Adelphia, NJ"
59,Turf Quality,7/13/21,5,59,DLFPS-340/3455,DLF Pickseed USA,PLV,4,2,59,2021,Jul,PLV-2021-07-13,7,3,4,"Adelphia, NJ"
59,Turf Quality,8/11/21,5,59,DLFPS-340/3455,DLF Pickseed USA,JEN,4,2,59,2021,Aug,JEN-2021-08-11,3,2,4,"Adelphia, NJ"
59,Turf Quality,9/17/21,4,59,DLFPS-340/3455,DLF Pickseed USA,JEN,4,2,59,2021,Sep,JEN-2021-09-17,4,9,4,"Adelphia, NJ"
59,Turf Quality,10/13/21,4,59,DLFPS-340/3455,DLF Pickseed USA,SAB,4,2,59,2021,Oct,SAB-2021-10-13,30,8,4,"Adelphia, NJ"
59,Turf Quality,11/18/21,5,59,DLFPS-340/3455,DLF Pickseed USA,WAM,4,2,59,2021,Nov,WAM-2021-11-18,36,7,4,"Adelphia, NJ"
32,Turf Quality,4/18/18,3,32,Blue Gem (NAI-13-9),Columbia River Seed,RMD,3,2,32,2018,Apr,RMD-2018-04-18,8,1,1,"Adelphia, NJ"
32,Turf Quality,5/10/18,4,32,Blue Gem (NAI-13-9),Columbia River Seed,RON,3,2,32,2018,May,RON-2018-05-10,13,6,1,"Adelphia, NJ"
32,Turf Quality,6/7/18,6,32,Blue Gem (NAI-13-9),Columbia River Seed,RON,3,2,32,2018,Jun,RON-2018-06-07,14,4,1,"Adelphia, NJ"
32,Turf Quality,7/17/18,6,32,Blue Gem (NAI-13-9),Columbia River Seed,RON,3,2,32,2018,Jul,RON-2018-07-17,15,3,1,"Adelphia, NJ"
32,Turf Quality,8/15/18,7,32,Blue Gem (NAI-13-9),Columbia River Seed,RMD,3,2,32,2018,Aug,RMD-2018-08-15,9,2,1,"Adelphia, NJ"
32,Turf Quality,9/12/18,7,32,Blue Gem (NAI-13-9),Columbia River Seed,RON,3,2,32,2018,Sep,RON-2018-09-12,16,9,1,"Adelphia, NJ"
32,Turf Quality,10/2/18,7,32,Blue Gem (NAI-13-9),Columbia River Seed,RON,3,2,32,2018,Oct,RON-2018-10-02,17,8,1,"Adelphia, NJ"
32,Turf Quality,11/9/18,6,32,Blue Gem (NAI-13-9),Columbia River Seed,RON,3,2,32,2018,Nov,RON-2018-11-09,18,7,1,"Adelphia, NJ"
32,Turf Quality,4/17/19,3,32,Blue Gem (NAI-13-9),Columbia River Seed,RON,3,2,32,2019,Apr,RON-2019-04-17,19,1,2,"Adelphia, NJ"
32,Turf Quality,5/2/19,4,32,Blue Gem (NAI-13-9),Columbia River Seed,RON,3,2,32,2019,May,RON-2019-05-02,20,6,2,"Adelphia, NJ"
32,Turf Quality,6/13/19,6,32,Blue Gem (NAI-13-9),Columbia River Seed,RON,3,2,32,2019,Jun,RON-2019-06-13,21,4,2,"Adelphia, NJ"
32,Turf Quality,6/17/19,4,32,Blue Gem (NAI-13-9),Columbia River Seed,SAB,3,2,32,2019,Jun,SAB-2019-06-17,25,4,2,"Adelphia, NJ"
32,Turf Quality,7/17/19,5,32,Blue Gem (NAI-13-9),Columbia River Seed,RON,3,2,32,2019,Jul,RON-2019-07-17,22,3,2,"Adelphia, NJ"
32,Turf Quality,8/22/19,8,32,Blue Gem (NAI-13-9),Columbia River Seed,SAB,3,2,32,2019,Aug,SAB-2019-08-22,26,2,2,"Adelphia, NJ"
32,Turf Quality,9/16/19,7,32,Blue Gem (NAI-13-9),Columbia River Seed,RON,3,2,32,2019,Sep,RON-2019-09-16,23,9,2,"Adelphia, NJ"
32,Turf Quality,10/10/19,3,32,Blue Gem (NAI-13-9),Columbia River Seed,SAB,3,2,32,2019,Oct,SAB-2019-10-10,27,8,2,"Adelphia, NJ"
32,Turf Quality,11/1/19,7,32,Blue Gem (NAI-13-9),Columbia River Seed,RON,3,2,32,2019,Nov,RON-2019-11-01,24,7,2,"Adelphia, NJ"
32,Turf Quality,4/28/20,3,32,Blue Gem (NAI-13-9),Columbia River Seed,WAM,3,2,32,2020,Apr,WAM-2020-04-28,31,1,3,"Adelphia, NJ"
32,Turf Quality,5/18/20,2,32,Blue Gem (NAI-13-9),Columbia River Seed,SAB,3,2,32,2020,May,SAB-2020-05-18,28,6,3,"Adelphia, NJ"
32,Turf Quality,6/17/20,5,32,Blue Gem (NAI-13-9),Columbia River Seed,WAM,3,2,32,2020,Jun,WAM-2020-06-17,32,4,3,"Adelphia, NJ"
32,Turf Quality,7/15/20,7,32,Blue Gem (NAI-13-9),Columbia River Seed,WAM,3,2,32,2020,Jul,WAM-2020-07-15,33,3,3,"Adelphia, NJ"
32,Turf Quality,8/6/20,8,32,Blue Gem (NAI-13-9),Columbia River Seed,PLV,3,2,32,2020,Aug,PLV-2020-08-06,5,2,3,"Adelphia, NJ"
32,Turf Quality,9/2/20,6,32,Blue Gem (NAI-13-9),Columbia River Seed,DAS,3,2,32,2020,Sep,DAS-2020-09-02,1,9,3,"Adelphia, NJ"
32,Turf Quality,10/15/20,2,32,Blue Gem (NAI-13-9),Columbia River Seed,WAM,3,2,32,2020,Oct,WAM-2020-10-15,34,8,3,"Adelphia, NJ"
32,Turf Quality,11/5/20,4,32,Blue Gem (NAI-13-9),Columbia River Seed,WAM,3,2,32,2020,Nov,WAM-2020-11-05,35,7,3,"Adelphia, NJ"
32,Turf Quality,10/15/20,3,32,Blue Gem (NAI-13-9),Columbia River Seed,RMD,3,2,32,2020,Oct,RMD-2020-10-15,10,8,3,"Adelphia, NJ"
32,Turf Quality,10/23/20,4,32,Blue Gem (NAI-13-9),Columbia River Seed,RMD,3,2,32,2020,Oct,RMD-2020-10-23,11,8,3,"Adelphia, NJ"
32,Turf Quality,3/30/21,3,32,Blue Gem (NAI-13-9),Columbia River Seed,RMD,3,2,32,2021,Mar,RMD-2021-03-30,12,5,4,"Adelphia, NJ"
32,Turf Quality,4/22/21,5,32,Blue Gem (NAI-13-9),Columbia River Seed,PLV,3,2,32,2021,Apr,PLV-2021-04-22,6,1,4,"Adelphia, NJ"
32,Turf Quality,5/28/21,4,32,Blue Gem (NAI-13-9),Columbia River Seed,SAB,3,2,32,2021,May,SAB-2021-05-28,29,6,4,"Adelphia, NJ"
32,Turf Quality,6/11/21,6,32,Blue Gem (NAI-13-9),Columbia River Seed,JEN,3,2,32,2021,Jun,JEN-2021-06-11,2,4,4,"Adelphia, NJ"
32,Turf Quality,7/13/21,8,32,Blue Gem (NAI-13-9),Columbia River Seed,PLV,3,2,32,2021,Jul,PLV-2021-07-13,7,3,4,"Adelphia, NJ"
32,Turf Quality,8/11/21,7,32,Blue Gem (NAI-13-9),Columbia River Seed,JEN,3,2,32,2021,Aug,JEN-2021-08-11,3,2,4,"Adelphia, NJ"
32,Turf Quality,9/17/21,6,32,Blue Gem (NAI-13-9),Columbia River Seed,JEN,3,2,32,2021,Sep,JEN-2021-09-17,4,9,4,"Adelphia, NJ"
32,Turf Quality,10/13/21,8,32,Blue Gem (NAI-13-9),Columbia River Seed,SAB,3,2,32,2021,Oct,SAB-2021-10-13,30,8,4,"Adelphia, NJ"
32,Turf Quality,11/18/21,7,32,Blue Gem (NAI-13-9),Columbia River Seed,WAM,3,2,32,2021,Nov,WAM-2021-11-18,36,7,4,"Adelphia, NJ"
29,Turf Quality,4/18/18,7,29,Jersey (NAI-A16-3),Novel AG Inc.,RMD,2,2,29,2018,Apr,RMD-2018-04-18,8,1,1,"Adelphia, NJ"
29,Turf Quality,5/10/18,6,29,Jersey (NAI-A16-3),Novel AG Inc.,RON,2,2,29,2018,May,RON-2018-05-10,13,6,1,"Adelphia, NJ"
29,Turf Quality,6/7/18,6,29,Jersey (NAI-A16-3),Novel AG Inc.,RON,2,2,29,2018,Jun,RON-2018-06-07,14,4,1,"Adelphia, NJ"
29,Turf Quality,7/17/18,7,29,Jersey (NAI-A16-3),Novel AG Inc.,RON,2,2,29,2018,Jul,RON-2018-07-17,15,3,1,"Adelphia, NJ"
29,Turf Quality,8/15/18,6,29,Jersey (NAI-A16-3),Novel AG Inc.,RMD,2,2,29,2018,Aug,RMD-2018-08-15,9,2,1,"Adelphia, NJ"
29,Turf Quality,9/12/18,5,29,Jersey (NAI-A16-3),Novel AG Inc.,RON,2,2,29,2018,Sep,RON-2018-09-12,16,9,1,"Adelphia, NJ"
29,Turf Quality,10/2/18,7,29,Jersey (NAI-A16-3),Novel AG Inc.,RON,2,2,29,2018,Oct,RON-2018-10-02,17,8,1,"Adelphia, NJ"
29,Turf Quality,11/9/18,6,29,Jersey (NAI-A16-3),Novel AG Inc.,RON,2,2,29,2018,Nov,RON-2018-11-09,18,7,1,"Adelphia, NJ"
29,Turf Quality,4/17/19,6,29,Jersey (NAI-A16-3),Novel AG Inc.,RON,2,2,29,2019,Apr,RON-2019-04-17,19,1,2,"Adelphia, NJ"
29,Turf Quality,5/2/19,6,29,Jersey (NAI-A16-3),Novel AG Inc.,RON,2,2,29,2019,May,RON-2019-05-02,20,6,2,"Adelphia, NJ"
29,Turf Quality,6/13/19,5,29,Jersey (NAI-A16-3),Novel AG Inc.,RON,2,2,29,2019,Jun,RON-2019-06-13,21,4,2,"Adelphia, NJ"
29,Turf Quality,6/17/19,4,29,Jersey (NAI-A16-3),Novel AG Inc.,SAB,2,2,29,2019,Jun,SAB-2019-06-17,25,4,2,"Adelphia, NJ"
29,Turf Quality,7/17/19,4,29,Jersey (NAI-A16-3),Novel AG Inc.,RON,2,2,29,2019,Jul,RON-2019-07-17,22,3,2,"Adelphia, NJ"
29,Turf Quality,8/22/19,4,29,Jersey (NAI-A16-3),Novel AG Inc.,SAB,2,2,29,2019,Aug,SAB-2019-08-22,26,2,2,"Adelphia, NJ"
29,Turf Quality,9/16/19,4,29,Jersey (NAI-A16-3),Novel AG Inc.,RON,2,2,29,2019,Sep,RON-2019-09-16,23,9,2,"Adelphia, NJ"
29,Turf Quality,10/10/19,3,29,Jersey (NAI-A16-3),Novel AG Inc.,SAB,2,2,29,2019,Oct,SAB-2019-10-10,27,8,2,"Adelphia, NJ"
29,Turf Quality,11/1/19,5,29,Jersey (NAI-A16-3),Novel AG Inc.,RON,2,2,29,2019,Nov,RON-2019-11-01,24,7,2,"Adelphia, NJ"
29,Turf Quality,4/28/20,4,29,Jersey (NAI-A16-3),Novel AG Inc.,WAM,2,2,29,2020,Apr,WAM-2020-04-28,31,1,3,"Adelphia, NJ"
29,Turf Quality,5/18/20,6,29,Jersey (NAI-A16-3),Novel AG Inc.,SAB,2,2,29,2020,May,SAB-2020-05-18,28,6,3,"Adelphia, NJ"
29,Turf Quality,6/17/20,5,29,Jersey (NAI-A16-3),Novel AG Inc.,WAM,2,2,29,2020,Jun,WAM-2020-06-17,32,4,3,"Adelphia, NJ"
29,Turf Quality,7/15/20,4,29,Jersey (NAI-A16-3),Novel AG Inc.,WAM,2,2,29,2020,Jul,WAM-2020-07-15,33,3,3,"Adelphia, NJ"
29,Turf Quality,8/6/20,5,29,Jersey (NAI-A16-3),Novel AG Inc.,PLV,2,2,29,2020,Aug,PLV-2020-08-06,5,2,3,"Adelphia, NJ"
29,Turf Quality,9/2/20,4,29,Jersey (NAI-A16-3),Novel AG Inc.,DAS,2,2,29,2020,Sep,DAS-2020-09-02,1,9,3,"Adelphia, NJ"
29,Turf Quality,10/15/20,2,29,Jersey (NAI-A16-3),Novel AG Inc.,WAM,2,2,29,2020,Oct,WAM-2020-10-15,34,8,3,"Adelphia, NJ"
29,Turf Quality,11/5/20,4,29,Jersey (NAI-A16-3),Novel AG Inc.,WAM,2,2,29,2020,Nov,WAM-2020-11-05,35,7,3,"Adelphia, NJ"
29,Turf Quality,10/15/20,3,29,Jersey (NAI-A16-3),Novel AG Inc.,RMD,2,2,29,2020,Oct,RMD-2020-10-15,10,8,3,"Adelphia, NJ"
29,Turf Quality,10/23/20,3,29,Jersey (NAI-A16-3),Novel AG Inc.,RMD,2,2,29,2020,Oct,RMD-2020-10-23,11,8,3,"Adelphia, NJ"
29,Turf Quality,3/30/21,4,29,Jersey (NAI-A16-3),Novel AG Inc.,RMD,2,2,29,2021,Mar,RMD-2021-03-30,12,5,4,"Adelphia, NJ"
29,Turf Quality,4/22/21,4,29,Jersey (NAI-A16-3),Novel AG Inc.,PLV,2,2,29,2021,Apr,PLV-2021-04-22,6,1,4,"Adelphia, NJ"
29,Turf Quality,5/28/21,5,29,Jersey (NAI-A16-3),Novel AG Inc.,SAB,2,2,29,2021,May,SAB-2021-05-28,29,6,4,"Adelphia, NJ"
29,Turf Quality,6/11/21,5,29,Jersey (NAI-A16-3),Novel AG Inc.,JEN,2,2,29,2021,Jun,JEN-2021-06-11,2,4,4,"Adelphia, NJ"
29,Turf Quality,7/13/21,5,29,Jersey (NAI-A16-3),Novel AG Inc.,PLV,2,2,29,2021,Jul,PLV-2021-07-13,7,3,4,"Adelphia, NJ"
29,Turf Quality,8/11/21,5,29,Jersey (NAI-A16-3),Novel AG Inc.,JEN,2,2,29,2021,Aug,JEN-2021-08-11,3,2,4,"Adelphia, NJ"
29,Turf Quality,9/17/21,4,29,Jersey (NAI-A16-3),Novel AG Inc.,JEN,2,2,29,2021,Sep,JEN-2021-09-17,4,9,4,"Adelphia, NJ"
29,Turf Quality,10/13/21,4,29,Jersey (NAI-A16-3),Novel AG Inc.,SAB,2,2,29,2021,Oct,SAB-2021-10-13,30,8,4,"Adelphia, NJ"
29,Turf Quality,11/18/21,6,29,Jersey (NAI-A16-3),Novel AG Inc.,WAM,2,2,29,2021,Nov,WAM-2021-11-18,36,7,4,"Adelphia, NJ"
2,Turf Quality,4/18/18,3,2,A13-1,Landmark Turf & Native Seed,RMD,1,2,2,2018,Apr,RMD-2018-04-18,8,1,1,"Adelphia, NJ"
2,Turf Quality,5/10/18,5,2,A13-1,Landmark Turf & Native Seed,RON,1,2,2,2018,May,RON-2018-05-10,13,6,1,"Adelphia, NJ"
2,Turf Quality,6/7/18,6,2,A13-1,Landmark Turf & Native Seed,RON,1,2,2,2018,Jun,RON-2018-06-07,14,4,1,"Adelphia, NJ"
2,Turf Quality,7/17/18,7,2,A13-1,Landmark Turf & Native Seed,RON,1,2,2,2018,Jul,RON-2018-07-17,15,3,1,"Adelphia, NJ"
2,Turf Quality,8/15/18,6,2,A13-1,Landmark Turf & Native Seed,RMD,1,2,2,2018,Aug,RMD-2018-08-15,9,2,1,"Adelphia, NJ"
2,Turf Quality,9/12/18,7,2,A13-1,Landmark Turf & Native Seed,RON,1,2,2,2018,Sep,RON-2018-09-12,16,9,1,"Adelphia, NJ"
2,Turf Quality,10/2/18,7,2,A13-1,Landmark Turf & Native Seed,RON,1,2,2,2018,Oct,RON-2018-10-02,17,8,1,"Adelphia, NJ"
2,Turf Quality,11/9/18,7,2,A13-1,Landmark Turf & Native Seed,RON,1,2,2,2018,Nov,RON-2018-11-09,18,7,1,"Adelphia, NJ"
2,Turf Quality,4/17/19,5,2,A13-1,Landmark Turf & Native Seed,RON,1,2,2,2019,Apr,RON-2019-04-17,19,1,2,"Adelphia, NJ"
2,Turf Quality,5/2/19,8,2,A13-1,Landmark Turf & Native Seed,RON,1,2,2,2019,May,RON-2019-05-02,20,6,2,"Adelphia, NJ"
2,Turf Quality,6/13/19,8,2,A13-1,Landmark Turf & Native Seed,RON,1,2,2,2019,Jun,RON-2019-06-13,21,4,2,"Adelphia, NJ"
2,Turf Quality,6/17/19,8,2,A13-1,Landmark Turf & Native Seed,SAB,1,2,2,2019,Jun,SAB-2019-06-17,25,4,2,"Adelphia, NJ"
2,Turf Quality,7/17/19,6,2,A13-1,Landmark Turf & Native Seed,RON,1,2,2,2019,Jul,RON-2019-07-17,22,3,2,"Adelphia, NJ"
2,Turf Quality,8/22/19,8,2,A13-1,Landmark Turf & Native Seed,SAB,1,2,2,2019,Aug,SAB-2019-08-22,26,2,2,"Adelphia, NJ"
2,Turf Quality,9/16/19,8,2,A13-1,Landmark Turf & Native Seed,RON,1,2,2,2019,Sep,RON-2019-09-16,23,9,2,"Adelphia, NJ"
2,Turf Quality,10/10/19,8,2,A13-1,Landmark Turf & Native Seed,SAB,1,2,2,2019,Oct,SAB-2019-10-10,27,8,2,"Adelphia, NJ"
2,Turf Quality,11/1/19,7,2,A13-1,Landmark Turf & Native Seed,RON,1,2,2,2019,Nov,RON-2019-11-01,24,7,2,"Adelphia, NJ"
2,Turf Quality,4/28/20,6,2,A13-1,Landmark Turf & Native Seed,WAM,1,2,2,2020,Apr,WAM-2020-04-28,31,1,3,"Adelphia, NJ"
2,Turf Quality,5/18/20,8,2,A13-1,Landmark Turf & Native Seed,SAB,1,2,2,2020,May,SAB-2020-05-18,28,6,3,"Adelphia, NJ"
2,Turf Quality,6/17/20,9,2,A13-1,Landmark Turf & Native Seed,WAM,1,2,2,2020,Jun,WAM-2020-06-17,32,4,3,"Adelphia, NJ"
2,Turf Quality,7/15/20,8,2,A13-1,Landmark Turf & Native Seed,WAM,1,2,2,2020,Jul,WAM-2020-07-15,33,3,3,"Adelphia, NJ"
2,Turf Quality,8/6/20,6,2,A13-1,Landmark Turf & Native Seed,PLV,1,2,2,2020,Aug,PLV-2020-08-06,5,2,3,"Adelphia, NJ"
2,Turf Quality,9/2/20,6,2,A13-1,Landmark Turf & Native Seed,DAS,1,2,2,2020,Sep,DAS-2020-09-02,1,9,3,"Adelphia, NJ"
2,Turf Quality,10/15/20,7,2,A13-1,Landmark Turf & Native Seed,WAM,1,2,2,2020,Oct,WAM-2020-10-15,34,8,3,"Adelphia, NJ"
2,Turf Quality,11/5/20,6,2,A13-1,Landmark Turf & Native Seed,WAM,1,2,2,2020,Nov,WAM-2020-11-05,35,7,3,"Adelphia, NJ"
2,Turf Quality,10/15/20,8,2,A13-1,Landmark Turf & Native Seed,RMD,1,2,2,2020,Oct,RMD-2020-10-15,10,8,3,"Adelphia, NJ"
2,Turf Quality,10/23/20,7,2,A13-1,Landmark Turf & Native Seed,RMD,1,2,2,2020,Oct,RMD-2020-10-23,11,8,3,"Adelphia, NJ"
2,Turf Quality,3/30/21,5,2,A13-1,Landmark Turf & Native Seed,RMD,1,2,2,2021,Mar,RMD-2021-03-30,12,5,4,"Adelphia, NJ"
2,Turf Quality,4/22/21,8,2,A13-1,Landmark Turf & Native Seed,PLV,1,2,2,2021,Apr,PLV-2021-04-22,6,1,4,"Adelphia, NJ"
2,Turf Quality,5/28/21,8,2,A13-1,Landmark Turf & Native Seed,SAB,1,2,2,2021,May,SAB-2021-05-28,29,6,4,"Adelphia, NJ"
2,Turf Quality,6/11/21,8,2,A13-1,Landmark Turf & Native Seed,JEN,1,2,2,2021,Jun,JEN-2021-06-11,2,4,4,"Adelphia, NJ"
2,Turf Quality,7/13/21,6,2,A13-1,Landmark Turf & Native Seed,PLV,1,2,2,2021,Jul,PLV-2021-07-13,7,3,4,"Adelphia, NJ"
2,Turf Quality,8/11/21,6,2,A13-1,Landmark Turf & Native Seed,JEN,1,2,2,2021,Aug,JEN-2021-08-11,3,2,4,"Adelphia, NJ"
2,Turf Quality,9/17/21,7,2,A13-1,Landmark Turf & Native Seed,JEN,1,2,2,2021,Sep,JEN-2021-09-17,4,9,4,"Adelphia, NJ"
2,Turf Quality,10/13/21,8,2,A13-1,Landmark Turf & Native Seed,SAB,1,2,2,2021,Oct,SAB-2021-10-13,30,8,4,"Adelphia, NJ"
2,Turf Quality,11/18/21,6,2,A13-1,Landmark Turf & Native Seed,WAM,1,2,2,2021,Nov,WAM-2021-11-18,36,7,4,"Adelphia, NJ"
268,Turf Quality,4/18/18,4,42,Aviator II (NAI-15-84),Columbia River Seed,RMD,18,3,266,2018,Apr,RMD-2018-04-18,8,1,1,"Adelphia, NJ"
268,Turf Quality,5/10/18,6,42,Aviator II (NAI-15-84),Columbia River Seed,RON,18,3,266,2018,May,RON-2018-05-10,13,6,1,"Adelphia, NJ"
268,Turf Quality,6/7/18,7,42,Aviator II (NAI-15-84),Columbia River Seed,RON,18,3,266,2018,Jun,RON-2018-06-07,14,4,1,"Adelphia, NJ"
268,Turf Quality,7/17/18,7,42,Aviator II (NAI-15-84),Columbia River Seed,RON,18,3,266,2018,Jul,RON-2018-07-17,15,3,1,"Adelphia, NJ"
268,Turf Quality,8/15/18,3,42,Aviator II (NAI-15-84),Columbia River Seed,RMD,18,3,266,2018,Aug,RMD-2018-08-15,9,2,1,"Adelphia, NJ"
268,Turf Quality,9/12/18,2,42,Aviator II (NAI-15-84),Columbia River Seed,RON,18,3,266,2018,Sep,RON-2018-09-12,16,9,1,"Adelphia, NJ"
268,Turf Quality,10/2/18,1,42,Aviator II (NAI-15-84),Columbia River Seed,RON,18,3,266,2018,Oct,RON-2018-10-02,17,8,1,"Adelphia, NJ"
268,Turf Quality,11/9/18,1,42,Aviator II (NAI-15-84),Columbia River Seed,RON,18,3,266,2018,Nov,RON-2018-11-09,18,7,1,"Adelphia, NJ"
268,Turf Quality,4/17/19,3,42,Aviator II (NAI-15-84),Columbia River Seed,RON,18,3,266,2019,Apr,RON-2019-04-17,19,1,2,"Adelphia, NJ"
268,Turf Quality,5/2/19,2,42,Aviator II (NAI-15-84),Columbia River Seed,RON,18,3,266,2019,May,RON-2019-05-02,20,6,2,"Adelphia, NJ"
268,Turf Quality,6/13/19,3,42,Aviator II (NAI-15-84),Columbia River Seed,RON,18,3,266,2019,Jun,RON-2019-06-13,21,4,2,"Adelphia, NJ"
268,Turf Quality,6/17/19,2,42,Aviator II (NAI-15-84),Columbia River Seed,SAB,18,3,266,2019,Jun,SAB-2019-06-17,25,4,2,"Adelphia, NJ"
268,Turf Quality,7/17/19,4,42,Aviator II (NAI-15-84),Columbia River Seed,RON,18,3,266,2019,Jul,RON-2019-07-17,22,3,2,"Adelphia, NJ"
268,Turf Quality,8/22/19,2,42,Aviator II (NAI-15-84),Columbia River Seed,SAB,18,3,266,2019,Aug,SAB-2019-08-22,26,2,2,"Adelphia, NJ"
268,Turf Quality,9/16/19,2,42,Aviator II (NAI-15-84),Columbia River Seed,RON,18,3,266,2019,Sep,RON-2019-09-16,23,9,2,"Adelphia, NJ"
268,Turf Quality,10/10/19,2,42,Aviator II (NAI-15-84),Columbia River Seed,SAB,18,3,266,2019,Oct,SAB-2019-10-10,27,8,2,"Adelphia, NJ"
268,Turf Quality,11/1/19,3,42,Aviator II (NAI-15-84),Columbia River Seed,RON,18,3,266,2019,Nov,RON-2019-11-01,24,7,2,"Adelphia, NJ"
268,Turf Quality,4/28/20,3,42,Aviator II (NAI-15-84),Columbia River Seed,WAM,18,3,266,2020,Apr,WAM-2020-04-28,31,1,3,"Adelphia, NJ"
268,Turf Quality,5/18/20,4,42,Aviator II (NAI-15-84),Columbia River Seed,SAB,18,3,266,2020,May,SAB-2020-05-18,28,6,3,"Adelphia, NJ"
268,Turf Quality,6/17/20,4,42,Aviator II (NAI-15-84),Columbia River Seed,WAM,18,3,266,2020,Jun,WAM-2020-06-17,32,4,3,"Adelphia, NJ"
268,Turf Quality,7/15/20,4,42,Aviator II (NAI-15-84),Columbia River Seed,WAM,18,3,266,2020,Jul,WAM-2020-07-15,33,3,3,"Adelphia, NJ"
268,Turf Quality,8/6/20,5,42,Aviator II (NAI-15-84),Columbia River Seed,PLV,18,3,266,2020,Aug,PLV-2020-08-06,5,2,3,"Adelphia, NJ"
268,Turf Quality,9/2/20,2,42,Aviator II (NAI-15-84),Columbia River Seed,DAS,18,3,266,2020,Sep,DAS-2020-09-02,1,9,3,"Adelphia, NJ"
268,Turf Quality,10/15/20,1,42,Aviator II (NAI-15-84),Columbia River Seed,WAM,18,3,266,2020,Oct,WAM-2020-10-15,34,8,3,"Adelphia, NJ"
268,Turf Quality,11/5/20,3,42,Aviator II (NAI-15-84),Columbia River Seed,WAM,18,3,266,2020,Nov,WAM-2020-11-05,35,7,3,"Adelphia, NJ"
268,Turf Quality,10/15/20,1,42,Aviator II (NAI-15-84),Columbia River Seed,RMD,18,3,266,2020,Oct,RMD-2020-10-15,10,8,3,"Adelphia, NJ"
268,Turf Quality,10/23/20,2,42,Aviator II (NAI-15-84),Columbia River Seed,RMD,18,3,266,2020,Oct,RMD-2020-10-23,11,8,3,"Adelphia, NJ"
268,Turf Quality,3/30/21,1,42,Aviator II (NAI-15-84),Columbia River Seed,RMD,18,3,266,2021,Mar,RMD-2021-03-30,12,5,4,"Adelphia, NJ"
268,Turf Quality,4/22/21,3,42,Aviator II (NAI-15-84),Columbia River Seed,PLV,18,3,266,2021,Apr,PLV-2021-04-22,6,1,4,"Adelphia, NJ"
268,Turf Quality,5/28/21,3,42,Aviator II (NAI-15-84),Columbia River Seed,SAB,18,3,266,2021,May,SAB-2021-05-28,29,6,4,"Adelphia, NJ"
268,Turf Quality,6/11/21,4,42,Aviator II (NAI-15-84),Columbia River Seed,JEN,18,3,266,2021,Jun,JEN-2021-06-11,2,4,4,"Adelphia, NJ"
268,Turf Quality,7/13/21,5,42,Aviator II (NAI-15-84),Columbia River Seed,PLV,18,3,266,2021,Jul,PLV-2021-07-13,7,3,4,"Adelphia, NJ"
268,Turf Quality,8/11/21,4,42,Aviator II (NAI-15-84),Columbia River Seed,JEN,18,3,266,2021,Aug,JEN-2021-08-11,3,2,4,"Adelphia, NJ"
268,Turf Quality,9/17/21,3,42,Aviator II (NAI-15-84),Columbia River Seed,JEN,18,3,266,2021,Sep,JEN-2021-09-17,4,9,4,"Adelphia, NJ"
268,Turf Quality,10/13/21,3,42,Aviator II (NAI-15-84),Columbia River Seed,SAB,18,3,266,2021,Oct,SAB-2021-10-13,30,8,4,"Adelphia, NJ"
268,Turf Quality,11/18/21,4,42,Aviator II (NAI-15-84),Columbia River Seed,WAM,18,3,266,2021,Nov,WAM-2021-11-18,36,7,4,"Adelphia, NJ"
243,Turf Quality,4/18/18,3,46,Bombay (GO-22B23),Grassland Oregon,RMD,17,3,241,2018,Apr,RMD-2018-04-18,8,1,1,"Adelphia, NJ"
243,Turf Quality,5/10/18,5,46,Bombay (GO-22B23),Grassland Oregon,RON,17,3,241,2018,May,RON-2018-05-10,13,6,1,"Adelphia, NJ"
243,Turf Quality,6/7/18,5,46,Bombay (GO-22B23),Grassland Oregon,RON,17,3,241,2018,Jun,RON-2018-06-07,14,4,1,"Adelphia, NJ"
243,Turf Quality,7/17/18,6,46,Bombay (GO-22B23),Grassland Oregon,RON,17,3,241,2018,Jul,RON-2018-07-17,15,3,1,"Adelphia, NJ"
243,Turf Quality,8/15/18,8,46,Bombay (GO-22B23),Grassland Oregon,RMD,17,3,241,2018,Aug,RMD-2018-08-15,9,2,1,"Adelphia, NJ"
243,Turf Quality,9/12/18,7,46,Bombay (GO-22B23),Grassland Oregon,RON,17,3,241,2018,Sep,RON-2018-09-12,16,9,1,"Adelphia, NJ"
243,Turf Quality,10/2/18,7,46,Bombay (GO-22B23),Grassland Oregon,RON,17,3,241,2018,Oct,RON-2018-10-02,17,8,1,"Adelphia, NJ"
243,Turf Quality,11/9/18,7,46,Bombay (GO-22B23),Grassland Oregon,RON,17,3,241,2018,Nov,RON-2018-11-09,18,7,1,"Adelphia, NJ"
243,Turf Quality,4/17/19,7,46,Bombay (GO-22B23),Grassland Oregon,RON,17,3,241,2019,Apr,RON-2019-04-17,19,1,2,"Adelphia, NJ"
243,Turf Quality,5/2/19,9,46,Bombay (GO-22B23),Grassland Oregon,RON,17,3,241,2019,May,RON-2019-05-02,20,6,2,"Adelphia, NJ"
243,Turf Quality,6/13/19,8,46,Bombay (GO-22B23),Grassland Oregon,RON,17,3,241,2019,Jun,RON-2019-06-13,21,4,2,"Adelphia, NJ"
243,Turf Quality,6/17/19,7,46,Bombay (GO-22B23),Grassland Oregon,SAB,17,3,241,2019,Jun,SAB-2019-06-17,25,4,2,"Adelphia, NJ"
243,Turf Quality,7/17/19,6,46,Bombay (GO-22B23),Grassland Oregon,RON,17,3,241,2019,Jul,RON-2019-07-17,22,3,2,"Adelphia, NJ"
243,Turf Quality,8/22/19,7,46,Bombay (GO-22B23),Grassland Oregon,SAB,17,3,241,2019,Aug,SAB-2019-08-22,26,2,2,"Adelphia, NJ"
243,Turf Quality,9/16/19,9,46,Bombay (GO-22B23),Grassland Oregon,RON,17,3,241,2019,Sep,RON-2019-09-16,23,9,2,"Adelphia, NJ"
243,Turf Quality,10/10/19,7,46,Bombay (GO-22B23),Grassland Oregon,SAB,17,3,241,2019,Oct,SAB-2019-10-10,27,8,2,"Adelphia, NJ"
243,Turf Quality,11/1/19,7,46,Bombay (GO-22B23),Grassland Oregon,RON,17,3,241,2019,Nov,RON-2019-11-01,24,7,2,"Adelphia, NJ"
243,Turf Quality,4/28/20,7,46,Bombay (GO-22B23),Grassland Oregon,WAM,17,3,241,2020,Apr,WAM-2020-04-28,31,1,3,"Adelphia, NJ"
243,Turf Quality,5/18/20,9,46,Bombay (GO-22B23),Grassland Oregon,SAB,17,3,241,2020,May,SAB-2020-05-18,28,6,3,"Adelphia, NJ"
243,Turf Quality,6/17/20,6,46,Bombay (GO-22B23),Grassland Oregon,WAM,17,3,241,2020,Jun,WAM-2020-06-17,32,4,3,"Adelphia, NJ"
243,Turf Quality,7/15/20,6,46,Bombay (GO-22B23),Grassland Oregon,WAM,17,3,241,2020,Jul,WAM-2020-07-15,33,3,3,"Adelphia, NJ"
243,Turf Quality,8/6/20,8,46,Bombay (GO-22B23),Grassland Oregon,PLV,17,3,241,2020,Aug,PLV-2020-08-06,5,2,3,"Adelphia, NJ"
243,Turf Quality,9/2/20,8,46,Bombay (GO-22B23),Grassland Oregon,DAS,17,3,241,2020,Sep,DAS-2020-09-02,1,9,3,"Adelphia, NJ"
243,Turf Quality,10/15/20,5,46,Bombay (GO-22B23),Grassland Oregon,WAM,17,3,241,2020,Oct,WAM-2020-10-15,34,8,3,"Adelphia, NJ"
243,Turf Quality,11/5/20,5,46,Bombay (GO-22B23),Grassland Oregon,WAM,17,3,241,2020,Nov,WAM-2020-11-05,35,7,3,"Adelphia, NJ"
243,Turf Quality,10/15/20,7,46,Bombay (GO-22B23),Grassland Oregon,RMD,17,3,241,2020,Oct,RMD-2020-10-15,10,8,3,"Adelphia, NJ"
243,Turf Quality,10/23/20,7,46,Bombay (GO-22B23),Grassland Oregon,RMD,17,3,241,2020,Oct,RMD-2020-10-23,11,8,3,"Adelphia, NJ"
243,Turf Quality,3/30/21,6,46,Bombay (GO-22B23),Grassland Oregon,RMD,17,3,241,2021,Mar,RMD-2021-03-30,12,5,4,"Adelphia, NJ"
243,Turf Quality,4/22/21,8,46,Bombay (GO-22B23),Grassland Oregon,PLV,17,3,241,2021,Apr,PLV-2021-04-22,6,1,4,"Adelphia, NJ"
243,Turf Quality,5/28/21,7,46,Bombay (GO-22B23),Grassland Oregon,SAB,17,3,241,2021,May,SAB-2021-05-28,29,6,4,"Adelphia, NJ"
243,Turf Quality,6/11/21,7,46,Bombay (GO-22B23),Grassland Oregon,JEN,17,3,241,2021,Jun,JEN-2021-06-11,2,4,4,"Adelphia, NJ"
243,Turf Quality,7/13/21,8,46,Bombay (GO-22B23),Grassland Oregon,PLV,17,3,241,2021,Jul,PLV-2021-07-13,7,3,4,"Adelphia, NJ"
243,Turf Quality,8/11/21,6,46,Bombay (GO-22B23),Grassland Oregon,JEN,17,3,241,2021,Aug,JEN-2021-08-11,3,2,4,"Adelphia, NJ"
243,Turf Quality,9/17/21,6,46,Bombay (GO-22B23),Grassland Oregon,JEN,17,3,241,2021,Sep,JEN-2021-09-17,4,9,4,"Adelphia, NJ"
243,Turf Quality,10/13/21,6,46,Bombay (GO-22B23),Grassland Oregon,SAB,17,3,241,2021,Oct,SAB-2021-10-13,30,8,4,"Adelphia, NJ"
243,Turf Quality,11/18/21,7,46,Bombay (GO-22B23),Grassland Oregon,WAM,17,3,241,2021,Nov,WAM-2021-11-18,36,7,4,"Adelphia, NJ"
238,Turf Quality,4/18/18,3,38,Amaze (NAI-14-133),Columbia River Seed,RMD,16,3,236,2018,Apr,RMD-2018-04-18,8,1,1,"Adelphia, NJ"
238,Turf Quality,5/10/18,4,38,Amaze (NAI-14-133),Columbia River Seed,RON,16,3,236,2018,May,RON-2018-05-10,13,6,1,"Adelphia, NJ"
238,Turf Quality,6/7/18,6,38,Amaze (NAI-14-133),Columbia River Seed,RON,16,3,236,2018,Jun,RON-2018-06-07,14,4,1,"Adelphia, NJ"
238,Turf Quality,7/17/18,5,38,Amaze (NAI-14-133),Columbia River Seed,RON,16,3,236,2018,Jul,RON-2018-07-17,15,3,1,"Adelphia, NJ"
238,Turf Quality,8/15/18,6,38,Amaze (NAI-14-133),Columbia River Seed,RMD,16,3,236,2018,Aug,RMD-2018-08-15,9,2,1,"Adelphia, NJ"
238,Turf Quality,9/12/18,3,38,Amaze (NAI-14-133),Columbia River Seed,RON,16,3,236,2018,Sep,RON-2018-09-12,16,9,1,"Adelphia, NJ"
238,Turf Quality,10/2/18,2,38,Amaze (NAI-14-133),Columbia River Seed,RON,16,3,236,2018,Oct,RON-2018-10-02,17,8,1,"Adelphia, NJ"
238,Turf Quality,11/9/18,2,38,Amaze (NAI-14-133),Columbia River Seed,RON,16,3,236,2018,Nov,RON-2018-11-09,18,7,1,"Adelphia, NJ"
238,Turf Quality,4/17/19,2,38,Amaze (NAI-14-133),Columbia River Seed,RON,16,3,236,2019,Apr,RON-2019-04-17,19,1,2,"Adelphia, NJ"
238,Turf Quality,5/2/19,2,38,Amaze (NAI-14-133),Columbia River Seed,RON,16,3,236,2019,May,RON-2019-05-02,20,6,2,"Adelphia, NJ"
238,Turf Quality,6/13/19,3,38,Amaze (NAI-14-133),Columbia River Seed,RON,16,3,236,2019,Jun,RON-2019-06-13,21,4,2,"Adelphia, NJ"
238,Turf Quality,6/17/19,3,38,Amaze (NAI-14-133),Columbia River Seed,SAB,16,3,236,2019,Jun,SAB-2019-06-17,25,4,2,"Adelphia, NJ"
238,Turf Quality,7/17/19,4,38,Amaze (NAI-14-133),Columbia River Seed,RON,16,3,236,2019,Jul,RON-2019-07-17,22,3,2,"Adelphia, NJ"
238,Turf Quality,8/22/19,3,38,Amaze (NAI-14-133),Columbia River Seed,SAB,16,3,236,2019,Aug,SAB-2019-08-22,26,2,2,"Adelphia, NJ"
238,Turf Quality,9/16/19,4,38,Amaze (NAI-14-133),Columbia River Seed,RON,16,3,236,2019,Sep,RON-2019-09-16,23,9,2,"Adelphia, NJ"
238,Turf Quality,10/10/19,3,38,Amaze (NAI-14-133),Columbia River Seed,SAB,16,3,236,2019,Oct,SAB-2019-10-10,27,8,2,"Adelphia, NJ"
238,Turf Quality,11/1/19,3,38,Amaze (NAI-14-133),Columbia River Seed,RON,16,3,236,2019,Nov,RON-2019-11-01,24,7,2,"Adelphia, NJ"
238,Turf Quality,4/28/20,3,38,Amaze (NAI-14-133),Columbia River Seed,WAM,16,3,236,2020,Apr,WAM-2020-04-28,31,1,3,"Adelphia, NJ"
238,Turf Quality,5/18/20,3,38,Amaze (NAI-14-133),Columbia River Seed,SAB,16,3,236,2020,May,SAB-2020-05-18,28,6,3,"Adelphia, NJ"
238,Turf Quality,6/17/20,3,38,Amaze (NAI-14-133),Columbia River Seed,WAM,16,3,236,2020,Jun,WAM-2020-06-17,32,4,3,"Adelphia, NJ"
238,Turf Quality,7/15/20,4,38,Amaze (NAI-14-133),Columbia River Seed,WAM,16,3,236,2020,Jul,WAM-2020-07-15,33,3,3,"Adelphia, NJ"
238,Turf Quality,8/6/20,5,38,Amaze (NAI-14-133),Columbia River Seed,PLV,16,3,236,2020,Aug,PLV-2020-08-06,5,2,3,"Adelphia, NJ"
238,Turf Quality,9/2/20,3,38,Amaze (NAI-14-133),Columbia River Seed,DAS,16,3,236,2020,Sep,DAS-2020-09-02,1,9,3,"Adelphia, NJ"
238,Turf Quality,10/15/20,2,38,Amaze (NAI-14-133),Columbia River Seed,WAM,16,3,236,2020,Oct,WAM-2020-10-15,34,8,3,"Adelphia, NJ"
238,Turf Quality,11/5/20,3,38,Amaze (NAI-14-133),Columbia River Seed,WAM,16,3,236,2020,Nov,WAM-2020-11-05,35,7,3,"Adelphia, NJ"
238,Turf Quality,10/15/20,3,38,Amaze (NAI-14-133),Columbia River Seed,RMD,16,3,236,2020,Oct,RMD-2020-10-15,10,8,3,"Adelphia, NJ"
238,Turf Quality,10/23/20,3,38,Amaze (NAI-14-133),Columbia River Seed,RMD,16,3,236,2020,Oct,RMD-2020-10-23,11,8,3,"Adelphia, NJ"
238,Turf Quality,3/30/21,3,38,Amaze (NAI-14-133),Columbia River Seed,RMD,16,3,236,2021,Mar,RMD-2021-03-30,12,5,4,"Adelphia, NJ"
238,Turf Quality,4/22/21,3,38,Amaze (NAI-14-133),Columbia River Seed,PLV,16,3,236,2021,Apr,PLV-2021-04-22,6,1,4,"Adelphia, NJ"
238,Turf Quality,5/28/21,3,38,Amaze (NAI-14-133),Columbia River Seed,SAB,16,3,236,2021,May,SAB-2021-05-28,29,6,4,"Adelphia, NJ"
238,Turf Quality,6/11/21,4,38,Amaze (NAI-14-133),Columbia River Seed,JEN,16,3,236,2021,Jun,JEN-2021-06-11,2,4,4,"Adelphia, NJ"
238,Turf Quality,7/13/21,5,38,Amaze (NAI-14-133),Columbia River Seed,PLV,16,3,236,2021,Jul,PLV-2021-07-13,7,3,4,"Adelphia, NJ"
238,Turf Quality,8/11/21,4,38,Amaze (NAI-14-133),Columbia River Seed,JEN,16,3,236,2021,Aug,JEN-2021-08-11,3,2,4,"Adelphia, NJ"
238,Turf Quality,9/17/21,4,38,Amaze (NAI-14-133),Columbia River Seed,JEN,16,3,236,2021,Sep,JEN-2021-09-17,4,9,4,"Adelphia, NJ"
238,Turf Quality,10/13/21,1,38,Amaze (NAI-14-133),Columbia River Seed,SAB,16,3,236,2021,Oct,SAB-2021-10-13,30,8,4,"Adelphia, NJ"
238,Turf Quality,11/18/21,4,38,Amaze (NAI-14-133),Columbia River Seed,WAM,16,3,236,2021,Nov,WAM-2021-11-18,36,7,4,"Adelphia, NJ"
213,Turf Quality,4/18/18,6,23,Barvette HGT,Standard,RMD,15,3,211,2018,Apr,RMD-2018-04-18,8,1,1,"Adelphia, NJ"
213,Turf Quality,5/10/18,4,23,Barvette HGT,Standard,RON,15,3,211,2018,May,RON-2018-05-10,13,6,1,"Adelphia, NJ"
213,Turf Quality,6/7/18,4,23,Barvette HGT,Standard,RON,15,3,211,2018,Jun,RON-2018-06-07,14,4,1,"Adelphia, NJ"
213,Turf Quality,7/17/18,5,23,Barvette HGT,Standard,RON,15,3,211,2018,Jul,RON-2018-07-17,15,3,1,"Adelphia, NJ"
213,Turf Quality,8/15/18,8,23,Barvette HGT,Standard,RMD,15,3,211,2018,Aug,RMD-2018-08-15,9,2,1,"Adelphia, NJ"
213,Turf Quality,9/12/18,8,23,Barvette HGT,Standard,RON,15,3,211,2018,Sep,RON-2018-09-12,16,9,1,"Adelphia, NJ"
213,Turf Quality,10/2/18,6,23,Barvette HGT,Standard,RON,15,3,211,2018,Oct,RON-2018-10-02,17,8,1,"Adelphia, NJ"
213,Turf Quality,11/9/18,9,23,Barvette HGT,Standard,RON,15,3,211,2018,Nov,RON-2018-11-09,18,7,1,"Adelphia, NJ"
213,Turf Quality,4/17/19,8,23,Barvette HGT,Standard,RON,15,3,211,2019,Apr,RON-2019-04-17,19,1,2,"Adelphia, NJ"
213,Turf Quality,5/2/19,4,23,Barvette HGT,Standard,RON,15,3,211,2019,May,RON-2019-05-02,20,6,2,"Adelphia, NJ"
213,Turf Quality,6/13/19,4,23,Barvette HGT,Standard,RON,15,3,211,2019,Jun,RON-2019-06-13,21,4,2,"Adelphia, NJ"
213,Turf Quality,6/17/19,4,23,Barvette HGT,Standard,SAB,15,3,211,2019,Jun,SAB-2019-06-17,25,4,2,"Adelphia, NJ"
213,Turf Quality,7/17/19,4,23,Barvette HGT,Standard,RON,15,3,211,2019,Jul,RON-2019-07-17,22,3,2,"Adelphia, NJ"
213,Turf Quality,8/22/19,6,23,Barvette HGT,Standard,SAB,15,3,211,2019,Aug,SAB-2019-08-22,26,2,2,"Adelphia, NJ"
213,Turf Quality,9/16/19,8,23,Barvette HGT,Standard,RON,15,3,211,2019,Sep,RON-2019-09-16,23,9,2,"Adelphia, NJ"
213,Turf Quality,10/10/19,6,23,Barvette HGT,Standard,SAB,15,3,211,2019,Oct,SAB-2019-10-10,27,8,2,"Adelphia, NJ"
213,Turf Quality,11/1/19,6,23,Barvette HGT,Standard,RON,15,3,211,2019,Nov,RON-2019-11-01,24,7,2,"Adelphia, NJ"
213,Turf Quality,4/28/20,5,23,Barvette HGT,Standard,WAM,15,3,211,2020,Apr,WAM-2020-04-28,31,1,3,"Adelphia, NJ"
213,Turf Quality,5/18/20,7,23,Barvette HGT,Standard,SAB,15,3,211,2020,May,SAB-2020-05-18,28,6,3,"Adelphia, NJ"
213,Turf Quality,6/17/20,2,23,Barvette HGT,Standard,WAM,15,3,211,2020,Jun,WAM-2020-06-17,32,4,3,"Adelphia, NJ"
213,Turf Quality,7/15/20,4,23,Barvette HGT,Standard,WAM,15,3,211,2020,Jul,WAM-2020-07-15,33,3,3,"Adelphia, NJ"
213,Turf Quality,8/6/20,7,23,Barvette HGT,Standard,PLV,15,3,211,2020,Aug,PLV-2020-08-06,5,2,3,"Adelphia, NJ"
213,Turf Quality,9/2/20,7,23,Barvette HGT,Standard,DAS,15,3,211,2020,Sep,DAS-2020-09-02,1,9,3,"Adelphia, NJ"
213,Turf Quality,10/15/20,6,23,Barvette HGT,Standard,WAM,15,3,211,2020,Oct,WAM-2020-10-15,34,8,3,"Adelphia, NJ"
213,Turf Quality,11/5/20,8,23,Barvette HGT,Standard,WAM,15,3,211,2020,Nov,WAM-2020-11-05,35,7,3,"Adelphia, NJ"
213,Turf Quality,10/15/20,8,23,Barvette HGT,Standard,RMD,15,3,211,2020,Oct,RMD-2020-10-15,10,8,3,"Adelphia, NJ"
213,Turf Quality,10/23/20,7,23,Barvette HGT,Standard,RMD,15,3,211,2020,Oct,RMD-2020-10-23,11,8,3,"Adelphia, NJ"
213,Turf Quality,3/30/21,9,23,Barvette HGT,Standard,RMD,15,3,211,2021,Mar,RMD-2021-03-30,12,5,4,"Adelphia, NJ"
213,Turf Quality,4/22/21,7,23,Barvette HGT,Standard,PLV,15,3,211,2021,Apr,PLV-2021-04-22,6,1,4,"Adelphia, NJ"
213,Turf Quality,5/28/21,4,23,Barvette HGT,Standard,SAB,15,3,211,2021,May,SAB-2021-05-28,29,6,4,"Adelphia, NJ"
213,Turf Quality,6/11/21,4,23,Barvette HGT,Standard,JEN,15,3,211,2021,Jun,JEN-2021-06-11,2,4,4,"Adelphia, NJ"
213,Turf Quality,7/13/21,6,23,Barvette HGT,Standard,PLV,15,3,211,2021,Jul,PLV-2021-07-13,7,3,4,"Adelphia, NJ"
213,Turf Quality,8/11/21,5,23,Barvette HGT,Standard,JEN,15,3,211,2021,Aug,JEN-2021-08-11,3,2,4,"Adelphia, NJ"
213,Turf Quality,9/17/21,7,23,Barvette HGT,Standard,JEN,15,3,211,2021,Sep,JEN-2021-09-17,4,9,4,"Adelphia, NJ"
213,Turf Quality,10/13/21,7,23,Barvette HGT,Standard,SAB,15,3,211,2021,Oct,SAB-2021-10-13,30,8,4,"Adelphia, NJ"
213,Turf Quality,11/18/21,7,23,Barvette HGT,Standard,WAM,15,3,211,2021,Nov,WAM-2021-11-18,36,7,4,"Adelphia, NJ"
208,Turf Quality,4/18/18,5,87,PST-K15-172,Pure Seed Testing Inc.,RMD,14,3,206,2018,Apr,RMD-2018-04-18,8,1,1,"Adelphia, NJ"
208,Turf Quality,5/10/18,5,87,PST-K15-172,Pure Seed Testing Inc.,RON,14,3,206,2018,May,RON-2018-05-10,13,6,1,"Adelphia, NJ"
208,Turf Quality,6/7/18,5,87,PST-K15-172,Pure Seed Testing Inc.,RON,14,3,206,2018,Jun,RON-2018-06-07,14,4,1,"Adelphia, NJ"
208,Turf Quality,7/17/18,7,87,PST-K15-172,Pure Seed Testing Inc.,RON,14,3,206,2018,Jul,RON-2018-07-17,15,3,1,"Adelphia, NJ"
208,Turf Quality,8/15/18,6,87,PST-K15-172,Pure Seed Testing Inc.,RMD,14,3,206,2018,Aug,RMD-2018-08-15,9,2,1,"Adelphia, NJ"
208,Turf Quality,9/12/18,6,87,PST-K15-172,Pure Seed Testing Inc.,RON,14,3,206,2018,Sep,RON-2018-09-12,16,9,1,"Adelphia, NJ"
208,Turf Quality,10/2/18,6,87,PST-K15-172,Pure Seed Testing Inc.,RON,14,3,206,2018,Oct,RON-2018-10-02,17,8,1,"Adelphia, NJ"
208,Turf Quality,11/9/18,6,87,PST-K15-172,Pure Seed Testing Inc.,RON,14,3,206,2018,Nov,RON-2018-11-09,18,7,1,"Adelphia, NJ"
208,Turf Quality,4/17/19,6,87,PST-K15-172,Pure Seed Testing Inc.,RON,14,3,206,2019,Apr,RON-2019-04-17,19,1,2,"Adelphia, NJ"
208,Turf Quality,5/2/19,6,87,PST-K15-172,Pure Seed Testing Inc.,RON,14,3,206,2019,May,RON-2019-05-02,20,6,2,"Adelphia, NJ"
208,Turf Quality,6/13/19,6,87,PST-K15-172,Pure Seed Testing Inc.,RON,14,3,206,2019,Jun,RON-2019-06-13,21,4,2,"Adelphia, NJ"
208,Turf Quality,6/17/19,5,87,PST-K15-172,Pure Seed Testing Inc.,SAB,14,3,206,2019,Jun,SAB-2019-06-17,25,4,2,"Adelphia, NJ"
208,Turf Quality,7/17/19,8,87,PST-K15-172,Pure Seed Testing Inc.,RON,14,3,206,2019,Jul,RON-2019-07-17,22,3,2,"Adelphia, NJ"
208,Turf Quality,8/22/19,6,87,PST-K15-172,Pure Seed Testing Inc.,SAB,14,3,206,2019,Aug,SAB-2019-08-22,26,2,2,"Adelphia, NJ"
208,Turf Quality,9/16/19,8,87,PST-K15-172,Pure Seed Testing Inc.,RON,14,3,206,2019,Sep,RON-2019-09-16,23,9,2,"Adelphia, NJ"
208,Turf Quality,10/10/19,5,87,PST-K15-172,Pure Seed Testing Inc.,SAB,14,3,206,2019,Oct,SAB-2019-10-10,27,8,2,"Adelphia, NJ"
208,Turf Quality,11/1/19,5,87,PST-K15-172,Pure Seed Testing Inc.,RON,14,3,206,2019,Nov,RON-2019-11-01,24,7,2,"Adelphia, NJ"
208,Turf Quality,4/28/20,7,87,PST-K15-172,Pure Seed Testing Inc.,WAM,14,3,206,2020,Apr,WAM-2020-04-28,31,1,3,"Adelphia, NJ"
208,Turf Quality,5/18/20,7,87,PST-K15-172,Pure Seed Testing Inc.,SAB,14,3,206,2020,May,SAB-2020-05-18,28,6,3,"Adelphia, NJ"
208,Turf Quality,6/17/20,5,87,PST-K15-172,Pure Seed Testing Inc.,WAM,14,3,206,2020,Jun,WAM-2020-06-17,32,4,3,"Adelphia, NJ"
208,Turf Quality,7/15/20,6,87,PST-K15-172,Pure Seed Testing Inc.,WAM,14,3,206,2020,Jul,WAM-2020-07-15,33,3,3,"Adelphia, NJ"
208,Turf Quality,8/6/20,6,87,PST-K15-172,Pure Seed Testing Inc.,PLV,14,3,206,2020,Aug,PLV-2020-08-06,5,2,3,"Adelphia, NJ"
208,Turf Quality,9/2/20,7,87,PST-K15-172,Pure Seed Testing Inc.,DAS,14,3,206,2020,Sep,DAS-2020-09-02,1,9,3,"Adelphia, NJ"
208,Turf Quality,10/15/20,5,87,PST-K15-172,Pure Seed Testing Inc.,WAM,14,3,206,2020,Oct,WAM-2020-10-15,34,8,3,"Adelphia, NJ"
208,Turf Quality,11/5/20,4,87,PST-K15-172,Pure Seed Testing Inc.,WAM,14,3,206,2020,Nov,WAM-2020-11-05,35,7,3,"Adelphia, NJ"
208,Turf Quality,10/15/20,7,87,PST-K15-172,Pure Seed Testing Inc.,RMD,14,3,206,2020,Oct,RMD-2020-10-15,10,8,3,"Adelphia, NJ"
208,Turf Quality,10/23/20,6,87,PST-K15-172,Pure Seed Testing Inc.,RMD,14,3,206,2020,Oct,RMD-2020-10-23,11,8,3,"Adelphia, NJ"
208,Turf Quality,3/30/21,6,87,PST-K15-172,Pure Seed Testing Inc.,RMD,14,3,206,2021,Mar,RMD-2021-03-30,12,5,4,"Adelphia, NJ"
208,Turf Quality,4/22/21,7,87,PST-K15-172,Pure Seed Testing Inc.,PLV,14,3,206,2021,Apr,PLV-2021-04-22,6,1,4,"Adelphia, NJ"
208,Turf Quality,5/28/21,4,87,PST-K15-172,Pure Seed Testing Inc.,SAB,14,3,206,2021,May,SAB-2021-05-28,29,6,4,"Adelphia, NJ"
208,Turf Quality,6/11/21,6,87,PST-K15-172,Pure Seed Testing Inc.,JEN,14,3,206,2021,Jun,JEN-2021-06-11,2,4,4,"Adelphia, NJ"
208,Turf Quality,7/13/21,6,87,PST-K15-172,Pure Seed Testing Inc.,PLV,14,3,206,2021,Jul,PLV-2021-07-13,7,3,4,"Adelphia, NJ"
208,Turf Quality,8/11/21,4,87,PST-K15-172,Pure Seed Testing Inc.,JEN,14,3,206,2021,Aug,JEN-2021-08-11,3,2,4,"Adelphia, NJ"
208,Turf Quality,9/17/21,6,87,PST-K15-172,Pure Seed Testing Inc.,JEN,14,3,206,2021,Sep,JEN-2021-09-17,4,9,4,"Adelphia, NJ"
208,Turf Quality,10/13/21,5,87,PST-K15-172,Pure Seed Testing Inc.,SAB,14,3,206,2021,Oct,SAB-2021-10-13,30,8,4,"Adelphia, NJ"
208,Turf Quality,11/18/21,7,87,PST-K15-172,Pure Seed Testing Inc.,WAM,14,3,206,2021,Nov,WAM-2021-11-18,36,7,4,"Adelphia, NJ"
183,Turf Quality,4/18/18,3,14,Yellowstone (A12-7),Landmark Turf & Native Seed,RMD,13,3,181,2018,Apr,RMD-2018-04-18,8,1,1,"Adelphia, NJ"
183,Turf Quality,5/10/18,5,14,Yellowstone (A12-7),Landmark Turf & Native Seed,RON,13,3,181,2018,May,RON-2018-05-10,13,6,1,"Adelphia, NJ"
183,Turf Quality,6/7/18,5,14,Yellowstone (A12-7),Landmark Turf & Native Seed,RON,13,3,181,2018,Jun,RON-2018-06-07,14,4,1,"Adelphia, NJ"
183,Turf Quality,7/17/18,7,14,Yellowstone (A12-7),Landmark Turf & Native Seed,RON,13,3,181,2018,Jul,RON-2018-07-17,15,3,1,"Adelphia, NJ"
183,Turf Quality,8/15/18,6,14,Yellowstone (A12-7),Landmark Turf & Native Seed,RMD,13,3,181,2018,Aug,RMD-2018-08-15,9,2,1,"Adelphia, NJ"
183,Turf Quality,9/12/18,5,14,Yellowstone (A12-7),Landmark Turf & Native Seed,RON,13,3,181,2018,Sep,RON-2018-09-12,16,9,1,"Adelphia, NJ"
183,Turf Quality,10/2/18,6,14,Yellowstone (A12-7),Landmark Turf & Native Seed,RON,13,3,181,2018,Oct,RON-2018-10-02,17,8,1,"Adelphia, NJ"
183,Turf Quality,11/9/18,6,14,Yellowstone (A12-7),Landmark Turf & Native Seed,RON,13,3,181,2018,Nov,RON-2018-11-09,18,7,1,"Adelphia, NJ"
183,Turf Quality,4/17/19,6,14,Yellowstone (A12-7),Landmark Turf & Native Seed,RON,13,3,181,2019,Apr,RON-2019-04-17,19,1,2,"Adelphia, NJ"
183,Turf Quality,5/2/19,6,14,Yellowstone (A12-7),Landmark Turf & Native Seed,RON,13,3,181,2019,May,RON-2019-05-02,20,6,2,"Adelphia, NJ"
183,Turf Quality,6/13/19,6,14,Yellowstone (A12-7),Landmark Turf & Native Seed,RON,13,3,181,2019,Jun,RON-2019-06-13,21,4,2,"Adelphia, NJ"
183,Turf Quality,6/17/19,6,14,Yellowstone (A12-7),Landmark Turf & Native Seed,SAB,13,3,181,2019,Jun,SAB-2019-06-17,25,4,2,"Adelphia, NJ"
183,Turf Quality,7/17/19,5,14,Yellowstone (A12-7),Landmark Turf & Native Seed,RON,13,3,181,2019,Jul,RON-2019-07-17,22,3,2,"Adelphia, NJ"
183,Turf Quality,8/22/19,5,14,Yellowstone (A12-7),Landmark Turf & Native Seed,SAB,13,3,181,2019,Aug,SAB-2019-08-22,26,2,2,"Adelphia, NJ"
183,Turf Quality,9/16/19,4,14,Yellowstone (A12-7),Landmark Turf & Native Seed,RON,13,3,181,2019,Sep,RON-2019-09-16,23,9,2,"Adelphia, NJ"
183,Turf Quality,10/10/19,4,14,Yellowstone (A12-7),Landmark Turf & Native Seed,SAB,13,3,181,2019,Oct,SAB-2019-10-10,27,8,2,"Adelphia, NJ"
183,Turf Quality,11/1/19,5,14,Yellowstone (A12-7),Landmark Turf & Native Seed,RON,13,3,181,2019,Nov,RON-2019-11-01,24,7,2,"Adelphia, NJ"
183,Turf Quality,4/28/20,6,14,Yellowstone (A12-7),Landmark Turf & Native Seed,WAM,13,3,181,2020,Apr,WAM-2020-04-28,31,1,3,"Adelphia, NJ"
183,Turf Quality,5/18/20,7,14,Yellowstone (A12-7),Landmark Turf & Native Seed,SAB,13,3,181,2020,May,SAB-2020-05-18,28,6,3,"Adelphia, NJ"
183,Turf Quality,6/17/20,4,14,Yellowstone (A12-7),Landmark Turf & Native Seed,WAM,13,3,181,2020,Jun,WAM-2020-06-17,32,4,3,"Adelphia, NJ"
183,Turf Quality,7/15/20,4,14,Yellowstone (A12-7),Landmark Turf & Native Seed,WAM,13,3,181,2020,Jul,WAM-2020-07-15,33,3,3,"Adelphia, NJ"
183,Turf Quality,8/6/20,6,14,Yellowstone (A12-7),Landmark Turf & Native Seed,PLV,13,3,181,2020,Aug,PLV-2020-08-06,5,2,3,"Adelphia, NJ"
183,Turf Quality,9/2/20,4,14,Yellowstone (A12-7),Landmark Turf & Native Seed,DAS,13,3,181,2020,Sep,DAS-2020-09-02,1,9,3,"Adelphia, NJ"
183,Turf Quality,10/15/20,3,14,Yellowstone (A12-7),Landmark Turf & Native Seed,WAM,13,3,181,2020,Oct,WAM-2020-10-15,34,8,3,"Adelphia, NJ"
183,Turf Quality,11/5/20,3,14,Yellowstone (A12-7),Landmark Turf & Native Seed,WAM,13,3,181,2020,Nov,WAM-2020-11-05,35,7,3,"Adelphia, NJ"
183,Turf Quality,10/15/20,3,14,Yellowstone (A12-7),Landmark Turf & Native Seed,RMD,13,3,181,2020,Oct,RMD-2020-10-15,10,8,3,"Adelphia, NJ"
183,Turf Quality,10/23/20,3,14,Yellowstone (A12-7),Landmark Turf & Native Seed,RMD,13,3,181,2020,Oct,RMD-2020-10-23,11,8,3,"Adelphia, NJ"
183,Turf Quality,3/30/21,3,14,Yellowstone (A12-7),Landmark Turf & Native Seed,RMD,13,3,181,2021,Mar,RMD-2021-03-30,12,5,4,"Adelphia, NJ"
183,Turf Quality,4/22/21,4,14,Yellowstone (A12-7),Landmark Turf & Native Seed,PLV,13,3,181,2021,Apr,PLV-2021-04-22,6,1,4,"Adelphia, NJ"
183,Turf Quality,5/28/21,4,14,Yellowstone (A12-7),Landmark Turf & Native Seed,SAB,13,3,181,2021,May,SAB-2021-05-28,29,6,4,"Adelphia, NJ"
183,Turf Quality,6/11/21,5,14,Yellowstone (A12-7),Landmark Turf & Native Seed,JEN,13,3,181,2021,Jun,JEN-2021-06-11,2,4,4,"Adelphia, NJ"
183,Turf Quality,7/13/21,5,14,Yellowstone (A12-7),Landmark Turf & Native Seed,PLV,13,3,181,2021,Jul,PLV-2021-07-13,7,3,4,"Adelphia, NJ"
183,Turf Quality,8/11/21,4,14,Yellowstone (A12-7),Landmark Turf & Native Seed,JEN,13,3,181,2021,Aug,JEN-2021-08-11,3,2,4,"Adelphia, NJ"
183,Turf Quality,9/17/21,4,14,Yellowstone (A12-7),Landmark Turf & Native Seed,JEN,13,3,181,2021,Sep,JEN-2021-09-17,4,9,4,"Adelphia, NJ"
183,Turf Quality,10/13/21,3,14,Yellowstone (A12-7),Landmark Turf & Native Seed,SAB,13,3,181,2021,Oct,SAB-2021-10-13,30,8,4,"Adelphia, NJ"
183,Turf Quality,11/18/21,5,14,Yellowstone (A12-7),Landmark Turf & Native Seed,WAM,13,3,181,2021,Nov,WAM-2021-11-18,36,7,4,"Adelphia, NJ"
178,Turf Quality,4/18/18,4,84,PST-11-7,DLF Pickseed USA,RMD,12,3,177,2018,Apr,RMD-2018-04-18,8,1,1,"Adelphia, NJ"
178,Turf Quality,5/10/18,4,84,PST-11-7,DLF Pickseed USA,RON,12,3,177,2018,May,RON-2018-05-10,13,6,1,"Adelphia, NJ"
178,Turf Quality,6/7/18,5,84,PST-11-7,DLF Pickseed USA,RON,12,3,177,2018,Jun,RON-2018-06-07,14,4,1,"Adelphia, NJ"
178,Turf Quality,7/17/18,7,84,PST-11-7,DLF Pickseed USA,RON,12,3,177,2018,Jul,RON-2018-07-17,15,3,1,"Adelphia, NJ"
178,Turf Quality,8/15/18,6,84,PST-11-7,DLF Pickseed USA,RMD,12,3,177,2018,Aug,RMD-2018-08-15,9,2,1,"Adelphia, NJ"
178,Turf Quality,9/12/18,6,84,PST-11-7,DLF Pickseed USA,RON,12,3,177,2018,Sep,RON-2018-09-12,16,9,1,"Adelphia, NJ"
178,Turf Quality,10/2/18,6,84,PST-11-7,DLF Pickseed USA,RON,12,3,177,2018,Oct,RON-2018-10-02,17,8,1,"Adelphia, NJ"
178,Turf Quality,11/9/18,5,84,PST-11-7,DLF Pickseed USA,RON,12,3,177,2018,Nov,RON-2018-11-09,18,7,1,"Adelphia, NJ"
178,Turf Quality,4/17/19,5,84,PST-11-7,DLF Pickseed USA,RON,12,3,177,2019,Apr,RON-2019-04-17,19,1,2,"Adelphia, NJ"
178,Turf Quality,5/2/19,6,84,PST-11-7,DLF Pickseed USA,RON,12,3,177,2019,May,RON-2019-05-02,20,6,2,"Adelphia, NJ"
178,Turf Quality,6/13/19,7,84,PST-11-7,DLF Pickseed USA,RON,12,3,177,2019,Jun,RON-2019-06-13,21,4,2,"Adelphia, NJ"
178,Turf Quality,6/17/19,7,84,PST-11-7,DLF Pickseed USA,SAB,12,3,177,2019,Jun,SAB-2019-06-17,25,4,2,"Adelphia, NJ"
178,Turf Quality,7/17/19,4,84,PST-11-7,DLF Pickseed USA,RON,12,3,177,2019,Jul,RON-2019-07-17,22,3,2,"Adelphia, NJ"
178,Turf Quality,8/22/19,4,84,PST-11-7,DLF Pickseed USA,SAB,12,3,177,2019,Aug,SAB-2019-08-22,26,2,2,"Adelphia, NJ"
178,Turf Quality,9/16/19,4,84,PST-11-7,DLF Pickseed USA,RON,12,3,177,2019,Sep,RON-2019-09-16,23,9,2,"Adelphia, NJ"
178,Turf Quality,10/10/19,2,84,PST-11-7,DLF Pickseed USA,SAB,12,3,177,2019,Oct,SAB-2019-10-10,27,8,2,"Adelphia, NJ"
178,Turf Quality,11/1/19,4,84,PST-11-7,DLF Pickseed USA,RON,12,3,177,2019,Nov,RON-2019-11-01,24,7,2,"Adelphia, NJ"
178,Turf Quality,4/28/20,3,84,PST-11-7,DLF Pickseed USA,WAM,12,3,177,2020,Apr,WAM-2020-04-28,31,1,3,"Adelphia, NJ"
178,Turf Quality,5/18/20,2,84,PST-11-7,DLF Pickseed USA,SAB,12,3,177,2020,May,SAB-2020-05-18,28,6,3,"Adelphia, NJ"
178,Turf Quality,6/17/20,2,84,PST-11-7,DLF Pickseed USA,WAM,12,3,177,2020,Jun,WAM-2020-06-17,32,4,3,"Adelphia, NJ"
178,Turf Quality,7/15/20,2,84,PST-11-7,DLF Pickseed USA,WAM,12,3,177,2020,Jul,WAM-2020-07-15,33,3,3,"Adelphia, NJ"
178,Turf Quality,8/6/20,2,84,PST-11-7,DLF Pickseed USA,PLV,12,3,177,2020,Aug,PLV-2020-08-06,5,2,3,"Adelphia, NJ"
178,Turf Quality,9/2/20,2,84,PST-11-7,DLF Pickseed USA,DAS,12,3,177,2020,Sep,DAS-2020-09-02,1,9,3,"Adelphia, NJ"
178,Turf Quality,10/15/20,1,84,PST-11-7,DLF Pickseed USA,WAM,12,3,177,2020,Oct,WAM-2020-10-15,34,8,3,"Adelphia, NJ"
178,Turf Quality,11/5/20,1,84,PST-11-7,DLF Pickseed USA,WAM,12,3,177,2020,Nov,WAM-2020-11-05,35,7,3,"Adelphia, NJ"
178,Turf Quality,10/15/20,1,84,PST-11-7,DLF Pickseed USA,RMD,12,3,177,2020,Oct,RMD-2020-10-15,10,8,3,"Adelphia, NJ"
178,Turf Quality,10/23/20,1,84,PST-11-7,DLF Pickseed USA,RMD,12,3,177,2020,Oct,RMD-2020-10-23,11,8,3,"Adelphia, NJ"
178,Turf Quality,3/30/21,1,84,PST-11-7,DLF Pickseed USA,RMD,12,3,177,2021,Mar,RMD-2021-03-30,12,5,4,"Adelphia, NJ"
178,Turf Quality,4/22/21,1,84,PST-11-7,DLF Pickseed USA,PLV,12,3,177,2021,Apr,PLV-2021-04-22,6,1,4,"Adelphia, NJ"
178,Turf Quality,5/28/21,1,84,PST-11-7,DLF Pickseed USA,SAB,12,3,177,2021,May,SAB-2021-05-28,29,6,4,"Adelphia, NJ"
178,Turf Quality,6/11/21,1,84,PST-11-7,DLF Pickseed USA,JEN,12,3,177,2021,Jun,JEN-2021-06-11,2,4,4,"Adelphia, NJ"
178,Turf Quality,7/13/21,2,84,PST-11-7,DLF Pickseed USA,PLV,12,3,177,2021,Jul,PLV-2021-07-13,7,3,4,"Adelphia, NJ"
178,Turf Quality,8/11/21,1,84,PST-11-7,DLF Pickseed USA,JEN,12,3,177,2021,Aug,JEN-2021-08-11,3,2,4,"Adelphia, NJ"
178,Turf Quality,9/17/21,1,84,PST-11-7,DLF Pickseed USA,JEN,12,3,177,2021,Sep,JEN-2021-09-17,4,9,4,"Adelphia, NJ"
178,Turf Quality,10/13/21,1,84,PST-11-7,DLF Pickseed USA,SAB,12,3,177,2021,Oct,SAB-2021-10-13,30,8,4,"Adelphia, NJ"
178,Turf Quality,11/18/21,2,84,PST-11-7,DLF Pickseed USA,WAM,12,3,177,2021,Nov,WAM-2021-11-18,36,7,4,"Adelphia, NJ"
153,Turf Quality,4/18/18,3,83,Dublin (PST-K15-157),Pure Seed Testing Inc.,RMD,11,3,152,2018,Apr,RMD-2018-04-18,8,1,1,"Adelphia, NJ"
153,Turf Quality,5/10/18,4,83,Dublin (PST-K15-157),Pure Seed Testing Inc.,RON,11,3,152,2018,May,RON-2018-05-10,13,6,1,"Adelphia, NJ"
153,Turf Quality,6/7/18,5,83,Dublin (PST-K15-157),Pure Seed Testing Inc.,RON,11,3,152,2018,Jun,RON-2018-06-07,14,4,1,"Adelphia, NJ"
153,Turf Quality,7/17/18,6,83,Dublin (PST-K15-157),Pure Seed Testing Inc.,RON,11,3,152,2018,Jul,RON-2018-07-17,15,3,1,"Adelphia, NJ"
153,Turf Quality,8/15/18,8,83,Dublin (PST-K15-157),Pure Seed Testing Inc.,RMD,11,3,152,2018,Aug,RMD-2018-08-15,9,2,1,"Adelphia, NJ"
153,Turf Quality,9/12/18,4,83,Dublin (PST-K15-157),Pure Seed Testing Inc.,RON,11,3,152,2018,Sep,RON-2018-09-12,16,9,1,"Adelphia, NJ"
153,Turf Quality,10/2/18,4,83,Dublin (PST-K15-157),Pure Seed Testing Inc.,RON,11,3,152,2018,Oct,RON-2018-10-02,17,8,1,"Adelphia, NJ"
153,Turf Quality,11/9/18,3,83,Dublin (PST-K15-157),Pure Seed Testing Inc.,RON,11,3,152,2018,Nov,RON-2018-11-09,18,7,1,"Adelphia, NJ"
153,Turf Quality,4/17/19,3,83,Dublin (PST-K15-157),Pure Seed Testing Inc.,RON,11,3,152,2019,Apr,RON-2019-04-17,19,1,2,"Adelphia, NJ"
153,Turf Quality,5/2/19,4,83,Dublin (PST-K15-157),Pure Seed Testing Inc.,RON,11,3,152,2019,May,RON-2019-05-02,20,6,2,"Adelphia, NJ"
153,Turf Quality,6/13/19,4,83,Dublin (PST-K15-157),Pure Seed Testing Inc.,RON,11,3,152,2019,Jun,RON-2019-06-13,21,4,2,"Adelphia, NJ"
153,Turf Quality,6/17/19,4,83,Dublin (PST-K15-157),Pure Seed Testing Inc.,SAB,11,3,152,2019,Jun,SAB-2019-06-17,25,4,2,"Adelphia, NJ"
153,Turf Quality,7/17/19,4,83,Dublin (PST-K15-157),Pure Seed Testing Inc.,RON,11,3,152,2019,Jul,RON-2019-07-17,22,3,2,"Adelphia, NJ"
153,Turf Quality,8/22/19,4,83,Dublin (PST-K15-157),Pure Seed Testing Inc.,SAB,11,3,152,2019,Aug,SAB-2019-08-22,26,2,2,"Adelphia, NJ"
153,Turf Quality,9/16/19,5,83,Dublin (PST-K15-157),Pure Seed Testing Inc.,RON,11,3,152,2019,Sep,RON-2019-09-16,23,9,2,"Adelphia, NJ"
153,Turf Quality,10/10/19,4,83,Dublin (PST-K15-157),Pure Seed Testing Inc.,SAB,11,3,152,2019,Oct,SAB-2019-10-10,27,8,2,"Adelphia, NJ"
153,Turf Quality,11/1/19,5,83,Dublin (PST-K15-157),Pure Seed Testing Inc.,RON,11,3,152,2019,Nov,RON-2019-11-01,24,7,2,"Adelphia, NJ"
153,Turf Quality,4/28/20,4,83,Dublin (PST-K15-157),Pure Seed Testing Inc.,WAM,11,3,152,2020,Apr,WAM-2020-04-28,31,1,3,"Adelphia, NJ"
153,Turf Quality,5/18/20,5,83,Dublin (PST-K15-157),Pure Seed Testing Inc.,SAB,11,3,152,2020,May,SAB-2020-05-18,28,6,3,"Adelphia, NJ"
153,Turf Quality,6/17/20,2,83,Dublin (PST-K15-157),Pure Seed Testing Inc.,WAM,11,3,152,2020,Jun,WAM-2020-06-17,32,4,3,"Adelphia, NJ"
153,Turf Quality,7/15/20,2,83,Dublin (PST-K15-157),Pure Seed Testing Inc.,WAM,11,3,152,2020,Jul,WAM-2020-07-15,33,3,3,"Adelphia, NJ"
153,Turf Quality,8/6/20,6,83,Dublin (PST-K15-157),Pure Seed Testing Inc.,PLV,11,3,152,2020,Aug,PLV-2020-08-06,5,2,3,"Adelphia, NJ"
153,Turf Quality,9/2/20,5,83,Dublin (PST-K15-157),Pure Seed Testing Inc.,DAS,11,3,152,2020,Sep,DAS-2020-09-02,1,9,3,"Adelphia, NJ"
153,Turf Quality,10/15/20,2,83,Dublin (PST-K15-157),Pure Seed Testing Inc.,WAM,11,3,152,2020,Oct,WAM-2020-10-15,34,8,3,"Adelphia, NJ"
153,Turf Quality,11/5/20,3,83,Dublin (PST-K15-157),Pure Seed Testing Inc.,WAM,11,3,152,2020,Nov,WAM-2020-11-05,35,7,3,"Adelphia, NJ"
153,Turf Quality,10/15/20,2,83,Dublin (PST-K15-157),Pure Seed Testing Inc.,RMD,11,3,152,2020,Oct,RMD-2020-10-15,10,8,3,"Adelphia, NJ"
153,Turf Quality,10/23/20,3,83,Dublin (PST-K15-157),Pure Seed Testing Inc.,RMD,11,3,152,2020,Oct,RMD-2020-10-23,11,8,3,"Adelphia, NJ"
153,Turf Quality,3/30/21,2,83,Dublin (PST-K15-157),Pure Seed Testing Inc.,RMD,11,3,152,2021,Mar,RMD-2021-03-30,12,5,4,"Adelphia, NJ"
153,Turf Quality,4/22/21,4,83,Dublin (PST-K15-157),Pure Seed Testing Inc.,PLV,11,3,152,2021,Apr,PLV-2021-04-22,6,1,4,"Adelphia, NJ"
153,Turf Quality,5/28/21,3,83,Dublin (PST-K15-157),Pure Seed Testing Inc.,SAB,11,3,152,2021,May,SAB-2021-05-28,29,6,4,"Adelphia, NJ"
153,Turf Quality,6/11/21,5,83,Dublin (PST-K15-157),Pure Seed Testing Inc.,JEN,11,3,152,2021,Jun,JEN-2021-06-11,2,4,4,"Adelphia, NJ"
153,Turf Quality,7/13/21,5,83,Dublin (PST-K15-157),Pure Seed Testing Inc.,PLV,11,3,152,2021,Jul,PLV-2021-07-13,7,3,4,"Adelphia, NJ"
153,Turf Quality,8/11/21,5,83,Dublin (PST-K15-157),Pure Seed Testing Inc.,JEN,11,3,152,2021,Aug,JEN-2021-08-11,3,2,4,"Adelphia, NJ"
153,Turf Quality,9/17/21,3,83,Dublin (PST-K15-157),Pure Seed Testing Inc.,JEN,11,3,152,2021,Sep,JEN-2021-09-17,4,9,4,"Adelphia, NJ"
153,Turf Quality,10/13/21,4,83,Dublin (PST-K15-157),Pure Seed Testing Inc.,SAB,11,3,152,2021,Oct,SAB-2021-10-13,30,8,4,"Adelphia, NJ"
153,Turf Quality,11/18/21,5,83,Dublin (PST-K15-157),Pure Seed Testing Inc.,WAM,11,3,152,2021,Nov,WAM-2021-11-18,36,7,4,"Adelphia, NJ"
148,Turf Quality,4/18/18,2,75,A15-6,Peak Plant Genetics,RMD,10,3,147,2018,Apr,RMD-2018-04-18,8,1,1,"Adelphia, NJ"
148,Turf Quality,5/10/18,4,75,A15-6,Peak Plant Genetics,RON,10,3,147,2018,May,RON-2018-05-10,13,6,1,"Adelphia, NJ"
148,Turf Quality,6/7/18,4,75,A15-6,Peak Plant Genetics,RON,10,3,147,2018,Jun,RON-2018-06-07,14,4,1,"Adelphia, NJ"
148,Turf Quality,7/17/18,4,75,A15-6,Peak Plant Genetics,RON,10,3,147,2018,Jul,RON-2018-07-17,15,3,1,"Adelphia, NJ"
148,Turf Quality,8/15/18,5,75,A15-6,Peak Plant Genetics,RMD,10,3,147,2018,Aug,RMD-2018-08-15,9,2,1,"Adelphia, NJ"
148,Turf Quality,9/12/18,4,75,A15-6,Peak Plant Genetics,RON,10,3,147,2018,Sep,RON-2018-09-12,16,9,1,"Adelphia, NJ"
148,Turf Quality,10/2/18,6,75,A15-6,Peak Plant Genetics,RON,10,3,147,2018,Oct,RON-2018-10-02,17,8,1,"Adelphia, NJ"
148,Turf Quality,11/9/18,6,75,A15-6,Peak Plant Genetics,RON,10,3,147,2018,Nov,RON-2018-11-09,18,7,1,"Adelphia, NJ"
148,Turf Quality,4/17/19,4,75,A15-6,Peak Plant Genetics,RON,10,3,147,2019,Apr,RON-2019-04-17,19,1,2,"Adelphia, NJ"
148,Turf Quality,5/2/19,7,75,A15-6,Peak Plant Genetics,RON,10,3,147,2019,May,RON-2019-05-02,20,6,2,"Adelphia, NJ"
148,Turf Quality,6/13/19,6,75,A15-6,Peak Plant Genetics,RON,10,3,147,2019,Jun,RON-2019-06-13,21,4,2,"Adelphia, NJ"
148,Turf Quality,6/17/19,4,75,A15-6,Peak Plant Genetics,SAB,10,3,147,2019,Jun,SAB-2019-06-17,25,4,2,"Adelphia, NJ"
148,Turf Quality,7/17/19,5,75,A15-6,Peak Plant Genetics,RON,10,3,147,2019,Jul,RON-2019-07-17,22,3,2,"Adelphia, NJ"
148,Turf Quality,8/22/19,5,75,A15-6,Peak Plant Genetics,SAB,10,3,147,2019,Aug,SAB-2019-08-22,26,2,2,"Adelphia, NJ"
148,Turf Quality,9/16/19,5,75,A15-6,Peak Plant Genetics,RON,10,3,147,2019,Sep,RON-2019-09-16,23,9,2,"Adelphia, NJ"
148,Turf Quality,10/10/19,4,75,A15-6,Peak Plant Genetics,SAB,10,3,147,2019,Oct,SAB-2019-10-10,27,8,2,"Adelphia, NJ"
148,Turf Quality,11/1/19,6,75,A15-6,Peak Plant Genetics,RON,10,3,147,2019,Nov,RON-2019-11-01,24,7,2,"Adelphia, NJ"
148,Turf Quality,4/28/20,7,75,A15-6,Peak Plant Genetics,WAM,10,3,147,2020,Apr,WAM-2020-04-28,31,1,3,"Adelphia, NJ"
148,Turf Quality,5/18/20,8,75,A15-6,Peak Plant Genetics,SAB,10,3,147,2020,May,SAB-2020-05-18,28,6,3,"Adelphia, NJ"
148,Turf Quality,6/17/20,6,75,A15-6,Peak Plant Genetics,WAM,10,3,147,2020,Jun,WAM-2020-06-17,32,4,3,"Adelphia, NJ"
148,Turf Quality,7/15/20,5,75,A15-6,Peak Plant Genetics,WAM,10,3,147,2020,Jul,WAM-2020-07-15,33,3,3,"Adelphia, NJ"
148,Turf Quality,8/6/20,6,75,A15-6,Peak Plant Genetics,PLV,10,3,147,2020,Aug,PLV-2020-08-06,5,2,3,"Adelphia, NJ"
148,Turf Quality,9/2/20,7,75,A15-6,Peak Plant Genetics,DAS,10,3,147,2020,Sep,DAS-2020-09-02,1,9,3,"Adelphia, NJ"
148,Turf Quality,10/15/20,4,75,A15-6,Peak Plant Genetics,WAM,10,3,147,2020,Oct,WAM-2020-10-15,34,8,3,"Adelphia, NJ"
148,Turf Quality,11/5/20,5,75,A15-6,Peak Plant Genetics,WAM,10,3,147,2020,Nov,WAM-2020-11-05,35,7,3,"Adelphia, NJ"
148,Turf Quality,10/15/20,3,75,A15-6,Peak Plant Genetics,RMD,10,3,147,2020,Oct,RMD-2020-10-15,10,8,3,"Adelphia, NJ"
148,Turf Quality,10/23/20,5,75,A15-6,Peak Plant Genetics,RMD,10,3,147,2020,Oct,RMD-2020-10-23,11,8,3,"Adelphia, NJ"
148,Turf Quality,3/30/21,4,75,A15-6,Peak Plant Genetics,RMD,10,3,147,2021,Mar,RMD-2021-03-30,12,5,4,"Adelphia, NJ"
148,Turf Quality,4/22/21,6,75,A15-6,Peak Plant Genetics,PLV,10,3,147,2021,Apr,PLV-2021-04-22,6,1,4,"Adelphia, NJ"
148,Turf Quality,5/28/21,5,75,A15-6,Peak Plant Genetics,SAB,10,3,147,2021,May,SAB-2021-05-28,29,6,4,"Adelphia, NJ"
148,Turf Quality,6/11/21,6,75,A15-6,Peak Plant Genetics,JEN,10,3,147,2021,Jun,JEN-2021-06-11,2,4,4,"Adelphia, NJ"
148,Turf Quality,7/13/21,7,75,A15-6,Peak Plant Genetics,PLV,10,3,147,2021,Jul,PLV-2021-07-13,7,3,4,"Adelphia, NJ"
148,Turf Quality,8/11/21,6,75,A15-6,Peak Plant Genetics,JEN,10,3,147,2021,Aug,JEN-2021-08-11,3,2,4,"Adelphia, NJ"
148,Turf Quality,9/17/21,6,75,A15-6,Peak Plant Genetics,JEN,10,3,147,2021,Sep,JEN-2021-09-17,4,9,4,"Adelphia, NJ"
148,Turf Quality,10/13/21,6,75,A15-6,Peak Plant Genetics,SAB,10,3,147,2021,Oct,SAB-2021-10-13,30,8,4,"Adelphia, NJ"
148,Turf Quality,11/18/21,5,75,A15-6,Peak Plant Genetics,WAM,10,3,147,2021,Nov,WAM-2021-11-18,36,7,4,"Adelphia, NJ"
123,Turf Quality,4/18/18,5,2,A13-1,Landmark Turf & Native Seed,RMD,9,3,122,2018,Apr,RMD-2018-04-18,8,1,1,"Adelphia, NJ"
123,Turf Quality,5/10/18,6,2,A13-1,Landmark Turf & Native Seed,RON,9,3,122,2018,May,RON-2018-05-10,13,6,1,"Adelphia, NJ"
123,Turf Quality,6/7/18,7,2,A13-1,Landmark Turf & Native Seed,RON,9,3,122,2018,Jun,RON-2018-06-07,14,4,1,"Adelphia, NJ"
123,Turf Quality,7/17/18,6,2,A13-1,Landmark Turf & Native Seed,RON,9,3,122,2018,Jul,RON-2018-07-17,15,3,1,"Adelphia, NJ"
123,Turf Quality,8/15/18,8,2,A13-1,Landmark Turf & Native Seed,RMD,9,3,122,2018,Aug,RMD-2018-08-15,9,2,1,"Adelphia, NJ"
123,Turf Quality,9/12/18,8,2,A13-1,Landmark Turf & Native Seed,RON,9,3,122,2018,Sep,RON-2018-09-12,16,9,1,"Adelphia, NJ"
123,Turf Quality,10/2/18,6,2,A13-1,Landmark Turf & Native Seed,RON,9,3,122,2018,Oct,RON-2018-10-02,17,8,1,"Adelphia, NJ"
123,Turf Quality,11/9/18,8,2,A13-1,Landmark Turf & Native Seed,RON,9,3,122,2018,Nov,RON-2018-11-09,18,7,1,"Adelphia, NJ"
123,Turf Quality,4/17/19,6,2,A13-1,Landmark Turf & Native Seed,RON,9,3,122,2019,Apr,RON-2019-04-17,19,1,2,"Adelphia, NJ"
123,Turf Quality,5/2/19,6,2,A13-1,Landmark Turf & Native Seed,RON,9,3,122,2019,May,RON-2019-05-02,20,6,2,"Adelphia, NJ"
123,Turf Quality,6/13/19,7,2,A13-1,Landmark Turf & Native Seed,RON,9,3,122,2019,Jun,RON-2019-06-13,21,4,2,"Adelphia, NJ"
123,Turf Quality,6/17/19,7,2,A13-1,Landmark Turf & Native Seed,SAB,9,3,122,2019,Jun,SAB-2019-06-17,25,4,2,"Adelphia, NJ"
123,Turf Quality,7/17/19,6,2,A13-1,Landmark Turf & Native Seed,RON,9,3,122,2019,Jul,RON-2019-07-17,22,3,2,"Adelphia, NJ"
123,Turf Quality,8/22/19,6,2,A13-1,Landmark Turf & Native Seed,SAB,9,3,122,2019,Aug,SAB-2019-08-22,26,2,2,"Adelphia, NJ"
123,Turf Quality,9/16/19,8,2,A13-1,Landmark Turf & Native Seed,RON,9,3,122,2019,Sep,RON-2019-09-16,23,9,2,"Adelphia, NJ"
123,Turf Quality,10/10/19,7,2,A13-1,Landmark Turf & Native Seed,SAB,9,3,122,2019,Oct,SAB-2019-10-10,27,8,2,"Adelphia, NJ"
123,Turf Quality,11/1/19,7,2,A13-1,Landmark Turf & Native Seed,RON,9,3,122,2019,Nov,RON-2019-11-01,24,7,2,"Adelphia, NJ"
123,Turf Quality,4/28/20,6,2,A13-1,Landmark Turf & Native Seed,WAM,9,3,122,2020,Apr,WAM-2020-04-28,31,1,3,"Adelphia, NJ"
123,Turf Quality,5/18/20,7,2,A13-1,Landmark Turf & Native Seed,SAB,9,3,122,2020,May,SAB-2020-05-18,28,6,3,"Adelphia, NJ"
123,Turf Quality,6/17/20,8,2,A13-1,Landmark Turf & Native Seed,WAM,9,3,122,2020,Jun,WAM-2020-06-17,32,4,3,"Adelphia, NJ"
123,Turf Quality,7/15/20,5,2,A13-1,Landmark Turf & Native Seed,WAM,9,3,122,2020,Jul,WAM-2020-07-15,33,3,3,"Adelphia, NJ"
123,Turf Quality,8/6/20,7,2,A13-1,Landmark Turf & Native Seed,PLV,9,3,122,2020,Aug,PLV-2020-08-06,5,2,3,"Adelphia, NJ"
123,Turf Quality,9/2/20,5,2,A13-1,Landmark Turf & Native Seed,DAS,9,3,122,2020,Sep,DAS-2020-09-02,1,9,3,"Adelphia, NJ"
123,Turf Quality,10/15/20,5,2,A13-1,Landmark Turf & Native Seed,WAM,9,3,122,2020,Oct,WAM-2020-10-15,34,8,3,"Adelphia, NJ"
123,Turf Quality,11/5/20,5,2,A13-1,Landmark Turf & Native Seed,WAM,9,3,122,2020,Nov,WAM-2020-11-05,35,7,3,"Adelphia, NJ"
123,Turf Quality,10/15/20,5,2,A13-1,Landmark Turf & Native Seed,RMD,9,3,122,2020,Oct,RMD-2020-10-15,10,8,3,"Adelphia, NJ"
123,Turf Quality,10/23/20,5,2,A13-1,Landmark Turf & Native Seed,RMD,9,3,122,2020,Oct,RMD-2020-10-23,11,8,3,"Adelphia, NJ"
123,Turf Quality,3/30/21,4,2,A13-1,Landmark Turf & Native Seed,RMD,9,3,122,2021,Mar,RMD-2021-03-30,12,5,4,"Adelphia, NJ"
123,Turf Quality,4/22/21,8,2,A13-1,Landmark Turf & Native Seed,PLV,9,3,122,2021,Apr,PLV-2021-04-22,6,1,4,"Adelphia, NJ"
123,Turf Quality,5/28/21,6,2,A13-1,Landmark Turf & Native Seed,SAB,9,3,122,2021,May,SAB-2021-05-28,29,6,4,"Adelphia, NJ"
123,Turf Quality,6/11/21,8,2,A13-1,Landmark Turf & Native Seed,JEN,9,3,122,2021,Jun,JEN-2021-06-11,2,4,4,"Adelphia, NJ"
123,Turf Quality,7/13/21,6,2,A13-1,Landmark Turf & Native Seed,PLV,9,3,122,2021,Jul,PLV-2021-07-13,7,3,4,"Adelphia, NJ"
123,Turf Quality,8/11/21,7,2,A13-1,Landmark Turf & Native Seed,JEN,9,3,122,2021,Aug,JEN-2021-08-11,3,2,4,"Adelphia, NJ"
123,Turf Quality,9/17/21,6,2,A13-1,Landmark Turf & Native Seed,JEN,9,3,122,2021,Sep,JEN-2021-09-17,4,9,4,"Adelphia, NJ"
123,Turf Quality,10/13/21,7,2,A13-1,Landmark Turf & Native Seed,SAB,9,3,122,2021,Oct,SAB-2021-10-13,30,8,4,"Adelphia, NJ"
123,Turf Quality,11/18/21,6,2,A13-1,Landmark Turf & Native Seed,WAM,9,3,122,2021,Nov,WAM-2021-11-18,36,7,4,"Adelphia, NJ"
118,Turf Quality,4/18/18,3,81,PST-K13-141,Pure Seed Testing Inc.,RMD,8,3,117,2018,Apr,RMD-2018-04-18,8,1,1,"Adelphia, NJ"
118,Turf Quality,5/10/18,4,81,PST-K13-141,Pure Seed Testing Inc.,RON,8,3,117,2018,May,RON-2018-05-10,13,6,1,"Adelphia, NJ"
118,Turf Quality,6/7/18,5,81,PST-K13-141,Pure Seed Testing Inc.,RON,8,3,117,2018,Jun,RON-2018-06-07,14,4,1,"Adelphia, NJ"
118,Turf Quality,7/17/18,5,81,PST-K13-141,Pure Seed Testing Inc.,RON,8,3,117,2018,Jul,RON-2018-07-17,15,3,1,"Adelphia, NJ"
118,Turf Quality,8/15/18,5,81,PST-K13-141,Pure Seed Testing Inc.,RMD,8,3,117,2018,Aug,RMD-2018-08-15,9,2,1,"Adelphia, NJ"
118,Turf Quality,9/12/18,6,81,PST-K13-141,Pure Seed Testing Inc.,RON,8,3,117,2018,Sep,RON-2018-09-12,16,9,1,"Adelphia, NJ"
118,Turf Quality,10/2/18,6,81,PST-K13-141,Pure Seed Testing Inc.,RON,8,3,117,2018,Oct,RON-2018-10-02,17,8,1,"Adelphia, NJ"
118,Turf Quality,11/9/18,7,81,PST-K13-141,Pure Seed Testing Inc.,RON,8,3,117,2018,Nov,RON-2018-11-09,18,7,1,"Adelphia, NJ"
118,Turf Quality,4/17/19,5,81,PST-K13-141,Pure Seed Testing Inc.,RON,8,3,117,2019,Apr,RON-2019-04-17,19,1,2,"Adelphia, NJ"
118,Turf Quality,5/2/19,6,81,PST-K13-141,Pure Seed Testing Inc.,RON,8,3,117,2019,May,RON-2019-05-02,20,6,2,"Adelphia, NJ"
118,Turf Quality,6/13/19,6,81,PST-K13-141,Pure Seed Testing Inc.,RON,8,3,117,2019,Jun,RON-2019-06-13,21,4,2,"Adelphia, NJ"
118,Turf Quality,6/17/19,5,81,PST-K13-141,Pure Seed Testing Inc.,SAB,8,3,117,2019,Jun,SAB-2019-06-17,25,4,2,"Adelphia, NJ"
118,Turf Quality,7/17/19,5,81,PST-K13-141,Pure Seed Testing Inc.,RON,8,3,117,2019,Jul,RON-2019-07-17,22,3,2,"Adelphia, NJ"
118,Turf Quality,8/22/19,5,81,PST-K13-141,Pure Seed Testing Inc.,SAB,8,3,117,2019,Aug,SAB-2019-08-22,26,2,2,"Adelphia, NJ"
118,Turf Quality,9/16/19,6,81,PST-K13-141,Pure Seed Testing Inc.,RON,8,3,117,2019,Sep,RON-2019-09-16,23,9,2,"Adelphia, NJ"
118,Turf Quality,10/10/19,4,81,PST-K13-141,Pure Seed Testing Inc.,SAB,8,3,117,2019,Oct,SAB-2019-10-10,27,8,2,"Adelphia, NJ"
118,Turf Quality,11/1/19,5,81,PST-K13-141,Pure Seed Testing Inc.,RON,8,3,117,2019,Nov,RON-2019-11-01,24,7,2,"Adelphia, NJ"
118,Turf Quality,4/28/20,4,81,PST-K13-141,Pure Seed Testing Inc.,WAM,8,3,117,2020,Apr,WAM-2020-04-28,31,1,3,"Adelphia, NJ"
118,Turf Quality,5/18/20,6,81,PST-K13-141,Pure Seed Testing Inc.,SAB,8,3,117,2020,May,SAB-2020-05-18,28,6,3,"Adelphia, NJ"
118,Turf Quality,6/17/20,5,81,PST-K13-141,Pure Seed Testing Inc.,WAM,8,3,117,2020,Jun,WAM-2020-06-17,32,4,3,"Adelphia, NJ"
118,Turf Quality,7/15/20,4,81,PST-K13-141,Pure Seed Testing Inc.,WAM,8,3,117,2020,Jul,WAM-2020-07-15,33,3,3,"Adelphia, NJ"
118,Turf Quality,8/6/20,6,81,PST-K13-141,Pure Seed Testing Inc.,PLV,8,3,117,2020,Aug,PLV-2020-08-06,5,2,3,"Adelphia, NJ"
118,Turf Quality,9/2/20,4,81,PST-K13-141,Pure Seed Testing Inc.,DAS,8,3,117,2020,Sep,DAS-2020-09-02,1,9,3,"Adelphia, NJ"
118,Turf Quality,10/15/20,3,81,PST-K13-141,Pure Seed Testing Inc.,WAM,8,3,117,2020,Oct,WAM-2020-10-15,34,8,3,"Adelphia, NJ"
118,Turf Quality,11/5/20,4,81,PST-K13-141,Pure Seed Testing Inc.,WAM,8,3,117,2020,Nov,WAM-2020-11-05,35,7,3,"Adelphia, NJ"
118,Turf Quality,10/15/20,3,81,PST-K13-141,Pure Seed Testing Inc.,RMD,8,3,117,2020,Oct,RMD-2020-10-15,10,8,3,"Adelphia, NJ"
118,Turf Quality,10/23/20,3,81,PST-K13-141,Pure Seed Testing Inc.,RMD,8,3,117,2020,Oct,RMD-2020-10-23,11,8,3,"Adelphia, NJ"
118,Turf Quality,3/30/21,4,81,PST-K13-141,Pure Seed Testing Inc.,RMD,8,3,117,2021,Mar,RMD-2021-03-30,12,5,4,"Adelphia, NJ"
118,Turf Quality,4/22/21,4,81,PST-K13-141,Pure Seed Testing Inc.,PLV,8,3,117,2021,Apr,PLV-2021-04-22,6,1,4,"Adelphia, NJ"
118,Turf Quality,5/28/21,5,81,PST-K13-141,Pure Seed Testing Inc.,SAB,8,3,117,2021,May,SAB-2021-05-28,29,6,4,"Adelphia, NJ"
118,Turf Quality,6/11/21,7,81,PST-K13-141,Pure Seed Testing Inc.,JEN,8,3,117,2021,Jun,JEN-2021-06-11,2,4,4,"Adelphia, NJ"
118,Turf Quality,7/13/21,6,81,PST-K13-141,Pure Seed Testing Inc.,PLV,8,3,117,2021,Jul,PLV-2021-07-13,7,3,4,"Adelphia, NJ"
118,Turf Quality,8/11/21,5,81,PST-K13-141,Pure Seed Testing Inc.,JEN,8,3,117,2021,Aug,JEN-2021-08-11,3,2,4,"Adelphia, NJ"
118,Turf Quality,9/17/21,6,81,PST-K13-141,Pure Seed Testing Inc.,JEN,8,3,117,2021,Sep,JEN-2021-09-17,4,9,4,"Adelphia, NJ"
118,Turf Quality,10/13/21,6,81,PST-K13-141,Pure Seed Testing Inc.,SAB,8,3,117,2021,Oct,SAB-2021-10-13,30,8,4,"Adelphia, NJ"
118,Turf Quality,11/18/21,5,81,PST-K13-141,Pure Seed Testing Inc.,WAM,8,3,117,2021,Nov,WAM-2021-11-18,36,7,4,"Adelphia, NJ"
93,Turf Quality,4/18/18,6,78,A06-8,Blue Mt. Seeds Inc.,RMD,7,3,92,2018,Apr,RMD-2018-04-18,8,1,1,"Adelphia, NJ"
93,Turf Quality,5/10/18,6,78,A06-8,Blue Mt. Seeds Inc.,RON,7,3,92,2018,May,RON-2018-05-10,13,6,1,"Adelphia, NJ"
93,Turf Quality,6/7/18,5,78,A06-8,Blue Mt. Seeds Inc.,RON,7,3,92,2018,Jun,RON-2018-06-07,14,4,1,"Adelphia, NJ"
93,Turf Quality,7/17/18,4,78,A06-8,Blue Mt. Seeds Inc.,RON,7,3,92,2018,Jul,RON-2018-07-17,15,3,1,"Adelphia, NJ"
93,Turf Quality,8/15/18,9,78,A06-8,Blue Mt. Seeds Inc.,RMD,7,3,92,2018,Aug,RMD-2018-08-15,9,2,1,"Adelphia, NJ"
93,Turf Quality,9/12/18,6,78,A06-8,Blue Mt. Seeds Inc.,RON,7,3,92,2018,Sep,RON-2018-09-12,16,9,1,"Adelphia, NJ"
93,Turf Quality,10/2/18,7,78,A06-8,Blue Mt. Seeds Inc.,RON,7,3,92,2018,Oct,RON-2018-10-02,17,8,1,"Adelphia, NJ"
93,Turf Quality,11/9/18,7,78,A06-8,Blue Mt. Seeds Inc.,RON,7,3,92,2018,Nov,RON-2018-11-09,18,7,1,"Adelphia, NJ"
93,Turf Quality,4/17/19,5,78,A06-8,Blue Mt. Seeds Inc.,RON,7,3,92,2019,Apr,RON-2019-04-17,19,1,2,"Adelphia, NJ"
93,Turf Quality,5/2/19,5,78,A06-8,Blue Mt. Seeds Inc.,RON,7,3,92,2019,May,RON-2019-05-02,20,6,2,"Adelphia, NJ"
93,Turf Quality,6/13/19,5,78,A06-8,Blue Mt. Seeds Inc.,RON,7,3,92,2019,Jun,RON-2019-06-13,21,4,2,"Adelphia, NJ"
93,Turf Quality,6/17/19,4,78,A06-8,Blue Mt. Seeds Inc.,SAB,7,3,92,2019,Jun,SAB-2019-06-17,25,4,2,"Adelphia, NJ"
93,Turf Quality,7/17/19,5,78,A06-8,Blue Mt. Seeds Inc.,RON,7,3,92,2019,Jul,RON-2019-07-17,22,3,2,"Adelphia, NJ"
93,Turf Quality,8/22/19,6,78,A06-8,Blue Mt. Seeds Inc.,SAB,7,3,92,2019,Aug,SAB-2019-08-22,26,2,2,"Adelphia, NJ"
93,Turf Quality,9/16/19,6,78,A06-8,Blue Mt. Seeds Inc.,RON,7,3,92,2019,Sep,RON-2019-09-16,23,9,2,"Adelphia, NJ"
93,Turf Quality,10/10/19,6,78,A06-8,Blue Mt. Seeds Inc.,SAB,7,3,92,2019,Oct,SAB-2019-10-10,27,8,2,"Adelphia, NJ"
93,Turf Quality,11/1/19,6,78,A06-8,Blue Mt. Seeds Inc.,RON,7,3,92,2019,Nov,RON-2019-11-01,24,7,2,"Adelphia, NJ"
93,Turf Quality,4/28/20,7,78,A06-8,Blue Mt. Seeds Inc.,WAM,7,3,92,2020,Apr,WAM-2020-04-28,31,1,3,"Adelphia, NJ"
93,Turf Quality,5/18/20,6,78,A06-8,Blue Mt. Seeds Inc.,SAB,7,3,92,2020,May,SAB-2020-05-18,28,6,3,"Adelphia, NJ"
93,Turf Quality,6/17/20,4,78,A06-8,Blue Mt. Seeds Inc.,WAM,7,3,92,2020,Jun,WAM-2020-06-17,32,4,3,"Adelphia, NJ"
93,Turf Quality,7/15/20,5,78,A06-8,Blue Mt. Seeds Inc.,WAM,7,3,92,2020,Jul,WAM-2020-07-15,33,3,3,"Adelphia, NJ"
93,Turf Quality,8/6/20,6,78,A06-8,Blue Mt. Seeds Inc.,PLV,7,3,92,2020,Aug,PLV-2020-08-06,5,2,3,"Adelphia, NJ"
93,Turf Quality,9/2/20,5,78,A06-8,Blue Mt. Seeds Inc.,DAS,7,3,92,2020,Sep,DAS-2020-09-02,1,9,3,"Adelphia, NJ"
93,Turf Quality,10/15/20,3,78,A06-8,Blue Mt. Seeds Inc.,WAM,7,3,92,2020,Oct,WAM-2020-10-15,34,8,3,"Adelphia, NJ"
93,Turf Quality,11/5/20,4,78,A06-8,Blue Mt. Seeds Inc.,WAM,7,3,92,2020,Nov,WAM-2020-11-05,35,7,3,"Adelphia, NJ"
93,Turf Quality,10/15/20,4,78,A06-8,Blue Mt. Seeds Inc.,RMD,7,3,92,2020,Oct,RMD-2020-10-15,10,8,3,"Adelphia, NJ"
93,Turf Quality,10/23/20,5,78,A06-8,Blue Mt. Seeds Inc.,RMD,7,3,92,2020,Oct,RMD-2020-10-23,11,8,3,"Adelphia, NJ"
93,Turf Quality,3/30/21,4,78,A06-8,Blue Mt. Seeds Inc.,RMD,7,3,92,2021,Mar,RMD-2021-03-30,12,5,4,"Adelphia, NJ"
93,Turf Quality,4/22/21,6,78,A06-8,Blue Mt. Seeds Inc.,PLV,7,3,92,2021,Apr,PLV-2021-04-22,6,1,4,"Adelphia, NJ"
93,Turf Quality,5/28/21,5,78,A06-8,Blue Mt. Seeds Inc.,SAB,7,3,92,2021,May,SAB-2021-05-28,29,6,4,"Adelphia, NJ"
93,Turf Quality,6/11/21,4,78,A06-8,Blue Mt. Seeds Inc.,JEN,7,3,92,2021,Jun,JEN-2021-06-11,2,4,4,"Adelphia, NJ"
93,Turf Quality,7/13/21,7,78,A06-8,Blue Mt. Seeds Inc.,PLV,7,3,92,2021,Jul,PLV-2021-07-13,7,3,4,"Adelphia, NJ"
93,Turf Quality,8/11/21,6,78,A06-8,Blue Mt. Seeds Inc.,JEN,7,3,92,2021,Aug,JEN-2021-08-11,3,2,4,"Adelphia, NJ"
93,Turf Quality,9/17/21,5,78,A06-8,Blue Mt. Seeds Inc.,JEN,7,3,92,2021,Sep,JEN-2021-09-17,4,9,4,"Adelphia, NJ"
93,Turf Quality,10/13/21,4,78,A06-8,Blue Mt. Seeds Inc.,SAB,7,3,92,2021,Oct,SAB-2021-10-13,30,8,4,"Adelphia, NJ"
93,Turf Quality,11/18/21,5,78,A06-8,Blue Mt. Seeds Inc.,WAM,7,3,92,2021,Nov,WAM-2021-11-18,36,7,4,"Adelphia, NJ"
88,Turf Quality,4/18/18,3,88,Midnight,Standard,RMD,6,3,88,2018,Apr,RMD-2018-04-18,8,1,1,"Adelphia, NJ"
88,Turf Quality,5/10/18,4,88,Midnight,Standard,RON,6,3,88,2018,May,RON-2018-05-10,13,6,1,"Adelphia, NJ"
88,Turf Quality,6/7/18,6,88,Midnight,Standard,RON,6,3,88,2018,Jun,RON-2018-06-07,14,4,1,"Adelphia, NJ"
88,Turf Quality,7/17/18,6,88,Midnight,Standard,RON,6,3,88,2018,Jul,RON-2018-07-17,15,3,1,"Adelphia, NJ"
88,Turf Quality,8/15/18,7,88,Midnight,Standard,RMD,6,3,88,2018,Aug,RMD-2018-08-15,9,2,1,"Adelphia, NJ"
88,Turf Quality,9/12/18,6,88,Midnight,Standard,RON,6,3,88,2018,Sep,RON-2018-09-12,16,9,1,"Adelphia, NJ"
88,Turf Quality,10/2/18,6,88,Midnight,Standard,RON,6,3,88,2018,Oct,RON-2018-10-02,17,8,1,"Adelphia, NJ"
88,Turf Quality,11/9/18,6,88,Midnight,Standard,RON,6,3,88,2018,Nov,RON-2018-11-09,18,7,1,"Adelphia, NJ"
88,Turf Quality,4/17/19,3,88,Midnight,Standard,RON,6,3,88,2019,Apr,RON-2019-04-17,19,1,2,"Adelphia, NJ"
88,Turf Quality,5/2/19,5,88,Midnight,Standard,RON,6,3,88,2019,May,RON-2019-05-02,20,6,2,"Adelphia, NJ"
88,Turf Quality,6/13/19,6,88,Midnight,Standard,RON,6,3,88,2019,Jun,RON-2019-06-13,21,4,2,"Adelphia, NJ"
88,Turf Quality,6/17/19,6,88,Midnight,Standard,SAB,6,3,88,2019,Jun,SAB-2019-06-17,25,4,2,"Adelphia, NJ"
88,Turf Quality,7/17/19,5,88,Midnight,Standard,RON,6,3,88,2019,Jul,RON-2019-07-17,22,3,2,"Adelphia, NJ"
88,Turf Quality,8/22/19,7,88,Midnight,Standard,SAB,6,3,88,2019,Aug,SAB-2019-08-22,26,2,2,"Adelphia, NJ"
88,Turf Quality,9/16/19,6,88,Midnight,Standard,RON,6,3,88,2019,Sep,RON-2019-09-16,23,9,2,"Adelphia, NJ"
88,Turf Quality,10/10/19,8,88,Midnight,Standard,SAB,6,3,88,2019,Oct,SAB-2019-10-10,27,8,2,"Adelphia, NJ"
88,Turf Quality,11/1/19,6,88,Midnight,Standard,RON,6,3,88,2019,Nov,RON-2019-11-01,24,7,2,"Adelphia, NJ"
88,Turf Quality,4/28/20,6,88,Midnight,Standard,WAM,6,3,88,2020,Apr,WAM-2020-04-28,31,1,3,"Adelphia, NJ"
88,Turf Quality,5/18/20,4,88,Midnight,Standard,SAB,6,3,88,2020,May,SAB-2020-05-18,28,6,3,"Adelphia, NJ"
88,Turf Quality,6/17/20,6,88,Midnight,Standard,WAM,6,3,88,2020,Jun,WAM-2020-06-17,32,4,3,"Adelphia, NJ"
88,Turf Quality,7/15/20,7,88,Midnight,Standard,WAM,6,3,88,2020,Jul,WAM-2020-07-15,33,3,3,"Adelphia, NJ"
88,Turf Quality,8/6/20,8,88,Midnight,Standard,PLV,6,3,88,2020,Aug,PLV-2020-08-06,5,2,3,"Adelphia, NJ"
88,Turf Quality,9/2/20,6,88,Midnight,Standard,DAS,6,3,88,2020,Sep,DAS-2020-09-02,1,9,3,"Adelphia, NJ"
88,Turf Quality,10/15/20,4,88,Midnight,Standard,WAM,6,3,88,2020,Oct,WAM-2020-10-15,34,8,3,"Adelphia, NJ"
88,Turf Quality,11/5/20,4,88,Midnight,Standard,WAM,6,3,88,2020,Nov,WAM-2020-11-05,35,7,3,"Adelphia, NJ"
88,Turf Quality,10/15/20,5,88,Midnight,Standard,RMD,6,3,88,2020,Oct,RMD-2020-10-15,10,8,3,"Adelphia, NJ"
88,Turf Quality,10/23/20,5,88,Midnight,Standard,RMD,6,3,88,2020,Oct,RMD-2020-10-23,11,8,3,"Adelphia, NJ"
88,Turf Quality,3/30/21,4,88,Midnight,Standard,RMD,6,3,88,2021,Mar,RMD-2021-03-30,12,5,4,"Adelphia, NJ"
88,Turf Quality,4/22/21,4,88,Midnight,Standard,PLV,6,3,88,2021,Apr,PLV-2021-04-22,6,1,4,"Adelphia, NJ"
88,Turf Quality,5/28/21,5,88,Midnight,Standard,SAB,6,3,88,2021,May,SAB-2021-05-28,29,6,4,"Adelphia, NJ"
88,Turf Quality,6/11/21,6,88,Midnight,Standard,JEN,6,3,88,2021,Jun,JEN-2021-06-11,2,4,4,"Adelphia, NJ"
88,Turf Quality,7/13/21,8,88,Midnight,Standard,PLV,6,3,88,2021,Jul,PLV-2021-07-13,7,3,4,"Adelphia, NJ"
88,Turf Quality,8/11/21,7,88,Midnight,Standard,JEN,6,3,88,2021,Aug,JEN-2021-08-11,3,2,4,"Adelphia, NJ"
88,Turf Quality,9/17/21,7,88,Midnight,Standard,JEN,6,3,88,2021,Sep,JEN-2021-09-17,4,9,4,"Adelphia, NJ"
88,Turf Quality,10/13/21,8,88,Midnight,Standard,SAB,6,3,88,2021,Oct,SAB-2021-10-13,30,8,4,"Adelphia, NJ"
88,Turf Quality,11/18/21,7,88,Midnight,Standard,WAM,6,3,88,2021,Nov,WAM-2021-11-18,36,7,4,"Adelphia, NJ"
63,Turf Quality,4/18/18,2,63,MVS-130,Mountain View Seeds,RMD,5,3,63,2018,Apr,RMD-2018-04-18,8,1,1,"Adelphia, NJ"
63,Turf Quality,5/10/18,3,63,MVS-130,Mountain View Seeds,RON,5,3,63,2018,May,RON-2018-05-10,13,6,1,"Adelphia, NJ"
63,Turf Quality,6/7/18,7,63,MVS-130,Mountain View Seeds,RON,5,3,63,2018,Jun,RON-2018-06-07,14,4,1,"Adelphia, NJ"
63,Turf Quality,7/17/18,6,63,MVS-130,Mountain View Seeds,RON,5,3,63,2018,Jul,RON-2018-07-17,15,3,1,"Adelphia, NJ"
63,Turf Quality,8/15/18,6,63,MVS-130,Mountain View Seeds,RMD,5,3,63,2018,Aug,RMD-2018-08-15,9,2,1,"Adelphia, NJ"
63,Turf Quality,9/12/18,4,63,MVS-130,Mountain View Seeds,RON,5,3,63,2018,Sep,RON-2018-09-12,16,9,1,"Adelphia, NJ"
63,Turf Quality,10/2/18,4,63,MVS-130,Mountain View Seeds,RON,5,3,63,2018,Oct,RON-2018-10-02,17,8,1,"Adelphia, NJ"
63,Turf Quality,11/9/18,4,63,MVS-130,Mountain View Seeds,RON,5,3,63,2018,Nov,RON-2018-11-09,18,7,1,"Adelphia, NJ"
63,Turf Quality,4/17/19,3,63,MVS-130,Mountain View Seeds,RON,5,3,63,2019,Apr,RON-2019-04-17,19,1,2,"Adelphia, NJ"
63,Turf Quality,5/2/19,5,63,MVS-130,Mountain View Seeds,RON,5,3,63,2019,May,RON-2019-05-02,20,6,2,"Adelphia, NJ"
63,Turf Quality,6/13/19,5,63,MVS-130,Mountain View Seeds,RON,5,3,63,2019,Jun,RON-2019-06-13,21,4,2,"Adelphia, NJ"
63,Turf Quality,6/17/19,5,63,MVS-130,Mountain View Seeds,SAB,5,3,63,2019,Jun,SAB-2019-06-17,25,4,2,"Adelphia, NJ"
63,Turf Quality,7/17/19,5,63,MVS-130,Mountain View Seeds,RON,5,3,63,2019,Jul,RON-2019-07-17,22,3,2,"Adelphia, NJ"
63,Turf Quality,8/22/19,4,63,MVS-130,Mountain View Seeds,SAB,5,3,63,2019,Aug,SAB-2019-08-22,26,2,2,"Adelphia, NJ"
63,Turf Quality,9/16/19,5,63,MVS-130,Mountain View Seeds,RON,5,3,63,2019,Sep,RON-2019-09-16,23,9,2,"Adelphia, NJ"
63,Turf Quality,10/10/19,4,63,MVS-130,Mountain View Seeds,SAB,5,3,63,2019,Oct,SAB-2019-10-10,27,8,2,"Adelphia, NJ"
63,Turf Quality,11/1/19,4,63,MVS-130,Mountain View Seeds,RON,5,3,63,2019,Nov,RON-2019-11-01,24,7,2,"Adelphia, NJ"
63,Turf Quality,4/28/20,4,63,MVS-130,Mountain View Seeds,WAM,5,3,63,2020,Apr,WAM-2020-04-28,31,1,3,"Adelphia, NJ"
63,Turf Quality,5/18/20,4,63,MVS-130,Mountain View Seeds,SAB,5,3,63,2020,May,SAB-2020-05-18,28,6,3,"Adelphia, NJ"
63,Turf Quality,6/17/20,4,63,MVS-130,Mountain View Seeds,WAM,5,3,63,2020,Jun,WAM-2020-06-17,32,4,3,"Adelphia, NJ"
63,Turf Quality,7/15/20,4,63,MVS-130,Mountain View Seeds,WAM,5,3,63,2020,Jul,WAM-2020-07-15,33,3,3,"Adelphia, NJ"
63,Turf Quality,8/6/20,4,63,MVS-130,Mountain View Seeds,PLV,5,3,63,2020,Aug,PLV-2020-08-06,5,2,3,"Adelphia, NJ"
63,Turf Quality,9/2/20,3,63,MVS-130,Mountain View Seeds,DAS,5,3,63,2020,Sep,DAS-2020-09-02,1,9,3,"Adelphia, NJ"
63,Turf Quality,10/15/20,4,63,MVS-130,Mountain View Seeds,WAM,5,3,63,2020,Oct,WAM-2020-10-15,34,8,3,"Adelphia, NJ"
63,Turf Quality,11/5/20,5,63,MVS-130,Mountain View Seeds,WAM,5,3,63,2020,Nov,WAM-2020-11-05,35,7,3,"Adelphia, NJ"
63,Turf Quality,10/15/20,4,63,MVS-130,Mountain View Seeds,RMD,5,3,63,2020,Oct,RMD-2020-10-15,10,8,3,"Adelphia, NJ"
63,Turf Quality,10/23/20,4,63,MVS-130,Mountain View Seeds,RMD,5,3,63,2020,Oct,RMD-2020-10-23,11,8,3,"Adelphia, NJ"
63,Turf Quality,3/30/21,3,63,MVS-130,Mountain View Seeds,RMD,5,3,63,2021,Mar,RMD-2021-03-30,12,5,4,"Adelphia, NJ"
63,Turf Quality,4/22/21,6,63,MVS-130,Mountain View Seeds,PLV,5,3,63,2021,Apr,PLV-2021-04-22,6,1,4,"Adelphia, NJ"
63,Turf Quality,5/28/21,4,63,MVS-130,Mountain View Seeds,SAB,5,3,63,2021,May,SAB-2021-05-28,29,6,4,"Adelphia, NJ"
63,Turf Quality,6/11/21,4,63,MVS-130,Mountain View Seeds,JEN,5,3,63,2021,Jun,JEN-2021-06-11,2,4,4,"Adelphia, NJ"
63,Turf Quality,7/13/21,5,63,MVS-130,Mountain View Seeds,PLV,5,3,63,2021,Jul,PLV-2021-07-13,7,3,4,"Adelphia, NJ"
63,Turf Quality,8/11/21,4,63,MVS-130,Mountain View Seeds,JEN,5,3,63,2021,Aug,JEN-2021-08-11,3,2,4,"Adelphia, NJ"
63,Turf Quality,9/17/21,2,63,MVS-130,Mountain View Seeds,JEN,5,3,63,2021,Sep,JEN-2021-09-17,4,9,4,"Adelphia, NJ"
63,Turf Quality,10/13/21,3,63,MVS-130,Mountain View Seeds,SAB,5,3,63,2021,Oct,SAB-2021-10-13,30,8,4,"Adelphia, NJ"
63,Turf Quality,11/18/21,7,63,MVS-130,Mountain View Seeds,WAM,5,3,63,2021,Nov,WAM-2021-11-18,36,7,4,"Adelphia, NJ"
58,Turf Quality,4/18/18,4,58,DLFPS-340/3444,DLF Pickseed USA,RMD,4,3,58,2018,Apr,RMD-2018-04-18,8,1,1,"Adelphia, NJ"
58,Turf Quality,5/10/18,5,58,DLFPS-340/3444,DLF Pickseed USA,RON,4,3,58,2018,May,RON-2018-05-10,13,6,1,"Adelphia, NJ"
58,Turf Quality,6/7/18,4,58,DLFPS-340/3444,DLF Pickseed USA,RON,4,3,58,2018,Jun,RON-2018-06-07,14,4,1,"Adelphia, NJ"
58,Turf Quality,7/17/18,4,58,DLFPS-340/3444,DLF Pickseed USA,RON,4,3,58,2018,Jul,RON-2018-07-17,15,3,1,"Adelphia, NJ"
58,Turf Quality,8/15/18,3,58,DLFPS-340/3444,DLF Pickseed USA,RMD,4,3,58,2018,Aug,RMD-2018-08-15,9,2,1,"Adelphia, NJ"
58,Turf Quality,9/12/18,2,58,DLFPS-340/3444,DLF Pickseed USA,RON,4,3,58,2018,Sep,RON-2018-09-12,16,9,1,"Adelphia, NJ"
58,Turf Quality,10/2/18,2,58,DLFPS-340/3444,DLF Pickseed USA,RON,4,3,58,2018,Oct,RON-2018-10-02,17,8,1,"Adelphia, NJ"
58,Turf Quality,11/9/18,2,58,DLFPS-340/3444,DLF Pickseed USA,RON,4,3,58,2018,Nov,RON-2018-11-09,18,7,1,"Adelphia, NJ"
58,Turf Quality,4/17/19,3,58,DLFPS-340/3444,DLF Pickseed USA,RON,4,3,58,2019,Apr,RON-2019-04-17,19,1,2,"Adelphia, NJ"
58,Turf Quality,5/2/19,4,58,DLFPS-340/3444,DLF Pickseed USA,RON,4,3,58,2019,May,RON-2019-05-02,20,6,2,"Adelphia, NJ"
58,Turf Quality,6/13/19,4,58,DLFPS-340/3444,DLF Pickseed USA,RON,4,3,58,2019,Jun,RON-2019-06-13,21,4,2,"Adelphia, NJ"
58,Turf Quality,6/17/19,4,58,DLFPS-340/3444,DLF Pickseed USA,SAB,4,3,58,2019,Jun,SAB-2019-06-17,25,4,2,"Adelphia, NJ"
58,Turf Quality,7/17/19,4,58,DLFPS-340/3444,DLF Pickseed USA,RON,4,3,58,2019,Jul,RON-2019-07-17,22,3,2,"Adelphia, NJ"
58,Turf Quality,8/22/19,2,58,DLFPS-340/3444,DLF Pickseed USA,SAB,4,3,58,2019,Aug,SAB-2019-08-22,26,2,2,"Adelphia, NJ"
58,Turf Quality,9/16/19,1,58,DLFPS-340/3444,DLF Pickseed USA,RON,4,3,58,2019,Sep,RON-2019-09-16,23,9,2,"Adelphia, NJ"
58,Turf Quality,10/10/19,1,58,DLFPS-340/3444,DLF Pickseed USA,SAB,4,3,58,2019,Oct,SAB-2019-10-10,27,8,2,"Adelphia, NJ"
58,Turf Quality,11/1/19,1,58,DLFPS-340/3444,DLF Pickseed USA,RON,4,3,58,2019,Nov,RON-2019-11-01,24,7,2,"Adelphia, NJ"
58,Turf Quality,4/28/20,4,58,DLFPS-340/3444,DLF Pickseed USA,WAM,4,3,58,2020,Apr,WAM-2020-04-28,31,1,3,"Adelphia, NJ"
58,Turf Quality,5/18/20,3,58,DLFPS-340/3444,DLF Pickseed USA,SAB,4,3,58,2020,May,SAB-2020-05-18,28,6,3,"Adelphia, NJ"
58,Turf Quality,6/17/20,3,58,DLFPS-340/3444,DLF Pickseed USA,WAM,4,3,58,2020,Jun,WAM-2020-06-17,32,4,3,"Adelphia, NJ"
58,Turf Quality,7/15/20,3,58,DLFPS-340/3444,DLF Pickseed USA,WAM,4,3,58,2020,Jul,WAM-2020-07-15,33,3,3,"Adelphia, NJ"
58,Turf Quality,8/6/20,4,58,DLFPS-340/3444,DLF Pickseed USA,PLV,4,3,58,2020,Aug,PLV-2020-08-06,5,2,3,"Adelphia, NJ"
58,Turf Quality,9/2/20,4,58,DLFPS-340/3444,DLF Pickseed USA,DAS,4,3,58,2020,Sep,DAS-2020-09-02,1,9,3,"Adelphia, NJ"
58,Turf Quality,10/15/20,3,58,DLFPS-340/3444,DLF Pickseed USA,WAM,4,3,58,2020,Oct,WAM-2020-10-15,34,8,3,"Adelphia, NJ"
58,Turf Quality,11/5/20,2,58,DLFPS-340/3444,DLF Pickseed USA,WAM,4,3,58,2020,Nov,WAM-2020-11-05,35,7,3,"Adelphia, NJ"
58,Turf Quality,10/15/20,3,58,DLFPS-340/3444,DLF Pickseed USA,RMD,4,3,58,2020,Oct,RMD-2020-10-15,10,8,3,"Adelphia, NJ"
58,Turf Quality,10/23/20,3,58,DLFPS-340/3444,DLF Pickseed USA,RMD,4,3,58,2020,Oct,RMD-2020-10-23,11,8,3,"Adelphia, NJ"
58,Turf Quality,3/30/21,2,58,DLFPS-340/3444,DLF Pickseed USA,RMD,4,3,58,2021,Mar,RMD-2021-03-30,12,5,4,"Adelphia, NJ"
58,Turf Quality,4/22/21,3,58,DLFPS-340/3444,DLF Pickseed USA,PLV,4,3,58,2021,Apr,PLV-2021-04-22,6,1,4,"Adelphia, NJ"
58,Turf Quality,5/28/21,3,58,DLFPS-340/3444,DLF Pickseed USA,SAB,4,3,58,2021,May,SAB-2021-05-28,29,6,4,"Adelphia, NJ"
58,Turf Quality,6/11/21,4,58,DLFPS-340/3444,DLF Pickseed USA,JEN,4,3,58,2021,Jun,JEN-2021-06-11,2,4,4,"Adelphia, NJ"
58,Turf Quality,7/13/21,3,58,DLFPS-340/3444,DLF Pickseed USA,PLV,4,3,58,2021,Jul,PLV-2021-07-13,7,3,4,"Adelphia, NJ"
58,Turf Quality,8/11/21,4,58,DLFPS-340/3444,DLF Pickseed USA,JEN,4,3,58,2021,Aug,JEN-2021-08-11,3,2,4,"Adelphia, NJ"
58,Turf Quality,9/17/21,4,58,DLFPS-340/3444,DLF Pickseed USA,JEN,4,3,58,2021,Sep,JEN-2021-09-17,4,9,4,"Adelphia, NJ"
58,Turf Quality,10/13/21,4,58,DLFPS-340/3444,DLF Pickseed USA,SAB,4,3,58,2021,Oct,SAB-2021-10-13,30,8,4,"Adelphia, NJ"
58,Turf Quality,11/18/21,6,58,DLFPS-340/3444,DLF Pickseed USA,WAM,4,3,58,2021,Nov,WAM-2021-11-18,36,7,4,"Adelphia, NJ"
33,Turf Quality,4/18/18,3,33,United (NAI-13-14),Columbia River Seed,RMD,3,3,33,2018,Apr,RMD-2018-04-18,8,1,1,"Adelphia, NJ"
33,Turf Quality,5/10/18,4,33,United (NAI-13-14),Columbia River Seed,RON,3,3,33,2018,May,RON-2018-05-10,13,6,1,"Adelphia, NJ"
33,Turf Quality,6/7/18,5,33,United (NAI-13-14),Columbia River Seed,RON,3,3,33,2018,Jun,RON-2018-06-07,14,4,1,"Adelphia, NJ"
33,Turf Quality,7/17/18,6,33,United (NAI-13-14),Columbia River Seed,RON,3,3,33,2018,Jul,RON-2018-07-17,15,3,1,"Adelphia, NJ"
33,Turf Quality,8/15/18,7,33,United (NAI-13-14),Columbia River Seed,RMD,3,3,33,2018,Aug,RMD-2018-08-15,9,2,1,"Adelphia, NJ"
33,Turf Quality,9/12/18,6,33,United (NAI-13-14),Columbia River Seed,RON,3,3,33,2018,Sep,RON-2018-09-12,16,9,1,"Adelphia, NJ"
33,Turf Quality,10/2/18,7,33,United (NAI-13-14),Columbia River Seed,RON,3,3,33,2018,Oct,RON-2018-10-02,17,8,1,"Adelphia, NJ"
33,Turf Quality,11/9/18,6,33,United (NAI-13-14),Columbia River Seed,RON,3,3,33,2018,Nov,RON-2018-11-09,18,7,1,"Adelphia, NJ"
33,Turf Quality,4/17/19,3,33,United (NAI-13-14),Columbia River Seed,RON,3,3,33,2019,Apr,RON-2019-04-17,19,1,2,"Adelphia, NJ"
33,Turf Quality,5/2/19,5,33,United (NAI-13-14),Columbia River Seed,RON,3,3,33,2019,May,RON-2019-05-02,20,6,2,"Adelphia, NJ"
33,Turf Quality,6/13/19,6,33,United (NAI-13-14),Columbia River Seed,RON,3,3,33,2019,Jun,RON-2019-06-13,21,4,2,"Adelphia, NJ"
33,Turf Quality,6/17/19,5,33,United (NAI-13-14),Columbia River Seed,SAB,3,3,33,2019,Jun,SAB-2019-06-17,25,4,2,"Adelphia, NJ"
33,Turf Quality,7/17/19,5,33,United (NAI-13-14),Columbia River Seed,RON,3,3,33,2019,Jul,RON-2019-07-17,22,3,2,"Adelphia, NJ"
33,Turf Quality,8/22/19,7,33,United (NAI-13-14),Columbia River Seed,SAB,3,3,33,2019,Aug,SAB-2019-08-22,26,2,2,"Adelphia, NJ"
33,Turf Quality,9/16/19,6,33,United (NAI-13-14),Columbia River Seed,RON,3,3,33,2019,Sep,RON-2019-09-16,23,9,2,"Adelphia, NJ"
33,Turf Quality,10/10/19,5,33,United (NAI-13-14),Columbia River Seed,SAB,3,3,33,2019,Oct,SAB-2019-10-10,27,8,2,"Adelphia, NJ"
33,Turf Quality,11/1/19,7,33,United (NAI-13-14),Columbia River Seed,RON,3,3,33,2019,Nov,RON-2019-11-01,24,7,2,"Adelphia, NJ"
33,Turf Quality,4/28/20,3,33,United (NAI-13-14),Columbia River Seed,WAM,3,3,33,2020,Apr,WAM-2020-04-28,31,1,3,"Adelphia, NJ"
33,Turf Quality,5/18/20,1,33,United (NAI-13-14),Columbia River Seed,SAB,3,3,33,2020,May,SAB-2020-05-18,28,6,3,"Adelphia, NJ"
33,Turf Quality,6/17/20,4,33,United (NAI-13-14),Columbia River Seed,WAM,3,3,33,2020,Jun,WAM-2020-06-17,32,4,3,"Adelphia, NJ"
33,Turf Quality,7/15/20,5,33,United (NAI-13-14),Columbia River Seed,WAM,3,3,33,2020,Jul,WAM-2020-07-15,33,3,3,"Adelphia, NJ"
33,Turf Quality,8/6/20,7,33,United (NAI-13-14),Columbia River Seed,PLV,3,3,33,2020,Aug,PLV-2020-08-06,5,2,3,"Adelphia, NJ"
33,Turf Quality,9/2/20,6,33,United (NAI-13-14),Columbia River Seed,DAS,3,3,33,2020,Sep,DAS-2020-09-02,1,9,3,"Adelphia, NJ"
33,Turf Quality,10/15/20,4,33,United (NAI-13-14),Columbia River Seed,WAM,3,3,33,2020,Oct,WAM-2020-10-15,34,8,3,"Adelphia, NJ"
33,Turf Quality,11/5/20,5,33,United (NAI-13-14),Columbia River Seed,WAM,3,3,33,2020,Nov,WAM-2020-11-05,35,7,3,"Adelphia, NJ"
33,Turf Quality,10/15/20,5,33,United (NAI-13-14),Columbia River Seed,RMD,3,3,33,2020,Oct,RMD-2020-10-15,10,8,3,"Adelphia, NJ"
33,Turf Quality,10/23/20,5,33,United (NAI-13-14),Columbia River Seed,RMD,3,3,33,2020,Oct,RMD-2020-10-23,11,8,3,"Adelphia, NJ"
33,Turf Quality,3/30/21,3,33,United (NAI-13-14),Columbia River Seed,RMD,3,3,33,2021,Mar,RMD-2021-03-30,12,5,4,"Adelphia, NJ"
33,Turf Quality,4/22/21,5,33,United (NAI-13-14),Columbia River Seed,PLV,3,3,33,2021,Apr,PLV-2021-04-22,6,1,4,"Adelphia, NJ"
33,Turf Quality,5/28/21,4,33,United (NAI-13-14),Columbia River Seed,SAB,3,3,33,2021,May,SAB-2021-05-28,29,6,4,"Adelphia, NJ"
33,Turf Quality,6/11/21,5,33,United (NAI-13-14),Columbia River Seed,JEN,3,3,33,2021,Jun,JEN-2021-06-11,2,4,4,"Adelphia, NJ"
33,Turf Quality,7/13/21,7,33,United (NAI-13-14),Columbia River Seed,PLV,3,3,33,2021,Jul,PLV-2021-07-13,7,3,4,"Adelphia, NJ"
33,Turf Quality,8/11/21,6,33,United (NAI-13-14),Columbia River Seed,JEN,3,3,33,2021,Aug,JEN-2021-08-11,3,2,4,"Adelphia, NJ"
33,Turf Quality,9/17/21,5,33,United (NAI-13-14),Columbia River Seed,JEN,3,3,33,2021,Sep,JEN-2021-09-17,4,9,4,"Adelphia, NJ"
33,Turf Quality,10/13/21,7,33,United (NAI-13-14),Columbia River Seed,SAB,3,3,33,2021,Oct,SAB-2021-10-13,30,8,4,"Adelphia, NJ"
33,Turf Quality,11/18/21,6,33,United (NAI-13-14),Columbia River Seed,WAM,3,3,33,2021,Nov,WAM-2021-11-18,36,7,4,"Adelphia, NJ"
28,Turf Quality,4/18/18,4,28,RAD-1776,Barenbrug Research,RMD,2,3,28,2018,Apr,RMD-2018-04-18,8,1,1,"Adelphia, NJ"
28,Turf Quality,5/10/18,3,28,RAD-1776,Barenbrug Research,RON,2,3,28,2018,May,RON-2018-05-10,13,6,1,"Adelphia, NJ"
28,Turf Quality,6/7/18,3,28,RAD-1776,Barenbrug Research,RON,2,3,28,2018,Jun,RON-2018-06-07,14,4,1,"Adelphia, NJ"
28,Turf Quality,7/17/18,6,28,RAD-1776,Barenbrug Research,RON,2,3,28,2018,Jul,RON-2018-07-17,15,3,1,"Adelphia, NJ"
28,Turf Quality,8/15/18,4,28,RAD-1776,Barenbrug Research,RMD,2,3,28,2018,Aug,RMD-2018-08-15,9,2,1,"Adelphia, NJ"
28,Turf Quality,9/12/18,4,28,RAD-1776,Barenbrug Research,RON,2,3,28,2018,Sep,RON-2018-09-12,16,9,1,"Adelphia, NJ"
28,Turf Quality,10/2/18,3,28,RAD-1776,Barenbrug Research,RON,2,3,28,2018,Oct,RON-2018-10-02,17,8,1,"Adelphia, NJ"
28,Turf Quality,11/9/18,3,28,RAD-1776,Barenbrug Research,RON,2,3,28,2018,Nov,RON-2018-11-09,18,7,1,"Adelphia, NJ"
28,Turf Quality,4/17/19,3,28,RAD-1776,Barenbrug Research,RON,2,3,28,2019,Apr,RON-2019-04-17,19,1,2,"Adelphia, NJ"
28,Turf Quality,5/2/19,3,28,RAD-1776,Barenbrug Research,RON,2,3,28,2019,May,RON-2019-05-02,20,6,2,"Adelphia, NJ"
28,Turf Quality,6/13/19,4,28,RAD-1776,Barenbrug Research,RON,2,3,28,2019,Jun,RON-2019-06-13,21,4,2,"Adelphia, NJ"
28,Turf Quality,6/17/19,4,28,RAD-1776,Barenbrug Research,SAB,2,3,28,2019,Jun,SAB-2019-06-17,25,4,2,"Adelphia, NJ"
28,Turf Quality,7/17/19,5,28,RAD-1776,Barenbrug Research,RON,2,3,28,2019,Jul,RON-2019-07-17,22,3,2,"Adelphia, NJ"
28,Turf Quality,8/22/19,4,28,RAD-1776,Barenbrug Research,SAB,2,3,28,2019,Aug,SAB-2019-08-22,26,2,2,"Adelphia, NJ"
28,Turf Quality,9/16/19,3,28,RAD-1776,Barenbrug Research,RON,2,3,28,2019,Sep,RON-2019-09-16,23,9,2,"Adelphia, NJ"
28,Turf Quality,10/10/19,3,28,RAD-1776,Barenbrug Research,SAB,2,3,28,2019,Oct,SAB-2019-10-10,27,8,2,"Adelphia, NJ"
28,Turf Quality,11/1/19,3,28,RAD-1776,Barenbrug Research,RON,2,3,28,2019,Nov,RON-2019-11-01,24,7,2,"Adelphia, NJ"
28,Turf Quality,4/28/20,4,28,RAD-1776,Barenbrug Research,WAM,2,3,28,2020,Apr,WAM-2020-04-28,31,1,3,"Adelphia, NJ"
28,Turf Quality,5/18/20,2,28,RAD-1776,Barenbrug Research,SAB,2,3,28,2020,May,SAB-2020-05-18,28,6,3,"Adelphia, NJ"
28,Turf Quality,6/17/20,3,28,RAD-1776,Barenbrug Research,WAM,2,3,28,2020,Jun,WAM-2020-06-17,32,4,3,"Adelphia, NJ"
28,Turf Quality,7/15/20,7,28,RAD-1776,Barenbrug Research,WAM,2,3,28,2020,Jul,WAM-2020-07-15,33,3,3,"Adelphia, NJ"
28,Turf Quality,8/6/20,4,28,RAD-1776,Barenbrug Research,PLV,2,3,28,2020,Aug,PLV-2020-08-06,5,2,3,"Adelphia, NJ"
28,Turf Quality,9/2/20,3,28,RAD-1776,Barenbrug Research,DAS,2,3,28,2020,Sep,DAS-2020-09-02,1,9,3,"Adelphia, NJ"
28,Turf Quality,10/15/20,3,28,RAD-1776,Barenbrug Research,WAM,2,3,28,2020,Oct,WAM-2020-10-15,34,8,3,"Adelphia, NJ"
28,Turf Quality,11/5/20,4,28,RAD-1776,Barenbrug Research,WAM,2,3,28,2020,Nov,WAM-2020-11-05,35,7,3,"Adelphia, NJ"
28,Turf Quality,10/15/20,3,28,RAD-1776,Barenbrug Research,RMD,2,3,28,2020,Oct,RMD-2020-10-15,10,8,3,"Adelphia, NJ"
28,Turf Quality,10/23/20,3,28,RAD-1776,Barenbrug Research,RMD,2,3,28,2020,Oct,RMD-2020-10-23,11,8,3,"Adelphia, NJ"
28,Turf Quality,3/30/21,3,28,RAD-1776,Barenbrug Research,RMD,2,3,28,2021,Mar,RMD-2021-03-30,12,5,4,"Adelphia, NJ"
28,Turf Quality,4/22/21,6,28,RAD-1776,Barenbrug Research,PLV,2,3,28,2021,Apr,PLV-2021-04-22,6,1,4,"Adelphia, NJ"
28,Turf Quality,5/28/21,4,28,RAD-1776,Barenbrug Research,SAB,2,3,28,2021,May,SAB-2021-05-28,29,6,4,"Adelphia, NJ"
28,Turf Quality,6/11/21,5,28,RAD-1776,Barenbrug Research,JEN,2,3,28,2021,Jun,JEN-2021-06-11,2,4,4,"Adelphia, NJ"
28,Turf Quality,7/13/21,6,28,RAD-1776,Barenbrug Research,PLV,2,3,28,2021,Jul,PLV-2021-07-13,7,3,4,"Adelphia, NJ"
28,Turf Quality,8/11/21,5,28,RAD-1776,Barenbrug Research,JEN,2,3,28,2021,Aug,JEN-2021-08-11,3,2,4,"Adelphia, NJ"
28,Turf Quality,9/17/21,4,28,RAD-1776,Barenbrug Research,JEN,2,3,28,2021,Sep,JEN-2021-09-17,4,9,4,"Adelphia, NJ"
28,Turf Quality,10/13/21,5,28,RAD-1776,Barenbrug Research,SAB,2,3,28,2021,Oct,SAB-2021-10-13,30,8,4,"Adelphia, NJ"
28,Turf Quality,11/18/21,5,28,RAD-1776,Barenbrug Research,WAM,2,3,28,2021,Nov,WAM-2021-11-18,36,7,4,"Adelphia, NJ"
3,Turf Quality,4/18/18,3,3,A99-2897,Turf Merchants Inc.,RMD,1,3,3,2018,Apr,RMD-2018-04-18,8,1,1,"Adelphia, NJ"
3,Turf Quality,5/10/18,6,3,A99-2897,Turf Merchants Inc.,RON,1,3,3,2018,May,RON-2018-05-10,13,6,1,"Adelphia, NJ"
3,Turf Quality,6/7/18,8,3,A99-2897,Turf Merchants Inc.,RON,1,3,3,2018,Jun,RON-2018-06-07,14,4,1,"Adelphia, NJ"
3,Turf Quality,7/17/18,8,3,A99-2897,Turf Merchants Inc.,RON,1,3,3,2018,Jul,RON-2018-07-17,15,3,1,"Adelphia, NJ"
3,Turf Quality,8/15/18,7,3,A99-2897,Turf Merchants Inc.,RMD,1,3,3,2018,Aug,RMD-2018-08-15,9,2,1,"Adelphia, NJ"
3,Turf Quality,9/12/18,7,3,A99-2897,Turf Merchants Inc.,RON,1,3,3,2018,Sep,RON-2018-09-12,16,9,1,"Adelphia, NJ"
3,Turf Quality,10/2/18,7,3,A99-2897,Turf Merchants Inc.,RON,1,3,3,2018,Oct,RON-2018-10-02,17,8,1,"Adelphia, NJ"
3,Turf Quality,11/9/18,7,3,A99-2897,Turf Merchants Inc.,RON,1,3,3,2018,Nov,RON-2018-11-09,18,7,1,"Adelphia, NJ"
3,Turf Quality,4/17/19,5,3,A99-2897,Turf Merchants Inc.,RON,1,3,3,2019,Apr,RON-2019-04-17,19,1,2,"Adelphia, NJ"
3,Turf Quality,5/2/19,7,3,A99-2897,Turf Merchants Inc.,RON,1,3,3,2019,May,RON-2019-05-02,20,6,2,"Adelphia, NJ"
3,Turf Quality,6/13/19,6,3,A99-2897,Turf Merchants Inc.,RON,1,3,3,2019,Jun,RON-2019-06-13,21,4,2,"Adelphia, NJ"
3,Turf Quality,6/17/19,7,3,A99-2897,Turf Merchants Inc.,SAB,1,3,3,2019,Jun,SAB-2019-06-17,25,4,2,"Adelphia, NJ"
3,Turf Quality,7/17/19,6,3,A99-2897,Turf Merchants Inc.,RON,1,3,3,2019,Jul,RON-2019-07-17,22,3,2,"Adelphia, NJ"
3,Turf Quality,8/22/19,8,3,A99-2897,Turf Merchants Inc.,SAB,1,3,3,2019,Aug,SAB-2019-08-22,26,2,2,"Adelphia, NJ"
3,Turf Quality,9/16/19,7,3,A99-2897,Turf Merchants Inc.,RON,1,3,3,2019,Sep,RON-2019-09-16,23,9,2,"Adelphia, NJ"
3,Turf Quality,10/10/19,6,3,A99-2897,Turf Merchants Inc.,SAB,1,3,3,2019,Oct,SAB-2019-10-10,27,8,2,"Adelphia, NJ"
3,Turf Quality,11/1/19,6,3,A99-2897,Turf Merchants Inc.,RON,1,3,3,2019,Nov,RON-2019-11-01,24,7,2,"Adelphia, NJ"
3,Turf Quality,4/28/20,5,3,A99-2897,Turf Merchants Inc.,WAM,1,3,3,2020,Apr,WAM-2020-04-28,31,1,3,"Adelphia, NJ"
3,Turf Quality,5/18/20,5,3,A99-2897,Turf Merchants Inc.,SAB,1,3,3,2020,May,SAB-2020-05-18,28,6,3,"Adelphia, NJ"
3,Turf Quality,6/17/20,6,3,A99-2897,Turf Merchants Inc.,WAM,1,3,3,2020,Jun,WAM-2020-06-17,32,4,3,"Adelphia, NJ"
3,Turf Quality,7/15/20,6,3,A99-2897,Turf Merchants Inc.,WAM,1,3,3,2020,Jul,WAM-2020-07-15,33,3,3,"Adelphia, NJ"
3,Turf Quality,8/6/20,7,3,A99-2897,Turf Merchants Inc.,PLV,1,3,3,2020,Aug,PLV-2020-08-06,5,2,3,"Adelphia, NJ"
3,Turf Quality,9/2/20,7,3,A99-2897,Turf Merchants Inc.,DAS,1,3,3,2020,Sep,DAS-2020-09-02,1,9,3,"Adelphia, NJ"
3,Turf Quality,10/15/20,5,3,A99-2897,Turf Merchants Inc.,WAM,1,3,3,2020,Oct,WAM-2020-10-15,34,8,3,"Adelphia, NJ"
3,Turf Quality,11/5/20,7,3,A99-2897,Turf Merchants Inc.,WAM,1,3,3,2020,Nov,WAM-2020-11-05,35,7,3,"Adelphia, NJ"
3,Turf Quality,10/15/20,5,3,A99-2897,Turf Merchants Inc.,RMD,1,3,3,2020,Oct,RMD-2020-10-15,10,8,3,"Adelphia, NJ"
3,Turf Quality,10/23/20,6,3,A99-2897,Turf Merchants Inc.,RMD,1,3,3,2020,Oct,RMD-2020-10-23,11,8,3,"Adelphia, NJ"
3,Turf Quality,3/30/21,5,3,A99-2897,Turf Merchants Inc.,RMD,1,3,3,2021,Mar,RMD-2021-03-30,12,5,4,"Adelphia, NJ"
3,Turf Quality,4/22/21,7,3,A99-2897,Turf Merchants Inc.,PLV,1,3,3,2021,Apr,PLV-2021-04-22,6,1,4,"Adelphia, NJ"
3,Turf Quality,5/28/21,8,3,A99-2897,Turf Merchants Inc.,SAB,1,3,3,2021,May,SAB-2021-05-28,29,6,4,"Adelphia, NJ"
3,Turf Quality,6/11/21,9,3,A99-2897,Turf Merchants Inc.,JEN,1,3,3,2021,Jun,JEN-2021-06-11,2,4,4,"Adelphia, NJ"
3,Turf Quality,7/13/21,7,3,A99-2897,Turf Merchants Inc.,PLV,1,3,3,2021,Jul,PLV-2021-07-13,7,3,4,"Adelphia, NJ"
3,Turf Quality,8/11/21,7,3,A99-2897,Turf Merchants Inc.,JEN,1,3,3,2021,Aug,JEN-2021-08-11,3,2,4,"Adelphia, NJ"
3,Turf Quality,9/17/21,8,3,A99-2897,Turf Merchants Inc.,JEN,1,3,3,2021,Sep,JEN-2021-09-17,4,9,4,"Adelphia, NJ"
3,Turf Quality,10/13/21,7,3,A99-2897,Turf Merchants Inc.,SAB,1,3,3,2021,Oct,SAB-2021-10-13,30,8,4,"Adelphia, NJ"
3,Turf Quality,11/18/21,7,3,A99-2897,Turf Merchants Inc.,WAM,1,3,3,2021,Nov,WAM-2021-11-18,36,7,4,"Adelphia, NJ"
267,Turf Quality,4/18/18,4,73,A16-2,The Scotts Company,RMD,18,4,265,2018,Apr,RMD-2018-04-18,8,1,1,"Adelphia, NJ"
267,Turf Quality,5/10/18,5,73,A16-2,The Scotts Company,RON,18,4,265,2018,May,RON-2018-05-10,13,6,1,"Adelphia, NJ"
267,Turf Quality,6/7/18,5,73,A16-2,The Scotts Company,RON,18,4,265,2018,Jun,RON-2018-06-07,14,4,1,"Adelphia, NJ"
267,Turf Quality,7/17/18,6,73,A16-2,The Scotts Company,RON,18,4,265,2018,Jul,RON-2018-07-17,15,3,1,"Adelphia, NJ"
267,Turf Quality,8/15/18,6,73,A16-2,The Scotts Company,RMD,18,4,265,2018,Aug,RMD-2018-08-15,9,2,1,"Adelphia, NJ"
267,Turf Quality,9/12/18,6,73,A16-2,The Scotts Company,RON,18,4,265,2018,Sep,RON-2018-09-12,16,9,1,"Adelphia, NJ"
267,Turf Quality,10/2/18,7,73,A16-2,The Scotts Company,RON,18,4,265,2018,Oct,RON-2018-10-02,17,8,1,"Adelphia, NJ"
267,Turf Quality,11/9/18,6,73,A16-2,The Scotts Company,RON,18,4,265,2018,Nov,RON-2018-11-09,18,7,1,"Adelphia, NJ"
267,Turf Quality,4/17/19,7,73,A16-2,The Scotts Company,RON,18,4,265,2019,Apr,RON-2019-04-17,19,1,2,"Adelphia, NJ"
267,Turf Quality,5/2/19,7,73,A16-2,The Scotts Company,RON,18,4,265,2019,May,RON-2019-05-02,20,6,2,"Adelphia, NJ"
267,Turf Quality,6/13/19,6,73,A16-2,The Scotts Company,RON,18,4,265,2019,Jun,RON-2019-06-13,21,4,2,"Adelphia, NJ"
267,Turf Quality,6/17/19,5,73,A16-2,The Scotts Company,SAB,18,4,265,2019,Jun,SAB-2019-06-17,25,4,2,"Adelphia, NJ"
267,Turf Quality,7/17/19,5,73,A16-2,The Scotts Company,RON,18,4,265,2019,Jul,RON-2019-07-17,22,3,2,"Adelphia, NJ"
267,Turf Quality,8/22/19,4,73,A16-2,The Scotts Company,SAB,18,4,265,2019,Aug,SAB-2019-08-22,26,2,2,"Adelphia, NJ"
267,Turf Quality,9/16/19,4,73,A16-2,The Scotts Company,RON,18,4,265,2019,Sep,RON-2019-09-16,23,9,2,"Adelphia, NJ"
267,Turf Quality,10/10/19,3,73,A16-2,The Scotts Company,SAB,18,4,265,2019,Oct,SAB-2019-10-10,27,8,2,"Adelphia, NJ"
267,Turf Quality,11/1/19,3,73,A16-2,The Scotts Company,RON,18,4,265,2019,Nov,RON-2019-11-01,24,7,2,"Adelphia, NJ"
267,Turf Quality,4/28/20,5,73,A16-2,The Scotts Company,WAM,18,4,265,2020,Apr,WAM-2020-04-28,31,1,3,"Adelphia, NJ"
267,Turf Quality,5/18/20,5,73,A16-2,The Scotts Company,SAB,18,4,265,2020,May,SAB-2020-05-18,28,6,3,"Adelphia, NJ"
267,Turf Quality,6/17/20,5,73,A16-2,The Scotts Company,WAM,18,4,265,2020,Jun,WAM-2020-06-17,32,4,3,"Adelphia, NJ"
267,Turf Quality,7/15/20,4,73,A16-2,The Scotts Company,WAM,18,4,265,2020,Jul,WAM-2020-07-15,33,3,3,"Adelphia, NJ"
267,Turf Quality,8/6/20,5,73,A16-2,The Scotts Company,PLV,18,4,265,2020,Aug,PLV-2020-08-06,5,2,3,"Adelphia, NJ"
267,Turf Quality,9/2/20,4,73,A16-2,The Scotts Company,DAS,18,4,265,2020,Sep,DAS-2020-09-02,1,9,3,"Adelphia, NJ"
267,Turf Quality,10/15/20,3,73,A16-2,The Scotts Company,WAM,18,4,265,2020,Oct,WAM-2020-10-15,34,8,3,"Adelphia, NJ"
267,Turf Quality,11/5/20,3,73,A16-2,The Scotts Company,WAM,18,4,265,2020,Nov,WAM-2020-11-05,35,7,3,"Adelphia, NJ"
267,Turf Quality,10/15/20,3,73,A16-2,The Scotts Company,RMD,18,4,265,2020,Oct,RMD-2020-10-15,10,8,3,"Adelphia, NJ"
267,Turf Quality,10/23/20,3,73,A16-2,The Scotts Company,RMD,18,4,265,2020,Oct,RMD-2020-10-23,11,8,3,"Adelphia, NJ"
267,Turf Quality,3/30/21,3,73,A16-2,The Scotts Company,RMD,18,4,265,2021,Mar,RMD-2021-03-30,12,5,4,"Adelphia, NJ"
267,Turf Quality,4/22/21,7,73,A16-2,The Scotts Company,PLV,18,4,265,2021,Apr,PLV-2021-04-22,6,1,4,"Adelphia, NJ"
267,Turf Quality,5/28/21,4,73,A16-2,The Scotts Company,SAB,18,4,265,2021,May,SAB-2021-05-28,29,6,4,"Adelphia, NJ"
267,Turf Quality,6/11/21,5,73,A16-2,The Scotts Company,JEN,18,4,265,2021,Jun,JEN-2021-06-11,2,4,4,"Adelphia, NJ"
267,Turf Quality,7/13/21,4,73,A16-2,The Scotts Company,PLV,18,4,265,2021,Jul,PLV-2021-07-13,7,3,4,"Adelphia, NJ"
267,Turf Quality,8/11/21,4,73,A16-2,The Scotts Company,JEN,18,4,265,2021,Aug,JEN-2021-08-11,3,2,4,"Adelphia, NJ"
267,Turf Quality,9/17/21,4,73,A16-2,The Scotts Company,JEN,18,4,265,2021,Sep,JEN-2021-09-17,4,9,4,"Adelphia, NJ"
267,Turf Quality,10/13/21,3,73,A16-2,The Scotts Company,SAB,18,4,265,2021,Oct,SAB-2021-10-13,30,8,4,"Adelphia, NJ"
267,Turf Quality,11/18/21,4,73,A16-2,The Scotts Company,WAM,18,4,265,2021,Nov,WAM-2021-11-18,36,7,4,"Adelphia, NJ"
244,Turf Quality,4/18/18,4,10,AKB3179,Pennington Seed,RMD,17,4,242,2018,Apr,RMD-2018-04-18,8,1,1,"Adelphia, NJ"
244,Turf Quality,5/10/18,6,10,AKB3179,Pennington Seed,RON,17,4,242,2018,May,RON-2018-05-10,13,6,1,"Adelphia, NJ"
244,Turf Quality,6/7/18,6,10,AKB3179,Pennington Seed,RON,17,4,242,2018,Jun,RON-2018-06-07,14,4,1,"Adelphia, NJ"
244,Turf Quality,7/17/18,5,10,AKB3179,Pennington Seed,RON,17,4,242,2018,Jul,RON-2018-07-17,15,3,1,"Adelphia, NJ"
244,Turf Quality,8/15/18,8,10,AKB3179,Pennington Seed,RMD,17,4,242,2018,Aug,RMD-2018-08-15,9,2,1,"Adelphia, NJ"
244,Turf Quality,9/12/18,6,10,AKB3179,Pennington Seed,RON,17,4,242,2018,Sep,RON-2018-09-12,16,9,1,"Adelphia, NJ"
244,Turf Quality,10/2/18,5,10,AKB3179,Pennington Seed,RON,17,4,242,2018,Oct,RON-2018-10-02,17,8,1,"Adelphia, NJ"
244,Turf Quality,11/9/18,5,10,AKB3179,Pennington Seed,RON,17,4,242,2018,Nov,RON-2018-11-09,18,7,1,"Adelphia, NJ"
244,Turf Quality,4/17/19,4,10,AKB3179,Pennington Seed,RON,17,4,242,2019,Apr,RON-2019-04-17,19,1,2,"Adelphia, NJ"
244,Turf Quality,5/2/19,4,10,AKB3179,Pennington Seed,RON,17,4,242,2019,May,RON-2019-05-02,20,6,2,"Adelphia, NJ"
244,Turf Quality,6/13/19,7,10,AKB3179,Pennington Seed,RON,17,4,242,2019,Jun,RON-2019-06-13,21,4,2,"Adelphia, NJ"
244,Turf Quality,6/17/19,5,10,AKB3179,Pennington Seed,SAB,17,4,242,2019,Jun,SAB-2019-06-17,25,4,2,"Adelphia, NJ"
244,Turf Quality,7/17/19,5,10,AKB3179,Pennington Seed,RON,17,4,242,2019,Jul,RON-2019-07-17,22,3,2,"Adelphia, NJ"
244,Turf Quality,8/22/19,4,10,AKB3179,Pennington Seed,SAB,17,4,242,2019,Aug,SAB-2019-08-22,26,2,2,"Adelphia, NJ"
244,Turf Quality,9/16/19,4,10,AKB3179,Pennington Seed,RON,17,4,242,2019,Sep,RON-2019-09-16,23,9,2,"Adelphia, NJ"
244,Turf Quality,10/10/19,3,10,AKB3179,Pennington Seed,SAB,17,4,242,2019,Oct,SAB-2019-10-10,27,8,2,"Adelphia, NJ"
244,Turf Quality,11/1/19,3,10,AKB3179,Pennington Seed,RON,17,4,242,2019,Nov,RON-2019-11-01,24,7,2,"Adelphia, NJ"
244,Turf Quality,4/28/20,4,10,AKB3179,Pennington Seed,WAM,17,4,242,2020,Apr,WAM-2020-04-28,31,1,3,"Adelphia, NJ"
244,Turf Quality,5/18/20,4,10,AKB3179,Pennington Seed,SAB,17,4,242,2020,May,SAB-2020-05-18,28,6,3,"Adelphia, NJ"
244,Turf Quality,6/17/20,4,10,AKB3179,Pennington Seed,WAM,17,4,242,2020,Jun,WAM-2020-06-17,32,4,3,"Adelphia, NJ"
244,Turf Quality,7/15/20,5,10,AKB3179,Pennington Seed,WAM,17,4,242,2020,Jul,WAM-2020-07-15,33,3,3,"Adelphia, NJ"
244,Turf Quality,8/6/20,6,10,AKB3179,Pennington Seed,PLV,17,4,242,2020,Aug,PLV-2020-08-06,5,2,3,"Adelphia, NJ"
244,Turf Quality,9/2/20,3,10,AKB3179,Pennington Seed,DAS,17,4,242,2020,Sep,DAS-2020-09-02,1,9,3,"Adelphia, NJ"
244,Turf Quality,10/15/20,4,10,AKB3179,Pennington Seed,WAM,17,4,242,2020,Oct,WAM-2020-10-15,34,8,3,"Adelphia, NJ"
244,Turf Quality,11/5/20,4,10,AKB3179,Pennington Seed,WAM,17,4,242,2020,Nov,WAM-2020-11-05,35,7,3,"Adelphia, NJ"
244,Turf Quality,10/15/20,4,10,AKB3179,Pennington Seed,RMD,17,4,242,2020,Oct,RMD-2020-10-15,10,8,3,"Adelphia, NJ"
244,Turf Quality,10/23/20,4,10,AKB3179,Pennington Seed,RMD,17,4,242,2020,Oct,RMD-2020-10-23,11,8,3,"Adelphia, NJ"
244,Turf Quality,3/30/21,4,10,AKB3179,Pennington Seed,RMD,17,4,242,2021,Mar,RMD-2021-03-30,12,5,4,"Adelphia, NJ"
244,Turf Quality,4/22/21,6,10,AKB3179,Pennington Seed,PLV,17,4,242,2021,Apr,PLV-2021-04-22,6,1,4,"Adelphia, NJ"
244,Turf Quality,5/28/21,4,10,AKB3179,Pennington Seed,SAB,17,4,242,2021,May,SAB-2021-05-28,29,6,4,"Adelphia, NJ"
244,Turf Quality,6/11/21,5,10,AKB3179,Pennington Seed,JEN,17,4,242,2021,Jun,JEN-2021-06-11,2,4,4,"Adelphia, NJ"
244,Turf Quality,7/13/21,6,10,AKB3179,Pennington Seed,PLV,17,4,242,2021,Jul,PLV-2021-07-13,7,3,4,"Adelphia, NJ"
244,Turf Quality,8/11/21,6,10,AKB3179,Pennington Seed,JEN,17,4,242,2021,Aug,JEN-2021-08-11,3,2,4,"Adelphia, NJ"
244,Turf Quality,9/17/21,5,10,AKB3179,Pennington Seed,JEN,17,4,242,2021,Sep,JEN-2021-09-17,4,9,4,"Adelphia, NJ"
244,Turf Quality,10/13/21,4,10,AKB3179,Pennington Seed,SAB,17,4,242,2021,Oct,SAB-2021-10-13,30,8,4,"Adelphia, NJ"
244,Turf Quality,11/18/21,5,10,AKB3179,Pennington Seed,WAM,17,4,242,2021,Nov,WAM-2021-11-18,36,7,4,"Adelphia, NJ"
237,Turf Quality,4/18/18,2,5,Blue Knight,Ledeboer Plant Breeding,RMD,16,4,235,2018,Apr,RMD-2018-04-18,8,1,1,"Adelphia, NJ"
237,Turf Quality,5/10/18,3,5,Blue Knight,Ledeboer Plant Breeding,RON,16,4,235,2018,May,RON-2018-05-10,13,6,1,"Adelphia, NJ"
237,Turf Quality,6/7/18,4,5,Blue Knight,Ledeboer Plant Breeding,RON,16,4,235,2018,Jun,RON-2018-06-07,14,4,1,"Adelphia, NJ"
237,Turf Quality,7/17/18,3,5,Blue Knight,Ledeboer Plant Breeding,RON,16,4,235,2018,Jul,RON-2018-07-17,15,3,1,"Adelphia, NJ"
237,Turf Quality,8/15/18,2,5,Blue Knight,Ledeboer Plant Breeding,RMD,16,4,235,2018,Aug,RMD-2018-08-15,9,2,1,"Adelphia, NJ"
237,Turf Quality,9/12/18,1,5,Blue Knight,Ledeboer Plant Breeding,RON,16,4,235,2018,Sep,RON-2018-09-12,16,9,1,"Adelphia, NJ"
237,Turf Quality,10/2/18,1,5,Blue Knight,Ledeboer Plant Breeding,RON,16,4,235,2018,Oct,RON-2018-10-02,17,8,1,"Adelphia, NJ"
237,Turf Quality,11/9/18,1,5,Blue Knight,Ledeboer Plant Breeding,RON,16,4,235,2018,Nov,RON-2018-11-09,18,7,1,"Adelphia, NJ"
237,Turf Quality,4/17/19,1,5,Blue Knight,Ledeboer Plant Breeding,RON,16,4,235,2019,Apr,RON-2019-04-17,19,1,2,"Adelphia, NJ"
237,Turf Quality,5/2/19,1,5,Blue Knight,Ledeboer Plant Breeding,RON,16,4,235,2019,May,RON-2019-05-02,20,6,2,"Adelphia, NJ"
237,Turf Quality,6/13/19,1,5,Blue Knight,Ledeboer Plant Breeding,RON,16,4,235,2019,Jun,RON-2019-06-13,21,4,2,"Adelphia, NJ"
237,Turf Quality,6/17/19,1,5,Blue Knight,Ledeboer Plant Breeding,SAB,16,4,235,2019,Jun,SAB-2019-06-17,25,4,2,"Adelphia, NJ"
237,Turf Quality,7/17/19,2,5,Blue Knight,Ledeboer Plant Breeding,RON,16,4,235,2019,Jul,RON-2019-07-17,22,3,2,"Adelphia, NJ"
237,Turf Quality,8/22/19,1,5,Blue Knight,Ledeboer Plant Breeding,SAB,16,4,235,2019,Aug,SAB-2019-08-22,26,2,2,"Adelphia, NJ"
237,Turf Quality,9/16/19,1,5,Blue Knight,Ledeboer Plant Breeding,RON,16,4,235,2019,Sep,RON-2019-09-16,23,9,2,"Adelphia, NJ"
237,Turf Quality,10/10/19,2,5,Blue Knight,Ledeboer Plant Breeding,SAB,16,4,235,2019,Oct,SAB-2019-10-10,27,8,2,"Adelphia, NJ"
237,Turf Quality,11/1/19,1,5,Blue Knight,Ledeboer Plant Breeding,RON,16,4,235,2019,Nov,RON-2019-11-01,24,7,2,"Adelphia, NJ"
237,Turf Quality,4/28/20,2,5,Blue Knight,Ledeboer Plant Breeding,WAM,16,4,235,2020,Apr,WAM-2020-04-28,31,1,3,"Adelphia, NJ"
237,Turf Quality,5/18/20,2,5,Blue Knight,Ledeboer Plant Breeding,SAB,16,4,235,2020,May,SAB-2020-05-18,28,6,3,"Adelphia, NJ"
237,Turf Quality,6/17/20,3,5,Blue Knight,Ledeboer Plant Breeding,WAM,16,4,235,2020,Jun,WAM-2020-06-17,32,4,3,"Adelphia, NJ"
237,Turf Quality,7/15/20,3,5,Blue Knight,Ledeboer Plant Breeding,WAM,16,4,235,2020,Jul,WAM-2020-07-15,33,3,3,"Adelphia, NJ"
237,Turf Quality,8/6/20,5,5,Blue Knight,Ledeboer Plant Breeding,PLV,16,4,235,2020,Aug,PLV-2020-08-06,5,2,3,"Adelphia, NJ"
237,Turf Quality,9/2/20,4,5,Blue Knight,Ledeboer Plant Breeding,DAS,16,4,235,2020,Sep,DAS-2020-09-02,1,9,3,"Adelphia, NJ"
237,Turf Quality,10/15/20,3,5,Blue Knight,Ledeboer Plant Breeding,WAM,16,4,235,2020,Oct,WAM-2020-10-15,34,8,3,"Adelphia, NJ"
237,Turf Quality,11/5/20,4,5,Blue Knight,Ledeboer Plant Breeding,WAM,16,4,235,2020,Nov,WAM-2020-11-05,35,7,3,"Adelphia, NJ"
237,Turf Quality,10/15/20,4,5,Blue Knight,Ledeboer Plant Breeding,RMD,16,4,235,2020,Oct,RMD-2020-10-15,10,8,3,"Adelphia, NJ"
237,Turf Quality,10/23/20,4,5,Blue Knight,Ledeboer Plant Breeding,RMD,16,4,235,2020,Oct,RMD-2020-10-23,11,8,3,"Adelphia, NJ"
237,Turf Quality,3/30/21,4,5,Blue Knight,Ledeboer Plant Breeding,RMD,16,4,235,2021,Mar,RMD-2021-03-30,12,5,4,"Adelphia, NJ"
237,Turf Quality,4/22/21,3,5,Blue Knight,Ledeboer Plant Breeding,PLV,16,4,235,2021,Apr,PLV-2021-04-22,6,1,4,"Adelphia, NJ"
237,Turf Quality,5/28/21,3,5,Blue Knight,Ledeboer Plant Breeding,SAB,16,4,235,2021,May,SAB-2021-05-28,29,6,4,"Adelphia, NJ"
237,Turf Quality,6/11/21,4,5,Blue Knight,Ledeboer Plant Breeding,JEN,16,4,235,2021,Jun,JEN-2021-06-11,2,4,4,"Adelphia, NJ"
237,Turf Quality,7/13/21,4,5,Blue Knight,Ledeboer Plant Breeding,PLV,16,4,235,2021,Jul,PLV-2021-07-13,7,3,4,"Adelphia, NJ"
237,Turf Quality,8/11/21,5,5,Blue Knight,Ledeboer Plant Breeding,JEN,16,4,235,2021,Aug,JEN-2021-08-11,3,2,4,"Adelphia, NJ"
237,Turf Quality,9/17/21,6,5,Blue Knight,Ledeboer Plant Breeding,JEN,16,4,235,2021,Sep,JEN-2021-09-17,4,9,4,"Adelphia, NJ"
237,Turf Quality,10/13/21,4,5,Blue Knight,Ledeboer Plant Breeding,SAB,16,4,235,2021,Oct,SAB-2021-10-13,30,8,4,"Adelphia, NJ"
237,Turf Quality,11/18/21,4,5,Blue Knight,Ledeboer Plant Breeding,WAM,16,4,235,2021,Nov,WAM-2021-11-18,36,7,4,"Adelphia, NJ"
214,Turf Quality,4/18/18,3,66,A12-34,Mountain View Seeds,RMD,15,4,212,2018,Apr,RMD-2018-04-18,8,1,1,"Adelphia, NJ"
214,Turf Quality,5/10/18,3,66,A12-34,Mountain View Seeds,RON,15,4,212,2018,May,RON-2018-05-10,13,6,1,"Adelphia, NJ"
214,Turf Quality,6/7/18,4,66,A12-34,Mountain View Seeds,RON,15,4,212,2018,Jun,RON-2018-06-07,14,4,1,"Adelphia, NJ"
214,Turf Quality,7/17/18,7,66,A12-34,Mountain View Seeds,RON,15,4,212,2018,Jul,RON-2018-07-17,15,3,1,"Adelphia, NJ"
214,Turf Quality,8/15/18,7,66,A12-34,Mountain View Seeds,RMD,15,4,212,2018,Aug,RMD-2018-08-15,9,2,1,"Adelphia, NJ"
214,Turf Quality,9/12/18,5,66,A12-34,Mountain View Seeds,RON,15,4,212,2018,Sep,RON-2018-09-12,16,9,1,"Adelphia, NJ"
214,Turf Quality,10/2/18,5,66,A12-34,Mountain View Seeds,RON,15,4,212,2018,Oct,RON-2018-10-02,17,8,1,"Adelphia, NJ"
214,Turf Quality,11/9/18,5,66,A12-34,Mountain View Seeds,RON,15,4,212,2018,Nov,RON-2018-11-09,18,7,1,"Adelphia, NJ"
214,Turf Quality,4/17/19,3,66,A12-34,Mountain View Seeds,RON,15,4,212,2019,Apr,RON-2019-04-17,19,1,2,"Adelphia, NJ"
214,Turf Quality,5/2/19,2,66,A12-34,Mountain View Seeds,RON,15,4,212,2019,May,RON-2019-05-02,20,6,2,"Adelphia, NJ"
214,Turf Quality,6/13/19,5,66,A12-34,Mountain View Seeds,RON,15,4,212,2019,Jun,RON-2019-06-13,21,4,2,"Adelphia, NJ"
214,Turf Quality,6/17/19,5,66,A12-34,Mountain View Seeds,SAB,15,4,212,2019,Jun,SAB-2019-06-17,25,4,2,"Adelphia, NJ"
214,Turf Quality,7/17/19,6,66,A12-34,Mountain View Seeds,RON,15,4,212,2019,Jul,RON-2019-07-17,22,3,2,"Adelphia, NJ"
214,Turf Quality,8/22/19,4,66,A12-34,Mountain View Seeds,SAB,15,4,212,2019,Aug,SAB-2019-08-22,26,2,2,"Adelphia, NJ"
214,Turf Quality,9/16/19,6,66,A12-34,Mountain View Seeds,RON,15,4,212,2019,Sep,RON-2019-09-16,23,9,2,"Adelphia, NJ"
214,Turf Quality,10/10/19,3,66,A12-34,Mountain View Seeds,SAB,15,4,212,2019,Oct,SAB-2019-10-10,27,8,2,"Adelphia, NJ"
214,Turf Quality,11/1/19,1,66,A12-34,Mountain View Seeds,RON,15,4,212,2019,Nov,RON-2019-11-01,24,7,2,"Adelphia, NJ"
214,Turf Quality,4/28/20,4,66,A12-34,Mountain View Seeds,WAM,15,4,212,2020,Apr,WAM-2020-04-28,31,1,3,"Adelphia, NJ"
214,Turf Quality,5/18/20,6,66,A12-34,Mountain View Seeds,SAB,15,4,212,2020,May,SAB-2020-05-18,28,6,3,"Adelphia, NJ"
214,Turf Quality,6/17/20,4,66,A12-34,Mountain View Seeds,WAM,15,4,212,2020,Jun,WAM-2020-06-17,32,4,3,"Adelphia, NJ"
214,Turf Quality,7/15/20,5,66,A12-34,Mountain View Seeds,WAM,15,4,212,2020,Jul,WAM-2020-07-15,33,3,3,"Adelphia, NJ"
214,Turf Quality,8/6/20,8,66,A12-34,Mountain View Seeds,PLV,15,4,212,2020,Aug,PLV-2020-08-06,5,2,3,"Adelphia, NJ"
214,Turf Quality,9/2/20,6,66,A12-34,Mountain View Seeds,DAS,15,4,212,2020,Sep,DAS-2020-09-02,1,9,3,"Adelphia, NJ"
214,Turf Quality,10/15/20,6,66,A12-34,Mountain View Seeds,WAM,15,4,212,2020,Oct,WAM-2020-10-15,34,8,3,"Adelphia, NJ"
214,Turf Quality,11/5/20,6,66,A12-34,Mountain View Seeds,WAM,15,4,212,2020,Nov,WAM-2020-11-05,35,7,3,"Adelphia, NJ"
214,Turf Quality,10/15/20,6,66,A12-34,Mountain View Seeds,RMD,15,4,212,2020,Oct,RMD-2020-10-15,10,8,3,"Adelphia, NJ"
214,Turf Quality,10/23/20,5,66,A12-34,Mountain View Seeds,RMD,15,4,212,2020,Oct,RMD-2020-10-23,11,8,3,"Adelphia, NJ"
214,Turf Quality,3/30/21,3,66,A12-34,Mountain View Seeds,RMD,15,4,212,2021,Mar,RMD-2021-03-30,12,5,4,"Adelphia, NJ"
214,Turf Quality,4/22/21,3,66,A12-34,Mountain View Seeds,PLV,15,4,212,2021,Apr,PLV-2021-04-22,6,1,4,"Adelphia, NJ"
214,Turf Quality,5/28/21,4,66,A12-34,Mountain View Seeds,SAB,15,4,212,2021,May,SAB-2021-05-28,29,6,4,"Adelphia, NJ"
214,Turf Quality,6/11/21,5,66,A12-34,Mountain View Seeds,JEN,15,4,212,2021,Jun,JEN-2021-06-11,2,4,4,"Adelphia, NJ"
214,Turf Quality,7/13/21,6,66,A12-34,Mountain View Seeds,PLV,15,4,212,2021,Jul,PLV-2021-07-13,7,3,4,"Adelphia, NJ"
214,Turf Quality,8/11/21,5,66,A12-34,Mountain View Seeds,JEN,15,4,212,2021,Aug,JEN-2021-08-11,3,2,4,"Adelphia, NJ"
214,Turf Quality,9/17/21,5,66,A12-34,Mountain View Seeds,JEN,15,4,212,2021,Sep,JEN-2021-09-17,4,9,4,"Adelphia, NJ"
214,Turf Quality,10/13/21,3,66,A12-34,Mountain View Seeds,SAB,15,4,212,2021,Oct,SAB-2021-10-13,30,8,4,"Adelphia, NJ"
214,Turf Quality,11/18/21,5,66,A12-34,Mountain View Seeds,WAM,15,4,212,2021,Nov,WAM-2021-11-18,36,7,4,"Adelphia, NJ"
207,Turf Quality,4/18/18,4,3,A99-2897,Turf Merchants Inc.,RMD,14,4,205,2018,Apr,RMD-2018-04-18,8,1,1,"Adelphia, NJ"
207,Turf Quality,5/10/18,6,3,A99-2897,Turf Merchants Inc.,RON,14,4,205,2018,May,RON-2018-05-10,13,6,1,"Adelphia, NJ"
207,Turf Quality,6/7/18,6,3,A99-2897,Turf Merchants Inc.,RON,14,4,205,2018,Jun,RON-2018-06-07,14,4,1,"Adelphia, NJ"
207,Turf Quality,7/17/18,8,3,A99-2897,Turf Merchants Inc.,RON,14,4,205,2018,Jul,RON-2018-07-17,15,3,1,"Adelphia, NJ"
207,Turf Quality,8/15/18,5,3,A99-2897,Turf Merchants Inc.,RMD,14,4,205,2018,Aug,RMD-2018-08-15,9,2,1,"Adelphia, NJ"
207,Turf Quality,9/12/18,7,3,A99-2897,Turf Merchants Inc.,RON,14,4,205,2018,Sep,RON-2018-09-12,16,9,1,"Adelphia, NJ"
207,Turf Quality,10/2/18,6,3,A99-2897,Turf Merchants Inc.,RON,14,4,205,2018,Oct,RON-2018-10-02,17,8,1,"Adelphia, NJ"
207,Turf Quality,11/9/18,8,3,A99-2897,Turf Merchants Inc.,RON,14,4,205,2018,Nov,RON-2018-11-09,18,7,1,"Adelphia, NJ"
207,Turf Quality,4/17/19,5,3,A99-2897,Turf Merchants Inc.,RON,14,4,205,2019,Apr,RON-2019-04-17,19,1,2,"Adelphia, NJ"
207,Turf Quality,5/2/19,6,3,A99-2897,Turf Merchants Inc.,RON,14,4,205,2019,May,RON-2019-05-02,20,6,2,"Adelphia, NJ"
207,Turf Quality,6/13/19,6,3,A99-2897,Turf Merchants Inc.,RON,14,4,205,2019,Jun,RON-2019-06-13,21,4,2,"Adelphia, NJ"
207,Turf Quality,6/17/19,6,3,A99-2897,Turf Merchants Inc.,SAB,14,4,205,2019,Jun,SAB-2019-06-17,25,4,2,"Adelphia, NJ"
207,Turf Quality,7/17/19,6,3,A99-2897,Turf Merchants Inc.,RON,14,4,205,2019,Jul,RON-2019-07-17,22,3,2,"Adelphia, NJ"
207,Turf Quality,8/22/19,7,3,A99-2897,Turf Merchants Inc.,SAB,14,4,205,2019,Aug,SAB-2019-08-22,26,2,2,"Adelphia, NJ"
207,Turf Quality,9/16/19,9,3,A99-2897,Turf Merchants Inc.,RON,14,4,205,2019,Sep,RON-2019-09-16,23,9,2,"Adelphia, NJ"
207,Turf Quality,10/10/19,8,3,A99-2897,Turf Merchants Inc.,SAB,14,4,205,2019,Oct,SAB-2019-10-10,27,8,2,"Adelphia, NJ"
207,Turf Quality,11/1/19,7,3,A99-2897,Turf Merchants Inc.,RON,14,4,205,2019,Nov,RON-2019-11-01,24,7,2,"Adelphia, NJ"
207,Turf Quality,4/28/20,7,3,A99-2897,Turf Merchants Inc.,WAM,14,4,205,2020,Apr,WAM-2020-04-28,31,1,3,"Adelphia, NJ"
207,Turf Quality,5/18/20,8,3,A99-2897,Turf Merchants Inc.,SAB,14,4,205,2020,May,SAB-2020-05-18,28,6,3,"Adelphia, NJ"
207,Turf Quality,6/17/20,6,3,A99-2897,Turf Merchants Inc.,WAM,14,4,205,2020,Jun,WAM-2020-06-17,32,4,3,"Adelphia, NJ"
207,Turf Quality,7/15/20,6,3,A99-2897,Turf Merchants Inc.,WAM,14,4,205,2020,Jul,WAM-2020-07-15,33,3,3,"Adelphia, NJ"
207,Turf Quality,8/6/20,7,3,A99-2897,Turf Merchants Inc.,PLV,14,4,205,2020,Aug,PLV-2020-08-06,5,2,3,"Adelphia, NJ"
207,Turf Quality,9/2/20,8,3,A99-2897,Turf Merchants Inc.,DAS,14,4,205,2020,Sep,DAS-2020-09-02,1,9,3,"Adelphia, NJ"
207,Turf Quality,10/15/20,5,3,A99-2897,Turf Merchants Inc.,WAM,14,4,205,2020,Oct,WAM-2020-10-15,34,8,3,"Adelphia, NJ"
207,Turf Quality,11/5/20,6,3,A99-2897,Turf Merchants Inc.,WAM,14,4,205,2020,Nov,WAM-2020-11-05,35,7,3,"Adelphia, NJ"
207,Turf Quality,10/15/20,7,3,A99-2897,Turf Merchants Inc.,RMD,14,4,205,2020,Oct,RMD-2020-10-15,10,8,3,"Adelphia, NJ"
207,Turf Quality,10/23/20,5,3,A99-2897,Turf Merchants Inc.,RMD,14,4,205,2020,Oct,RMD-2020-10-23,11,8,3,"Adelphia, NJ"
207,Turf Quality,3/30/21,7,3,A99-2897,Turf Merchants Inc.,RMD,14,4,205,2021,Mar,RMD-2021-03-30,12,5,4,"Adelphia, NJ"
207,Turf Quality,4/22/21,7,3,A99-2897,Turf Merchants Inc.,PLV,14,4,205,2021,Apr,PLV-2021-04-22,6,1,4,"Adelphia, NJ"
207,Turf Quality,5/28/21,6,3,A99-2897,Turf Merchants Inc.,SAB,14,4,205,2021,May,SAB-2021-05-28,29,6,4,"Adelphia, NJ"
207,Turf Quality,6/11/21,8,3,A99-2897,Turf Merchants Inc.,JEN,14,4,205,2021,Jun,JEN-2021-06-11,2,4,4,"Adelphia, NJ"
207,Turf Quality,7/13/21,8,3,A99-2897,Turf Merchants Inc.,PLV,14,4,205,2021,Jul,PLV-2021-07-13,7,3,4,"Adelphia, NJ"
207,Turf Quality,8/11/21,6,3,A99-2897,Turf Merchants Inc.,JEN,14,4,205,2021,Aug,JEN-2021-08-11,3,2,4,"Adelphia, NJ"
207,Turf Quality,9/17/21,5,3,A99-2897,Turf Merchants Inc.,JEN,14,4,205,2021,Sep,JEN-2021-09-17,4,9,4,"Adelphia, NJ"
207,Turf Quality,10/13/21,6,3,A99-2897,Turf Merchants Inc.,SAB,14,4,205,2021,Oct,SAB-2021-10-13,30,8,4,"Adelphia, NJ"
207,Turf Quality,11/18/21,7,3,A99-2897,Turf Merchants Inc.,WAM,14,4,205,2021,Nov,WAM-2021-11-18,36,7,4,"Adelphia, NJ"
184,Turf Quality,4/18/18,4,72,Shamrock,Standard,RMD,13,4,182,2018,Apr,RMD-2018-04-18,8,1,1,"Adelphia, NJ"
184,Turf Quality,5/10/18,6,72,Shamrock,Standard,RON,13,4,182,2018,May,RON-2018-05-10,13,6,1,"Adelphia, NJ"
184,Turf Quality,6/7/18,5,72,Shamrock,Standard,RON,13,4,182,2018,Jun,RON-2018-06-07,14,4,1,"Adelphia, NJ"
184,Turf Quality,7/17/18,5,72,Shamrock,Standard,RON,13,4,182,2018,Jul,RON-2018-07-17,15,3,1,"Adelphia, NJ"
184,Turf Quality,8/15/18,5,72,Shamrock,Standard,RMD,13,4,182,2018,Aug,RMD-2018-08-15,9,2,1,"Adelphia, NJ"
184,Turf Quality,9/12/18,4,72,Shamrock,Standard,RON,13,4,182,2018,Sep,RON-2018-09-12,16,9,1,"Adelphia, NJ"
184,Turf Quality,10/2/18,4,72,Shamrock,Standard,RON,13,4,182,2018,Oct,RON-2018-10-02,17,8,1,"Adelphia, NJ"
184,Turf Quality,11/9/18,3,72,Shamrock,Standard,RON,13,4,182,2018,Nov,RON-2018-11-09,18,7,1,"Adelphia, NJ"
184,Turf Quality,4/17/19,4,72,Shamrock,Standard,RON,13,4,182,2019,Apr,RON-2019-04-17,19,1,2,"Adelphia, NJ"
184,Turf Quality,5/2/19,5,72,Shamrock,Standard,RON,13,4,182,2019,May,RON-2019-05-02,20,6,2,"Adelphia, NJ"
184,Turf Quality,6/13/19,5,72,Shamrock,Standard,RON,13,4,182,2019,Jun,RON-2019-06-13,21,4,2,"Adelphia, NJ"
184,Turf Quality,6/17/19,4,72,Shamrock,Standard,SAB,13,4,182,2019,Jun,SAB-2019-06-17,25,4,2,"Adelphia, NJ"
184,Turf Quality,7/17/19,4,72,Shamrock,Standard,RON,13,4,182,2019,Jul,RON-2019-07-17,22,3,2,"Adelphia, NJ"
184,Turf Quality,8/22/19,2,72,Shamrock,Standard,SAB,13,4,182,2019,Aug,SAB-2019-08-22,26,2,2,"Adelphia, NJ"
184,Turf Quality,9/16/19,2,72,Shamrock,Standard,RON,13,4,182,2019,Sep,RON-2019-09-16,23,9,2,"Adelphia, NJ"
184,Turf Quality,10/10/19,1,72,Shamrock,Standard,SAB,13,4,182,2019,Oct,SAB-2019-10-10,27,8,2,"Adelphia, NJ"
184,Turf Quality,11/1/19,1,72,Shamrock,Standard,RON,13,4,182,2019,Nov,RON-2019-11-01,24,7,2,"Adelphia, NJ"
184,Turf Quality,4/28/20,4,72,Shamrock,Standard,WAM,13,4,182,2020,Apr,WAM-2020-04-28,31,1,3,"Adelphia, NJ"
184,Turf Quality,5/18/20,4,72,Shamrock,Standard,SAB,13,4,182,2020,May,SAB-2020-05-18,28,6,3,"Adelphia, NJ"
184,Turf Quality,6/17/20,3,72,Shamrock,Standard,WAM,13,4,182,2020,Jun,WAM-2020-06-17,32,4,3,"Adelphia, NJ"
184,Turf Quality,7/15/20,3,72,Shamrock,Standard,WAM,13,4,182,2020,Jul,WAM-2020-07-15,33,3,3,"Adelphia, NJ"
184,Turf Quality,8/6/20,5,72,Shamrock,Standard,PLV,13,4,182,2020,Aug,PLV-2020-08-06,5,2,3,"Adelphia, NJ"
184,Turf Quality,9/2/20,4,72,Shamrock,Standard,DAS,13,4,182,2020,Sep,DAS-2020-09-02,1,9,3,"Adelphia, NJ"
184,Turf Quality,10/15/20,2,72,Shamrock,Standard,WAM,13,4,182,2020,Oct,WAM-2020-10-15,34,8,3,"Adelphia, NJ"
184,Turf Quality,11/5/20,2,72,Shamrock,Standard,WAM,13,4,182,2020,Nov,WAM-2020-11-05,35,7,3,"Adelphia, NJ"
184,Turf Quality,10/15/20,2,72,Shamrock,Standard,RMD,13,4,182,2020,Oct,RMD-2020-10-15,10,8,3,"Adelphia, NJ"
184,Turf Quality,10/23/20,1,72,Shamrock,Standard,RMD,13,4,182,2020,Oct,RMD-2020-10-23,11,8,3,"Adelphia, NJ"
184,Turf Quality,3/30/21,1,72,Shamrock,Standard,RMD,13,4,182,2021,Mar,RMD-2021-03-30,12,5,4,"Adelphia, NJ"
184,Turf Quality,4/22/21,4,72,Shamrock,Standard,PLV,13,4,182,2021,Apr,PLV-2021-04-22,6,1,4,"Adelphia, NJ"
184,Turf Quality,5/28/21,2,72,Shamrock,Standard,SAB,13,4,182,2021,May,SAB-2021-05-28,29,6,4,"Adelphia, NJ"
184,Turf Quality,6/11/21,5,72,Shamrock,Standard,JEN,13,4,182,2021,Jun,JEN-2021-06-11,2,4,4,"Adelphia, NJ"
184,Turf Quality,7/13/21,3,72,Shamrock,Standard,PLV,13,4,182,2021,Jul,PLV-2021-07-13,7,3,4,"Adelphia, NJ"
184,Turf Quality,8/11/21,5,72,Shamrock,Standard,JEN,13,4,182,2021,Aug,JEN-2021-08-11,3,2,4,"Adelphia, NJ"
184,Turf Quality,9/17/21,5,72,Shamrock,Standard,JEN,13,4,182,2021,Sep,JEN-2021-09-17,4,9,4,"Adelphia, NJ"
184,Turf Quality,10/13/21,2,72,Shamrock,Standard,SAB,13,4,182,2021,Oct,SAB-2021-10-13,30,8,4,"Adelphia, NJ"
184,Turf Quality,11/18/21,5,72,Shamrock,Standard,WAM,13,4,182,2021,Nov,WAM-2021-11-18,36,7,4,"Adelphia, NJ"
177,Turf Quality,4/18/18,4,30,Twilight (NAI-13-132),SiteOne Landscape Supply,RMD,12,4,176,2018,Apr,RMD-2018-04-18,8,1,1,"Adelphia, NJ"
177,Turf Quality,5/10/18,6,30,Twilight (NAI-13-132),SiteOne Landscape Supply,RON,12,4,176,2018,May,RON-2018-05-10,13,6,1,"Adelphia, NJ"
177,Turf Quality,6/7/18,8,30,Twilight (NAI-13-132),SiteOne Landscape Supply,RON,12,4,176,2018,Jun,RON-2018-06-07,14,4,1,"Adelphia, NJ"
177,Turf Quality,7/17/18,8,30,Twilight (NAI-13-132),SiteOne Landscape Supply,RON,12,4,176,2018,Jul,RON-2018-07-17,15,3,1,"Adelphia, NJ"
177,Turf Quality,8/15/18,8,30,Twilight (NAI-13-132),SiteOne Landscape Supply,RMD,12,4,176,2018,Aug,RMD-2018-08-15,9,2,1,"Adelphia, NJ"
177,Turf Quality,9/12/18,6,30,Twilight (NAI-13-132),SiteOne Landscape Supply,RON,12,4,176,2018,Sep,RON-2018-09-12,16,9,1,"Adelphia, NJ"
177,Turf Quality,10/2/18,5,30,Twilight (NAI-13-132),SiteOne Landscape Supply,RON,12,4,176,2018,Oct,RON-2018-10-02,17,8,1,"Adelphia, NJ"
177,Turf Quality,11/9/18,5,30,Twilight (NAI-13-132),SiteOne Landscape Supply,RON,12,4,176,2018,Nov,RON-2018-11-09,18,7,1,"Adelphia, NJ"
177,Turf Quality,4/17/19,4,30,Twilight (NAI-13-132),SiteOne Landscape Supply,RON,12,4,176,2019,Apr,RON-2019-04-17,19,1,2,"Adelphia, NJ"
177,Turf Quality,5/2/19,4,30,Twilight (NAI-13-132),SiteOne Landscape Supply,RON,12,4,176,2019,May,RON-2019-05-02,20,6,2,"Adelphia, NJ"
177,Turf Quality,6/13/19,6,30,Twilight (NAI-13-132),SiteOne Landscape Supply,RON,12,4,176,2019,Jun,RON-2019-06-13,21,4,2,"Adelphia, NJ"
177,Turf Quality,6/17/19,5,30,Twilight (NAI-13-132),SiteOne Landscape Supply,SAB,12,4,176,2019,Jun,SAB-2019-06-17,25,4,2,"Adelphia, NJ"
177,Turf Quality,7/17/19,6,30,Twilight (NAI-13-132),SiteOne Landscape Supply,RON,12,4,176,2019,Jul,RON-2019-07-17,22,3,2,"Adelphia, NJ"
177,Turf Quality,8/22/19,6,30,Twilight (NAI-13-132),SiteOne Landscape Supply,SAB,12,4,176,2019,Aug,SAB-2019-08-22,26,2,2,"Adelphia, NJ"
177,Turf Quality,9/16/19,6,30,Twilight (NAI-13-132),SiteOne Landscape Supply,RON,12,4,176,2019,Sep,RON-2019-09-16,23,9,2,"Adelphia, NJ"
177,Turf Quality,10/10/19,5,30,Twilight (NAI-13-132),SiteOne Landscape Supply,SAB,12,4,176,2019,Oct,SAB-2019-10-10,27,8,2,"Adelphia, NJ"
177,Turf Quality,11/1/19,5,30,Twilight (NAI-13-132),SiteOne Landscape Supply,RON,12,4,176,2019,Nov,RON-2019-11-01,24,7,2,"Adelphia, NJ"
177,Turf Quality,4/28/20,6,30,Twilight (NAI-13-132),SiteOne Landscape Supply,WAM,12,4,176,2020,Apr,WAM-2020-04-28,31,1,3,"Adelphia, NJ"
177,Turf Quality,5/18/20,4,30,Twilight (NAI-13-132),SiteOne Landscape Supply,SAB,12,4,176,2020,May,SAB-2020-05-18,28,6,3,"Adelphia, NJ"
177,Turf Quality,6/17/20,7,30,Twilight (NAI-13-132),SiteOne Landscape Supply,WAM,12,4,176,2020,Jun,WAM-2020-06-17,32,4,3,"Adelphia, NJ"
177,Turf Quality,7/15/20,7,30,Twilight (NAI-13-132),SiteOne Landscape Supply,WAM,12,4,176,2020,Jul,WAM-2020-07-15,33,3,3,"Adelphia, NJ"
177,Turf Quality,8/6/20,7,30,Twilight (NAI-13-132),SiteOne Landscape Supply,PLV,12,4,176,2020,Aug,PLV-2020-08-06,5,2,3,"Adelphia, NJ"
177,Turf Quality,9/2/20,5,30,Twilight (NAI-13-132),SiteOne Landscape Supply,DAS,12,4,176,2020,Sep,DAS-2020-09-02,1,9,3,"Adelphia, NJ"
177,Turf Quality,10/15/20,3,30,Twilight (NAI-13-132),SiteOne Landscape Supply,WAM,12,4,176,2020,Oct,WAM-2020-10-15,34,8,3,"Adelphia, NJ"
177,Turf Quality,11/5/20,4,30,Twilight (NAI-13-132),SiteOne Landscape Supply,WAM,12,4,176,2020,Nov,WAM-2020-11-05,35,7,3,"Adelphia, NJ"
177,Turf Quality,10/15/20,4,30,Twilight (NAI-13-132),SiteOne Landscape Supply,RMD,12,4,176,2020,Oct,RMD-2020-10-15,10,8,3,"Adelphia, NJ"
177,Turf Quality,10/23/20,3,30,Twilight (NAI-13-132),SiteOne Landscape Supply,RMD,12,4,176,2020,Oct,RMD-2020-10-23,11,8,3,"Adelphia, NJ"
177,Turf Quality,3/30/21,3,30,Twilight (NAI-13-132),SiteOne Landscape Supply,RMD,12,4,176,2021,Mar,RMD-2021-03-30,12,5,4,"Adelphia, NJ"
177,Turf Quality,4/22/21,6,30,Twilight (NAI-13-132),SiteOne Landscape Supply,PLV,12,4,176,2021,Apr,PLV-2021-04-22,6,1,4,"Adelphia, NJ"
177,Turf Quality,5/28/21,4,30,Twilight (NAI-13-132),SiteOne Landscape Supply,SAB,12,4,176,2021,May,SAB-2021-05-28,29,6,4,"Adelphia, NJ"
177,Turf Quality,6/11/21,6,30,Twilight (NAI-13-132),SiteOne Landscape Supply,JEN,12,4,176,2021,Jun,JEN-2021-06-11,2,4,4,"Adelphia, NJ"
177,Turf Quality,7/13/21,7,30,Twilight (NAI-13-132),SiteOne Landscape Supply,PLV,12,4,176,2021,Jul,PLV-2021-07-13,7,3,4,"Adelphia, NJ"
177,Turf Quality,8/11/21,6,30,Twilight (NAI-13-132),SiteOne Landscape Supply,JEN,12,4,176,2021,Aug,JEN-2021-08-11,3,2,4,"Adelphia, NJ"
177,Turf Quality,9/17/21,6,30,Twilight (NAI-13-132),SiteOne Landscape Supply,JEN,12,4,176,2021,Sep,JEN-2021-09-17,4,9,4,"Adelphia, NJ"
177,Turf Quality,10/13/21,6,30,Twilight (NAI-13-132),SiteOne Landscape Supply,SAB,12,4,176,2021,Oct,SAB-2021-10-13,30,8,4,"Adelphia, NJ"
177,Turf Quality,11/18/21,5,30,Twilight (NAI-13-132),SiteOne Landscape Supply,WAM,12,4,176,2021,Nov,WAM-2021-11-18,36,7,4,"Adelphia, NJ"
154,Turf Quality,4/18/18,4,55,DLFPS-340/3438,DLF Pickseed USA,RMD,11,4,153,2018,Apr,RMD-2018-04-18,8,1,1,"Adelphia, NJ"
154,Turf Quality,5/10/18,7,55,DLFPS-340/3438,DLF Pickseed USA,RON,11,4,153,2018,May,RON-2018-05-10,13,6,1,"Adelphia, NJ"
154,Turf Quality,6/7/18,5,55,DLFPS-340/3438,DLF Pickseed USA,RON,11,4,153,2018,Jun,RON-2018-06-07,14,4,1,"Adelphia, NJ"
154,Turf Quality,7/17/18,5,55,DLFPS-340/3438,DLF Pickseed USA,RON,11,4,153,2018,Jul,RON-2018-07-17,15,3,1,"Adelphia, NJ"
154,Turf Quality,8/15/18,7,55,DLFPS-340/3438,DLF Pickseed USA,RMD,11,4,153,2018,Aug,RMD-2018-08-15,9,2,1,"Adelphia, NJ"
154,Turf Quality,9/12/18,5,55,DLFPS-340/3438,DLF Pickseed USA,RON,11,4,153,2018,Sep,RON-2018-09-12,16,9,1,"Adelphia, NJ"
154,Turf Quality,10/2/18,5,55,DLFPS-340/3438,DLF Pickseed USA,RON,11,4,153,2018,Oct,RON-2018-10-02,17,8,1,"Adelphia, NJ"
154,Turf Quality,11/9/18,6,55,DLFPS-340/3438,DLF Pickseed USA,RON,11,4,153,2018,Nov,RON-2018-11-09,18,7,1,"Adelphia, NJ"
154,Turf Quality,4/17/19,5,55,DLFPS-340/3438,DLF Pickseed USA,RON,11,4,153,2019,Apr,RON-2019-04-17,19,1,2,"Adelphia, NJ"
154,Turf Quality,5/2/19,5,55,DLFPS-340/3438,DLF Pickseed USA,RON,11,4,153,2019,May,RON-2019-05-02,20,6,2,"Adelphia, NJ"
154,Turf Quality,6/13/19,6,55,DLFPS-340/3438,DLF Pickseed USA,RON,11,4,153,2019,Jun,RON-2019-06-13,21,4,2,"Adelphia, NJ"
154,Turf Quality,6/17/19,7,55,DLFPS-340/3438,DLF Pickseed USA,SAB,11,4,153,2019,Jun,SAB-2019-06-17,25,4,2,"Adelphia, NJ"
154,Turf Quality,7/17/19,7,55,DLFPS-340/3438,DLF Pickseed USA,RON,11,4,153,2019,Jul,RON-2019-07-17,22,3,2,"Adelphia, NJ"
154,Turf Quality,8/22/19,6,55,DLFPS-340/3438,DLF Pickseed USA,SAB,11,4,153,2019,Aug,SAB-2019-08-22,26,2,2,"Adelphia, NJ"
154,Turf Quality,9/16/19,7,55,DLFPS-340/3438,DLF Pickseed USA,RON,11,4,153,2019,Sep,RON-2019-09-16,23,9,2,"Adelphia, NJ"
154,Turf Quality,10/10/19,5,55,DLFPS-340/3438,DLF Pickseed USA,SAB,11,4,153,2019,Oct,SAB-2019-10-10,27,8,2,"Adelphia, NJ"
154,Turf Quality,11/1/19,5,55,DLFPS-340/3438,DLF Pickseed USA,RON,11,4,153,2019,Nov,RON-2019-11-01,24,7,2,"Adelphia, NJ"
154,Turf Quality,4/28/20,7,55,DLFPS-340/3438,DLF Pickseed USA,WAM,11,4,153,2020,Apr,WAM-2020-04-28,31,1,3,"Adelphia, NJ"
154,Turf Quality,5/18/20,7,55,DLFPS-340/3438,DLF Pickseed USA,SAB,11,4,153,2020,May,SAB-2020-05-18,28,6,3,"Adelphia, NJ"
154,Turf Quality,6/17/20,4,55,DLFPS-340/3438,DLF Pickseed USA,WAM,11,4,153,2020,Jun,WAM-2020-06-17,32,4,3,"Adelphia, NJ"
154,Turf Quality,7/15/20,6,55,DLFPS-340/3438,DLF Pickseed USA,WAM,11,4,153,2020,Jul,WAM-2020-07-15,33,3,3,"Adelphia, NJ"
154,Turf Quality,8/6/20,8,55,DLFPS-340/3438,DLF Pickseed USA,PLV,11,4,153,2020,Aug,PLV-2020-08-06,5,2,3,"Adelphia, NJ"
154,Turf Quality,9/2/20,4,55,DLFPS-340/3438,DLF Pickseed USA,DAS,11,4,153,2020,Sep,DAS-2020-09-02,1,9,3,"Adelphia, NJ"
154,Turf Quality,10/15/20,3,55,DLFPS-340/3438,DLF Pickseed USA,WAM,11,4,153,2020,Oct,WAM-2020-10-15,34,8,3,"Adelphia, NJ"
154,Turf Quality,11/5/20,4,55,DLFPS-340/3438,DLF Pickseed USA,WAM,11,4,153,2020,Nov,WAM-2020-11-05,35,7,3,"Adelphia, NJ"
154,Turf Quality,10/15/20,3,55,DLFPS-340/3438,DLF Pickseed USA,RMD,11,4,153,2020,Oct,RMD-2020-10-15,10,8,3,"Adelphia, NJ"
154,Turf Quality,10/23/20,3,55,DLFPS-340/3438,DLF Pickseed USA,RMD,11,4,153,2020,Oct,RMD-2020-10-23,11,8,3,"Adelphia, NJ"
154,Turf Quality,3/30/21,3,55,DLFPS-340/3438,DLF Pickseed USA,RMD,11,4,153,2021,Mar,RMD-2021-03-30,12,5,4,"Adelphia, NJ"
154,Turf Quality,4/22/21,5,55,DLFPS-340/3438,DLF Pickseed USA,PLV,11,4,153,2021,Apr,PLV-2021-04-22,6,1,4,"Adelphia, NJ"
154,Turf Quality,5/28/21,4,55,DLFPS-340/3438,DLF Pickseed USA,SAB,11,4,153,2021,May,SAB-2021-05-28,29,6,4,"Adelphia, NJ"
154,Turf Quality,6/11/21,5,55,DLFPS-340/3438,DLF Pickseed USA,JEN,11,4,153,2021,Jun,JEN-2021-06-11,2,4,4,"Adelphia, NJ"
154,Turf Quality,7/13/21,6,55,DLFPS-340/3438,DLF Pickseed USA,PLV,11,4,153,2021,Jul,PLV-2021-07-13,7,3,4,"Adelphia, NJ"
154,Turf Quality,8/11/21,7,55,DLFPS-340/3438,DLF Pickseed USA,JEN,11,4,153,2021,Aug,JEN-2021-08-11,3,2,4,"Adelphia, NJ"
154,Turf Quality,9/17/21,5,55,DLFPS-340/3438,DLF Pickseed USA,JEN,11,4,153,2021,Sep,JEN-2021-09-17,4,9,4,"Adelphia, NJ"
154,Turf Quality,10/13/21,6,55,DLFPS-340/3438,DLF Pickseed USA,SAB,11,4,153,2021,Oct,SAB-2021-10-13,30,8,4,"Adelphia, NJ"
154,Turf Quality,11/18/21,5,55,DLFPS-340/3438,DLF Pickseed USA,WAM,11,4,153,2021,Nov,WAM-2021-11-18,36,7,4,"Adelphia, NJ"
147,Turf Quality,4/18/18,4,50,DLFPS-340/3446,DLF Pickseed USA,RMD,10,4,146,2018,Apr,RMD-2018-04-18,8,1,1,"Adelphia, NJ"
147,Turf Quality,5/10/18,5,50,DLFPS-340/3446,DLF Pickseed USA,RON,10,4,146,2018,May,RON-2018-05-10,13,6,1,"Adelphia, NJ"
147,Turf Quality,6/7/18,5,50,DLFPS-340/3446,DLF Pickseed USA,RON,10,4,146,2018,Jun,RON-2018-06-07,14,4,1,"Adelphia, NJ"
147,Turf Quality,7/17/18,6,50,DLFPS-340/3446,DLF Pickseed USA,RON,10,4,146,2018,Jul,RON-2018-07-17,15,3,1,"Adelphia, NJ"
147,Turf Quality,8/15/18,7,50,DLFPS-340/3446,DLF Pickseed USA,RMD,10,4,146,2018,Aug,RMD-2018-08-15,9,2,1,"Adelphia, NJ"
147,Turf Quality,9/12/18,5,50,DLFPS-340/3446,DLF Pickseed USA,RON,10,4,146,2018,Sep,RON-2018-09-12,16,9,1,"Adelphia, NJ"
147,Turf Quality,10/2/18,5,50,DLFPS-340/3446,DLF Pickseed USA,RON,10,4,146,2018,Oct,RON-2018-10-02,17,8,1,"Adelphia, NJ"
147,Turf Quality,11/9/18,5,50,DLFPS-340/3446,DLF Pickseed USA,RON,10,4,146,2018,Nov,RON-2018-11-09,18,7,1,"Adelphia, NJ"
147,Turf Quality,4/17/19,5,50,DLFPS-340/3446,DLF Pickseed USA,RON,10,4,146,2019,Apr,RON-2019-04-17,19,1,2,"Adelphia, NJ"
147,Turf Quality,5/2/19,6,50,DLFPS-340/3446,DLF Pickseed USA,RON,10,4,146,2019,May,RON-2019-05-02,20,6,2,"Adelphia, NJ"
147,Turf Quality,6/13/19,7,50,DLFPS-340/3446,DLF Pickseed USA,RON,10,4,146,2019,Jun,RON-2019-06-13,21,4,2,"Adelphia, NJ"
147,Turf Quality,6/17/19,5,50,DLFPS-340/3446,DLF Pickseed USA,SAB,10,4,146,2019,Jun,SAB-2019-06-17,25,4,2,"Adelphia, NJ"
147,Turf Quality,7/17/19,6,50,DLFPS-340/3446,DLF Pickseed USA,RON,10,4,146,2019,Jul,RON-2019-07-17,22,3,2,"Adelphia, NJ"
147,Turf Quality,8/22/19,3,50,DLFPS-340/3446,DLF Pickseed USA,SAB,10,4,146,2019,Aug,SAB-2019-08-22,26,2,2,"Adelphia, NJ"
147,Turf Quality,9/16/19,4,50,DLFPS-340/3446,DLF Pickseed USA,RON,10,4,146,2019,Sep,RON-2019-09-16,23,9,2,"Adelphia, NJ"
147,Turf Quality,10/10/19,4,50,DLFPS-340/3446,DLF Pickseed USA,SAB,10,4,146,2019,Oct,SAB-2019-10-10,27,8,2,"Adelphia, NJ"
147,Turf Quality,11/1/19,4,50,DLFPS-340/3446,DLF Pickseed USA,RON,10,4,146,2019,Nov,RON-2019-11-01,24,7,2,"Adelphia, NJ"
147,Turf Quality,4/28/20,6,50,DLFPS-340/3446,DLF Pickseed USA,WAM,10,4,146,2020,Apr,WAM-2020-04-28,31,1,3,"Adelphia, NJ"
147,Turf Quality,5/18/20,4,50,DLFPS-340/3446,DLF Pickseed USA,SAB,10,4,146,2020,May,SAB-2020-05-18,28,6,3,"Adelphia, NJ"
147,Turf Quality,6/17/20,4,50,DLFPS-340/3446,DLF Pickseed USA,WAM,10,4,146,2020,Jun,WAM-2020-06-17,32,4,3,"Adelphia, NJ"
147,Turf Quality,7/15/20,5,50,DLFPS-340/3446,DLF Pickseed USA,WAM,10,4,146,2020,Jul,WAM-2020-07-15,33,3,3,"Adelphia, NJ"
147,Turf Quality,8/6/20,5,50,DLFPS-340/3446,DLF Pickseed USA,PLV,10,4,146,2020,Aug,PLV-2020-08-06,5,2,3,"Adelphia, NJ"
147,Turf Quality,9/2/20,4,50,DLFPS-340/3446,DLF Pickseed USA,DAS,10,4,146,2020,Sep,DAS-2020-09-02,1,9,3,"Adelphia, NJ"
147,Turf Quality,10/15/20,1,50,DLFPS-340/3446,DLF Pickseed USA,WAM,10,4,146,2020,Oct,WAM-2020-10-15,34,8,3,"Adelphia, NJ"
147,Turf Quality,11/5/20,3,50,DLFPS-340/3446,DLF Pickseed USA,WAM,10,4,146,2020,Nov,WAM-2020-11-05,35,7,3,"Adelphia, NJ"
147,Turf Quality,10/15/20,3,50,DLFPS-340/3446,DLF Pickseed USA,RMD,10,4,146,2020,Oct,RMD-2020-10-15,10,8,3,"Adelphia, NJ"
147,Turf Quality,10/23/20,3,50,DLFPS-340/3446,DLF Pickseed USA,RMD,10,4,146,2020,Oct,RMD-2020-10-23,11,8,3,"Adelphia, NJ"
147,Turf Quality,3/30/21,2,50,DLFPS-340/3446,DLF Pickseed USA,RMD,10,4,146,2021,Mar,RMD-2021-03-30,12,5,4,"Adelphia, NJ"
147,Turf Quality,4/22/21,4,50,DLFPS-340/3446,DLF Pickseed USA,PLV,10,4,146,2021,Apr,PLV-2021-04-22,6,1,4,"Adelphia, NJ"
147,Turf Quality,5/28/21,3,50,DLFPS-340/3446,DLF Pickseed USA,SAB,10,4,146,2021,May,SAB-2021-05-28,29,6,4,"Adelphia, NJ"
147,Turf Quality,6/11/21,5,50,DLFPS-340/3446,DLF Pickseed USA,JEN,10,4,146,2021,Jun,JEN-2021-06-11,2,4,4,"Adelphia, NJ"
147,Turf Quality,7/13/21,6,50,DLFPS-340/3446,DLF Pickseed USA,PLV,10,4,146,2021,Jul,PLV-2021-07-13,7,3,4,"Adelphia, NJ"
147,Turf Quality,8/11/21,6,50,DLFPS-340/3446,DLF Pickseed USA,JEN,10,4,146,2021,Aug,JEN-2021-08-11,3,2,4,"Adelphia, NJ"
147,Turf Quality,9/17/21,4,50,DLFPS-340/3446,DLF Pickseed USA,JEN,10,4,146,2021,Sep,JEN-2021-09-17,4,9,4,"Adelphia, NJ"
147,Turf Quality,10/13/21,4,50,DLFPS-340/3446,DLF Pickseed USA,SAB,10,4,146,2021,Oct,SAB-2021-10-13,30,8,4,"Adelphia, NJ"
147,Turf Quality,11/18/21,5,50,DLFPS-340/3446,DLF Pickseed USA,WAM,10,4,146,2021,Nov,WAM-2021-11-18,36,7,4,"Adelphia, NJ"
124,Turf Quality,4/18/18,3,44,Blue Devil,Columbia Seeds,RMD,9,4,123,2018,Apr,RMD-2018-04-18,8,1,1,"Adelphia, NJ"
124,Turf Quality,5/10/18,4,44,Blue Devil,Columbia Seeds,RON,9,4,123,2018,May,RON-2018-05-10,13,6,1,"Adelphia, NJ"
124,Turf Quality,6/7/18,6,44,Blue Devil,Columbia Seeds,RON,9,4,123,2018,Jun,RON-2018-06-07,14,4,1,"Adelphia, NJ"
124,Turf Quality,7/17/18,7,44,Blue Devil,Columbia Seeds,RON,9,4,123,2018,Jul,RON-2018-07-17,15,3,1,"Adelphia, NJ"
124,Turf Quality,8/15/18,8,44,Blue Devil,Columbia Seeds,RMD,9,4,123,2018,Aug,RMD-2018-08-15,9,2,1,"Adelphia, NJ"
124,Turf Quality,9/12/18,6,44,Blue Devil,Columbia Seeds,RON,9,4,123,2018,Sep,RON-2018-09-12,16,9,1,"Adelphia, NJ"
124,Turf Quality,10/2/18,5,44,Blue Devil,Columbia Seeds,RON,9,4,123,2018,Oct,RON-2018-10-02,17,8,1,"Adelphia, NJ"
124,Turf Quality,11/9/18,6,44,Blue Devil,Columbia Seeds,RON,9,4,123,2018,Nov,RON-2018-11-09,18,7,1,"Adelphia, NJ"
124,Turf Quality,4/17/19,3,44,Blue Devil,Columbia Seeds,RON,9,4,123,2019,Apr,RON-2019-04-17,19,1,2,"Adelphia, NJ"
124,Turf Quality,5/2/19,5,44,Blue Devil,Columbia Seeds,RON,9,4,123,2019,May,RON-2019-05-02,20,6,2,"Adelphia, NJ"
124,Turf Quality,6/13/19,5,44,Blue Devil,Columbia Seeds,RON,9,4,123,2019,Jun,RON-2019-06-13,21,4,2,"Adelphia, NJ"
124,Turf Quality,6/17/19,5,44,Blue Devil,Columbia Seeds,SAB,9,4,123,2019,Jun,SAB-2019-06-17,25,4,2,"Adelphia, NJ"
124,Turf Quality,7/17/19,5,44,Blue Devil,Columbia Seeds,RON,9,4,123,2019,Jul,RON-2019-07-17,22,3,2,"Adelphia, NJ"
124,Turf Quality,8/22/19,5,44,Blue Devil,Columbia Seeds,SAB,9,4,123,2019,Aug,SAB-2019-08-22,26,2,2,"Adelphia, NJ"
124,Turf Quality,9/16/19,6,44,Blue Devil,Columbia Seeds,RON,9,4,123,2019,Sep,RON-2019-09-16,23,9,2,"Adelphia, NJ"
124,Turf Quality,10/10/19,5,44,Blue Devil,Columbia Seeds,SAB,9,4,123,2019,Oct,SAB-2019-10-10,27,8,2,"Adelphia, NJ"
124,Turf Quality,11/1/19,5,44,Blue Devil,Columbia Seeds,RON,9,4,123,2019,Nov,RON-2019-11-01,24,7,2,"Adelphia, NJ"
124,Turf Quality,4/28/20,5,44,Blue Devil,Columbia Seeds,WAM,9,4,123,2020,Apr,WAM-2020-04-28,31,1,3,"Adelphia, NJ"
124,Turf Quality,5/18/20,5,44,Blue Devil,Columbia Seeds,SAB,9,4,123,2020,May,SAB-2020-05-18,28,6,3,"Adelphia, NJ"
124,Turf Quality,6/17/20,6,44,Blue Devil,Columbia Seeds,WAM,9,4,123,2020,Jun,WAM-2020-06-17,32,4,3,"Adelphia, NJ"
124,Turf Quality,7/15/20,6,44,Blue Devil,Columbia Seeds,WAM,9,4,123,2020,Jul,WAM-2020-07-15,33,3,3,"Adelphia, NJ"
124,Turf Quality,8/6/20,7,44,Blue Devil,Columbia Seeds,PLV,9,4,123,2020,Aug,PLV-2020-08-06,5,2,3,"Adelphia, NJ"
124,Turf Quality,9/2/20,5,44,Blue Devil,Columbia Seeds,DAS,9,4,123,2020,Sep,DAS-2020-09-02,1,9,3,"Adelphia, NJ"
124,Turf Quality,10/15/20,4,44,Blue Devil,Columbia Seeds,WAM,9,4,123,2020,Oct,WAM-2020-10-15,34,8,3,"Adelphia, NJ"
124,Turf Quality,11/5/20,5,44,Blue Devil,Columbia Seeds,WAM,9,4,123,2020,Nov,WAM-2020-11-05,35,7,3,"Adelphia, NJ"
124,Turf Quality,10/15/20,3,44,Blue Devil,Columbia Seeds,RMD,9,4,123,2020,Oct,RMD-2020-10-15,10,8,3,"Adelphia, NJ"
124,Turf Quality,10/23/20,4,44,Blue Devil,Columbia Seeds,RMD,9,4,123,2020,Oct,RMD-2020-10-23,11,8,3,"Adelphia, NJ"
124,Turf Quality,3/30/21,3,44,Blue Devil,Columbia Seeds,RMD,9,4,123,2021,Mar,RMD-2021-03-30,12,5,4,"Adelphia, NJ"
124,Turf Quality,4/22/21,3,44,Blue Devil,Columbia Seeds,PLV,9,4,123,2021,Apr,PLV-2021-04-22,6,1,4,"Adelphia, NJ"
124,Turf Quality,5/28/21,4,44,Blue Devil,Columbia Seeds,SAB,9,4,123,2021,May,SAB-2021-05-28,29,6,4,"Adelphia, NJ"
124,Turf Quality,6/11/21,6,44,Blue Devil,Columbia Seeds,JEN,9,4,123,2021,Jun,JEN-2021-06-11,2,4,4,"Adelphia, NJ"
124,Turf Quality,7/13/21,6,44,Blue Devil,Columbia Seeds,PLV,9,4,123,2021,Jul,PLV-2021-07-13,7,3,4,"Adelphia, NJ"
124,Turf Quality,8/11/21,8,44,Blue Devil,Columbia Seeds,JEN,9,4,123,2021,Aug,JEN-2021-08-11,3,2,4,"Adelphia, NJ"
124,Turf Quality,9/17/21,6,44,Blue Devil,Columbia Seeds,JEN,9,4,123,2021,Sep,JEN-2021-09-17,4,9,4,"Adelphia, NJ"
124,Turf Quality,10/13/21,6,44,Blue Devil,Columbia Seeds,SAB,9,4,123,2021,Oct,SAB-2021-10-13,30,8,4,"Adelphia, NJ"
124,Turf Quality,11/18/21,5,44,Blue Devil,Columbia Seeds,WAM,9,4,123,2021,Nov,WAM-2021-11-18,36,7,4,"Adelphia, NJ"
117,Turf Quality,4/18/18,3,43,Pivot,Columbia River Seed,RMD,8,4,116,2018,Apr,RMD-2018-04-18,8,1,1,"Adelphia, NJ"
117,Turf Quality,5/10/18,6,43,Pivot,Columbia River Seed,RON,8,4,116,2018,May,RON-2018-05-10,13,6,1,"Adelphia, NJ"
117,Turf Quality,6/7/18,5,43,Pivot,Columbia River Seed,RON,8,4,116,2018,Jun,RON-2018-06-07,14,4,1,"Adelphia, NJ"
117,Turf Quality,7/17/18,5,43,Pivot,Columbia River Seed,RON,8,4,116,2018,Jul,RON-2018-07-17,15,3,1,"Adelphia, NJ"
117,Turf Quality,8/15/18,7,43,Pivot,Columbia River Seed,RMD,8,4,116,2018,Aug,RMD-2018-08-15,9,2,1,"Adelphia, NJ"
117,Turf Quality,9/12/18,5,43,Pivot,Columbia River Seed,RON,8,4,116,2018,Sep,RON-2018-09-12,16,9,1,"Adelphia, NJ"
117,Turf Quality,10/2/18,5,43,Pivot,Columbia River Seed,RON,8,4,116,2018,Oct,RON-2018-10-02,17,8,1,"Adelphia, NJ"
117,Turf Quality,11/9/18,4,43,Pivot,Columbia River Seed,RON,8,4,116,2018,Nov,RON-2018-11-09,18,7,1,"Adelphia, NJ"
117,Turf Quality,4/17/19,4,43,Pivot,Columbia River Seed,RON,8,4,116,2019,Apr,RON-2019-04-17,19,1,2,"Adelphia, NJ"
117,Turf Quality,5/2/19,5,43,Pivot,Columbia River Seed,RON,8,4,116,2019,May,RON-2019-05-02,20,6,2,"Adelphia, NJ"
117,Turf Quality,6/13/19,5,43,Pivot,Columbia River Seed,RON,8,4,116,2019,Jun,RON-2019-06-13,21,4,2,"Adelphia, NJ"
117,Turf Quality,6/17/19,5,43,Pivot,Columbia River Seed,SAB,8,4,116,2019,Jun,SAB-2019-06-17,25,4,2,"Adelphia, NJ"
117,Turf Quality,7/17/19,7,43,Pivot,Columbia River Seed,RON,8,4,116,2019,Jul,RON-2019-07-17,22,3,2,"Adelphia, NJ"
117,Turf Quality,8/22/19,4,43,Pivot,Columbia River Seed,SAB,8,4,116,2019,Aug,SAB-2019-08-22,26,2,2,"Adelphia, NJ"
117,Turf Quality,9/16/19,3,43,Pivot,Columbia River Seed,RON,8,4,116,2019,Sep,RON-2019-09-16,23,9,2,"Adelphia, NJ"
117,Turf Quality,10/10/19,3,43,Pivot,Columbia River Seed,SAB,8,4,116,2019,Oct,SAB-2019-10-10,27,8,2,"Adelphia, NJ"
117,Turf Quality,11/1/19,3,43,Pivot,Columbia River Seed,RON,8,4,116,2019,Nov,RON-2019-11-01,24,7,2,"Adelphia, NJ"
117,Turf Quality,4/28/20,4,43,Pivot,Columbia River Seed,WAM,8,4,116,2020,Apr,WAM-2020-04-28,31,1,3,"Adelphia, NJ"
117,Turf Quality,5/18/20,6,43,Pivot,Columbia River Seed,SAB,8,4,116,2020,May,SAB-2020-05-18,28,6,3,"Adelphia, NJ"
117,Turf Quality,6/17/20,3,43,Pivot,Columbia River Seed,WAM,8,4,116,2020,Jun,WAM-2020-06-17,32,4,3,"Adelphia, NJ"
117,Turf Quality,7/15/20,4,43,Pivot,Columbia River Seed,WAM,8,4,116,2020,Jul,WAM-2020-07-15,33,3,3,"Adelphia, NJ"
117,Turf Quality,8/6/20,7,43,Pivot,Columbia River Seed,PLV,8,4,116,2020,Aug,PLV-2020-08-06,5,2,3,"Adelphia, NJ"
117,Turf Quality,9/2/20,6,43,Pivot,Columbia River Seed,DAS,8,4,116,2020,Sep,DAS-2020-09-02,1,9,3,"Adelphia, NJ"
117,Turf Quality,10/15/20,2,43,Pivot,Columbia River Seed,WAM,8,4,116,2020,Oct,WAM-2020-10-15,34,8,3,"Adelphia, NJ"
117,Turf Quality,11/5/20,2,43,Pivot,Columbia River Seed,WAM,8,4,116,2020,Nov,WAM-2020-11-05,35,7,3,"Adelphia, NJ"
117,Turf Quality,10/15/20,3,43,Pivot,Columbia River Seed,RMD,8,4,116,2020,Oct,RMD-2020-10-15,10,8,3,"Adelphia, NJ"
117,Turf Quality,10/23/20,3,43,Pivot,Columbia River Seed,RMD,8,4,116,2020,Oct,RMD-2020-10-23,11,8,3,"Adelphia, NJ"
117,Turf Quality,3/30/21,3,43,Pivot,Columbia River Seed,RMD,8,4,116,2021,Mar,RMD-2021-03-30,12,5,4,"Adelphia, NJ"
117,Turf Quality,4/22/21,6,43,Pivot,Columbia River Seed,PLV,8,4,116,2021,Apr,PLV-2021-04-22,6,1,4,"Adelphia, NJ"
117,Turf Quality,5/28/21,4,43,Pivot,Columbia River Seed,SAB,8,4,116,2021,May,SAB-2021-05-28,29,6,4,"Adelphia, NJ"
117,Turf Quality,6/11/21,6,43,Pivot,Columbia River Seed,JEN,8,4,116,2021,Jun,JEN-2021-06-11,2,4,4,"Adelphia, NJ"
117,Turf Quality,7/13/21,6,43,Pivot,Columbia River Seed,PLV,8,4,116,2021,Jul,PLV-2021-07-13,7,3,4,"Adelphia, NJ"
117,Turf Quality,8/11/21,7,43,Pivot,Columbia River Seed,JEN,8,4,116,2021,Aug,JEN-2021-08-11,3,2,4,"Adelphia, NJ"
117,Turf Quality,9/17/21,5,43,Pivot,Columbia River Seed,JEN,8,4,116,2021,Sep,JEN-2021-09-17,4,9,4,"Adelphia, NJ"
117,Turf Quality,10/13/21,2,43,Pivot,Columbia River Seed,SAB,8,4,116,2021,Oct,SAB-2021-10-13,30,8,4,"Adelphia, NJ"
117,Turf Quality,11/18/21,4,43,Pivot,Columbia River Seed,WAM,8,4,116,2021,Nov,WAM-2021-11-18,36,7,4,"Adelphia, NJ"
94,Turf Quality,4/18/18,6,21,BAR PP 7309V,Barenbrug Research,RMD,7,4,93,2018,Apr,RMD-2018-04-18,8,1,1,"Adelphia, NJ"
94,Turf Quality,5/10/18,7,21,BAR PP 7309V,Barenbrug Research,RON,7,4,93,2018,May,RON-2018-05-10,13,6,1,"Adelphia, NJ"
94,Turf Quality,6/7/18,4,21,BAR PP 7309V,Barenbrug Research,RON,7,4,93,2018,Jun,RON-2018-06-07,14,4,1,"Adelphia, NJ"
94,Turf Quality,7/17/18,5,21,BAR PP 7309V,Barenbrug Research,RON,7,4,93,2018,Jul,RON-2018-07-17,15,3,1,"Adelphia, NJ"
94,Turf Quality,8/15/18,8,21,BAR PP 7309V,Barenbrug Research,RMD,7,4,93,2018,Aug,RMD-2018-08-15,9,2,1,"Adelphia, NJ"
94,Turf Quality,9/12/18,5,21,BAR PP 7309V,Barenbrug Research,RON,7,4,93,2018,Sep,RON-2018-09-12,16,9,1,"Adelphia, NJ"
94,Turf Quality,10/2/18,4,21,BAR PP 7309V,Barenbrug Research,RON,7,4,93,2018,Oct,RON-2018-10-02,17,8,1,"Adelphia, NJ"
94,Turf Quality,11/9/18,4,21,BAR PP 7309V,Barenbrug Research,RON,7,4,93,2018,Nov,RON-2018-11-09,18,7,1,"Adelphia, NJ"
94,Turf Quality,4/17/19,5,21,BAR PP 7309V,Barenbrug Research,RON,7,4,93,2019,Apr,RON-2019-04-17,19,1,2,"Adelphia, NJ"
94,Turf Quality,5/2/19,4,21,BAR PP 7309V,Barenbrug Research,RON,7,4,93,2019,May,RON-2019-05-02,20,6,2,"Adelphia, NJ"
94,Turf Quality,6/13/19,4,21,BAR PP 7309V,Barenbrug Research,RON,7,4,93,2019,Jun,RON-2019-06-13,21,4,2,"Adelphia, NJ"
94,Turf Quality,6/17/19,5,21,BAR PP 7309V,Barenbrug Research,SAB,7,4,93,2019,Jun,SAB-2019-06-17,25,4,2,"Adelphia, NJ"
94,Turf Quality,7/17/19,5,21,BAR PP 7309V,Barenbrug Research,RON,7,4,93,2019,Jul,RON-2019-07-17,22,3,2,"Adelphia, NJ"
94,Turf Quality,8/22/19,2,21,BAR PP 7309V,Barenbrug Research,SAB,7,4,93,2019,Aug,SAB-2019-08-22,26,2,2,"Adelphia, NJ"
94,Turf Quality,9/16/19,2,21,BAR PP 7309V,Barenbrug Research,RON,7,4,93,2019,Sep,RON-2019-09-16,23,9,2,"Adelphia, NJ"
94,Turf Quality,10/10/19,2,21,BAR PP 7309V,Barenbrug Research,SAB,7,4,93,2019,Oct,SAB-2019-10-10,27,8,2,"Adelphia, NJ"
94,Turf Quality,11/1/19,1,21,BAR PP 7309V,Barenbrug Research,RON,7,4,93,2019,Nov,RON-2019-11-01,24,7,2,"Adelphia, NJ"
94,Turf Quality,4/28/20,3,21,BAR PP 7309V,Barenbrug Research,WAM,7,4,93,2020,Apr,WAM-2020-04-28,31,1,3,"Adelphia, NJ"
94,Turf Quality,5/18/20,4,21,BAR PP 7309V,Barenbrug Research,SAB,7,4,93,2020,May,SAB-2020-05-18,28,6,3,"Adelphia, NJ"
94,Turf Quality,6/17/20,2,21,BAR PP 7309V,Barenbrug Research,WAM,7,4,93,2020,Jun,WAM-2020-06-17,32,4,3,"Adelphia, NJ"
94,Turf Quality,7/15/20,3,21,BAR PP 7309V,Barenbrug Research,WAM,7,4,93,2020,Jul,WAM-2020-07-15,33,3,3,"Adelphia, NJ"
94,Turf Quality,8/6/20,2,21,BAR PP 7309V,Barenbrug Research,PLV,7,4,93,2020,Aug,PLV-2020-08-06,5,2,3,"Adelphia, NJ"
94,Turf Quality,9/2/20,1,21,BAR PP 7309V,Barenbrug Research,DAS,7,4,93,2020,Sep,DAS-2020-09-02,1,9,3,"Adelphia, NJ"
94,Turf Quality,10/15/20,1,21,BAR PP 7309V,Barenbrug Research,WAM,7,4,93,2020,Oct,WAM-2020-10-15,34,8,3,"Adelphia, NJ"
94,Turf Quality,11/5/20,3,21,BAR PP 7309V,Barenbrug Research,WAM,7,4,93,2020,Nov,WAM-2020-11-05,35,7,3,"Adelphia, NJ"
94,Turf Quality,10/15/20,2,21,BAR PP 7309V,Barenbrug Research,RMD,7,4,93,2020,Oct,RMD-2020-10-15,10,8,3,"Adelphia, NJ"
94,Turf Quality,10/23/20,1,21,BAR PP 7309V,Barenbrug Research,RMD,7,4,93,2020,Oct,RMD-2020-10-23,11,8,3,"Adelphia, NJ"
94,Turf Quality,3/30/21,2,21,BAR PP 7309V,Barenbrug Research,RMD,7,4,93,2021,Mar,RMD-2021-03-30,12,5,4,"Adelphia, NJ"
94,Turf Quality,4/22/21,4,21,BAR PP 7309V,Barenbrug Research,PLV,7,4,93,2021,Apr,PLV-2021-04-22,6,1,4,"Adelphia, NJ"
94,Turf Quality,5/28/21,4,21,BAR PP 7309V,Barenbrug Research,SAB,7,4,93,2021,May,SAB-2021-05-28,29,6,4,"Adelphia, NJ"
94,Turf Quality,6/11/21,4,21,BAR PP 7309V,Barenbrug Research,JEN,7,4,93,2021,Jun,JEN-2021-06-11,2,4,4,"Adelphia, NJ"
94,Turf Quality,7/13/21,4,21,BAR PP 7309V,Barenbrug Research,PLV,7,4,93,2021,Jul,PLV-2021-07-13,7,3,4,"Adelphia, NJ"
94,Turf Quality,8/11/21,4,21,BAR PP 7309V,Barenbrug Research,JEN,7,4,93,2021,Aug,JEN-2021-08-11,3,2,4,"Adelphia, NJ"
94,Turf Quality,9/17/21,2,21,BAR PP 7309V,Barenbrug Research,JEN,7,4,93,2021,Sep,JEN-2021-09-17,4,9,4,"Adelphia, NJ"
94,Turf Quality,10/13/21,2,21,BAR PP 7309V,Barenbrug Research,SAB,7,4,93,2021,Oct,SAB-2021-10-13,30,8,4,"Adelphia, NJ"
94,Turf Quality,11/18/21,4,21,BAR PP 7309V,Barenbrug Research,WAM,7,4,93,2021,Nov,WAM-2021-11-18,36,7,4,"Adelphia, NJ"
87,Turf Quality,4/18/18,4,87,PST-K15-172,Pure Seed Testing Inc.,RMD,6,4,87,2018,Apr,RMD-2018-04-18,8,1,1,"Adelphia, NJ"
87,Turf Quality,5/10/18,6,87,PST-K15-172,Pure Seed Testing Inc.,RON,6,4,87,2018,May,RON-2018-05-10,13,6,1,"Adelphia, NJ"
87,Turf Quality,6/7/18,5,87,PST-K15-172,Pure Seed Testing Inc.,RON,6,4,87,2018,Jun,RON-2018-06-07,14,4,1,"Adelphia, NJ"
87,Turf Quality,7/17/18,7,87,PST-K15-172,Pure Seed Testing Inc.,RON,6,4,87,2018,Jul,RON-2018-07-17,15,3,1,"Adelphia, NJ"
87,Turf Quality,8/15/18,8,87,PST-K15-172,Pure Seed Testing Inc.,RMD,6,4,87,2018,Aug,RMD-2018-08-15,9,2,1,"Adelphia, NJ"
87,Turf Quality,9/12/18,6,87,PST-K15-172,Pure Seed Testing Inc.,RON,6,4,87,2018,Sep,RON-2018-09-12,16,9,1,"Adelphia, NJ"
87,Turf Quality,10/2/18,7,87,PST-K15-172,Pure Seed Testing Inc.,RON,6,4,87,2018,Oct,RON-2018-10-02,17,8,1,"Adelphia, NJ"
87,Turf Quality,11/9/18,8,87,PST-K15-172,Pure Seed Testing Inc.,RON,6,4,87,2018,Nov,RON-2018-11-09,18,7,1,"Adelphia, NJ"
87,Turf Quality,4/17/19,6,87,PST-K15-172,Pure Seed Testing Inc.,RON,6,4,87,2019,Apr,RON-2019-04-17,19,1,2,"Adelphia, NJ"
87,Turf Quality,5/2/19,5,87,PST-K15-172,Pure Seed Testing Inc.,RON,6,4,87,2019,May,RON-2019-05-02,20,6,2,"Adelphia, NJ"
87,Turf Quality,6/13/19,5,87,PST-K15-172,Pure Seed Testing Inc.,RON,6,4,87,2019,Jun,RON-2019-06-13,21,4,2,"Adelphia, NJ"
87,Turf Quality,6/17/19,5,87,PST-K15-172,Pure Seed Testing Inc.,SAB,6,4,87,2019,Jun,SAB-2019-06-17,25,4,2,"Adelphia, NJ"
87,Turf Quality,7/17/19,6,87,PST-K15-172,Pure Seed Testing Inc.,RON,6,4,87,2019,Jul,RON-2019-07-17,22,3,2,"Adelphia, NJ"
87,Turf Quality,8/22/19,6,87,PST-K15-172,Pure Seed Testing Inc.,SAB,6,4,87,2019,Aug,SAB-2019-08-22,26,2,2,"Adelphia, NJ"
87,Turf Quality,9/16/19,8,87,PST-K15-172,Pure Seed Testing Inc.,RON,6,4,87,2019,Sep,RON-2019-09-16,23,9,2,"Adelphia, NJ"
87,Turf Quality,10/10/19,5,87,PST-K15-172,Pure Seed Testing Inc.,SAB,6,4,87,2019,Oct,SAB-2019-10-10,27,8,2,"Adelphia, NJ"
87,Turf Quality,11/1/19,5,87,PST-K15-172,Pure Seed Testing Inc.,RON,6,4,87,2019,Nov,RON-2019-11-01,24,7,2,"Adelphia, NJ"
87,Turf Quality,4/28/20,5,87,PST-K15-172,Pure Seed Testing Inc.,WAM,6,4,87,2020,Apr,WAM-2020-04-28,31,1,3,"Adelphia, NJ"
87,Turf Quality,5/18/20,6,87,PST-K15-172,Pure Seed Testing Inc.,SAB,6,4,87,2020,May,SAB-2020-05-18,28,6,3,"Adelphia, NJ"
87,Turf Quality,6/17/20,5,87,PST-K15-172,Pure Seed Testing Inc.,WAM,6,4,87,2020,Jun,WAM-2020-06-17,32,4,3,"Adelphia, NJ"
87,Turf Quality,7/15/20,6,87,PST-K15-172,Pure Seed Testing Inc.,WAM,6,4,87,2020,Jul,WAM-2020-07-15,33,3,3,"Adelphia, NJ"
87,Turf Quality,8/6/20,7,87,PST-K15-172,Pure Seed Testing Inc.,PLV,6,4,87,2020,Aug,PLV-2020-08-06,5,2,3,"Adelphia, NJ"
87,Turf Quality,9/2/20,7,87,PST-K15-172,Pure Seed Testing Inc.,DAS,6,4,87,2020,Sep,DAS-2020-09-02,1,9,3,"Adelphia, NJ"
87,Turf Quality,10/15/20,6,87,PST-K15-172,Pure Seed Testing Inc.,WAM,6,4,87,2020,Oct,WAM-2020-10-15,34,8,3,"Adelphia, NJ"
87,Turf Quality,11/5/20,6,87,PST-K15-172,Pure Seed Testing Inc.,WAM,6,4,87,2020,Nov,WAM-2020-11-05,35,7,3,"Adelphia, NJ"
87,Turf Quality,10/15/20,8,87,PST-K15-172,Pure Seed Testing Inc.,RMD,6,4,87,2020,Oct,RMD-2020-10-15,10,8,3,"Adelphia, NJ"
87,Turf Quality,10/23/20,8,87,PST-K15-172,Pure Seed Testing Inc.,RMD,6,4,87,2020,Oct,RMD-2020-10-23,11,8,3,"Adelphia, NJ"
87,Turf Quality,3/30/21,7,87,PST-K15-172,Pure Seed Testing Inc.,RMD,6,4,87,2021,Mar,RMD-2021-03-30,12,5,4,"Adelphia, NJ"
87,Turf Quality,4/22/21,9,87,PST-K15-172,Pure Seed Testing Inc.,PLV,6,4,87,2021,Apr,PLV-2021-04-22,6,1,4,"Adelphia, NJ"
87,Turf Quality,5/28/21,4,87,PST-K15-172,Pure Seed Testing Inc.,SAB,6,4,87,2021,May,SAB-2021-05-28,29,6,4,"Adelphia, NJ"
87,Turf Quality,6/11/21,6,87,PST-K15-172,Pure Seed Testing Inc.,JEN,6,4,87,2021,Jun,JEN-2021-06-11,2,4,4,"Adelphia, NJ"
87,Turf Quality,7/13/21,5,87,PST-K15-172,Pure Seed Testing Inc.,PLV,6,4,87,2021,Jul,PLV-2021-07-13,7,3,4,"Adelphia, NJ"
87,Turf Quality,8/11/21,6,87,PST-K15-172,Pure Seed Testing Inc.,JEN,6,4,87,2021,Aug,JEN-2021-08-11,3,2,4,"Adelphia, NJ"
87,Turf Quality,9/17/21,7,87,PST-K15-172,Pure Seed Testing Inc.,JEN,6,4,87,2021,Sep,JEN-2021-09-17,4,9,4,"Adelphia, NJ"
87,Turf Quality,10/13/21,5,87,PST-K15-172,Pure Seed Testing Inc.,SAB,6,4,87,2021,Oct,SAB-2021-10-13,30,8,4,"Adelphia, NJ"
87,Turf Quality,11/18/21,7,87,PST-K15-172,Pure Seed Testing Inc.,WAM,6,4,87,2021,Nov,WAM-2021-11-18,36,7,4,"Adelphia, NJ"
64,Turf Quality,4/18/18,4,64,A16-1,Mountain View Seeds,RMD,5,4,64,2018,Apr,RMD-2018-04-18,8,1,1,"Adelphia, NJ"
64,Turf Quality,5/10/18,7,64,A16-1,Mountain View Seeds,RON,5,4,64,2018,May,RON-2018-05-10,13,6,1,"Adelphia, NJ"
64,Turf Quality,6/7/18,6,64,A16-1,Mountain View Seeds,RON,5,4,64,2018,Jun,RON-2018-06-07,14,4,1,"Adelphia, NJ"
64,Turf Quality,7/17/18,4,64,A16-1,Mountain View Seeds,RON,5,4,64,2018,Jul,RON-2018-07-17,15,3,1,"Adelphia, NJ"
64,Turf Quality,8/15/18,4,64,A16-1,Mountain View Seeds,RMD,5,4,64,2018,Aug,RMD-2018-08-15,9,2,1,"Adelphia, NJ"
64,Turf Quality,9/12/18,2,64,A16-1,Mountain View Seeds,RON,5,4,64,2018,Sep,RON-2018-09-12,16,9,1,"Adelphia, NJ"
64,Turf Quality,10/2/18,3,64,A16-1,Mountain View Seeds,RON,5,4,64,2018,Oct,RON-2018-10-02,17,8,1,"Adelphia, NJ"
64,Turf Quality,11/9/18,3,64,A16-1,Mountain View Seeds,RON,5,4,64,2018,Nov,RON-2018-11-09,18,7,1,"Adelphia, NJ"
64,Turf Quality,4/17/19,4,64,A16-1,Mountain View Seeds,RON,5,4,64,2019,Apr,RON-2019-04-17,19,1,2,"Adelphia, NJ"
64,Turf Quality,5/2/19,4,64,A16-1,Mountain View Seeds,RON,5,4,64,2019,May,RON-2019-05-02,20,6,2,"Adelphia, NJ"
64,Turf Quality,6/13/19,4,64,A16-1,Mountain View Seeds,RON,5,4,64,2019,Jun,RON-2019-06-13,21,4,2,"Adelphia, NJ"
64,Turf Quality,6/17/19,4,64,A16-1,Mountain View Seeds,SAB,5,4,64,2019,Jun,SAB-2019-06-17,25,4,2,"Adelphia, NJ"
64,Turf Quality,7/17/19,4,64,A16-1,Mountain View Seeds,RON,5,4,64,2019,Jul,RON-2019-07-17,22,3,2,"Adelphia, NJ"
64,Turf Quality,8/22/19,2,64,A16-1,Mountain View Seeds,SAB,5,4,64,2019,Aug,SAB-2019-08-22,26,2,2,"Adelphia, NJ"
64,Turf Quality,9/16/19,1,64,A16-1,Mountain View Seeds,RON,5,4,64,2019,Sep,RON-2019-09-16,23,9,2,"Adelphia, NJ"
64,Turf Quality,10/10/19,1,64,A16-1,Mountain View Seeds,SAB,5,4,64,2019,Oct,SAB-2019-10-10,27,8,2,"Adelphia, NJ"
64,Turf Quality,11/1/19,1,64,A16-1,Mountain View Seeds,RON,5,4,64,2019,Nov,RON-2019-11-01,24,7,2,"Adelphia, NJ"
64,Turf Quality,4/28/20,2,64,A16-1,Mountain View Seeds,WAM,5,4,64,2020,Apr,WAM-2020-04-28,31,1,3,"Adelphia, NJ"
64,Turf Quality,5/18/20,1,64,A16-1,Mountain View Seeds,SAB,5,4,64,2020,May,SAB-2020-05-18,28,6,3,"Adelphia, NJ"
64,Turf Quality,6/17/20,3,64,A16-1,Mountain View Seeds,WAM,5,4,64,2020,Jun,WAM-2020-06-17,32,4,3,"Adelphia, NJ"
64,Turf Quality,7/15/20,2,64,A16-1,Mountain View Seeds,WAM,5,4,64,2020,Jul,WAM-2020-07-15,33,3,3,"Adelphia, NJ"
64,Turf Quality,8/6/20,2,64,A16-1,Mountain View Seeds,PLV,5,4,64,2020,Aug,PLV-2020-08-06,5,2,3,"Adelphia, NJ"
64,Turf Quality,9/2/20,1,64,A16-1,Mountain View Seeds,DAS,5,4,64,2020,Sep,DAS-2020-09-02,1,9,3,"Adelphia, NJ"
64,Turf Quality,10/15/20,1,64,A16-1,Mountain View Seeds,WAM,5,4,64,2020,Oct,WAM-2020-10-15,34,8,3,"Adelphia, NJ"
64,Turf Quality,11/5/20,2,64,A16-1,Mountain View Seeds,WAM,5,4,64,2020,Nov,WAM-2020-11-05,35,7,3,"Adelphia, NJ"
64,Turf Quality,10/15/20,1,64,A16-1,Mountain View Seeds,RMD,5,4,64,2020,Oct,RMD-2020-10-15,10,8,3,"Adelphia, NJ"
64,Turf Quality,10/23/20,1,64,A16-1,Mountain View Seeds,RMD,5,4,64,2020,Oct,RMD-2020-10-23,11,8,3,"Adelphia, NJ"
64,Turf Quality,3/30/21,2,64,A16-1,Mountain View Seeds,RMD,5,4,64,2021,Mar,RMD-2021-03-30,12,5,4,"Adelphia, NJ"
64,Turf Quality,4/22/21,2,64,A16-1,Mountain View Seeds,PLV,5,4,64,2021,Apr,PLV-2021-04-22,6,1,4,"Adelphia, NJ"
64,Turf Quality,5/28/21,3,64,A16-1,Mountain View Seeds,SAB,5,4,64,2021,May,SAB-2021-05-28,29,6,4,"Adelphia, NJ"
64,Turf Quality,6/11/21,3,64,A16-1,Mountain View Seeds,JEN,5,4,64,2021,Jun,JEN-2021-06-11,2,4,4,"Adelphia, NJ"
64,Turf Quality,7/13/21,2,64,A16-1,Mountain View Seeds,PLV,5,4,64,2021,Jul,PLV-2021-07-13,7,3,4,"Adelphia, NJ"
64,Turf Quality,8/11/21,4,64,A16-1,Mountain View Seeds,JEN,5,4,64,2021,Aug,JEN-2021-08-11,3,2,4,"Adelphia, NJ"
64,Turf Quality,9/17/21,1,64,A16-1,Mountain View Seeds,JEN,5,4,64,2021,Sep,JEN-2021-09-17,4,9,4,"Adelphia, NJ"
64,Turf Quality,10/13/21,1,64,A16-1,Mountain View Seeds,SAB,5,4,64,2021,Oct,SAB-2021-10-13,30,8,4,"Adelphia, NJ"
64,Turf Quality,11/18/21,4,64,A16-1,Mountain View Seeds,WAM,5,4,64,2021,Nov,WAM-2021-11-18,36,7,4,"Adelphia, NJ"
57,Turf Quality,4/18/18,6,57,DLFPS-340/3548,DLF Pickseed USA,RMD,4,4,57,2018,Apr,RMD-2018-04-18,8,1,1,"Adelphia, NJ"
57,Turf Quality,5/10/18,8,57,DLFPS-340/3548,DLF Pickseed USA,RON,4,4,57,2018,May,RON-2018-05-10,13,6,1,"Adelphia, NJ"
57,Turf Quality,6/7/18,5,57,DLFPS-340/3548,DLF Pickseed USA,RON,4,4,57,2018,Jun,RON-2018-06-07,14,4,1,"Adelphia, NJ"
57,Turf Quality,7/17/18,7,57,DLFPS-340/3548,DLF Pickseed USA,RON,4,4,57,2018,Jul,RON-2018-07-17,15,3,1,"Adelphia, NJ"
57,Turf Quality,8/15/18,7,57,DLFPS-340/3548,DLF Pickseed USA,RMD,4,4,57,2018,Aug,RMD-2018-08-15,9,2,1,"Adelphia, NJ"
57,Turf Quality,9/12/18,5,57,DLFPS-340/3548,DLF Pickseed USA,RON,4,4,57,2018,Sep,RON-2018-09-12,16,9,1,"Adelphia, NJ"
57,Turf Quality,10/2/18,5,57,DLFPS-340/3548,DLF Pickseed USA,RON,4,4,57,2018,Oct,RON-2018-10-02,17,8,1,"Adelphia, NJ"
57,Turf Quality,11/9/18,5,57,DLFPS-340/3548,DLF Pickseed USA,RON,4,4,57,2018,Nov,RON-2018-11-09,18,7,1,"Adelphia, NJ"
57,Turf Quality,4/17/19,6,57,DLFPS-340/3548,DLF Pickseed USA,RON,4,4,57,2019,Apr,RON-2019-04-17,19,1,2,"Adelphia, NJ"
57,Turf Quality,5/2/19,5,57,DLFPS-340/3548,DLF Pickseed USA,RON,4,4,57,2019,May,RON-2019-05-02,20,6,2,"Adelphia, NJ"
57,Turf Quality,6/13/19,5,57,DLFPS-340/3548,DLF Pickseed USA,RON,4,4,57,2019,Jun,RON-2019-06-13,21,4,2,"Adelphia, NJ"
57,Turf Quality,6/17/19,4,57,DLFPS-340/3548,DLF Pickseed USA,SAB,4,4,57,2019,Jun,SAB-2019-06-17,25,4,2,"Adelphia, NJ"
57,Turf Quality,7/17/19,5,57,DLFPS-340/3548,DLF Pickseed USA,RON,4,4,57,2019,Jul,RON-2019-07-17,22,3,2,"Adelphia, NJ"
57,Turf Quality,8/22/19,4,57,DLFPS-340/3548,DLF Pickseed USA,SAB,4,4,57,2019,Aug,SAB-2019-08-22,26,2,2,"Adelphia, NJ"
57,Turf Quality,9/16/19,5,57,DLFPS-340/3548,DLF Pickseed USA,RON,4,4,57,2019,Sep,RON-2019-09-16,23,9,2,"Adelphia, NJ"
57,Turf Quality,10/10/19,3,57,DLFPS-340/3548,DLF Pickseed USA,SAB,4,4,57,2019,Oct,SAB-2019-10-10,27,8,2,"Adelphia, NJ"
57,Turf Quality,11/1/19,5,57,DLFPS-340/3548,DLF Pickseed USA,RON,4,4,57,2019,Nov,RON-2019-11-01,24,7,2,"Adelphia, NJ"
57,Turf Quality,4/28/20,4,57,DLFPS-340/3548,DLF Pickseed USA,WAM,4,4,57,2020,Apr,WAM-2020-04-28,31,1,3,"Adelphia, NJ"
57,Turf Quality,5/18/20,5,57,DLFPS-340/3548,DLF Pickseed USA,SAB,4,4,57,2020,May,SAB-2020-05-18,28,6,3,"Adelphia, NJ"
57,Turf Quality,6/17/20,4,57,DLFPS-340/3548,DLF Pickseed USA,WAM,4,4,57,2020,Jun,WAM-2020-06-17,32,4,3,"Adelphia, NJ"
57,Turf Quality,7/15/20,4,57,DLFPS-340/3548,DLF Pickseed USA,WAM,4,4,57,2020,Jul,WAM-2020-07-15,33,3,3,"Adelphia, NJ"
57,Turf Quality,8/6/20,4,57,DLFPS-340/3548,DLF Pickseed USA,PLV,4,4,57,2020,Aug,PLV-2020-08-06,5,2,3,"Adelphia, NJ"
57,Turf Quality,9/2/20,4,57,DLFPS-340/3548,DLF Pickseed USA,DAS,4,4,57,2020,Sep,DAS-2020-09-02,1,9,3,"Adelphia, NJ"
57,Turf Quality,10/15/20,3,57,DLFPS-340/3548,DLF Pickseed USA,WAM,4,4,57,2020,Oct,WAM-2020-10-15,34,8,3,"Adelphia, NJ"
57,Turf Quality,11/5/20,3,57,DLFPS-340/3548,DLF Pickseed USA,WAM,4,4,57,2020,Nov,WAM-2020-11-05,35,7,3,"Adelphia, NJ"
57,Turf Quality,10/15/20,4,57,DLFPS-340/3548,DLF Pickseed USA,RMD,4,4,57,2020,Oct,RMD-2020-10-15,10,8,3,"Adelphia, NJ"
57,Turf Quality,10/23/20,3,57,DLFPS-340/3548,DLF Pickseed USA,RMD,4,4,57,2020,Oct,RMD-2020-10-23,11,8,3,"Adelphia, NJ"
57,Turf Quality,3/30/21,4,57,DLFPS-340/3548,DLF Pickseed USA,RMD,4,4,57,2021,Mar,RMD-2021-03-30,12,5,4,"Adelphia, NJ"
57,Turf Quality,4/22/21,7,57,DLFPS-340/3548,DLF Pickseed USA,PLV,4,4,57,2021,Apr,PLV-2021-04-22,6,1,4,"Adelphia, NJ"
57,Turf Quality,5/28/21,5,57,DLFPS-340/3548,DLF Pickseed USA,SAB,4,4,57,2021,May,SAB-2021-05-28,29,6,4,"Adelphia, NJ"
57,Turf Quality,6/11/21,4,57,DLFPS-340/3548,DLF Pickseed USA,JEN,4,4,57,2021,Jun,JEN-2021-06-11,2,4,4,"Adelphia, NJ"
57,Turf Quality,7/13/21,4,57,DLFPS-340/3548,DLF Pickseed USA,PLV,4,4,57,2021,Jul,PLV-2021-07-13,7,3,4,"Adelphia, NJ"
57,Turf Quality,8/11/21,3,57,DLFPS-340/3548,DLF Pickseed USA,JEN,4,4,57,2021,Aug,JEN-2021-08-11,3,2,4,"Adelphia, NJ"
57,Turf Quality,9/17/21,3,57,DLFPS-340/3548,DLF Pickseed USA,JEN,4,4,57,2021,Sep,JEN-2021-09-17,4,9,4,"Adelphia, NJ"
57,Turf Quality,10/13/21,2,57,DLFPS-340/3548,DLF Pickseed USA,SAB,4,4,57,2021,Oct,SAB-2021-10-13,30,8,4,"Adelphia, NJ"
57,Turf Quality,11/18/21,5,57,DLFPS-340/3548,DLF Pickseed USA,WAM,4,4,57,2021,Nov,WAM-2021-11-18,36,7,4,"Adelphia, NJ"
34,Turf Quality,4/18/18,2,34,NAI-14-122,Columbia River Seed,RMD,3,4,34,2018,Apr,RMD-2018-04-18,8,1,1,"Adelphia, NJ"
34,Turf Quality,5/10/18,5,34,NAI-14-122,Columbia River Seed,RON,3,4,34,2018,May,RON-2018-05-10,13,6,1,"Adelphia, NJ"
34,Turf Quality,6/7/18,7,34,NAI-14-122,Columbia River Seed,RON,3,4,34,2018,Jun,RON-2018-06-07,14,4,1,"Adelphia, NJ"
34,Turf Quality,7/17/18,6,34,NAI-14-122,Columbia River Seed,RON,3,4,34,2018,Jul,RON-2018-07-17,15,3,1,"Adelphia, NJ"
34,Turf Quality,8/15/18,6,34,NAI-14-122,Columbia River Seed,RMD,3,4,34,2018,Aug,RMD-2018-08-15,9,2,1,"Adelphia, NJ"
34,Turf Quality,9/12/18,4,34,NAI-14-122,Columbia River Seed,RON,3,4,34,2018,Sep,RON-2018-09-12,16,9,1,"Adelphia, NJ"
34,Turf Quality,10/2/18,4,34,NAI-14-122,Columbia River Seed,RON,3,4,34,2018,Oct,RON-2018-10-02,17,8,1,"Adelphia, NJ"
34,Turf Quality,11/9/18,3,34,NAI-14-122,Columbia River Seed,RON,3,4,34,2018,Nov,RON-2018-11-09,18,7,1,"Adelphia, NJ"
34,Turf Quality,4/17/19,3,34,NAI-14-122,Columbia River Seed,RON,3,4,34,2019,Apr,RON-2019-04-17,19,1,2,"Adelphia, NJ"
34,Turf Quality,5/2/19,4,34,NAI-14-122,Columbia River Seed,RON,3,4,34,2019,May,RON-2019-05-02,20,6,2,"Adelphia, NJ"
34,Turf Quality,6/13/19,4,34,NAI-14-122,Columbia River Seed,RON,3,4,34,2019,Jun,RON-2019-06-13,21,4,2,"Adelphia, NJ"
34,Turf Quality,6/17/19,4,34,NAI-14-122,Columbia River Seed,SAB,3,4,34,2019,Jun,SAB-2019-06-17,25,4,2,"Adelphia, NJ"
34,Turf Quality,7/17/19,4,34,NAI-14-122,Columbia River Seed,RON,3,4,34,2019,Jul,RON-2019-07-17,22,3,2,"Adelphia, NJ"
34,Turf Quality,8/22/19,4,34,NAI-14-122,Columbia River Seed,SAB,3,4,34,2019,Aug,SAB-2019-08-22,26,2,2,"Adelphia, NJ"
34,Turf Quality,9/16/19,5,34,NAI-14-122,Columbia River Seed,RON,3,4,34,2019,Sep,RON-2019-09-16,23,9,2,"Adelphia, NJ"
34,Turf Quality,10/10/19,3,34,NAI-14-122,Columbia River Seed,SAB,3,4,34,2019,Oct,SAB-2019-10-10,27,8,2,"Adelphia, NJ"
34,Turf Quality,11/1/19,4,34,NAI-14-122,Columbia River Seed,RON,3,4,34,2019,Nov,RON-2019-11-01,24,7,2,"Adelphia, NJ"
34,Turf Quality,4/28/20,5,34,NAI-14-122,Columbia River Seed,WAM,3,4,34,2020,Apr,WAM-2020-04-28,31,1,3,"Adelphia, NJ"
34,Turf Quality,5/18/20,4,34,NAI-14-122,Columbia River Seed,SAB,3,4,34,2020,May,SAB-2020-05-18,28,6,3,"Adelphia, NJ"
34,Turf Quality,6/17/20,5,34,NAI-14-122,Columbia River Seed,WAM,3,4,34,2020,Jun,WAM-2020-06-17,32,4,3,"Adelphia, NJ"
34,Turf Quality,7/15/20,6,34,NAI-14-122,Columbia River Seed,WAM,3,4,34,2020,Jul,WAM-2020-07-15,33,3,3,"Adelphia, NJ"
34,Turf Quality,8/6/20,4,34,NAI-14-122,Columbia River Seed,PLV,3,4,34,2020,Aug,PLV-2020-08-06,5,2,3,"Adelphia, NJ"
34,Turf Quality,9/2/20,4,34,NAI-14-122,Columbia River Seed,DAS,3,4,34,2020,Sep,DAS-2020-09-02,1,9,3,"Adelphia, NJ"
34,Turf Quality,10/15/20,3,34,NAI-14-122,Columbia River Seed,WAM,3,4,34,2020,Oct,WAM-2020-10-15,34,8,3,"Adelphia, NJ"
34,Turf Quality,11/5/20,6,34,NAI-14-122,Columbia River Seed,WAM,3,4,34,2020,Nov,WAM-2020-11-05,35,7,3,"Adelphia, NJ"
34,Turf Quality,10/15/20,5,34,NAI-14-122,Columbia River Seed,RMD,3,4,34,2020,Oct,RMD-2020-10-15,10,8,3,"Adelphia, NJ"
34,Turf Quality,10/23/20,6,34,NAI-14-122,Columbia River Seed,RMD,3,4,34,2020,Oct,RMD-2020-10-23,11,8,3,"Adelphia, NJ"
34,Turf Quality,3/30/21,3,34,NAI-14-122,Columbia River Seed,RMD,3,4,34,2021,Mar,RMD-2021-03-30,12,5,4,"Adelphia, NJ"
34,Turf Quality,4/22/21,6,34,NAI-14-122,Columbia River Seed,PLV,3,4,34,2021,Apr,PLV-2021-04-22,6,1,4,"Adelphia, NJ"
34,Turf Quality,5/28/21,4,34,NAI-14-122,Columbia River Seed,SAB,3,4,34,2021,May,SAB-2021-05-28,29,6,4,"Adelphia, NJ"
34,Turf Quality,6/11/21,4,34,NAI-14-122,Columbia River Seed,JEN,3,4,34,2021,Jun,JEN-2021-06-11,2,4,4,"Adelphia, NJ"
34,Turf Quality,7/13/21,5,34,NAI-14-122,Columbia River Seed,PLV,3,4,34,2021,Jul,PLV-2021-07-13,7,3,4,"Adelphia, NJ"
34,Turf Quality,8/11/21,4,34,NAI-14-122,Columbia River Seed,JEN,3,4,34,2021,Aug,JEN-2021-08-11,3,2,4,"Adelphia, NJ"
34,Turf Quality,9/17/21,3,34,NAI-14-122,Columbia River Seed,JEN,3,4,34,2021,Sep,JEN-2021-09-17,4,9,4,"Adelphia, NJ"
34,Turf Quality,10/13/21,2,34,NAI-14-122,Columbia River Seed,SAB,3,4,34,2021,Oct,SAB-2021-10-13,30,8,4,"Adelphia, NJ"
34,Turf Quality,11/18/21,7,34,NAI-14-122,Columbia River Seed,WAM,3,4,34,2021,Nov,WAM-2021-11-18,36,7,4,"Adelphia, NJ"
27,Turf Quality,4/18/18,7,27,Barserati (BAR PP 110358),Barenbrug Research,RMD,2,4,27,2018,Apr,RMD-2018-04-18,8,1,1,"Adelphia, NJ"
27,Turf Quality,5/10/18,7,27,Barserati (BAR PP 110358),Barenbrug Research,RON,2,4,27,2018,May,RON-2018-05-10,13,6,1,"Adelphia, NJ"
27,Turf Quality,6/7/18,5,27,Barserati (BAR PP 110358),Barenbrug Research,RON,2,4,27,2018,Jun,RON-2018-06-07,14,4,1,"Adelphia, NJ"
27,Turf Quality,7/17/18,8,27,Barserati (BAR PP 110358),Barenbrug Research,RON,2,4,27,2018,Jul,RON-2018-07-17,15,3,1,"Adelphia, NJ"
27,Turf Quality,8/15/18,9,27,Barserati (BAR PP 110358),Barenbrug Research,RMD,2,4,27,2018,Aug,RMD-2018-08-15,9,2,1,"Adelphia, NJ"
27,Turf Quality,9/12/18,8,27,Barserati (BAR PP 110358),Barenbrug Research,RON,2,4,27,2018,Sep,RON-2018-09-12,16,9,1,"Adelphia, NJ"
27,Turf Quality,10/2/18,8,27,Barserati (BAR PP 110358),Barenbrug Research,RON,2,4,27,2018,Oct,RON-2018-10-02,17,8,1,"Adelphia, NJ"
27,Turf Quality,11/9/18,7,27,Barserati (BAR PP 110358),Barenbrug Research,RON,2,4,27,2018,Nov,RON-2018-11-09,18,7,1,"Adelphia, NJ"
27,Turf Quality,4/17/19,7,27,Barserati (BAR PP 110358),Barenbrug Research,RON,2,4,27,2019,Apr,RON-2019-04-17,19,1,2,"Adelphia, NJ"
27,Turf Quality,5/2/19,7,27,Barserati (BAR PP 110358),Barenbrug Research,RON,2,4,27,2019,May,RON-2019-05-02,20,6,2,"Adelphia, NJ"
27,Turf Quality,6/13/19,8,27,Barserati (BAR PP 110358),Barenbrug Research,RON,2,4,27,2019,Jun,RON-2019-06-13,21,4,2,"Adelphia, NJ"
27,Turf Quality,6/17/19,7,27,Barserati (BAR PP 110358),Barenbrug Research,SAB,2,4,27,2019,Jun,SAB-2019-06-17,25,4,2,"Adelphia, NJ"
27,Turf Quality,7/17/19,7,27,Barserati (BAR PP 110358),Barenbrug Research,RON,2,4,27,2019,Jul,RON-2019-07-17,22,3,2,"Adelphia, NJ"
27,Turf Quality,8/22/19,7,27,Barserati (BAR PP 110358),Barenbrug Research,SAB,2,4,27,2019,Aug,SAB-2019-08-22,26,2,2,"Adelphia, NJ"
27,Turf Quality,9/16/19,8,27,Barserati (BAR PP 110358),Barenbrug Research,RON,2,4,27,2019,Sep,RON-2019-09-16,23,9,2,"Adelphia, NJ"
27,Turf Quality,10/10/19,4,27,Barserati (BAR PP 110358),Barenbrug Research,SAB,2,4,27,2019,Oct,SAB-2019-10-10,27,8,2,"Adelphia, NJ"
27,Turf Quality,11/1/19,6,27,Barserati (BAR PP 110358),Barenbrug Research,RON,2,4,27,2019,Nov,RON-2019-11-01,24,7,2,"Adelphia, NJ"
27,Turf Quality,4/28/20,6,27,Barserati (BAR PP 110358),Barenbrug Research,WAM,2,4,27,2020,Apr,WAM-2020-04-28,31,1,3,"Adelphia, NJ"
27,Turf Quality,5/18/20,6,27,Barserati (BAR PP 110358),Barenbrug Research,SAB,2,4,27,2020,May,SAB-2020-05-18,28,6,3,"Adelphia, NJ"
27,Turf Quality,6/17/20,7,27,Barserati (BAR PP 110358),Barenbrug Research,WAM,2,4,27,2020,Jun,WAM-2020-06-17,32,4,3,"Adelphia, NJ"
27,Turf Quality,7/15/20,5,27,Barserati (BAR PP 110358),Barenbrug Research,WAM,2,4,27,2020,Jul,WAM-2020-07-15,33,3,3,"Adelphia, NJ"
27,Turf Quality,8/6/20,7,27,Barserati (BAR PP 110358),Barenbrug Research,PLV,2,4,27,2020,Aug,PLV-2020-08-06,5,2,3,"Adelphia, NJ"
27,Turf Quality,9/2/20,7,27,Barserati (BAR PP 110358),Barenbrug Research,DAS,2,4,27,2020,Sep,DAS-2020-09-02,1,9,3,"Adelphia, NJ"
27,Turf Quality,10/15/20,7,27,Barserati (BAR PP 110358),Barenbrug Research,WAM,2,4,27,2020,Oct,WAM-2020-10-15,34,8,3,"Adelphia, NJ"
27,Turf Quality,11/5/20,6,27,Barserati (BAR PP 110358),Barenbrug Research,WAM,2,4,27,2020,Nov,WAM-2020-11-05,35,7,3,"Adelphia, NJ"
27,Turf Quality,10/15/20,8,27,Barserati (BAR PP 110358),Barenbrug Research,RMD,2,4,27,2020,Oct,RMD-2020-10-15,10,8,3,"Adelphia, NJ"
27,Turf Quality,10/23/20,7,27,Barserati (BAR PP 110358),Barenbrug Research,RMD,2,4,27,2020,Oct,RMD-2020-10-23,11,8,3,"Adelphia, NJ"
27,Turf Quality,3/30/21,6,27,Barserati (BAR PP 110358),Barenbrug Research,RMD,2,4,27,2021,Mar,RMD-2021-03-30,12,5,4,"Adelphia, NJ"
27,Turf Quality,4/22/21,8,27,Barserati (BAR PP 110358),Barenbrug Research,PLV,2,4,27,2021,Apr,PLV-2021-04-22,6,1,4,"Adelphia, NJ"
27,Turf Quality,5/28/21,6,27,Barserati (BAR PP 110358),Barenbrug Research,SAB,2,4,27,2021,May,SAB-2021-05-28,29,6,4,"Adelphia, NJ"
27,Turf Quality,6/11/21,6,27,Barserati (BAR PP 110358),Barenbrug Research,JEN,2,4,27,2021,Jun,JEN-2021-06-11,2,4,4,"Adelphia, NJ"
27,Turf Quality,7/13/21,8,27,Barserati (BAR PP 110358),Barenbrug Research,PLV,2,4,27,2021,Jul,PLV-2021-07-13,7,3,4,"Adelphia, NJ"
27,Turf Quality,8/11/21,8,27,Barserati (BAR PP 110358),Barenbrug Research,JEN,2,4,27,2021,Aug,JEN-2021-08-11,3,2,4,"Adelphia, NJ"
27,Turf Quality,9/17/21,9,27,Barserati (BAR PP 110358),Barenbrug Research,JEN,2,4,27,2021,Sep,JEN-2021-09-17,4,9,4,"Adelphia, NJ"
27,Turf Quality,10/13/21,7,27,Barserati (BAR PP 110358),Barenbrug Research,SAB,2,4,27,2021,Oct,SAB-2021-10-13,30,8,4,"Adelphia, NJ"
27,Turf Quality,11/18/21,7,27,Barserati (BAR PP 110358),Barenbrug Research,WAM,2,4,27,2021,Nov,WAM-2021-11-18,36,7,4,"Adelphia, NJ"
4,Turf Quality,4/18/18,5,4,Syrah (LTP-11-41),Lebanon Seaboard Corp.,RMD,1,4,4,2018,Apr,RMD-2018-04-18,8,1,1,"Adelphia, NJ"
4,Turf Quality,5/10/18,9,4,Syrah (LTP-11-41),Lebanon Seaboard Corp.,RON,1,4,4,2018,May,RON-2018-05-10,13,6,1,"Adelphia, NJ"
4,Turf Quality,6/7/18,6,4,Syrah (LTP-11-41),Lebanon Seaboard Corp.,RON,1,4,4,2018,Jun,RON-2018-06-07,14,4,1,"Adelphia, NJ"
4,Turf Quality,7/17/18,7,4,Syrah (LTP-11-41),Lebanon Seaboard Corp.,RON,1,4,4,2018,Jul,RON-2018-07-17,15,3,1,"Adelphia, NJ"
4,Turf Quality,8/15/18,7,4,Syrah (LTP-11-41),Lebanon Seaboard Corp.,RMD,1,4,4,2018,Aug,RMD-2018-08-15,9,2,1,"Adelphia, NJ"
4,Turf Quality,9/12/18,6,4,Syrah (LTP-11-41),Lebanon Seaboard Corp.,RON,1,4,4,2018,Sep,RON-2018-09-12,16,9,1,"Adelphia, NJ"
4,Turf Quality,10/2/18,6,4,Syrah (LTP-11-41),Lebanon Seaboard Corp.,RON,1,4,4,2018,Oct,RON-2018-10-02,17,8,1,"Adelphia, NJ"
4,Turf Quality,11/9/18,5,4,Syrah (LTP-11-41),Lebanon Seaboard Corp.,RON,1,4,4,2018,Nov,RON-2018-11-09,18,7,1,"Adelphia, NJ"
4,Turf Quality,4/17/19,4,4,Syrah (LTP-11-41),Lebanon Seaboard Corp.,RON,1,4,4,2019,Apr,RON-2019-04-17,19,1,2,"Adelphia, NJ"
4,Turf Quality,5/2/19,6,4,Syrah (LTP-11-41),Lebanon Seaboard Corp.,RON,1,4,4,2019,May,RON-2019-05-02,20,6,2,"Adelphia, NJ"
4,Turf Quality,6/13/19,5,4,Syrah (LTP-11-41),Lebanon Seaboard Corp.,RON,1,4,4,2019,Jun,RON-2019-06-13,21,4,2,"Adelphia, NJ"
4,Turf Quality,6/17/19,6,4,Syrah (LTP-11-41),Lebanon Seaboard Corp.,SAB,1,4,4,2019,Jun,SAB-2019-06-17,25,4,2,"Adelphia, NJ"
4,Turf Quality,7/17/19,5,4,Syrah (LTP-11-41),Lebanon Seaboard Corp.,RON,1,4,4,2019,Jul,RON-2019-07-17,22,3,2,"Adelphia, NJ"
4,Turf Quality,8/22/19,6,4,Syrah (LTP-11-41),Lebanon Seaboard Corp.,SAB,1,4,4,2019,Aug,SAB-2019-08-22,26,2,2,"Adelphia, NJ"
4,Turf Quality,9/16/19,6,4,Syrah (LTP-11-41),Lebanon Seaboard Corp.,RON,1,4,4,2019,Sep,RON-2019-09-16,23,9,2,"Adelphia, NJ"
4,Turf Quality,10/10/19,6,4,Syrah (LTP-11-41),Lebanon Seaboard Corp.,SAB,1,4,4,2019,Oct,SAB-2019-10-10,27,8,2,"Adelphia, NJ"
4,Turf Quality,11/1/19,7,4,Syrah (LTP-11-41),Lebanon Seaboard Corp.,RON,1,4,4,2019,Nov,RON-2019-11-01,24,7,2,"Adelphia, NJ"
4,Turf Quality,4/28/20,7,4,Syrah (LTP-11-41),Lebanon Seaboard Corp.,WAM,1,4,4,2020,Apr,WAM-2020-04-28,31,1,3,"Adelphia, NJ"
4,Turf Quality,5/18/20,7,4,Syrah (LTP-11-41),Lebanon Seaboard Corp.,SAB,1,4,4,2020,May,SAB-2020-05-18,28,6,3,"Adelphia, NJ"
4,Turf Quality,6/17/20,5,4,Syrah (LTP-11-41),Lebanon Seaboard Corp.,WAM,1,4,4,2020,Jun,WAM-2020-06-17,32,4,3,"Adelphia, NJ"
4,Turf Quality,7/15/20,6,4,Syrah (LTP-11-41),Lebanon Seaboard Corp.,WAM,1,4,4,2020,Jul,WAM-2020-07-15,33,3,3,"Adelphia, NJ"
4,Turf Quality,8/6/20,6,4,Syrah (LTP-11-41),Lebanon Seaboard Corp.,PLV,1,4,4,2020,Aug,PLV-2020-08-06,5,2,3,"Adelphia, NJ"
4,Turf Quality,9/2/20,8,4,Syrah (LTP-11-41),Lebanon Seaboard Corp.,DAS,1,4,4,2020,Sep,DAS-2020-09-02,1,9,3,"Adelphia, NJ"
4,Turf Quality,10/15/20,7,4,Syrah (LTP-11-41),Lebanon Seaboard Corp.,WAM,1,4,4,2020,Oct,WAM-2020-10-15,34,8,3,"Adelphia, NJ"
4,Turf Quality,11/5/20,8,4,Syrah (LTP-11-41),Lebanon Seaboard Corp.,WAM,1,4,4,2020,Nov,WAM-2020-11-05,35,7,3,"Adelphia, NJ"
4,Turf Quality,10/15/20,8,4,Syrah (LTP-11-41),Lebanon Seaboard Corp.,RMD,1,4,4,2020,Oct,RMD-2020-10-15,10,8,3,"Adelphia, NJ"
4,Turf Quality,10/23/20,7,4,Syrah (LTP-11-41),Lebanon Seaboard Corp.,RMD,1,4,4,2020,Oct,RMD-2020-10-23,11,8,3,"Adelphia, NJ"
4,Turf Quality,3/30/21,5,4,Syrah (LTP-11-41),Lebanon Seaboard Corp.,RMD,1,4,4,2021,Mar,RMD-2021-03-30,12,5,4,"Adelphia, NJ"
4,Turf Quality,4/22/21,8,4,Syrah (LTP-11-41),Lebanon Seaboard Corp.,PLV,1,4,4,2021,Apr,PLV-2021-04-22,6,1,4,"Adelphia, NJ"
4,Turf Quality,5/28/21,9,4,Syrah (LTP-11-41),Lebanon Seaboard Corp.,SAB,1,4,4,2021,May,SAB-2021-05-28,29,6,4,"Adelphia, NJ"
4,Turf Quality,6/11/21,6,4,Syrah (LTP-11-41),Lebanon Seaboard Corp.,JEN,1,4,4,2021,Jun,JEN-2021-06-11,2,4,4,"Adelphia, NJ"
4,Turf Quality,7/13/21,4,4,Syrah (LTP-11-41),Lebanon Seaboard Corp.,PLV,1,4,4,2021,Jul,PLV-2021-07-13,7,3,4,"Adelphia, NJ"
4,Turf Quality,8/11/21,6,4,Syrah (LTP-11-41),Lebanon Seaboard Corp.,JEN,1,4,4,2021,Aug,JEN-2021-08-11,3,2,4,"Adelphia, NJ"
4,Turf Quality,9/17/21,7,4,Syrah (LTP-11-41),Lebanon Seaboard Corp.,JEN,1,4,4,2021,Sep,JEN-2021-09-17,4,9,4,"Adelphia, NJ"
4,Turf Quality,10/13/21,8,4,Syrah (LTP-11-41),Lebanon Seaboard Corp.,SAB,1,4,4,2021,Oct,SAB-2021-10-13,30,8,4,"Adelphia, NJ"
4,Turf Quality,11/18/21,8,4,Syrah (LTP-11-41),Lebanon Seaboard Corp.,WAM,1,4,4,2021,Nov,WAM-2021-11-18,36,7,4,"Adelphia, NJ"
266,Turf Quality,4/18/18,3,35,Orion (PST-K13-143),Pure Seed Testing Inc.,RMD,18,5,264,2018,Apr,RMD-2018-04-18,8,1,1,"Adelphia, NJ"
266,Turf Quality,5/10/18,4,35,Orion (PST-K13-143),Pure Seed Testing Inc.,RON,18,5,264,2018,May,RON-2018-05-10,13,6,1,"Adelphia, NJ"
266,Turf Quality,6/7/18,4,35,Orion (PST-K13-143),Pure Seed Testing Inc.,RON,18,5,264,2018,Jun,RON-2018-06-07,14,4,1,"Adelphia, NJ"
266,Turf Quality,7/17/18,5,35,Orion (PST-K13-143),Pure Seed Testing Inc.,RON,18,5,264,2018,Jul,RON-2018-07-17,15,3,1,"Adelphia, NJ"
266,Turf Quality,8/15/18,5,35,Orion (PST-K13-143),Pure Seed Testing Inc.,RMD,18,5,264,2018,Aug,RMD-2018-08-15,9,2,1,"Adelphia, NJ"
266,Turf Quality,9/12/18,3,35,Orion (PST-K13-143),Pure Seed Testing Inc.,RON,18,5,264,2018,Sep,RON-2018-09-12,16,9,1,"Adelphia, NJ"
266,Turf Quality,10/2/18,4,35,Orion (PST-K13-143),Pure Seed Testing Inc.,RON,18,5,264,2018,Oct,RON-2018-10-02,17,8,1,"Adelphia, NJ"
266,Turf Quality,11/9/18,3,35,Orion (PST-K13-143),Pure Seed Testing Inc.,RON,18,5,264,2018,Nov,RON-2018-11-09,18,7,1,"Adelphia, NJ"
266,Turf Quality,4/17/19,4,35,Orion (PST-K13-143),Pure Seed Testing Inc.,RON,18,5,264,2019,Apr,RON-2019-04-17,19,1,2,"Adelphia, NJ"
266,Turf Quality,5/2/19,4,35,Orion (PST-K13-143),Pure Seed Testing Inc.,RON,18,5,264,2019,May,RON-2019-05-02,20,6,2,"Adelphia, NJ"
266,Turf Quality,6/13/19,5,35,Orion (PST-K13-143),Pure Seed Testing Inc.,RON,18,5,264,2019,Jun,RON-2019-06-13,21,4,2,"Adelphia, NJ"
266,Turf Quality,6/17/19,5,35,Orion (PST-K13-143),Pure Seed Testing Inc.,SAB,18,5,264,2019,Jun,SAB-2019-06-17,25,4,2,"Adelphia, NJ"
266,Turf Quality,7/17/19,6,35,Orion (PST-K13-143),Pure Seed Testing Inc.,RON,18,5,264,2019,Jul,RON-2019-07-17,22,3,2,"Adelphia, NJ"
266,Turf Quality,8/22/19,3,35,Orion (PST-K13-143),Pure Seed Testing Inc.,SAB,18,5,264,2019,Aug,SAB-2019-08-22,26,2,2,"Adelphia, NJ"
266,Turf Quality,9/16/19,3,35,Orion (PST-K13-143),Pure Seed Testing Inc.,RON,18,5,264,2019,Sep,RON-2019-09-16,23,9,2,"Adelphia, NJ"
266,Turf Quality,10/10/19,2,35,Orion (PST-K13-143),Pure Seed Testing Inc.,SAB,18,5,264,2019,Oct,SAB-2019-10-10,27,8,2,"Adelphia, NJ"
266,Turf Quality,11/1/19,3,35,Orion (PST-K13-143),Pure Seed Testing Inc.,RON,18,5,264,2019,Nov,RON-2019-11-01,24,7,2,"Adelphia, NJ"
266,Turf Quality,4/28/20,4,35,Orion (PST-K13-143),Pure Seed Testing Inc.,WAM,18,5,264,2020,Apr,WAM-2020-04-28,31,1,3,"Adelphia, NJ"
266,Turf Quality,5/18/20,3,35,Orion (PST-K13-143),Pure Seed Testing Inc.,SAB,18,5,264,2020,May,SAB-2020-05-18,28,6,3,"Adelphia, NJ"
266,Turf Quality,6/17/20,4,35,Orion (PST-K13-143),Pure Seed Testing Inc.,WAM,18,5,264,2020,Jun,WAM-2020-06-17,32,4,3,"Adelphia, NJ"
266,Turf Quality,7/15/20,5,35,Orion (PST-K13-143),Pure Seed Testing Inc.,WAM,18,5,264,2020,Jul,WAM-2020-07-15,33,3,3,"Adelphia, NJ"
266,Turf Quality,8/6/20,7,35,Orion (PST-K13-143),Pure Seed Testing Inc.,PLV,18,5,264,2020,Aug,PLV-2020-08-06,5,2,3,"Adelphia, NJ"
266,Turf Quality,9/2/20,4,35,Orion (PST-K13-143),Pure Seed Testing Inc.,DAS,18,5,264,2020,Sep,DAS-2020-09-02,1,9,3,"Adelphia, NJ"
266,Turf Quality,10/15/20,3,35,Orion (PST-K13-143),Pure Seed Testing Inc.,WAM,18,5,264,2020,Oct,WAM-2020-10-15,34,8,3,"Adelphia, NJ"
266,Turf Quality,11/5/20,3,35,Orion (PST-K13-143),Pure Seed Testing Inc.,WAM,18,5,264,2020,Nov,WAM-2020-11-05,35,7,3,"Adelphia, NJ"
266,Turf Quality,10/15/20,3,35,Orion (PST-K13-143),Pure Seed Testing Inc.,RMD,18,5,264,2020,Oct,RMD-2020-10-15,10,8,3,"Adelphia, NJ"
266,Turf Quality,10/23/20,3,35,Orion (PST-K13-143),Pure Seed Testing Inc.,RMD,18,5,264,2020,Oct,RMD-2020-10-23,11,8,3,"Adelphia, NJ"
266,Turf Quality,3/30/21,3,35,Orion (PST-K13-143),Pure Seed Testing Inc.,RMD,18,5,264,2021,Mar,RMD-2021-03-30,12,5,4,"Adelphia, NJ"
266,Turf Quality,4/22/21,7,35,Orion (PST-K13-143),Pure Seed Testing Inc.,PLV,18,5,264,2021,Apr,PLV-2021-04-22,6,1,4,"Adelphia, NJ"
266,Turf Quality,5/28/21,5,35,Orion (PST-K13-143),Pure Seed Testing Inc.,SAB,18,5,264,2021,May,SAB-2021-05-28,29,6,4,"Adelphia, NJ"
266,Turf Quality,6/11/21,5,35,Orion (PST-K13-143),Pure Seed Testing Inc.,JEN,18,5,264,2021,Jun,JEN-2021-06-11,2,4,4,"Adelphia, NJ"
266,Turf Quality,7/13/21,5,35,Orion (PST-K13-143),Pure Seed Testing Inc.,PLV,18,5,264,2021,Jul,PLV-2021-07-13,7,3,4,"Adelphia, NJ"
266,Turf Quality,8/11/21,5,35,Orion (PST-K13-143),Pure Seed Testing Inc.,JEN,18,5,264,2021,Aug,JEN-2021-08-11,3,2,4,"Adelphia, NJ"
266,Turf Quality,9/17/21,5,35,Orion (PST-K13-143),Pure Seed Testing Inc.,JEN,18,5,264,2021,Sep,JEN-2021-09-17,4,9,4,"Adelphia, NJ"
266,Turf Quality,10/13/21,4,35,Orion (PST-K13-143),Pure Seed Testing Inc.,SAB,18,5,264,2021,Oct,SAB-2021-10-13,30,8,4,"Adelphia, NJ"
266,Turf Quality,11/18/21,5,35,Orion (PST-K13-143),Pure Seed Testing Inc.,WAM,18,5,264,2021,Nov,WAM-2021-11-18,36,7,4,"Adelphia, NJ"
245,Turf Quality,4/18/18,4,28,RAD-1776,Barenbrug Research,RMD,17,5,243,2018,Apr,RMD-2018-04-18,8,1,1,"Adelphia, NJ"
245,Turf Quality,5/10/18,4,28,RAD-1776,Barenbrug Research,RON,17,5,243,2018,May,RON-2018-05-10,13,6,1,"Adelphia, NJ"
245,Turf Quality,6/7/18,3,28,RAD-1776,Barenbrug Research,RON,17,5,243,2018,Jun,RON-2018-06-07,14,4,1,"Adelphia, NJ"
245,Turf Quality,7/17/18,5,28,RAD-1776,Barenbrug Research,RON,17,5,243,2018,Jul,RON-2018-07-17,15,3,1,"Adelphia, NJ"
245,Turf Quality,8/15/18,6,28,RAD-1776,Barenbrug Research,RMD,17,5,243,2018,Aug,RMD-2018-08-15,9,2,1,"Adelphia, NJ"
245,Turf Quality,9/12/18,3,28,RAD-1776,Barenbrug Research,RON,17,5,243,2018,Sep,RON-2018-09-12,16,9,1,"Adelphia, NJ"
245,Turf Quality,10/2/18,3,28,RAD-1776,Barenbrug Research,RON,17,5,243,2018,Oct,RON-2018-10-02,17,8,1,"Adelphia, NJ"
245,Turf Quality,11/9/18,3,28,RAD-1776,Barenbrug Research,RON,17,5,243,2018,Nov,RON-2018-11-09,18,7,1,"Adelphia, NJ"
245,Turf Quality,4/17/19,4,28,RAD-1776,Barenbrug Research,RON,17,5,243,2019,Apr,RON-2019-04-17,19,1,2,"Adelphia, NJ"
245,Turf Quality,5/2/19,4,28,RAD-1776,Barenbrug Research,RON,17,5,243,2019,May,RON-2019-05-02,20,6,2,"Adelphia, NJ"
245,Turf Quality,6/13/19,4,28,RAD-1776,Barenbrug Research,RON,17,5,243,2019,Jun,RON-2019-06-13,21,4,2,"Adelphia, NJ"
245,Turf Quality,6/17/19,5,28,RAD-1776,Barenbrug Research,SAB,17,5,243,2019,Jun,SAB-2019-06-17,25,4,2,"Adelphia, NJ"
245,Turf Quality,7/17/19,5,28,RAD-1776,Barenbrug Research,RON,17,5,243,2019,Jul,RON-2019-07-17,22,3,2,"Adelphia, NJ"
245,Turf Quality,8/22/19,3,28,RAD-1776,Barenbrug Research,SAB,17,5,243,2019,Aug,SAB-2019-08-22,26,2,2,"Adelphia, NJ"
245,Turf Quality,9/16/19,2,28,RAD-1776,Barenbrug Research,RON,17,5,243,2019,Sep,RON-2019-09-16,23,9,2,"Adelphia, NJ"
245,Turf Quality,10/10/19,2,28,RAD-1776,Barenbrug Research,SAB,17,5,243,2019,Oct,SAB-2019-10-10,27,8,2,"Adelphia, NJ"
245,Turf Quality,11/1/19,2,28,RAD-1776,Barenbrug Research,RON,17,5,243,2019,Nov,RON-2019-11-01,24,7,2,"Adelphia, NJ"
245,Turf Quality,4/28/20,4,28,RAD-1776,Barenbrug Research,WAM,17,5,243,2020,Apr,WAM-2020-04-28,31,1,3,"Adelphia, NJ"
245,Turf Quality,5/18/20,4,28,RAD-1776,Barenbrug Research,SAB,17,5,243,2020,May,SAB-2020-05-18,28,6,3,"Adelphia, NJ"
245,Turf Quality,6/17/20,3,28,RAD-1776,Barenbrug Research,WAM,17,5,243,2020,Jun,WAM-2020-06-17,32,4,3,"Adelphia, NJ"
245,Turf Quality,7/15/20,3,28,RAD-1776,Barenbrug Research,WAM,17,5,243,2020,Jul,WAM-2020-07-15,33,3,3,"Adelphia, NJ"
245,Turf Quality,8/6/20,5,28,RAD-1776,Barenbrug Research,PLV,17,5,243,2020,Aug,PLV-2020-08-06,5,2,3,"Adelphia, NJ"
245,Turf Quality,9/2/20,2,28,RAD-1776,Barenbrug Research,DAS,17,5,243,2020,Sep,DAS-2020-09-02,1,9,3,"Adelphia, NJ"
245,Turf Quality,10/15/20,1,28,RAD-1776,Barenbrug Research,WAM,17,5,243,2020,Oct,WAM-2020-10-15,34,8,3,"Adelphia, NJ"
245,Turf Quality,11/5/20,3,28,RAD-1776,Barenbrug Research,WAM,17,5,243,2020,Nov,WAM-2020-11-05,35,7,3,"Adelphia, NJ"
245,Turf Quality,10/15/20,2,28,RAD-1776,Barenbrug Research,RMD,17,5,243,2020,Oct,RMD-2020-10-15,10,8,3,"Adelphia, NJ"
245,Turf Quality,10/23/20,2,28,RAD-1776,Barenbrug Research,RMD,17,5,243,2020,Oct,RMD-2020-10-23,11,8,3,"Adelphia, NJ"
245,Turf Quality,3/30/21,2,28,RAD-1776,Barenbrug Research,RMD,17,5,243,2021,Mar,RMD-2021-03-30,12,5,4,"Adelphia, NJ"
245,Turf Quality,4/22/21,4,28,RAD-1776,Barenbrug Research,PLV,17,5,243,2021,Apr,PLV-2021-04-22,6,1,4,"Adelphia, NJ"
245,Turf Quality,5/28/21,3,28,RAD-1776,Barenbrug Research,SAB,17,5,243,2021,May,SAB-2021-05-28,29,6,4,"Adelphia, NJ"
245,Turf Quality,6/11/21,4,28,RAD-1776,Barenbrug Research,JEN,17,5,243,2021,Jun,JEN-2021-06-11,2,4,4,"Adelphia, NJ"
245,Turf Quality,7/13/21,5,28,RAD-1776,Barenbrug Research,PLV,17,5,243,2021,Jul,PLV-2021-07-13,7,3,4,"Adelphia, NJ"
245,Turf Quality,8/11/21,5,28,RAD-1776,Barenbrug Research,JEN,17,5,243,2021,Aug,JEN-2021-08-11,3,2,4,"Adelphia, NJ"
245,Turf Quality,9/17/21,3,28,RAD-1776,Barenbrug Research,JEN,17,5,243,2021,Sep,JEN-2021-09-17,4,9,4,"Adelphia, NJ"
245,Turf Quality,10/13/21,3,28,RAD-1776,Barenbrug Research,SAB,17,5,243,2021,Oct,SAB-2021-10-13,30,8,4,"Adelphia, NJ"
245,Turf Quality,11/18/21,5,28,RAD-1776,Barenbrug Research,WAM,17,5,243,2021,Nov,WAM-2021-11-18,36,7,4,"Adelphia, NJ"
236,Turf Quality,4/18/18,5,80,Paloma (PST-K13-139),Pure Seed Testing Inc.,RMD,16,5,234,2018,Apr,RMD-2018-04-18,8,1,1,"Adelphia, NJ"
236,Turf Quality,5/10/18,7,80,Paloma (PST-K13-139),Pure Seed Testing Inc.,RON,16,5,234,2018,May,RON-2018-05-10,13,6,1,"Adelphia, NJ"
236,Turf Quality,6/7/18,4,80,Paloma (PST-K13-139),Pure Seed Testing Inc.,RON,16,5,234,2018,Jun,RON-2018-06-07,14,4,1,"Adelphia, NJ"
236,Turf Quality,7/17/18,5,80,Paloma (PST-K13-139),Pure Seed Testing Inc.,RON,16,5,234,2018,Jul,RON-2018-07-17,15,3,1,"Adelphia, NJ"
236,Turf Quality,8/15/18,4,80,Paloma (PST-K13-139),Pure Seed Testing Inc.,RMD,16,5,234,2018,Aug,RMD-2018-08-15,9,2,1,"Adelphia, NJ"
236,Turf Quality,9/12/18,3,80,Paloma (PST-K13-139),Pure Seed Testing Inc.,RON,16,5,234,2018,Sep,RON-2018-09-12,16,9,1,"Adelphia, NJ"
236,Turf Quality,10/2/18,2,80,Paloma (PST-K13-139),Pure Seed Testing Inc.,RON,16,5,234,2018,Oct,RON-2018-10-02,17,8,1,"Adelphia, NJ"
236,Turf Quality,11/9/18,3,80,Paloma (PST-K13-139),Pure Seed Testing Inc.,RON,16,5,234,2018,Nov,RON-2018-11-09,18,7,1,"Adelphia, NJ"
236,Turf Quality,4/17/19,2,80,Paloma (PST-K13-139),Pure Seed Testing Inc.,RON,16,5,234,2019,Apr,RON-2019-04-17,19,1,2,"Adelphia, NJ"
236,Turf Quality,5/2/19,3,80,Paloma (PST-K13-139),Pure Seed Testing Inc.,RON,16,5,234,2019,May,RON-2019-05-02,20,6,2,"Adelphia, NJ"
236,Turf Quality,6/13/19,3,80,Paloma (PST-K13-139),Pure Seed Testing Inc.,RON,16,5,234,2019,Jun,RON-2019-06-13,21,4,2,"Adelphia, NJ"
236,Turf Quality,6/17/19,3,80,Paloma (PST-K13-139),Pure Seed Testing Inc.,SAB,16,5,234,2019,Jun,SAB-2019-06-17,25,4,2,"Adelphia, NJ"
236,Turf Quality,7/17/19,3,80,Paloma (PST-K13-139),Pure Seed Testing Inc.,RON,16,5,234,2019,Jul,RON-2019-07-17,22,3,2,"Adelphia, NJ"
236,Turf Quality,8/22/19,1,80,Paloma (PST-K13-139),Pure Seed Testing Inc.,SAB,16,5,234,2019,Aug,SAB-2019-08-22,26,2,2,"Adelphia, NJ"
236,Turf Quality,9/16/19,1,80,Paloma (PST-K13-139),Pure Seed Testing Inc.,RON,16,5,234,2019,Sep,RON-2019-09-16,23,9,2,"Adelphia, NJ"
236,Turf Quality,10/10/19,1,80,Paloma (PST-K13-139),Pure Seed Testing Inc.,SAB,16,5,234,2019,Oct,SAB-2019-10-10,27,8,2,"Adelphia, NJ"
236,Turf Quality,11/1/19,1,80,Paloma (PST-K13-139),Pure Seed Testing Inc.,RON,16,5,234,2019,Nov,RON-2019-11-01,24,7,2,"Adelphia, NJ"
236,Turf Quality,4/28/20,1,80,Paloma (PST-K13-139),Pure Seed Testing Inc.,WAM,16,5,234,2020,Apr,WAM-2020-04-28,31,1,3,"Adelphia, NJ"
236,Turf Quality,5/18/20,1,80,Paloma (PST-K13-139),Pure Seed Testing Inc.,SAB,16,5,234,2020,May,SAB-2020-05-18,28,6,3,"Adelphia, NJ"
236,Turf Quality,6/17/20,1,80,Paloma (PST-K13-139),Pure Seed Testing Inc.,WAM,16,5,234,2020,Jun,WAM-2020-06-17,32,4,3,"Adelphia, NJ"
236,Turf Quality,7/15/20,1,80,Paloma (PST-K13-139),Pure Seed Testing Inc.,WAM,16,5,234,2020,Jul,WAM-2020-07-15,33,3,3,"Adelphia, NJ"
236,Turf Quality,8/6/20,3,80,Paloma (PST-K13-139),Pure Seed Testing Inc.,PLV,16,5,234,2020,Aug,PLV-2020-08-06,5,2,3,"Adelphia, NJ"
236,Turf Quality,9/2/20,1,80,Paloma (PST-K13-139),Pure Seed Testing Inc.,DAS,16,5,234,2020,Sep,DAS-2020-09-02,1,9,3,"Adelphia, NJ"
236,Turf Quality,10/15/20,1,80,Paloma (PST-K13-139),Pure Seed Testing Inc.,WAM,16,5,234,2020,Oct,WAM-2020-10-15,34,8,3,"Adelphia, NJ"
236,Turf Quality,11/5/20,3,80,Paloma (PST-K13-139),Pure Seed Testing Inc.,WAM,16,5,234,2020,Nov,WAM-2020-11-05,35,7,3,"Adelphia, NJ"
236,Turf Quality,10/15/20,1,80,Paloma (PST-K13-139),Pure Seed Testing Inc.,RMD,16,5,234,2020,Oct,RMD-2020-10-15,10,8,3,"Adelphia, NJ"
236,Turf Quality,10/23/20,1,80,Paloma (PST-K13-139),Pure Seed Testing Inc.,RMD,16,5,234,2020,Oct,RMD-2020-10-23,11,8,3,"Adelphia, NJ"
236,Turf Quality,3/30/21,1,80,Paloma (PST-K13-139),Pure Seed Testing Inc.,RMD,16,5,234,2021,Mar,RMD-2021-03-30,12,5,4,"Adelphia, NJ"
236,Turf Quality,4/22/21,2,80,Paloma (PST-K13-139),Pure Seed Testing Inc.,PLV,16,5,234,2021,Apr,PLV-2021-04-22,6,1,4,"Adelphia, NJ"
236,Turf Quality,5/28/21,2,80,Paloma (PST-K13-139),Pure Seed Testing Inc.,SAB,16,5,234,2021,May,SAB-2021-05-28,29,6,4,"Adelphia, NJ"
236,Turf Quality,6/11/21,3,80,Paloma (PST-K13-139),Pure Seed Testing Inc.,JEN,16,5,234,2021,Jun,JEN-2021-06-11,2,4,4,"Adelphia, NJ"
236,Turf Quality,7/13/21,3,80,Paloma (PST-K13-139),Pure Seed Testing Inc.,PLV,16,5,234,2021,Jul,PLV-2021-07-13,7,3,4,"Adelphia, NJ"
236,Turf Quality,8/11/21,4,80,Paloma (PST-K13-139),Pure Seed Testing Inc.,JEN,16,5,234,2021,Aug,JEN-2021-08-11,3,2,4,"Adelphia, NJ"
236,Turf Quality,9/17/21,3,80,Paloma (PST-K13-139),Pure Seed Testing Inc.,JEN,16,5,234,2021,Sep,JEN-2021-09-17,4,9,4,"Adelphia, NJ"
236,Turf Quality,10/13/21,2,80,Paloma (PST-K13-139),Pure Seed Testing Inc.,SAB,16,5,234,2021,Oct,SAB-2021-10-13,30,8,4,"Adelphia, NJ"
236,Turf Quality,11/18/21,4,80,Paloma (PST-K13-139),Pure Seed Testing Inc.,WAM,16,5,234,2021,Nov,WAM-2021-11-18,36,7,4,"Adelphia, NJ"
215,Turf Quality,4/18/18,3,34,NAI-14-122,Columbia River Seed,RMD,15,5,213,2018,Apr,RMD-2018-04-18,8,1,1,"Adelphia, NJ"
215,Turf Quality,5/10/18,4,34,NAI-14-122,Columbia River Seed,RON,15,5,213,2018,May,RON-2018-05-10,13,6,1,"Adelphia, NJ"
215,Turf Quality,6/7/18,6,34,NAI-14-122,Columbia River Seed,RON,15,5,213,2018,Jun,RON-2018-06-07,14,4,1,"Adelphia, NJ"
215,Turf Quality,7/17/18,5,34,NAI-14-122,Columbia River Seed,RON,15,5,213,2018,Jul,RON-2018-07-17,15,3,1,"Adelphia, NJ"
215,Turf Quality,8/15/18,6,34,NAI-14-122,Columbia River Seed,RMD,15,5,213,2018,Aug,RMD-2018-08-15,9,2,1,"Adelphia, NJ"
215,Turf Quality,9/12/18,4,34,NAI-14-122,Columbia River Seed,RON,15,5,213,2018,Sep,RON-2018-09-12,16,9,1,"Adelphia, NJ"
215,Turf Quality,10/2/18,3,34,NAI-14-122,Columbia River Seed,RON,15,5,213,2018,Oct,RON-2018-10-02,17,8,1,"Adelphia, NJ"
215,Turf Quality,11/9/18,3,34,NAI-14-122,Columbia River Seed,RON,15,5,213,2018,Nov,RON-2018-11-09,18,7,1,"Adelphia, NJ"
215,Turf Quality,4/17/19,3,34,NAI-14-122,Columbia River Seed,RON,15,5,213,2019,Apr,RON-2019-04-17,19,1,2,"Adelphia, NJ"
215,Turf Quality,5/2/19,4,34,NAI-14-122,Columbia River Seed,RON,15,5,213,2019,May,RON-2019-05-02,20,6,2,"Adelphia, NJ"
215,Turf Quality,6/13/19,4,34,NAI-14-122,Columbia River Seed,RON,15,5,213,2019,Jun,RON-2019-06-13,21,4,2,"Adelphia, NJ"
215,Turf Quality,6/17/19,4,34,NAI-14-122,Columbia River Seed,SAB,15,5,213,2019,Jun,SAB-2019-06-17,25,4,2,"Adelphia, NJ"
215,Turf Quality,7/17/19,4,34,NAI-14-122,Columbia River Seed,RON,15,5,213,2019,Jul,RON-2019-07-17,22,3,2,"Adelphia, NJ"
215,Turf Quality,8/22/19,3,34,NAI-14-122,Columbia River Seed,SAB,15,5,213,2019,Aug,SAB-2019-08-22,26,2,2,"Adelphia, NJ"
215,Turf Quality,9/16/19,3,34,NAI-14-122,Columbia River Seed,RON,15,5,213,2019,Sep,RON-2019-09-16,23,9,2,"Adelphia, NJ"
215,Turf Quality,10/10/19,3,34,NAI-14-122,Columbia River Seed,SAB,15,5,213,2019,Oct,SAB-2019-10-10,27,8,2,"Adelphia, NJ"
215,Turf Quality,11/1/19,3,34,NAI-14-122,Columbia River Seed,RON,15,5,213,2019,Nov,RON-2019-11-01,24,7,2,"Adelphia, NJ"
215,Turf Quality,4/28/20,4,34,NAI-14-122,Columbia River Seed,WAM,15,5,213,2020,Apr,WAM-2020-04-28,31,1,3,"Adelphia, NJ"
215,Turf Quality,5/18/20,4,34,NAI-14-122,Columbia River Seed,SAB,15,5,213,2020,May,SAB-2020-05-18,28,6,3,"Adelphia, NJ"
215,Turf Quality,6/17/20,3,34,NAI-14-122,Columbia River Seed,WAM,15,5,213,2020,Jun,WAM-2020-06-17,32,4,3,"Adelphia, NJ"
215,Turf Quality,7/15/20,4,34,NAI-14-122,Columbia River Seed,WAM,15,5,213,2020,Jul,WAM-2020-07-15,33,3,3,"Adelphia, NJ"
215,Turf Quality,8/6/20,5,34,NAI-14-122,Columbia River Seed,PLV,15,5,213,2020,Aug,PLV-2020-08-06,5,2,3,"Adelphia, NJ"
215,Turf Quality,9/2/20,3,34,NAI-14-122,Columbia River Seed,DAS,15,5,213,2020,Sep,DAS-2020-09-02,1,9,3,"Adelphia, NJ"
215,Turf Quality,10/15/20,3,34,NAI-14-122,Columbia River Seed,WAM,15,5,213,2020,Oct,WAM-2020-10-15,34,8,3,"Adelphia, NJ"
215,Turf Quality,11/5/20,4,34,NAI-14-122,Columbia River Seed,WAM,15,5,213,2020,Nov,WAM-2020-11-05,35,7,3,"Adelphia, NJ"
215,Turf Quality,10/15/20,3,34,NAI-14-122,Columbia River Seed,RMD,15,5,213,2020,Oct,RMD-2020-10-15,10,8,3,"Adelphia, NJ"
215,Turf Quality,10/23/20,3,34,NAI-14-122,Columbia River Seed,RMD,15,5,213,2020,Oct,RMD-2020-10-23,11,8,3,"Adelphia, NJ"
215,Turf Quality,3/30/21,3,34,NAI-14-122,Columbia River Seed,RMD,15,5,213,2021,Mar,RMD-2021-03-30,12,5,4,"Adelphia, NJ"
215,Turf Quality,4/22/21,3,34,NAI-14-122,Columbia River Seed,PLV,15,5,213,2021,Apr,PLV-2021-04-22,6,1,4,"Adelphia, NJ"
215,Turf Quality,5/28/21,3,34,NAI-14-122,Columbia River Seed,SAB,15,5,213,2021,May,SAB-2021-05-28,29,6,4,"Adelphia, NJ"
215,Turf Quality,6/11/21,3,34,NAI-14-122,Columbia River Seed,JEN,15,5,213,2021,Jun,JEN-2021-06-11,2,4,4,"Adelphia, NJ"
215,Turf Quality,7/13/21,4,34,NAI-14-122,Columbia River Seed,PLV,15,5,213,2021,Jul,PLV-2021-07-13,7,3,4,"Adelphia, NJ"
215,Turf Quality,8/11/21,4,34,NAI-14-122,Columbia River Seed,JEN,15,5,213,2021,Aug,JEN-2021-08-11,3,2,4,"Adelphia, NJ"
215,Turf Quality,9/17/21,2,34,NAI-14-122,Columbia River Seed,JEN,15,5,213,2021,Sep,JEN-2021-09-17,4,9,4,"Adelphia, NJ"
215,Turf Quality,10/13/21,2,34,NAI-14-122,Columbia River Seed,SAB,15,5,213,2021,Oct,SAB-2021-10-13,30,8,4,"Adelphia, NJ"
215,Turf Quality,11/18/21,4,34,NAI-14-122,Columbia River Seed,WAM,15,5,213,2021,Nov,WAM-2021-11-18,36,7,4,"Adelphia, NJ"
206,Turf Quality,4/18/18,4,53,DLFPS-340/3494,DLF Pickseed USA,RMD,14,5,204,2018,Apr,RMD-2018-04-18,8,1,1,"Adelphia, NJ"
206,Turf Quality,5/10/18,6,53,DLFPS-340/3494,DLF Pickseed USA,RON,14,5,204,2018,May,RON-2018-05-10,13,6,1,"Adelphia, NJ"
206,Turf Quality,6/7/18,4,53,DLFPS-340/3494,DLF Pickseed USA,RON,14,5,204,2018,Jun,RON-2018-06-07,14,4,1,"Adelphia, NJ"
206,Turf Quality,7/17/18,5,53,DLFPS-340/3494,DLF Pickseed USA,RON,14,5,204,2018,Jul,RON-2018-07-17,15,3,1,"Adelphia, NJ"
206,Turf Quality,8/15/18,7,53,DLFPS-340/3494,DLF Pickseed USA,RMD,14,5,204,2018,Aug,RMD-2018-08-15,9,2,1,"Adelphia, NJ"
206,Turf Quality,9/12/18,7,53,DLFPS-340/3494,DLF Pickseed USA,RON,14,5,204,2018,Sep,RON-2018-09-12,16,9,1,"Adelphia, NJ"
206,Turf Quality,10/2/18,6,53,DLFPS-340/3494,DLF Pickseed USA,RON,14,5,204,2018,Oct,RON-2018-10-02,17,8,1,"Adelphia, NJ"
206,Turf Quality,11/9/18,7,53,DLFPS-340/3494,DLF Pickseed USA,RON,14,5,204,2018,Nov,RON-2018-11-09,18,7,1,"Adelphia, NJ"
206,Turf Quality,4/17/19,4,53,DLFPS-340/3494,DLF Pickseed USA,RON,14,5,204,2019,Apr,RON-2019-04-17,19,1,2,"Adelphia, NJ"
206,Turf Quality,5/2/19,4,53,DLFPS-340/3494,DLF Pickseed USA,RON,14,5,204,2019,May,RON-2019-05-02,20,6,2,"Adelphia, NJ"
206,Turf Quality,6/13/19,4,53,DLFPS-340/3494,DLF Pickseed USA,RON,14,5,204,2019,Jun,RON-2019-06-13,21,4,2,"Adelphia, NJ"
206,Turf Quality,6/17/19,3,53,DLFPS-340/3494,DLF Pickseed USA,SAB,14,5,204,2019,Jun,SAB-2019-06-17,25,4,2,"Adelphia, NJ"
206,Turf Quality,7/17/19,2,53,DLFPS-340/3494,DLF Pickseed USA,RON,14,5,204,2019,Jul,RON-2019-07-17,22,3,2,"Adelphia, NJ"
206,Turf Quality,8/22/19,3,53,DLFPS-340/3494,DLF Pickseed USA,SAB,14,5,204,2019,Aug,SAB-2019-08-22,26,2,2,"Adelphia, NJ"
206,Turf Quality,9/16/19,3,53,DLFPS-340/3494,DLF Pickseed USA,RON,14,5,204,2019,Sep,RON-2019-09-16,23,9,2,"Adelphia, NJ"
206,Turf Quality,10/10/19,3,53,DLFPS-340/3494,DLF Pickseed USA,SAB,14,5,204,2019,Oct,SAB-2019-10-10,27,8,2,"Adelphia, NJ"
206,Turf Quality,11/1/19,2,53,DLFPS-340/3494,DLF Pickseed USA,RON,14,5,204,2019,Nov,RON-2019-11-01,24,7,2,"Adelphia, NJ"
206,Turf Quality,4/28/20,3,53,DLFPS-340/3494,DLF Pickseed USA,WAM,14,5,204,2020,Apr,WAM-2020-04-28,31,1,3,"Adelphia, NJ"
206,Turf Quality,5/18/20,1,53,DLFPS-340/3494,DLF Pickseed USA,SAB,14,5,204,2020,May,SAB-2020-05-18,28,6,3,"Adelphia, NJ"
206,Turf Quality,6/17/20,2,53,DLFPS-340/3494,DLF Pickseed USA,WAM,14,5,204,2020,Jun,WAM-2020-06-17,32,4,3,"Adelphia, NJ"
206,Turf Quality,7/15/20,2,53,DLFPS-340/3494,DLF Pickseed USA,WAM,14,5,204,2020,Jul,WAM-2020-07-15,33,3,3,"Adelphia, NJ"
206,Turf Quality,8/6/20,2,53,DLFPS-340/3494,DLF Pickseed USA,PLV,14,5,204,2020,Aug,PLV-2020-08-06,5,2,3,"Adelphia, NJ"
206,Turf Quality,9/2/20,3,53,DLFPS-340/3494,DLF Pickseed USA,DAS,14,5,204,2020,Sep,DAS-2020-09-02,1,9,3,"Adelphia, NJ"
206,Turf Quality,10/15/20,1,53,DLFPS-340/3494,DLF Pickseed USA,WAM,14,5,204,2020,Oct,WAM-2020-10-15,34,8,3,"Adelphia, NJ"
206,Turf Quality,11/5/20,2,53,DLFPS-340/3494,DLF Pickseed USA,WAM,14,5,204,2020,Nov,WAM-2020-11-05,35,7,3,"Adelphia, NJ"
206,Turf Quality,10/15/20,2,53,DLFPS-340/3494,DLF Pickseed USA,RMD,14,5,204,2020,Oct,RMD-2020-10-15,10,8,3,"Adelphia, NJ"
206,Turf Quality,10/23/20,2,53,DLFPS-340/3494,DLF Pickseed USA,RMD,14,5,204,2020,Oct,RMD-2020-10-23,11,8,3,"Adelphia, NJ"
206,Turf Quality,3/30/21,1,53,DLFPS-340/3494,DLF Pickseed USA,RMD,14,5,204,2021,Mar,RMD-2021-03-30,12,5,4,"Adelphia, NJ"
206,Turf Quality,4/22/21,2,53,DLFPS-340/3494,DLF Pickseed USA,PLV,14,5,204,2021,Apr,PLV-2021-04-22,6,1,4,"Adelphia, NJ"
206,Turf Quality,5/28/21,1,53,DLFPS-340/3494,DLF Pickseed USA,SAB,14,5,204,2021,May,SAB-2021-05-28,29,6,4,"Adelphia, NJ"
206,Turf Quality,6/11/21,3,53,DLFPS-340/3494,DLF Pickseed USA,JEN,14,5,204,2021,Jun,JEN-2021-06-11,2,4,4,"Adelphia, NJ"
206,Turf Quality,7/13/21,4,53,DLFPS-340/3494,DLF Pickseed USA,PLV,14,5,204,2021,Jul,PLV-2021-07-13,7,3,4,"Adelphia, NJ"
206,Turf Quality,8/11/21,3,53,DLFPS-340/3494,DLF Pickseed USA,JEN,14,5,204,2021,Aug,JEN-2021-08-11,3,2,4,"Adelphia, NJ"
206,Turf Quality,9/17/21,3,53,DLFPS-340/3494,DLF Pickseed USA,JEN,14,5,204,2021,Sep,JEN-2021-09-17,4,9,4,"Adelphia, NJ"
206,Turf Quality,10/13/21,4,53,DLFPS-340/3494,DLF Pickseed USA,SAB,14,5,204,2021,Oct,SAB-2021-10-13,30,8,4,"Adelphia, NJ"
206,Turf Quality,11/18/21,5,53,DLFPS-340/3494,DLF Pickseed USA,WAM,14,5,204,2021,Nov,WAM-2021-11-18,36,7,4,"Adelphia, NJ"
185,Turf Quality,4/18/18,3,26,BAR PP 79494,Barenbrug Research,RMD,13,5,183,2018,Apr,RMD-2018-04-18,8,1,1,"Adelphia, NJ"
185,Turf Quality,5/10/18,4,26,BAR PP 79494,Barenbrug Research,RON,13,5,183,2018,May,RON-2018-05-10,13,6,1,"Adelphia, NJ"
185,Turf Quality,6/7/18,7,26,BAR PP 79494,Barenbrug Research,RON,13,5,183,2018,Jun,RON-2018-06-07,14,4,1,"Adelphia, NJ"
185,Turf Quality,7/17/18,6,26,BAR PP 79494,Barenbrug Research,RON,13,5,183,2018,Jul,RON-2018-07-17,15,3,1,"Adelphia, NJ"
185,Turf Quality,8/15/18,6,26,BAR PP 79494,Barenbrug Research,RMD,13,5,183,2018,Aug,RMD-2018-08-15,9,2,1,"Adelphia, NJ"
185,Turf Quality,9/12/18,5,26,BAR PP 79494,Barenbrug Research,RON,13,5,183,2018,Sep,RON-2018-09-12,16,9,1,"Adelphia, NJ"
185,Turf Quality,10/2/18,5,26,BAR PP 79494,Barenbrug Research,RON,13,5,183,2018,Oct,RON-2018-10-02,17,8,1,"Adelphia, NJ"
185,Turf Quality,11/9/18,4,26,BAR PP 79494,Barenbrug Research,RON,13,5,183,2018,Nov,RON-2018-11-09,18,7,1,"Adelphia, NJ"
185,Turf Quality,4/17/19,3,26,BAR PP 79494,Barenbrug Research,RON,13,5,183,2019,Apr,RON-2019-04-17,19,1,2,"Adelphia, NJ"
185,Turf Quality,5/2/19,4,26,BAR PP 79494,Barenbrug Research,RON,13,5,183,2019,May,RON-2019-05-02,20,6,2,"Adelphia, NJ"
185,Turf Quality,6/13/19,5,26,BAR PP 79494,Barenbrug Research,RON,13,5,183,2019,Jun,RON-2019-06-13,21,4,2,"Adelphia, NJ"
185,Turf Quality,6/17/19,5,26,BAR PP 79494,Barenbrug Research,SAB,13,5,183,2019,Jun,SAB-2019-06-17,25,4,2,"Adelphia, NJ"
185,Turf Quality,7/17/19,4,26,BAR PP 79494,Barenbrug Research,RON,13,5,183,2019,Jul,RON-2019-07-17,22,3,2,"Adelphia, NJ"
185,Turf Quality,8/22/19,5,26,BAR PP 79494,Barenbrug Research,SAB,13,5,183,2019,Aug,SAB-2019-08-22,26,2,2,"Adelphia, NJ"
185,Turf Quality,9/16/19,5,26,BAR PP 79494,Barenbrug Research,RON,13,5,183,2019,Sep,RON-2019-09-16,23,9,2,"Adelphia, NJ"
185,Turf Quality,10/10/19,4,26,BAR PP 79494,Barenbrug Research,SAB,13,5,183,2019,Oct,SAB-2019-10-10,27,8,2,"Adelphia, NJ"
185,Turf Quality,11/1/19,5,26,BAR PP 79494,Barenbrug Research,RON,13,5,183,2019,Nov,RON-2019-11-01,24,7,2,"Adelphia, NJ"
185,Turf Quality,4/28/20,6,26,BAR PP 79494,Barenbrug Research,WAM,13,5,183,2020,Apr,WAM-2020-04-28,31,1,3,"Adelphia, NJ"
185,Turf Quality,5/18/20,5,26,BAR PP 79494,Barenbrug Research,SAB,13,5,183,2020,May,SAB-2020-05-18,28,6,3,"Adelphia, NJ"
185,Turf Quality,6/17/20,6,26,BAR PP 79494,Barenbrug Research,WAM,13,5,183,2020,Jun,WAM-2020-06-17,32,4,3,"Adelphia, NJ"
185,Turf Quality,7/15/20,6,26,BAR PP 79494,Barenbrug Research,WAM,13,5,183,2020,Jul,WAM-2020-07-15,33,3,3,"Adelphia, NJ"
185,Turf Quality,8/6/20,7,26,BAR PP 79494,Barenbrug Research,PLV,13,5,183,2020,Aug,PLV-2020-08-06,5,2,3,"Adelphia, NJ"
185,Turf Quality,9/2/20,6,26,BAR PP 79494,Barenbrug Research,DAS,13,5,183,2020,Sep,DAS-2020-09-02,1,9,3,"Adelphia, NJ"
185,Turf Quality,10/15/20,4,26,BAR PP 79494,Barenbrug Research,WAM,13,5,183,2020,Oct,WAM-2020-10-15,34,8,3,"Adelphia, NJ"
185,Turf Quality,11/5/20,5,26,BAR PP 79494,Barenbrug Research,WAM,13,5,183,2020,Nov,WAM-2020-11-05,35,7,3,"Adelphia, NJ"
185,Turf Quality,10/15/20,3,26,BAR PP 79494,Barenbrug Research,RMD,13,5,183,2020,Oct,RMD-2020-10-15,10,8,3,"Adelphia, NJ"
185,Turf Quality,10/23/20,4,26,BAR PP 79494,Barenbrug Research,RMD,13,5,183,2020,Oct,RMD-2020-10-23,11,8,3,"Adelphia, NJ"
185,Turf Quality,3/30/21,4,26,BAR PP 79494,Barenbrug Research,RMD,13,5,183,2021,Mar,RMD-2021-03-30,12,5,4,"Adelphia, NJ"
185,Turf Quality,4/22/21,6,26,BAR PP 79494,Barenbrug Research,PLV,13,5,183,2021,Apr,PLV-2021-04-22,6,1,4,"Adelphia, NJ"
185,Turf Quality,5/28/21,4,26,BAR PP 79494,Barenbrug Research,SAB,13,5,183,2021,May,SAB-2021-05-28,29,6,4,"Adelphia, NJ"
185,Turf Quality,6/11/21,7,26,BAR PP 79494,Barenbrug Research,JEN,13,5,183,2021,Jun,JEN-2021-06-11,2,4,4,"Adelphia, NJ"
185,Turf Quality,7/13/21,8,26,BAR PP 79494,Barenbrug Research,PLV,13,5,183,2021,Jul,PLV-2021-07-13,7,3,4,"Adelphia, NJ"
185,Turf Quality,8/11/21,6,26,BAR PP 79494,Barenbrug Research,JEN,13,5,183,2021,Aug,JEN-2021-08-11,3,2,4,"Adelphia, NJ"
185,Turf Quality,9/17/21,6,26,BAR PP 79494,Barenbrug Research,JEN,13,5,183,2021,Sep,JEN-2021-09-17,4,9,4,"Adelphia, NJ"
185,Turf Quality,10/13/21,6,26,BAR PP 79494,Barenbrug Research,SAB,13,5,183,2021,Oct,SAB-2021-10-13,30,8,4,"Adelphia, NJ"
185,Turf Quality,11/18/21,6,26,BAR PP 79494,Barenbrug Research,WAM,13,5,183,2021,Nov,WAM-2021-11-18,36,7,4,"Adelphia, NJ"
176,Turf Quality,4/18/18,4,60,DLFPS-340/3550,DLF Pickseed USA,RMD,12,5,175,2018,Apr,RMD-2018-04-18,8,1,1,"Adelphia, NJ"
176,Turf Quality,5/10/18,6,60,DLFPS-340/3550,DLF Pickseed USA,RON,12,5,175,2018,May,RON-2018-05-10,13,6,1,"Adelphia, NJ"
176,Turf Quality,6/7/18,5,60,DLFPS-340/3550,DLF Pickseed USA,RON,12,5,175,2018,Jun,RON-2018-06-07,14,4,1,"Adelphia, NJ"
176,Turf Quality,7/17/18,7,60,DLFPS-340/3550,DLF Pickseed USA,RON,12,5,175,2018,Jul,RON-2018-07-17,15,3,1,"Adelphia, NJ"
176,Turf Quality,8/15/18,7,60,DLFPS-340/3550,DLF Pickseed USA,RMD,12,5,175,2018,Aug,RMD-2018-08-15,9,2,1,"Adelphia, NJ"
176,Turf Quality,9/12/18,7,60,DLFPS-340/3550,DLF Pickseed USA,RON,12,5,175,2018,Sep,RON-2018-09-12,16,9,1,"Adelphia, NJ"
176,Turf Quality,10/2/18,7,60,DLFPS-340/3550,DLF Pickseed USA,RON,12,5,175,2018,Oct,RON-2018-10-02,17,8,1,"Adelphia, NJ"
176,Turf Quality,11/9/18,7,60,DLFPS-340/3550,DLF Pickseed USA,RON,12,5,175,2018,Nov,RON-2018-11-09,18,7,1,"Adelphia, NJ"
176,Turf Quality,4/17/19,5,60,DLFPS-340/3550,DLF Pickseed USA,RON,12,5,175,2019,Apr,RON-2019-04-17,19,1,2,"Adelphia, NJ"
176,Turf Quality,5/2/19,4,60,DLFPS-340/3550,DLF Pickseed USA,RON,12,5,175,2019,May,RON-2019-05-02,20,6,2,"Adelphia, NJ"
176,Turf Quality,6/13/19,7,60,DLFPS-340/3550,DLF Pickseed USA,RON,12,5,175,2019,Jun,RON-2019-06-13,21,4,2,"Adelphia, NJ"
176,Turf Quality,6/17/19,6,60,DLFPS-340/3550,DLF Pickseed USA,SAB,12,5,175,2019,Jun,SAB-2019-06-17,25,4,2,"Adelphia, NJ"
176,Turf Quality,7/17/19,7,60,DLFPS-340/3550,DLF Pickseed USA,RON,12,5,175,2019,Jul,RON-2019-07-17,22,3,2,"Adelphia, NJ"
176,Turf Quality,8/22/19,7,60,DLFPS-340/3550,DLF Pickseed USA,SAB,12,5,175,2019,Aug,SAB-2019-08-22,26,2,2,"Adelphia, NJ"
176,Turf Quality,9/16/19,7,60,DLFPS-340/3550,DLF Pickseed USA,RON,12,5,175,2019,Sep,RON-2019-09-16,23,9,2,"Adelphia, NJ"
176,Turf Quality,10/10/19,5,60,DLFPS-340/3550,DLF Pickseed USA,SAB,12,5,175,2019,Oct,SAB-2019-10-10,27,8,2,"Adelphia, NJ"
176,Turf Quality,11/1/19,5,60,DLFPS-340/3550,DLF Pickseed USA,RON,12,5,175,2019,Nov,RON-2019-11-01,24,7,2,"Adelphia, NJ"
176,Turf Quality,4/28/20,6,60,DLFPS-340/3550,DLF Pickseed USA,WAM,12,5,175,2020,Apr,WAM-2020-04-28,31,1,3,"Adelphia, NJ"
176,Turf Quality,5/18/20,6,60,DLFPS-340/3550,DLF Pickseed USA,SAB,12,5,175,2020,May,SAB-2020-05-18,28,6,3,"Adelphia, NJ"
176,Turf Quality,6/17/20,7,60,DLFPS-340/3550,DLF Pickseed USA,WAM,12,5,175,2020,Jun,WAM-2020-06-17,32,4,3,"Adelphia, NJ"
176,Turf Quality,7/15/20,7,60,DLFPS-340/3550,DLF Pickseed USA,WAM,12,5,175,2020,Jul,WAM-2020-07-15,33,3,3,"Adelphia, NJ"
176,Turf Quality,8/6/20,7,60,DLFPS-340/3550,DLF Pickseed USA,PLV,12,5,175,2020,Aug,PLV-2020-08-06,5,2,3,"Adelphia, NJ"
176,Turf Quality,9/2/20,7,60,DLFPS-340/3550,DLF Pickseed USA,DAS,12,5,175,2020,Sep,DAS-2020-09-02,1,9,3,"Adelphia, NJ"
176,Turf Quality,10/15/20,4,60,DLFPS-340/3550,DLF Pickseed USA,WAM,12,5,175,2020,Oct,WAM-2020-10-15,34,8,3,"Adelphia, NJ"
176,Turf Quality,11/5/20,5,60,DLFPS-340/3550,DLF Pickseed USA,WAM,12,5,175,2020,Nov,WAM-2020-11-05,35,7,3,"Adelphia, NJ"
176,Turf Quality,10/15/20,4,60,DLFPS-340/3550,DLF Pickseed USA,RMD,12,5,175,2020,Oct,RMD-2020-10-15,10,8,3,"Adelphia, NJ"
176,Turf Quality,10/23/20,4,60,DLFPS-340/3550,DLF Pickseed USA,RMD,12,5,175,2020,Oct,RMD-2020-10-23,11,8,3,"Adelphia, NJ"
176,Turf Quality,3/30/21,6,60,DLFPS-340/3550,DLF Pickseed USA,RMD,12,5,175,2021,Mar,RMD-2021-03-30,12,5,4,"Adelphia, NJ"
176,Turf Quality,4/22/21,7,60,DLFPS-340/3550,DLF Pickseed USA,PLV,12,5,175,2021,Apr,PLV-2021-04-22,6,1,4,"Adelphia, NJ"
176,Turf Quality,5/28/21,5,60,DLFPS-340/3550,DLF Pickseed USA,SAB,12,5,175,2021,May,SAB-2021-05-28,29,6,4,"Adelphia, NJ"
176,Turf Quality,6/11/21,6,60,DLFPS-340/3550,DLF Pickseed USA,JEN,12,5,175,2021,Jun,JEN-2021-06-11,2,4,4,"Adelphia, NJ"
176,Turf Quality,7/13/21,7,60,DLFPS-340/3550,DLF Pickseed USA,PLV,12,5,175,2021,Jul,PLV-2021-07-13,7,3,4,"Adelphia, NJ"
176,Turf Quality,8/11/21,8,60,DLFPS-340/3550,DLF Pickseed USA,JEN,12,5,175,2021,Aug,JEN-2021-08-11,3,2,4,"Adelphia, NJ"
176,Turf Quality,9/17/21,7,60,DLFPS-340/3550,DLF Pickseed USA,JEN,12,5,175,2021,Sep,JEN-2021-09-17,4,9,4,"Adelphia, NJ"
176,Turf Quality,10/13/21,7,60,DLFPS-340/3550,DLF Pickseed USA,SAB,12,5,175,2021,Oct,SAB-2021-10-13,30,8,4,"Adelphia, NJ"
176,Turf Quality,11/18/21,7,60,DLFPS-340/3550,DLF Pickseed USA,WAM,12,5,175,2021,Nov,WAM-2021-11-18,36,7,4,"Adelphia, NJ"
155,Turf Quality,4/18/18,2,68,PPG-KB 1320,Mountain View Seeds,RMD,11,5,154,2018,Apr,RMD-2018-04-18,8,1,1,"Adelphia, NJ"
155,Turf Quality,5/10/18,4,68,PPG-KB 1320,Mountain View Seeds,RON,11,5,154,2018,May,RON-2018-05-10,13,6,1,"Adelphia, NJ"
155,Turf Quality,6/7/18,6,68,PPG-KB 1320,Mountain View Seeds,RON,11,5,154,2018,Jun,RON-2018-06-07,14,4,1,"Adelphia, NJ"
155,Turf Quality,7/17/18,3,68,PPG-KB 1320,Mountain View Seeds,RON,11,5,154,2018,Jul,RON-2018-07-17,15,3,1,"Adelphia, NJ"
155,Turf Quality,8/15/18,3,68,PPG-KB 1320,Mountain View Seeds,RMD,11,5,154,2018,Aug,RMD-2018-08-15,9,2,1,"Adelphia, NJ"
155,Turf Quality,9/12/18,1,68,PPG-KB 1320,Mountain View Seeds,RON,11,5,154,2018,Sep,RON-2018-09-12,16,9,1,"Adelphia, NJ"
155,Turf Quality,10/2/18,1,68,PPG-KB 1320,Mountain View Seeds,RON,11,5,154,2018,Oct,RON-2018-10-02,17,8,1,"Adelphia, NJ"
155,Turf Quality,11/9/18,1,68,PPG-KB 1320,Mountain View Seeds,RON,11,5,154,2018,Nov,RON-2018-11-09,18,7,1,"Adelphia, NJ"
155,Turf Quality,4/17/19,1,68,PPG-KB 1320,Mountain View Seeds,RON,11,5,154,2019,Apr,RON-2019-04-17,19,1,2,"Adelphia, NJ"
155,Turf Quality,5/2/19,1,68,PPG-KB 1320,Mountain View Seeds,RON,11,5,154,2019,May,RON-2019-05-02,20,6,2,"Adelphia, NJ"
155,Turf Quality,6/13/19,1,68,PPG-KB 1320,Mountain View Seeds,RON,11,5,154,2019,Jun,RON-2019-06-13,21,4,2,"Adelphia, NJ"
155,Turf Quality,6/17/19,1,68,PPG-KB 1320,Mountain View Seeds,SAB,11,5,154,2019,Jun,SAB-2019-06-17,25,4,2,"Adelphia, NJ"
155,Turf Quality,7/17/19,1,68,PPG-KB 1320,Mountain View Seeds,RON,11,5,154,2019,Jul,RON-2019-07-17,22,3,2,"Adelphia, NJ"
155,Turf Quality,8/22/19,1,68,PPG-KB 1320,Mountain View Seeds,SAB,11,5,154,2019,Aug,SAB-2019-08-22,26,2,2,"Adelphia, NJ"
155,Turf Quality,9/16/19,1,68,PPG-KB 1320,Mountain View Seeds,RON,11,5,154,2019,Sep,RON-2019-09-16,23,9,2,"Adelphia, NJ"
155,Turf Quality,10/10/19,1,68,PPG-KB 1320,Mountain View Seeds,SAB,11,5,154,2019,Oct,SAB-2019-10-10,27,8,2,"Adelphia, NJ"
155,Turf Quality,11/1/19,1,68,PPG-KB 1320,Mountain View Seeds,RON,11,5,154,2019,Nov,RON-2019-11-01,24,7,2,"Adelphia, NJ"
155,Turf Quality,4/28/20,1,68,PPG-KB 1320,Mountain View Seeds,WAM,11,5,154,2020,Apr,WAM-2020-04-28,31,1,3,"Adelphia, NJ"
155,Turf Quality,5/18/20,1,68,PPG-KB 1320,Mountain View Seeds,SAB,11,5,154,2020,May,SAB-2020-05-18,28,6,3,"Adelphia, NJ"
155,Turf Quality,6/17/20,1,68,PPG-KB 1320,Mountain View Seeds,WAM,11,5,154,2020,Jun,WAM-2020-06-17,32,4,3,"Adelphia, NJ"
155,Turf Quality,7/15/20,1,68,PPG-KB 1320,Mountain View Seeds,WAM,11,5,154,2020,Jul,WAM-2020-07-15,33,3,3,"Adelphia, NJ"
155,Turf Quality,8/6/20,2,68,PPG-KB 1320,Mountain View Seeds,PLV,11,5,154,2020,Aug,PLV-2020-08-06,5,2,3,"Adelphia, NJ"
155,Turf Quality,9/2/20,1,68,PPG-KB 1320,Mountain View Seeds,DAS,11,5,154,2020,Sep,DAS-2020-09-02,1,9,3,"Adelphia, NJ"
155,Turf Quality,10/15/20,1,68,PPG-KB 1320,Mountain View Seeds,WAM,11,5,154,2020,Oct,WAM-2020-10-15,34,8,3,"Adelphia, NJ"
155,Turf Quality,11/5/20,1,68,PPG-KB 1320,Mountain View Seeds,WAM,11,5,154,2020,Nov,WAM-2020-11-05,35,7,3,"Adelphia, NJ"
155,Turf Quality,10/15/20,1,68,PPG-KB 1320,Mountain View Seeds,RMD,11,5,154,2020,Oct,RMD-2020-10-15,10,8,3,"Adelphia, NJ"
155,Turf Quality,10/23/20,1,68,PPG-KB 1320,Mountain View Seeds,RMD,11,5,154,2020,Oct,RMD-2020-10-23,11,8,3,"Adelphia, NJ"
155,Turf Quality,3/30/21,1,68,PPG-KB 1320,Mountain View Seeds,RMD,11,5,154,2021,Mar,RMD-2021-03-30,12,5,4,"Adelphia, NJ"
155,Turf Quality,4/22/21,1,68,PPG-KB 1320,Mountain View Seeds,PLV,11,5,154,2021,Apr,PLV-2021-04-22,6,1,4,"Adelphia, NJ"
155,Turf Quality,5/28/21,1,68,PPG-KB 1320,Mountain View Seeds,SAB,11,5,154,2021,May,SAB-2021-05-28,29,6,4,"Adelphia, NJ"
155,Turf Quality,6/11/21,2,68,PPG-KB 1320,Mountain View Seeds,JEN,11,5,154,2021,Jun,JEN-2021-06-11,2,4,4,"Adelphia, NJ"
155,Turf Quality,7/13/21,3,68,PPG-KB 1320,Mountain View Seeds,PLV,11,5,154,2021,Jul,PLV-2021-07-13,7,3,4,"Adelphia, NJ"
155,Turf Quality,8/11/21,3,68,PPG-KB 1320,Mountain View Seeds,JEN,11,5,154,2021,Aug,JEN-2021-08-11,3,2,4,"Adelphia, NJ"
155,Turf Quality,9/17/21,3,68,PPG-KB 1320,Mountain View Seeds,JEN,11,5,154,2021,Sep,JEN-2021-09-17,4,9,4,"Adelphia, NJ"
155,Turf Quality,10/13/21,2,68,PPG-KB 1320,Mountain View Seeds,SAB,11,5,154,2021,Oct,SAB-2021-10-13,30,8,4,"Adelphia, NJ"
155,Turf Quality,11/18/21,4,68,PPG-KB 1320,Mountain View Seeds,WAM,11,5,154,2021,Nov,WAM-2021-11-18,36,7,4,"Adelphia, NJ"
146,Turf Quality,4/18/18,5,79,Kenblue,Standard,RMD,10,5,145,2018,Apr,RMD-2018-04-18,8,1,1,"Adelphia, NJ"
146,Turf Quality,5/10/18,4,79,Kenblue,Standard,RON,10,5,145,2018,May,RON-2018-05-10,13,6,1,"Adelphia, NJ"
146,Turf Quality,6/7/18,3,79,Kenblue,Standard,RON,10,5,145,2018,Jun,RON-2018-06-07,14,4,1,"Adelphia, NJ"
146,Turf Quality,7/17/18,4,79,Kenblue,Standard,RON,10,5,145,2018,Jul,RON-2018-07-17,15,3,1,"Adelphia, NJ"
146,Turf Quality,8/15/18,3,79,Kenblue,Standard,RMD,10,5,145,2018,Aug,RMD-2018-08-15,9,2,1,"Adelphia, NJ"
146,Turf Quality,9/12/18,1,79,Kenblue,Standard,RON,10,5,145,2018,Sep,RON-2018-09-12,16,9,1,"Adelphia, NJ"
146,Turf Quality,10/2/18,1,79,Kenblue,Standard,RON,10,5,145,2018,Oct,RON-2018-10-02,17,8,1,"Adelphia, NJ"
146,Turf Quality,11/9/18,1,79,Kenblue,Standard,RON,10,5,145,2018,Nov,RON-2018-11-09,18,7,1,"Adelphia, NJ"
146,Turf Quality,4/17/19,2,79,Kenblue,Standard,RON,10,5,145,2019,Apr,RON-2019-04-17,19,1,2,"Adelphia, NJ"
146,Turf Quality,5/2/19,2,79,Kenblue,Standard,RON,10,5,145,2019,May,RON-2019-05-02,20,6,2,"Adelphia, NJ"
146,Turf Quality,6/13/19,2,79,Kenblue,Standard,RON,10,5,145,2019,Jun,RON-2019-06-13,21,4,2,"Adelphia, NJ"
146,Turf Quality,6/17/19,3,79,Kenblue,Standard,SAB,10,5,145,2019,Jun,SAB-2019-06-17,25,4,2,"Adelphia, NJ"
146,Turf Quality,7/17/19,3,79,Kenblue,Standard,RON,10,5,145,2019,Jul,RON-2019-07-17,22,3,2,"Adelphia, NJ"
146,Turf Quality,8/22/19,3,79,Kenblue,Standard,SAB,10,5,145,2019,Aug,SAB-2019-08-22,26,2,2,"Adelphia, NJ"
146,Turf Quality,9/16/19,2,79,Kenblue,Standard,RON,10,5,145,2019,Sep,RON-2019-09-16,23,9,2,"Adelphia, NJ"
146,Turf Quality,10/10/19,3,79,Kenblue,Standard,SAB,10,5,145,2019,Oct,SAB-2019-10-10,27,8,2,"Adelphia, NJ"
146,Turf Quality,11/1/19,1,79,Kenblue,Standard,RON,10,5,145,2019,Nov,RON-2019-11-01,24,7,2,"Adelphia, NJ"
146,Turf Quality,4/28/20,3,79,Kenblue,Standard,WAM,10,5,145,2020,Apr,WAM-2020-04-28,31,1,3,"Adelphia, NJ"
146,Turf Quality,5/18/20,3,79,Kenblue,Standard,SAB,10,5,145,2020,May,SAB-2020-05-18,28,6,3,"Adelphia, NJ"
146,Turf Quality,6/17/20,1,79,Kenblue,Standard,WAM,10,5,145,2020,Jun,WAM-2020-06-17,32,4,3,"Adelphia, NJ"
146,Turf Quality,7/15/20,2,79,Kenblue,Standard,WAM,10,5,145,2020,Jul,WAM-2020-07-15,33,3,3,"Adelphia, NJ"
146,Turf Quality,8/6/20,5,79,Kenblue,Standard,PLV,10,5,145,2020,Aug,PLV-2020-08-06,5,2,3,"Adelphia, NJ"
146,Turf Quality,9/2/20,3,79,Kenblue,Standard,DAS,10,5,145,2020,Sep,DAS-2020-09-02,1,9,3,"Adelphia, NJ"
146,Turf Quality,10/15/20,2,79,Kenblue,Standard,WAM,10,5,145,2020,Oct,WAM-2020-10-15,34,8,3,"Adelphia, NJ"
146,Turf Quality,11/5/20,3,79,Kenblue,Standard,WAM,10,5,145,2020,Nov,WAM-2020-11-05,35,7,3,"Adelphia, NJ"
146,Turf Quality,10/15/20,2,79,Kenblue,Standard,RMD,10,5,145,2020,Oct,RMD-2020-10-15,10,8,3,"Adelphia, NJ"
146,Turf Quality,10/23/20,2,79,Kenblue,Standard,RMD,10,5,145,2020,Oct,RMD-2020-10-23,11,8,3,"Adelphia, NJ"
146,Turf Quality,3/30/21,3,79,Kenblue,Standard,RMD,10,5,145,2021,Mar,RMD-2021-03-30,12,5,4,"Adelphia, NJ"
146,Turf Quality,4/22/21,6,79,Kenblue,Standard,PLV,10,5,145,2021,Apr,PLV-2021-04-22,6,1,4,"Adelphia, NJ"
146,Turf Quality,5/28/21,4,79,Kenblue,Standard,SAB,10,5,145,2021,May,SAB-2021-05-28,29,6,4,"Adelphia, NJ"
146,Turf Quality,6/11/21,3,79,Kenblue,Standard,JEN,10,5,145,2021,Jun,JEN-2021-06-11,2,4,4,"Adelphia, NJ"
146,Turf Quality,7/13/21,6,79,Kenblue,Standard,PLV,10,5,145,2021,Jul,PLV-2021-07-13,7,3,4,"Adelphia, NJ"
146,Turf Quality,8/11/21,4,79,Kenblue,Standard,JEN,10,5,145,2021,Aug,JEN-2021-08-11,3,2,4,"Adelphia, NJ"
146,Turf Quality,9/17/21,4,79,Kenblue,Standard,JEN,10,5,145,2021,Sep,JEN-2021-09-17,4,9,4,"Adelphia, NJ"
146,Turf Quality,10/13/21,6,79,Kenblue,Standard,SAB,10,5,145,2021,Oct,SAB-2021-10-13,30,8,4,"Adelphia, NJ"
146,Turf Quality,11/18/21,3,79,Kenblue,Standard,WAM,10,5,145,2021,Nov,WAM-2021-11-18,36,7,4,"Adelphia, NJ"
125,Turf Quality,4/18/18,6,58,DLFPS-340/3444,DLF Pickseed USA,RMD,9,5,124,2018,Apr,RMD-2018-04-18,8,1,1,"Adelphia, NJ"
125,Turf Quality,5/10/18,6,58,DLFPS-340/3444,DLF Pickseed USA,RON,9,5,124,2018,May,RON-2018-05-10,13,6,1,"Adelphia, NJ"
125,Turf Quality,6/7/18,5,58,DLFPS-340/3444,DLF Pickseed USA,RON,9,5,124,2018,Jun,RON-2018-06-07,14,4,1,"Adelphia, NJ"
125,Turf Quality,7/17/18,5,58,DLFPS-340/3444,DLF Pickseed USA,RON,9,5,124,2018,Jul,RON-2018-07-17,15,3,1,"Adelphia, NJ"
125,Turf Quality,8/15/18,4,58,DLFPS-340/3444,DLF Pickseed USA,RMD,9,5,124,2018,Aug,RMD-2018-08-15,9,2,1,"Adelphia, NJ"
125,Turf Quality,9/12/18,1,58,DLFPS-340/3444,DLF Pickseed USA,RON,9,5,124,2018,Sep,RON-2018-09-12,16,9,1,"Adelphia, NJ"
125,Turf Quality,10/2/18,1,58,DLFPS-340/3444,DLF Pickseed USA,RON,9,5,124,2018,Oct,RON-2018-10-02,17,8,1,"Adelphia, NJ"
125,Turf Quality,11/9/18,1,58,DLFPS-340/3444,DLF Pickseed USA,RON,9,5,124,2018,Nov,RON-2018-11-09,18,7,1,"Adelphia, NJ"
125,Turf Quality,4/17/19,2,58,DLFPS-340/3444,DLF Pickseed USA,RON,9,5,124,2019,Apr,RON-2019-04-17,19,1,2,"Adelphia, NJ"
125,Turf Quality,5/2/19,2,58,DLFPS-340/3444,DLF Pickseed USA,RON,9,5,124,2019,May,RON-2019-05-02,20,6,2,"Adelphia, NJ"
125,Turf Quality,6/13/19,3,58,DLFPS-340/3444,DLF Pickseed USA,RON,9,5,124,2019,Jun,RON-2019-06-13,21,4,2,"Adelphia, NJ"
125,Turf Quality,6/17/19,4,58,DLFPS-340/3444,DLF Pickseed USA,SAB,9,5,124,2019,Jun,SAB-2019-06-17,25,4,2,"Adelphia, NJ"
125,Turf Quality,7/17/19,3,58,DLFPS-340/3444,DLF Pickseed USA,RON,9,5,124,2019,Jul,RON-2019-07-17,22,3,2,"Adelphia, NJ"
125,Turf Quality,8/22/19,1,58,DLFPS-340/3444,DLF Pickseed USA,SAB,9,5,124,2019,Aug,SAB-2019-08-22,26,2,2,"Adelphia, NJ"
125,Turf Quality,9/16/19,1,58,DLFPS-340/3444,DLF Pickseed USA,RON,9,5,124,2019,Sep,RON-2019-09-16,23,9,2,"Adelphia, NJ"
125,Turf Quality,10/10/19,1,58,DLFPS-340/3444,DLF Pickseed USA,SAB,9,5,124,2019,Oct,SAB-2019-10-10,27,8,2,"Adelphia, NJ"
125,Turf Quality,11/1/19,1,58,DLFPS-340/3444,DLF Pickseed USA,RON,9,5,124,2019,Nov,RON-2019-11-01,24,7,2,"Adelphia, NJ"
125,Turf Quality,4/28/20,2,58,DLFPS-340/3444,DLF Pickseed USA,WAM,9,5,124,2020,Apr,WAM-2020-04-28,31,1,3,"Adelphia, NJ"
125,Turf Quality,5/18/20,2,58,DLFPS-340/3444,DLF Pickseed USA,SAB,9,5,124,2020,May,SAB-2020-05-18,28,6,3,"Adelphia, NJ"
125,Turf Quality,6/17/20,2,58,DLFPS-340/3444,DLF Pickseed USA,WAM,9,5,124,2020,Jun,WAM-2020-06-17,32,4,3,"Adelphia, NJ"
125,Turf Quality,7/15/20,3,58,DLFPS-340/3444,DLF Pickseed USA,WAM,9,5,124,2020,Jul,WAM-2020-07-15,33,3,3,"Adelphia, NJ"
125,Turf Quality,8/6/20,3,58,DLFPS-340/3444,DLF Pickseed USA,PLV,9,5,124,2020,Aug,PLV-2020-08-06,5,2,3,"Adelphia, NJ"
125,Turf Quality,9/2/20,2,58,DLFPS-340/3444,DLF Pickseed USA,DAS,9,5,124,2020,Sep,DAS-2020-09-02,1,9,3,"Adelphia, NJ"
125,Turf Quality,10/15/20,2,58,DLFPS-340/3444,DLF Pickseed USA,WAM,9,5,124,2020,Oct,WAM-2020-10-15,34,8,3,"Adelphia, NJ"
125,Turf Quality,11/5/20,3,58,DLFPS-340/3444,DLF Pickseed USA,WAM,9,5,124,2020,Nov,WAM-2020-11-05,35,7,3,"Adelphia, NJ"
125,Turf Quality,10/15/20,2,58,DLFPS-340/3444,DLF Pickseed USA,RMD,9,5,124,2020,Oct,RMD-2020-10-15,10,8,3,"Adelphia, NJ"
125,Turf Quality,10/23/20,2,58,DLFPS-340/3444,DLF Pickseed USA,RMD,9,5,124,2020,Oct,RMD-2020-10-23,11,8,3,"Adelphia, NJ"
125,Turf Quality,3/30/21,2,58,DLFPS-340/3444,DLF Pickseed USA,RMD,9,5,124,2021,Mar,RMD-2021-03-30,12,5,4,"Adelphia, NJ"
125,Turf Quality,4/22/21,1,58,DLFPS-340/3444,DLF Pickseed USA,PLV,9,5,124,2021,Apr,PLV-2021-04-22,6,1,4,"Adelphia, NJ"
125,Turf Quality,5/28/21,3,58,DLFPS-340/3444,DLF Pickseed USA,SAB,9,5,124,2021,May,SAB-2021-05-28,29,6,4,"Adelphia, NJ"
125,Turf Quality,6/11/21,5,58,DLFPS-340/3444,DLF Pickseed USA,JEN,9,5,124,2021,Jun,JEN-2021-06-11,2,4,4,"Adelphia, NJ"
125,Turf Quality,7/13/21,4,58,DLFPS-340/3444,DLF Pickseed USA,PLV,9,5,124,2021,Jul,PLV-2021-07-13,7,3,4,"Adelphia, NJ"
125,Turf Quality,8/11/21,5,58,DLFPS-340/3444,DLF Pickseed USA,JEN,9,5,124,2021,Aug,JEN-2021-08-11,3,2,4,"Adelphia, NJ"
125,Turf Quality,9/17/21,5,58,DLFPS-340/3444,DLF Pickseed USA,JEN,9,5,124,2021,Sep,JEN-2021-09-17,4,9,4,"Adelphia, NJ"
125,Turf Quality,10/13/21,4,58,DLFPS-340/3444,DLF Pickseed USA,SAB,9,5,124,2021,Oct,SAB-2021-10-13,30,8,4,"Adelphia, NJ"
125,Turf Quality,11/18/21,5,58,DLFPS-340/3444,DLF Pickseed USA,WAM,9,5,124,2021,Nov,WAM-2021-11-18,36,7,4,"Adelphia, NJ"
116,Turf Quality,4/18/18,3,7,Selway,Seeds Inc.,RMD,8,5,115,2018,Apr,RMD-2018-04-18,8,1,1,"Adelphia, NJ"
116,Turf Quality,5/10/18,4,7,Selway,Seeds Inc.,RON,8,5,115,2018,May,RON-2018-05-10,13,6,1,"Adelphia, NJ"
116,Turf Quality,6/7/18,4,7,Selway,Seeds Inc.,RON,8,5,115,2018,Jun,RON-2018-06-07,14,4,1,"Adelphia, NJ"
116,Turf Quality,7/17/18,4,7,Selway,Seeds Inc.,RON,8,5,115,2018,Jul,RON-2018-07-17,15,3,1,"Adelphia, NJ"
116,Turf Quality,8/15/18,4,7,Selway,Seeds Inc.,RMD,8,5,115,2018,Aug,RMD-2018-08-15,9,2,1,"Adelphia, NJ"
116,Turf Quality,9/12/18,3,7,Selway,Seeds Inc.,RON,8,5,115,2018,Sep,RON-2018-09-12,16,9,1,"Adelphia, NJ"
116,Turf Quality,10/2/18,3,7,Selway,Seeds Inc.,RON,8,5,115,2018,Oct,RON-2018-10-02,17,8,1,"Adelphia, NJ"
116,Turf Quality,11/9/18,4,7,Selway,Seeds Inc.,RON,8,5,115,2018,Nov,RON-2018-11-09,18,7,1,"Adelphia, NJ"
116,Turf Quality,4/17/19,5,7,Selway,Seeds Inc.,RON,8,5,115,2019,Apr,RON-2019-04-17,19,1,2,"Adelphia, NJ"
116,Turf Quality,5/2/19,4,7,Selway,Seeds Inc.,RON,8,5,115,2019,May,RON-2019-05-02,20,6,2,"Adelphia, NJ"
116,Turf Quality,6/13/19,4,7,Selway,Seeds Inc.,RON,8,5,115,2019,Jun,RON-2019-06-13,21,4,2,"Adelphia, NJ"
116,Turf Quality,6/17/19,5,7,Selway,Seeds Inc.,SAB,8,5,115,2019,Jun,SAB-2019-06-17,25,4,2,"Adelphia, NJ"
116,Turf Quality,7/17/19,6,7,Selway,Seeds Inc.,RON,8,5,115,2019,Jul,RON-2019-07-17,22,3,2,"Adelphia, NJ"
116,Turf Quality,8/22/19,1,7,Selway,Seeds Inc.,SAB,8,5,115,2019,Aug,SAB-2019-08-22,26,2,2,"Adelphia, NJ"
116,Turf Quality,9/16/19,2,7,Selway,Seeds Inc.,RON,8,5,115,2019,Sep,RON-2019-09-16,23,9,2,"Adelphia, NJ"
116,Turf Quality,10/10/19,3,7,Selway,Seeds Inc.,SAB,8,5,115,2019,Oct,SAB-2019-10-10,27,8,2,"Adelphia, NJ"
116,Turf Quality,11/1/19,3,7,Selway,Seeds Inc.,RON,8,5,115,2019,Nov,RON-2019-11-01,24,7,2,"Adelphia, NJ"
116,Turf Quality,4/28/20,5,7,Selway,Seeds Inc.,WAM,8,5,115,2020,Apr,WAM-2020-04-28,31,1,3,"Adelphia, NJ"
116,Turf Quality,5/18/20,7,7,Selway,Seeds Inc.,SAB,8,5,115,2020,May,SAB-2020-05-18,28,6,3,"Adelphia, NJ"
116,Turf Quality,6/17/20,3,7,Selway,Seeds Inc.,WAM,8,5,115,2020,Jun,WAM-2020-06-17,32,4,3,"Adelphia, NJ"
116,Turf Quality,7/15/20,4,7,Selway,Seeds Inc.,WAM,8,5,115,2020,Jul,WAM-2020-07-15,33,3,3,"Adelphia, NJ"
116,Turf Quality,8/6/20,7,7,Selway,Seeds Inc.,PLV,8,5,115,2020,Aug,PLV-2020-08-06,5,2,3,"Adelphia, NJ"
116,Turf Quality,9/2/20,6,7,Selway,Seeds Inc.,DAS,8,5,115,2020,Sep,DAS-2020-09-02,1,9,3,"Adelphia, NJ"
116,Turf Quality,10/15/20,4,7,Selway,Seeds Inc.,WAM,8,5,115,2020,Oct,WAM-2020-10-15,34,8,3,"Adelphia, NJ"
116,Turf Quality,11/5/20,5,7,Selway,Seeds Inc.,WAM,8,5,115,2020,Nov,WAM-2020-11-05,35,7,3,"Adelphia, NJ"
116,Turf Quality,10/15/20,5,7,Selway,Seeds Inc.,RMD,8,5,115,2020,Oct,RMD-2020-10-15,10,8,3,"Adelphia, NJ"
116,Turf Quality,10/23/20,6,7,Selway,Seeds Inc.,RMD,8,5,115,2020,Oct,RMD-2020-10-23,11,8,3,"Adelphia, NJ"
116,Turf Quality,3/30/21,6,7,Selway,Seeds Inc.,RMD,8,5,115,2021,Mar,RMD-2021-03-30,12,5,4,"Adelphia, NJ"
116,Turf Quality,4/22/21,7,7,Selway,Seeds Inc.,PLV,8,5,115,2021,Apr,PLV-2021-04-22,6,1,4,"Adelphia, NJ"
116,Turf Quality,5/28/21,4,7,Selway,Seeds Inc.,SAB,8,5,115,2021,May,SAB-2021-05-28,29,6,4,"Adelphia, NJ"
116,Turf Quality,6/11/21,3,7,Selway,Seeds Inc.,JEN,8,5,115,2021,Jun,JEN-2021-06-11,2,4,4,"Adelphia, NJ"
116,Turf Quality,7/13/21,5,7,Selway,Seeds Inc.,PLV,8,5,115,2021,Jul,PLV-2021-07-13,7,3,4,"Adelphia, NJ"
116,Turf Quality,8/11/21,7,7,Selway,Seeds Inc.,JEN,8,5,115,2021,Aug,JEN-2021-08-11,3,2,4,"Adelphia, NJ"
116,Turf Quality,9/17/21,8,7,Selway,Seeds Inc.,JEN,8,5,115,2021,Sep,JEN-2021-09-17,4,9,4,"Adelphia, NJ"
116,Turf Quality,10/13/21,4,7,Selway,Seeds Inc.,SAB,8,5,115,2021,Oct,SAB-2021-10-13,30,8,4,"Adelphia, NJ"
116,Turf Quality,11/18/21,7,7,Selway,Seeds Inc.,WAM,8,5,115,2021,Nov,WAM-2021-11-18,36,7,4,"Adelphia, NJ"
95,Turf Quality,4/18/18,3,56,DLFPS-340/3549,DLF Pickseed USA,RMD,7,5,94,2018,Apr,RMD-2018-04-18,8,1,1,"Adelphia, NJ"
95,Turf Quality,5/10/18,5,56,DLFPS-340/3549,DLF Pickseed USA,RON,7,5,94,2018,May,RON-2018-05-10,13,6,1,"Adelphia, NJ"
95,Turf Quality,6/7/18,4,56,DLFPS-340/3549,DLF Pickseed USA,RON,7,5,94,2018,Jun,RON-2018-06-07,14,4,1,"Adelphia, NJ"
95,Turf Quality,7/17/18,5,56,DLFPS-340/3549,DLF Pickseed USA,RON,7,5,94,2018,Jul,RON-2018-07-17,15,3,1,"Adelphia, NJ"
95,Turf Quality,8/15/18,7,56,DLFPS-340/3549,DLF Pickseed USA,RMD,7,5,94,2018,Aug,RMD-2018-08-15,9,2,1,"Adelphia, NJ"
95,Turf Quality,9/12/18,5,56,DLFPS-340/3549,DLF Pickseed USA,RON,7,5,94,2018,Sep,RON-2018-09-12,16,9,1,"Adelphia, NJ"
95,Turf Quality,10/2/18,5,56,DLFPS-340/3549,DLF Pickseed USA,RON,7,5,94,2018,Oct,RON-2018-10-02,17,8,1,"Adelphia, NJ"
95,Turf Quality,11/9/18,4,56,DLFPS-340/3549,DLF Pickseed USA,RON,7,5,94,2018,Nov,RON-2018-11-09,18,7,1,"Adelphia, NJ"
95,Turf Quality,4/17/19,4,56,DLFPS-340/3549,DLF Pickseed USA,RON,7,5,94,2019,Apr,RON-2019-04-17,19,1,2,"Adelphia, NJ"
95,Turf Quality,5/2/19,4,56,DLFPS-340/3549,DLF Pickseed USA,RON,7,5,94,2019,May,RON-2019-05-02,20,6,2,"Adelphia, NJ"
95,Turf Quality,6/13/19,5,56,DLFPS-340/3549,DLF Pickseed USA,RON,7,5,94,2019,Jun,RON-2019-06-13,21,4,2,"Adelphia, NJ"
95,Turf Quality,6/17/19,5,56,DLFPS-340/3549,DLF Pickseed USA,SAB,7,5,94,2019,Jun,SAB-2019-06-17,25,4,2,"Adelphia, NJ"
95,Turf Quality,7/17/19,6,56,DLFPS-340/3549,DLF Pickseed USA,RON,7,5,94,2019,Jul,RON-2019-07-17,22,3,2,"Adelphia, NJ"
95,Turf Quality,8/22/19,5,56,DLFPS-340/3549,DLF Pickseed USA,SAB,7,5,94,2019,Aug,SAB-2019-08-22,26,2,2,"Adelphia, NJ"
95,Turf Quality,9/16/19,7,56,DLFPS-340/3549,DLF Pickseed USA,RON,7,5,94,2019,Sep,RON-2019-09-16,23,9,2,"Adelphia, NJ"
95,Turf Quality,10/10/19,5,56,DLFPS-340/3549,DLF Pickseed USA,SAB,7,5,94,2019,Oct,SAB-2019-10-10,27,8,2,"Adelphia, NJ"
95,Turf Quality,11/1/19,4,56,DLFPS-340/3549,DLF Pickseed USA,RON,7,5,94,2019,Nov,RON-2019-11-01,24,7,2,"Adelphia, NJ"
95,Turf Quality,4/28/20,5,56,DLFPS-340/3549,DLF Pickseed USA,WAM,7,5,94,2020,Apr,WAM-2020-04-28,31,1,3,"Adelphia, NJ"
95,Turf Quality,5/18/20,4,56,DLFPS-340/3549,DLF Pickseed USA,SAB,7,5,94,2020,May,SAB-2020-05-18,28,6,3,"Adelphia, NJ"
95,Turf Quality,6/17/20,5,56,DLFPS-340/3549,DLF Pickseed USA,WAM,7,5,94,2020,Jun,WAM-2020-06-17,32,4,3,"Adelphia, NJ"
95,Turf Quality,7/15/20,6,56,DLFPS-340/3549,DLF Pickseed USA,WAM,7,5,94,2020,Jul,WAM-2020-07-15,33,3,3,"Adelphia, NJ"
95,Turf Quality,8/6/20,7,56,DLFPS-340/3549,DLF Pickseed USA,PLV,7,5,94,2020,Aug,PLV-2020-08-06,5,2,3,"Adelphia, NJ"
95,Turf Quality,9/2/20,6,56,DLFPS-340/3549,DLF Pickseed USA,DAS,7,5,94,2020,Sep,DAS-2020-09-02,1,9,3,"Adelphia, NJ"
95,Turf Quality,10/15/20,4,56,DLFPS-340/3549,DLF Pickseed USA,WAM,7,5,94,2020,Oct,WAM-2020-10-15,34,8,3,"Adelphia, NJ"
95,Turf Quality,11/5/20,5,56,DLFPS-340/3549,DLF Pickseed USA,WAM,7,5,94,2020,Nov,WAM-2020-11-05,35,7,3,"Adelphia, NJ"
95,Turf Quality,10/15/20,3,56,DLFPS-340/3549,DLF Pickseed USA,RMD,7,5,94,2020,Oct,RMD-2020-10-15,10,8,3,"Adelphia, NJ"
95,Turf Quality,10/23/20,3,56,DLFPS-340/3549,DLF Pickseed USA,RMD,7,5,94,2020,Oct,RMD-2020-10-23,11,8,3,"Adelphia, NJ"
95,Turf Quality,3/30/21,3,56,DLFPS-340/3549,DLF Pickseed USA,RMD,7,5,94,2021,Mar,RMD-2021-03-30,12,5,4,"Adelphia, NJ"
95,Turf Quality,4/22/21,5,56,DLFPS-340/3549,DLF Pickseed USA,PLV,7,5,94,2021,Apr,PLV-2021-04-22,6,1,4,"Adelphia, NJ"
95,Turf Quality,5/28/21,5,56,DLFPS-340/3549,DLF Pickseed USA,SAB,7,5,94,2021,May,SAB-2021-05-28,29,6,4,"Adelphia, NJ"
95,Turf Quality,6/11/21,5,56,DLFPS-340/3549,DLF Pickseed USA,JEN,7,5,94,2021,Jun,JEN-2021-06-11,2,4,4,"Adelphia, NJ"
95,Turf Quality,7/13/21,7,56,DLFPS-340/3549,DLF Pickseed USA,PLV,7,5,94,2021,Jul,PLV-2021-07-13,7,3,4,"Adelphia, NJ"
95,Turf Quality,8/11/21,7,56,DLFPS-340/3549,DLF Pickseed USA,JEN,7,5,94,2021,Aug,JEN-2021-08-11,3,2,4,"Adelphia, NJ"
95,Turf Quality,9/17/21,5,56,DLFPS-340/3549,DLF Pickseed USA,JEN,7,5,94,2021,Sep,JEN-2021-09-17,4,9,4,"Adelphia, NJ"
95,Turf Quality,10/13/21,4,56,DLFPS-340/3549,DLF Pickseed USA,SAB,7,5,94,2021,Oct,SAB-2021-10-13,30,8,4,"Adelphia, NJ"
95,Turf Quality,11/18/21,5,56,DLFPS-340/3549,DLF Pickseed USA,WAM,7,5,94,2021,Nov,WAM-2021-11-18,36,7,4,"Adelphia, NJ"
86,Turf Quality,4/18/18,3,86,New Moon (PST-K15-177),Pure Seed Testing Inc.,RMD,6,5,86,2018,Apr,RMD-2018-04-18,8,1,1,"Adelphia, NJ"
86,Turf Quality,5/10/18,5,86,New Moon (PST-K15-177),Pure Seed Testing Inc.,RON,6,5,86,2018,May,RON-2018-05-10,13,6,1,"Adelphia, NJ"
86,Turf Quality,6/7/18,5,86,New Moon (PST-K15-177),Pure Seed Testing Inc.,RON,6,5,86,2018,Jun,RON-2018-06-07,14,4,1,"Adelphia, NJ"
86,Turf Quality,7/17/18,5,86,New Moon (PST-K15-177),Pure Seed Testing Inc.,RON,6,5,86,2018,Jul,RON-2018-07-17,15,3,1,"Adelphia, NJ"
86,Turf Quality,8/15/18,6,86,New Moon (PST-K15-177),Pure Seed Testing Inc.,RMD,6,5,86,2018,Aug,RMD-2018-08-15,9,2,1,"Adelphia, NJ"
86,Turf Quality,9/12/18,5,86,New Moon (PST-K15-177),Pure Seed Testing Inc.,RON,6,5,86,2018,Sep,RON-2018-09-12,16,9,1,"Adelphia, NJ"
86,Turf Quality,10/2/18,5,86,New Moon (PST-K15-177),Pure Seed Testing Inc.,RON,6,5,86,2018,Oct,RON-2018-10-02,17,8,1,"Adelphia, NJ"
86,Turf Quality,11/9/18,5,86,New Moon (PST-K15-177),Pure Seed Testing Inc.,RON,6,5,86,2018,Nov,RON-2018-11-09,18,7,1,"Adelphia, NJ"
86,Turf Quality,4/17/19,4,86,New Moon (PST-K15-177),Pure Seed Testing Inc.,RON,6,5,86,2019,Apr,RON-2019-04-17,19,1,2,"Adelphia, NJ"
86,Turf Quality,5/2/19,5,86,New Moon (PST-K15-177),Pure Seed Testing Inc.,RON,6,5,86,2019,May,RON-2019-05-02,20,6,2,"Adelphia, NJ"
86,Turf Quality,6/13/19,5,86,New Moon (PST-K15-177),Pure Seed Testing Inc.,RON,6,5,86,2019,Jun,RON-2019-06-13,21,4,2,"Adelphia, NJ"
86,Turf Quality,6/17/19,5,86,New Moon (PST-K15-177),Pure Seed Testing Inc.,SAB,6,5,86,2019,Jun,SAB-2019-06-17,25,4,2,"Adelphia, NJ"
86,Turf Quality,7/17/19,4,86,New Moon (PST-K15-177),Pure Seed Testing Inc.,RON,6,5,86,2019,Jul,RON-2019-07-17,22,3,2,"Adelphia, NJ"
86,Turf Quality,8/22/19,4,86,New Moon (PST-K15-177),Pure Seed Testing Inc.,SAB,6,5,86,2019,Aug,SAB-2019-08-22,26,2,2,"Adelphia, NJ"
86,Turf Quality,9/16/19,4,86,New Moon (PST-K15-177),Pure Seed Testing Inc.,RON,6,5,86,2019,Sep,RON-2019-09-16,23,9,2,"Adelphia, NJ"
86,Turf Quality,10/10/19,3,86,New Moon (PST-K15-177),Pure Seed Testing Inc.,SAB,6,5,86,2019,Oct,SAB-2019-10-10,27,8,2,"Adelphia, NJ"
86,Turf Quality,11/1/19,4,86,New Moon (PST-K15-177),Pure Seed Testing Inc.,RON,6,5,86,2019,Nov,RON-2019-11-01,24,7,2,"Adelphia, NJ"
86,Turf Quality,4/28/20,4,86,New Moon (PST-K15-177),Pure Seed Testing Inc.,WAM,6,5,86,2020,Apr,WAM-2020-04-28,31,1,3,"Adelphia, NJ"
86,Turf Quality,5/18/20,2,86,New Moon (PST-K15-177),Pure Seed Testing Inc.,SAB,6,5,86,2020,May,SAB-2020-05-18,28,6,3,"Adelphia, NJ"
86,Turf Quality,6/17/20,3,86,New Moon (PST-K15-177),Pure Seed Testing Inc.,WAM,6,5,86,2020,Jun,WAM-2020-06-17,32,4,3,"Adelphia, NJ"
86,Turf Quality,7/15/20,2,86,New Moon (PST-K15-177),Pure Seed Testing Inc.,WAM,6,5,86,2020,Jul,WAM-2020-07-15,33,3,3,"Adelphia, NJ"
86,Turf Quality,8/6/20,2,86,New Moon (PST-K15-177),Pure Seed Testing Inc.,PLV,6,5,86,2020,Aug,PLV-2020-08-06,5,2,3,"Adelphia, NJ"
86,Turf Quality,9/2/20,4,86,New Moon (PST-K15-177),Pure Seed Testing Inc.,DAS,6,5,86,2020,Sep,DAS-2020-09-02,1,9,3,"Adelphia, NJ"
86,Turf Quality,10/15/20,1,86,New Moon (PST-K15-177),Pure Seed Testing Inc.,WAM,6,5,86,2020,Oct,WAM-2020-10-15,34,8,3,"Adelphia, NJ"
86,Turf Quality,11/5/20,4,86,New Moon (PST-K15-177),Pure Seed Testing Inc.,WAM,6,5,86,2020,Nov,WAM-2020-11-05,35,7,3,"Adelphia, NJ"
86,Turf Quality,10/15/20,1,86,New Moon (PST-K15-177),Pure Seed Testing Inc.,RMD,6,5,86,2020,Oct,RMD-2020-10-15,10,8,3,"Adelphia, NJ"
86,Turf Quality,10/23/20,3,86,New Moon (PST-K15-177),Pure Seed Testing Inc.,RMD,6,5,86,2020,Oct,RMD-2020-10-23,11,8,3,"Adelphia, NJ"
86,Turf Quality,3/30/21,1,86,New Moon (PST-K15-177),Pure Seed Testing Inc.,RMD,6,5,86,2021,Mar,RMD-2021-03-30,12,5,4,"Adelphia, NJ"
86,Turf Quality,4/22/21,2,86,New Moon (PST-K15-177),Pure Seed Testing Inc.,PLV,6,5,86,2021,Apr,PLV-2021-04-22,6,1,4,"Adelphia, NJ"
86,Turf Quality,5/28/21,1,86,New Moon (PST-K15-177),Pure Seed Testing Inc.,SAB,6,5,86,2021,May,SAB-2021-05-28,29,6,4,"Adelphia, NJ"
86,Turf Quality,6/11/21,2,86,New Moon (PST-K15-177),Pure Seed Testing Inc.,JEN,6,5,86,2021,Jun,JEN-2021-06-11,2,4,4,"Adelphia, NJ"
86,Turf Quality,7/13/21,3,86,New Moon (PST-K15-177),Pure Seed Testing Inc.,PLV,6,5,86,2021,Jul,PLV-2021-07-13,7,3,4,"Adelphia, NJ"
86,Turf Quality,8/11/21,2,86,New Moon (PST-K15-177),Pure Seed Testing Inc.,JEN,6,5,86,2021,Aug,JEN-2021-08-11,3,2,4,"Adelphia, NJ"
86,Turf Quality,9/17/21,2,86,New Moon (PST-K15-177),Pure Seed Testing Inc.,JEN,6,5,86,2021,Sep,JEN-2021-09-17,4,9,4,"Adelphia, NJ"
86,Turf Quality,10/13/21,2,86,New Moon (PST-K15-177),Pure Seed Testing Inc.,SAB,6,5,86,2021,Oct,SAB-2021-10-13,30,8,4,"Adelphia, NJ"
86,Turf Quality,11/18/21,4,86,New Moon (PST-K15-177),Pure Seed Testing Inc.,WAM,6,5,86,2021,Nov,WAM-2021-11-18,36,7,4,"Adelphia, NJ"
65,Turf Quality,4/18/18,3,65,A16-7,Mountain View Seeds,RMD,5,5,65,2018,Apr,RMD-2018-04-18,8,1,1,"Adelphia, NJ"
65,Turf Quality,5/10/18,4,65,A16-7,Mountain View Seeds,RON,5,5,65,2018,May,RON-2018-05-10,13,6,1,"Adelphia, NJ"
65,Turf Quality,6/7/18,6,65,A16-7,Mountain View Seeds,RON,5,5,65,2018,Jun,RON-2018-06-07,14,4,1,"Adelphia, NJ"
65,Turf Quality,7/17/18,5,65,A16-7,Mountain View Seeds,RON,5,5,65,2018,Jul,RON-2018-07-17,15,3,1,"Adelphia, NJ"
65,Turf Quality,8/15/18,5,65,A16-7,Mountain View Seeds,RMD,5,5,65,2018,Aug,RMD-2018-08-15,9,2,1,"Adelphia, NJ"
65,Turf Quality,9/12/18,4,65,A16-7,Mountain View Seeds,RON,5,5,65,2018,Sep,RON-2018-09-12,16,9,1,"Adelphia, NJ"
65,Turf Quality,10/2/18,4,65,A16-7,Mountain View Seeds,RON,5,5,65,2018,Oct,RON-2018-10-02,17,8,1,"Adelphia, NJ"
65,Turf Quality,11/9/18,4,65,A16-7,Mountain View Seeds,RON,5,5,65,2018,Nov,RON-2018-11-09,18,7,1,"Adelphia, NJ"
65,Turf Quality,4/17/19,3,65,A16-7,Mountain View Seeds,RON,5,5,65,2019,Apr,RON-2019-04-17,19,1,2,"Adelphia, NJ"
65,Turf Quality,5/2/19,4,65,A16-7,Mountain View Seeds,RON,5,5,65,2019,May,RON-2019-05-02,20,6,2,"Adelphia, NJ"
65,Turf Quality,6/13/19,4,65,A16-7,Mountain View Seeds,RON,5,5,65,2019,Jun,RON-2019-06-13,21,4,2,"Adelphia, NJ"
65,Turf Quality,6/17/19,4,65,A16-7,Mountain View Seeds,SAB,5,5,65,2019,Jun,SAB-2019-06-17,25,4,2,"Adelphia, NJ"
65,Turf Quality,7/17/19,5,65,A16-7,Mountain View Seeds,RON,5,5,65,2019,Jul,RON-2019-07-17,22,3,2,"Adelphia, NJ"
65,Turf Quality,8/22/19,5,65,A16-7,Mountain View Seeds,SAB,5,5,65,2019,Aug,SAB-2019-08-22,26,2,2,"Adelphia, NJ"
65,Turf Quality,9/16/19,6,65,A16-7,Mountain View Seeds,RON,5,5,65,2019,Sep,RON-2019-09-16,23,9,2,"Adelphia, NJ"
65,Turf Quality,10/10/19,4,65,A16-7,Mountain View Seeds,SAB,5,5,65,2019,Oct,SAB-2019-10-10,27,8,2,"Adelphia, NJ"
65,Turf Quality,11/1/19,6,65,A16-7,Mountain View Seeds,RON,5,5,65,2019,Nov,RON-2019-11-01,24,7,2,"Adelphia, NJ"
65,Turf Quality,4/28/20,4,65,A16-7,Mountain View Seeds,WAM,5,5,65,2020,Apr,WAM-2020-04-28,31,1,3,"Adelphia, NJ"
65,Turf Quality,5/18/20,4,65,A16-7,Mountain View Seeds,SAB,5,5,65,2020,May,SAB-2020-05-18,28,6,3,"Adelphia, NJ"
65,Turf Quality,6/17/20,5,65,A16-7,Mountain View Seeds,WAM,5,5,65,2020,Jun,WAM-2020-06-17,32,4,3,"Adelphia, NJ"
65,Turf Quality,7/15/20,5,65,A16-7,Mountain View Seeds,WAM,5,5,65,2020,Jul,WAM-2020-07-15,33,3,3,"Adelphia, NJ"
65,Turf Quality,8/6/20,6,65,A16-7,Mountain View Seeds,PLV,5,5,65,2020,Aug,PLV-2020-08-06,5,2,3,"Adelphia, NJ"
65,Turf Quality,9/2/20,5,65,A16-7,Mountain View Seeds,DAS,5,5,65,2020,Sep,DAS-2020-09-02,1,9,3,"Adelphia, NJ"
65,Turf Quality,10/15/20,3,65,A16-7,Mountain View Seeds,WAM,5,5,65,2020,Oct,WAM-2020-10-15,34,8,3,"Adelphia, NJ"
65,Turf Quality,11/5/20,4,65,A16-7,Mountain View Seeds,WAM,5,5,65,2020,Nov,WAM-2020-11-05,35,7,3,"Adelphia, NJ"
65,Turf Quality,10/15/20,4,65,A16-7,Mountain View Seeds,RMD,5,5,65,2020,Oct,RMD-2020-10-15,10,8,3,"Adelphia, NJ"
65,Turf Quality,10/23/20,3,65,A16-7,Mountain View Seeds,RMD,5,5,65,2020,Oct,RMD-2020-10-23,11,8,3,"Adelphia, NJ"
65,Turf Quality,3/30/21,3,65,A16-7,Mountain View Seeds,RMD,5,5,65,2021,Mar,RMD-2021-03-30,12,5,4,"Adelphia, NJ"
65,Turf Quality,4/22/21,4,65,A16-7,Mountain View Seeds,PLV,5,5,65,2021,Apr,PLV-2021-04-22,6,1,4,"Adelphia, NJ"
65,Turf Quality,5/28/21,3,65,A16-7,Mountain View Seeds,SAB,5,5,65,2021,May,SAB-2021-05-28,29,6,4,"Adelphia, NJ"
65,Turf Quality,6/11/21,4,65,A16-7,Mountain View Seeds,JEN,5,5,65,2021,Jun,JEN-2021-06-11,2,4,4,"Adelphia, NJ"
65,Turf Quality,7/13/21,7,65,A16-7,Mountain View Seeds,PLV,5,5,65,2021,Jul,PLV-2021-07-13,7,3,4,"Adelphia, NJ"
65,Turf Quality,8/11/21,5,65,A16-7,Mountain View Seeds,JEN,5,5,65,2021,Aug,JEN-2021-08-11,3,2,4,"Adelphia, NJ"
65,Turf Quality,9/17/21,3,65,A16-7,Mountain View Seeds,JEN,5,5,65,2021,Sep,JEN-2021-09-17,4,9,4,"Adelphia, NJ"
65,Turf Quality,10/13/21,5,65,A16-7,Mountain View Seeds,SAB,5,5,65,2021,Oct,SAB-2021-10-13,30,8,4,"Adelphia, NJ"
65,Turf Quality,11/18/21,5,65,A16-7,Mountain View Seeds,WAM,5,5,65,2021,Nov,WAM-2021-11-18,36,7,4,"Adelphia, NJ"
56,Turf Quality,4/18/18,4,56,DLFPS-340/3549,DLF Pickseed USA,RMD,4,5,56,2018,Apr,RMD-2018-04-18,8,1,1,"Adelphia, NJ"
56,Turf Quality,5/10/18,6,56,DLFPS-340/3549,DLF Pickseed USA,RON,4,5,56,2018,May,RON-2018-05-10,13,6,1,"Adelphia, NJ"
56,Turf Quality,6/7/18,5,56,DLFPS-340/3549,DLF Pickseed USA,RON,4,5,56,2018,Jun,RON-2018-06-07,14,4,1,"Adelphia, NJ"
56,Turf Quality,7/17/18,4,56,DLFPS-340/3549,DLF Pickseed USA,RON,4,5,56,2018,Jul,RON-2018-07-17,15,3,1,"Adelphia, NJ"
56,Turf Quality,8/15/18,5,56,DLFPS-340/3549,DLF Pickseed USA,RMD,4,5,56,2018,Aug,RMD-2018-08-15,9,2,1,"Adelphia, NJ"
56,Turf Quality,9/12/18,3,56,DLFPS-340/3549,DLF Pickseed USA,RON,4,5,56,2018,Sep,RON-2018-09-12,16,9,1,"Adelphia, NJ"
56,Turf Quality,10/2/18,2,56,DLFPS-340/3549,DLF Pickseed USA,RON,4,5,56,2018,Oct,RON-2018-10-02,17,8,1,"Adelphia, NJ"
56,Turf Quality,11/9/18,2,56,DLFPS-340/3549,DLF Pickseed USA,RON,4,5,56,2018,Nov,RON-2018-11-09,18,7,1,"Adelphia, NJ"
56,Turf Quality,4/17/19,3,56,DLFPS-340/3549,DLF Pickseed USA,RON,4,5,56,2019,Apr,RON-2019-04-17,19,1,2,"Adelphia, NJ"
56,Turf Quality,5/2/19,3,56,DLFPS-340/3549,DLF Pickseed USA,RON,4,5,56,2019,May,RON-2019-05-02,20,6,2,"Adelphia, NJ"
56,Turf Quality,6/13/19,3,56,DLFPS-340/3549,DLF Pickseed USA,RON,4,5,56,2019,Jun,RON-2019-06-13,21,4,2,"Adelphia, NJ"
56,Turf Quality,6/17/19,4,56,DLFPS-340/3549,DLF Pickseed USA,SAB,4,5,56,2019,Jun,SAB-2019-06-17,25,4,2,"Adelphia, NJ"
56,Turf Quality,7/17/19,4,56,DLFPS-340/3549,DLF Pickseed USA,RON,4,5,56,2019,Jul,RON-2019-07-17,22,3,2,"Adelphia, NJ"
56,Turf Quality,8/22/19,3,56,DLFPS-340/3549,DLF Pickseed USA,SAB,4,5,56,2019,Aug,SAB-2019-08-22,26,2,2,"Adelphia, NJ"
56,Turf Quality,9/16/19,2,56,DLFPS-340/3549,DLF Pickseed USA,RON,4,5,56,2019,Sep,RON-2019-09-16,23,9,2,"Adelphia, NJ"
56,Turf Quality,10/10/19,2,56,DLFPS-340/3549,DLF Pickseed USA,SAB,4,5,56,2019,Oct,SAB-2019-10-10,27,8,2,"Adelphia, NJ"
56,Turf Quality,11/1/19,2,56,DLFPS-340/3549,DLF Pickseed USA,RON,4,5,56,2019,Nov,RON-2019-11-01,24,7,2,"Adelphia, NJ"
56,Turf Quality,4/28/20,4,56,DLFPS-340/3549,DLF Pickseed USA,WAM,4,5,56,2020,Apr,WAM-2020-04-28,31,1,3,"Adelphia, NJ"
56,Turf Quality,5/18/20,4,56,DLFPS-340/3549,DLF Pickseed USA,SAB,4,5,56,2020,May,SAB-2020-05-18,28,6,3,"Adelphia, NJ"
56,Turf Quality,6/17/20,4,56,DLFPS-340/3549,DLF Pickseed USA,WAM,4,5,56,2020,Jun,WAM-2020-06-17,32,4,3,"Adelphia, NJ"
56,Turf Quality,7/15/20,5,56,DLFPS-340/3549,DLF Pickseed USA,WAM,4,5,56,2020,Jul,WAM-2020-07-15,33,3,3,"Adelphia, NJ"
56,Turf Quality,8/6/20,3,56,DLFPS-340/3549,DLF Pickseed USA,PLV,4,5,56,2020,Aug,PLV-2020-08-06,5,2,3,"Adelphia, NJ"
56,Turf Quality,9/2/20,3,56,DLFPS-340/3549,DLF Pickseed USA,DAS,4,5,56,2020,Sep,DAS-2020-09-02,1,9,3,"Adelphia, NJ"
56,Turf Quality,10/15/20,2,56,DLFPS-340/3549,DLF Pickseed USA,WAM,4,5,56,2020,Oct,WAM-2020-10-15,34,8,3,"Adelphia, NJ"
56,Turf Quality,11/5/20,4,56,DLFPS-340/3549,DLF Pickseed USA,WAM,4,5,56,2020,Nov,WAM-2020-11-05,35,7,3,"Adelphia, NJ"
56,Turf Quality,10/15/20,3,56,DLFPS-340/3549,DLF Pickseed USA,RMD,4,5,56,2020,Oct,RMD-2020-10-15,10,8,3,"Adelphia, NJ"
56,Turf Quality,10/23/20,3,56,DLFPS-340/3549,DLF Pickseed USA,RMD,4,5,56,2020,Oct,RMD-2020-10-23,11,8,3,"Adelphia, NJ"
56,Turf Quality,3/30/21,4,56,DLFPS-340/3549,DLF Pickseed USA,RMD,4,5,56,2021,Mar,RMD-2021-03-30,12,5,4,"Adelphia, NJ"
56,Turf Quality,4/22/21,8,56,DLFPS-340/3549,DLF Pickseed USA,PLV,4,5,56,2021,Apr,PLV-2021-04-22,6,1,4,"Adelphia, NJ"
56,Turf Quality,5/28/21,6,56,DLFPS-340/3549,DLF Pickseed USA,SAB,4,5,56,2021,May,SAB-2021-05-28,29,6,4,"Adelphia, NJ"
56,Turf Quality,6/11/21,4,56,DLFPS-340/3549,DLF Pickseed USA,JEN,4,5,56,2021,Jun,JEN-2021-06-11,2,4,4,"Adelphia, NJ"
56,Turf Quality,7/13/21,4,56,DLFPS-340/3549,DLF Pickseed USA,PLV,4,5,56,2021,Jul,PLV-2021-07-13,7,3,4,"Adelphia, NJ"
56,Turf Quality,8/11/21,4,56,DLFPS-340/3549,DLF Pickseed USA,JEN,4,5,56,2021,Aug,JEN-2021-08-11,3,2,4,"Adelphia, NJ"
56,Turf Quality,9/17/21,2,56,DLFPS-340/3549,DLF Pickseed USA,JEN,4,5,56,2021,Sep,JEN-2021-09-17,4,9,4,"Adelphia, NJ"
56,Turf Quality,10/13/21,2,56,DLFPS-340/3549,DLF Pickseed USA,SAB,4,5,56,2021,Oct,SAB-2021-10-13,30,8,4,"Adelphia, NJ"
56,Turf Quality,11/18/21,5,56,DLFPS-340/3549,DLF Pickseed USA,WAM,4,5,56,2021,Nov,WAM-2021-11-18,36,7,4,"Adelphia, NJ"
35,Turf Quality,4/18/18,1,35,Orion (PST-K13-143),Pure Seed Testing Inc.,RMD,3,5,35,2018,Apr,RMD-2018-04-18,8,1,1,"Adelphia, NJ"
35,Turf Quality,5/10/18,2,35,Orion (PST-K13-143),Pure Seed Testing Inc.,RON,3,5,35,2018,May,RON-2018-05-10,13,6,1,"Adelphia, NJ"
35,Turf Quality,6/7/18,4,35,Orion (PST-K13-143),Pure Seed Testing Inc.,RON,3,5,35,2018,Jun,RON-2018-06-07,14,4,1,"Adelphia, NJ"
35,Turf Quality,7/17/18,5,35,Orion (PST-K13-143),Pure Seed Testing Inc.,RON,3,5,35,2018,Jul,RON-2018-07-17,15,3,1,"Adelphia, NJ"
35,Turf Quality,8/15/18,4,35,Orion (PST-K13-143),Pure Seed Testing Inc.,RMD,3,5,35,2018,Aug,RMD-2018-08-15,9,2,1,"Adelphia, NJ"
35,Turf Quality,9/12/18,4,35,Orion (PST-K13-143),Pure Seed Testing Inc.,RON,3,5,35,2018,Sep,RON-2018-09-12,16,9,1,"Adelphia, NJ"
35,Turf Quality,10/2/18,5,35,Orion (PST-K13-143),Pure Seed Testing Inc.,RON,3,5,35,2018,Oct,RON-2018-10-02,17,8,1,"Adelphia, NJ"
35,Turf Quality,11/9/18,4,35,Orion (PST-K13-143),Pure Seed Testing Inc.,RON,3,5,35,2018,Nov,RON-2018-11-09,18,7,1,"Adelphia, NJ"
35,Turf Quality,4/17/19,4,35,Orion (PST-K13-143),Pure Seed Testing Inc.,RON,3,5,35,2019,Apr,RON-2019-04-17,19,1,2,"Adelphia, NJ"
35,Turf Quality,5/2/19,4,35,Orion (PST-K13-143),Pure Seed Testing Inc.,RON,3,5,35,2019,May,RON-2019-05-02,20,6,2,"Adelphia, NJ"
35,Turf Quality,6/13/19,5,35,Orion (PST-K13-143),Pure Seed Testing Inc.,RON,3,5,35,2019,Jun,RON-2019-06-13,21,4,2,"Adelphia, NJ"
35,Turf Quality,6/17/19,6,35,Orion (PST-K13-143),Pure Seed Testing Inc.,SAB,3,5,35,2019,Jun,SAB-2019-06-17,25,4,2,"Adelphia, NJ"
35,Turf Quality,7/17/19,6,35,Orion (PST-K13-143),Pure Seed Testing Inc.,RON,3,5,35,2019,Jul,RON-2019-07-17,22,3,2,"Adelphia, NJ"
35,Turf Quality,8/22/19,4,35,Orion (PST-K13-143),Pure Seed Testing Inc.,SAB,3,5,35,2019,Aug,SAB-2019-08-22,26,2,2,"Adelphia, NJ"
35,Turf Quality,9/16/19,3,35,Orion (PST-K13-143),Pure Seed Testing Inc.,RON,3,5,35,2019,Sep,RON-2019-09-16,23,9,2,"Adelphia, NJ"
35,Turf Quality,10/10/19,3,35,Orion (PST-K13-143),Pure Seed Testing Inc.,SAB,3,5,35,2019,Oct,SAB-2019-10-10,27,8,2,"Adelphia, NJ"
35,Turf Quality,11/1/19,2,35,Orion (PST-K13-143),Pure Seed Testing Inc.,RON,3,5,35,2019,Nov,RON-2019-11-01,24,7,2,"Adelphia, NJ"
35,Turf Quality,4/28/20,3,35,Orion (PST-K13-143),Pure Seed Testing Inc.,WAM,3,5,35,2020,Apr,WAM-2020-04-28,31,1,3,"Adelphia, NJ"
35,Turf Quality,5/18/20,4,35,Orion (PST-K13-143),Pure Seed Testing Inc.,SAB,3,5,35,2020,May,SAB-2020-05-18,28,6,3,"Adelphia, NJ"
35,Turf Quality,6/17/20,3,35,Orion (PST-K13-143),Pure Seed Testing Inc.,WAM,3,5,35,2020,Jun,WAM-2020-06-17,32,4,3,"Adelphia, NJ"
35,Turf Quality,7/15/20,5,35,Orion (PST-K13-143),Pure Seed Testing Inc.,WAM,3,5,35,2020,Jul,WAM-2020-07-15,33,3,3,"Adelphia, NJ"
35,Turf Quality,8/6/20,6,35,Orion (PST-K13-143),Pure Seed Testing Inc.,PLV,3,5,35,2020,Aug,PLV-2020-08-06,5,2,3,"Adelphia, NJ"
35,Turf Quality,9/2/20,5,35,Orion (PST-K13-143),Pure Seed Testing Inc.,DAS,3,5,35,2020,Sep,DAS-2020-09-02,1,9,3,"Adelphia, NJ"
35,Turf Quality,10/15/20,4,35,Orion (PST-K13-143),Pure Seed Testing Inc.,WAM,3,5,35,2020,Oct,WAM-2020-10-15,34,8,3,"Adelphia, NJ"
35,Turf Quality,11/5/20,5,35,Orion (PST-K13-143),Pure Seed Testing Inc.,WAM,3,5,35,2020,Nov,WAM-2020-11-05,35,7,3,"Adelphia, NJ"
35,Turf Quality,10/15/20,5,35,Orion (PST-K13-143),Pure Seed Testing Inc.,RMD,3,5,35,2020,Oct,RMD-2020-10-15,10,8,3,"Adelphia, NJ"
35,Turf Quality,10/23/20,3,35,Orion (PST-K13-143),Pure Seed Testing Inc.,RMD,3,5,35,2020,Oct,RMD-2020-10-23,11,8,3,"Adelphia, NJ"
35,Turf Quality,3/30/21,4,35,Orion (PST-K13-143),Pure Seed Testing Inc.,RMD,3,5,35,2021,Mar,RMD-2021-03-30,12,5,4,"Adelphia, NJ"
35,Turf Quality,4/22/21,6,35,Orion (PST-K13-143),Pure Seed Testing Inc.,PLV,3,5,35,2021,Apr,PLV-2021-04-22,6,1,4,"Adelphia, NJ"
35,Turf Quality,5/28/21,4,35,Orion (PST-K13-143),Pure Seed Testing Inc.,SAB,3,5,35,2021,May,SAB-2021-05-28,29,6,4,"Adelphia, NJ"
35,Turf Quality,6/11/21,4,35,Orion (PST-K13-143),Pure Seed Testing Inc.,JEN,3,5,35,2021,Jun,JEN-2021-06-11,2,4,4,"Adelphia, NJ"
35,Turf Quality,7/13/21,6,35,Orion (PST-K13-143),Pure Seed Testing Inc.,PLV,3,5,35,2021,Jul,PLV-2021-07-13,7,3,4,"Adelphia, NJ"
35,Turf Quality,8/11/21,4,35,Orion (PST-K13-143),Pure Seed Testing Inc.,JEN,3,5,35,2021,Aug,JEN-2021-08-11,3,2,4,"Adelphia, NJ"
35,Turf Quality,9/17/21,3,35,Orion (PST-K13-143),Pure Seed Testing Inc.,JEN,3,5,35,2021,Sep,JEN-2021-09-17,4,9,4,"Adelphia, NJ"
35,Turf Quality,10/13/21,4,35,Orion (PST-K13-143),Pure Seed Testing Inc.,SAB,3,5,35,2021,Oct,SAB-2021-10-13,30,8,4,"Adelphia, NJ"
35,Turf Quality,11/18/21,5,35,Orion (PST-K13-143),Pure Seed Testing Inc.,WAM,3,5,35,2021,Nov,WAM-2021-11-18,36,7,4,"Adelphia, NJ"
26,Turf Quality,4/18/18,2,26,BAR PP 79494,Barenbrug Research,RMD,2,5,26,2018,Apr,RMD-2018-04-18,8,1,1,"Adelphia, NJ"
26,Turf Quality,5/10/18,3,26,BAR PP 79494,Barenbrug Research,RON,2,5,26,2018,May,RON-2018-05-10,13,6,1,"Adelphia, NJ"
26,Turf Quality,6/7/18,5,26,BAR PP 79494,Barenbrug Research,RON,2,5,26,2018,Jun,RON-2018-06-07,14,4,1,"Adelphia, NJ"
26,Turf Quality,7/17/18,6,26,BAR PP 79494,Barenbrug Research,RON,2,5,26,2018,Jul,RON-2018-07-17,15,3,1,"Adelphia, NJ"
26,Turf Quality,8/15/18,6,26,BAR PP 79494,Barenbrug Research,RMD,2,5,26,2018,Aug,RMD-2018-08-15,9,2,1,"Adelphia, NJ"
26,Turf Quality,9/12/18,4,26,BAR PP 79494,Barenbrug Research,RON,2,5,26,2018,Sep,RON-2018-09-12,16,9,1,"Adelphia, NJ"
26,Turf Quality,10/2/18,5,26,BAR PP 79494,Barenbrug Research,RON,2,5,26,2018,Oct,RON-2018-10-02,17,8,1,"Adelphia, NJ"
26,Turf Quality,11/9/18,4,26,BAR PP 79494,Barenbrug Research,RON,2,5,26,2018,Nov,RON-2018-11-09,18,7,1,"Adelphia, NJ"
26,Turf Quality,4/17/19,3,26,BAR PP 79494,Barenbrug Research,RON,2,5,26,2019,Apr,RON-2019-04-17,19,1,2,"Adelphia, NJ"
26,Turf Quality,5/2/19,4,26,BAR PP 79494,Barenbrug Research,RON,2,5,26,2019,May,RON-2019-05-02,20,6,2,"Adelphia, NJ"
26,Turf Quality,6/13/19,5,26,BAR PP 79494,Barenbrug Research,RON,2,5,26,2019,Jun,RON-2019-06-13,21,4,2,"Adelphia, NJ"
26,Turf Quality,6/17/19,5,26,BAR PP 79494,Barenbrug Research,SAB,2,5,26,2019,Jun,SAB-2019-06-17,25,4,2,"Adelphia, NJ"
26,Turf Quality,7/17/19,5,26,BAR PP 79494,Barenbrug Research,RON,2,5,26,2019,Jul,RON-2019-07-17,22,3,2,"Adelphia, NJ"
26,Turf Quality,8/22/19,6,26,BAR PP 79494,Barenbrug Research,SAB,2,5,26,2019,Aug,SAB-2019-08-22,26,2,2,"Adelphia, NJ"
26,Turf Quality,9/16/19,6,26,BAR PP 79494,Barenbrug Research,RON,2,5,26,2019,Sep,RON-2019-09-16,23,9,2,"Adelphia, NJ"
26,Turf Quality,10/10/19,4,26,BAR PP 79494,Barenbrug Research,SAB,2,5,26,2019,Oct,SAB-2019-10-10,27,8,2,"Adelphia, NJ"
26,Turf Quality,11/1/19,6,26,BAR PP 79494,Barenbrug Research,RON,2,5,26,2019,Nov,RON-2019-11-01,24,7,2,"Adelphia, NJ"
26,Turf Quality,4/28/20,4,26,BAR PP 79494,Barenbrug Research,WAM,2,5,26,2020,Apr,WAM-2020-04-28,31,1,3,"Adelphia, NJ"
26,Turf Quality,5/18/20,2,26,BAR PP 79494,Barenbrug Research,SAB,2,5,26,2020,May,SAB-2020-05-18,28,6,3,"Adelphia, NJ"
26,Turf Quality,6/17/20,5,26,BAR PP 79494,Barenbrug Research,WAM,2,5,26,2020,Jun,WAM-2020-06-17,32,4,3,"Adelphia, NJ"
26,Turf Quality,7/15/20,6,26,BAR PP 79494,Barenbrug Research,WAM,2,5,26,2020,Jul,WAM-2020-07-15,33,3,3,"Adelphia, NJ"
26,Turf Quality,8/6/20,7,26,BAR PP 79494,Barenbrug Research,PLV,2,5,26,2020,Aug,PLV-2020-08-06,5,2,3,"Adelphia, NJ"
26,Turf Quality,9/2/20,5,26,BAR PP 79494,Barenbrug Research,DAS,2,5,26,2020,Sep,DAS-2020-09-02,1,9,3,"Adelphia, NJ"
26,Turf Quality,10/15/20,5,26,BAR PP 79494,Barenbrug Research,WAM,2,5,26,2020,Oct,WAM-2020-10-15,34,8,3,"Adelphia, NJ"
26,Turf Quality,11/5/20,5,26,BAR PP 79494,Barenbrug Research,WAM,2,5,26,2020,Nov,WAM-2020-11-05,35,7,3,"Adelphia, NJ"
26,Turf Quality,10/15/20,5,26,BAR PP 79494,Barenbrug Research,RMD,2,5,26,2020,Oct,RMD-2020-10-15,10,8,3,"Adelphia, NJ"
26,Turf Quality,10/23/20,6,26,BAR PP 79494,Barenbrug Research,RMD,2,5,26,2020,Oct,RMD-2020-10-23,11,8,3,"Adelphia, NJ"
26,Turf Quality,3/30/21,2,26,BAR PP 79494,Barenbrug Research,RMD,2,5,26,2021,Mar,RMD-2021-03-30,12,5,4,"Adelphia, NJ"
26,Turf Quality,4/22/21,3,26,BAR PP 79494,Barenbrug Research,PLV,2,5,26,2021,Apr,PLV-2021-04-22,6,1,4,"Adelphia, NJ"
26,Turf Quality,5/28/21,2,26,BAR PP 79494,Barenbrug Research,SAB,2,5,26,2021,May,SAB-2021-05-28,29,6,4,"Adelphia, NJ"
26,Turf Quality,6/11/21,5,26,BAR PP 79494,Barenbrug Research,JEN,2,5,26,2021,Jun,JEN-2021-06-11,2,4,4,"Adelphia, NJ"
26,Turf Quality,7/13/21,6,26,BAR PP 79494,Barenbrug Research,PLV,2,5,26,2021,Jul,PLV-2021-07-13,7,3,4,"Adelphia, NJ"
26,Turf Quality,8/11/21,7,26,BAR PP 79494,Barenbrug Research,JEN,2,5,26,2021,Aug,JEN-2021-08-11,3,2,4,"Adelphia, NJ"
26,Turf Quality,9/17/21,7,26,BAR PP 79494,Barenbrug Research,JEN,2,5,26,2021,Sep,JEN-2021-09-17,4,9,4,"Adelphia, NJ"
26,Turf Quality,10/13/21,4,26,BAR PP 79494,Barenbrug Research,SAB,2,5,26,2021,Oct,SAB-2021-10-13,30,8,4,"Adelphia, NJ"
26,Turf Quality,11/18/21,6,26,BAR PP 79494,Barenbrug Research,WAM,2,5,26,2021,Nov,WAM-2021-11-18,36,7,4,"Adelphia, NJ"
5,Turf Quality,4/18/18,1,5,Blue Knight,Ledeboer Plant Breeding,RMD,1,5,5,2018,Apr,RMD-2018-04-18,8,1,1,"Adelphia, NJ"
5,Turf Quality,5/10/18,1,5,Blue Knight,Ledeboer Plant Breeding,RON,1,5,5,2018,May,RON-2018-05-10,13,6,1,"Adelphia, NJ"
5,Turf Quality,6/7/18,2,5,Blue Knight,Ledeboer Plant Breeding,RON,1,5,5,2018,Jun,RON-2018-06-07,14,4,1,"Adelphia, NJ"
5,Turf Quality,7/17/18,2,5,Blue Knight,Ledeboer Plant Breeding,RON,1,5,5,2018,Jul,RON-2018-07-17,15,3,1,"Adelphia, NJ"
5,Turf Quality,8/15/18,2,5,Blue Knight,Ledeboer Plant Breeding,RMD,1,5,5,2018,Aug,RMD-2018-08-15,9,2,1,"Adelphia, NJ"
5,Turf Quality,9/12/18,1,5,Blue Knight,Ledeboer Plant Breeding,RON,1,5,5,2018,Sep,RON-2018-09-12,16,9,1,"Adelphia, NJ"
5,Turf Quality,10/2/18,1,5,Blue Knight,Ledeboer Plant Breeding,RON,1,5,5,2018,Oct,RON-2018-10-02,17,8,1,"Adelphia, NJ"
5,Turf Quality,11/9/18,1,5,Blue Knight,Ledeboer Plant Breeding,RON,1,5,5,2018,Nov,RON-2018-11-09,18,7,1,"Adelphia, NJ"
5,Turf Quality,4/17/19,1,5,Blue Knight,Ledeboer Plant Breeding,RON,1,5,5,2019,Apr,RON-2019-04-17,19,1,2,"Adelphia, NJ"
5,Turf Quality,5/2/19,1,5,Blue Knight,Ledeboer Plant Breeding,RON,1,5,5,2019,May,RON-2019-05-02,20,6,2,"Adelphia, NJ"
5,Turf Quality,6/13/19,3,5,Blue Knight,Ledeboer Plant Breeding,RON,1,5,5,2019,Jun,RON-2019-06-13,21,4,2,"Adelphia, NJ"
5,Turf Quality,6/17/19,3,5,Blue Knight,Ledeboer Plant Breeding,SAB,1,5,5,2019,Jun,SAB-2019-06-17,25,4,2,"Adelphia, NJ"
5,Turf Quality,7/17/19,3,5,Blue Knight,Ledeboer Plant Breeding,RON,1,5,5,2019,Jul,RON-2019-07-17,22,3,2,"Adelphia, NJ"
5,Turf Quality,8/22/19,2,5,Blue Knight,Ledeboer Plant Breeding,SAB,1,5,5,2019,Aug,SAB-2019-08-22,26,2,2,"Adelphia, NJ"
5,Turf Quality,9/16/19,2,5,Blue Knight,Ledeboer Plant Breeding,RON,1,5,5,2019,Sep,RON-2019-09-16,23,9,2,"Adelphia, NJ"
5,Turf Quality,10/10/19,2,5,Blue Knight,Ledeboer Plant Breeding,SAB,1,5,5,2019,Oct,SAB-2019-10-10,27,8,2,"Adelphia, NJ"
5,Turf Quality,11/1/19,1,5,Blue Knight,Ledeboer Plant Breeding,RON,1,5,5,2019,Nov,RON-2019-11-01,24,7,2,"Adelphia, NJ"
5,Turf Quality,4/28/20,3,5,Blue Knight,Ledeboer Plant Breeding,WAM,1,5,5,2020,Apr,WAM-2020-04-28,31,1,3,"Adelphia, NJ"
5,Turf Quality,5/18/20,3,5,Blue Knight,Ledeboer Plant Breeding,SAB,1,5,5,2020,May,SAB-2020-05-18,28,6,3,"Adelphia, NJ"
5,Turf Quality,6/17/20,3,5,Blue Knight,Ledeboer Plant Breeding,WAM,1,5,5,2020,Jun,WAM-2020-06-17,32,4,3,"Adelphia, NJ"
5,Turf Quality,7/15/20,4,5,Blue Knight,Ledeboer Plant Breeding,WAM,1,5,5,2020,Jul,WAM-2020-07-15,33,3,3,"Adelphia, NJ"
5,Turf Quality,8/6/20,3,5,Blue Knight,Ledeboer Plant Breeding,PLV,1,5,5,2020,Aug,PLV-2020-08-06,5,2,3,"Adelphia, NJ"
5,Turf Quality,9/2/20,3,5,Blue Knight,Ledeboer Plant Breeding,DAS,1,5,5,2020,Sep,DAS-2020-09-02,1,9,3,"Adelphia, NJ"
5,Turf Quality,10/15/20,4,5,Blue Knight,Ledeboer Plant Breeding,WAM,1,5,5,2020,Oct,WAM-2020-10-15,34,8,3,"Adelphia, NJ"
5,Turf Quality,11/5/20,4,5,Blue Knight,Ledeboer Plant Breeding,WAM,1,5,5,2020,Nov,WAM-2020-11-05,35,7,3,"Adelphia, NJ"
5,Turf Quality,10/15/20,3,5,Blue Knight,Ledeboer Plant Breeding,RMD,1,5,5,2020,Oct,RMD-2020-10-15,10,8,3,"Adelphia, NJ"
5,Turf Quality,10/23/20,3,5,Blue Knight,Ledeboer Plant Breeding,RMD,1,5,5,2020,Oct,RMD-2020-10-23,11,8,3,"Adelphia, NJ"
5,Turf Quality,3/30/21,3,5,Blue Knight,Ledeboer Plant Breeding,RMD,1,5,5,2021,Mar,RMD-2021-03-30,12,5,4,"Adelphia, NJ"
5,Turf Quality,4/22/21,4,5,Blue Knight,Ledeboer Plant Breeding,PLV,1,5,5,2021,Apr,PLV-2021-04-22,6,1,4,"Adelphia, NJ"
5,Turf Quality,5/28/21,4,5,Blue Knight,Ledeboer Plant Breeding,SAB,1,5,5,2021,May,SAB-2021-05-28,29,6,4,"Adelphia, NJ"
5,Turf Quality,6/11/21,4,5,Blue Knight,Ledeboer Plant Breeding,JEN,1,5,5,2021,Jun,JEN-2021-06-11,2,4,4,"Adelphia, NJ"
5,Turf Quality,7/13/21,5,5,Blue Knight,Ledeboer Plant Breeding,PLV,1,5,5,2021,Jul,PLV-2021-07-13,7,3,4,"Adelphia, NJ"
5,Turf Quality,8/11/21,4,5,Blue Knight,Ledeboer Plant Breeding,JEN,1,5,5,2021,Aug,JEN-2021-08-11,3,2,4,"Adelphia, NJ"
5,Turf Quality,9/17/21,5,5,Blue Knight,Ledeboer Plant Breeding,JEN,1,5,5,2021,Sep,JEN-2021-09-17,4,9,4,"Adelphia, NJ"
5,Turf Quality,10/13/21,3,5,Blue Knight,Ledeboer Plant Breeding,SAB,1,5,5,2021,Oct,SAB-2021-10-13,30,8,4,"Adelphia, NJ"
5,Turf Quality,11/18/21,3,5,Blue Knight,Ledeboer Plant Breeding,WAM,1,5,5,2021,Nov,WAM-2021-11-18,36,7,4,"Adelphia, NJ"
265,Turf Quality,4/18/18,6,55,DLFPS-340/3438,DLF Pickseed USA,RMD,18,6,263,2018,Apr,RMD-2018-04-18,8,1,1,"Adelphia, NJ"
265,Turf Quality,5/10/18,7,55,DLFPS-340/3438,DLF Pickseed USA,RON,18,6,263,2018,May,RON-2018-05-10,13,6,1,"Adelphia, NJ"
265,Turf Quality,6/7/18,6,55,DLFPS-340/3438,DLF Pickseed USA,RON,18,6,263,2018,Jun,RON-2018-06-07,14,4,1,"Adelphia, NJ"
265,Turf Quality,7/17/18,6,55,DLFPS-340/3438,DLF Pickseed USA,RON,18,6,263,2018,Jul,RON-2018-07-17,15,3,1,"Adelphia, NJ"
265,Turf Quality,8/15/18,5,55,DLFPS-340/3438,DLF Pickseed USA,RMD,18,6,263,2018,Aug,RMD-2018-08-15,9,2,1,"Adelphia, NJ"
265,Turf Quality,9/12/18,4,55,DLFPS-340/3438,DLF Pickseed USA,RON,18,6,263,2018,Sep,RON-2018-09-12,16,9,1,"Adelphia, NJ"
265,Turf Quality,10/2/18,4,55,DLFPS-340/3438,DLF Pickseed USA,RON,18,6,263,2018,Oct,RON-2018-10-02,17,8,1,"Adelphia, NJ"
265,Turf Quality,11/9/18,4,55,DLFPS-340/3438,DLF Pickseed USA,RON,18,6,263,2018,Nov,RON-2018-11-09,18,7,1,"Adelphia, NJ"
265,Turf Quality,4/17/19,4,55,DLFPS-340/3438,DLF Pickseed USA,RON,18,6,263,2019,Apr,RON-2019-04-17,19,1,2,"Adelphia, NJ"
265,Turf Quality,5/2/19,4,55,DLFPS-340/3438,DLF Pickseed USA,RON,18,6,263,2019,May,RON-2019-05-02,20,6,2,"Adelphia, NJ"
265,Turf Quality,6/13/19,4,55,DLFPS-340/3438,DLF Pickseed USA,RON,18,6,263,2019,Jun,RON-2019-06-13,21,4,2,"Adelphia, NJ"
265,Turf Quality,6/17/19,5,55,DLFPS-340/3438,DLF Pickseed USA,SAB,18,6,263,2019,Jun,SAB-2019-06-17,25,4,2,"Adelphia, NJ"
265,Turf Quality,7/17/19,6,55,DLFPS-340/3438,DLF Pickseed USA,RON,18,6,263,2019,Jul,RON-2019-07-17,22,3,2,"Adelphia, NJ"
265,Turf Quality,8/22/19,5,55,DLFPS-340/3438,DLF Pickseed USA,SAB,18,6,263,2019,Aug,SAB-2019-08-22,26,2,2,"Adelphia, NJ"
265,Turf Quality,9/16/19,6,55,DLFPS-340/3438,DLF Pickseed USA,RON,18,6,263,2019,Sep,RON-2019-09-16,23,9,2,"Adelphia, NJ"
265,Turf Quality,10/10/19,5,55,DLFPS-340/3438,DLF Pickseed USA,SAB,18,6,263,2019,Oct,SAB-2019-10-10,27,8,2,"Adelphia, NJ"
265,Turf Quality,11/1/19,7,55,DLFPS-340/3438,DLF Pickseed USA,RON,18,6,263,2019,Nov,RON-2019-11-01,24,7,2,"Adelphia, NJ"
265,Turf Quality,4/28/20,7,55,DLFPS-340/3438,DLF Pickseed USA,WAM,18,6,263,2020,Apr,WAM-2020-04-28,31,1,3,"Adelphia, NJ"
265,Turf Quality,5/18/20,7,55,DLFPS-340/3438,DLF Pickseed USA,SAB,18,6,263,2020,May,SAB-2020-05-18,28,6,3,"Adelphia, NJ"
265,Turf Quality,6/17/20,5,55,DLFPS-340/3438,DLF Pickseed USA,WAM,18,6,263,2020,Jun,WAM-2020-06-17,32,4,3,"Adelphia, NJ"
265,Turf Quality,7/15/20,6,55,DLFPS-340/3438,DLF Pickseed USA,WAM,18,6,263,2020,Jul,WAM-2020-07-15,33,3,3,"Adelphia, NJ"
265,Turf Quality,8/6/20,8,55,DLFPS-340/3438,DLF Pickseed USA,PLV,18,6,263,2020,Aug,PLV-2020-08-06,5,2,3,"Adelphia, NJ"
265,Turf Quality,9/2/20,5,55,DLFPS-340/3438,DLF Pickseed USA,DAS,18,6,263,2020,Sep,DAS-2020-09-02,1,9,3,"Adelphia, NJ"
265,Turf Quality,10/15/20,5,55,DLFPS-340/3438,DLF Pickseed USA,WAM,18,6,263,2020,Oct,WAM-2020-10-15,34,8,3,"Adelphia, NJ"
265,Turf Quality,11/5/20,7,55,DLFPS-340/3438,DLF Pickseed USA,WAM,18,6,263,2020,Nov,WAM-2020-11-05,35,7,3,"Adelphia, NJ"
265,Turf Quality,10/15/20,6,55,DLFPS-340/3438,DLF Pickseed USA,RMD,18,6,263,2020,Oct,RMD-2020-10-15,10,8,3,"Adelphia, NJ"
265,Turf Quality,10/23/20,5,55,DLFPS-340/3438,DLF Pickseed USA,RMD,18,6,263,2020,Oct,RMD-2020-10-23,11,8,3,"Adelphia, NJ"
265,Turf Quality,3/30/21,5,55,DLFPS-340/3438,DLF Pickseed USA,RMD,18,6,263,2021,Mar,RMD-2021-03-30,12,5,4,"Adelphia, NJ"
265,Turf Quality,4/22/21,7,55,DLFPS-340/3438,DLF Pickseed USA,PLV,18,6,263,2021,Apr,PLV-2021-04-22,6,1,4,"Adelphia, NJ"
265,Turf Quality,5/28/21,5,55,DLFPS-340/3438,DLF Pickseed USA,SAB,18,6,263,2021,May,SAB-2021-05-28,29,6,4,"Adelphia, NJ"
265,Turf Quality,6/11/21,5,55,DLFPS-340/3438,DLF Pickseed USA,JEN,18,6,263,2021,Jun,JEN-2021-06-11,2,4,4,"Adelphia, NJ"
265,Turf Quality,7/13/21,6,55,DLFPS-340/3438,DLF Pickseed USA,PLV,18,6,263,2021,Jul,PLV-2021-07-13,7,3,4,"Adelphia, NJ"
265,Turf Quality,8/11/21,5,55,DLFPS-340/3438,DLF Pickseed USA,JEN,18,6,263,2021,Aug,JEN-2021-08-11,3,2,4,"Adelphia, NJ"
265,Turf Quality,9/17/21,4,55,DLFPS-340/3438,DLF Pickseed USA,JEN,18,6,263,2021,Sep,JEN-2021-09-17,4,9,4,"Adelphia, NJ"
265,Turf Quality,10/13/21,6,55,DLFPS-340/3438,DLF Pickseed USA,SAB,18,6,263,2021,Oct,SAB-2021-10-13,30,8,4,"Adelphia, NJ"
265,Turf Quality,11/18/21,6,55,DLFPS-340/3438,DLF Pickseed USA,WAM,18,6,263,2021,Nov,WAM-2021-11-18,36,7,4,"Adelphia, NJ"
246,Turf Quality,4/18/18,5,9,AKB3128,Pennington Seed,RMD,17,6,244,2018,Apr,RMD-2018-04-18,8,1,1,"Adelphia, NJ"
246,Turf Quality,5/10/18,5,9,AKB3128,Pennington Seed,RON,17,6,244,2018,May,RON-2018-05-10,13,6,1,"Adelphia, NJ"
246,Turf Quality,6/7/18,4,9,AKB3128,Pennington Seed,RON,17,6,244,2018,Jun,RON-2018-06-07,14,4,1,"Adelphia, NJ"
246,Turf Quality,7/17/18,5,9,AKB3128,Pennington Seed,RON,17,6,244,2018,Jul,RON-2018-07-17,15,3,1,"Adelphia, NJ"
246,Turf Quality,8/15/18,6,9,AKB3128,Pennington Seed,RMD,17,6,244,2018,Aug,RMD-2018-08-15,9,2,1,"Adelphia, NJ"
246,Turf Quality,9/12/18,6,9,AKB3128,Pennington Seed,RON,17,6,244,2018,Sep,RON-2018-09-12,16,9,1,"Adelphia, NJ"
246,Turf Quality,10/2/18,7,9,AKB3128,Pennington Seed,RON,17,6,244,2018,Oct,RON-2018-10-02,17,8,1,"Adelphia, NJ"
246,Turf Quality,11/9/18,8,9,AKB3128,Pennington Seed,RON,17,6,244,2018,Nov,RON-2018-11-09,18,7,1,"Adelphia, NJ"
246,Turf Quality,4/17/19,7,9,AKB3128,Pennington Seed,RON,17,6,244,2019,Apr,RON-2019-04-17,19,1,2,"Adelphia, NJ"
246,Turf Quality,5/2/19,6,9,AKB3128,Pennington Seed,RON,17,6,244,2019,May,RON-2019-05-02,20,6,2,"Adelphia, NJ"
246,Turf Quality,6/13/19,5,9,AKB3128,Pennington Seed,RON,17,6,244,2019,Jun,RON-2019-06-13,21,4,2,"Adelphia, NJ"
246,Turf Quality,6/17/19,3,9,AKB3128,Pennington Seed,SAB,17,6,244,2019,Jun,SAB-2019-06-17,25,4,2,"Adelphia, NJ"
246,Turf Quality,7/17/19,5,9,AKB3128,Pennington Seed,RON,17,6,244,2019,Jul,RON-2019-07-17,22,3,2,"Adelphia, NJ"
246,Turf Quality,8/22/19,5,9,AKB3128,Pennington Seed,SAB,17,6,244,2019,Aug,SAB-2019-08-22,26,2,2,"Adelphia, NJ"
246,Turf Quality,9/16/19,7,9,AKB3128,Pennington Seed,RON,17,6,244,2019,Sep,RON-2019-09-16,23,9,2,"Adelphia, NJ"
246,Turf Quality,10/10/19,4,9,AKB3128,Pennington Seed,SAB,17,6,244,2019,Oct,SAB-2019-10-10,27,8,2,"Adelphia, NJ"
246,Turf Quality,11/1/19,5,9,AKB3128,Pennington Seed,RON,17,6,244,2019,Nov,RON-2019-11-01,24,7,2,"Adelphia, NJ"
246,Turf Quality,4/28/20,6,9,AKB3128,Pennington Seed,WAM,17,6,244,2020,Apr,WAM-2020-04-28,31,1,3,"Adelphia, NJ"
246,Turf Quality,5/18/20,7,9,AKB3128,Pennington Seed,SAB,17,6,244,2020,May,SAB-2020-05-18,28,6,3,"Adelphia, NJ"
246,Turf Quality,6/17/20,4,9,AKB3128,Pennington Seed,WAM,17,6,244,2020,Jun,WAM-2020-06-17,32,4,3,"Adelphia, NJ"
246,Turf Quality,7/15/20,6,9,AKB3128,Pennington Seed,WAM,17,6,244,2020,Jul,WAM-2020-07-15,33,3,3,"Adelphia, NJ"
246,Turf Quality,8/6/20,8,9,AKB3128,Pennington Seed,PLV,17,6,244,2020,Aug,PLV-2020-08-06,5,2,3,"Adelphia, NJ"
246,Turf Quality,9/2/20,8,9,AKB3128,Pennington Seed,DAS,17,6,244,2020,Sep,DAS-2020-09-02,1,9,3,"Adelphia, NJ"
246,Turf Quality,10/15/20,4,9,AKB3128,Pennington Seed,WAM,17,6,244,2020,Oct,WAM-2020-10-15,34,8,3,"Adelphia, NJ"
246,Turf Quality,11/5/20,6,9,AKB3128,Pennington Seed,WAM,17,6,244,2020,Nov,WAM-2020-11-05,35,7,3,"Adelphia, NJ"
246,Turf Quality,10/15/20,5,9,AKB3128,Pennington Seed,RMD,17,6,244,2020,Oct,RMD-2020-10-15,10,8,3,"Adelphia, NJ"
246,Turf Quality,10/23/20,6,9,AKB3128,Pennington Seed,RMD,17,6,244,2020,Oct,RMD-2020-10-23,11,8,3,"Adelphia, NJ"
246,Turf Quality,3/30/21,7,9,AKB3128,Pennington Seed,RMD,17,6,244,2021,Mar,RMD-2021-03-30,12,5,4,"Adelphia, NJ"
246,Turf Quality,4/22/21,7,9,AKB3128,Pennington Seed,PLV,17,6,244,2021,Apr,PLV-2021-04-22,6,1,4,"Adelphia, NJ"
246,Turf Quality,5/28/21,3,9,AKB3128,Pennington Seed,SAB,17,6,244,2021,May,SAB-2021-05-28,29,6,4,"Adelphia, NJ"
246,Turf Quality,6/11/21,4,9,AKB3128,Pennington Seed,JEN,17,6,244,2021,Jun,JEN-2021-06-11,2,4,4,"Adelphia, NJ"
246,Turf Quality,7/13/21,7,9,AKB3128,Pennington Seed,PLV,17,6,244,2021,Jul,PLV-2021-07-13,7,3,4,"Adelphia, NJ"
246,Turf Quality,8/11/21,6,9,AKB3128,Pennington Seed,JEN,17,6,244,2021,Aug,JEN-2021-08-11,3,2,4,"Adelphia, NJ"
246,Turf Quality,9/17/21,5,9,AKB3128,Pennington Seed,JEN,17,6,244,2021,Sep,JEN-2021-09-17,4,9,4,"Adelphia, NJ"
246,Turf Quality,10/13/21,5,9,AKB3128,Pennington Seed,SAB,17,6,244,2021,Oct,SAB-2021-10-13,30,8,4,"Adelphia, NJ"
246,Turf Quality,11/18/21,7,9,AKB3128,Pennington Seed,WAM,17,6,244,2021,Nov,WAM-2021-11-18,36,7,4,"Adelphia, NJ"
235,Turf Quality,4/18/18,3,60,DLFPS-340/3550,DLF Pickseed USA,RMD,16,6,233,2018,Apr,RMD-2018-04-18,8,1,1,"Adelphia, NJ"
235,Turf Quality,5/10/18,4,60,DLFPS-340/3550,DLF Pickseed USA,RON,16,6,233,2018,May,RON-2018-05-10,13,6,1,"Adelphia, NJ"
235,Turf Quality,6/7/18,5,60,DLFPS-340/3550,DLF Pickseed USA,RON,16,6,233,2018,Jun,RON-2018-06-07,14,4,1,"Adelphia, NJ"
235,Turf Quality,7/17/18,6,60,DLFPS-340/3550,DLF Pickseed USA,RON,16,6,233,2018,Jul,RON-2018-07-17,15,3,1,"Adelphia, NJ"
235,Turf Quality,8/15/18,6,60,DLFPS-340/3550,DLF Pickseed USA,RMD,16,6,233,2018,Aug,RMD-2018-08-15,9,2,1,"Adelphia, NJ"
235,Turf Quality,9/12/18,7,60,DLFPS-340/3550,DLF Pickseed USA,RON,16,6,233,2018,Sep,RON-2018-09-12,16,9,1,"Adelphia, NJ"
235,Turf Quality,10/2/18,8,60,DLFPS-340/3550,DLF Pickseed USA,RON,16,6,233,2018,Oct,RON-2018-10-02,17,8,1,"Adelphia, NJ"
235,Turf Quality,11/9/18,7,60,DLFPS-340/3550,DLF Pickseed USA,RON,16,6,233,2018,Nov,RON-2018-11-09,18,7,1,"Adelphia, NJ"
235,Turf Quality,4/17/19,7,60,DLFPS-340/3550,DLF Pickseed USA,RON,16,6,233,2019,Apr,RON-2019-04-17,19,1,2,"Adelphia, NJ"
235,Turf Quality,5/2/19,6,60,DLFPS-340/3550,DLF Pickseed USA,RON,16,6,233,2019,May,RON-2019-05-02,20,6,2,"Adelphia, NJ"
235,Turf Quality,6/13/19,8,60,DLFPS-340/3550,DLF Pickseed USA,RON,16,6,233,2019,Jun,RON-2019-06-13,21,4,2,"Adelphia, NJ"
235,Turf Quality,6/17/19,8,60,DLFPS-340/3550,DLF Pickseed USA,SAB,16,6,233,2019,Jun,SAB-2019-06-17,25,4,2,"Adelphia, NJ"
235,Turf Quality,7/17/19,9,60,DLFPS-340/3550,DLF Pickseed USA,RON,16,6,233,2019,Jul,RON-2019-07-17,22,3,2,"Adelphia, NJ"
235,Turf Quality,8/22/19,8,60,DLFPS-340/3550,DLF Pickseed USA,SAB,16,6,233,2019,Aug,SAB-2019-08-22,26,2,2,"Adelphia, NJ"
235,Turf Quality,9/16/19,8,60,DLFPS-340/3550,DLF Pickseed USA,RON,16,6,233,2019,Sep,RON-2019-09-16,23,9,2,"Adelphia, NJ"
235,Turf Quality,10/10/19,6,60,DLFPS-340/3550,DLF Pickseed USA,SAB,16,6,233,2019,Oct,SAB-2019-10-10,27,8,2,"Adelphia, NJ"
235,Turf Quality,11/1/19,6,60,DLFPS-340/3550,DLF Pickseed USA,RON,16,6,233,2019,Nov,RON-2019-11-01,24,7,2,"Adelphia, NJ"
235,Turf Quality,4/28/20,7,60,DLFPS-340/3550,DLF Pickseed USA,WAM,16,6,233,2020,Apr,WAM-2020-04-28,31,1,3,"Adelphia, NJ"
235,Turf Quality,5/18/20,7,60,DLFPS-340/3550,DLF Pickseed USA,SAB,16,6,233,2020,May,SAB-2020-05-18,28,6,3,"Adelphia, NJ"
235,Turf Quality,6/17/20,6,60,DLFPS-340/3550,DLF Pickseed USA,WAM,16,6,233,2020,Jun,WAM-2020-06-17,32,4,3,"Adelphia, NJ"
235,Turf Quality,7/15/20,7,60,DLFPS-340/3550,DLF Pickseed USA,WAM,16,6,233,2020,Jul,WAM-2020-07-15,33,3,3,"Adelphia, NJ"
235,Turf Quality,8/6/20,9,60,DLFPS-340/3550,DLF Pickseed USA,PLV,16,6,233,2020,Aug,PLV-2020-08-06,5,2,3,"Adelphia, NJ"
235,Turf Quality,9/2/20,8,60,DLFPS-340/3550,DLF Pickseed USA,DAS,16,6,233,2020,Sep,DAS-2020-09-02,1,9,3,"Adelphia, NJ"
235,Turf Quality,10/15/20,6,60,DLFPS-340/3550,DLF Pickseed USA,WAM,16,6,233,2020,Oct,WAM-2020-10-15,34,8,3,"Adelphia, NJ"
235,Turf Quality,11/5/20,6,60,DLFPS-340/3550,DLF Pickseed USA,WAM,16,6,233,2020,Nov,WAM-2020-11-05,35,7,3,"Adelphia, NJ"
235,Turf Quality,10/15/20,6,60,DLFPS-340/3550,DLF Pickseed USA,RMD,16,6,233,2020,Oct,RMD-2020-10-15,10,8,3,"Adelphia, NJ"
235,Turf Quality,10/23/20,7,60,DLFPS-340/3550,DLF Pickseed USA,RMD,16,6,233,2020,Oct,RMD-2020-10-23,11,8,3,"Adelphia, NJ"
235,Turf Quality,3/30/21,5,60,DLFPS-340/3550,DLF Pickseed USA,RMD,16,6,233,2021,Mar,RMD-2021-03-30,12,5,4,"Adelphia, NJ"
235,Turf Quality,4/22/21,7,60,DLFPS-340/3550,DLF Pickseed USA,PLV,16,6,233,2021,Apr,PLV-2021-04-22,6,1,4,"Adelphia, NJ"
235,Turf Quality,5/28/21,6,60,DLFPS-340/3550,DLF Pickseed USA,SAB,16,6,233,2021,May,SAB-2021-05-28,29,6,4,"Adelphia, NJ"
235,Turf Quality,6/11/21,6,60,DLFPS-340/3550,DLF Pickseed USA,JEN,16,6,233,2021,Jun,JEN-2021-06-11,2,4,4,"Adelphia, NJ"
235,Turf Quality,7/13/21,8,60,DLFPS-340/3550,DLF Pickseed USA,PLV,16,6,233,2021,Jul,PLV-2021-07-13,7,3,4,"Adelphia, NJ"
235,Turf Quality,8/11/21,5,60,DLFPS-340/3550,DLF Pickseed USA,JEN,16,6,233,2021,Aug,JEN-2021-08-11,3,2,4,"Adelphia, NJ"
235,Turf Quality,9/17/21,6,60,DLFPS-340/3550,DLF Pickseed USA,JEN,16,6,233,2021,Sep,JEN-2021-09-17,4,9,4,"Adelphia, NJ"
235,Turf Quality,10/13/21,5,60,DLFPS-340/3550,DLF Pickseed USA,SAB,16,6,233,2021,Oct,SAB-2021-10-13,30,8,4,"Adelphia, NJ"
235,Turf Quality,11/18/21,6,60,DLFPS-340/3550,DLF Pickseed USA,WAM,16,6,233,2021,Nov,WAM-2021-11-18,36,7,4,"Adelphia, NJ"
216,Turf Quality,4/18/18,5,56,DLFPS-340/3549,DLF Pickseed USA,RMD,15,6,214,2018,Apr,RMD-2018-04-18,8,1,1,"Adelphia, NJ"
216,Turf Quality,5/10/18,6,56,DLFPS-340/3549,DLF Pickseed USA,RON,15,6,214,2018,May,RON-2018-05-10,13,6,1,"Adelphia, NJ"
216,Turf Quality,6/7/18,5,56,DLFPS-340/3549,DLF Pickseed USA,RON,15,6,214,2018,Jun,RON-2018-06-07,14,4,1,"Adelphia, NJ"
216,Turf Quality,7/17/18,4,56,DLFPS-340/3549,DLF Pickseed USA,RON,15,6,214,2018,Jul,RON-2018-07-17,15,3,1,"Adelphia, NJ"
216,Turf Quality,8/15/18,5,56,DLFPS-340/3549,DLF Pickseed USA,RMD,15,6,214,2018,Aug,RMD-2018-08-15,9,2,1,"Adelphia, NJ"
216,Turf Quality,9/12/18,4,56,DLFPS-340/3549,DLF Pickseed USA,RON,15,6,214,2018,Sep,RON-2018-09-12,16,9,1,"Adelphia, NJ"
216,Turf Quality,10/2/18,3,56,DLFPS-340/3549,DLF Pickseed USA,RON,15,6,214,2018,Oct,RON-2018-10-02,17,8,1,"Adelphia, NJ"
216,Turf Quality,11/9/18,2,56,DLFPS-340/3549,DLF Pickseed USA,RON,15,6,214,2018,Nov,RON-2018-11-09,18,7,1,"Adelphia, NJ"
216,Turf Quality,4/17/19,3,56,DLFPS-340/3549,DLF Pickseed USA,RON,15,6,214,2019,Apr,RON-2019-04-17,19,1,2,"Adelphia, NJ"
216,Turf Quality,5/2/19,3,56,DLFPS-340/3549,DLF Pickseed USA,RON,15,6,214,2019,May,RON-2019-05-02,20,6,2,"Adelphia, NJ"
216,Turf Quality,6/13/19,3,56,DLFPS-340/3549,DLF Pickseed USA,RON,15,6,214,2019,Jun,RON-2019-06-13,21,4,2,"Adelphia, NJ"
216,Turf Quality,6/17/19,4,56,DLFPS-340/3549,DLF Pickseed USA,SAB,15,6,214,2019,Jun,SAB-2019-06-17,25,4,2,"Adelphia, NJ"
216,Turf Quality,7/17/19,3,56,DLFPS-340/3549,DLF Pickseed USA,RON,15,6,214,2019,Jul,RON-2019-07-17,22,3,2,"Adelphia, NJ"
216,Turf Quality,8/22/19,2,56,DLFPS-340/3549,DLF Pickseed USA,SAB,15,6,214,2019,Aug,SAB-2019-08-22,26,2,2,"Adelphia, NJ"
216,Turf Quality,9/16/19,1,56,DLFPS-340/3549,DLF Pickseed USA,RON,15,6,214,2019,Sep,RON-2019-09-16,23,9,2,"Adelphia, NJ"
216,Turf Quality,10/10/19,1,56,DLFPS-340/3549,DLF Pickseed USA,SAB,15,6,214,2019,Oct,SAB-2019-10-10,27,8,2,"Adelphia, NJ"
216,Turf Quality,11/1/19,1,56,DLFPS-340/3549,DLF Pickseed USA,RON,15,6,214,2019,Nov,RON-2019-11-01,24,7,2,"Adelphia, NJ"
216,Turf Quality,4/28/20,3,56,DLFPS-340/3549,DLF Pickseed USA,WAM,15,6,214,2020,Apr,WAM-2020-04-28,31,1,3,"Adelphia, NJ"
216,Turf Quality,5/18/20,4,56,DLFPS-340/3549,DLF Pickseed USA,SAB,15,6,214,2020,May,SAB-2020-05-18,28,6,3,"Adelphia, NJ"
216,Turf Quality,6/17/20,3,56,DLFPS-340/3549,DLF Pickseed USA,WAM,15,6,214,2020,Jun,WAM-2020-06-17,32,4,3,"Adelphia, NJ"
216,Turf Quality,7/15/20,3,56,DLFPS-340/3549,DLF Pickseed USA,WAM,15,6,214,2020,Jul,WAM-2020-07-15,33,3,3,"Adelphia, NJ"
216,Turf Quality,8/6/20,5,56,DLFPS-340/3549,DLF Pickseed USA,PLV,15,6,214,2020,Aug,PLV-2020-08-06,5,2,3,"Adelphia, NJ"
216,Turf Quality,9/2/20,2,56,DLFPS-340/3549,DLF Pickseed USA,DAS,15,6,214,2020,Sep,DAS-2020-09-02,1,9,3,"Adelphia, NJ"
216,Turf Quality,10/15/20,2,56,DLFPS-340/3549,DLF Pickseed USA,WAM,15,6,214,2020,Oct,WAM-2020-10-15,34,8,3,"Adelphia, NJ"
216,Turf Quality,11/5/20,4,56,DLFPS-340/3549,DLF Pickseed USA,WAM,15,6,214,2020,Nov,WAM-2020-11-05,35,7,3,"Adelphia, NJ"
216,Turf Quality,10/15/20,2,56,DLFPS-340/3549,DLF Pickseed USA,RMD,15,6,214,2020,Oct,RMD-2020-10-15,10,8,3,"Adelphia, NJ"
216,Turf Quality,10/23/20,2,56,DLFPS-340/3549,DLF Pickseed USA,RMD,15,6,214,2020,Oct,RMD-2020-10-23,11,8,3,"Adelphia, NJ"
216,Turf Quality,3/30/21,3,56,DLFPS-340/3549,DLF Pickseed USA,RMD,15,6,214,2021,Mar,RMD-2021-03-30,12,5,4,"Adelphia, NJ"
216,Turf Quality,4/22/21,4,56,DLFPS-340/3549,DLF Pickseed USA,PLV,15,6,214,2021,Apr,PLV-2021-04-22,6,1,4,"Adelphia, NJ"
216,Turf Quality,5/28/21,4,56,DLFPS-340/3549,DLF Pickseed USA,SAB,15,6,214,2021,May,SAB-2021-05-28,29,6,4,"Adelphia, NJ"
216,Turf Quality,6/11/21,4,56,DLFPS-340/3549,DLF Pickseed USA,JEN,15,6,214,2021,Jun,JEN-2021-06-11,2,4,4,"Adelphia, NJ"
216,Turf Quality,7/13/21,4,56,DLFPS-340/3549,DLF Pickseed USA,PLV,15,6,214,2021,Jul,PLV-2021-07-13,7,3,4,"Adelphia, NJ"
216,Turf Quality,8/11/21,4,56,DLFPS-340/3549,DLF Pickseed USA,JEN,15,6,214,2021,Aug,JEN-2021-08-11,3,2,4,"Adelphia, NJ"
216,Turf Quality,9/17/21,2,56,DLFPS-340/3549,DLF Pickseed USA,JEN,15,6,214,2021,Sep,JEN-2021-09-17,4,9,4,"Adelphia, NJ"
216,Turf Quality,10/13/21,2,56,DLFPS-340/3549,DLF Pickseed USA,SAB,15,6,214,2021,Oct,SAB-2021-10-13,30,8,4,"Adelphia, NJ"
216,Turf Quality,11/18/21,4,56,DLFPS-340/3549,DLF Pickseed USA,WAM,15,6,214,2021,Nov,WAM-2021-11-18,36,7,4,"Adelphia, NJ"
205,Turf Quality,4/18/18,4,47,Star (GO-2628),Grassland Oregon,RMD,14,6,203,2018,Apr,RMD-2018-04-18,8,1,1,"Adelphia, NJ"
205,Turf Quality,5/10/18,7,47,Star (GO-2628),Grassland Oregon,RON,14,6,203,2018,May,RON-2018-05-10,13,6,1,"Adelphia, NJ"
205,Turf Quality,6/7/18,5,47,Star (GO-2628),Grassland Oregon,RON,14,6,203,2018,Jun,RON-2018-06-07,14,4,1,"Adelphia, NJ"
205,Turf Quality,7/17/18,6,47,Star (GO-2628),Grassland Oregon,RON,14,6,203,2018,Jul,RON-2018-07-17,15,3,1,"Adelphia, NJ"
205,Turf Quality,8/15/18,7,47,Star (GO-2628),Grassland Oregon,RMD,14,6,203,2018,Aug,RMD-2018-08-15,9,2,1,"Adelphia, NJ"
205,Turf Quality,9/12/18,7,47,Star (GO-2628),Grassland Oregon,RON,14,6,203,2018,Sep,RON-2018-09-12,16,9,1,"Adelphia, NJ"
205,Turf Quality,10/2/18,7,47,Star (GO-2628),Grassland Oregon,RON,14,6,203,2018,Oct,RON-2018-10-02,17,8,1,"Adelphia, NJ"
205,Turf Quality,11/9/18,8,47,Star (GO-2628),Grassland Oregon,RON,14,6,203,2018,Nov,RON-2018-11-09,18,7,1,"Adelphia, NJ"
205,Turf Quality,4/17/19,8,47,Star (GO-2628),Grassland Oregon,RON,14,6,203,2019,Apr,RON-2019-04-17,19,1,2,"Adelphia, NJ"
205,Turf Quality,5/2/19,7,47,Star (GO-2628),Grassland Oregon,RON,14,6,203,2019,May,RON-2019-05-02,20,6,2,"Adelphia, NJ"
205,Turf Quality,6/13/19,7,47,Star (GO-2628),Grassland Oregon,RON,14,6,203,2019,Jun,RON-2019-06-13,21,4,2,"Adelphia, NJ"
205,Turf Quality,6/17/19,7,47,Star (GO-2628),Grassland Oregon,SAB,14,6,203,2019,Jun,SAB-2019-06-17,25,4,2,"Adelphia, NJ"
205,Turf Quality,7/17/19,8,47,Star (GO-2628),Grassland Oregon,RON,14,6,203,2019,Jul,RON-2019-07-17,22,3,2,"Adelphia, NJ"
205,Turf Quality,8/22/19,9,47,Star (GO-2628),Grassland Oregon,SAB,14,6,203,2019,Aug,SAB-2019-08-22,26,2,2,"Adelphia, NJ"
205,Turf Quality,9/16/19,8,47,Star (GO-2628),Grassland Oregon,RON,14,6,203,2019,Sep,RON-2019-09-16,23,9,2,"Adelphia, NJ"
205,Turf Quality,10/10/19,8,47,Star (GO-2628),Grassland Oregon,SAB,14,6,203,2019,Oct,SAB-2019-10-10,27,8,2,"Adelphia, NJ"
205,Turf Quality,11/1/19,7,47,Star (GO-2628),Grassland Oregon,RON,14,6,203,2019,Nov,RON-2019-11-01,24,7,2,"Adelphia, NJ"
205,Turf Quality,4/28/20,9,47,Star (GO-2628),Grassland Oregon,WAM,14,6,203,2020,Apr,WAM-2020-04-28,31,1,3,"Adelphia, NJ"
205,Turf Quality,5/18/20,8,47,Star (GO-2628),Grassland Oregon,SAB,14,6,203,2020,May,SAB-2020-05-18,28,6,3,"Adelphia, NJ"
205,Turf Quality,6/17/20,6,47,Star (GO-2628),Grassland Oregon,WAM,14,6,203,2020,Jun,WAM-2020-06-17,32,4,3,"Adelphia, NJ"
205,Turf Quality,7/15/20,6,47,Star (GO-2628),Grassland Oregon,WAM,14,6,203,2020,Jul,WAM-2020-07-15,33,3,3,"Adelphia, NJ"
205,Turf Quality,8/6/20,8,47,Star (GO-2628),Grassland Oregon,PLV,14,6,203,2020,Aug,PLV-2020-08-06,5,2,3,"Adelphia, NJ"
205,Turf Quality,9/2/20,7,47,Star (GO-2628),Grassland Oregon,DAS,14,6,203,2020,Sep,DAS-2020-09-02,1,9,3,"Adelphia, NJ"
205,Turf Quality,10/15/20,6,47,Star (GO-2628),Grassland Oregon,WAM,14,6,203,2020,Oct,WAM-2020-10-15,34,8,3,"Adelphia, NJ"
205,Turf Quality,11/5/20,6,47,Star (GO-2628),Grassland Oregon,WAM,14,6,203,2020,Nov,WAM-2020-11-05,35,7,3,"Adelphia, NJ"
205,Turf Quality,10/15/20,7,47,Star (GO-2628),Grassland Oregon,RMD,14,6,203,2020,Oct,RMD-2020-10-15,10,8,3,"Adelphia, NJ"
205,Turf Quality,10/23/20,5,47,Star (GO-2628),Grassland Oregon,RMD,14,6,203,2020,Oct,RMD-2020-10-23,11,8,3,"Adelphia, NJ"
205,Turf Quality,3/30/21,6,47,Star (GO-2628),Grassland Oregon,RMD,14,6,203,2021,Mar,RMD-2021-03-30,12,5,4,"Adelphia, NJ"
205,Turf Quality,4/22/21,8,47,Star (GO-2628),Grassland Oregon,PLV,14,6,203,2021,Apr,PLV-2021-04-22,6,1,4,"Adelphia, NJ"
205,Turf Quality,5/28/21,6,47,Star (GO-2628),Grassland Oregon,SAB,14,6,203,2021,May,SAB-2021-05-28,29,6,4,"Adelphia, NJ"
205,Turf Quality,6/11/21,6,47,Star (GO-2628),Grassland Oregon,JEN,14,6,203,2021,Jun,JEN-2021-06-11,2,4,4,"Adelphia, NJ"
205,Turf Quality,7/13/21,4,47,Star (GO-2628),Grassland Oregon,PLV,14,6,203,2021,Jul,PLV-2021-07-13,7,3,4,"Adelphia, NJ"
205,Turf Quality,8/11/21,5,47,Star (GO-2628),Grassland Oregon,JEN,14,6,203,2021,Aug,JEN-2021-08-11,3,2,4,"Adelphia, NJ"
205,Turf Quality,9/17/21,5,47,Star (GO-2628),Grassland Oregon,JEN,14,6,203,2021,Sep,JEN-2021-09-17,4,9,4,"Adelphia, NJ"
205,Turf Quality,10/13/21,7,47,Star (GO-2628),Grassland Oregon,SAB,14,6,203,2021,Oct,SAB-2021-10-13,30,8,4,"Adelphia, NJ"
205,Turf Quality,11/18/21,7,47,Star (GO-2628),Grassland Oregon,WAM,14,6,203,2021,Nov,WAM-2021-11-18,36,7,4,"Adelphia, NJ"
186,Turf Quality,4/18/18,5,2,A13-1,Landmark Turf & Native Seed,RMD,13,6,184,2018,Apr,RMD-2018-04-18,8,1,1,"Adelphia, NJ"
186,Turf Quality,5/10/18,5,2,A13-1,Landmark Turf & Native Seed,RON,13,6,184,2018,May,RON-2018-05-10,13,6,1,"Adelphia, NJ"
186,Turf Quality,6/7/18,6,2,A13-1,Landmark Turf & Native Seed,RON,13,6,184,2018,Jun,RON-2018-06-07,14,4,1,"Adelphia, NJ"
186,Turf Quality,7/17/18,5,2,A13-1,Landmark Turf & Native Seed,RON,13,6,184,2018,Jul,RON-2018-07-17,15,3,1,"Adelphia, NJ"
186,Turf Quality,8/15/18,7,2,A13-1,Landmark Turf & Native Seed,RMD,13,6,184,2018,Aug,RMD-2018-08-15,9,2,1,"Adelphia, NJ"
186,Turf Quality,9/12/18,6,2,A13-1,Landmark Turf & Native Seed,RON,13,6,184,2018,Sep,RON-2018-09-12,16,9,1,"Adelphia, NJ"
186,Turf Quality,10/2/18,7,2,A13-1,Landmark Turf & Native Seed,RON,13,6,184,2018,Oct,RON-2018-10-02,17,8,1,"Adelphia, NJ"
186,Turf Quality,11/9/18,6,2,A13-1,Landmark Turf & Native Seed,RON,13,6,184,2018,Nov,RON-2018-11-09,18,7,1,"Adelphia, NJ"
186,Turf Quality,4/17/19,6,2,A13-1,Landmark Turf & Native Seed,RON,13,6,184,2019,Apr,RON-2019-04-17,19,1,2,"Adelphia, NJ"
186,Turf Quality,5/2/19,8,2,A13-1,Landmark Turf & Native Seed,RON,13,6,184,2019,May,RON-2019-05-02,20,6,2,"Adelphia, NJ"
186,Turf Quality,6/13/19,7,2,A13-1,Landmark Turf & Native Seed,RON,13,6,184,2019,Jun,RON-2019-06-13,21,4,2,"Adelphia, NJ"
186,Turf Quality,6/17/19,8,2,A13-1,Landmark Turf & Native Seed,SAB,13,6,184,2019,Jun,SAB-2019-06-17,25,4,2,"Adelphia, NJ"
186,Turf Quality,7/17/19,7,2,A13-1,Landmark Turf & Native Seed,RON,13,6,184,2019,Jul,RON-2019-07-17,22,3,2,"Adelphia, NJ"
186,Turf Quality,8/22/19,7,2,A13-1,Landmark Turf & Native Seed,SAB,13,6,184,2019,Aug,SAB-2019-08-22,26,2,2,"Adelphia, NJ"
186,Turf Quality,9/16/19,7,2,A13-1,Landmark Turf & Native Seed,RON,13,6,184,2019,Sep,RON-2019-09-16,23,9,2,"Adelphia, NJ"
186,Turf Quality,10/10/19,7,2,A13-1,Landmark Turf & Native Seed,SAB,13,6,184,2019,Oct,SAB-2019-10-10,27,8,2,"Adelphia, NJ"
186,Turf Quality,11/1/19,7,2,A13-1,Landmark Turf & Native Seed,RON,13,6,184,2019,Nov,RON-2019-11-01,24,7,2,"Adelphia, NJ"
186,Turf Quality,4/28/20,7,2,A13-1,Landmark Turf & Native Seed,WAM,13,6,184,2020,Apr,WAM-2020-04-28,31,1,3,"Adelphia, NJ"
186,Turf Quality,5/18/20,8,2,A13-1,Landmark Turf & Native Seed,SAB,13,6,184,2020,May,SAB-2020-05-18,28,6,3,"Adelphia, NJ"
186,Turf Quality,6/17/20,7,2,A13-1,Landmark Turf & Native Seed,WAM,13,6,184,2020,Jun,WAM-2020-06-17,32,4,3,"Adelphia, NJ"
186,Turf Quality,7/15/20,5,2,A13-1,Landmark Turf & Native Seed,WAM,13,6,184,2020,Jul,WAM-2020-07-15,33,3,3,"Adelphia, NJ"
186,Turf Quality,8/6/20,6,2,A13-1,Landmark Turf & Native Seed,PLV,13,6,184,2020,Aug,PLV-2020-08-06,5,2,3,"Adelphia, NJ"
186,Turf Quality,9/2/20,5,2,A13-1,Landmark Turf & Native Seed,DAS,13,6,184,2020,Sep,DAS-2020-09-02,1,9,3,"Adelphia, NJ"
186,Turf Quality,10/15/20,6,2,A13-1,Landmark Turf & Native Seed,WAM,13,6,184,2020,Oct,WAM-2020-10-15,34,8,3,"Adelphia, NJ"
186,Turf Quality,11/5/20,7,2,A13-1,Landmark Turf & Native Seed,WAM,13,6,184,2020,Nov,WAM-2020-11-05,35,7,3,"Adelphia, NJ"
186,Turf Quality,10/15/20,6,2,A13-1,Landmark Turf & Native Seed,RMD,13,6,184,2020,Oct,RMD-2020-10-15,10,8,3,"Adelphia, NJ"
186,Turf Quality,10/23/20,6,2,A13-1,Landmark Turf & Native Seed,RMD,13,6,184,2020,Oct,RMD-2020-10-23,11,8,3,"Adelphia, NJ"
186,Turf Quality,3/30/21,6,2,A13-1,Landmark Turf & Native Seed,RMD,13,6,184,2021,Mar,RMD-2021-03-30,12,5,4,"Adelphia, NJ"
186,Turf Quality,4/22/21,8,2,A13-1,Landmark Turf & Native Seed,PLV,13,6,184,2021,Apr,PLV-2021-04-22,6,1,4,"Adelphia, NJ"
186,Turf Quality,5/28/21,7,2,A13-1,Landmark Turf & Native Seed,SAB,13,6,184,2021,May,SAB-2021-05-28,29,6,4,"Adelphia, NJ"
186,Turf Quality,6/11/21,6,2,A13-1,Landmark Turf & Native Seed,JEN,13,6,184,2021,Jun,JEN-2021-06-11,2,4,4,"Adelphia, NJ"
186,Turf Quality,7/13/21,7,2,A13-1,Landmark Turf & Native Seed,PLV,13,6,184,2021,Jul,PLV-2021-07-13,7,3,4,"Adelphia, NJ"
186,Turf Quality,8/11/21,6,2,A13-1,Landmark Turf & Native Seed,JEN,13,6,184,2021,Aug,JEN-2021-08-11,3,2,4,"Adelphia, NJ"
186,Turf Quality,9/17/21,6,2,A13-1,Landmark Turf & Native Seed,JEN,13,6,184,2021,Sep,JEN-2021-09-17,4,9,4,"Adelphia, NJ"
186,Turf Quality,10/13/21,6,2,A13-1,Landmark Turf & Native Seed,SAB,13,6,184,2021,Oct,SAB-2021-10-13,30,8,4,"Adelphia, NJ"
186,Turf Quality,11/18/21,4,2,A13-1,Landmark Turf & Native Seed,WAM,13,6,184,2021,Nov,WAM-2021-11-18,36,7,4,"Adelphia, NJ"
175,Turf Quality,4/18/18,5,47,Star (GO-2628),Grassland Oregon,RMD,12,6,174,2018,Apr,RMD-2018-04-18,8,1,1,"Adelphia, NJ"
175,Turf Quality,5/10/18,6,47,Star (GO-2628),Grassland Oregon,RON,12,6,174,2018,May,RON-2018-05-10,13,6,1,"Adelphia, NJ"
175,Turf Quality,6/7/18,7,47,Star (GO-2628),Grassland Oregon,RON,12,6,174,2018,Jun,RON-2018-06-07,14,4,1,"Adelphia, NJ"
175,Turf Quality,7/17/18,6,47,Star (GO-2628),Grassland Oregon,RON,12,6,174,2018,Jul,RON-2018-07-17,15,3,1,"Adelphia, NJ"
175,Turf Quality,8/15/18,7,47,Star (GO-2628),Grassland Oregon,RMD,12,6,174,2018,Aug,RMD-2018-08-15,9,2,1,"Adelphia, NJ"
175,Turf Quality,9/12/18,7,47,Star (GO-2628),Grassland Oregon,RON,12,6,174,2018,Sep,RON-2018-09-12,16,9,1,"Adelphia, NJ"
175,Turf Quality,10/2/18,7,47,Star (GO-2628),Grassland Oregon,RON,12,6,174,2018,Oct,RON-2018-10-02,17,8,1,"Adelphia, NJ"
175,Turf Quality,11/9/18,6,47,Star (GO-2628),Grassland Oregon,RON,12,6,174,2018,Nov,RON-2018-11-09,18,7,1,"Adelphia, NJ"
175,Turf Quality,4/17/19,6,47,Star (GO-2628),Grassland Oregon,RON,12,6,174,2019,Apr,RON-2019-04-17,19,1,2,"Adelphia, NJ"
175,Turf Quality,5/2/19,8,47,Star (GO-2628),Grassland Oregon,RON,12,6,174,2019,May,RON-2019-05-02,20,6,2,"Adelphia, NJ"
175,Turf Quality,6/13/19,7,47,Star (GO-2628),Grassland Oregon,RON,12,6,174,2019,Jun,RON-2019-06-13,21,4,2,"Adelphia, NJ"
175,Turf Quality,6/17/19,5,47,Star (GO-2628),Grassland Oregon,SAB,12,6,174,2019,Jun,SAB-2019-06-17,25,4,2,"Adelphia, NJ"
175,Turf Quality,7/17/19,5,47,Star (GO-2628),Grassland Oregon,RON,12,6,174,2019,Jul,RON-2019-07-17,22,3,2,"Adelphia, NJ"
175,Turf Quality,8/22/19,6,47,Star (GO-2628),Grassland Oregon,SAB,12,6,174,2019,Aug,SAB-2019-08-22,26,2,2,"Adelphia, NJ"
175,Turf Quality,9/16/19,7,47,Star (GO-2628),Grassland Oregon,RON,12,6,174,2019,Sep,RON-2019-09-16,23,9,2,"Adelphia, NJ"
175,Turf Quality,10/10/19,7,47,Star (GO-2628),Grassland Oregon,SAB,12,6,174,2019,Oct,SAB-2019-10-10,27,8,2,"Adelphia, NJ"
175,Turf Quality,11/1/19,8,47,Star (GO-2628),Grassland Oregon,RON,12,6,174,2019,Nov,RON-2019-11-01,24,7,2,"Adelphia, NJ"
175,Turf Quality,4/28/20,7,47,Star (GO-2628),Grassland Oregon,WAM,12,6,174,2020,Apr,WAM-2020-04-28,31,1,3,"Adelphia, NJ"
175,Turf Quality,5/18/20,7,47,Star (GO-2628),Grassland Oregon,SAB,12,6,174,2020,May,SAB-2020-05-18,28,6,3,"Adelphia, NJ"
175,Turf Quality,6/17/20,6,47,Star (GO-2628),Grassland Oregon,WAM,12,6,174,2020,Jun,WAM-2020-06-17,32,4,3,"Adelphia, NJ"
175,Turf Quality,7/15/20,7,47,Star (GO-2628),Grassland Oregon,WAM,12,6,174,2020,Jul,WAM-2020-07-15,33,3,3,"Adelphia, NJ"
175,Turf Quality,8/6/20,8,47,Star (GO-2628),Grassland Oregon,PLV,12,6,174,2020,Aug,PLV-2020-08-06,5,2,3,"Adelphia, NJ"
175,Turf Quality,9/2/20,7,47,Star (GO-2628),Grassland Oregon,DAS,12,6,174,2020,Sep,DAS-2020-09-02,1,9,3,"Adelphia, NJ"
175,Turf Quality,10/15/20,4,47,Star (GO-2628),Grassland Oregon,WAM,12,6,174,2020,Oct,WAM-2020-10-15,34,8,3,"Adelphia, NJ"
175,Turf Quality,11/5/20,5,47,Star (GO-2628),Grassland Oregon,WAM,12,6,174,2020,Nov,WAM-2020-11-05,35,7,3,"Adelphia, NJ"
175,Turf Quality,10/15/20,4,47,Star (GO-2628),Grassland Oregon,RMD,12,6,174,2020,Oct,RMD-2020-10-15,10,8,3,"Adelphia, NJ"
175,Turf Quality,10/23/20,5,47,Star (GO-2628),Grassland Oregon,RMD,12,6,174,2020,Oct,RMD-2020-10-23,11,8,3,"Adelphia, NJ"
175,Turf Quality,3/30/21,5,47,Star (GO-2628),Grassland Oregon,RMD,12,6,174,2021,Mar,RMD-2021-03-30,12,5,4,"Adelphia, NJ"
175,Turf Quality,4/22/21,9,47,Star (GO-2628),Grassland Oregon,PLV,12,6,174,2021,Apr,PLV-2021-04-22,6,1,4,"Adelphia, NJ"
175,Turf Quality,5/28/21,7,47,Star (GO-2628),Grassland Oregon,SAB,12,6,174,2021,May,SAB-2021-05-28,29,6,4,"Adelphia, NJ"
175,Turf Quality,6/11/21,7,47,Star (GO-2628),Grassland Oregon,JEN,12,6,174,2021,Jun,JEN-2021-06-11,2,4,4,"Adelphia, NJ"
175,Turf Quality,7/13/21,7,47,Star (GO-2628),Grassland Oregon,PLV,12,6,174,2021,Jul,PLV-2021-07-13,7,3,4,"Adelphia, NJ"
175,Turf Quality,8/11/21,6,47,Star (GO-2628),Grassland Oregon,JEN,12,6,174,2021,Aug,JEN-2021-08-11,3,2,4,"Adelphia, NJ"
175,Turf Quality,9/17/21,6,47,Star (GO-2628),Grassland Oregon,JEN,12,6,174,2021,Sep,JEN-2021-09-17,4,9,4,"Adelphia, NJ"
175,Turf Quality,10/13/21,7,47,Star (GO-2628),Grassland Oregon,SAB,12,6,174,2021,Oct,SAB-2021-10-13,30,8,4,"Adelphia, NJ"
175,Turf Quality,11/18/21,8,47,Star (GO-2628),Grassland Oregon,WAM,12,6,174,2021,Nov,WAM-2021-11-18,36,7,4,"Adelphia, NJ"
156,Turf Quality,4/18/18,6,10,AKB3179,Pennington Seed,RMD,11,6,155,2018,Apr,RMD-2018-04-18,8,1,1,"Adelphia, NJ"
156,Turf Quality,5/10/18,6,10,AKB3179,Pennington Seed,RON,11,6,155,2018,May,RON-2018-05-10,13,6,1,"Adelphia, NJ"
156,Turf Quality,6/7/18,5,10,AKB3179,Pennington Seed,RON,11,6,155,2018,Jun,RON-2018-06-07,14,4,1,"Adelphia, NJ"
156,Turf Quality,7/17/18,6,10,AKB3179,Pennington Seed,RON,11,6,155,2018,Jul,RON-2018-07-17,15,3,1,"Adelphia, NJ"
156,Turf Quality,8/15/18,8,10,AKB3179,Pennington Seed,RMD,11,6,155,2018,Aug,RMD-2018-08-15,9,2,1,"Adelphia, NJ"
156,Turf Quality,9/12/18,5,10,AKB3179,Pennington Seed,RON,11,6,155,2018,Sep,RON-2018-09-12,16,9,1,"Adelphia, NJ"
156,Turf Quality,10/2/18,5,10,AKB3179,Pennington Seed,RON,11,6,155,2018,Oct,RON-2018-10-02,17,8,1,"Adelphia, NJ"
156,Turf Quality,11/9/18,5,10,AKB3179,Pennington Seed,RON,11,6,155,2018,Nov,RON-2018-11-09,18,7,1,"Adelphia, NJ"
156,Turf Quality,4/17/19,4,10,AKB3179,Pennington Seed,RON,11,6,155,2019,Apr,RON-2019-04-17,19,1,2,"Adelphia, NJ"
156,Turf Quality,5/2/19,4,10,AKB3179,Pennington Seed,RON,11,6,155,2019,May,RON-2019-05-02,20,6,2,"Adelphia, NJ"
156,Turf Quality,6/13/19,5,10,AKB3179,Pennington Seed,RON,11,6,155,2019,Jun,RON-2019-06-13,21,4,2,"Adelphia, NJ"
156,Turf Quality,6/17/19,6,10,AKB3179,Pennington Seed,SAB,11,6,155,2019,Jun,SAB-2019-06-17,25,4,2,"Adelphia, NJ"
156,Turf Quality,7/17/19,5,10,AKB3179,Pennington Seed,RON,11,6,155,2019,Jul,RON-2019-07-17,22,3,2,"Adelphia, NJ"
156,Turf Quality,8/22/19,4,10,AKB3179,Pennington Seed,SAB,11,6,155,2019,Aug,SAB-2019-08-22,26,2,2,"Adelphia, NJ"
156,Turf Quality,9/16/19,4,10,AKB3179,Pennington Seed,RON,11,6,155,2019,Sep,RON-2019-09-16,23,9,2,"Adelphia, NJ"
156,Turf Quality,10/10/19,4,10,AKB3179,Pennington Seed,SAB,11,6,155,2019,Oct,SAB-2019-10-10,27,8,2,"Adelphia, NJ"
156,Turf Quality,11/1/19,4,10,AKB3179,Pennington Seed,RON,11,6,155,2019,Nov,RON-2019-11-01,24,7,2,"Adelphia, NJ"
156,Turf Quality,4/28/20,4,10,AKB3179,Pennington Seed,WAM,11,6,155,2020,Apr,WAM-2020-04-28,31,1,3,"Adelphia, NJ"
156,Turf Quality,5/18/20,4,10,AKB3179,Pennington Seed,SAB,11,6,155,2020,May,SAB-2020-05-18,28,6,3,"Adelphia, NJ"
156,Turf Quality,6/17/20,4,10,AKB3179,Pennington Seed,WAM,11,6,155,2020,Jun,WAM-2020-06-17,32,4,3,"Adelphia, NJ"
156,Turf Quality,7/15/20,4,10,AKB3179,Pennington Seed,WAM,11,6,155,2020,Jul,WAM-2020-07-15,33,3,3,"Adelphia, NJ"
156,Turf Quality,8/6/20,6,10,AKB3179,Pennington Seed,PLV,11,6,155,2020,Aug,PLV-2020-08-06,5,2,3,"Adelphia, NJ"
156,Turf Quality,9/2/20,3,10,AKB3179,Pennington Seed,DAS,11,6,155,2020,Sep,DAS-2020-09-02,1,9,3,"Adelphia, NJ"
156,Turf Quality,10/15/20,1,10,AKB3179,Pennington Seed,WAM,11,6,155,2020,Oct,WAM-2020-10-15,34,8,3,"Adelphia, NJ"
156,Turf Quality,11/5/20,2,10,AKB3179,Pennington Seed,WAM,11,6,155,2020,Nov,WAM-2020-11-05,35,7,3,"Adelphia, NJ"
156,Turf Quality,10/15/20,3,10,AKB3179,Pennington Seed,RMD,11,6,155,2020,Oct,RMD-2020-10-15,10,8,3,"Adelphia, NJ"
156,Turf Quality,10/23/20,3,10,AKB3179,Pennington Seed,RMD,11,6,155,2020,Oct,RMD-2020-10-23,11,8,3,"Adelphia, NJ"
156,Turf Quality,3/30/21,3,10,AKB3179,Pennington Seed,RMD,11,6,155,2021,Mar,RMD-2021-03-30,12,5,4,"Adelphia, NJ"
156,Turf Quality,4/22/21,3,10,AKB3179,Pennington Seed,PLV,11,6,155,2021,Apr,PLV-2021-04-22,6,1,4,"Adelphia, NJ"
156,Turf Quality,5/28/21,3,10,AKB3179,Pennington Seed,SAB,11,6,155,2021,May,SAB-2021-05-28,29,6,4,"Adelphia, NJ"
156,Turf Quality,6/11/21,3,10,AKB3179,Pennington Seed,JEN,11,6,155,2021,Jun,JEN-2021-06-11,2,4,4,"Adelphia, NJ"
156,Turf Quality,7/13/21,4,10,AKB3179,Pennington Seed,PLV,11,6,155,2021,Jul,PLV-2021-07-13,7,3,4,"Adelphia, NJ"
156,Turf Quality,8/11/21,6,10,AKB3179,Pennington Seed,JEN,11,6,155,2021,Aug,JEN-2021-08-11,3,2,4,"Adelphia, NJ"
156,Turf Quality,9/17/21,5,10,AKB3179,Pennington Seed,JEN,11,6,155,2021,Sep,JEN-2021-09-17,4,9,4,"Adelphia, NJ"
156,Turf Quality,10/13/21,5,10,AKB3179,Pennington Seed,SAB,11,6,155,2021,Oct,SAB-2021-10-13,30,8,4,"Adelphia, NJ"
156,Turf Quality,11/18/21,6,10,AKB3179,Pennington Seed,WAM,11,6,155,2021,Nov,WAM-2021-11-18,36,7,4,"Adelphia, NJ"
145,Turf Quality,4/18/18,5,42,Aviator II (NAI-15-84),Columbia River Seed,RMD,10,6,144,2018,Apr,RMD-2018-04-18,8,1,1,"Adelphia, NJ"
145,Turf Quality,5/10/18,6,42,Aviator II (NAI-15-84),Columbia River Seed,RON,10,6,144,2018,May,RON-2018-05-10,13,6,1,"Adelphia, NJ"
145,Turf Quality,6/7/18,5,42,Aviator II (NAI-15-84),Columbia River Seed,RON,10,6,144,2018,Jun,RON-2018-06-07,14,4,1,"Adelphia, NJ"
145,Turf Quality,7/17/18,5,42,Aviator II (NAI-15-84),Columbia River Seed,RON,10,6,144,2018,Jul,RON-2018-07-17,15,3,1,"Adelphia, NJ"
145,Turf Quality,8/15/18,5,42,Aviator II (NAI-15-84),Columbia River Seed,RMD,10,6,144,2018,Aug,RMD-2018-08-15,9,2,1,"Adelphia, NJ"
145,Turf Quality,9/12/18,2,42,Aviator II (NAI-15-84),Columbia River Seed,RON,10,6,144,2018,Sep,RON-2018-09-12,16,9,1,"Adelphia, NJ"
145,Turf Quality,10/2/18,2,42,Aviator II (NAI-15-84),Columbia River Seed,RON,10,6,144,2018,Oct,RON-2018-10-02,17,8,1,"Adelphia, NJ"
145,Turf Quality,11/9/18,1,42,Aviator II (NAI-15-84),Columbia River Seed,RON,10,6,144,2018,Nov,RON-2018-11-09,18,7,1,"Adelphia, NJ"
145,Turf Quality,4/17/19,1,42,Aviator II (NAI-15-84),Columbia River Seed,RON,10,6,144,2019,Apr,RON-2019-04-17,19,1,2,"Adelphia, NJ"
145,Turf Quality,5/2/19,1,42,Aviator II (NAI-15-84),Columbia River Seed,RON,10,6,144,2019,May,RON-2019-05-02,20,6,2,"Adelphia, NJ"
145,Turf Quality,6/13/19,2,42,Aviator II (NAI-15-84),Columbia River Seed,RON,10,6,144,2019,Jun,RON-2019-06-13,21,4,2,"Adelphia, NJ"
145,Turf Quality,6/17/19,4,42,Aviator II (NAI-15-84),Columbia River Seed,SAB,10,6,144,2019,Jun,SAB-2019-06-17,25,4,2,"Adelphia, NJ"
145,Turf Quality,7/17/19,2,42,Aviator II (NAI-15-84),Columbia River Seed,RON,10,6,144,2019,Jul,RON-2019-07-17,22,3,2,"Adelphia, NJ"
145,Turf Quality,8/22/19,2,42,Aviator II (NAI-15-84),Columbia River Seed,SAB,10,6,144,2019,Aug,SAB-2019-08-22,26,2,2,"Adelphia, NJ"
145,Turf Quality,9/16/19,2,42,Aviator II (NAI-15-84),Columbia River Seed,RON,10,6,144,2019,Sep,RON-2019-09-16,23,9,2,"Adelphia, NJ"
145,Turf Quality,10/10/19,1,42,Aviator II (NAI-15-84),Columbia River Seed,SAB,10,6,144,2019,Oct,SAB-2019-10-10,27,8,2,"Adelphia, NJ"
145,Turf Quality,11/1/19,2,42,Aviator II (NAI-15-84),Columbia River Seed,RON,10,6,144,2019,Nov,RON-2019-11-01,24,7,2,"Adelphia, NJ"
145,Turf Quality,4/28/20,4,42,Aviator II (NAI-15-84),Columbia River Seed,WAM,10,6,144,2020,Apr,WAM-2020-04-28,31,1,3,"Adelphia, NJ"
145,Turf Quality,5/18/20,4,42,Aviator II (NAI-15-84),Columbia River Seed,SAB,10,6,144,2020,May,SAB-2020-05-18,28,6,3,"Adelphia, NJ"
145,Turf Quality,6/17/20,3,42,Aviator II (NAI-15-84),Columbia River Seed,WAM,10,6,144,2020,Jun,WAM-2020-06-17,32,4,3,"Adelphia, NJ"
145,Turf Quality,7/15/20,3,42,Aviator II (NAI-15-84),Columbia River Seed,WAM,10,6,144,2020,Jul,WAM-2020-07-15,33,3,3,"Adelphia, NJ"
145,Turf Quality,8/6/20,5,42,Aviator II (NAI-15-84),Columbia River Seed,PLV,10,6,144,2020,Aug,PLV-2020-08-06,5,2,3,"Adelphia, NJ"
145,Turf Quality,9/2/20,2,42,Aviator II (NAI-15-84),Columbia River Seed,DAS,10,6,144,2020,Sep,DAS-2020-09-02,1,9,3,"Adelphia, NJ"
145,Turf Quality,10/15/20,1,42,Aviator II (NAI-15-84),Columbia River Seed,WAM,10,6,144,2020,Oct,WAM-2020-10-15,34,8,3,"Adelphia, NJ"
145,Turf Quality,11/5/20,2,42,Aviator II (NAI-15-84),Columbia River Seed,WAM,10,6,144,2020,Nov,WAM-2020-11-05,35,7,3,"Adelphia, NJ"
145,Turf Quality,10/15/20,1,42,Aviator II (NAI-15-84),Columbia River Seed,RMD,10,6,144,2020,Oct,RMD-2020-10-15,10,8,3,"Adelphia, NJ"
145,Turf Quality,10/23/20,1,42,Aviator II (NAI-15-84),Columbia River Seed,RMD,10,6,144,2020,Oct,RMD-2020-10-23,11,8,3,"Adelphia, NJ"
145,Turf Quality,3/30/21,1,42,Aviator II (NAI-15-84),Columbia River Seed,RMD,10,6,144,2021,Mar,RMD-2021-03-30,12,5,4,"Adelphia, NJ"
145,Turf Quality,4/22/21,1,42,Aviator II (NAI-15-84),Columbia River Seed,PLV,10,6,144,2021,Apr,PLV-2021-04-22,6,1,4,"Adelphia, NJ"
145,Turf Quality,5/28/21,1,42,Aviator II (NAI-15-84),Columbia River Seed,SAB,10,6,144,2021,May,SAB-2021-05-28,29,6,4,"Adelphia, NJ"
145,Turf Quality,6/11/21,2,42,Aviator II (NAI-15-84),Columbia River Seed,JEN,10,6,144,2021,Jun,JEN-2021-06-11,2,4,4,"Adelphia, NJ"
145,Turf Quality,7/13/21,3,42,Aviator II (NAI-15-84),Columbia River Seed,PLV,10,6,144,2021,Jul,PLV-2021-07-13,7,3,4,"Adelphia, NJ"
145,Turf Quality,8/11/21,3,42,Aviator II (NAI-15-84),Columbia River Seed,JEN,10,6,144,2021,Aug,JEN-2021-08-11,3,2,4,"Adelphia, NJ"
145,Turf Quality,9/17/21,2,42,Aviator II (NAI-15-84),Columbia River Seed,JEN,10,6,144,2021,Sep,JEN-2021-09-17,4,9,4,"Adelphia, NJ"
145,Turf Quality,10/13/21,1,42,Aviator II (NAI-15-84),Columbia River Seed,SAB,10,6,144,2021,Oct,SAB-2021-10-13,30,8,4,"Adelphia, NJ"
145,Turf Quality,11/18/21,4,42,Aviator II (NAI-15-84),Columbia River Seed,WAM,10,6,144,2021,Nov,WAM-2021-11-18,36,7,4,"Adelphia, NJ"
126,Turf Quality,4/18/18,2,66,A12-34,Mountain View Seeds,RMD,9,6,125,2018,Apr,RMD-2018-04-18,8,1,1,"Adelphia, NJ"
126,Turf Quality,5/10/18,4,66,A12-34,Mountain View Seeds,RON,9,6,125,2018,May,RON-2018-05-10,13,6,1,"Adelphia, NJ"
126,Turf Quality,6/7/18,3,66,A12-34,Mountain View Seeds,RON,9,6,125,2018,Jun,RON-2018-06-07,14,4,1,"Adelphia, NJ"
126,Turf Quality,7/17/18,5,66,A12-34,Mountain View Seeds,RON,9,6,125,2018,Jul,RON-2018-07-17,15,3,1,"Adelphia, NJ"
126,Turf Quality,8/15/18,6,66,A12-34,Mountain View Seeds,RMD,9,6,125,2018,Aug,RMD-2018-08-15,9,2,1,"Adelphia, NJ"
126,Turf Quality,9/12/18,5,66,A12-34,Mountain View Seeds,RON,9,6,125,2018,Sep,RON-2018-09-12,16,9,1,"Adelphia, NJ"
126,Turf Quality,10/2/18,6,66,A12-34,Mountain View Seeds,RON,9,6,125,2018,Oct,RON-2018-10-02,17,8,1,"Adelphia, NJ"
126,Turf Quality,11/9/18,5,66,A12-34,Mountain View Seeds,RON,9,6,125,2018,Nov,RON-2018-11-09,18,7,1,"Adelphia, NJ"
126,Turf Quality,4/17/19,4,66,A12-34,Mountain View Seeds,RON,9,6,125,2019,Apr,RON-2019-04-17,19,1,2,"Adelphia, NJ"
126,Turf Quality,5/2/19,4,66,A12-34,Mountain View Seeds,RON,9,6,125,2019,May,RON-2019-05-02,20,6,2,"Adelphia, NJ"
126,Turf Quality,6/13/19,5,66,A12-34,Mountain View Seeds,RON,9,6,125,2019,Jun,RON-2019-06-13,21,4,2,"Adelphia, NJ"
126,Turf Quality,6/17/19,5,66,A12-34,Mountain View Seeds,SAB,9,6,125,2019,Jun,SAB-2019-06-17,25,4,2,"Adelphia, NJ"
126,Turf Quality,7/17/19,5,66,A12-34,Mountain View Seeds,RON,9,6,125,2019,Jul,RON-2019-07-17,22,3,2,"Adelphia, NJ"
126,Turf Quality,8/22/19,4,66,A12-34,Mountain View Seeds,SAB,9,6,125,2019,Aug,SAB-2019-08-22,26,2,2,"Adelphia, NJ"
126,Turf Quality,9/16/19,5,66,A12-34,Mountain View Seeds,RON,9,6,125,2019,Sep,RON-2019-09-16,23,9,2,"Adelphia, NJ"
126,Turf Quality,10/10/19,4,66,A12-34,Mountain View Seeds,SAB,9,6,125,2019,Oct,SAB-2019-10-10,27,8,2,"Adelphia, NJ"
126,Turf Quality,11/1/19,4,66,A12-34,Mountain View Seeds,RON,9,6,125,2019,Nov,RON-2019-11-01,24,7,2,"Adelphia, NJ"
126,Turf Quality,4/28/20,4,66,A12-34,Mountain View Seeds,WAM,9,6,125,2020,Apr,WAM-2020-04-28,31,1,3,"Adelphia, NJ"
126,Turf Quality,5/18/20,4,66,A12-34,Mountain View Seeds,SAB,9,6,125,2020,May,SAB-2020-05-18,28,6,3,"Adelphia, NJ"
126,Turf Quality,6/17/20,5,66,A12-34,Mountain View Seeds,WAM,9,6,125,2020,Jun,WAM-2020-06-17,32,4,3,"Adelphia, NJ"
126,Turf Quality,7/15/20,4,66,A12-34,Mountain View Seeds,WAM,9,6,125,2020,Jul,WAM-2020-07-15,33,3,3,"Adelphia, NJ"
126,Turf Quality,8/6/20,8,66,A12-34,Mountain View Seeds,PLV,9,6,125,2020,Aug,PLV-2020-08-06,5,2,3,"Adelphia, NJ"
126,Turf Quality,9/2/20,6,66,A12-34,Mountain View Seeds,DAS,9,6,125,2020,Sep,DAS-2020-09-02,1,9,3,"Adelphia, NJ"
126,Turf Quality,10/15/20,3,66,A12-34,Mountain View Seeds,WAM,9,6,125,2020,Oct,WAM-2020-10-15,34,8,3,"Adelphia, NJ"
126,Turf Quality,11/5/20,6,66,A12-34,Mountain View Seeds,WAM,9,6,125,2020,Nov,WAM-2020-11-05,35,7,3,"Adelphia, NJ"
126,Turf Quality,10/15/20,4,66,A12-34,Mountain View Seeds,RMD,9,6,125,2020,Oct,RMD-2020-10-15,10,8,3,"Adelphia, NJ"
126,Turf Quality,10/23/20,4,66,A12-34,Mountain View Seeds,RMD,9,6,125,2020,Oct,RMD-2020-10-23,11,8,3,"Adelphia, NJ"
126,Turf Quality,3/30/21,4,66,A12-34,Mountain View Seeds,RMD,9,6,125,2021,Mar,RMD-2021-03-30,12,5,4,"Adelphia, NJ"
126,Turf Quality,4/22/21,4,66,A12-34,Mountain View Seeds,PLV,9,6,125,2021,Apr,PLV-2021-04-22,6,1,4,"Adelphia, NJ"
126,Turf Quality,5/28/21,4,66,A12-34,Mountain View Seeds,SAB,9,6,125,2021,May,SAB-2021-05-28,29,6,4,"Adelphia, NJ"
126,Turf Quality,6/11/21,5,66,A12-34,Mountain View Seeds,JEN,9,6,125,2021,Jun,JEN-2021-06-11,2,4,4,"Adelphia, NJ"
126,Turf Quality,7/13/21,5,66,A12-34,Mountain View Seeds,PLV,9,6,125,2021,Jul,PLV-2021-07-13,7,3,4,"Adelphia, NJ"
126,Turf Quality,8/11/21,6,66,A12-34,Mountain View Seeds,JEN,9,6,125,2021,Aug,JEN-2021-08-11,3,2,4,"Adelphia, NJ"
126,Turf Quality,9/17/21,5,66,A12-34,Mountain View Seeds,JEN,9,6,125,2021,Sep,JEN-2021-09-17,4,9,4,"Adelphia, NJ"
126,Turf Quality,10/13/21,2,66,A12-34,Mountain View Seeds,SAB,9,6,125,2021,Oct,SAB-2021-10-13,30,8,4,"Adelphia, NJ"
126,Turf Quality,11/18/21,5,66,A12-34,Mountain View Seeds,WAM,9,6,125,2021,Nov,WAM-2021-11-18,36,7,4,"Adelphia, NJ"
115,Turf Quality,4/18/18,6,59,DLFPS-340/3455,DLF Pickseed USA,RMD,8,6,114,2018,Apr,RMD-2018-04-18,8,1,1,"Adelphia, NJ"
115,Turf Quality,5/10/18,7,59,DLFPS-340/3455,DLF Pickseed USA,RON,8,6,114,2018,May,RON-2018-05-10,13,6,1,"Adelphia, NJ"
115,Turf Quality,6/7/18,4,59,DLFPS-340/3455,DLF Pickseed USA,RON,8,6,114,2018,Jun,RON-2018-06-07,14,4,1,"Adelphia, NJ"
115,Turf Quality,7/17/18,5,59,DLFPS-340/3455,DLF Pickseed USA,RON,8,6,114,2018,Jul,RON-2018-07-17,15,3,1,"Adelphia, NJ"
115,Turf Quality,8/15/18,7,59,DLFPS-340/3455,DLF Pickseed USA,RMD,8,6,114,2018,Aug,RMD-2018-08-15,9,2,1,"Adelphia, NJ"
115,Turf Quality,9/12/18,6,59,DLFPS-340/3455,DLF Pickseed USA,RON,8,6,114,2018,Sep,RON-2018-09-12,16,9,1,"Adelphia, NJ"
115,Turf Quality,10/2/18,5,59,DLFPS-340/3455,DLF Pickseed USA,RON,8,6,114,2018,Oct,RON-2018-10-02,17,8,1,"Adelphia, NJ"
115,Turf Quality,11/9/18,6,59,DLFPS-340/3455,DLF Pickseed USA,RON,8,6,114,2018,Nov,RON-2018-11-09,18,7,1,"Adelphia, NJ"
115,Turf Quality,4/17/19,7,59,DLFPS-340/3455,DLF Pickseed USA,RON,8,6,114,2019,Apr,RON-2019-04-17,19,1,2,"Adelphia, NJ"
115,Turf Quality,5/2/19,5,59,DLFPS-340/3455,DLF Pickseed USA,RON,8,6,114,2019,May,RON-2019-05-02,20,6,2,"Adelphia, NJ"
115,Turf Quality,6/13/19,4,59,DLFPS-340/3455,DLF Pickseed USA,RON,8,6,114,2019,Jun,RON-2019-06-13,21,4,2,"Adelphia, NJ"
115,Turf Quality,6/17/19,6,59,DLFPS-340/3455,DLF Pickseed USA,SAB,8,6,114,2019,Jun,SAB-2019-06-17,25,4,2,"Adelphia, NJ"
115,Turf Quality,7/17/19,7,59,DLFPS-340/3455,DLF Pickseed USA,RON,8,6,114,2019,Jul,RON-2019-07-17,22,3,2,"Adelphia, NJ"
115,Turf Quality,8/22/19,4,59,DLFPS-340/3455,DLF Pickseed USA,SAB,8,6,114,2019,Aug,SAB-2019-08-22,26,2,2,"Adelphia, NJ"
115,Turf Quality,9/16/19,4,59,DLFPS-340/3455,DLF Pickseed USA,RON,8,6,114,2019,Sep,RON-2019-09-16,23,9,2,"Adelphia, NJ"
115,Turf Quality,10/10/19,3,59,DLFPS-340/3455,DLF Pickseed USA,SAB,8,6,114,2019,Oct,SAB-2019-10-10,27,8,2,"Adelphia, NJ"
115,Turf Quality,11/1/19,4,59,DLFPS-340/3455,DLF Pickseed USA,RON,8,6,114,2019,Nov,RON-2019-11-01,24,7,2,"Adelphia, NJ"
115,Turf Quality,4/28/20,4,59,DLFPS-340/3455,DLF Pickseed USA,WAM,8,6,114,2020,Apr,WAM-2020-04-28,31,1,3,"Adelphia, NJ"
115,Turf Quality,5/18/20,6,59,DLFPS-340/3455,DLF Pickseed USA,SAB,8,6,114,2020,May,SAB-2020-05-18,28,6,3,"Adelphia, NJ"
115,Turf Quality,6/17/20,3,59,DLFPS-340/3455,DLF Pickseed USA,WAM,8,6,114,2020,Jun,WAM-2020-06-17,32,4,3,"Adelphia, NJ"
115,Turf Quality,7/15/20,4,59,DLFPS-340/3455,DLF Pickseed USA,WAM,8,6,114,2020,Jul,WAM-2020-07-15,33,3,3,"Adelphia, NJ"
115,Turf Quality,8/6/20,5,59,DLFPS-340/3455,DLF Pickseed USA,PLV,8,6,114,2020,Aug,PLV-2020-08-06,5,2,3,"Adelphia, NJ"
115,Turf Quality,9/2/20,4,59,DLFPS-340/3455,DLF Pickseed USA,DAS,8,6,114,2020,Sep,DAS-2020-09-02,1,9,3,"Adelphia, NJ"
115,Turf Quality,10/15/20,3,59,DLFPS-340/3455,DLF Pickseed USA,WAM,8,6,114,2020,Oct,WAM-2020-10-15,34,8,3,"Adelphia, NJ"
115,Turf Quality,11/5/20,4,59,DLFPS-340/3455,DLF Pickseed USA,WAM,8,6,114,2020,Nov,WAM-2020-11-05,35,7,3,"Adelphia, NJ"
115,Turf Quality,10/15/20,4,59,DLFPS-340/3455,DLF Pickseed USA,RMD,8,6,114,2020,Oct,RMD-2020-10-15,10,8,3,"Adelphia, NJ"
115,Turf Quality,10/23/20,4,59,DLFPS-340/3455,DLF Pickseed USA,RMD,8,6,114,2020,Oct,RMD-2020-10-23,11,8,3,"Adelphia, NJ"
115,Turf Quality,3/30/21,4,59,DLFPS-340/3455,DLF Pickseed USA,RMD,8,6,114,2021,Mar,RMD-2021-03-30,12,5,4,"Adelphia, NJ"
115,Turf Quality,4/22/21,5,59,DLFPS-340/3455,DLF Pickseed USA,PLV,8,6,114,2021,Apr,PLV-2021-04-22,6,1,4,"Adelphia, NJ"
115,Turf Quality,5/28/21,5,59,DLFPS-340/3455,DLF Pickseed USA,SAB,8,6,114,2021,May,SAB-2021-05-28,29,6,4,"Adelphia, NJ"
115,Turf Quality,6/11/21,5,59,DLFPS-340/3455,DLF Pickseed USA,JEN,8,6,114,2021,Jun,JEN-2021-06-11,2,4,4,"Adelphia, NJ"
115,Turf Quality,7/13/21,6,59,DLFPS-340/3455,DLF Pickseed USA,PLV,8,6,114,2021,Jul,PLV-2021-07-13,7,3,4,"Adelphia, NJ"
115,Turf Quality,8/11/21,5,59,DLFPS-340/3455,DLF Pickseed USA,JEN,8,6,114,2021,Aug,JEN-2021-08-11,3,2,4,"Adelphia, NJ"
115,Turf Quality,9/17/21,3,59,DLFPS-340/3455,DLF Pickseed USA,JEN,8,6,114,2021,Sep,JEN-2021-09-17,4,9,4,"Adelphia, NJ"
115,Turf Quality,10/13/21,4,59,DLFPS-340/3455,DLF Pickseed USA,SAB,8,6,114,2021,Oct,SAB-2021-10-13,30,8,4,"Adelphia, NJ"
115,Turf Quality,11/18/21,5,59,DLFPS-340/3455,DLF Pickseed USA,WAM,8,6,114,2021,Nov,WAM-2021-11-18,36,7,4,"Adelphia, NJ"
96,Turf Quality,4/18/18,2,5,Blue Knight,Ledeboer Plant Breeding,RMD,7,6,95,2018,Apr,RMD-2018-04-18,8,1,1,"Adelphia, NJ"
96,Turf Quality,5/10/18,4,5,Blue Knight,Ledeboer Plant Breeding,RON,7,6,95,2018,May,RON-2018-05-10,13,6,1,"Adelphia, NJ"
96,Turf Quality,6/7/18,4,5,Blue Knight,Ledeboer Plant Breeding,RON,7,6,95,2018,Jun,RON-2018-06-07,14,4,1,"Adelphia, NJ"
96,Turf Quality,7/17/18,3,5,Blue Knight,Ledeboer Plant Breeding,RON,7,6,95,2018,Jul,RON-2018-07-17,15,3,1,"Adelphia, NJ"
96,Turf Quality,8/15/18,4,5,Blue Knight,Ledeboer Plant Breeding,RMD,7,6,95,2018,Aug,RMD-2018-08-15,9,2,1,"Adelphia, NJ"
96,Turf Quality,9/12/18,3,5,Blue Knight,Ledeboer Plant Breeding,RON,7,6,95,2018,Sep,RON-2018-09-12,16,9,1,"Adelphia, NJ"
96,Turf Quality,10/2/18,3,5,Blue Knight,Ledeboer Plant Breeding,RON,7,6,95,2018,Oct,RON-2018-10-02,17,8,1,"Adelphia, NJ"
96,Turf Quality,11/9/18,2,5,Blue Knight,Ledeboer Plant Breeding,RON,7,6,95,2018,Nov,RON-2018-11-09,18,7,1,"Adelphia, NJ"
96,Turf Quality,4/17/19,3,5,Blue Knight,Ledeboer Plant Breeding,RON,7,6,95,2019,Apr,RON-2019-04-17,19,1,2,"Adelphia, NJ"
96,Turf Quality,5/2/19,3,5,Blue Knight,Ledeboer Plant Breeding,RON,7,6,95,2019,May,RON-2019-05-02,20,6,2,"Adelphia, NJ"
96,Turf Quality,6/13/19,4,5,Blue Knight,Ledeboer Plant Breeding,RON,7,6,95,2019,Jun,RON-2019-06-13,21,4,2,"Adelphia, NJ"
96,Turf Quality,6/17/19,4,5,Blue Knight,Ledeboer Plant Breeding,SAB,7,6,95,2019,Jun,SAB-2019-06-17,25,4,2,"Adelphia, NJ"
96,Turf Quality,7/17/19,4,5,Blue Knight,Ledeboer Plant Breeding,RON,7,6,95,2019,Jul,RON-2019-07-17,22,3,2,"Adelphia, NJ"
96,Turf Quality,8/22/19,2,5,Blue Knight,Ledeboer Plant Breeding,SAB,7,6,95,2019,Aug,SAB-2019-08-22,26,2,2,"Adelphia, NJ"
96,Turf Quality,9/16/19,2,5,Blue Knight,Ledeboer Plant Breeding,RON,7,6,95,2019,Sep,RON-2019-09-16,23,9,2,"Adelphia, NJ"
96,Turf Quality,10/10/19,2,5,Blue Knight,Ledeboer Plant Breeding,SAB,7,6,95,2019,Oct,SAB-2019-10-10,27,8,2,"Adelphia, NJ"
96,Turf Quality,11/1/19,2,5,Blue Knight,Ledeboer Plant Breeding,RON,7,6,95,2019,Nov,RON-2019-11-01,24,7,2,"Adelphia, NJ"
96,Turf Quality,4/28/20,3,5,Blue Knight,Ledeboer Plant Breeding,WAM,7,6,95,2020,Apr,WAM-2020-04-28,31,1,3,"Adelphia, NJ"
96,Turf Quality,5/18/20,1,5,Blue Knight,Ledeboer Plant Breeding,SAB,7,6,95,2020,May,SAB-2020-05-18,28,6,3,"Adelphia, NJ"
96,Turf Quality,6/17/20,3,5,Blue Knight,Ledeboer Plant Breeding,WAM,7,6,95,2020,Jun,WAM-2020-06-17,32,4,3,"Adelphia, NJ"
96,Turf Quality,7/15/20,3,5,Blue Knight,Ledeboer Plant Breeding,WAM,7,6,95,2020,Jul,WAM-2020-07-15,33,3,3,"Adelphia, NJ"
96,Turf Quality,8/6/20,4,5,Blue Knight,Ledeboer Plant Breeding,PLV,7,6,95,2020,Aug,PLV-2020-08-06,5,2,3,"Adelphia, NJ"
96,Turf Quality,9/2/20,2,5,Blue Knight,Ledeboer Plant Breeding,DAS,7,6,95,2020,Sep,DAS-2020-09-02,1,9,3,"Adelphia, NJ"
96,Turf Quality,10/15/20,1,5,Blue Knight,Ledeboer Plant Breeding,WAM,7,6,95,2020,Oct,WAM-2020-10-15,34,8,3,"Adelphia, NJ"
96,Turf Quality,11/5/20,2,5,Blue Knight,Ledeboer Plant Breeding,WAM,7,6,95,2020,Nov,WAM-2020-11-05,35,7,3,"Adelphia, NJ"
96,Turf Quality,10/15/20,1,5,Blue Knight,Ledeboer Plant Breeding,RMD,7,6,95,2020,Oct,RMD-2020-10-15,10,8,3,"Adelphia, NJ"
96,Turf Quality,10/23/20,1,5,Blue Knight,Ledeboer Plant Breeding,RMD,7,6,95,2020,Oct,RMD-2020-10-23,11,8,3,"Adelphia, NJ"
96,Turf Quality,3/30/21,1,5,Blue Knight,Ledeboer Plant Breeding,RMD,7,6,95,2021,Mar,RMD-2021-03-30,12,5,4,"Adelphia, NJ"
96,Turf Quality,4/22/21,2,5,Blue Knight,Ledeboer Plant Breeding,PLV,7,6,95,2021,Apr,PLV-2021-04-22,6,1,4,"Adelphia, NJ"
96,Turf Quality,5/28/21,1,5,Blue Knight,Ledeboer Plant Breeding,SAB,7,6,95,2021,May,SAB-2021-05-28,29,6,4,"Adelphia, NJ"
96,Turf Quality,6/11/21,3,5,Blue Knight,Ledeboer Plant Breeding,JEN,7,6,95,2021,Jun,JEN-2021-06-11,2,4,4,"Adelphia, NJ"
96,Turf Quality,7/13/21,3,5,Blue Knight,Ledeboer Plant Breeding,PLV,7,6,95,2021,Jul,PLV-2021-07-13,7,3,4,"Adelphia, NJ"
96,Turf Quality,8/11/21,5,5,Blue Knight,Ledeboer Plant Breeding,JEN,7,6,95,2021,Aug,JEN-2021-08-11,3,2,4,"Adelphia, NJ"
96,Turf Quality,9/17/21,2,5,Blue Knight,Ledeboer Plant Breeding,JEN,7,6,95,2021,Sep,JEN-2021-09-17,4,9,4,"Adelphia, NJ"
96,Turf Quality,10/13/21,2,5,Blue Knight,Ledeboer Plant Breeding,SAB,7,6,95,2021,Oct,SAB-2021-10-13,30,8,4,"Adelphia, NJ"
96,Turf Quality,11/18/21,3,5,Blue Knight,Ledeboer Plant Breeding,WAM,7,6,95,2021,Nov,WAM-2021-11-18,36,7,4,"Adelphia, NJ"
85,Turf Quality,4/18/18,2,85,PST-K15-167,Pure Seed Testing Inc.,RMD,6,6,85,2018,Apr,RMD-2018-04-18,8,1,1,"Adelphia, NJ"
85,Turf Quality,5/10/18,4,85,PST-K15-167,Pure Seed Testing Inc.,RON,6,6,85,2018,May,RON-2018-05-10,13,6,1,"Adelphia, NJ"
85,Turf Quality,6/7/18,4,85,PST-K15-167,Pure Seed Testing Inc.,RON,6,6,85,2018,Jun,RON-2018-06-07,14,4,1,"Adelphia, NJ"
85,Turf Quality,7/17/18,4,85,PST-K15-167,Pure Seed Testing Inc.,RON,6,6,85,2018,Jul,RON-2018-07-17,15,3,1,"Adelphia, NJ"
85,Turf Quality,8/15/18,7,85,PST-K15-167,Pure Seed Testing Inc.,RMD,6,6,85,2018,Aug,RMD-2018-08-15,9,2,1,"Adelphia, NJ"
85,Turf Quality,9/12/18,6,85,PST-K15-167,Pure Seed Testing Inc.,RON,6,6,85,2018,Sep,RON-2018-09-12,16,9,1,"Adelphia, NJ"
85,Turf Quality,10/2/18,6,85,PST-K15-167,Pure Seed Testing Inc.,RON,6,6,85,2018,Oct,RON-2018-10-02,17,8,1,"Adelphia, NJ"
85,Turf Quality,11/9/18,6,85,PST-K15-167,Pure Seed Testing Inc.,RON,6,6,85,2018,Nov,RON-2018-11-09,18,7,1,"Adelphia, NJ"
85,Turf Quality,4/17/19,4,85,PST-K15-167,Pure Seed Testing Inc.,RON,6,6,85,2019,Apr,RON-2019-04-17,19,1,2,"Adelphia, NJ"
85,Turf Quality,5/2/19,6,85,PST-K15-167,Pure Seed Testing Inc.,RON,6,6,85,2019,May,RON-2019-05-02,20,6,2,"Adelphia, NJ"
85,Turf Quality,6/13/19,6,85,PST-K15-167,Pure Seed Testing Inc.,RON,6,6,85,2019,Jun,RON-2019-06-13,21,4,2,"Adelphia, NJ"
85,Turf Quality,6/17/19,2,85,PST-K15-167,Pure Seed Testing Inc.,SAB,6,6,85,2019,Jun,SAB-2019-06-17,25,4,2,"Adelphia, NJ"
85,Turf Quality,7/17/19,5,85,PST-K15-167,Pure Seed Testing Inc.,RON,6,6,85,2019,Jul,RON-2019-07-17,22,3,2,"Adelphia, NJ"
85,Turf Quality,8/22/19,6,85,PST-K15-167,Pure Seed Testing Inc.,SAB,6,6,85,2019,Aug,SAB-2019-08-22,26,2,2,"Adelphia, NJ"
85,Turf Quality,9/16/19,6,85,PST-K15-167,Pure Seed Testing Inc.,RON,6,6,85,2019,Sep,RON-2019-09-16,23,9,2,"Adelphia, NJ"
85,Turf Quality,10/10/19,4,85,PST-K15-167,Pure Seed Testing Inc.,SAB,6,6,85,2019,Oct,SAB-2019-10-10,27,8,2,"Adelphia, NJ"
85,Turf Quality,11/1/19,4,85,PST-K15-167,Pure Seed Testing Inc.,RON,6,6,85,2019,Nov,RON-2019-11-01,24,7,2,"Adelphia, NJ"
85,Turf Quality,4/28/20,5,85,PST-K15-167,Pure Seed Testing Inc.,WAM,6,6,85,2020,Apr,WAM-2020-04-28,31,1,3,"Adelphia, NJ"
85,Turf Quality,5/18/20,5,85,PST-K15-167,Pure Seed Testing Inc.,SAB,6,6,85,2020,May,SAB-2020-05-18,28,6,3,"Adelphia, NJ"
85,Turf Quality,6/17/20,5,85,PST-K15-167,Pure Seed Testing Inc.,WAM,6,6,85,2020,Jun,WAM-2020-06-17,32,4,3,"Adelphia, NJ"
85,Turf Quality,7/15/20,5,85,PST-K15-167,Pure Seed Testing Inc.,WAM,6,6,85,2020,Jul,WAM-2020-07-15,33,3,3,"Adelphia, NJ"
85,Turf Quality,8/6/20,6,85,PST-K15-167,Pure Seed Testing Inc.,PLV,6,6,85,2020,Aug,PLV-2020-08-06,5,2,3,"Adelphia, NJ"
85,Turf Quality,9/2/20,5,85,PST-K15-167,Pure Seed Testing Inc.,DAS,6,6,85,2020,Sep,DAS-2020-09-02,1,9,3,"Adelphia, NJ"
85,Turf Quality,10/15/20,3,85,PST-K15-167,Pure Seed Testing Inc.,WAM,6,6,85,2020,Oct,WAM-2020-10-15,34,8,3,"Adelphia, NJ"
85,Turf Quality,11/5/20,3,85,PST-K15-167,Pure Seed Testing Inc.,WAM,6,6,85,2020,Nov,WAM-2020-11-05,35,7,3,"Adelphia, NJ"
85,Turf Quality,10/15/20,4,85,PST-K15-167,Pure Seed Testing Inc.,RMD,6,6,85,2020,Oct,RMD-2020-10-15,10,8,3,"Adelphia, NJ"
85,Turf Quality,10/23/20,4,85,PST-K15-167,Pure Seed Testing Inc.,RMD,6,6,85,2020,Oct,RMD-2020-10-23,11,8,3,"Adelphia, NJ"
85,Turf Quality,3/30/21,3,85,PST-K15-167,Pure Seed Testing Inc.,RMD,6,6,85,2021,Mar,RMD-2021-03-30,12,5,4,"Adelphia, NJ"
85,Turf Quality,4/22/21,5,85,PST-K15-167,Pure Seed Testing Inc.,PLV,6,6,85,2021,Apr,PLV-2021-04-22,6,1,4,"Adelphia, NJ"
85,Turf Quality,5/28/21,4,85,PST-K15-167,Pure Seed Testing Inc.,SAB,6,6,85,2021,May,SAB-2021-05-28,29,6,4,"Adelphia, NJ"
85,Turf Quality,6/11/21,3,85,PST-K15-167,Pure Seed Testing Inc.,JEN,6,6,85,2021,Jun,JEN-2021-06-11,2,4,4,"Adelphia, NJ"
85,Turf Quality,7/13/21,3,85,PST-K15-167,Pure Seed Testing Inc.,PLV,6,6,85,2021,Jul,PLV-2021-07-13,7,3,4,"Adelphia, NJ"
85,Turf Quality,8/11/21,4,85,PST-K15-167,Pure Seed Testing Inc.,JEN,6,6,85,2021,Aug,JEN-2021-08-11,3,2,4,"Adelphia, NJ"
85,Turf Quality,9/17/21,4,85,PST-K15-167,Pure Seed Testing Inc.,JEN,6,6,85,2021,Sep,JEN-2021-09-17,4,9,4,"Adelphia, NJ"
85,Turf Quality,10/13/21,3,85,PST-K15-167,Pure Seed Testing Inc.,SAB,6,6,85,2021,Oct,SAB-2021-10-13,30,8,4,"Adelphia, NJ"
85,Turf Quality,11/18/21,5,85,PST-K15-167,Pure Seed Testing Inc.,WAM,6,6,85,2021,Nov,WAM-2021-11-18,36,7,4,"Adelphia, NJ"
66,Turf Quality,4/18/18,4,66,A12-34,Mountain View Seeds,RMD,5,6,66,2018,Apr,RMD-2018-04-18,8,1,1,"Adelphia, NJ"
66,Turf Quality,5/10/18,6,66,A12-34,Mountain View Seeds,RON,5,6,66,2018,May,RON-2018-05-10,13,6,1,"Adelphia, NJ"
66,Turf Quality,6/7/18,6,66,A12-34,Mountain View Seeds,RON,5,6,66,2018,Jun,RON-2018-06-07,14,4,1,"Adelphia, NJ"
66,Turf Quality,7/17/18,6,66,A12-34,Mountain View Seeds,RON,5,6,66,2018,Jul,RON-2018-07-17,15,3,1,"Adelphia, NJ"
66,Turf Quality,8/15/18,5,66,A12-34,Mountain View Seeds,RMD,5,6,66,2018,Aug,RMD-2018-08-15,9,2,1,"Adelphia, NJ"
66,Turf Quality,9/12/18,4,66,A12-34,Mountain View Seeds,RON,5,6,66,2018,Sep,RON-2018-09-12,16,9,1,"Adelphia, NJ"
66,Turf Quality,10/2/18,5,66,A12-34,Mountain View Seeds,RON,5,6,66,2018,Oct,RON-2018-10-02,17,8,1,"Adelphia, NJ"
66,Turf Quality,11/9/18,4,66,A12-34,Mountain View Seeds,RON,5,6,66,2018,Nov,RON-2018-11-09,18,7,1,"Adelphia, NJ"
66,Turf Quality,4/17/19,3,66,A12-34,Mountain View Seeds,RON,5,6,66,2019,Apr,RON-2019-04-17,19,1,2,"Adelphia, NJ"
66,Turf Quality,5/2/19,3,66,A12-34,Mountain View Seeds,RON,5,6,66,2019,May,RON-2019-05-02,20,6,2,"Adelphia, NJ"
66,Turf Quality,6/13/19,5,66,A12-34,Mountain View Seeds,RON,5,6,66,2019,Jun,RON-2019-06-13,21,4,2,"Adelphia, NJ"
66,Turf Quality,6/17/19,3,66,A12-34,Mountain View Seeds,SAB,5,6,66,2019,Jun,SAB-2019-06-17,25,4,2,"Adelphia, NJ"
66,Turf Quality,7/17/19,5,66,A12-34,Mountain View Seeds,RON,5,6,66,2019,Jul,RON-2019-07-17,22,3,2,"Adelphia, NJ"
66,Turf Quality,8/22/19,6,66,A12-34,Mountain View Seeds,SAB,5,6,66,2019,Aug,SAB-2019-08-22,26,2,2,"Adelphia, NJ"
66,Turf Quality,9/16/19,7,66,A12-34,Mountain View Seeds,RON,5,6,66,2019,Sep,RON-2019-09-16,23,9,2,"Adelphia, NJ"
66,Turf Quality,10/10/19,4,66,A12-34,Mountain View Seeds,SAB,5,6,66,2019,Oct,SAB-2019-10-10,27,8,2,"Adelphia, NJ"
66,Turf Quality,11/1/19,5,66,A12-34,Mountain View Seeds,RON,5,6,66,2019,Nov,RON-2019-11-01,24,7,2,"Adelphia, NJ"
66,Turf Quality,4/28/20,5,66,A12-34,Mountain View Seeds,WAM,5,6,66,2020,Apr,WAM-2020-04-28,31,1,3,"Adelphia, NJ"
66,Turf Quality,5/18/20,5,66,A12-34,Mountain View Seeds,SAB,5,6,66,2020,May,SAB-2020-05-18,28,6,3,"Adelphia, NJ"
66,Turf Quality,6/17/20,5,66,A12-34,Mountain View Seeds,WAM,5,6,66,2020,Jun,WAM-2020-06-17,32,4,3,"Adelphia, NJ"
66,Turf Quality,7/15/20,6,66,A12-34,Mountain View Seeds,WAM,5,6,66,2020,Jul,WAM-2020-07-15,33,3,3,"Adelphia, NJ"
66,Turf Quality,8/6/20,8,66,A12-34,Mountain View Seeds,PLV,5,6,66,2020,Aug,PLV-2020-08-06,5,2,3,"Adelphia, NJ"
66,Turf Quality,9/2/20,7,66,A12-34,Mountain View Seeds,DAS,5,6,66,2020,Sep,DAS-2020-09-02,1,9,3,"Adelphia, NJ"
66,Turf Quality,10/15/20,6,66,A12-34,Mountain View Seeds,WAM,5,6,66,2020,Oct,WAM-2020-10-15,34,8,3,"Adelphia, NJ"
66,Turf Quality,11/5/20,5,66,A12-34,Mountain View Seeds,WAM,5,6,66,2020,Nov,WAM-2020-11-05,35,7,3,"Adelphia, NJ"
66,Turf Quality,10/15/20,8,66,A12-34,Mountain View Seeds,RMD,5,6,66,2020,Oct,RMD-2020-10-15,10,8,3,"Adelphia, NJ"
66,Turf Quality,10/23/20,6,66,A12-34,Mountain View Seeds,RMD,5,6,66,2020,Oct,RMD-2020-10-23,11,8,3,"Adelphia, NJ"
66,Turf Quality,3/30/21,6,66,A12-34,Mountain View Seeds,RMD,5,6,66,2021,Mar,RMD-2021-03-30,12,5,4,"Adelphia, NJ"
66,Turf Quality,4/22/21,6,66,A12-34,Mountain View Seeds,PLV,5,6,66,2021,Apr,PLV-2021-04-22,6,1,4,"Adelphia, NJ"
66,Turf Quality,5/28/21,4,66,A12-34,Mountain View Seeds,SAB,5,6,66,2021,May,SAB-2021-05-28,29,6,4,"Adelphia, NJ"
66,Turf Quality,6/11/21,6,66,A12-34,Mountain View Seeds,JEN,5,6,66,2021,Jun,JEN-2021-06-11,2,4,4,"Adelphia, NJ"
66,Turf Quality,7/13/21,8,66,A12-34,Mountain View Seeds,PLV,5,6,66,2021,Jul,PLV-2021-07-13,7,3,4,"Adelphia, NJ"
66,Turf Quality,8/11/21,6,66,A12-34,Mountain View Seeds,JEN,5,6,66,2021,Aug,JEN-2021-08-11,3,2,4,"Adelphia, NJ"
66,Turf Quality,9/17/21,5,66,A12-34,Mountain View Seeds,JEN,5,6,66,2021,Sep,JEN-2021-09-17,4,9,4,"Adelphia, NJ"
66,Turf Quality,10/13/21,4,66,A12-34,Mountain View Seeds,SAB,5,6,66,2021,Oct,SAB-2021-10-13,30,8,4,"Adelphia, NJ"
66,Turf Quality,11/18/21,3,66,A12-34,Mountain View Seeds,WAM,5,6,66,2021,Nov,WAM-2021-11-18,36,7,4,"Adelphia, NJ"
55,Turf Quality,4/18/18,5,55,DLFPS-340/3438,DLF Pickseed USA,RMD,4,6,55,2018,Apr,RMD-2018-04-18,8,1,1,"Adelphia, NJ"
55,Turf Quality,5/10/18,6,55,DLFPS-340/3438,DLF Pickseed USA,RON,4,6,55,2018,May,RON-2018-05-10,13,6,1,"Adelphia, NJ"
55,Turf Quality,6/7/18,5,55,DLFPS-340/3438,DLF Pickseed USA,RON,4,6,55,2018,Jun,RON-2018-06-07,14,4,1,"Adelphia, NJ"
55,Turf Quality,7/17/18,6,55,DLFPS-340/3438,DLF Pickseed USA,RON,4,6,55,2018,Jul,RON-2018-07-17,15,3,1,"Adelphia, NJ"
55,Turf Quality,8/15/18,6,55,DLFPS-340/3438,DLF Pickseed USA,RMD,4,6,55,2018,Aug,RMD-2018-08-15,9,2,1,"Adelphia, NJ"
55,Turf Quality,9/12/18,4,55,DLFPS-340/3438,DLF Pickseed USA,RON,4,6,55,2018,Sep,RON-2018-09-12,16,9,1,"Adelphia, NJ"
55,Turf Quality,10/2/18,4,55,DLFPS-340/3438,DLF Pickseed USA,RON,4,6,55,2018,Oct,RON-2018-10-02,17,8,1,"Adelphia, NJ"
55,Turf Quality,11/9/18,4,55,DLFPS-340/3438,DLF Pickseed USA,RON,4,6,55,2018,Nov,RON-2018-11-09,18,7,1,"Adelphia, NJ"
55,Turf Quality,4/17/19,4,55,DLFPS-340/3438,DLF Pickseed USA,RON,4,6,55,2019,Apr,RON-2019-04-17,19,1,2,"Adelphia, NJ"
55,Turf Quality,5/2/19,5,55,DLFPS-340/3438,DLF Pickseed USA,RON,4,6,55,2019,May,RON-2019-05-02,20,6,2,"Adelphia, NJ"
55,Turf Quality,6/13/19,7,55,DLFPS-340/3438,DLF Pickseed USA,RON,4,6,55,2019,Jun,RON-2019-06-13,21,4,2,"Adelphia, NJ"
55,Turf Quality,6/17/19,6,55,DLFPS-340/3438,DLF Pickseed USA,SAB,4,6,55,2019,Jun,SAB-2019-06-17,25,4,2,"Adelphia, NJ"
55,Turf Quality,7/17/19,8,55,DLFPS-340/3438,DLF Pickseed USA,RON,4,6,55,2019,Jul,RON-2019-07-17,22,3,2,"Adelphia, NJ"
55,Turf Quality,8/22/19,5,55,DLFPS-340/3438,DLF Pickseed USA,SAB,4,6,55,2019,Aug,SAB-2019-08-22,26,2,2,"Adelphia, NJ"
55,Turf Quality,9/16/19,7,55,DLFPS-340/3438,DLF Pickseed USA,RON,4,6,55,2019,Sep,RON-2019-09-16,23,9,2,"Adelphia, NJ"
55,Turf Quality,10/10/19,4,55,DLFPS-340/3438,DLF Pickseed USA,SAB,4,6,55,2019,Oct,SAB-2019-10-10,27,8,2,"Adelphia, NJ"
55,Turf Quality,11/1/19,6,55,DLFPS-340/3438,DLF Pickseed USA,RON,4,6,55,2019,Nov,RON-2019-11-01,24,7,2,"Adelphia, NJ"
55,Turf Quality,4/28/20,6,55,DLFPS-340/3438,DLF Pickseed USA,WAM,4,6,55,2020,Apr,WAM-2020-04-28,31,1,3,"Adelphia, NJ"
55,Turf Quality,5/18/20,6,55,DLFPS-340/3438,DLF Pickseed USA,SAB,4,6,55,2020,May,SAB-2020-05-18,28,6,3,"Adelphia, NJ"
55,Turf Quality,6/17/20,4,55,DLFPS-340/3438,DLF Pickseed USA,WAM,4,6,55,2020,Jun,WAM-2020-06-17,32,4,3,"Adelphia, NJ"
55,Turf Quality,7/15/20,7,55,DLFPS-340/3438,DLF Pickseed USA,WAM,4,6,55,2020,Jul,WAM-2020-07-15,33,3,3,"Adelphia, NJ"
55,Turf Quality,8/6/20,7,55,DLFPS-340/3438,DLF Pickseed USA,PLV,4,6,55,2020,Aug,PLV-2020-08-06,5,2,3,"Adelphia, NJ"
55,Turf Quality,9/2/20,5,55,DLFPS-340/3438,DLF Pickseed USA,DAS,4,6,55,2020,Sep,DAS-2020-09-02,1,9,3,"Adelphia, NJ"
55,Turf Quality,10/15/20,5,55,DLFPS-340/3438,DLF Pickseed USA,WAM,4,6,55,2020,Oct,WAM-2020-10-15,34,8,3,"Adelphia, NJ"
55,Turf Quality,11/5/20,6,55,DLFPS-340/3438,DLF Pickseed USA,WAM,4,6,55,2020,Nov,WAM-2020-11-05,35,7,3,"Adelphia, NJ"
55,Turf Quality,10/15/20,7,55,DLFPS-340/3438,DLF Pickseed USA,RMD,4,6,55,2020,Oct,RMD-2020-10-15,10,8,3,"Adelphia, NJ"
55,Turf Quality,10/23/20,6,55,DLFPS-340/3438,DLF Pickseed USA,RMD,4,6,55,2020,Oct,RMD-2020-10-23,11,8,3,"Adelphia, NJ"
55,Turf Quality,3/30/21,5,55,DLFPS-340/3438,DLF Pickseed USA,RMD,4,6,55,2021,Mar,RMD-2021-03-30,12,5,4,"Adelphia, NJ"
55,Turf Quality,4/22/21,8,55,DLFPS-340/3438,DLF Pickseed USA,PLV,4,6,55,2021,Apr,PLV-2021-04-22,6,1,4,"Adelphia, NJ"
55,Turf Quality,5/28/21,5,55,DLFPS-340/3438,DLF Pickseed USA,SAB,4,6,55,2021,May,SAB-2021-05-28,29,6,4,"Adelphia, NJ"
55,Turf Quality,6/11/21,4,55,DLFPS-340/3438,DLF Pickseed USA,JEN,4,6,55,2021,Jun,JEN-2021-06-11,2,4,4,"Adelphia, NJ"
55,Turf Quality,7/13/21,5,55,DLFPS-340/3438,DLF Pickseed USA,PLV,4,6,55,2021,Jul,PLV-2021-07-13,7,3,4,"Adelphia, NJ"
55,Turf Quality,8/11/21,5,55,DLFPS-340/3438,DLF Pickseed USA,JEN,4,6,55,2021,Aug,JEN-2021-08-11,3,2,4,"Adelphia, NJ"
55,Turf Quality,9/17/21,4,55,DLFPS-340/3438,DLF Pickseed USA,JEN,4,6,55,2021,Sep,JEN-2021-09-17,4,9,4,"Adelphia, NJ"
55,Turf Quality,10/13/21,4,55,DLFPS-340/3438,DLF Pickseed USA,SAB,4,6,55,2021,Oct,SAB-2021-10-13,30,8,4,"Adelphia, NJ"
55,Turf Quality,11/18/21,5,55,DLFPS-340/3438,DLF Pickseed USA,WAM,4,6,55,2021,Nov,WAM-2021-11-18,36,7,4,"Adelphia, NJ"
36,Turf Quality,4/18/18,3,36,NAI-14-128,Columbia River Seed,RMD,3,6,36,2018,Apr,RMD-2018-04-18,8,1,1,"Adelphia, NJ"
36,Turf Quality,5/10/18,4,36,NAI-14-128,Columbia River Seed,RON,3,6,36,2018,May,RON-2018-05-10,13,6,1,"Adelphia, NJ"
36,Turf Quality,6/7/18,6,36,NAI-14-128,Columbia River Seed,RON,3,6,36,2018,Jun,RON-2018-06-07,14,4,1,"Adelphia, NJ"
36,Turf Quality,7/17/18,5,36,NAI-14-128,Columbia River Seed,RON,3,6,36,2018,Jul,RON-2018-07-17,15,3,1,"Adelphia, NJ"
36,Turf Quality,8/15/18,5,36,NAI-14-128,Columbia River Seed,RMD,3,6,36,2018,Aug,RMD-2018-08-15,9,2,1,"Adelphia, NJ"
36,Turf Quality,9/12/18,3,36,NAI-14-128,Columbia River Seed,RON,3,6,36,2018,Sep,RON-2018-09-12,16,9,1,"Adelphia, NJ"
36,Turf Quality,10/2/18,3,36,NAI-14-128,Columbia River Seed,RON,3,6,36,2018,Oct,RON-2018-10-02,17,8,1,"Adelphia, NJ"
36,Turf Quality,11/9/18,3,36,NAI-14-128,Columbia River Seed,RON,3,6,36,2018,Nov,RON-2018-11-09,18,7,1,"Adelphia, NJ"
36,Turf Quality,4/17/19,3,36,NAI-14-128,Columbia River Seed,RON,3,6,36,2019,Apr,RON-2019-04-17,19,1,2,"Adelphia, NJ"
36,Turf Quality,5/2/19,3,36,NAI-14-128,Columbia River Seed,RON,3,6,36,2019,May,RON-2019-05-02,20,6,2,"Adelphia, NJ"
36,Turf Quality,6/13/19,4,36,NAI-14-128,Columbia River Seed,RON,3,6,36,2019,Jun,RON-2019-06-13,21,4,2,"Adelphia, NJ"
36,Turf Quality,6/17/19,4,36,NAI-14-128,Columbia River Seed,SAB,3,6,36,2019,Jun,SAB-2019-06-17,25,4,2,"Adelphia, NJ"
36,Turf Quality,7/17/19,5,36,NAI-14-128,Columbia River Seed,RON,3,6,36,2019,Jul,RON-2019-07-17,22,3,2,"Adelphia, NJ"
36,Turf Quality,8/22/19,4,36,NAI-14-128,Columbia River Seed,SAB,3,6,36,2019,Aug,SAB-2019-08-22,26,2,2,"Adelphia, NJ"
36,Turf Quality,9/16/19,4,36,NAI-14-128,Columbia River Seed,RON,3,6,36,2019,Sep,RON-2019-09-16,23,9,2,"Adelphia, NJ"
36,Turf Quality,10/10/19,3,36,NAI-14-128,Columbia River Seed,SAB,3,6,36,2019,Oct,SAB-2019-10-10,27,8,2,"Adelphia, NJ"
36,Turf Quality,11/1/19,4,36,NAI-14-128,Columbia River Seed,RON,3,6,36,2019,Nov,RON-2019-11-01,24,7,2,"Adelphia, NJ"
36,Turf Quality,4/28/20,5,36,NAI-14-128,Columbia River Seed,WAM,3,6,36,2020,Apr,WAM-2020-04-28,31,1,3,"Adelphia, NJ"
36,Turf Quality,5/18/20,5,36,NAI-14-128,Columbia River Seed,SAB,3,6,36,2020,May,SAB-2020-05-18,28,6,3,"Adelphia, NJ"
36,Turf Quality,6/17/20,4,36,NAI-14-128,Columbia River Seed,WAM,3,6,36,2020,Jun,WAM-2020-06-17,32,4,3,"Adelphia, NJ"
36,Turf Quality,7/15/20,5,36,NAI-14-128,Columbia River Seed,WAM,3,6,36,2020,Jul,WAM-2020-07-15,33,3,3,"Adelphia, NJ"
36,Turf Quality,8/6/20,4,36,NAI-14-128,Columbia River Seed,PLV,3,6,36,2020,Aug,PLV-2020-08-06,5,2,3,"Adelphia, NJ"
36,Turf Quality,9/2/20,4,36,NAI-14-128,Columbia River Seed,DAS,3,6,36,2020,Sep,DAS-2020-09-02,1,9,3,"Adelphia, NJ"
36,Turf Quality,10/15/20,4,36,NAI-14-128,Columbia River Seed,WAM,3,6,36,2020,Oct,WAM-2020-10-15,34,8,3,"Adelphia, NJ"
36,Turf Quality,11/5/20,6,36,NAI-14-128,Columbia River Seed,WAM,3,6,36,2020,Nov,WAM-2020-11-05,35,7,3,"Adelphia, NJ"
36,Turf Quality,10/15/20,6,36,NAI-14-128,Columbia River Seed,RMD,3,6,36,2020,Oct,RMD-2020-10-15,10,8,3,"Adelphia, NJ"
36,Turf Quality,10/23/20,6,36,NAI-14-128,Columbia River Seed,RMD,3,6,36,2020,Oct,RMD-2020-10-23,11,8,3,"Adelphia, NJ"
36,Turf Quality,3/30/21,3,36,NAI-14-128,Columbia River Seed,RMD,3,6,36,2021,Mar,RMD-2021-03-30,12,5,4,"Adelphia, NJ"
36,Turf Quality,4/22/21,6,36,NAI-14-128,Columbia River Seed,PLV,3,6,36,2021,Apr,PLV-2021-04-22,6,1,4,"Adelphia, NJ"
36,Turf Quality,5/28/21,5,36,NAI-14-128,Columbia River Seed,SAB,3,6,36,2021,May,SAB-2021-05-28,29,6,4,"Adelphia, NJ"
36,Turf Quality,6/11/21,4,36,NAI-14-128,Columbia River Seed,JEN,3,6,36,2021,Jun,JEN-2021-06-11,2,4,4,"Adelphia, NJ"
36,Turf Quality,7/13/21,5,36,NAI-14-128,Columbia River Seed,PLV,3,6,36,2021,Jul,PLV-2021-07-13,7,3,4,"Adelphia, NJ"
36,Turf Quality,8/11/21,4,36,NAI-14-128,Columbia River Seed,JEN,3,6,36,2021,Aug,JEN-2021-08-11,3,2,4,"Adelphia, NJ"
36,Turf Quality,9/17/21,2,36,NAI-14-128,Columbia River Seed,JEN,3,6,36,2021,Sep,JEN-2021-09-17,4,9,4,"Adelphia, NJ"
36,Turf Quality,10/13/21,3,36,NAI-14-128,Columbia River Seed,SAB,3,6,36,2021,Oct,SAB-2021-10-13,30,8,4,"Adelphia, NJ"
36,Turf Quality,11/18/21,4,36,NAI-14-128,Columbia River Seed,WAM,3,6,36,2021,Nov,WAM-2021-11-18,36,7,4,"Adelphia, NJ"
25,Turf Quality,4/18/18,5,25,BAR PP 7236V,Barenbrug Research,RMD,2,6,25,2018,Apr,RMD-2018-04-18,8,1,1,"Adelphia, NJ"
25,Turf Quality,5/10/18,5,25,BAR PP 7236V,Barenbrug Research,RON,2,6,25,2018,May,RON-2018-05-10,13,6,1,"Adelphia, NJ"
25,Turf Quality,6/7/18,4,25,BAR PP 7236V,Barenbrug Research,RON,2,6,25,2018,Jun,RON-2018-06-07,14,4,1,"Adelphia, NJ"
25,Turf Quality,7/17/18,5,25,BAR PP 7236V,Barenbrug Research,RON,2,6,25,2018,Jul,RON-2018-07-17,15,3,1,"Adelphia, NJ"
25,Turf Quality,8/15/18,7,25,BAR PP 7236V,Barenbrug Research,RMD,2,6,25,2018,Aug,RMD-2018-08-15,9,2,1,"Adelphia, NJ"
25,Turf Quality,9/12/18,7,25,BAR PP 7236V,Barenbrug Research,RON,2,6,25,2018,Sep,RON-2018-09-12,16,9,1,"Adelphia, NJ"
25,Turf Quality,10/2/18,6,25,BAR PP 7236V,Barenbrug Research,RON,2,6,25,2018,Oct,RON-2018-10-02,17,8,1,"Adelphia, NJ"
25,Turf Quality,11/9/18,7,25,BAR PP 7236V,Barenbrug Research,RON,2,6,25,2018,Nov,RON-2018-11-09,18,7,1,"Adelphia, NJ"
25,Turf Quality,4/17/19,8,25,BAR PP 7236V,Barenbrug Research,RON,2,6,25,2019,Apr,RON-2019-04-17,19,1,2,"Adelphia, NJ"
25,Turf Quality,5/2/19,6,25,BAR PP 7236V,Barenbrug Research,RON,2,6,25,2019,May,RON-2019-05-02,20,6,2,"Adelphia, NJ"
25,Turf Quality,6/13/19,6,25,BAR PP 7236V,Barenbrug Research,RON,2,6,25,2019,Jun,RON-2019-06-13,21,4,2,"Adelphia, NJ"
25,Turf Quality,6/17/19,4,25,BAR PP 7236V,Barenbrug Research,SAB,2,6,25,2019,Jun,SAB-2019-06-17,25,4,2,"Adelphia, NJ"
25,Turf Quality,7/17/19,4,25,BAR PP 7236V,Barenbrug Research,RON,2,6,25,2019,Jul,RON-2019-07-17,22,3,2,"Adelphia, NJ"
25,Turf Quality,8/22/19,6,25,BAR PP 7236V,Barenbrug Research,SAB,2,6,25,2019,Aug,SAB-2019-08-22,26,2,2,"Adelphia, NJ"
25,Turf Quality,9/16/19,6,25,BAR PP 7236V,Barenbrug Research,RON,2,6,25,2019,Sep,RON-2019-09-16,23,9,2,"Adelphia, NJ"
25,Turf Quality,10/10/19,5,25,BAR PP 7236V,Barenbrug Research,SAB,2,6,25,2019,Oct,SAB-2019-10-10,27,8,2,"Adelphia, NJ"
25,Turf Quality,11/1/19,8,25,BAR PP 7236V,Barenbrug Research,RON,2,6,25,2019,Nov,RON-2019-11-01,24,7,2,"Adelphia, NJ"
25,Turf Quality,4/28/20,7,25,BAR PP 7236V,Barenbrug Research,WAM,2,6,25,2020,Apr,WAM-2020-04-28,31,1,3,"Adelphia, NJ"
25,Turf Quality,5/18/20,7,25,BAR PP 7236V,Barenbrug Research,SAB,2,6,25,2020,May,SAB-2020-05-18,28,6,3,"Adelphia, NJ"
25,Turf Quality,6/17/20,3,25,BAR PP 7236V,Barenbrug Research,WAM,2,6,25,2020,Jun,WAM-2020-06-17,32,4,3,"Adelphia, NJ"
25,Turf Quality,7/15/20,6,25,BAR PP 7236V,Barenbrug Research,WAM,2,6,25,2020,Jul,WAM-2020-07-15,33,3,3,"Adelphia, NJ"
25,Turf Quality,8/6/20,6,25,BAR PP 7236V,Barenbrug Research,PLV,2,6,25,2020,Aug,PLV-2020-08-06,5,2,3,"Adelphia, NJ"
25,Turf Quality,9/2/20,6,25,BAR PP 7236V,Barenbrug Research,DAS,2,6,25,2020,Sep,DAS-2020-09-02,1,9,3,"Adelphia, NJ"
25,Turf Quality,10/15/20,6,25,BAR PP 7236V,Barenbrug Research,WAM,2,6,25,2020,Oct,WAM-2020-10-15,34,8,3,"Adelphia, NJ"
25,Turf Quality,11/5/20,7,25,BAR PP 7236V,Barenbrug Research,WAM,2,6,25,2020,Nov,WAM-2020-11-05,35,7,3,"Adelphia, NJ"
25,Turf Quality,10/15/20,6,25,BAR PP 7236V,Barenbrug Research,RMD,2,6,25,2020,Oct,RMD-2020-10-15,10,8,3,"Adelphia, NJ"
25,Turf Quality,10/23/20,6,25,BAR PP 7236V,Barenbrug Research,RMD,2,6,25,2020,Oct,RMD-2020-10-23,11,8,3,"Adelphia, NJ"
25,Turf Quality,3/30/21,6,25,BAR PP 7236V,Barenbrug Research,RMD,2,6,25,2021,Mar,RMD-2021-03-30,12,5,4,"Adelphia, NJ"
25,Turf Quality,4/22/21,7,25,BAR PP 7236V,Barenbrug Research,PLV,2,6,25,2021,Apr,PLV-2021-04-22,6,1,4,"Adelphia, NJ"
25,Turf Quality,5/28/21,5,25,BAR PP 7236V,Barenbrug Research,SAB,2,6,25,2021,May,SAB-2021-05-28,29,6,4,"Adelphia, NJ"
25,Turf Quality,6/11/21,4,25,BAR PP 7236V,Barenbrug Research,JEN,2,6,25,2021,Jun,JEN-2021-06-11,2,4,4,"Adelphia, NJ"
25,Turf Quality,7/13/21,6,25,BAR PP 7236V,Barenbrug Research,PLV,2,6,25,2021,Jul,PLV-2021-07-13,7,3,4,"Adelphia, NJ"
25,Turf Quality,8/11/21,6,25,BAR PP 7236V,Barenbrug Research,JEN,2,6,25,2021,Aug,JEN-2021-08-11,3,2,4,"Adelphia, NJ"
25,Turf Quality,9/17/21,6,25,BAR PP 7236V,Barenbrug Research,JEN,2,6,25,2021,Sep,JEN-2021-09-17,4,9,4,"Adelphia, NJ"
25,Turf Quality,10/13/21,7,25,BAR PP 7236V,Barenbrug Research,SAB,2,6,25,2021,Oct,SAB-2021-10-13,30,8,4,"Adelphia, NJ"
25,Turf Quality,11/18/21,7,25,BAR PP 7236V,Barenbrug Research,WAM,2,6,25,2021,Nov,WAM-2021-11-18,36,7,4,"Adelphia, NJ"
6,Turf Quality,4/18/18,4,6,RAD 553,Seeds Inc.,RMD,1,6,6,2018,Apr,RMD-2018-04-18,8,1,1,"Adelphia, NJ"
6,Turf Quality,5/10/18,6,6,RAD 553,Seeds Inc.,RON,1,6,6,2018,May,RON-2018-05-10,13,6,1,"Adelphia, NJ"
6,Turf Quality,6/7/18,4,6,RAD 553,Seeds Inc.,RON,1,6,6,2018,Jun,RON-2018-06-07,14,4,1,"Adelphia, NJ"
6,Turf Quality,7/17/18,5,6,RAD 553,Seeds Inc.,RON,1,6,6,2018,Jul,RON-2018-07-17,15,3,1,"Adelphia, NJ"
6,Turf Quality,8/15/18,6,6,RAD 553,Seeds Inc.,RMD,1,6,6,2018,Aug,RMD-2018-08-15,9,2,1,"Adelphia, NJ"
6,Turf Quality,9/12/18,5,6,RAD 553,Seeds Inc.,RON,1,6,6,2018,Sep,RON-2018-09-12,16,9,1,"Adelphia, NJ"
6,Turf Quality,10/2/18,5,6,RAD 553,Seeds Inc.,RON,1,6,6,2018,Oct,RON-2018-10-02,17,8,1,"Adelphia, NJ"
6,Turf Quality,11/9/18,3,6,RAD 553,Seeds Inc.,RON,1,6,6,2018,Nov,RON-2018-11-09,18,7,1,"Adelphia, NJ"
6,Turf Quality,4/17/19,4,6,RAD 553,Seeds Inc.,RON,1,6,6,2019,Apr,RON-2019-04-17,19,1,2,"Adelphia, NJ"
6,Turf Quality,5/2/19,4,6,RAD 553,Seeds Inc.,RON,1,6,6,2019,May,RON-2019-05-02,20,6,2,"Adelphia, NJ"
6,Turf Quality,6/13/19,5,6,RAD 553,Seeds Inc.,RON,1,6,6,2019,Jun,RON-2019-06-13,21,4,2,"Adelphia, NJ"
6,Turf Quality,6/17/19,4,6,RAD 553,Seeds Inc.,SAB,1,6,6,2019,Jun,SAB-2019-06-17,25,4,2,"Adelphia, NJ"
6,Turf Quality,7/17/19,3,6,RAD 553,Seeds Inc.,RON,1,6,6,2019,Jul,RON-2019-07-17,22,3,2,"Adelphia, NJ"
6,Turf Quality,8/22/19,4,6,RAD 553,Seeds Inc.,SAB,1,6,6,2019,Aug,SAB-2019-08-22,26,2,2,"Adelphia, NJ"
6,Turf Quality,9/16/19,4,6,RAD 553,Seeds Inc.,RON,1,6,6,2019,Sep,RON-2019-09-16,23,9,2,"Adelphia, NJ"
6,Turf Quality,10/10/19,4,6,RAD 553,Seeds Inc.,SAB,1,6,6,2019,Oct,SAB-2019-10-10,27,8,2,"Adelphia, NJ"
6,Turf Quality,11/1/19,3,6,RAD 553,Seeds Inc.,RON,1,6,6,2019,Nov,RON-2019-11-01,24,7,2,"Adelphia, NJ"
6,Turf Quality,4/28/20,3,6,RAD 553,Seeds Inc.,WAM,1,6,6,2020,Apr,WAM-2020-04-28,31,1,3,"Adelphia, NJ"
6,Turf Quality,5/18/20,4,6,RAD 553,Seeds Inc.,SAB,1,6,6,2020,May,SAB-2020-05-18,28,6,3,"Adelphia, NJ"
6,Turf Quality,6/17/20,3,6,RAD 553,Seeds Inc.,WAM,1,6,6,2020,Jun,WAM-2020-06-17,32,4,3,"Adelphia, NJ"
6,Turf Quality,7/15/20,3,6,RAD 553,Seeds Inc.,WAM,1,6,6,2020,Jul,WAM-2020-07-15,33,3,3,"Adelphia, NJ"
6,Turf Quality,8/6/20,5,6,RAD 553,Seeds Inc.,PLV,1,6,6,2020,Aug,PLV-2020-08-06,5,2,3,"Adelphia, NJ"
6,Turf Quality,9/2/20,5,6,RAD 553,Seeds Inc.,DAS,1,6,6,2020,Sep,DAS-2020-09-02,1,9,3,"Adelphia, NJ"
6,Turf Quality,10/15/20,4,6,RAD 553,Seeds Inc.,WAM,1,6,6,2020,Oct,WAM-2020-10-15,34,8,3,"Adelphia, NJ"
6,Turf Quality,11/5/20,5,6,RAD 553,Seeds Inc.,WAM,1,6,6,2020,Nov,WAM-2020-11-05,35,7,3,"Adelphia, NJ"
6,Turf Quality,10/15/20,5,6,RAD 553,Seeds Inc.,RMD,1,6,6,2020,Oct,RMD-2020-10-15,10,8,3,"Adelphia, NJ"
6,Turf Quality,10/23/20,5,6,RAD 553,Seeds Inc.,RMD,1,6,6,2020,Oct,RMD-2020-10-23,11,8,3,"Adelphia, NJ"
6,Turf Quality,3/30/21,2,6,RAD 553,Seeds Inc.,RMD,1,6,6,2021,Mar,RMD-2021-03-30,12,5,4,"Adelphia, NJ"
6,Turf Quality,4/22/21,6,6,RAD 553,Seeds Inc.,PLV,1,6,6,2021,Apr,PLV-2021-04-22,6,1,4,"Adelphia, NJ"
6,Turf Quality,5/28/21,5,6,RAD 553,Seeds Inc.,SAB,1,6,6,2021,May,SAB-2021-05-28,29,6,4,"Adelphia, NJ"
6,Turf Quality,6/11/21,4,6,RAD 553,Seeds Inc.,JEN,1,6,6,2021,Jun,JEN-2021-06-11,2,4,4,"Adelphia, NJ"
6,Turf Quality,7/13/21,4,6,RAD 553,Seeds Inc.,PLV,1,6,6,2021,Jul,PLV-2021-07-13,7,3,4,"Adelphia, NJ"
6,Turf Quality,8/11/21,4,6,RAD 553,Seeds Inc.,JEN,1,6,6,2021,Aug,JEN-2021-08-11,3,2,4,"Adelphia, NJ"
6,Turf Quality,9/17/21,4,6,RAD 553,Seeds Inc.,JEN,1,6,6,2021,Sep,JEN-2021-09-17,4,9,4,"Adelphia, NJ"
6,Turf Quality,10/13/21,4,6,RAD 553,Seeds Inc.,SAB,1,6,6,2021,Oct,SAB-2021-10-13,30,8,4,"Adelphia, NJ"
6,Turf Quality,11/18/21,3,6,RAD 553,Seeds Inc.,WAM,1,6,6,2021,Nov,WAM-2021-11-18,36,7,4,"Adelphia, NJ"
264,Turf Quality,4/18/18,4,82,Electric (PST-K11-118),Pure Seed Testing Inc.,RMD,18,7,262,2018,Apr,RMD-2018-04-18,8,1,1,"Adelphia, NJ"
264,Turf Quality,5/10/18,6,82,Electric (PST-K11-118),Pure Seed Testing Inc.,RON,18,7,262,2018,May,RON-2018-05-10,13,6,1,"Adelphia, NJ"
264,Turf Quality,6/7/18,4,82,Electric (PST-K11-118),Pure Seed Testing Inc.,RON,18,7,262,2018,Jun,RON-2018-06-07,14,4,1,"Adelphia, NJ"
264,Turf Quality,7/17/18,6,82,Electric (PST-K11-118),Pure Seed Testing Inc.,RON,18,7,262,2018,Jul,RON-2018-07-17,15,3,1,"Adelphia, NJ"
264,Turf Quality,8/15/18,7,82,Electric (PST-K11-118),Pure Seed Testing Inc.,RMD,18,7,262,2018,Aug,RMD-2018-08-15,9,2,1,"Adelphia, NJ"
264,Turf Quality,9/12/18,6,82,Electric (PST-K11-118),Pure Seed Testing Inc.,RON,18,7,262,2018,Sep,RON-2018-09-12,16,9,1,"Adelphia, NJ"
264,Turf Quality,10/2/18,7,82,Electric (PST-K11-118),Pure Seed Testing Inc.,RON,18,7,262,2018,Oct,RON-2018-10-02,17,8,1,"Adelphia, NJ"
264,Turf Quality,11/9/18,6,82,Electric (PST-K11-118),Pure Seed Testing Inc.,RON,18,7,262,2018,Nov,RON-2018-11-09,18,7,1,"Adelphia, NJ"
264,Turf Quality,4/17/19,7,82,Electric (PST-K11-118),Pure Seed Testing Inc.,RON,18,7,262,2019,Apr,RON-2019-04-17,19,1,2,"Adelphia, NJ"
264,Turf Quality,5/2/19,6,82,Electric (PST-K11-118),Pure Seed Testing Inc.,RON,18,7,262,2019,May,RON-2019-05-02,20,6,2,"Adelphia, NJ"
264,Turf Quality,6/13/19,5,82,Electric (PST-K11-118),Pure Seed Testing Inc.,RON,18,7,262,2019,Jun,RON-2019-06-13,21,4,2,"Adelphia, NJ"
264,Turf Quality,6/17/19,6,82,Electric (PST-K11-118),Pure Seed Testing Inc.,SAB,18,7,262,2019,Jun,SAB-2019-06-17,25,4,2,"Adelphia, NJ"
264,Turf Quality,7/17/19,7,82,Electric (PST-K11-118),Pure Seed Testing Inc.,RON,18,7,262,2019,Jul,RON-2019-07-17,22,3,2,"Adelphia, NJ"
264,Turf Quality,8/22/19,4,82,Electric (PST-K11-118),Pure Seed Testing Inc.,SAB,18,7,262,2019,Aug,SAB-2019-08-22,26,2,2,"Adelphia, NJ"
264,Turf Quality,9/16/19,4,82,Electric (PST-K11-118),Pure Seed Testing Inc.,RON,18,7,262,2019,Sep,RON-2019-09-16,23,9,2,"Adelphia, NJ"
264,Turf Quality,10/10/19,4,82,Electric (PST-K11-118),Pure Seed Testing Inc.,SAB,18,7,262,2019,Oct,SAB-2019-10-10,27,8,2,"Adelphia, NJ"
264,Turf Quality,11/1/19,4,82,Electric (PST-K11-118),Pure Seed Testing Inc.,RON,18,7,262,2019,Nov,RON-2019-11-01,24,7,2,"Adelphia, NJ"
264,Turf Quality,4/28/20,5,82,Electric (PST-K11-118),Pure Seed Testing Inc.,WAM,18,7,262,2020,Apr,WAM-2020-04-28,31,1,3,"Adelphia, NJ"
264,Turf Quality,5/18/20,6,82,Electric (PST-K11-118),Pure Seed Testing Inc.,SAB,18,7,262,2020,May,SAB-2020-05-18,28,6,3,"Adelphia, NJ"
264,Turf Quality,6/17/20,5,82,Electric (PST-K11-118),Pure Seed Testing Inc.,WAM,18,7,262,2020,Jun,WAM-2020-06-17,32,4,3,"Adelphia, NJ"
264,Turf Quality,7/15/20,5,82,Electric (PST-K11-118),Pure Seed Testing Inc.,WAM,18,7,262,2020,Jul,WAM-2020-07-15,33,3,3,"Adelphia, NJ"
264,Turf Quality,8/6/20,8,82,Electric (PST-K11-118),Pure Seed Testing Inc.,PLV,18,7,262,2020,Aug,PLV-2020-08-06,5,2,3,"Adelphia, NJ"
264,Turf Quality,9/2/20,5,82,Electric (PST-K11-118),Pure Seed Testing Inc.,DAS,18,7,262,2020,Sep,DAS-2020-09-02,1,9,3,"Adelphia, NJ"
264,Turf Quality,10/15/20,4,82,Electric (PST-K11-118),Pure Seed Testing Inc.,WAM,18,7,262,2020,Oct,WAM-2020-10-15,34,8,3,"Adelphia, NJ"
264,Turf Quality,11/5/20,3,82,Electric (PST-K11-118),Pure Seed Testing Inc.,WAM,18,7,262,2020,Nov,WAM-2020-11-05,35,7,3,"Adelphia, NJ"
264,Turf Quality,10/15/20,5,82,Electric (PST-K11-118),Pure Seed Testing Inc.,RMD,18,7,262,2020,Oct,RMD-2020-10-15,10,8,3,"Adelphia, NJ"
264,Turf Quality,10/23/20,3,82,Electric (PST-K11-118),Pure Seed Testing Inc.,RMD,18,7,262,2020,Oct,RMD-2020-10-23,11,8,3,"Adelphia, NJ"
264,Turf Quality,3/30/21,5,82,Electric (PST-K11-118),Pure Seed Testing Inc.,RMD,18,7,262,2021,Mar,RMD-2021-03-30,12,5,4,"Adelphia, NJ"
264,Turf Quality,4/22/21,6,82,Electric (PST-K11-118),Pure Seed Testing Inc.,PLV,18,7,262,2021,Apr,PLV-2021-04-22,6,1,4,"Adelphia, NJ"
264,Turf Quality,5/28/21,5,82,Electric (PST-K11-118),Pure Seed Testing Inc.,SAB,18,7,262,2021,May,SAB-2021-05-28,29,6,4,"Adelphia, NJ"
264,Turf Quality,6/11/21,5,82,Electric (PST-K11-118),Pure Seed Testing Inc.,JEN,18,7,262,2021,Jun,JEN-2021-06-11,2,4,4,"Adelphia, NJ"
264,Turf Quality,7/13/21,6,82,Electric (PST-K11-118),Pure Seed Testing Inc.,PLV,18,7,262,2021,Jul,PLV-2021-07-13,7,3,4,"Adelphia, NJ"
264,Turf Quality,8/11/21,6,82,Electric (PST-K11-118),Pure Seed Testing Inc.,JEN,18,7,262,2021,Aug,JEN-2021-08-11,3,2,4,"Adelphia, NJ"
264,Turf Quality,9/17/21,3,82,Electric (PST-K11-118),Pure Seed Testing Inc.,JEN,18,7,262,2021,Sep,JEN-2021-09-17,4,9,4,"Adelphia, NJ"
264,Turf Quality,10/13/21,1,82,Electric (PST-K11-118),Pure Seed Testing Inc.,SAB,18,7,262,2021,Oct,SAB-2021-10-13,30,8,4,"Adelphia, NJ"
264,Turf Quality,11/18/21,3,82,Electric (PST-K11-118),Pure Seed Testing Inc.,WAM,18,7,262,2021,Nov,WAM-2021-11-18,36,7,4,"Adelphia, NJ"
247,Turf Quality,4/18/18,3,86,New Moon (PST-K15-177),Pure Seed Testing Inc.,RMD,17,7,245,2018,Apr,RMD-2018-04-18,8,1,1,"Adelphia, NJ"
247,Turf Quality,5/10/18,4,86,New Moon (PST-K15-177),Pure Seed Testing Inc.,RON,17,7,245,2018,May,RON-2018-05-10,13,6,1,"Adelphia, NJ"
247,Turf Quality,6/7/18,4,86,New Moon (PST-K15-177),Pure Seed Testing Inc.,RON,17,7,245,2018,Jun,RON-2018-06-07,14,4,1,"Adelphia, NJ"
247,Turf Quality,7/17/18,5,86,New Moon (PST-K15-177),Pure Seed Testing Inc.,RON,17,7,245,2018,Jul,RON-2018-07-17,15,3,1,"Adelphia, NJ"
247,Turf Quality,8/15/18,7,86,New Moon (PST-K15-177),Pure Seed Testing Inc.,RMD,17,7,245,2018,Aug,RMD-2018-08-15,9,2,1,"Adelphia, NJ"
247,Turf Quality,9/12/18,5,86,New Moon (PST-K15-177),Pure Seed Testing Inc.,RON,17,7,245,2018,Sep,RON-2018-09-12,16,9,1,"Adelphia, NJ"
247,Turf Quality,10/2/18,7,86,New Moon (PST-K15-177),Pure Seed Testing Inc.,RON,17,7,245,2018,Oct,RON-2018-10-02,17,8,1,"Adelphia, NJ"
247,Turf Quality,11/9/18,4,86,New Moon (PST-K15-177),Pure Seed Testing Inc.,RON,17,7,245,2018,Nov,RON-2018-11-09,18,7,1,"Adelphia, NJ"
247,Turf Quality,4/17/19,5,86,New Moon (PST-K15-177),Pure Seed Testing Inc.,RON,17,7,245,2019,Apr,RON-2019-04-17,19,1,2,"Adelphia, NJ"
247,Turf Quality,5/2/19,5,86,New Moon (PST-K15-177),Pure Seed Testing Inc.,RON,17,7,245,2019,May,RON-2019-05-02,20,6,2,"Adelphia, NJ"
247,Turf Quality,6/13/19,6,86,New Moon (PST-K15-177),Pure Seed Testing Inc.,RON,17,7,245,2019,Jun,RON-2019-06-13,21,4,2,"Adelphia, NJ"
247,Turf Quality,6/17/19,5,86,New Moon (PST-K15-177),Pure Seed Testing Inc.,SAB,17,7,245,2019,Jun,SAB-2019-06-17,25,4,2,"Adelphia, NJ"
247,Turf Quality,7/17/19,5,86,New Moon (PST-K15-177),Pure Seed Testing Inc.,RON,17,7,245,2019,Jul,RON-2019-07-17,22,3,2,"Adelphia, NJ"
247,Turf Quality,8/22/19,4,86,New Moon (PST-K15-177),Pure Seed Testing Inc.,SAB,17,7,245,2019,Aug,SAB-2019-08-22,26,2,2,"Adelphia, NJ"
247,Turf Quality,9/16/19,3,86,New Moon (PST-K15-177),Pure Seed Testing Inc.,RON,17,7,245,2019,Sep,RON-2019-09-16,23,9,2,"Adelphia, NJ"
247,Turf Quality,10/10/19,3,86,New Moon (PST-K15-177),Pure Seed Testing Inc.,SAB,17,7,245,2019,Oct,SAB-2019-10-10,27,8,2,"Adelphia, NJ"
247,Turf Quality,11/1/19,4,86,New Moon (PST-K15-177),Pure Seed Testing Inc.,RON,17,7,245,2019,Nov,RON-2019-11-01,24,7,2,"Adelphia, NJ"
247,Turf Quality,4/28/20,3,86,New Moon (PST-K15-177),Pure Seed Testing Inc.,WAM,17,7,245,2020,Apr,WAM-2020-04-28,31,1,3,"Adelphia, NJ"
247,Turf Quality,5/18/20,4,86,New Moon (PST-K15-177),Pure Seed Testing Inc.,SAB,17,7,245,2020,May,SAB-2020-05-18,28,6,3,"Adelphia, NJ"
247,Turf Quality,6/17/20,3,86,New Moon (PST-K15-177),Pure Seed Testing Inc.,WAM,17,7,245,2020,Jun,WAM-2020-06-17,32,4,3,"Adelphia, NJ"
247,Turf Quality,7/15/20,2,86,New Moon (PST-K15-177),Pure Seed Testing Inc.,WAM,17,7,245,2020,Jul,WAM-2020-07-15,33,3,3,"Adelphia, NJ"
247,Turf Quality,8/6/20,3,86,New Moon (PST-K15-177),Pure Seed Testing Inc.,PLV,17,7,245,2020,Aug,PLV-2020-08-06,5,2,3,"Adelphia, NJ"
247,Turf Quality,9/2/20,4,86,New Moon (PST-K15-177),Pure Seed Testing Inc.,DAS,17,7,245,2020,Sep,DAS-2020-09-02,1,9,3,"Adelphia, NJ"
247,Turf Quality,10/15/20,1,86,New Moon (PST-K15-177),Pure Seed Testing Inc.,WAM,17,7,245,2020,Oct,WAM-2020-10-15,34,8,3,"Adelphia, NJ"
247,Turf Quality,11/5/20,4,86,New Moon (PST-K15-177),Pure Seed Testing Inc.,WAM,17,7,245,2020,Nov,WAM-2020-11-05,35,7,3,"Adelphia, NJ"
247,Turf Quality,10/15/20,2,86,New Moon (PST-K15-177),Pure Seed Testing Inc.,RMD,17,7,245,2020,Oct,RMD-2020-10-15,10,8,3,"Adelphia, NJ"
247,Turf Quality,10/23/20,3,86,New Moon (PST-K15-177),Pure Seed Testing Inc.,RMD,17,7,245,2020,Oct,RMD-2020-10-23,11,8,3,"Adelphia, NJ"
247,Turf Quality,3/30/21,3,86,New Moon (PST-K15-177),Pure Seed Testing Inc.,RMD,17,7,245,2021,Mar,RMD-2021-03-30,12,5,4,"Adelphia, NJ"
247,Turf Quality,4/22/21,3,86,New Moon (PST-K15-177),Pure Seed Testing Inc.,PLV,17,7,245,2021,Apr,PLV-2021-04-22,6,1,4,"Adelphia, NJ"
247,Turf Quality,5/28/21,1,86,New Moon (PST-K15-177),Pure Seed Testing Inc.,SAB,17,7,245,2021,May,SAB-2021-05-28,29,6,4,"Adelphia, NJ"
247,Turf Quality,6/11/21,2,86,New Moon (PST-K15-177),Pure Seed Testing Inc.,JEN,17,7,245,2021,Jun,JEN-2021-06-11,2,4,4,"Adelphia, NJ"
247,Turf Quality,7/13/21,4,86,New Moon (PST-K15-177),Pure Seed Testing Inc.,PLV,17,7,245,2021,Jul,PLV-2021-07-13,7,3,4,"Adelphia, NJ"
247,Turf Quality,8/11/21,4,86,New Moon (PST-K15-177),Pure Seed Testing Inc.,JEN,17,7,245,2021,Aug,JEN-2021-08-11,3,2,4,"Adelphia, NJ"
247,Turf Quality,9/17/21,3,86,New Moon (PST-K15-177),Pure Seed Testing Inc.,JEN,17,7,245,2021,Sep,JEN-2021-09-17,4,9,4,"Adelphia, NJ"
247,Turf Quality,10/13/21,4,86,New Moon (PST-K15-177),Pure Seed Testing Inc.,SAB,17,7,245,2021,Oct,SAB-2021-10-13,30,8,4,"Adelphia, NJ"
247,Turf Quality,11/18/21,7,86,New Moon (PST-K15-177),Pure Seed Testing Inc.,WAM,17,7,245,2021,Nov,WAM-2021-11-18,36,7,4,"Adelphia, NJ"
234,Turf Quality,4/18/18,5,30,Twilight (NAI-13-132),SiteOne Landscape Supply,RMD,16,7,232,2018,Apr,RMD-2018-04-18,8,1,1,"Adelphia, NJ"
234,Turf Quality,5/10/18,5,30,Twilight (NAI-13-132),SiteOne Landscape Supply,RON,16,7,232,2018,May,RON-2018-05-10,13,6,1,"Adelphia, NJ"
234,Turf Quality,6/7/18,6,30,Twilight (NAI-13-132),SiteOne Landscape Supply,RON,16,7,232,2018,Jun,RON-2018-06-07,14,4,1,"Adelphia, NJ"
234,Turf Quality,7/17/18,6,30,Twilight (NAI-13-132),SiteOne Landscape Supply,RON,16,7,232,2018,Jul,RON-2018-07-17,15,3,1,"Adelphia, NJ"
234,Turf Quality,8/15/18,8,30,Twilight (NAI-13-132),SiteOne Landscape Supply,RMD,16,7,232,2018,Aug,RMD-2018-08-15,9,2,1,"Adelphia, NJ"
234,Turf Quality,9/12/18,7,30,Twilight (NAI-13-132),SiteOne Landscape Supply,RON,16,7,232,2018,Sep,RON-2018-09-12,16,9,1,"Adelphia, NJ"
234,Turf Quality,10/2/18,5,30,Twilight (NAI-13-132),SiteOne Landscape Supply,RON,16,7,232,2018,Oct,RON-2018-10-02,17,8,1,"Adelphia, NJ"
234,Turf Quality,11/9/18,5,30,Twilight (NAI-13-132),SiteOne Landscape Supply,RON,16,7,232,2018,Nov,RON-2018-11-09,18,7,1,"Adelphia, NJ"
234,Turf Quality,4/17/19,4,30,Twilight (NAI-13-132),SiteOne Landscape Supply,RON,16,7,232,2019,Apr,RON-2019-04-17,19,1,2,"Adelphia, NJ"
234,Turf Quality,5/2/19,5,30,Twilight (NAI-13-132),SiteOne Landscape Supply,RON,16,7,232,2019,May,RON-2019-05-02,20,6,2,"Adelphia, NJ"
234,Turf Quality,6/13/19,7,30,Twilight (NAI-13-132),SiteOne Landscape Supply,RON,16,7,232,2019,Jun,RON-2019-06-13,21,4,2,"Adelphia, NJ"
234,Turf Quality,6/17/19,6,30,Twilight (NAI-13-132),SiteOne Landscape Supply,SAB,16,7,232,2019,Jun,SAB-2019-06-17,25,4,2,"Adelphia, NJ"
234,Turf Quality,7/17/19,5,30,Twilight (NAI-13-132),SiteOne Landscape Supply,RON,16,7,232,2019,Jul,RON-2019-07-17,22,3,2,"Adelphia, NJ"
234,Turf Quality,8/22/19,6,30,Twilight (NAI-13-132),SiteOne Landscape Supply,SAB,16,7,232,2019,Aug,SAB-2019-08-22,26,2,2,"Adelphia, NJ"
234,Turf Quality,9/16/19,6,30,Twilight (NAI-13-132),SiteOne Landscape Supply,RON,16,7,232,2019,Sep,RON-2019-09-16,23,9,2,"Adelphia, NJ"
234,Turf Quality,10/10/19,6,30,Twilight (NAI-13-132),SiteOne Landscape Supply,SAB,16,7,232,2019,Oct,SAB-2019-10-10,27,8,2,"Adelphia, NJ"
234,Turf Quality,11/1/19,6,30,Twilight (NAI-13-132),SiteOne Landscape Supply,RON,16,7,232,2019,Nov,RON-2019-11-01,24,7,2,"Adelphia, NJ"
234,Turf Quality,4/28/20,5,30,Twilight (NAI-13-132),SiteOne Landscape Supply,WAM,16,7,232,2020,Apr,WAM-2020-04-28,31,1,3,"Adelphia, NJ"
234,Turf Quality,5/18/20,4,30,Twilight (NAI-13-132),SiteOne Landscape Supply,SAB,16,7,232,2020,May,SAB-2020-05-18,28,6,3,"Adelphia, NJ"
234,Turf Quality,6/17/20,5,30,Twilight (NAI-13-132),SiteOne Landscape Supply,WAM,16,7,232,2020,Jun,WAM-2020-06-17,32,4,3,"Adelphia, NJ"
234,Turf Quality,7/15/20,7,30,Twilight (NAI-13-132),SiteOne Landscape Supply,WAM,16,7,232,2020,Jul,WAM-2020-07-15,33,3,3,"Adelphia, NJ"
234,Turf Quality,8/6/20,9,30,Twilight (NAI-13-132),SiteOne Landscape Supply,PLV,16,7,232,2020,Aug,PLV-2020-08-06,5,2,3,"Adelphia, NJ"
234,Turf Quality,9/2/20,5,30,Twilight (NAI-13-132),SiteOne Landscape Supply,DAS,16,7,232,2020,Sep,DAS-2020-09-02,1,9,3,"Adelphia, NJ"
234,Turf Quality,10/15/20,4,30,Twilight (NAI-13-132),SiteOne Landscape Supply,WAM,16,7,232,2020,Oct,WAM-2020-10-15,34,8,3,"Adelphia, NJ"
234,Turf Quality,11/5/20,4,30,Twilight (NAI-13-132),SiteOne Landscape Supply,WAM,16,7,232,2020,Nov,WAM-2020-11-05,35,7,3,"Adelphia, NJ"
234,Turf Quality,10/15/20,4,30,Twilight (NAI-13-132),SiteOne Landscape Supply,RMD,16,7,232,2020,Oct,RMD-2020-10-15,10,8,3,"Adelphia, NJ"
234,Turf Quality,10/23/20,5,30,Twilight (NAI-13-132),SiteOne Landscape Supply,RMD,16,7,232,2020,Oct,RMD-2020-10-23,11,8,3,"Adelphia, NJ"
234,Turf Quality,3/30/21,4,30,Twilight (NAI-13-132),SiteOne Landscape Supply,RMD,16,7,232,2021,Mar,RMD-2021-03-30,12,5,4,"Adelphia, NJ"
234,Turf Quality,4/22/21,5,30,Twilight (NAI-13-132),SiteOne Landscape Supply,PLV,16,7,232,2021,Apr,PLV-2021-04-22,6,1,4,"Adelphia, NJ"
234,Turf Quality,5/28/21,6,30,Twilight (NAI-13-132),SiteOne Landscape Supply,SAB,16,7,232,2021,May,SAB-2021-05-28,29,6,4,"Adelphia, NJ"
234,Turf Quality,6/11/21,6,30,Twilight (NAI-13-132),SiteOne Landscape Supply,JEN,16,7,232,2021,Jun,JEN-2021-06-11,2,4,4,"Adelphia, NJ"
234,Turf Quality,7/13/21,7,30,Twilight (NAI-13-132),SiteOne Landscape Supply,PLV,16,7,232,2021,Jul,PLV-2021-07-13,7,3,4,"Adelphia, NJ"
234,Turf Quality,8/11/21,5,30,Twilight (NAI-13-132),SiteOne Landscape Supply,JEN,16,7,232,2021,Aug,JEN-2021-08-11,3,2,4,"Adelphia, NJ"
234,Turf Quality,9/17/21,4,30,Twilight (NAI-13-132),SiteOne Landscape Supply,JEN,16,7,232,2021,Sep,JEN-2021-09-17,4,9,4,"Adelphia, NJ"
234,Turf Quality,10/13/21,4,30,Twilight (NAI-13-132),SiteOne Landscape Supply,SAB,16,7,232,2021,Oct,SAB-2021-10-13,30,8,4,"Adelphia, NJ"
234,Turf Quality,11/18/21,5,30,Twilight (NAI-13-132),SiteOne Landscape Supply,WAM,16,7,232,2021,Nov,WAM-2021-11-18,36,7,4,"Adelphia, NJ"
217,Turf Quality,4/18/18,4,11,AKB3241,Pennington Seed,RMD,15,7,215,2018,Apr,RMD-2018-04-18,8,1,1,"Adelphia, NJ"
217,Turf Quality,5/10/18,5,11,AKB3241,Pennington Seed,RON,15,7,215,2018,May,RON-2018-05-10,13,6,1,"Adelphia, NJ"
217,Turf Quality,6/7/18,4,11,AKB3241,Pennington Seed,RON,15,7,215,2018,Jun,RON-2018-06-07,14,4,1,"Adelphia, NJ"
217,Turf Quality,7/17/18,4,11,AKB3241,Pennington Seed,RON,15,7,215,2018,Jul,RON-2018-07-17,15,3,1,"Adelphia, NJ"
217,Turf Quality,8/15/18,8,11,AKB3241,Pennington Seed,RMD,15,7,215,2018,Aug,RMD-2018-08-15,9,2,1,"Adelphia, NJ"
217,Turf Quality,9/12/18,6,11,AKB3241,Pennington Seed,RON,15,7,215,2018,Sep,RON-2018-09-12,16,9,1,"Adelphia, NJ"
217,Turf Quality,10/2/18,6,11,AKB3241,Pennington Seed,RON,15,7,215,2018,Oct,RON-2018-10-02,17,8,1,"Adelphia, NJ"
217,Turf Quality,11/9/18,4,11,AKB3241,Pennington Seed,RON,15,7,215,2018,Nov,RON-2018-11-09,18,7,1,"Adelphia, NJ"
217,Turf Quality,4/17/19,6,11,AKB3241,Pennington Seed,RON,15,7,215,2019,Apr,RON-2019-04-17,19,1,2,"Adelphia, NJ"
217,Turf Quality,5/2/19,5,11,AKB3241,Pennington Seed,RON,15,7,215,2019,May,RON-2019-05-02,20,6,2,"Adelphia, NJ"
217,Turf Quality,6/13/19,5,11,AKB3241,Pennington Seed,RON,15,7,215,2019,Jun,RON-2019-06-13,21,4,2,"Adelphia, NJ"
217,Turf Quality,6/17/19,4,11,AKB3241,Pennington Seed,SAB,15,7,215,2019,Jun,SAB-2019-06-17,25,4,2,"Adelphia, NJ"
217,Turf Quality,7/17/19,5,11,AKB3241,Pennington Seed,RON,15,7,215,2019,Jul,RON-2019-07-17,22,3,2,"Adelphia, NJ"
217,Turf Quality,8/22/19,6,11,AKB3241,Pennington Seed,SAB,15,7,215,2019,Aug,SAB-2019-08-22,26,2,2,"Adelphia, NJ"
217,Turf Quality,9/16/19,8,11,AKB3241,Pennington Seed,RON,15,7,215,2019,Sep,RON-2019-09-16,23,9,2,"Adelphia, NJ"
217,Turf Quality,10/10/19,4,11,AKB3241,Pennington Seed,SAB,15,7,215,2019,Oct,SAB-2019-10-10,27,8,2,"Adelphia, NJ"
217,Turf Quality,11/1/19,4,11,AKB3241,Pennington Seed,RON,15,7,215,2019,Nov,RON-2019-11-01,24,7,2,"Adelphia, NJ"
217,Turf Quality,4/28/20,5,11,AKB3241,Pennington Seed,WAM,15,7,215,2020,Apr,WAM-2020-04-28,31,1,3,"Adelphia, NJ"
217,Turf Quality,5/18/20,6,11,AKB3241,Pennington Seed,SAB,15,7,215,2020,May,SAB-2020-05-18,28,6,3,"Adelphia, NJ"
217,Turf Quality,6/17/20,4,11,AKB3241,Pennington Seed,WAM,15,7,215,2020,Jun,WAM-2020-06-17,32,4,3,"Adelphia, NJ"
217,Turf Quality,7/15/20,4,11,AKB3241,Pennington Seed,WAM,15,7,215,2020,Jul,WAM-2020-07-15,33,3,3,"Adelphia, NJ"
217,Turf Quality,8/6/20,8,11,AKB3241,Pennington Seed,PLV,15,7,215,2020,Aug,PLV-2020-08-06,5,2,3,"Adelphia, NJ"
217,Turf Quality,9/2/20,5,11,AKB3241,Pennington Seed,DAS,15,7,215,2020,Sep,DAS-2020-09-02,1,9,3,"Adelphia, NJ"
217,Turf Quality,10/15/20,4,11,AKB3241,Pennington Seed,WAM,15,7,215,2020,Oct,WAM-2020-10-15,34,8,3,"Adelphia, NJ"
217,Turf Quality,11/5/20,4,11,AKB3241,Pennington Seed,WAM,15,7,215,2020,Nov,WAM-2020-11-05,35,7,3,"Adelphia, NJ"
217,Turf Quality,10/15/20,4,11,AKB3241,Pennington Seed,RMD,15,7,215,2020,Oct,RMD-2020-10-15,10,8,3,"Adelphia, NJ"
217,Turf Quality,10/23/20,4,11,AKB3241,Pennington Seed,RMD,15,7,215,2020,Oct,RMD-2020-10-23,11,8,3,"Adelphia, NJ"
217,Turf Quality,3/30/21,4,11,AKB3241,Pennington Seed,RMD,15,7,215,2021,Mar,RMD-2021-03-30,12,5,4,"Adelphia, NJ"
217,Turf Quality,4/22/21,4,11,AKB3241,Pennington Seed,PLV,15,7,215,2021,Apr,PLV-2021-04-22,6,1,4,"Adelphia, NJ"
217,Turf Quality,5/28/21,3,11,AKB3241,Pennington Seed,SAB,15,7,215,2021,May,SAB-2021-05-28,29,6,4,"Adelphia, NJ"
217,Turf Quality,6/11/21,5,11,AKB3241,Pennington Seed,JEN,15,7,215,2021,Jun,JEN-2021-06-11,2,4,4,"Adelphia, NJ"
217,Turf Quality,7/13/21,5,11,AKB3241,Pennington Seed,PLV,15,7,215,2021,Jul,PLV-2021-07-13,7,3,4,"Adelphia, NJ"
217,Turf Quality,8/11/21,5,11,AKB3241,Pennington Seed,JEN,15,7,215,2021,Aug,JEN-2021-08-11,3,2,4,"Adelphia, NJ"
217,Turf Quality,9/17/21,4,11,AKB3241,Pennington Seed,JEN,15,7,215,2021,Sep,JEN-2021-09-17,4,9,4,"Adelphia, NJ"
217,Turf Quality,10/13/21,4,11,AKB3241,Pennington Seed,SAB,15,7,215,2021,Oct,SAB-2021-10-13,30,8,4,"Adelphia, NJ"
217,Turf Quality,11/18/21,5,11,AKB3241,Pennington Seed,WAM,15,7,215,2021,Nov,WAM-2021-11-18,36,7,4,"Adelphia, NJ"
204,Turf Quality,4/18/18,5,15,After Midnight,Jacklin Seed by Simplot,RMD,14,7,202,2018,Apr,RMD-2018-04-18,8,1,1,"Adelphia, NJ"
204,Turf Quality,5/10/18,5,15,After Midnight,Jacklin Seed by Simplot,RON,14,7,202,2018,May,RON-2018-05-10,13,6,1,"Adelphia, NJ"
204,Turf Quality,6/7/18,6,15,After Midnight,Jacklin Seed by Simplot,RON,14,7,202,2018,Jun,RON-2018-06-07,14,4,1,"Adelphia, NJ"
204,Turf Quality,7/17/18,6,15,After Midnight,Jacklin Seed by Simplot,RON,14,7,202,2018,Jul,RON-2018-07-17,15,3,1,"Adelphia, NJ"
204,Turf Quality,8/15/18,7,15,After Midnight,Jacklin Seed by Simplot,RMD,14,7,202,2018,Aug,RMD-2018-08-15,9,2,1,"Adelphia, NJ"
204,Turf Quality,9/12/18,7,15,After Midnight,Jacklin Seed by Simplot,RON,14,7,202,2018,Sep,RON-2018-09-12,16,9,1,"Adelphia, NJ"
204,Turf Quality,10/2/18,6,15,After Midnight,Jacklin Seed by Simplot,RON,14,7,202,2018,Oct,RON-2018-10-02,17,8,1,"Adelphia, NJ"
204,Turf Quality,11/9/18,7,15,After Midnight,Jacklin Seed by Simplot,RON,14,7,202,2018,Nov,RON-2018-11-09,18,7,1,"Adelphia, NJ"
204,Turf Quality,4/17/19,5,15,After Midnight,Jacklin Seed by Simplot,RON,14,7,202,2019,Apr,RON-2019-04-17,19,1,2,"Adelphia, NJ"
204,Turf Quality,5/2/19,7,15,After Midnight,Jacklin Seed by Simplot,RON,14,7,202,2019,May,RON-2019-05-02,20,6,2,"Adelphia, NJ"
204,Turf Quality,6/13/19,8,15,After Midnight,Jacklin Seed by Simplot,RON,14,7,202,2019,Jun,RON-2019-06-13,21,4,2,"Adelphia, NJ"
204,Turf Quality,6/17/19,8,15,After Midnight,Jacklin Seed by Simplot,SAB,14,7,202,2019,Jun,SAB-2019-06-17,25,4,2,"Adelphia, NJ"
204,Turf Quality,7/17/19,7,15,After Midnight,Jacklin Seed by Simplot,RON,14,7,202,2019,Jul,RON-2019-07-17,22,3,2,"Adelphia, NJ"
204,Turf Quality,8/22/19,6,15,After Midnight,Jacklin Seed by Simplot,SAB,14,7,202,2019,Aug,SAB-2019-08-22,26,2,2,"Adelphia, NJ"
204,Turf Quality,9/16/19,6,15,After Midnight,Jacklin Seed by Simplot,RON,14,7,202,2019,Sep,RON-2019-09-16,23,9,2,"Adelphia, NJ"
204,Turf Quality,10/10/19,6,15,After Midnight,Jacklin Seed by Simplot,SAB,14,7,202,2019,Oct,SAB-2019-10-10,27,8,2,"Adelphia, NJ"
204,Turf Quality,11/1/19,6,15,After Midnight,Jacklin Seed by Simplot,RON,14,7,202,2019,Nov,RON-2019-11-01,24,7,2,"Adelphia, NJ"
204,Turf Quality,4/28/20,6,15,After Midnight,Jacklin Seed by Simplot,WAM,14,7,202,2020,Apr,WAM-2020-04-28,31,1,3,"Adelphia, NJ"
204,Turf Quality,5/18/20,6,15,After Midnight,Jacklin Seed by Simplot,SAB,14,7,202,2020,May,SAB-2020-05-18,28,6,3,"Adelphia, NJ"
204,Turf Quality,6/17/20,8,15,After Midnight,Jacklin Seed by Simplot,WAM,14,7,202,2020,Jun,WAM-2020-06-17,32,4,3,"Adelphia, NJ"
204,Turf Quality,7/15/20,6,15,After Midnight,Jacklin Seed by Simplot,WAM,14,7,202,2020,Jul,WAM-2020-07-15,33,3,3,"Adelphia, NJ"
204,Turf Quality,8/6/20,7,15,After Midnight,Jacklin Seed by Simplot,PLV,14,7,202,2020,Aug,PLV-2020-08-06,5,2,3,"Adelphia, NJ"
204,Turf Quality,9/2/20,5,15,After Midnight,Jacklin Seed by Simplot,DAS,14,7,202,2020,Sep,DAS-2020-09-02,1,9,3,"Adelphia, NJ"
204,Turf Quality,10/15/20,3,15,After Midnight,Jacklin Seed by Simplot,WAM,14,7,202,2020,Oct,WAM-2020-10-15,34,8,3,"Adelphia, NJ"
204,Turf Quality,11/5/20,3,15,After Midnight,Jacklin Seed by Simplot,WAM,14,7,202,2020,Nov,WAM-2020-11-05,35,7,3,"Adelphia, NJ"
204,Turf Quality,10/15/20,5,15,After Midnight,Jacklin Seed by Simplot,RMD,14,7,202,2020,Oct,RMD-2020-10-15,10,8,3,"Adelphia, NJ"
204,Turf Quality,10/23/20,4,15,After Midnight,Jacklin Seed by Simplot,RMD,14,7,202,2020,Oct,RMD-2020-10-23,11,8,3,"Adelphia, NJ"
204,Turf Quality,3/30/21,4,15,After Midnight,Jacklin Seed by Simplot,RMD,14,7,202,2021,Mar,RMD-2021-03-30,12,5,4,"Adelphia, NJ"
204,Turf Quality,4/22/21,6,15,After Midnight,Jacklin Seed by Simplot,PLV,14,7,202,2021,Apr,PLV-2021-04-22,6,1,4,"Adelphia, NJ"
204,Turf Quality,5/28/21,5,15,After Midnight,Jacklin Seed by Simplot,SAB,14,7,202,2021,May,SAB-2021-05-28,29,6,4,"Adelphia, NJ"
204,Turf Quality,6/11/21,5,15,After Midnight,Jacklin Seed by Simplot,JEN,14,7,202,2021,Jun,JEN-2021-06-11,2,4,4,"Adelphia, NJ"
204,Turf Quality,7/13/21,5,15,After Midnight,Jacklin Seed by Simplot,PLV,14,7,202,2021,Jul,PLV-2021-07-13,7,3,4,"Adelphia, NJ"
204,Turf Quality,8/11/21,4,15,After Midnight,Jacklin Seed by Simplot,JEN,14,7,202,2021,Aug,JEN-2021-08-11,3,2,4,"Adelphia, NJ"
204,Turf Quality,9/17/21,4,15,After Midnight,Jacklin Seed by Simplot,JEN,14,7,202,2021,Sep,JEN-2021-09-17,4,9,4,"Adelphia, NJ"
204,Turf Quality,10/13/21,4,15,After Midnight,Jacklin Seed by Simplot,SAB,14,7,202,2021,Oct,SAB-2021-10-13,30,8,4,"Adelphia, NJ"
204,Turf Quality,11/18/21,4,15,After Midnight,Jacklin Seed by Simplot,WAM,14,7,202,2021,Nov,WAM-2021-11-18,36,7,4,"Adelphia, NJ"
187,Turf Quality,4/18/18,5,83,Dublin (PST-K15-157),Pure Seed Testing Inc.,RMD,13,7,185,2018,Apr,RMD-2018-04-18,8,1,1,"Adelphia, NJ"
187,Turf Quality,5/10/18,6,83,Dublin (PST-K15-157),Pure Seed Testing Inc.,RON,13,7,185,2018,May,RON-2018-05-10,13,6,1,"Adelphia, NJ"
187,Turf Quality,6/7/18,6,83,Dublin (PST-K15-157),Pure Seed Testing Inc.,RON,13,7,185,2018,Jun,RON-2018-06-07,14,4,1,"Adelphia, NJ"
187,Turf Quality,7/17/18,7,83,Dublin (PST-K15-157),Pure Seed Testing Inc.,RON,13,7,185,2018,Jul,RON-2018-07-17,15,3,1,"Adelphia, NJ"
187,Turf Quality,8/15/18,8,83,Dublin (PST-K15-157),Pure Seed Testing Inc.,RMD,13,7,185,2018,Aug,RMD-2018-08-15,9,2,1,"Adelphia, NJ"
187,Turf Quality,9/12/18,5,83,Dublin (PST-K15-157),Pure Seed Testing Inc.,RON,13,7,185,2018,Sep,RON-2018-09-12,16,9,1,"Adelphia, NJ"
187,Turf Quality,10/2/18,4,83,Dublin (PST-K15-157),Pure Seed Testing Inc.,RON,13,7,185,2018,Oct,RON-2018-10-02,17,8,1,"Adelphia, NJ"
187,Turf Quality,11/9/18,4,83,Dublin (PST-K15-157),Pure Seed Testing Inc.,RON,13,7,185,2018,Nov,RON-2018-11-09,18,7,1,"Adelphia, NJ"
187,Turf Quality,4/17/19,5,83,Dublin (PST-K15-157),Pure Seed Testing Inc.,RON,13,7,185,2019,Apr,RON-2019-04-17,19,1,2,"Adelphia, NJ"
187,Turf Quality,5/2/19,4,83,Dublin (PST-K15-157),Pure Seed Testing Inc.,RON,13,7,185,2019,May,RON-2019-05-02,20,6,2,"Adelphia, NJ"
187,Turf Quality,6/13/19,4,83,Dublin (PST-K15-157),Pure Seed Testing Inc.,RON,13,7,185,2019,Jun,RON-2019-06-13,21,4,2,"Adelphia, NJ"
187,Turf Quality,6/17/19,5,83,Dublin (PST-K15-157),Pure Seed Testing Inc.,SAB,13,7,185,2019,Jun,SAB-2019-06-17,25,4,2,"Adelphia, NJ"
187,Turf Quality,7/17/19,4,83,Dublin (PST-K15-157),Pure Seed Testing Inc.,RON,13,7,185,2019,Jul,RON-2019-07-17,22,3,2,"Adelphia, NJ"
187,Turf Quality,8/22/19,3,83,Dublin (PST-K15-157),Pure Seed Testing Inc.,SAB,13,7,185,2019,Aug,SAB-2019-08-22,26,2,2,"Adelphia, NJ"
187,Turf Quality,9/16/19,2,83,Dublin (PST-K15-157),Pure Seed Testing Inc.,RON,13,7,185,2019,Sep,RON-2019-09-16,23,9,2,"Adelphia, NJ"
187,Turf Quality,10/10/19,2,83,Dublin (PST-K15-157),Pure Seed Testing Inc.,SAB,13,7,185,2019,Oct,SAB-2019-10-10,27,8,2,"Adelphia, NJ"
187,Turf Quality,11/1/19,3,83,Dublin (PST-K15-157),Pure Seed Testing Inc.,RON,13,7,185,2019,Nov,RON-2019-11-01,24,7,2,"Adelphia, NJ"
187,Turf Quality,4/28/20,3,83,Dublin (PST-K15-157),Pure Seed Testing Inc.,WAM,13,7,185,2020,Apr,WAM-2020-04-28,31,1,3,"Adelphia, NJ"
187,Turf Quality,5/18/20,4,83,Dublin (PST-K15-157),Pure Seed Testing Inc.,SAB,13,7,185,2020,May,SAB-2020-05-18,28,6,3,"Adelphia, NJ"
187,Turf Quality,6/17/20,3,83,Dublin (PST-K15-157),Pure Seed Testing Inc.,WAM,13,7,185,2020,Jun,WAM-2020-06-17,32,4,3,"Adelphia, NJ"
187,Turf Quality,7/15/20,3,83,Dublin (PST-K15-157),Pure Seed Testing Inc.,WAM,13,7,185,2020,Jul,WAM-2020-07-15,33,3,3,"Adelphia, NJ"
187,Turf Quality,8/6/20,4,83,Dublin (PST-K15-157),Pure Seed Testing Inc.,PLV,13,7,185,2020,Aug,PLV-2020-08-06,5,2,3,"Adelphia, NJ"
187,Turf Quality,9/2/20,4,83,Dublin (PST-K15-157),Pure Seed Testing Inc.,DAS,13,7,185,2020,Sep,DAS-2020-09-02,1,9,3,"Adelphia, NJ"
187,Turf Quality,10/15/20,3,83,Dublin (PST-K15-157),Pure Seed Testing Inc.,WAM,13,7,185,2020,Oct,WAM-2020-10-15,34,8,3,"Adelphia, NJ"
187,Turf Quality,11/5/20,6,83,Dublin (PST-K15-157),Pure Seed Testing Inc.,WAM,13,7,185,2020,Nov,WAM-2020-11-05,35,7,3,"Adelphia, NJ"
187,Turf Quality,10/15/20,3,83,Dublin (PST-K15-157),Pure Seed Testing Inc.,RMD,13,7,185,2020,Oct,RMD-2020-10-15,10,8,3,"Adelphia, NJ"
187,Turf Quality,10/23/20,3,83,Dublin (PST-K15-157),Pure Seed Testing Inc.,RMD,13,7,185,2020,Oct,RMD-2020-10-23,11,8,3,"Adelphia, NJ"
187,Turf Quality,3/30/21,3,83,Dublin (PST-K15-157),Pure Seed Testing Inc.,RMD,13,7,185,2021,Mar,RMD-2021-03-30,12,5,4,"Adelphia, NJ"
187,Turf Quality,4/22/21,3,83,Dublin (PST-K15-157),Pure Seed Testing Inc.,PLV,13,7,185,2021,Apr,PLV-2021-04-22,6,1,4,"Adelphia, NJ"
187,Turf Quality,5/28/21,4,83,Dublin (PST-K15-157),Pure Seed Testing Inc.,SAB,13,7,185,2021,May,SAB-2021-05-28,29,6,4,"Adelphia, NJ"
187,Turf Quality,6/11/21,5,83,Dublin (PST-K15-157),Pure Seed Testing Inc.,JEN,13,7,185,2021,Jun,JEN-2021-06-11,2,4,4,"Adelphia, NJ"
187,Turf Quality,7/13/21,6,83,Dublin (PST-K15-157),Pure Seed Testing Inc.,PLV,13,7,185,2021,Jul,PLV-2021-07-13,7,3,4,"Adelphia, NJ"
187,Turf Quality,8/11/21,6,83,Dublin (PST-K15-157),Pure Seed Testing Inc.,JEN,13,7,185,2021,Aug,JEN-2021-08-11,3,2,4,"Adelphia, NJ"
187,Turf Quality,9/17/21,5,83,Dublin (PST-K15-157),Pure Seed Testing Inc.,JEN,13,7,185,2021,Sep,JEN-2021-09-17,4,9,4,"Adelphia, NJ"
187,Turf Quality,10/13/21,4,83,Dublin (PST-K15-157),Pure Seed Testing Inc.,SAB,13,7,185,2021,Oct,SAB-2021-10-13,30,8,4,"Adelphia, NJ"
187,Turf Quality,11/18/21,5,83,Dublin (PST-K15-157),Pure Seed Testing Inc.,WAM,13,7,185,2021,Nov,WAM-2021-11-18,36,7,4,"Adelphia, NJ"
174,Turf Quality,4/18/18,7,71,A10-280,Mountain View Seeds,RMD,12,7,173,2018,Apr,RMD-2018-04-18,8,1,1,"Adelphia, NJ"
174,Turf Quality,5/10/18,7,71,A10-280,Mountain View Seeds,RON,12,7,173,2018,May,RON-2018-05-10,13,6,1,"Adelphia, NJ"
174,Turf Quality,6/7/18,5,71,A10-280,Mountain View Seeds,RON,12,7,173,2018,Jun,RON-2018-06-07,14,4,1,"Adelphia, NJ"
174,Turf Quality,7/17/18,5,71,A10-280,Mountain View Seeds,RON,12,7,173,2018,Jul,RON-2018-07-17,15,3,1,"Adelphia, NJ"
174,Turf Quality,8/15/18,7,71,A10-280,Mountain View Seeds,RMD,12,7,173,2018,Aug,RMD-2018-08-15,9,2,1,"Adelphia, NJ"
174,Turf Quality,9/12/18,8,71,A10-280,Mountain View Seeds,RON,12,7,173,2018,Sep,RON-2018-09-12,16,9,1,"Adelphia, NJ"
174,Turf Quality,10/2/18,6,71,A10-280,Mountain View Seeds,RON,12,7,173,2018,Oct,RON-2018-10-02,17,8,1,"Adelphia, NJ"
174,Turf Quality,11/9/18,6,71,A10-280,Mountain View Seeds,RON,12,7,173,2018,Nov,RON-2018-11-09,18,7,1,"Adelphia, NJ"
174,Turf Quality,4/17/19,7,71,A10-280,Mountain View Seeds,RON,12,7,173,2019,Apr,RON-2019-04-17,19,1,2,"Adelphia, NJ"
174,Turf Quality,5/2/19,4,71,A10-280,Mountain View Seeds,RON,12,7,173,2019,May,RON-2019-05-02,20,6,2,"Adelphia, NJ"
174,Turf Quality,6/13/19,4,71,A10-280,Mountain View Seeds,RON,12,7,173,2019,Jun,RON-2019-06-13,21,4,2,"Adelphia, NJ"
174,Turf Quality,6/17/19,4,71,A10-280,Mountain View Seeds,SAB,12,7,173,2019,Jun,SAB-2019-06-17,25,4,2,"Adelphia, NJ"
174,Turf Quality,7/17/19,5,71,A10-280,Mountain View Seeds,RON,12,7,173,2019,Jul,RON-2019-07-17,22,3,2,"Adelphia, NJ"
174,Turf Quality,8/22/19,5,71,A10-280,Mountain View Seeds,SAB,12,7,173,2019,Aug,SAB-2019-08-22,26,2,2,"Adelphia, NJ"
174,Turf Quality,9/16/19,7,71,A10-280,Mountain View Seeds,RON,12,7,173,2019,Sep,RON-2019-09-16,23,9,2,"Adelphia, NJ"
174,Turf Quality,10/10/19,5,71,A10-280,Mountain View Seeds,SAB,12,7,173,2019,Oct,SAB-2019-10-10,27,8,2,"Adelphia, NJ"
174,Turf Quality,11/1/19,7,71,A10-280,Mountain View Seeds,RON,12,7,173,2019,Nov,RON-2019-11-01,24,7,2,"Adelphia, NJ"
174,Turf Quality,4/28/20,5,71,A10-280,Mountain View Seeds,WAM,12,7,173,2020,Apr,WAM-2020-04-28,31,1,3,"Adelphia, NJ"
174,Turf Quality,5/18/20,5,71,A10-280,Mountain View Seeds,SAB,12,7,173,2020,May,SAB-2020-05-18,28,6,3,"Adelphia, NJ"
174,Turf Quality,6/17/20,5,71,A10-280,Mountain View Seeds,WAM,12,7,173,2020,Jun,WAM-2020-06-17,32,4,3,"Adelphia, NJ"
174,Turf Quality,7/15/20,4,71,A10-280,Mountain View Seeds,WAM,12,7,173,2020,Jul,WAM-2020-07-15,33,3,3,"Adelphia, NJ"
174,Turf Quality,8/6/20,6,71,A10-280,Mountain View Seeds,PLV,12,7,173,2020,Aug,PLV-2020-08-06,5,2,3,"Adelphia, NJ"
174,Turf Quality,9/2/20,5,71,A10-280,Mountain View Seeds,DAS,12,7,173,2020,Sep,DAS-2020-09-02,1,9,3,"Adelphia, NJ"
174,Turf Quality,10/15/20,6,71,A10-280,Mountain View Seeds,WAM,12,7,173,2020,Oct,WAM-2020-10-15,34,8,3,"Adelphia, NJ"
174,Turf Quality,11/5/20,5,71,A10-280,Mountain View Seeds,WAM,12,7,173,2020,Nov,WAM-2020-11-05,35,7,3,"Adelphia, NJ"
174,Turf Quality,10/15/20,6,71,A10-280,Mountain View Seeds,RMD,12,7,173,2020,Oct,RMD-2020-10-15,10,8,3,"Adelphia, NJ"
174,Turf Quality,10/23/20,5,71,A10-280,Mountain View Seeds,RMD,12,7,173,2020,Oct,RMD-2020-10-23,11,8,3,"Adelphia, NJ"
174,Turf Quality,3/30/21,7,71,A10-280,Mountain View Seeds,RMD,12,7,173,2021,Mar,RMD-2021-03-30,12,5,4,"Adelphia, NJ"
174,Turf Quality,4/22/21,8,71,A10-280,Mountain View Seeds,PLV,12,7,173,2021,Apr,PLV-2021-04-22,6,1,4,"Adelphia, NJ"
174,Turf Quality,5/28/21,4,71,A10-280,Mountain View Seeds,SAB,12,7,173,2021,May,SAB-2021-05-28,29,6,4,"Adelphia, NJ"
174,Turf Quality,6/11/21,3,71,A10-280,Mountain View Seeds,JEN,12,7,173,2021,Jun,JEN-2021-06-11,2,4,4,"Adelphia, NJ"
174,Turf Quality,7/13/21,5,71,A10-280,Mountain View Seeds,PLV,12,7,173,2021,Jul,PLV-2021-07-13,7,3,4,"Adelphia, NJ"
174,Turf Quality,8/11/21,7,71,A10-280,Mountain View Seeds,JEN,12,7,173,2021,Aug,JEN-2021-08-11,3,2,4,"Adelphia, NJ"
174,Turf Quality,9/17/21,5,71,A10-280,Mountain View Seeds,JEN,12,7,173,2021,Sep,JEN-2021-09-17,4,9,4,"Adelphia, NJ"
174,Turf Quality,10/13/21,5,71,A10-280,Mountain View Seeds,SAB,12,7,173,2021,Oct,SAB-2021-10-13,30,8,4,"Adelphia, NJ"
174,Turf Quality,11/18/21,5,71,A10-280,Mountain View Seeds,WAM,12,7,173,2021,Nov,WAM-2021-11-18,36,7,4,"Adelphia, NJ"
157,Turf Quality,4/18/18,5,24,BAR PP 7K426,Barenbrug Research,RMD,11,7,156,2018,Apr,RMD-2018-04-18,8,1,1,"Adelphia, NJ"
157,Turf Quality,5/10/18,6,24,BAR PP 7K426,Barenbrug Research,RON,11,7,156,2018,May,RON-2018-05-10,13,6,1,"Adelphia, NJ"
157,Turf Quality,6/7/18,4,24,BAR PP 7K426,Barenbrug Research,RON,11,7,156,2018,Jun,RON-2018-06-07,14,4,1,"Adelphia, NJ"
157,Turf Quality,7/17/18,5,24,BAR PP 7K426,Barenbrug Research,RON,11,7,156,2018,Jul,RON-2018-07-17,15,3,1,"Adelphia, NJ"
157,Turf Quality,8/15/18,8,24,BAR PP 7K426,Barenbrug Research,RMD,11,7,156,2018,Aug,RMD-2018-08-15,9,2,1,"Adelphia, NJ"
157,Turf Quality,9/12/18,6,24,BAR PP 7K426,Barenbrug Research,RON,11,7,156,2018,Sep,RON-2018-09-12,16,9,1,"Adelphia, NJ"
157,Turf Quality,10/2/18,7,24,BAR PP 7K426,Barenbrug Research,RON,11,7,156,2018,Oct,RON-2018-10-02,17,8,1,"Adelphia, NJ"
157,Turf Quality,11/9/18,7,24,BAR PP 7K426,Barenbrug Research,RON,11,7,156,2018,Nov,RON-2018-11-09,18,7,1,"Adelphia, NJ"
157,Turf Quality,4/17/19,6,24,BAR PP 7K426,Barenbrug Research,RON,11,7,156,2019,Apr,RON-2019-04-17,19,1,2,"Adelphia, NJ"
157,Turf Quality,5/2/19,6,24,BAR PP 7K426,Barenbrug Research,RON,11,7,156,2019,May,RON-2019-05-02,20,6,2,"Adelphia, NJ"
157,Turf Quality,6/13/19,4,24,BAR PP 7K426,Barenbrug Research,RON,11,7,156,2019,Jun,RON-2019-06-13,21,4,2,"Adelphia, NJ"
157,Turf Quality,6/17/19,4,24,BAR PP 7K426,Barenbrug Research,SAB,11,7,156,2019,Jun,SAB-2019-06-17,25,4,2,"Adelphia, NJ"
157,Turf Quality,7/17/19,5,24,BAR PP 7K426,Barenbrug Research,RON,11,7,156,2019,Jul,RON-2019-07-17,22,3,2,"Adelphia, NJ"
157,Turf Quality,8/22/19,6,24,BAR PP 7K426,Barenbrug Research,SAB,11,7,156,2019,Aug,SAB-2019-08-22,26,2,2,"Adelphia, NJ"
157,Turf Quality,9/16/19,5,24,BAR PP 7K426,Barenbrug Research,RON,11,7,156,2019,Sep,RON-2019-09-16,23,9,2,"Adelphia, NJ"
157,Turf Quality,10/10/19,4,24,BAR PP 7K426,Barenbrug Research,SAB,11,7,156,2019,Oct,SAB-2019-10-10,27,8,2,"Adelphia, NJ"
157,Turf Quality,11/1/19,6,24,BAR PP 7K426,Barenbrug Research,RON,11,7,156,2019,Nov,RON-2019-11-01,24,7,2,"Adelphia, NJ"
157,Turf Quality,4/28/20,7,24,BAR PP 7K426,Barenbrug Research,WAM,11,7,156,2020,Apr,WAM-2020-04-28,31,1,3,"Adelphia, NJ"
157,Turf Quality,5/18/20,7,24,BAR PP 7K426,Barenbrug Research,SAB,11,7,156,2020,May,SAB-2020-05-18,28,6,3,"Adelphia, NJ"
157,Turf Quality,6/17/20,4,24,BAR PP 7K426,Barenbrug Research,WAM,11,7,156,2020,Jun,WAM-2020-06-17,32,4,3,"Adelphia, NJ"
157,Turf Quality,7/15/20,4,24,BAR PP 7K426,Barenbrug Research,WAM,11,7,156,2020,Jul,WAM-2020-07-15,33,3,3,"Adelphia, NJ"
157,Turf Quality,8/6/20,6,24,BAR PP 7K426,Barenbrug Research,PLV,11,7,156,2020,Aug,PLV-2020-08-06,5,2,3,"Adelphia, NJ"
157,Turf Quality,9/2/20,5,24,BAR PP 7K426,Barenbrug Research,DAS,11,7,156,2020,Sep,DAS-2020-09-02,1,9,3,"Adelphia, NJ"
157,Turf Quality,10/15/20,3,24,BAR PP 7K426,Barenbrug Research,WAM,11,7,156,2020,Oct,WAM-2020-10-15,34,8,3,"Adelphia, NJ"
157,Turf Quality,11/5/20,5,24,BAR PP 7K426,Barenbrug Research,WAM,11,7,156,2020,Nov,WAM-2020-11-05,35,7,3,"Adelphia, NJ"
157,Turf Quality,10/15/20,4,24,BAR PP 7K426,Barenbrug Research,RMD,11,7,156,2020,Oct,RMD-2020-10-15,10,8,3,"Adelphia, NJ"
157,Turf Quality,10/23/20,4,24,BAR PP 7K426,Barenbrug Research,RMD,11,7,156,2020,Oct,RMD-2020-10-23,11,8,3,"Adelphia, NJ"
157,Turf Quality,3/30/21,4,24,BAR PP 7K426,Barenbrug Research,RMD,11,7,156,2021,Mar,RMD-2021-03-30,12,5,4,"Adelphia, NJ"
157,Turf Quality,4/22/21,6,24,BAR PP 7K426,Barenbrug Research,PLV,11,7,156,2021,Apr,PLV-2021-04-22,6,1,4,"Adelphia, NJ"
157,Turf Quality,5/28/21,5,24,BAR PP 7K426,Barenbrug Research,SAB,11,7,156,2021,May,SAB-2021-05-28,29,6,4,"Adelphia, NJ"
157,Turf Quality,6/11/21,3,24,BAR PP 7K426,Barenbrug Research,JEN,11,7,156,2021,Jun,JEN-2021-06-11,2,4,4,"Adelphia, NJ"
157,Turf Quality,7/13/21,5,24,BAR PP 7K426,Barenbrug Research,PLV,11,7,156,2021,Jul,PLV-2021-07-13,7,3,4,"Adelphia, NJ"
157,Turf Quality,8/11/21,7,24,BAR PP 7K426,Barenbrug Research,JEN,11,7,156,2021,Aug,JEN-2021-08-11,3,2,4,"Adelphia, NJ"
157,Turf Quality,9/17/21,6,24,BAR PP 7K426,Barenbrug Research,JEN,11,7,156,2021,Sep,JEN-2021-09-17,4,9,4,"Adelphia, NJ"
157,Turf Quality,10/13/21,6,24,BAR PP 7K426,Barenbrug Research,SAB,11,7,156,2021,Oct,SAB-2021-10-13,30,8,4,"Adelphia, NJ"
157,Turf Quality,11/18/21,7,24,BAR PP 7K426,Barenbrug Research,WAM,11,7,156,2021,Nov,WAM-2021-11-18,36,7,4,"Adelphia, NJ"
144,Turf Quality,4/18/18,3,18,J-2726,Jacklin Seed by Simplot,RMD,10,7,143,2018,Apr,RMD-2018-04-18,8,1,1,"Adelphia, NJ"
144,Turf Quality,5/10/18,4,18,J-2726,Jacklin Seed by Simplot,RON,10,7,143,2018,May,RON-2018-05-10,13,6,1,"Adelphia, NJ"
144,Turf Quality,6/7/18,8,18,J-2726,Jacklin Seed by Simplot,RON,10,7,143,2018,Jun,RON-2018-06-07,14,4,1,"Adelphia, NJ"
144,Turf Quality,7/17/18,6,18,J-2726,Jacklin Seed by Simplot,RON,10,7,143,2018,Jul,RON-2018-07-17,15,3,1,"Adelphia, NJ"
144,Turf Quality,8/15/18,7,18,J-2726,Jacklin Seed by Simplot,RMD,10,7,143,2018,Aug,RMD-2018-08-15,9,2,1,"Adelphia, NJ"
144,Turf Quality,9/12/18,6,18,J-2726,Jacklin Seed by Simplot,RON,10,7,143,2018,Sep,RON-2018-09-12,16,9,1,"Adelphia, NJ"
144,Turf Quality,10/2/18,5,18,J-2726,Jacklin Seed by Simplot,RON,10,7,143,2018,Oct,RON-2018-10-02,17,8,1,"Adelphia, NJ"
144,Turf Quality,11/9/18,5,18,J-2726,Jacklin Seed by Simplot,RON,10,7,143,2018,Nov,RON-2018-11-09,18,7,1,"Adelphia, NJ"
144,Turf Quality,4/17/19,5,18,J-2726,Jacklin Seed by Simplot,RON,10,7,143,2019,Apr,RON-2019-04-17,19,1,2,"Adelphia, NJ"
144,Turf Quality,5/2/19,6,18,J-2726,Jacklin Seed by Simplot,RON,10,7,143,2019,May,RON-2019-05-02,20,6,2,"Adelphia, NJ"
144,Turf Quality,6/13/19,6,18,J-2726,Jacklin Seed by Simplot,RON,10,7,143,2019,Jun,RON-2019-06-13,21,4,2,"Adelphia, NJ"
144,Turf Quality,6/17/19,7,18,J-2726,Jacklin Seed by Simplot,SAB,10,7,143,2019,Jun,SAB-2019-06-17,25,4,2,"Adelphia, NJ"
144,Turf Quality,7/17/19,7,18,J-2726,Jacklin Seed by Simplot,RON,10,7,143,2019,Jul,RON-2019-07-17,22,3,2,"Adelphia, NJ"
144,Turf Quality,8/22/19,4,18,J-2726,Jacklin Seed by Simplot,SAB,10,7,143,2019,Aug,SAB-2019-08-22,26,2,2,"Adelphia, NJ"
144,Turf Quality,9/16/19,4,18,J-2726,Jacklin Seed by Simplot,RON,10,7,143,2019,Sep,RON-2019-09-16,23,9,2,"Adelphia, NJ"
144,Turf Quality,10/10/19,4,18,J-2726,Jacklin Seed by Simplot,SAB,10,7,143,2019,Oct,SAB-2019-10-10,27,8,2,"Adelphia, NJ"
144,Turf Quality,11/1/19,4,18,J-2726,Jacklin Seed by Simplot,RON,10,7,143,2019,Nov,RON-2019-11-01,24,7,2,"Adelphia, NJ"
144,Turf Quality,4/28/20,5,18,J-2726,Jacklin Seed by Simplot,WAM,10,7,143,2020,Apr,WAM-2020-04-28,31,1,3,"Adelphia, NJ"
144,Turf Quality,5/18/20,5,18,J-2726,Jacklin Seed by Simplot,SAB,10,7,143,2020,May,SAB-2020-05-18,28,6,3,"Adelphia, NJ"
144,Turf Quality,6/17/20,7,18,J-2726,Jacklin Seed by Simplot,WAM,10,7,143,2020,Jun,WAM-2020-06-17,32,4,3,"Adelphia, NJ"
144,Turf Quality,7/15/20,6,18,J-2726,Jacklin Seed by Simplot,WAM,10,7,143,2020,Jul,WAM-2020-07-15,33,3,3,"Adelphia, NJ"
144,Turf Quality,8/6/20,6,18,J-2726,Jacklin Seed by Simplot,PLV,10,7,143,2020,Aug,PLV-2020-08-06,5,2,3,"Adelphia, NJ"
144,Turf Quality,9/2/20,4,18,J-2726,Jacklin Seed by Simplot,DAS,10,7,143,2020,Sep,DAS-2020-09-02,1,9,3,"Adelphia, NJ"
144,Turf Quality,10/15/20,3,18,J-2726,Jacklin Seed by Simplot,WAM,10,7,143,2020,Oct,WAM-2020-10-15,34,8,3,"Adelphia, NJ"
144,Turf Quality,11/5/20,4,18,J-2726,Jacklin Seed by Simplot,WAM,10,7,143,2020,Nov,WAM-2020-11-05,35,7,3,"Adelphia, NJ"
144,Turf Quality,10/15/20,3,18,J-2726,Jacklin Seed by Simplot,RMD,10,7,143,2020,Oct,RMD-2020-10-15,10,8,3,"Adelphia, NJ"
144,Turf Quality,10/23/20,3,18,J-2726,Jacklin Seed by Simplot,RMD,10,7,143,2020,Oct,RMD-2020-10-23,11,8,3,"Adelphia, NJ"
144,Turf Quality,3/30/21,3,18,J-2726,Jacklin Seed by Simplot,RMD,10,7,143,2021,Mar,RMD-2021-03-30,12,5,4,"Adelphia, NJ"
144,Turf Quality,4/22/21,5,18,J-2726,Jacklin Seed by Simplot,PLV,10,7,143,2021,Apr,PLV-2021-04-22,6,1,4,"Adelphia, NJ"
144,Turf Quality,5/28/21,4,18,J-2726,Jacklin Seed by Simplot,SAB,10,7,143,2021,May,SAB-2021-05-28,29,6,4,"Adelphia, NJ"
144,Turf Quality,6/11/21,7,18,J-2726,Jacklin Seed by Simplot,JEN,10,7,143,2021,Jun,JEN-2021-06-11,2,4,4,"Adelphia, NJ"
144,Turf Quality,7/13/21,6,18,J-2726,Jacklin Seed by Simplot,PLV,10,7,143,2021,Jul,PLV-2021-07-13,7,3,4,"Adelphia, NJ"
144,Turf Quality,8/11/21,4,18,J-2726,Jacklin Seed by Simplot,JEN,10,7,143,2021,Aug,JEN-2021-08-11,3,2,4,"Adelphia, NJ"
144,Turf Quality,9/17/21,3,18,J-2726,Jacklin Seed by Simplot,JEN,10,7,143,2021,Sep,JEN-2021-09-17,4,9,4,"Adelphia, NJ"
144,Turf Quality,10/13/21,3,18,J-2726,Jacklin Seed by Simplot,SAB,10,7,143,2021,Oct,SAB-2021-10-13,30,8,4,"Adelphia, NJ"
144,Turf Quality,11/18/21,7,18,J-2726,Jacklin Seed by Simplot,WAM,10,7,143,2021,Nov,WAM-2021-11-18,36,7,4,"Adelphia, NJ"
127,Turf Quality,4/18/18,6,76,A16-17,Peak Plant Genetics,RMD,9,7,126,2018,Apr,RMD-2018-04-18,8,1,1,"Adelphia, NJ"
127,Turf Quality,5/10/18,7,76,A16-17,Peak Plant Genetics,RON,9,7,126,2018,May,RON-2018-05-10,13,6,1,"Adelphia, NJ"
127,Turf Quality,6/7/18,4,76,A16-17,Peak Plant Genetics,RON,9,7,126,2018,Jun,RON-2018-06-07,14,4,1,"Adelphia, NJ"
127,Turf Quality,7/17/18,7,76,A16-17,Peak Plant Genetics,RON,9,7,126,2018,Jul,RON-2018-07-17,15,3,1,"Adelphia, NJ"
127,Turf Quality,8/15/18,9,76,A16-17,Peak Plant Genetics,RMD,9,7,126,2018,Aug,RMD-2018-08-15,9,2,1,"Adelphia, NJ"
127,Turf Quality,9/12/18,7,76,A16-17,Peak Plant Genetics,RON,9,7,126,2018,Sep,RON-2018-09-12,16,9,1,"Adelphia, NJ"
127,Turf Quality,10/2/18,7,76,A16-17,Peak Plant Genetics,RON,9,7,126,2018,Oct,RON-2018-10-02,17,8,1,"Adelphia, NJ"
127,Turf Quality,11/9/18,7,76,A16-17,Peak Plant Genetics,RON,9,7,126,2018,Nov,RON-2018-11-09,18,7,1,"Adelphia, NJ"
127,Turf Quality,4/17/19,9,76,A16-17,Peak Plant Genetics,RON,9,7,126,2019,Apr,RON-2019-04-17,19,1,2,"Adelphia, NJ"
127,Turf Quality,5/2/19,7,76,A16-17,Peak Plant Genetics,RON,9,7,126,2019,May,RON-2019-05-02,20,6,2,"Adelphia, NJ"
127,Turf Quality,6/13/19,7,76,A16-17,Peak Plant Genetics,RON,9,7,126,2019,Jun,RON-2019-06-13,21,4,2,"Adelphia, NJ"
127,Turf Quality,6/17/19,8,76,A16-17,Peak Plant Genetics,SAB,9,7,126,2019,Jun,SAB-2019-06-17,25,4,2,"Adelphia, NJ"
127,Turf Quality,7/17/19,7,76,A16-17,Peak Plant Genetics,RON,9,7,126,2019,Jul,RON-2019-07-17,22,3,2,"Adelphia, NJ"
127,Turf Quality,8/22/19,8,76,A16-17,Peak Plant Genetics,SAB,9,7,126,2019,Aug,SAB-2019-08-22,26,2,2,"Adelphia, NJ"
127,Turf Quality,9/16/19,8,76,A16-17,Peak Plant Genetics,RON,9,7,126,2019,Sep,RON-2019-09-16,23,9,2,"Adelphia, NJ"
127,Turf Quality,10/10/19,7,76,A16-17,Peak Plant Genetics,SAB,9,7,126,2019,Oct,SAB-2019-10-10,27,8,2,"Adelphia, NJ"
127,Turf Quality,11/1/19,7,76,A16-17,Peak Plant Genetics,RON,9,7,126,2019,Nov,RON-2019-11-01,24,7,2,"Adelphia, NJ"
127,Turf Quality,4/28/20,7,76,A16-17,Peak Plant Genetics,WAM,9,7,126,2020,Apr,WAM-2020-04-28,31,1,3,"Adelphia, NJ"
127,Turf Quality,5/18/20,7,76,A16-17,Peak Plant Genetics,SAB,9,7,126,2020,May,SAB-2020-05-18,28,6,3,"Adelphia, NJ"
127,Turf Quality,6/17/20,6,76,A16-17,Peak Plant Genetics,WAM,9,7,126,2020,Jun,WAM-2020-06-17,32,4,3,"Adelphia, NJ"
127,Turf Quality,7/15/20,7,76,A16-17,Peak Plant Genetics,WAM,9,7,126,2020,Jul,WAM-2020-07-15,33,3,3,"Adelphia, NJ"
127,Turf Quality,8/6/20,7,76,A16-17,Peak Plant Genetics,PLV,9,7,126,2020,Aug,PLV-2020-08-06,5,2,3,"Adelphia, NJ"
127,Turf Quality,9/2/20,8,76,A16-17,Peak Plant Genetics,DAS,9,7,126,2020,Sep,DAS-2020-09-02,1,9,3,"Adelphia, NJ"
127,Turf Quality,10/15/20,8,76,A16-17,Peak Plant Genetics,WAM,9,7,126,2020,Oct,WAM-2020-10-15,34,8,3,"Adelphia, NJ"
127,Turf Quality,11/5/20,8,76,A16-17,Peak Plant Genetics,WAM,9,7,126,2020,Nov,WAM-2020-11-05,35,7,3,"Adelphia, NJ"
127,Turf Quality,10/15/20,9,76,A16-17,Peak Plant Genetics,RMD,9,7,126,2020,Oct,RMD-2020-10-15,10,8,3,"Adelphia, NJ"
127,Turf Quality,10/23/20,8,76,A16-17,Peak Plant Genetics,RMD,9,7,126,2020,Oct,RMD-2020-10-23,11,8,3,"Adelphia, NJ"
127,Turf Quality,3/30/21,9,76,A16-17,Peak Plant Genetics,RMD,9,7,126,2021,Mar,RMD-2021-03-30,12,5,4,"Adelphia, NJ"
127,Turf Quality,4/22/21,8,76,A16-17,Peak Plant Genetics,PLV,9,7,126,2021,Apr,PLV-2021-04-22,6,1,4,"Adelphia, NJ"
127,Turf Quality,5/28/21,7,76,A16-17,Peak Plant Genetics,SAB,9,7,126,2021,May,SAB-2021-05-28,29,6,4,"Adelphia, NJ"
127,Turf Quality,6/11/21,5,76,A16-17,Peak Plant Genetics,JEN,9,7,126,2021,Jun,JEN-2021-06-11,2,4,4,"Adelphia, NJ"
127,Turf Quality,7/13/21,7,76,A16-17,Peak Plant Genetics,PLV,9,7,126,2021,Jul,PLV-2021-07-13,7,3,4,"Adelphia, NJ"
127,Turf Quality,8/11/21,6,76,A16-17,Peak Plant Genetics,JEN,9,7,126,2021,Aug,JEN-2021-08-11,3,2,4,"Adelphia, NJ"
127,Turf Quality,9/17/21,8,76,A16-17,Peak Plant Genetics,JEN,9,7,126,2021,Sep,JEN-2021-09-17,4,9,4,"Adelphia, NJ"
127,Turf Quality,10/13/21,8,76,A16-17,Peak Plant Genetics,SAB,9,7,126,2021,Oct,SAB-2021-10-13,30,8,4,"Adelphia, NJ"
127,Turf Quality,11/18/21,7,76,A16-17,Peak Plant Genetics,WAM,9,7,126,2021,Nov,WAM-2021-11-18,36,7,4,"Adelphia, NJ"
114,Turf Quality,4/18/18,7,72,Shamrock,Standard,RMD,8,7,113,2018,Apr,RMD-2018-04-18,8,1,1,"Adelphia, NJ"
114,Turf Quality,5/10/18,8,72,Shamrock,Standard,RON,8,7,113,2018,May,RON-2018-05-10,13,6,1,"Adelphia, NJ"
114,Turf Quality,6/7/18,7,72,Shamrock,Standard,RON,8,7,113,2018,Jun,RON-2018-06-07,14,4,1,"Adelphia, NJ"
114,Turf Quality,7/17/18,5,72,Shamrock,Standard,RON,8,7,113,2018,Jul,RON-2018-07-17,15,3,1,"Adelphia, NJ"
114,Turf Quality,8/15/18,4,72,Shamrock,Standard,RMD,8,7,113,2018,Aug,RMD-2018-08-15,9,2,1,"Adelphia, NJ"
114,Turf Quality,9/12/18,3,72,Shamrock,Standard,RON,8,7,113,2018,Sep,RON-2018-09-12,16,9,1,"Adelphia, NJ"
